"Rhode Island","2010","335931","Current-carrying wiring device manufacturing","4","0","0","44",
"Rhode Island","2010","335932","Noncurrent-carrying wiring device manufacturing","1","0","0","44",
"Rhode Island","2010","33599 ","All other electrical equipment and component manufacturing","7","530","39597","44",
"Rhode Island","2010","335999","All other miscellaneous electrical equipment and component manufacturing","7","530","39597","44",
"Rhode Island","2010","336   ","Transportation equipment manufacturing","43","1336","55164","44",
"Rhode Island","2010","3362  ","Motor vehicle body and trailer manufacturing","3","62","2252","44",
"Rhode Island","2010","33621 ","Motor vehicle body and trailer manufacturing","3","62","2252","44",
"Rhode Island","2010","336211","Motor vehicle body manufacturing","3","62","2252","44",
"Rhode Island","2010","3363  ","Motor vehicle parts manufacturing","8","0","0","44",
"Rhode Island","2010","33631 ","Motor vehicle gasoline engine and engine parts manufacturing","1","0","0","44",
"Rhode Island","2010","336312","Gasoline engine and engine parts manufacturing","1","0","0","44",
"Rhode Island","2010","33632 ","Motor vehicle electrical and electronic equipment manufacturing","4","0","0","44",
"Rhode Island","2010","336322","Other motor vehicle electrical and electronic equipment manufacturing","4","0","0","44",
"Rhode Island","2010","33636 ","Motor vehicle seating and interior trim manufacturing","1","0","0","44",
"Rhode Island","2010","336360","Motor vehicle seating and interior trim manufacturing","1","0","0","44",
"Rhode Island","2010","33637 ","Motor vehicle metal stamping","1","0","0","44",
"Rhode Island","2010","336370","Motor vehicle metal stamping","1","0","0","44",
"Rhode Island","2010","33639 ","Other motor vehicle parts manufacturing","1","0","0","44",
"Rhode Island","2010","336399","All other motor vehicle parts manufacturing","1","0","0","44",
"Rhode Island","2010","3364  ","Aerospace product and parts manufacturing","1","0","0","44",
"Rhode Island","2010","33641 ","Aerospace product and parts manufacturing","1","0","0","44",
"Rhode Island","2010","336411","Aircraft manufacturing","1","0","0","44",
"Rhode Island","2010","3366  ","Ship and boat building","29","954","40004","44",
"Rhode Island","2010","33661 ","Ship and boat building","29","954","40004","44",
"Rhode Island","2010","336611","Ship building and repairing","6","481","22306","44",
"Rhode Island","2010","336612","Boat building","23","473","17698","44",
"Rhode Island","2010","3369  ","Other transportation equipment manufacturing","2","0","0","44",
"Rhode Island","2010","33699 ","Other transportation equipment manufacturing","2","0","0","44",
"Rhode Island","2010","336991","Motorcycle, bicycle, and parts manufacturing","2","0","0","44",
"Rhode Island","2010","337   ","Furniture and related product manufacturing","57","1398","60116","44",
"Rhode Island","2010","3371  ","Household and institutional furniture and kitchen cabinet manufacturing","27","0","7414","44",
"Rhode Island","2010","33711 ","Wood kitchen cabinet and countertop manufacturing","16","0","0","44",
"Rhode Island","2010","337110","Wood kitchen cabinet and countertop manufacturing","16","0","0","44",
"Rhode Island","2010","33712 ","Household and institutional furniture manufacturing","11","0","4608","44",
"Rhode Island","2010","337121","Upholstered household furniture manufacturing","3","0","0","44",
"Rhode Island","2010","337122","Nonupholstered wood household furniture manufacturing","5","19","464","44",
"Rhode Island","2010","337124","Metal household furniture manufacturing","1","0","0","44",
"Rhode Island","2010","337127","Institutional furniture manufacturing","1","0","0","44",
"Rhode Island","2010","337129","Wood television, radio, and sewing machine cabinet manufacturing","1","0","0","44",
"Rhode Island","2010","3372  ","Office furniture (including fixtures) manufacturing","29","834","35644","44",
"Rhode Island","2010","33721 ","Office furniture (including fixtures) manufacturing","29","834","35644","44",
"Rhode Island","2010","337211","Wood office furniture manufacturing","3","0","0","44",
"Rhode Island","2010","337212","Custom architectural woodwork and millwork manufacturing","17","591","24894","44",
"Rhode Island","2010","337215","Showcase, partition, shelving, and locker manufacturing","9","202","8672","44",
"Rhode Island","2010","3379  ","Other furniture related product manufacturing","1","0","0","44",
"Rhode Island","2010","33792 ","Blind and shade manufacturing","1","0","0","44",
"Rhode Island","2010","337920","Blind and shade manufacturing","1","0","0","44",
"Rhode Island","2010","339   ","Miscellaneous manufacturing","311","7963","360458","44",
"Rhode Island","2010","3391  ","Medical equipment and supplies manufacturing","58","2070","131620","44",
"Rhode Island","2010","33911 ","Medical equipment and supplies manufacturing","58","2070","131620","44",
"Rhode Island","2010","339112","Surgical and medical instrument manufacturing","7","909","74240","44",
"Rhode Island","2010","339113","Surgical appliance and supplies manufacturing","17","0","0","44",
"Rhode Island","2010","339114","Dental equipment and supplies manufacturing","3","0","0","44",
"Rhode Island","2010","339115","Ophthalmic goods manufacturing","5","199","4972","44",
"Rhode Island","2010","339116","Dental laboratories","26","110","3594","44",
"Rhode Island","2010","3399  ","Other miscellaneous manufacturing","253","5893","228838","44",
"Rhode Island","2010","33991 ","Jewelry and silverware manufacturing","171","4264","156290","44",
"Rhode Island","2010","339911","Jewelry (except costume) manufacturing","50","2318","80599","44",
"Rhode Island","2010","339912","Silverware and hollowware manufacturing","1","0","0","44",
"Rhode Island","2010","339913","Jewelers' material and lapidary work manufacturing","28","621","19599","44",
"Rhode Island","2010","339914","Costume jewelry and novelty manufacturing","92","1320","55968","44",
"Rhode Island","2010","33992 ","Sporting and athletic goods manufacturing","6","0","2139","44",
"Rhode Island","2010","339920","Sporting and athletic goods manufacturing","6","0","2139","44",
"Rhode Island","2010","33993 ","Doll, toy, and game manufacturing","4","101","4082","44",
"Rhode Island","2010","339932","Game, toy, and children's vehicle manufacturing","4","101","4082","44",
"Rhode Island","2010","33994 ","Office supplies (except paper) manufacturing","3","32","982","44",
"Rhode Island","2010","339941","Pen and mechanical pencil manufacturing","1","0","0","44",
"Rhode Island","2010","339943","Marking device manufacturing","2","0","0","44",
"Rhode Island","2010","33995 ","Sign manufacturing","24","593","21761","44",
"Rhode Island","2010","339950","Sign manufacturing","24","593","21761","44",
"Rhode Island","2010","33999 ","All other miscellaneous manufacturing","45","832","43584","44",
"Rhode Island","2010","339991","Gasket, packing, and sealing device manufacturing","6","382","26047","44",
"Rhode Island","2010","339992","Musical instrument manufacturing","1","0","0","44",
"Rhode Island","2010","339993","Fastener, button, needle, and pin manufacturing","8","219","7843","44",
"Rhode Island","2010","339994","Broom, brush, and mop manufacturing","1","0","0","44",
"Rhode Island","2010","339995","Burial casket manufacturing","2","0","0","44",
"Rhode Island","2010","339999","All other miscellaneous manufacturing","27","223","9469","44",
"Rhode Island","2010","42    ","Wholesale trade","1409","18239","1061617","44",
"Rhode Island","2010","423   ","Merchant wholesalers, durable goods","825","11885","726395","44",
"Rhode Island","2010","4231  ","Motor vehicle and motor vehicle parts and supplies merchant wholesalers","93","929","33703","44",
"Rhode Island","2010","42311 ","Automobile and other motor vehicle merchant wholesalers","26","222","7680","44",
"Rhode Island","2010","423110","Automobile and other motor vehicle merchant wholesalers","26","222","7680","44",
"Rhode Island","2010","42312 ","Motor vehicle supplies and new parts merchant wholesalers","54","513","17948","44",
"Rhode Island","2010","423120","Motor vehicle supplies and new parts merchant wholesalers","54","513","17948","44",
"Rhode Island","2010","42313 ","Tire and tube merchant wholesalers","2","0","0","44",
"Rhode Island","2010","423130","Tire and tube merchant wholesalers","2","0","0","44",
"Rhode Island","2010","42314 ","Motor vehicle parts (used) merchant wholesalers","11","166","6788","44",
"Rhode Island","2010","423140","Motor vehicle parts (used) merchant wholesalers","11","166","6788","44",
"Rhode Island","2010","4232  ","Furniture and home furnishing merchant wholesalers","39","477","24427","44",
"Rhode Island","2010","42321 ","Furniture merchant wholesalers","11","114","3651","44",
"Rhode Island","2010","423210","Furniture merchant wholesalers","11","114","3651","44",
"Rhode Island","2010","42322 ","Home furnishing merchant wholesalers","28","363","20776","44",
"Rhode Island","2010","423220","Home furnishing merchant wholesalers","28","363","20776","44",
"Rhode Island","2010","4233  ","Lumber and other construction materials merchant wholesalers","51","486","23779","44",
"Rhode Island","2010","42331 ","Lumber, plywood, millwork, and wood panel merchant wholesalers","18","260","12258","44",
"Rhode Island","2010","423310","Lumber, plywood, millwork, and wood panel merchant wholesalers","18","260","12258","44",
"Rhode Island","2010","42332 ","Brick, stone, and related construction material merchant wholesalers","10","0","2567","44",
"Rhode Island","2010","423320","Brick, stone, and related construction material merchant wholesalers","10","0","2567","44",
"Rhode Island","2010","42333 ","Roofing, siding, and insulation material merchant wholesalers","12","139","6955","44",
"Rhode Island","2010","423330","Roofing, siding, and insulation material merchant wholesalers","12","139","6955","44",
"Rhode Island","2010","42339 ","Other construction material merchant wholesalers","11","0","0","44",
"Rhode Island","2010","423390","Other construction material merchant wholesalers","11","0","0","44",
"Rhode Island","2010","4234  ","Professional and commercial equipment and supplies merchant wholesalers","128","3704","276803","44",
"Rhode Island","2010","42341 ","Photographic equipment and supplies merchant wholesalers","5","35","4524","44",
"Rhode Island","2010","423410","Photographic equipment and supplies merchant wholesalers","5","35","4524","44",
"Rhode Island","2010","42342 ","Office equipment merchant wholesalers","28","319","17397","44",
"Rhode Island","2010","423420","Office equipment merchant wholesalers","28","319","17397","44",
"Rhode Island","2010","42343 ","Computer and computer peripheral equipment and software merchant wholesalers","32","0","0","44",
"Rhode Island","2010","423430","Computer and computer peripheral equipment and software merchant wholesalers","32","0","0","44",
"Rhode Island","2010","42344 ","Other commercial equipment merchant wholesalers","18","233","10795","44",
"Rhode Island","2010","423440","Other commercial equipment merchant wholesalers","18","233","10795","44",
"Rhode Island","2010","42345 ","Medical, dental, and hospital equipment and supplies merchant wholesalers","27","671","42728","44",
"Rhode Island","2010","423450","Medical, dental, and hospital equipment and supplies merchant wholesalers","27","671","42728","44",
"Rhode Island","2010","42346 ","Ophthalmic goods merchant wholesalers","7","0","0","44",
"Rhode Island","2010","423460","Ophthalmic goods merchant wholesalers","7","0","0","44",
"Rhode Island","2010","42349 ","Other professional equipment and supplies merchant wholesalers","11","75","3483","44",
"Rhode Island","2010","423490","Other professional equipment and supplies merchant wholesalers","11","75","3483","44",
"Rhode Island","2010","4235  ","Metal and mineral (except petroleum) merchant wholesalers","33","948","41419","44",
"Rhode Island","2010","42351 ","Metal service centers and other metal merchant wholesalers","33","948","41419","44",
"Rhode Island","2010","423510","Metal service centers and other metal merchant wholesalers","33","948","41419","44",
"Rhode Island","2010","4236  ","Electrical and electronic goods merchant wholesalers","74","696","46954","44",
"Rhode Island","2010","42361 ","Electrical apparatus and equipment, wiring supplies, and related equipment merchant wholesalers","37","359","20580","44",
"Rhode Island","2010","423610","Electrical apparatus and equipment, wiring supplies, and related equipment merchant wholesalers","37","359","20580","44",
"Rhode Island","2010","42362 ","Electrical and electronic appliance, television, and radio set merchant wholesalers","5","0","0","44",
"Rhode Island","2010","423620","Electrical and electronic appliance, television, and radio set merchant wholesalers","5","0","0","44",
"Rhode Island","2010","42369 ","Other electronic parts and equipment merchant wholesalers","32","294","23164","44",
"Rhode Island","2010","423690","Other electronic parts and equipment merchant wholesalers","32","294","23164","44",
"Rhode Island","2010","4237  ","Hardware, plumbing and heating equipment and supplies merchant wholesalers","60","409","21059","44",
"Rhode Island","2010","42371 ","Hardware merchant wholesalers","17","96","4532","44",
"Rhode Island","2010","423710","Hardware merchant wholesalers","17","96","4532","44",
"Rhode Island","2010","42372 ","Plumbing and heating equipment and supplies (hydronics) merchant wholesalers","25","225","11670","44",
"Rhode Island","2010","423720","Plumbing and heating equipment and supplies (hydronics) merchant wholesalers","25","225","11670","44",
"Rhode Island","2010","42373 ","Warm air heating and air-conditioning equipment and supplies merchant wholesalers","14","68","4100","44",
"Rhode Island","2010","423730","Warm air heating and air-conditioning equipment and supplies merchant wholesalers","14","68","4100","44",
"Rhode Island","2010","42374 ","Refrigeration equipment and supplies merchant wholesalers","4","0","0","44",
"Rhode Island","2010","423740","Refrigeration equipment and supplies merchant wholesalers","4","0","0","44",
"Rhode Island","2010","4238  ","Machinery, equipment, and supplies merchant wholesalers","161","1176","67660","44",
"Rhode Island","2010","42381 ","Construction and mining (except oil well) machinery and equipment merchant wholesalers","14","104","5183","44",
"Rhode Island","2010","423810","Construction and mining (except oil well) machinery and equipment merchant wholesalers","14","104","5183","44",
"Rhode Island","2010","42382 ","Farm and garden machinery and equipment merchant wholesalers","4","0","0","44",
"Rhode Island","2010","423820","Farm and garden machinery and equipment merchant wholesalers","4","0","0","44",
"Rhode Island","2010","42383 ","Industrial machinery and equipment merchant wholesalers","75","680","41540","44",
"Rhode Island","2010","423830","Industrial machinery and equipment merchant wholesalers","75","680","41540","44",
"Rhode Island","2010","42384 ","Industrial supplies merchant wholesalers","30","0","13124","44",
"Rhode Island","2010","423840","Industrial supplies merchant wholesalers","30","0","13124","44",
"Rhode Island","2010","42385 ","Service establishment equipment and supplies merchant wholesalers","29","169","6825","44",
"Rhode Island","2010","423850","Service establishment equipment and supplies merchant wholesalers","29","169","6825","44",
"Rhode Island","2010","42386 ","Transportation equipment and supplies (except motor vehicle) merchant wholesalers","9","25","904","44",
"Rhode Island","2010","423860","Transportation equipment and supplies (except motor vehicle) merchant wholesalers","9","25","904","44",
"Rhode Island","2010","4239  ","Miscellaneous durable goods merchant wholesalers","186","3060","190591","44",
"Rhode Island","2010","42391 ","Sporting and recreational goods and supplies merchant wholesalers","21","156","12771","44",
"Rhode Island","2010","423910","Sporting and recreational goods and supplies merchant wholesalers","21","156","12771","44",
"Rhode Island","2010","42392 ","Toy and hobby goods and supplies merchant wholesalers","7","0","1510","44",
"Rhode Island","2010","423920","Toy and hobby goods and supplies merchant wholesalers","7","0","1510","44",
"Rhode Island","2010","42393 ","Recyclable material merchant wholesalers","32","531","21754","44",
"Rhode Island","2010","423930","Recyclable material merchant wholesalers","32","531","21754","44",
"Rhode Island","2010","42394 ","Jewelry, watch, precious stone, and precious metal merchant wholesalers","89","1520","97933","44",
"Rhode Island","2010","423940","Jewelry, watch, precious stone, and precious metal merchant wholesalers","89","1520","97933","44",
"Rhode Island","2010","42399 ","Other miscellaneous durable goods merchant wholesalers","37","818","56623","44",
"Rhode Island","2010","423990","Other miscellaneous durable goods merchant wholesalers","37","818","56623","44",
"Rhode Island","2010","424   ","Merchant wholesalers, nondurable goods","408","5595","283694","44",
"Rhode Island","2010","4241  ","Paper and paper product merchant wholesalers","40","552","31605","44",
"Rhode Island","2010","42411 ","Printing and writing paper merchant wholesalers","3","0","0","44",
"Rhode Island","2010","424110","Printing and writing paper merchant wholesalers","3","0","0","44",
"Rhode Island","2010","42412 ","Stationery and office supplies merchant wholesalers","20","420","25285","44",
"Rhode Island","2010","424120","Stationery and office supplies merchant wholesalers","20","420","25285","44",
"Rhode Island","2010","42413 ","Industrial and personal service paper merchant wholesalers","17","110","5457","44",
"Rhode Island","2010","424130","Industrial and personal service paper merchant wholesalers","17","110","5457","44",
"Rhode Island","2010","4242  ","Drugs and druggists' sundries merchant wholesalers","35","359","25315","44",
"Rhode Island","2010","42421 ","Drugs and druggists' sundries merchant wholesalers","35","359","25315","44",
"Rhode Island","2010","424210","Drugs and druggists' sundries merchant wholesalers","35","359","25315","44",
"Rhode Island","2010","4243  ","Apparel, piece goods, and notions merchant wholesalers","39","407","14466","44",
"Rhode Island","2010","42431 ","Piece goods, notions, and other dry goods merchant wholesalers","15","218","8558","44",
"Rhode Island","2010","424310","Piece goods, notions, and other dry goods merchant wholesalers","15","218","8558","44",
"Rhode Island","2010","42432 ","Men's and boys' clothing and furnishings merchant wholesalers","9","83","3046","44",
"Rhode Island","2010","424320","Men's and boys' clothing and furnishings merchant wholesalers","9","83","3046","44",
"Rhode Island","2010","42433 ","Women's, children's, and infants' clothing and accessories merchant wholesalers","11","0","2005","44",
"Rhode Island","2010","424330","Women's, children's, and infants' clothing and accessories merchant wholesalers","11","0","2005","44",
"Rhode Island","2010","42434 ","Footwear merchant wholesalers","4","0","857","44",
"Rhode Island","2010","424340","Footwear merchant wholesalers","4","0","857","44",
"Rhode Island","2010","4244  ","Grocery and related product merchant wholesalers","149","2415","108033","44",
"Rhode Island","2010","42441 ","General line grocery merchant wholesalers","8","236","11793","44",
"Rhode Island","2010","424410","General line grocery merchant wholesalers","8","236","11793","44",
"Rhode Island","2010","42442 ","Packaged frozen food merchant wholesalers","27","240","18883","44",
"Rhode Island","2010","424420","Packaged frozen food merchant wholesalers","27","240","18883","44",
"Rhode Island","2010","42443 ","Dairy product (except dried or canned) merchant wholesalers","6","51","1997","44",
"Rhode Island","2010","424430","Dairy product (except dried or canned) merchant wholesalers","6","51","1997","44",
"Rhode Island","2010","42444 ","Poultry and poultry product merchant wholesalers","4","36","1270","44",
"Rhode Island","2010","424440","Poultry and poultry product merchant wholesalers","4","36","1270","44",
"Rhode Island","2010","42445 ","Confectionery merchant wholesalers","14","595","17180","44",
"Rhode Island","2010","424450","Confectionery merchant wholesalers","14","595","17180","44",
"Rhode Island","2010","42446 ","Fish and seafood merchant wholesalers","32","204","9815","44",
"Rhode Island","2010","424460","Fish and seafood merchant wholesalers","32","204","9815","44",
"Rhode Island","2010","42447 ","Meat and meat product merchant wholesalers","10","151","7176","44",
"Rhode Island","2010","424470","Meat and meat product merchant wholesalers","10","151","7176","44",
"Rhode Island","2010","42448 ","Fresh fruit and vegetable merchant wholesalers","16","222","9664","44",
"Rhode Island","2010","424480","Fresh fruit and vegetable merchant wholesalers","16","222","9664","44",
"Rhode Island","2010","42449 ","Other grocery and related products merchant wholesalers","32","680","30255","44",
"Rhode Island","2010","424490","Other grocery and related products merchant wholesalers","32","680","30255","44",
"Rhode Island","2010","4245  ","Farm product raw material merchant wholesalers","3","5","246","44",
"Rhode Island","2010","42451 ","Grain and field bean merchant wholesalers","1","0","0","44",
"Rhode Island","2010","424510","Grain and field bean merchant wholesalers","1","0","0","44",
"Rhode Island","2010","42459 ","Other farm product raw material merchant wholesalers","2","0","0","44",
"Rhode Island","2010","424590","Other farm product raw material merchant wholesalers","2","0","0","44",
"Rhode Island","2010","4246  ","Chemical and allied products merchant wholesalers","50","519","30957","44",
"Rhode Island","2010","42461 ","Plastics materials and basic forms and shapes merchant wholesalers","13","106","5898","44",
"Rhode Island","2010","424610","Plastics materials and basic forms and shapes merchant wholesalers","13","106","5898","44",
"Rhode Island","2010","42469 ","Other chemical and allied products merchant wholesalers","37","413","25059","44",
"Rhode Island","2010","424690","Other chemical and allied products merchant wholesalers","37","413","25059","44",
"Rhode Island","2010","4247  ","Petroleum and petroleum products merchant wholesalers","17","214","17364","44",
"Rhode Island","2010","42471 ","Petroleum bulk stations and terminals","7","0","6517","44",
"Rhode Island","2010","424710","Petroleum bulk stations and terminals","7","0","6517","44",
"Rhode Island","2010","42472 ","Petroleum and petroleum products merchant wholesalers (except bulk stations and terminals)","10","112","10847","44",
"Rhode Island","2010","424720","Petroleum and petroleum products merchant wholesalers (except bulk stations and terminals)","10","112","10847","44",
"Rhode Island","2010","4248  ","Beer, wine, and distilled alcoholic beverage merchant wholesalers","21","459","27511","44",
"Rhode Island","2010","42481 ","Beer and ale merchant wholesalers","6","0","0","44",
"Rhode Island","2010","424810","Beer and ale merchant wholesalers","6","0","0","44",
"Rhode Island","2010","42482 ","Wine and distilled alcoholic beverage merchant wholesalers","15","302","16946","44",
"Rhode Island","2010","424820","Wine and distilled alcoholic beverage merchant wholesalers","15","302","16946","44",
"Rhode Island","2010","4249  ","Miscellaneous nondurable goods merchant wholesalers","54","665","28197","44",
"Rhode Island","2010","42491 ","Farm supplies merchant wholesalers","9","0","2231","44",
"Rhode Island","2010","424910","Farm supplies merchant wholesalers","9","0","2231","44",
"Rhode Island","2010","42492 ","Book, periodical, and newspaper merchant wholesalers","4","0","0","44",
"Rhode Island","2010","424920","Book, periodical, and newspaper merchant wholesalers","4","0","0","44",
"Rhode Island","2010","42493 ","Flower, nursery stock, and florists' supplies merchant wholesalers","5","140","4435","44",
"Rhode Island","2010","424930","Flower, nursery stock, and florists' supplies merchant wholesalers","5","140","4435","44",
"Rhode Island","2010","42494 ","Tobacco and tobacco product merchant wholesalers","5","0","384","44",
"Rhode Island","2010","424940","Tobacco and tobacco product merchant wholesalers","5","0","384","44",
"Rhode Island","2010","42495 ","Paint, varnish, and supplies merchant wholesalers","2","0","0","44",
"Rhode Island","2010","424950","Paint, varnish, and supplies merchant wholesalers","2","0","0","44",
"Rhode Island","2010","42499 ","Other miscellaneous nondurable goods merchant wholesalers","29","406","19285","44",
"Rhode Island","2010","424990","Other miscellaneous nondurable goods merchant wholesalers","29","406","19285","44",
"Rhode Island","2010","425   ","Wholesale electronic markets and agents and brokers","176","759","51528","44",
"Rhode Island","2010","4251  ","Wholesale electronic markets and agents and brokers","176","759","51528","44",
"Rhode Island","2010","42511 ","Business to business electronic markets","2","0","0","44",
"Rhode Island","2010","425110","Business to business electronic markets","2","0","0","44",
"Rhode Island","2010","42512 ","Wholesale trade agents and brokers","174","759","51503","44",
"Rhode Island","2010","425120","Wholesale trade agents and brokers","174","759","51503","44",
"Rhode Island","2010","44-45 ","Retail trade","3886","46006","1196633","44",
"Rhode Island","2010","441   ","Motor vehicle and parts dealers","389","4751","195598","44",
"Rhode Island","2010","4411  ","Automobile dealers","169","3126","142324","44",
"Rhode Island","2010","44111 ","New car dealers","71","2756","130086","44",
"Rhode Island","2010","441110","New car dealers","71","2756","130086","44",
"Rhode Island","2010","44112 ","Used car dealers","98","370","12238","44",
"Rhode Island","2010","441120","Used car dealers","98","370","12238","44",
"Rhode Island","2010","4412  ","Other motor vehicle dealers","80","490","19625","44",
