"Oklahoma","2008","333   ","Machinery manufacturing","429","28222","1415009","40",
"Oklahoma","2008","3331  ","Agriculture, construction, and mining machinery manufacturing","140","9005","444859","40",
"Oklahoma","2008","33312 ","Construction machinery manufacturing","27","2890","138540","40",
"Oklahoma","2008","333132","Oil and gas field machinery and equipment manufacturing","87","5492","280089","40",
"Oklahoma","2008","3332  ","Industrial machinery manufacturing","39","3535","211059","40",
"Oklahoma","2008","33322 ","Plastics and rubber industry machinery manufacturing","2","0","0","40",
"Oklahoma","2008","333220","Plastics and rubber industry machinery manufacturing","2","0","0","40",
"Oklahoma","2008","333292","Textile machinery manufacturing","1","0","0","40",
"Oklahoma","2008","333293","Printing machinery and equipment manufacturing","6","40","1343","40",
"Oklahoma","2008","3333  ","Commercial and service industry machinery manufacturing","23","0","0","40",
"Oklahoma","2008","33331 ","Commercial and service industry machinery manufacturing","23","0","0","40",
"Oklahoma","2008","333312","Commercial laundry, drycleaning, and pressing machine manufacturing","1","0","0","40",
"Oklahoma","2008","333313","Office machinery manufacturing","1","0","0","40",
"Oklahoma","2008","333314","Optical instrument and lens manufacturing","2","0","0","40",
"Oklahoma","2008","333315","Photographic and photocopying equipment manufacturing","4","0","1579","40",
"Oklahoma","2008","333319","Other commercial and service industry machinery manufacturing","15","0","0","40",
"Oklahoma","2008","33341 ","HVAC and commercial refrigeration equipment","38","5370","221319","40",
"Oklahoma","2008","333513","Machine tool (metal forming types) manufacturing","4","55","3772","40",
"Oklahoma","2008","333514","Special die and tool, die set, jig, and fixture manufacturing","14","0","0","40",
"Oklahoma","2008","333518","Other metalworking machinery manufacturing","3","0","2904","40",
"Oklahoma","2008","3336  ","Engine, turbine, and power transmission equipment manufacturing","16","1446","59188","40",
"Oklahoma","2008","33361 ","Engine, turbine, and power transmission equipment manufacturing","16","1446","59188","40",
"Oklahoma","2008","333611","Turbine and turbine generator set units manufacturing","5","412","24895","40",
"Oklahoma","2008","333922","Conveyor and conveying equipment manufacturing","1","0","0","40",
"Oklahoma","2008","33399 ","All other general purpose machinery manufacturing","49","1575","78524","40",
"Oklahoma","2008","333991","Power-driven handtool manufacturing","1","0","0","40",
"Oklahoma","2008","333993","Packaging machinery manufacturing","1","0","0","40",
"Oklahoma","2008","333994","Industrial process furnace and oven manufacturing","6","348","18700","40",
"Oklahoma","2008","333995","Fluid power cylinder and actuator manufacturing","2","0","0","40",
"Oklahoma","2008","3341  ","Computer and peripheral equipment manufacturing","10","0","0","40",
"Oklahoma","2008","334112","Computer storage device manufacturing","1","0","0","40",
"Oklahoma","2008","334119","Other computer peripheral equipment manufacturing","8","0","0","40",
"Oklahoma","2008","3342  ","Communications equipment manufacturing","14","307","13484","40",
"Oklahoma","2008","33429 ","Other communications equipment manufacturing","5","0","0","40",
"Oklahoma","2008","334412","Bare printed circuit board manufacturing","4","0","0","40",
"Oklahoma","2008","333411","Air purification equipment manufacturing","8","179","8037","40",
"Oklahoma","2008","333412","Industrial and commercial fan and blower manufacturing","2","0","0","40",
"Oklahoma","2008","33431 ","Audio and video equipment manufacturing","1","0","0","40",
"Oklahoma","2008","334310","Audio and video equipment manufacturing","1","0","0","40",
"Oklahoma","2008","333414","Heating equipment (except warm air furnaces) manufacturing","7","364","13025","40",
"Oklahoma","2008","333415","Air-conditioning and warm air heating equipment and commercial and industrial refrigeration equipment manufacturing","21","4551","191163","40",
"Oklahoma","2008","3335  ","Metalworking machinery manufacturing","52","1003","42177","40",
"Oklahoma","2008","33441 ","Semiconductor and other electronic component manufacturing","31","1391","51669","40",
"Oklahoma","2008","33351 ","Metalworking machinery manufacturing","52","1003","42177","40",
"Oklahoma","2008","333511","Industrial mold manufacturing","6","0","0","40",
"Oklahoma","2008","333512","Machine tool (metal cutting types) manufacturing","8","328","8786","40",
"Oklahoma","2008","333515","Cutting tool and machine tool accessory manufacturing","17","365","20180","40",
"Oklahoma","2008","333612","Speed changer, industrial high-speed drive, and gear manufacturing","2","0","0","40",
"Oklahoma","2008","333613","Mechanical power transmission equipment manufacturing","3","0","0","40",
"Oklahoma","2008","333618","Other engine equipment manufacturing","6","0","0","40",
"Oklahoma","2008","3339  ","Other general purpose machinery manufacturing","121","6747","379578","40",
"Oklahoma","2008","33391 ","Pump and compressor manufacturing","47","3513","226344","40",
"Oklahoma","2008","333911","Pump and pumping equipment manufacturing","32","2402","144000","40",
"Oklahoma","2008","333912","Air and gas compressor manufacturing","15","1111","82344","40",
"Oklahoma","2008","33392 ","Material handling equipment manufacturing","25","0","0","40",
"Oklahoma","2008","333921","Elevator and moving stairway manufacturing","1","0","0","40",
"Oklahoma","2008","333923","Overhead traveling crane, hoist, and monorail system manufacturing","14","0","0","40",
"Oklahoma","2008","333924","Industrial truck, tractor, trailer, and stacker machinery manufacturing","9","0","0","40",
"Oklahoma","2008","333992","Welding and soldering equipment manufacturing","4","151","10323","40",
"Oklahoma","2008","333996","Fluid power pump and motor manufacturing","4","0","0","40",
"Oklahoma","2008","333997","Scale and balance manufacturing","3","0","0","40",
"Oklahoma","2008","333999","All other miscellaneous general purpose machinery manufacturing","28","504","22564","40",
"Oklahoma","2008","334   ","Computer and electronic product manufacturing","121","4539","210764","40",
"Oklahoma","2008","33411 ","Computer and peripheral equipment manufacturing","10","0","0","40",
"Oklahoma","2008","334111","Electronic computer manufacturing","1","0","0","40",
"Oklahoma","2008","33421 ","Telephone apparatus manufacturing","1","0","0","40",
"Oklahoma","2008","334210","Telephone apparatus manufacturing","1","0","0","40",
"Oklahoma","2008","33422 ","Radio and television broadcasting and wireless communications equipment manufacturing","8","0","0","40",
"Oklahoma","2008","334220","Broadcast and wireless communications equip.","8","0","0","40",
"Oklahoma","2008","334290","Other communications equipment manufacturing","5","0","0","40",
"Oklahoma","2008","3343  ","Audio and video equipment manufacturing","1","0","0","40",
"Oklahoma","2008","3344  ","Semiconductor and other electronic component manufacturing","31","1391","51669","40",
"Oklahoma","2008","334413","Semiconductor and related device manufacturing","3","0","0","40",
"Oklahoma","2008","3345  ","Navigational, measuring, electromedical, and control instruments manufacturing","57","1885","107162","40",
"Oklahoma","2008","334516","Analytical laboratory instrument manufacturing","3","0","0","40",
"Oklahoma","2008","334517","Irradiation apparatus manufacturing","2","0","0","40",
"Oklahoma","2008","334518","Watch, clock, and part manufacturing","4","0","0","40",
"Oklahoma","2008","334612","Prerecorded compact disc (except software), tape, and record reproducing","3","0","0","40",
"Oklahoma","2008","3351  ","Electric lighting equipment manufacturing","11","179","7188","40",
"Oklahoma","2008","33511 ","Electric lamp bulb and part manufacturing","1","0","0","40",
"Oklahoma","2008","33512 ","Lighting fixture manufacturing","10","166","6740","40",
"Oklahoma","2008","335121","Residential electric lighting fixture manufacturing","2","0","0","40",
"Oklahoma","2008","335122","Commercial, industrial, and institutional electric lighting fixture manufacturing","4","29","1113","40",
"Oklahoma","2008","335129","Other lighting equipment manufacturing","4","130","5488","40",
"Oklahoma","2008","33522 ","Major appliance manufacturing","2","0","0","40",
"Oklahoma","2008","335221","Household cooking appliance manufacturing","2","0","0","40",
"Oklahoma","2008","33531 ","Electrical equipment manufacturing","33","1878","85947","40",
"Oklahoma","2008","335311","Power, distribution, and specialty transformer manufacturing","4","0","0","40",
"Oklahoma","2008","335312","Motor and generator manufacturing","14","0","0","40",
"Oklahoma","2008","335911","Storage battery manufacturing","1","0","0","40",
"Oklahoma","2008","335932","Noncurrent-carrying wiring device manufacturing","2","0","0","40",
"Oklahoma","2008","33599 ","All other electrical equipment and component manufacturing","8","287","11397","40",
"Oklahoma","2008","33612 ","Heavy duty truck manufacturing","4","0","0","40",
"Oklahoma","2008","334416","Electronic coil, transformer, and other inductor manufacturing","2","0","0","40",
"Oklahoma","2008","336   ","Transportation equipment manufacturing","207","13999","597979","40",
"Oklahoma","2008","3361  ","Motor vehicle manufacturing","7","0","0","40",
"Oklahoma","2008","33611 ","Automobile and light duty motor vehicle manufacturing","3","14","513","40",
"Oklahoma","2008","334417","Electronic connector manufacturing","3","0","0","40",
"Oklahoma","2008","334418","Printed circuit assembly (electronic assembly) manufacturing","7","525","21165","40",
"Oklahoma","2008","334419","Other electronic component manufacturing","12","0","17820","40",
"Oklahoma","2008","33451 ","Electronic instrument manufacturing","57","1885","107162","40",
"Oklahoma","2008","334510","Electromedical and electrotherapeutic apparatus manufacturing","3","0","0","40",
"Oklahoma","2008","334511","Search, detection, navigation, guidance, aeronautical, and nautical system and instrument manufacturing","5","127","5916","40",
"Oklahoma","2008","334512","Automatic environmental control manufacturing for residential, commercial, and appliance use","2","0","0","40",
"Oklahoma","2008","334513","Instruments and related products manufacturing for measuring, displaying, and controlling industrial process variables","12","954","62037","40",
"Oklahoma","2008","334514","Totalizing fluid meter and counting device manufacturing","6","0","0","40",
"Oklahoma","2008","334515","Instrument manufacturing for measuring and testing electricity and electrical signals","10","0","3995","40",
"Oklahoma","2008","334519","Other measuring and controlling device manufacturing","10","378","20251","40",
"Oklahoma","2008","3346  ","Manufacturing and reproducing magnetic and optical media","8","0","0","40",
"Oklahoma","2008","33461 ","Manufacturing and reproducing magnetic and optical media","8","0","0","40",
"Oklahoma","2008","334611","Software reproducing","3","0","1268","40",
"Oklahoma","2008","334613","Magnetic and optical recording media manufacturing","2","0","0","40",
"Oklahoma","2008","335   ","Electrical equipment, appliance, and component manufacturing","60","3683","150417","40",
"Oklahoma","2008","335110","Electric lamp bulb and part manufacturing","1","0","0","40",
"Oklahoma","2008","3352  ","Household appliance manufacturing","3","0","0","40",
"Oklahoma","2008","33521 ","Small electrical appliance manufacturing","1","0","0","40",
"Oklahoma","2008","335212","Household vacuum cleaner manufacturing","1","0","0","40",
"Oklahoma","2008","3353  ","Electrical equipment manufacturing","33","1878","85947","40",
"Oklahoma","2008","335313","Switchgear and switchboard apparatus manufacturing","4","170","13408","40",
"Oklahoma","2008","335314","Relay and industrial control manufacturing","11","0","0","40",
"Oklahoma","2008","3359  ","Other electrical equipment and component manufacturing","13","519","19393","40",
"Oklahoma","2008","33591 ","Battery manufacturing","1","0","0","40",
"Oklahoma","2008","33593 ","Wiring device manufacturing","4","0","0","40",
"Oklahoma","2008","335931","Current-carrying wiring device manufacturing","2","0","0","40",
"Oklahoma","2008","335991","Carbon and graphite product manufacturing","2","0","0","40",
"Oklahoma","2008","335999","All other miscellaneous electrical equipment and component manufacturing","6","193","6365","40",
"Oklahoma","2008","336111","Automobile manufacturing","1","0","0","40",
"Oklahoma","2008","336112","Light truck and utility vehicle manufacturing","2","0","0","40",
"Oklahoma","2008","336120","Heavy duty truck manufacturing","4","0","0","40",
"Oklahoma","2008","3362  ","Motor vehicle body and trailer manufacturing","68","3486","108367","40",
"Oklahoma","2008","336211","Motor vehicle body manufacturing","17","895","33427","40",
"Oklahoma","2008","336212","Truck trailer manufacturing","21","533","14425","40",
"Oklahoma","2008","336213","Motor home manufacturing","3","0","0","40",
"Oklahoma","2008","336214","Travel trailer and camper manufacturing","27","1832","49144","40",
"Oklahoma","2008","3363  ","Motor vehicle parts manufacturing","62","2833","109348","40",
"Oklahoma","2008","336312","Gasoline engine and engine parts manufacturing","19","231","11037","40",
"Oklahoma","2008","33632 ","Motor vehicle electrical and electronic equipment manufacturing","11","0","0","40",
"Oklahoma","2008","336322","Other motor vehicle electrical and electronic equipment manufacturing","11","0","0","40",
"Oklahoma","2008","33633 ","Motor vehicle steering and suspension components (except spring) manufacturing","1","0","0","40",
"Oklahoma","2008","336340","Motor vehicle brake system manufacturing","4","0","0","40",
"Oklahoma","2008","33636 ","Motor vehicle seating and interior trim manufacturing","2","0","0","40",
"Oklahoma","2008","336360","Motor vehicle seating and interior trim manufacturing","2","0","0","40",
"Oklahoma","2008","33637 ","Motor vehicle metal stamping","2","0","0","40",
"Oklahoma","2008","33641 ","Aerospace product and parts manufacturing","48","5810","316453","40",
"Oklahoma","2008","336413","Other aircraft parts and auxiliary equipment manufacturing","22","4944","275069","40",
"Oklahoma","2008","336415","Guided missile and space vehicle propulsion unit and propulsion unit parts manufacturing","1","0","0","40",
"Oklahoma","2008","3365  ","Railroad rolling stock manufacturing","5","0","0","40",
"Oklahoma","2008","33651 ","Railroad rolling stock manufacturing","5","0","0","40",
"Oklahoma","2008","336510","Railroad rolling stock manufacturing","5","0","0","40",
"Oklahoma","2008","3369  ","Other transportation equipment manufacturing","8","0","1036","40",
"Oklahoma","2008","33699 ","Other transportation equipment manufacturing","8","0","1036","40",
"Oklahoma","2008","337   ","Furniture and related product manufacturing","134","3044","94821","40",
"Oklahoma","2008","3371  ","Household and institutional furniture and kitchen cabinet manufacturing","98","1768","50780","40",
"Oklahoma","2008","337122","Nonupholstered wood household furniture manufacturing","11","95","2447","40",
"Oklahoma","2008","33791 ","Mattress manufacturing","9","245","8112","40",
"Oklahoma","2008","33621 ","Motor vehicle body and trailer manufacturing","68","3486","108367","40",
"Oklahoma","2008","337129","Wood television, radio, and sewing machine cabinet manufacturing","2","0","0","40",
"Oklahoma","2008","3372  ","Office furniture (including fixtures) manufacturing","25","1027","35897","40",
"Oklahoma","2008","33631 ","Motor vehicle gasoline engine and engine parts manufacturing","20","294","13386","40",
"Oklahoma","2008","336311","Carburetor, piston, piston ring, and valve manufacturing","1","0","0","40",
"Oklahoma","2008","336330","Motor vehicle steering and suspension components (except spring) manufacturing","1","0","0","40",
"Oklahoma","2008","33634 ","Motor vehicle brake system manufacturing","4","0","0","40",
"Oklahoma","2008","33635 ","Motor vehicle transmission and power train parts manufacturing","6","0","0","40",
"Oklahoma","2008","336350","Motor vehicle transmission and power train parts manufacturing","6","0","0","40",
"Oklahoma","2008","336370","Motor vehicle metal stamping","2","0","0","40",
"Oklahoma","2008","33639 ","Other motor vehicle parts manufacturing","16","501","23896","40",
"Oklahoma","2008","336399","All other motor vehicle parts manufacturing","16","501","23896","40",
"Oklahoma","2008","3364  ","Aerospace product and parts manufacturing","48","5810","316453","40",
"Oklahoma","2008","336411","Aircraft manufacturing","8","296","13717","40",
"Oklahoma","2008","336412","Aircraft engine and engine parts manufacturing","16","554","26563","40",
"Oklahoma","2008","336419","Other guided missile and space vehicle parts and auxiliary equipment manufacturing","1","0","0","40",
"Oklahoma","2008","3366  ","Ship and boat building","9","0","0","40",
"Oklahoma","2008","33661 ","Ship and boat building","9","0","0","40",
"Oklahoma","2008","336611","Ship building and repairing","1","0","0","40",
"Oklahoma","2008","336612","Boat building","8","0","0","40",
"Oklahoma","2008","336991","Motorcycle, bicycle, and parts manufacturing","5","32","500","40",
"Oklahoma","2008","336999","All other transportation equipment manufacturing","3","0","536","40",
"Oklahoma","2008","33711 ","Wood kitchen cabinet and countertop manufacturing","64","1055","26872","40",
"Oklahoma","2008","337110","Wood kitchen cabinet and countertop manufacturing","64","1055","26872","40",
"Oklahoma","2008","33712 ","Household and institutional furniture manufacturing","34","713","23908","40",
"Oklahoma","2008","337121","Upholstered household furniture manufacturing","11","0","0","40",
"Oklahoma","2008","337124","Metal household furniture manufacturing","4","0","394","40",
"Oklahoma","2008","337127","Institutional furniture manufacturing","6","330","15065","40",
"Oklahoma","2008","33721 ","Office furniture (including fixtures) manufacturing","25","1027","35897","40",
"Oklahoma","2008","337211","Wood office furniture manufacturing","2","0","0","40",
"Oklahoma","2008","337212","Custom architectural woodwork and millwork manufacturing","16","457","15536","40",
"Oklahoma","2008","337215","Showcase, partition, shelving, and locker manufacturing","7","550","19972","40",
"Oklahoma","2008","3379  ","Other furniture related product manufacturing","11","249","8144","40",
"Oklahoma","2008","339115","Ophthalmic goods manufacturing","7","0","0","40",
"Oklahoma","2008","33991 ","Jewelry and silverware manufacturing","3","0","0","40",
"Oklahoma","2008","339912","Silverware and hollowware manufacturing","1","0","0","40",
"Oklahoma","2008","339913","Jewelers' material and lapidary work manufacturing","1","0","0","40",
"Oklahoma","2008","339932","Game, toy, and children's vehicle manufacturing","2","0","0","40",
"Oklahoma","2008","33995 ","Sign manufacturing","70","663","21554","40",
"Oklahoma","2008","339950","Sign manufacturing","70","663","21554","40",
"Oklahoma","2008","339992","Musical instrument manufacturing","3","0","0","40",
"Oklahoma","2008","339994","Broom, brush, and mop manufacturing","3","0","0","40",
"Oklahoma","2008","339995","Burial casket manufacturing","1","0","0","40",
"Oklahoma","2008","339999","All other miscellaneous manufacturing","65","1276","40863","40",
"Oklahoma","2008","4231  ","Motor vehicle and motor vehicle parts and supplies merchant wholesalers","294","4791","185638","40",
"Oklahoma","2008","337910","Mattress manufacturing","9","245","8112","40",
"Oklahoma","2008","33792 ","Blind and shade manufacturing","2","0","0","40",
"Oklahoma","2008","337920","Blind and shade manufacturing","2","0","0","40",
"Oklahoma","2008","339   ","Miscellaneous manufacturing","299","4155","154074","40",
"Oklahoma","2008","3391  ","Medical equipment and supplies manufacturing","110","1109","44111","40",
"Oklahoma","2008","33911 ","Medical equipment and supplies manufacturing","110","1109","44111","40",
"Oklahoma","2008","339112","Surgical and medical instrument manufacturing","10","288","12979","40",
"Oklahoma","2008","339113","Surgical appliance and supplies manufacturing","12","0","0","40",
"Oklahoma","2008","339114","Dental equipment and supplies manufacturing","9","0","2895","40",
"Oklahoma","2008","339116","Dental laboratories","72","390","13010","40",
"Oklahoma","2008","3399  ","Other miscellaneous manufacturing","189","3046","109963","40",
"Oklahoma","2008","339914","Costume jewelry and novelty manufacturing","1","0","0","40",
"Oklahoma","2008","33992 ","Sporting and athletic goods manufacturing","21","479","23583","40",
"Oklahoma","2008","339920","Sporting and athletic goods manufacturing","21","479","23583","40",
"Oklahoma","2008","33993 ","Doll, toy, and game manufacturing","2","0","0","40",
"Oklahoma","2008","33994 ","Office supplies (except paper) manufacturing","3","0","0","40",
"Oklahoma","2008","339943","Marking device manufacturing","3","0","0","40",
"Oklahoma","2008","33999 ","All other miscellaneous manufacturing","90","1798","59863","40",
"Oklahoma","2008","339991","Gasket, packing, and sealing device manufacturing","18","490","18084","40",
"Oklahoma","2008","42    ","Wholesale trade","4602","61825","3001940","40",
"Oklahoma","2008","423   ","Merchant wholesalers, durable goods","2885","39337","2025870","40",
"Oklahoma","2008","42311 ","Automobile and other motor vehicle merchant wholesalers","99","1989","90640","40",
"Oklahoma","2008","423120","Motor vehicle supplies and new parts merchant wholesalers","135","2123","71247","40",
"Oklahoma","2008","42313 ","Tire and tube merchant wholesalers","28","389","17501","40",
"Oklahoma","2008","42321 ","Furniture merchant wholesalers","32","271","11269","40",
"Oklahoma","2008","4233  ","Lumber and other construction materials merchant wholesalers","202","2651","118589","40",
"Oklahoma","2008","42331 ","Lumber, plywood, millwork, and wood panel merchant wholesalers","72","1420","62662","40",
"Oklahoma","2008","423330","Roofing, siding, and insulation material merchant wholesalers","33","429","22019","40",
"Oklahoma","2008","4234  ","Professional and commercial equipment and supplies merchant wholesalers","382","5237","285074","40",
"Oklahoma","2008","42341 ","Photographic equipment and supplies merchant wholesalers","12","135","5066","40",
"Oklahoma","2008","423430","Computer and computer peripheral equipment and software merchant wholesalers","100","1479","77547","40",
"Oklahoma","2008","42345 ","Medical, dental, and hospital equipment and supplies merchant wholesalers","113","1391","110029","40",
"Oklahoma","2008","423450","Medical, dental, and hospital equipment and supplies merchant wholesalers","113","1391","110029","40",
"Oklahoma","2008","4235  ","Metal and mineral (except petroleum) merchant wholesalers","175","2326","119579","40",
"Oklahoma","2008","42352 ","Coal and other mineral and ore merchant wholesalers","4","0","561","40",
"Oklahoma","2008","423520","Coal and other mineral and ore merchant wholesalers","4","0","561","40",
"Oklahoma","2008","423620","Electrical and electronic appliance, television, and radio set merchant wholesalers","18","0","0","40",
"Oklahoma","2008","4237  ","Hardware, plumbing and heating equipment and supplies merchant wholesalers","259","3879","243044","40",
"Oklahoma","2008","423110","Automobile and other motor vehicle merchant wholesalers","99","1989","90640","40",
"Oklahoma","2008","42312 ","Motor vehicle supplies and new parts merchant wholesalers","135","2123","71247","40",
"Oklahoma","2008","423130","Tire and tube merchant wholesalers","28","389","17501","40",
"Oklahoma","2008","42314 ","Motor vehicle parts (used) merchant wholesalers","32","290","6250","40",
"Oklahoma","2008","423140","Motor vehicle parts (used) merchant wholesalers","32","290","6250","40",
"Oklahoma","2008","4232  ","Furniture and home furnishing merchant wholesalers","77","803","32804","40",
"Oklahoma","2008","423210","Furniture merchant wholesalers","32","271","11269","40",
"Oklahoma","2008","42322 ","Home furnishing merchant wholesalers","45","532","21535","40",
"Oklahoma","2008","423220","Home furnishing merchant wholesalers","45","532","21535","40",
"Oklahoma","2008","423310","Lumber, plywood, millwork, and wood panel merchant wholesalers","72","1420","62662","40",
"Oklahoma","2008","42332 ","Brick, stone, and related construction material merchant wholesalers","46","366","15664","40",
"Oklahoma","2008","423320","Brick, stone, and related construction material merchant wholesalers","46","366","15664","40",
"Oklahoma","2008","42333 ","Roofing, siding, and insulation material merchant wholesalers","33","429","22019","40",
"Oklahoma","2008","42339 ","Other construction material merchant wholesalers","51","436","18244","40",
"Oklahoma","2008","423390","Other construction material merchant wholesalers","51","436","18244","40",
"Oklahoma","2008","423410","Photographic equipment and supplies merchant wholesalers","12","135","5066","40",
"Oklahoma","2008","42342 ","Office equipment merchant wholesalers","89","1320","60593","40",
"Oklahoma","2008","423420","Office equipment merchant wholesalers","89","1320","60593","40",
"Oklahoma","2008","42343 ","Computer and computer peripheral equipment and software merchant wholesalers","100","1479","77547","40",
"Oklahoma","2008","42344 ","Other commercial equipment merchant wholesalers","42","391","15640","40",
"Oklahoma","2008","423440","Other commercial equipment merchant wholesalers","42","391","15640","40",
"Oklahoma","2008","42346 ","Ophthalmic goods merchant wholesalers","14","418","12542","40",
"Oklahoma","2008","423460","Ophthalmic goods merchant wholesalers","14","418","12542","40",
"Oklahoma","2008","42349 ","Other professional equipment and supplies merchant wholesalers","12","103","3657","40",
