"Oregon","2009","333220","Plastics and rubber industry machinery manufacturing","5","0","0","41",
"Oregon","2009","333298","All other industrial machinery manufacturing","18","0","0","41",
"Oregon","2009","333311","Automatic vending machine manufacturing","1","0","0","41",
"Oregon","2009","333315","Photographic and photocopying equipment manufacturing","2","0","0","41",
"Oregon","2009","332993","Ammunition (except small arms) manufacturing","1","0","0","41",
"Oregon","2009","332996","Fabricated pipe and pipe fitting manufacturing","15","526","21577","41",
"Oregon","2009","332999","All other miscellaneous fabricated metal product manufacturing","103","1125","38799","41",
"Oregon","2009","333   ","Machinery manufacturing","353","10530","574093","41",
"Oregon","2009","33311 ","Agricultural implement manufacturing","34","614","29150","41",
"Oregon","2009","333111","Farm machinery and equipment manufacturing","29","450","17891","41",
"Oregon","2009","33312 ","Construction machinery manufacturing","28","1203","44689","41",
"Oregon","2009","333120","Construction machinery manufacturing","28","1203","44689","41",
"Oregon","2009","33313 ","Mining and oil and gas field machinery manufacturing","5","172","8969","41",
"Oregon","2009","333132","Oil and gas field machinery and equipment manufacturing","3","106","6098","41",
"Oregon","2009","3332  ","Industrial machinery manufacturing","82","2831","216597","41",
"Oregon","2009","333210","Sawmill and woodworking machinery manufacturing","24","429","21373","41",
"Oregon","2009","33322 ","Plastics and rubber industry machinery manufacturing","5","0","0","41",
"Oregon","2009","33329 ","Other industrial machinery manufacturing","53","2314","186398","41",
"Oregon","2009","333291","Paper industry machinery manufacturing","8","127","5973","41",
"Oregon","2009","333292","Textile machinery manufacturing","3","0","0","41",
"Oregon","2009","333293","Printing machinery and equipment manufacturing","4","0","0","41",
"Oregon","2009","333294","Food product machinery manufacturing","11","221","10427","41",
"Oregon","2009","333295","Semiconductor machinery manufacturing","9","1580","147011","41",
"Oregon","2009","3333  ","Commercial and service industry machinery manufacturing","25","1260","61322","41",
"Oregon","2009","33331 ","Commercial and service industry machinery manufacturing","25","1260","61322","41",
"Oregon","2009","333313","Office machinery manufacturing","1","0","0","41",
"Oregon","2009","333314","Optical instrument and lens manufacturing","8","849","46474","41",
"Oregon","2009","333414","Heating equipment (except warm air furnaces) manufacturing","6","0","3330","41",
"Oregon","2009","333319","Other commercial and service industry machinery manufacturing","13","374","13490","41",
"Oregon","2009","3334  ","Ventilation, heating, air-conditioning, and commercial refrigeration equipment manufacturing","24","809","41641","41",
"Oregon","2009","33341 ","HVAC and commercial refrigeration equipment","24","809","41641","41",
"Oregon","2009","333411","Air purification equipment manufacturing","7","0","0","41",
"Oregon","2009","333412","Industrial and commercial fan and blower manufacturing","1","0","0","41",
"Oregon","2009","333513","Machine tool (metal forming types) manufacturing","1","0","0","41",
"Oregon","2009","333415","Air-conditioning and warm air heating equipment and commercial and industrial refrigeration equipment manufacturing","10","231","9702","41",
"Oregon","2009","3335  ","Metalworking machinery manufacturing","61","748","29460","41",
"Oregon","2009","33351 ","Metalworking machinery manufacturing","61","748","29460","41",
"Oregon","2009","333511","Industrial mold manufacturing","21","206","7203","41",
"Oregon","2009","333512","Machine tool (metal cutting types) manufacturing","8","291","12494","41",
"Oregon","2009","333514","Special die and tool, die set, jig, and fixture manufacturing","20","0","3742","41",
"Oregon","2009","333515","Cutting tool and machine tool accessory manufacturing","8","80","3633","41",
"Oregon","2009","333518","Other metalworking machinery manufacturing","3","59","2323","41",
"Oregon","2009","33361 ","Engine, turbine, and power transmission equipment manufacturing","17","326","10941","41",
"Oregon","2009","333611","Turbine and turbine generator set units manufacturing","3","0","0","41",
"Oregon","2009","333613","Mechanical power transmission equipment manufacturing","4","0","0","41",
"Oregon","2009","333618","Other engine equipment manufacturing","6","124","4932","41",
"Oregon","2009","33391 ","Pump and compressor manufacturing","7","220","12975","41",
"Oregon","2009","333911","Pump and pumping equipment manufacturing","7","220","12975","41",
"Oregon","2009","333923","Overhead traveling crane, hoist, and monorail system manufacturing","3","0","0","41",
"Oregon","2009","333991","Power-driven handtool manufacturing","5","0","0","41",
"Oregon","2009","333994","Industrial process furnace and oven manufacturing","3","100","4971","41",
"Oregon","2009","333995","Fluid power cylinder and actuator manufacturing","8","195","11139","41",
"Oregon","2009","333999","All other miscellaneous general purpose machinery manufacturing","19","233","10479","41",
"Oregon","2009","33411 ","Computer and peripheral equipment manufacturing","27","4994","387613","41",
"Oregon","2009","334210","Telephone apparatus manufacturing","3","0","428","41",
"Oregon","2009","33429 ","Other communications equipment manufacturing","9","371","18958","41",
"Oregon","2009","334413","Semiconductor and related device manufacturing","26","5460","356853","41",
"Oregon","2009","3336  ","Engine, turbine, and power transmission equipment manufacturing","17","326","10941","41",
"Oregon","2009","333612","Speed changer, industrial high-speed drive, and gear manufacturing","4","0","194","41",
"Oregon","2009","3339  ","Other general purpose machinery manufacturing","77","2567","131324","41",
"Oregon","2009","33392 ","Material handling equipment manufacturing","30","1317","71929","41",
"Oregon","2009","333922","Conveyor and conveying equipment manufacturing","16","569","26392","41",
"Oregon","2009","333924","Industrial truck, tractor, trailer, and stacker machinery manufacturing","11","0","0","41",
"Oregon","2009","33399 ","All other general purpose machinery manufacturing","40","1030","46420","41",
"Oregon","2009","333992","Welding and soldering equipment manufacturing","1","0","0","41",
"Oregon","2009","333993","Packaging machinery manufacturing","2","0","0","41",
"Oregon","2009","333996","Fluid power pump and motor manufacturing","1","0","0","41",
"Oregon","2009","333997","Scale and balance manufacturing","1","0","0","41",
"Oregon","2009","334   ","Computer and electronic product manufacturing","245","21443","1427983","41",
"Oregon","2009","3341  ","Computer and peripheral equipment manufacturing","27","4994","387613","41",
"Oregon","2009","334111","Electronic computer manufacturing","6","0","0","41",
"Oregon","2009","334112","Computer storage device manufacturing","3","0","0","41",
"Oregon","2009","334113","Computer terminal manufacturing","2","0","0","41",
"Oregon","2009","334119","Other computer peripheral equipment manufacturing","16","4567","364292","41",
"Oregon","2009","3342  ","Communications equipment manufacturing","22","1359","76908","41",
"Oregon","2009","33421 ","Telephone apparatus manufacturing","3","0","428","41",
"Oregon","2009","33422 ","Radio and television broadcasting and wireless communications equipment manufacturing","10","977","57522","41",
"Oregon","2009","334220","Broadcast and wireless communications equip.","10","977","57522","41",
"Oregon","2009","334290","Other communications equipment manufacturing","9","371","18958","41",
"Oregon","2009","3343  ","Audio and video equipment manufacturing","7","672","39963","41",
"Oregon","2009","33431 ","Audio and video equipment manufacturing","7","672","39963","41",
"Oregon","2009","334310","Audio and video equipment manufacturing","7","672","39963","41",
"Oregon","2009","3344  ","Semiconductor and other electronic component manufacturing","93","9048","505108","41",
"Oregon","2009","33441 ","Semiconductor and other electronic component manufacturing","93","9048","505108","41",
"Oregon","2009","334411","Electron tube manufacturing","1","0","0","41",
"Oregon","2009","334412","Bare printed circuit board manufacturing","10","1012","42881","41",
"Oregon","2009","334418","Printed circuit assembly (electronic assembly) manufacturing","27","1565","63199","41",
"Oregon","2009","334415","Electronic resistor manufacturing","2","0","0","41",
"Oregon","2009","334416","Electronic coil, transformer, and other inductor manufacturing","8","0","0","41",
"Oregon","2009","334417","Electronic connector manufacturing","2","0","0","41",
"Oregon","2009","334510","Electromedical and electrotherapeutic apparatus manufacturing","10","1326","76325","41",
"Oregon","2009","334511","Search, detection, navigation, guidance, aeronautical, and nautical system and instrument manufacturing","12","1252","110129","41",
"Oregon","2009","334513","Instruments and related products manufacturing for measuring, displaying, and controlling industrial process variables","10","71","3440","41",
"Oregon","2009","334514","Totalizing fluid meter and counting device manufacturing","4","133","6637","41",
"Oregon","2009","334516","Analytical laboratory instrument manufacturing","7","158","6143","41",
"Oregon","2009","334519","Other measuring and controlling device manufacturing","16","320","27991","41",
"Oregon","2009","3346  ","Manufacturing and reproducing magnetic and optical media","13","34","2113","41",
"Oregon","2009","334611","Software reproducing","2","0","0","41",
"Oregon","2009","334612","Prerecorded compact disc (except software), tape, and record reproducing","11","28","1808","41",
"Oregon","2009","33511 ","Electric lamp bulb and part manufacturing","2","0","0","41",
"Oregon","2009","335121","Residential electric lighting fixture manufacturing","6","0","0","41",
"Oregon","2009","3352  ","Household appliance manufacturing","3","0","0","41",
"Oregon","2009","335221","Household cooking appliance manufacturing","1","0","0","41",
"Oregon","2009","335311","Power, distribution, and specialty transformer manufacturing","3","0","0","41",
"Oregon","2009","33592 ","Communication and energy wire and cable manufacturing","4","0","0","41",
"Oregon","2009","33593 ","Wiring device manufacturing","9","247","10444","41",
"Oregon","2009","334419","Other electronic component manufacturing","17","250","10250","41",
"Oregon","2009","3345  ","Navigational, measuring, electromedical, and control instruments manufacturing","83","5336","416278","41",
"Oregon","2009","33451 ","Electronic instrument manufacturing","83","5336","416278","41",
"Oregon","2009","334512","Automatic environmental control manufacturing for residential, commercial, and appliance use","3","0","0","41",
"Oregon","2009","334515","Instrument manufacturing for measuring and testing electricity and electrical signals","17","0","0","41",
"Oregon","2009","334517","Irradiation apparatus manufacturing","1","0","0","41",
"Oregon","2009","334518","Watch, clock, and part manufacturing","3","20","811","41",
"Oregon","2009","33461 ","Manufacturing and reproducing magnetic and optical media","13","34","2113","41",
"Oregon","2009","335   ","Electrical equipment, appliance, and component manufacturing","73","1784","78993","41",
"Oregon","2009","3351  ","Electric lighting equipment manufacturing","14","368","14618","41",
"Oregon","2009","335110","Electric lamp bulb and part manufacturing","2","0","0","41",
"Oregon","2009","33512 ","Lighting fixture manufacturing","12","318","12701","41",
"Oregon","2009","335122","Commercial, industrial, and institutional electric lighting fixture manufacturing","2","0","0","41",
"Oregon","2009","335129","Other lighting equipment manufacturing","4","75","3509","41",
"Oregon","2009","33521 ","Small electrical appliance manufacturing","2","0","0","41",
"Oregon","2009","335211","Electric housewares and household fan manufacturing","2","0","0","41",
"Oregon","2009","33522 ","Major appliance manufacturing","1","0","0","41",
"Oregon","2009","3353  ","Electrical equipment manufacturing","28","492","21280","41",
"Oregon","2009","33531 ","Electrical equipment manufacturing","28","492","21280","41",
"Oregon","2009","335312","Motor and generator manufacturing","6","82","5552","41",
"Oregon","2009","335313","Switchgear and switchboard apparatus manufacturing","5","105","5547","41",
"Oregon","2009","335314","Relay and industrial control manufacturing","14","149","5533","41",
"Oregon","2009","3359  ","Other electrical equipment and component manufacturing","28","842","38864","41",
"Oregon","2009","33591 ","Battery manufacturing","4","0","0","41",
"Oregon","2009","335911","Storage battery manufacturing","4","0","0","41",
"Oregon","2009","335921","Fiber optic cable manufacturing","2","0","0","41",
"Oregon","2009","335929","Other communication and energy wire manufacturing","2","0","0","41",
"Oregon","2009","336   ","Transportation equipment manufacturing","238","9649","431196","41",
"Oregon","2009","335931","Current-carrying wiring device manufacturing","7","241","10292","41",
"Oregon","2009","335932","Noncurrent-carrying wiring device manufacturing","2","0","0","41",
"Oregon","2009","33599 ","All other electrical equipment and component manufacturing","11","85","3405","41",
"Oregon","2009","335991","Carbon and graphite product manufacturing","1","0","0","41",
"Oregon","2009","335999","All other miscellaneous electrical equipment and component manufacturing","10","0","3126","41",
"Oregon","2009","336112","Light truck and utility vehicle manufacturing","1","0","0","41",
"Oregon","2009","3361  ","Motor vehicle manufacturing","7","0","0","41",
"Oregon","2009","33611 ","Automobile and light duty motor vehicle manufacturing","3","0","0","41",
"Oregon","2009","336111","Automobile manufacturing","2","0","0","41",
"Oregon","2009","33621 ","Motor vehicle body and trailer manufacturing","55","2569","92471","41",
"Oregon","2009","336211","Motor vehicle body manufacturing","15","250","8606","41",
"Oregon","2009","336212","Truck trailer manufacturing","9","356","16592","41",
"Oregon","2009","336214","Travel trailer and camper manufacturing","29","0","58592","41",
"Oregon","2009","3363  ","Motor vehicle parts manufacturing","84","1263","57883","41",
"Oregon","2009","336311","Carburetor, piston, piston ring, and valve manufacturing","2","0","0","41",
"Oregon","2009","336312","Gasoline engine and engine parts manufacturing","18","108","3181","41",
"Oregon","2009","336322","Other motor vehicle electrical and electronic equipment manufacturing","12","419","20860","41",
"Oregon","2009","33634 ","Motor vehicle brake system manufacturing","1","0","0","41",
"Oregon","2009","336350","Motor vehicle transmission and power train parts manufacturing","4","0","0","41",
"Oregon","2009","33637 ","Motor vehicle metal stamping","4","0","0","41",
"Oregon","2009","336399","All other motor vehicle parts manufacturing","31","621","29015","41",
"Oregon","2009","336411","Aircraft manufacturing","14","0","0","41",
"Oregon","2009","336612","Boat building","17","174","5929","41",
"Oregon","2009","33612 ","Heavy duty truck manufacturing","4","0","0","41",
"Oregon","2009","336120","Heavy duty truck manufacturing","4","0","0","41",
"Oregon","2009","3362  ","Motor vehicle body and trailer manufacturing","55","2569","92471","41",
"Oregon","2009","336213","Motor home manufacturing","2","0","0","41",
"Oregon","2009","33631 ","Motor vehicle gasoline engine and engine parts manufacturing","20","111","3282","41",
"Oregon","2009","33632 ","Motor vehicle electrical and electronic equipment manufacturing","14","437","21609","41",
"Oregon","2009","336321","Vehicular lighting equipment manufacturing","2","0","0","41",
"Oregon","2009","33633 ","Motor vehicle steering and suspension components (except spring) manufacturing","4","0","1177","41",
"Oregon","2009","336330","Motor vehicle steering and suspension components (except spring) manufacturing","4","0","1177","41",
"Oregon","2009","336340","Motor vehicle brake system manufacturing","1","0","0","41",
"Oregon","2009","33635 ","Motor vehicle transmission and power train parts manufacturing","4","0","0","41",
"Oregon","2009","33636 ","Motor vehicle seating and interior trim manufacturing","5","0","593","41",
"Oregon","2009","336360","Motor vehicle seating and interior trim manufacturing","5","0","593","41",
"Oregon","2009","336370","Motor vehicle metal stamping","4","0","0","41",
"Oregon","2009","33639 ","Other motor vehicle parts manufacturing","32","622","29038","41",
"Oregon","2009","336391","Motor vehicle air-conditioning manufacturing","1","0","0","41",
"Oregon","2009","3364  ","Aerospace product and parts manufacturing","35","2433","144711","41",
"Oregon","2009","33641 ","Aerospace product and parts manufacturing","35","2433","144711","41",
"Oregon","2009","336412","Aircraft engine and engine parts manufacturing","3","0","0","41",
"Oregon","2009","336413","Other aircraft parts and auxiliary equipment manufacturing","18","1924","128509","41",
"Oregon","2009","3366  ","Ship and boat building","35","1886","90446","41",
"Oregon","2009","33661 ","Ship and boat building","35","1886","90446","41",
"Oregon","2009","336611","Ship building and repairing","18","1712","84517","41",
"Oregon","2009","3369  ","Other transportation equipment manufacturing","22","0","0","41",
"Oregon","2009","33711 ","Wood kitchen cabinet and countertop manufacturing","212","1911","53050","41",
"Oregon","2009","33699 ","Other transportation equipment manufacturing","22","0","0","41",
"Oregon","2009","336991","Motorcycle, bicycle, and parts manufacturing","16","0","0","41",
"Oregon","2009","336999","All other transportation equipment manufacturing","6","0","0","41",
"Oregon","2009","337   ","Furniture and related product manufacturing","381","4759","149777","41",
"Oregon","2009","3371  ","Household and institutional furniture and kitchen cabinet manufacturing","294","2887","82306","41",
"Oregon","2009","337122","Nonupholstered wood household furniture manufacturing","41","295","7836","41",
"Oregon","2009","337127","Institutional furniture manufacturing","14","356","12517","41",
"Oregon","2009","337110","Wood kitchen cabinet and countertop manufacturing","212","1911","53050","41",
"Oregon","2009","33712 ","Household and institutional furniture manufacturing","82","976","29256","41",
"Oregon","2009","337121","Upholstered household furniture manufacturing","15","0","5239","41",
"Oregon","2009","337124","Metal household furniture manufacturing","5","47","2065","41",
"Oregon","2009","337125","Household furniture (except wood and metal) manufacturing","2","0","0","41",
"Oregon","2009","337214","Office furniture (except wood) manufacturing","6","0","0","41",
"Oregon","2009","337129","Wood television, radio, and sewing machine cabinet manufacturing","5","0","0","41",
"Oregon","2009","3372  ","Office furniture (including fixtures) manufacturing","77","1389","49772","41",
"Oregon","2009","33721 ","Office furniture (including fixtures) manufacturing","77","1389","49772","41",
"Oregon","2009","337211","Wood office furniture manufacturing","7","47","1211","41",
"Oregon","2009","337212","Custom architectural woodwork and millwork manufacturing","38","892","33425","41",
"Oregon","2009","337215","Showcase, partition, shelving, and locker manufacturing","26","277","8106","41",
"Oregon","2009","3379  ","Other furniture related product manufacturing","10","483","17699","41",
"Oregon","2009","33792 ","Blind and shade manufacturing","3","0","0","41",
"Oregon","2009","337920","Blind and shade manufacturing","3","0","0","41",
"Oregon","2009","3391  ","Medical equipment and supplies manufacturing","237","3472","171157","41",
"Oregon","2009","33911 ","Medical equipment and supplies manufacturing","237","3472","171157","41",
"Oregon","2009","339114","Dental equipment and supplies manufacturing","19","0","0","41",
"Oregon","2009","3399  ","Other miscellaneous manufacturing","334","3807","122741","41",
"Oregon","2009","33991 ","Jewelry and silverware manufacturing","30","166","3967","41",
"Oregon","2009","339914","Costume jewelry and novelty manufacturing","6","0","508","41",
"Oregon","2009","33993 ","Doll, toy, and game manufacturing","24","190","5440","41",
"Oregon","2009","339941","Pen and mechanical pencil manufacturing","1","0","0","41",
"Oregon","2009","339944","Carbon paper and inked ribbon manufacturing","2","0","0","41",
"Oregon","2009","339993","Fastener, button, needle, and pin manufacturing","2","0","0","41",
"Oregon","2009","33791 ","Mattress manufacturing","7","343","12916","41",
"Oregon","2009","337910","Mattress manufacturing","7","343","12916","41",
"Oregon","2009","339   ","Miscellaneous manufacturing","571","7279","293898","41",
"Oregon","2009","339112","Surgical and medical instrument manufacturing","20","0","0","41",
"Oregon","2009","339113","Surgical appliance and supplies manufacturing","41","713","27648","41",
"Oregon","2009","339115","Ophthalmic goods manufacturing","9","118","4070","41",
"Oregon","2009","339116","Dental laboratories","148","883","28888","41",
"Oregon","2009","339911","Jewelry (except costume) manufacturing","22","0","3362","41",
"Oregon","2009","339913","Jewelers' material and lapidary work manufacturing","2","0","0","41",
"Oregon","2009","33992 ","Sporting and athletic goods manufacturing","48","833","26065","41",
"Oregon","2009","339920","Sporting and athletic goods manufacturing","48","833","26065","41",
"Oregon","2009","339931","Doll and stuffed toy manufacturing","2","0","0","41",
"Oregon","2009","339932","Game, toy, and children's vehicle manufacturing","22","187","5435","41",
"Oregon","2009","33994 ","Office supplies (except paper) manufacturing","14","162","6776","41",
"Oregon","2009","339942","Lead pencil and art good manufacturing","6","0","0","41",
"Oregon","2009","339943","Marking device manufacturing","5","15","391","41",
"Oregon","2009","33995 ","Sign manufacturing","120","1088","34484","41",
"Oregon","2009","339950","Sign manufacturing","120","1088","34484","41",
"Oregon","2009","33999 ","All other miscellaneous manufacturing","98","1368","46009","41",
"Oregon","2009","339991","Gasket, packing, and sealing device manufacturing","6","0","1555","41",
"Oregon","2009","339992","Musical instrument manufacturing","21","239","8927","41",
"Oregon","2009","339994","Broom, brush, and mop manufacturing","3","0","0","41",
"Oregon","2009","423110","Automobile and other motor vehicle merchant wholesalers","108","1431","71355","41",
"Oregon","2009","339999","All other miscellaneous manufacturing","66","794","26724","41",
"Oregon","2009","42    ","Wholesale trade","5610","83014","5146424","41",
"Oregon","2009","423   ","Merchant wholesalers, durable goods","3162","52645","3754121","41",
"Oregon","2009","4231  ","Motor vehicle and motor vehicle parts and supplies merchant wholesalers","325","4551","196458","41",
"Oregon","2009","42311 ","Automobile and other motor vehicle merchant wholesalers","108","1431","71355","41",
"Oregon","2009","423140","Motor vehicle parts (used) merchant wholesalers","22","142","4133","41",
"Oregon","2009","42312 ","Motor vehicle supplies and new parts merchant wholesalers","179","2785","111166","41",
"Oregon","2009","423120","Motor vehicle supplies and new parts merchant wholesalers","179","2785","111166","41",
"Oregon","2009","42313 ","Tire and tube merchant wholesalers","16","193","9804","41",
"Oregon","2009","423130","Tire and tube merchant wholesalers","16","193","9804","41",
"Oregon","2009","42314 ","Motor vehicle parts (used) merchant wholesalers","22","142","4133","41",
"Oregon","2009","4232  ","Furniture and home furnishing merchant wholesalers","110","1120","53356","41",
"Oregon","2009","42331 ","Lumber, plywood, millwork, and wood panel merchant wholesalers","304","3247","190483","41",
"Oregon","2009","42321 ","Furniture merchant wholesalers","41","389","21367","41",
"Oregon","2009","423210","Furniture merchant wholesalers","41","389","21367","41",
"Oregon","2009","42322 ","Home furnishing merchant wholesalers","69","731","31989","41",
"Oregon","2009","423220","Home furnishing merchant wholesalers","69","731","31989","41",
"Oregon","2009","4233  ","Lumber and other construction materials merchant wholesalers","448","4370","244075","41",
"Oregon","2009","423310","Lumber, plywood, millwork, and wood panel merchant wholesalers","304","3247","190483","41",
"Oregon","2009","42332 ","Brick, stone, and related construction material merchant wholesalers","66","438","18932","41",
"Oregon","2009","42333 ","Roofing, siding, and insulation material merchant wholesalers","24","251","14197","41",
"Oregon","2009","423330","Roofing, siding, and insulation material merchant wholesalers","24","251","14197","41",
"Oregon","2009","423390","Other construction material merchant wholesalers","54","434","20463","41",
"Oregon","2009","4234  ","Professional and commercial equipment and supplies merchant wholesalers","378","5986","376736","41",
"Oregon","2009","42342 ","Office equipment merchant wholesalers","76","1696","88258","41",
"Oregon","2009","423430","Computer and computer peripheral equipment and software merchant wholesalers","111","1495","108684","41",
"Oregon","2009","42345 ","Medical, dental, and hospital equipment and supplies merchant wholesalers","81","1238","108747","41",
"Oregon","2009","423460","Ophthalmic goods merchant wholesalers","8","0","7907","41",
"Oregon","2009","4235  ","Metal and mineral (except petroleum) merchant wholesalers","141","2100","104088","41",
"Oregon","2009","423620","Electrical and electronic appliance, television, and radio set merchant wholesalers","42","499","23035","41",
"Oregon","2009","4237  ","Hardware, plumbing and heating equipment and supplies merchant wholesalers","229","2593","128543","41",
