"Guam","2009","424510","Grain and field bean merchant wholesalers","1","0","0","66",
"Guam","2009","42452 ","Livestock merchant wholesalers","1","0","0","66",
"Guam","2009","424520","Livestock merchant wholesalers","1","0","0","66",
"Guam","2009","42459 ","Other farm product raw material merchant wholesalers","2","0","0","66",
"Guam","2009","424590","Other farm product raw material merchant wholesalers","2","0","0","66",
"Guam","2009","4246  ","Chemical and allied products merchant wholesalers","6","35","1172","66",
"Guam","2009","42461 ","Plastics materials and basic forms and shapes merchant wholesalers","1","0","0","66",
"Guam","2009","424610","Plastics materials and basic forms and shapes merchant wholesalers","1","0","0","66",
"Guam","2009","42469 ","Other chemical and allied products merchant wholesalers","5","29","1095","66",
"Guam","2009","424690","Other chemical and allied products merchant wholesalers","5","29","1095","66",
"Guam","2009","4247  ","Petroleum and petroleum products merchant wholesalers","4","153","9297","66",
"Guam","2009","42471 ","Petroleum bulk stations and terminals","1","0","0","66",
"Guam","2009","424710","Petroleum bulk stations and terminals","1","0","0","66",
"Guam","2009","42472 ","Petroleum and petroleum products merchant wholesalers (except bulk stations and terminals)","3","0","0","66",
"Guam","2009","424720","Petroleum and petroleum products merchant wholesalers (except bulk stations and terminals)","3","0","0","66",
"Guam","2009","4248  ","Beer, wine, and distilled alcoholic beverage merchant wholesalers","10","289","8036","66",
"Guam","2009","42481 ","Beer and ale merchant wholesalers","3","0","0","66",
"Guam","2009","424810","Beer and ale merchant wholesalers","3","0","0","66",
"Guam","2009","42482 ","Wine and distilled alcoholic beverage merchant wholesalers","7","101","2553","66",
"Guam","2009","424820","Wine and distilled alcoholic beverage merchant wholesalers","7","101","2553","66",
"Guam","2009","4249  ","Miscellaneous nondurable goods merchant wholesalers","20","236","6902","66",
"Guam","2009","42491 ","Farm supplies merchant wholesalers","2","0","0","66",
"Guam","2009","424910","Farm supplies merchant wholesalers","2","0","0","66",
"Guam","2009","42492 ","Book, periodical, and newspaper merchant wholesalers","1","0","0","66",
"Guam","2009","424920","Book, periodical, and newspaper merchant wholesalers","1","0","0","66",
"Guam","2009","42494 ","Tobacco and tobacco product merchant wholesalers","1","0","0","66",
"Guam","2009","424940","Tobacco and tobacco product merchant wholesalers","1","0","0","66",
"Guam","2009","42495 ","Paint, varnish, and supplies merchant wholesalers","6","68","2251","66",
"Guam","2009","424950","Paint, varnish, and supplies merchant wholesalers","6","68","2251","66",
"Guam","2009","42499 ","Other miscellaneous nondurable goods merchant wholesalers","10","45","960","66",
"Guam","2009","424990","Other miscellaneous nondurable goods merchant wholesalers","10","45","960","66",
"Guam","2009","425   ","Wholesale electronic markets and agents and brokers","7","0","95","66",
"Guam","2009","4251  ","Wholesale electronic markets and agents and brokers","7","0","95","66",
"Guam","2009","42512 ","Wholesale trade agents and brokers","7","0","95","66",
"Guam","2009","425120","Wholesale trade agents and brokers","7","0","95","66",
"Guam","2009","44-45 ","Retail trade","673","8257","170034","66",
"Guam","2009","441   ","Motor vehicle and parts dealers","41","804","22912","66",
"Guam","2009","4411  ","Automobile dealers","10","520","16204","66",
"Guam","2009","44111 ","New car dealers","7","484","15074","66",
"Guam","2009","441110","New car dealers","7","484","15074","66",
"Guam","2009","44112 ","Used car dealers","3","0","0","66",
"Guam","2009","441120","Used car dealers","3","0","0","66",
"Guam","2009","4412  ","Other motor vehicle dealers","6","61","1186","66",
"Guam","2009","44122 ","Motorcycle, boat, and other motor vehicle dealers","6","61","1186","66",
"Guam","2009","441221","Motorcycle, ATV, and personal watercraft dealers","4","44","802","66",
"Guam","2009","441222","Boat dealers","2","0","0","66",
"Guam","2009","4413  ","Automotive parts, accessories, and tire stores","25","0","5522","66",
"Guam","2009","44131 ","Automotive parts and accessories stores","21","0","4816","66",
"Guam","2009","441310","Automotive parts and accessories stores","21","0","4816","66",
"Guam","2009","44132 ","Tire dealers","4","0","0","66",
"Guam","2009","441320","Tire dealers","4","0","0","66",
"Guam","2009","442   ","Furniture and home furnishings stores","21","244","4429","66",
"Guam","2009","4421  ","Furniture stores","14","149","2721","66",
"Guam","2009","44211 ","Furniture stores","14","149","2721","66",
"Guam","2009","442110","Furniture stores","14","149","2721","66",
"Guam","2009","4422  ","Home furnishings stores","7","95","1708","66",
"Guam","2009","44221 ","Floor covering stores","3","32","732","66",
"Guam","2009","442210","Floor covering stores","3","32","732","66",
"Guam","2009","44229 ","Other home furnishings stores","4","0","976","66",
"Guam","2009","442291","Window treatment stores","2","0","0","66",
"Guam","2009","442299","All other home furnishings stores","2","0","0","66",
"Guam","2009","443   ","Electronics and appliance stores","34","454","12428","66",
"Guam","2009","4431  ","Electronics and appliance stores","34","454","12428","66",
"Guam","2009","44311 ","Appliance, television, and other electronics stores","16","244","6974","66",
"Guam","2009","443111","Household appliance stores","5","0","0","66",
"Guam","2009","443112","Radio, television, and other electronics stores","11","221","6404","66",
"Guam","2009","44312 ","Computer and software stores","17","201","5328","66",
"Guam","2009","443120","Computer and software stores","17","201","5328","66",
"Guam","2009","44313 ","Camera and photographic supplies stores","1","0","0","66",
"Guam","2009","443130","Camera and photographic supplies stores","1","0","0","66",
"Guam","2009","444   ","Building material and garden equipment and supplies dealers","32","627","11615","66",
"Guam","2009","4441  ","Building material and supplies dealers","26","580","11054","66",
"Guam","2009","44411 ","Home centers","3","0","0","66",
"Guam","2009","444110","Home centers","3","0","0","66",
"Guam","2009","44412 ","Paint and wallpaper stores","4","37","474","66",
"Guam","2009","444120","Paint and wallpaper stores","4","37","474","66",
"Guam","2009","44413 ","Hardware stores","13","254","4190","66",
"Guam","2009","444130","Hardware stores","13","254","4190","66",
"Guam","2009","44419 ","Other building material dealers","6","38","1062","66",
"Guam","2009","444190","Other building material dealers","6","38","1062","66",
"Guam","2009","4442  ","Lawn and garden equipment and supplies stores","6","0","0","66",
"Guam","2009","44421 ","Outdoor power equipment stores","1","0","0","66",
"Guam","2009","444210","Outdoor power equipment stores","1","0","0","66",
"Guam","2009","44422 ","Nursery, garden center, and farm supply stores","5","0","0","66",
"Guam","2009","444220","Nursery, garden center, and farm supply stores","5","0","0","66",
"Guam","2009","445   ","Food and beverage stores","163","1816","35371","66",
"Guam","2009","4451  ","Grocery stores","132","1680","33699","66",
"Guam","2009","44511 ","Supermarkets and other grocery (except convenience) stores","98","1516","29497","66",
"Guam","2009","445110","Supermarkets and other grocery (except convenience) stores","98","1516","29497","66",
"Guam","2009","44512 ","Convenience stores","34","0","0","66",
"Guam","2009","445120","Convenience stores","34","0","0","66",
"Guam","2009","4452  ","Specialty food stores","23","119","1509","66",
"Guam","2009","44521 ","Meat markets","5","0","460","66",
"Guam","2009","445210","Meat markets","5","0","460","66",
"Guam","2009","44522 ","Fish and seafood markets","2","0","0","66",
"Guam","2009","445220","Fish and seafood markets","2","0","0","66",
"Guam","2009","44523 ","Fruit and vegetable markets","4","0","0","66",
"Guam","2009","445230","Fruit and vegetable markets","4","0","0","66",
"Guam","2009","44529 ","Other specialty food stores","12","62","716","66",
"Guam","2009","445291","Baked goods stores","5","0","0","66",
"Guam","2009","445292","Confectionery and nut stores","5","28","277","66",
"Guam","2009","445299","All other specialty food stores","2","0","0","66",
"Guam","2009","4453  ","Beer, wine, and liquor stores","8","0","0","66",
"Guam","2009","44531 ","Beer, wine, and liquor stores","8","0","0","66",
"Guam","2009","445310","Beer, wine, and liquor stores","8","0","0","66",
"Guam","2009","446   ","Health and personal care stores","36","195","4289","66",
"Guam","2009","4461  ","Health and personal care stores","36","195","4289","66",
"Guam","2009","44611 ","Pharmacies and drug stores","11","74","2000","66",
"Guam","2009","446110","Pharmacies and drug stores","11","74","2000","66",
"Guam","2009","44612 ","Cosmetics, beauty supplies, and perfume stores","5","20","256","66",
"Guam","2009","446120","Cosmetics, beauty supplies, and perfume stores","5","20","256","66",
"Guam","2009","44613 ","Optical goods stores","4","21","511","66",
"Guam","2009","446130","Optical goods stores","4","21","511","66",
"Guam","2009","44619 ","Other health and personal care stores","16","80","1522","66",
"Guam","2009","446191","Food (health) supplement stores","13","70","1315","66",
"Guam","2009","446199","All other health and personal care stores","3","0","0","66",
"Guam","2009","447   ","Gasoline stations","46","520","7889","66",
"Guam","2009","4471  ","Gasoline stations","46","520","7889","66",
"Guam","2009","44711 ","Gasoline stations with convenience stores","45","518","7836","66",
"Guam","2009","447110","Gasoline stations with convenience stores","45","518","7836","66",
"Guam","2009","44719 ","Other gasoline stations","1","0","0","66",
"Guam","2009","447190","Other gasoline stations","1","0","0","66",
"Guam","2009","448   ","Clothing and clothing accessories stores","134","1235","24129","66",
"Guam","2009","4481  ","Clothing stores","63","666","10574","66",
"Guam","2009","44811 ","Men's clothing stores","7","52","874","66",
"Guam","2009","448110","Men's clothing stores","7","52","874","66",
"Guam","2009","44812 ","Women's clothing stores","26","291","5310","66",
"Guam","2009","448120","Women's clothing stores","26","291","5310","66",
"Guam","2009","44813 ","Children's and infants' clothing stores","3","0","73","66",
"Guam","2009","448130","Children's and infants' clothing stores","3","0","73","66",
"Guam","2009","44814 ","Family clothing stores","18","255","3247","66",
"Guam","2009","448140","Family clothing stores","18","255","3247","66",
"Guam","2009","44815 ","Clothing accessories stores","5","0","0","66",
"Guam","2009","448150","Clothing accessories stores","5","0","0","66",
"Guam","2009","44819 ","Other clothing stores","4","0","0","66",
"Guam","2009","448190","Other clothing stores","4","0","0","66",
"Guam","2009","4482  ","Shoe stores","10","132","2264","66",
"Guam","2009","44821 ","Shoe stores","10","132","2264","66",
"Guam","2009","448210","Shoe stores","10","132","2264","66",
"Guam","2009","4483  ","Jewelry, luggage, and leather goods stores","61","437","11291","66",
"Guam","2009","44831 ","Jewelry stores","42","221","5903","66",
"Guam","2009","448310","Jewelry stores","42","221","5903","66",
"Guam","2009","44832 ","Luggage and leather goods stores","19","216","5388","66",
"Guam","2009","448320","Luggage and leather goods stores","19","216","5388","66",
"Guam","2009","451   ","Sporting goods, hobby, book, and music stores","45","358","5311","66",
"Guam","2009","4511  ","Sporting goods, hobby, and musical instrument stores","33","259","4166","66",
"Guam","2009","45111 ","Sporting goods stores","26","216","3592","66",
"Guam","2009","451110","Sporting goods stores","26","216","3592","66",
"Guam","2009","45112 ","Hobby, toy, and game stores","4","0","0","66",
"Guam","2009","451120","Hobby, toy, and game stores","4","0","0","66",
"Guam","2009","45113 ","Sewing, needlework, and piece goods stores","1","0","0","66",
"Guam","2009","451130","Sewing, needlework, and piece goods stores","1","0","0","66",
"Guam","2009","45114 ","Musical instrument and supplies stores","2","0","0","66",
"Guam","2009","451140","Musical instrument and supplies stores","2","0","0","66",
"Guam","2009","4512  ","Book, periodical, and music stores","12","99","1145","66",
"Guam","2009","45121 ","Book stores and news dealers","10","94","1101","66",
"Guam","2009","451211","Book stores","9","52","604","66",
"Guam","2009","451212","News dealers and newsstands","1","0","0","66",
"Guam","2009","45122 ","Prerecorded tape, compact disc, and record stores","2","0","0","66",
"Guam","2009","451220","Prerecorded tape, compact disc, and record stores","2","0","0","66",
"Guam","2009","452   ","General merchandise stores","37","1553","34032","66",
"Guam","2009","4521  ","Department stores","5","838","11817","66",
"Guam","2009","45211 ","Department stores","5","838","11817","66",
"Guam","2009","452111","Department stores (except discount department stores)","3","403","4425","66",
"Guam","2009","452112","Discount department stores","2","0","0","66",
"Guam","2009","4529  ","Other general merchandise stores","32","0","0","66",
"Guam","2009","45291 ","Warehouse clubs and supercenters","1","0","0","66",
"Guam","2009","452910","Warehouse clubs and supercenters","1","0","0","66",
"Guam","2009","45299 ","All other general merchandise stores","31","0","0","66",
"Guam","2009","452990","All other general merchandise stores","31","0","0","66",
"Guam","2009","453   ","Miscellaneous store retailers","78","394","5930","66",
"Guam","2009","4531  ","Florists","6","46","731","66",
"Guam","2009","45311 ","Florists","6","46","731","66",
"Guam","2009","453110","Florists","6","46","731","66",
"Guam","2009","4532  ","Office supplies, stationery, and gift stores","54","266","3675","66",
"Guam","2009","45321 ","Office supplies and stationery stores","6","0","0","66",
"Guam","2009","453210","Office supplies and stationery stores","6","0","0","66",
"Guam","2009","45322 ","Gift, novelty, and souvenir stores","48","218","2675","66",
"Guam","2009","453220","Gift, novelty, and souvenir stores","48","218","2675","66",
"Guam","2009","4533  ","Used merchandise stores","2","0","0","66",
"Guam","2009","45331 ","Used merchandise stores","2","0","0","66",
"Guam","2009","453310","Used merchandise stores","2","0","0","66",
"Guam","2009","4539  ","Other miscellaneous store retailers","16","0","1192","66",
"Guam","2009","45391 ","Pet and pet supplies stores","10","0","620","66",
"Guam","2009","453910","Pet and pet supplies stores","10","0","620","66",
"Guam","2009","45392 ","Art dealers","1","0","0","66",
"Guam","2009","453920","Art dealers","1","0","0","66",
"Guam","2009","45399 ","All other miscellaneous store retailers","5","0","546","66",
"Guam","2009","453991","Tobacco stores","2","0","0","66",
"Guam","2009","453998","All other miscellaneous store retailers (except tobacco stores)","3","0","0","66",
"Guam","2009","454   ","Nonstore retailers","6","0","0","66",
"Guam","2009","4541  ","Electronic shopping and mail-order houses","1","0","0","66",
"Guam","2009","45411 ","Electronic shopping and mail-order houses","1","0","0","66",
"Guam","2009","454111","Electronic shopping","1","0","0","66",
"Guam","2009","4543  ","Direct selling establishments","5","0","0","66",
"Guam","2009","45431 ","Fuel dealers","3","0","0","66",
"Guam","2009","454312","Liquefied petroleum gas (bottled gas) dealers","3","0","0","66",
"Guam","2009","45439 ","Other direct selling establishments","2","0","0","66",
"Guam","2009","454390","Other direct selling establishments","2","0","0","66",
"Guam","2009","48-49 ","Transportation and warehousing","90","2787","101141","66",
"Guam","2009","481   ","Air transportation","10","0","0","66",
"Guam","2009","4811  ","Scheduled air transportation","6","0","0","66",
"Guam","2009","48111 ","Scheduled air transportation","6","0","0","66",
"Guam","2009","481111","Scheduled passenger air transportation","6","0","0","66",
"Guam","2009","4812  ","Nonscheduled air transportation","4","66","4035","66",
"Guam","2009","48121 ","Nonscheduled air transportation","4","66","4035","66",
"Guam","2009","481211","Nonscheduled chartered passenger air transportation","2","0","0","66",
"Guam","2009","481212","Nonscheduled chartered freight air transportation","1","0","0","66",
"Guam","2009","481219","Other nonscheduled air transportation","1","0","0","66",
"Guam","2009","483   ","Water transportation","3","0","0","66",
"Guam","2009","4831  ","Deep sea, coastal, and great lakes water transportation","3","0","0","66",
"Guam","2009","48311 ","Deep sea, coastal, and great lakes water transportation","3","0","0","66",
"Guam","2009","483113","Coastal and great lakes freight transportation","1","0","0","66",
"Guam","2009","483114","Coastal and great lakes passenger transportation","2","0","0","66",
"Guam","2009","484   ","Truck transportation","13","319","7622","66",
"Guam","2009","4841  ","General freight trucking","9","243","5472","66",
"Guam","2009","48411 ","General freight trucking, local","8","243","5460","66",
"Guam","2009","484110","General freight trucking, local","8","243","5460","66",
"Guam","2009","48412 ","General freight trucking, long-distance","1","0","0","66",
"Guam","2009","484121","General freight trucking, long-distance, truckload","1","0","0","66",
"Guam","2009","4842  ","Specialized freight trucking","4","0","0","66",
"Guam","2009","48421 ","Used household and office goods moving","3","0","0","66",
"Guam","2009","484210","Used household and office goods moving","3","0","0","66",
"Guam","2009","48422 ","Specialized freight (except used goods) trucking, local","1","0","0","66",
"Guam","2009","484220","Specialized freight (except used goods) trucking, local","1","0","0","66",
"Guam","2009","485   ","Transit and ground passenger transportation","13","0","0","66",
"Guam","2009","4853  ","Taxi and limousine service","4","0","184","66",
"Guam","2009","48531 ","Taxi service","3","0","166","66",
"Guam","2009","485310","Taxi service","3","0","166","66",
"Guam","2009","48532 ","Limousine service","1","0","0","66",
"Guam","2009","485320","Limousine service","1","0","0","66",
"Guam","2009","4859  ","Other transit and ground passenger transportation","9","0","0","66",
"Guam","2009","48599 ","Other transit and ground passenger transportation","9","0","0","66",
"Guam","2009","485991","Special needs transportation","3","0","0","66",
"Guam","2009","485999","All other transit and ground passenger transportation","6","0","0","66",
"Guam","2009","487   ","Scenic and sightseeing transportation","7","0","0","66",
"Guam","2009","4871  ","Scenic and sightseeing transportation, land","3","0","0","66",
"Guam","2009","48711 ","Scenic and sightseeing transportation, land","3","0","0","66",
"Guam","2009","487110","Scenic and sightseeing transportation, land","3","0","0","66",
"Guam","2009","4872  ","Scenic and sightseeing transportation, water","4","0","0","66",
"Guam","2009","48721 ","Scenic and sightseeing transportation, water","4","0","0","66",
"Guam","2009","487210","Scenic and sightseeing transportation, water","4","0","0","66",
"Guam","2009","488   ","Support activities for transportation","29","686","18490","66",
"Guam","2009","4881  ","Support activities for air transportation","7","485","11779","66",
"Guam","2009","48811 ","Airport operations","7","485","11779","66",
"Guam","2009","488111","Air traffic control","1","0","0","66",
"Guam","2009","488119","Other airport operations","6","479","11328","66",
"Guam","2009","4883  ","Support activities for water transportation","2","0","0","66",
"Guam","2009","48833 ","Navigational services to shipping","1","0","0","66",
"Guam","2009","488330","Navigational services to shipping","1","0","0","66",
"Guam","2009","48839 ","Other support activities for water transportation","1","0","0","66",
"Guam","2009","488390","Other support activities for water transportation","1","0","0","66",
"Guam","2009","4884  ","Support activities for road transportation","2","0","0","66",
"Guam","2009","48841 ","Motor vehicle towing","2","0","0","66",
"Guam","2009","488410","Motor vehicle towing","2","0","0","66",
"Guam","2009","4885  ","Freight transportation arrangement","17","135","3928","66",
"Guam","2009","48851 ","Freight transportation arrangement","17","135","3928","66",
"Guam","2009","488510","Freight transportation arrangement","17","135","3928","66",
"Guam","2009","4889  ","Other support activities for transportation","1","0","0","66",
"Guam","2009","48899 ","Other support activities for transportation","1","0","0","66",
"Guam","2009","488991","Packing and crating","1","0","0","66",
"Guam","2009","492   ","Couriers and messengers","7","0","1418","66",
"Guam","2009","4921  ","Couriers and express delivery services","4","0","0","66",
"Guam","2009","49211 ","Couriers and express delivery services","4","0","0","66",
"Guam","2009","492110","Couriers and express delivery services","4","0","0","66",
"Guam","2009","4922  ","Local messengers and local delivery","3","0","0","66",
"Guam","2009","49221 ","Local messengers and local delivery","3","0","0","66",
"Guam","2009","492210","Local messengers and local delivery","3","0","0","66",
"Guam","2009","493   ","Warehousing and storage","8","0","0","66",
"Guam","2009","4931  ","Warehousing and storage","8","0","0","66",
"Guam","2009","49311 ","General warehousing and storage","6","0","0","66",
"Guam","2009","493110","General warehousing and storage","6","0","0","66",
"Guam","2009","49319 ","Other warehousing and storage","2","0","0","66",
"Guam","2009","493190","Other warehousing and storage","2","0","0","66",
"Guam","2009","51    ","Information","56","1306","45038","66",
"Guam","2009","511   ","Publishing industries (except Internet)","8","0","0","66",
"Guam","2009","5111  ","Newspaper, periodical, book, and directory publishers","8","0","0","66",
"Guam","2009","51111 ","Newspaper publishers","2","0","0","66",
"Guam","2009","511110","Newspaper publishers","2","0","0","66",
"Guam","2009","51112 ","Periodical publishers","4","52","1088","66",
"Guam","2009","511120","Periodical publishers","4","52","1088","66",
"Guam","2009","51114 ","Directory and mailing list publishers","2","0","0","66",
"Guam","2009","511140","Directory and mailing list publishers","2","0","0","66",
"Guam","2009","512   ","Motion picture and sound recording industries","10","141","2691","66",
"Guam","2009","5121  ","Motion picture and video industries","10","141","2691","66",
"Guam","2009","51211 ","Motion picture and video production","8","55","1680","66",
"Guam","2009","512110","Motion picture and video production","8","55","1680","66",
"Guam","2009","51213 ","Motion picture and video exhibition","2","0","0","66",
"Guam","2009","512131","Motion picture theaters (except drive-ins)","2","0","0","66",
"Guam","2009","515   ","Broadcasting (except Internet)","16","399","12586","66",
"Guam","2009","5151  ","Radio and television broadcasting","13","177","5601","66",
"Guam","2009","51511 ","Radio broadcasting","11","161","5139","66",
"Guam","2009","515112","Radio stations","11","161","5139","66",
"Guam","2009","51512 ","Television broadcasting","2","0","0","66",
"Guam","2009","515120","Television broadcasting","2","0","0","66",
"Guam","2009","5152  ","Cable and other subscription programming","3","0","0","66",
"Guam","2009","51521 ","Cable and other subscription programming","3","0","0","66",
"Guam","2009","515210","Cable and other subscription programming","3","0","0","66",
"Guam","2009","517   ","Telecommunications","16","0","0","66",
"Guam","2009","5171  ","Wired telecommunications carriers","7","0","0","66",
"Guam","2009","51711 ","Wired telecommunications carriers","7","0","0","66",
"Guam","2009","517110","Wired telecommunications carriers","7","0","0","66",
"Guam","2009","5172  ","Wireless telecommunications carriers (except satellite)","5","0","0","66",
"Guam","2009","51721 ","Wireless telecommunications carriers (except satellite)","5","0","0","66",
"Guam","2009","517210","Wireless telecommunications carriers (except satellite)","5","0","0","66",
"Guam","2009","5179  ","Other telecommunications","4","0","0","66",
"Guam","2009","51791 ","Other telecommunications","4","0","0","66",
"Guam","2009","517911","Telecommunications resellers","1","0","0","66",
"Guam","2009","517919","All other telecommunications","3","0","0","66",
"Guam","2009","518   ","Data processing, hosting and related services","2","0","0","66",
"Guam","2009","5182  ","Data processing, hosting, and related services","2","0","0","66",
"Guam","2009","51821 ","Data processing, hosting, and related services","2","0","0","66",
"Guam","2009","518210","Data processing, hosting, and related services","2","0","0","66",
"Guam","2009","519   ","Other information services","4","0","278","66",
"Guam","2009","5191  ","Other information services","4","0","278","66",
"Guam","2009","51912 ","Libraries and archives","1","0","0","66",
"Guam","2009","519120","Libraries and archives","1","0","0","66",
"Guam","2009","51913 ","Internet publishing and broadcasting and web search portals","3","6","195","66",
"Guam","2009","519130","Internet publishing and broadcasting and web search portals","3","6","195","66",
"Guam","2009","52    ","Finance and insurance","130","1977","76363","66",
"Guam","2009","522   ","Credit intermediation and related activities","68","1215","44605","66",
"Guam","2009","5221  ","Depository credit intermediation","35","954","36787","66",
"Guam","2009","52211 ","Commercial banking","25","707","27881","66",
"Guam","2009","522110","Commercial banking","25","707","27881","66",
"Guam","2009","52212 ","Savings institutions","4","0","0","66",
"Guam","2009","522120","Savings institutions","4","0","0","66",
"Guam","2009","52213 ","Credit unions","6","169","5787","66",
"Guam","2009","522130","Credit unions","6","169","5787","66",
