"New Hampshire","2008","42372 ","Plumbing and heating equipment and supplies (hydronics) merchant wholesalers","56","652","34205","33",
"New Hampshire","2008","423720","Plumbing and heating equipment and supplies (hydronics) merchant wholesalers","56","652","34205","33",
"New Hampshire","2008","42373 ","Warm air heating and air-conditioning equipment and supplies merchant wholesalers","23","198","11150","33",
"New Hampshire","2008","42374 ","Refrigeration equipment and supplies merchant wholesalers","3","0","0","33",
"New Hampshire","2008","423740","Refrigeration equipment and supplies merchant wholesalers","3","0","0","33",
"New Hampshire","2008","423810","Construction and mining (except oil well) machinery and equipment merchant wholesalers","30","461","24049","33",
"New Hampshire","2008","42382 ","Farm and garden machinery and equipment merchant wholesalers","27","363","15105","33",
"New Hampshire","2008","423820","Farm and garden machinery and equipment merchant wholesalers","27","363","15105","33",
"New Hampshire","2008","42383 ","Industrial machinery and equipment merchant wholesalers","126","980","57681","33",
"New Hampshire","2008","42384 ","Industrial supplies merchant wholesalers","47","420","27449","33",
"New Hampshire","2008","423840","Industrial supplies merchant wholesalers","47","420","27449","33",
"New Hampshire","2008","423860","Transportation equipment and supplies (except motor vehicle) merchant wholesalers","13","0","7042","33",
"New Hampshire","2008","4239  ","Miscellaneous durable goods merchant wholesalers","128","1684","92820","33",
"New Hampshire","2008","42391 ","Sporting and recreational goods and supplies merchant wholesalers","33","501","31948","33",
"New Hampshire","2008","42392 ","Toy and hobby goods and supplies merchant wholesalers","12","173","6699","33",
"New Hampshire","2008","423920","Toy and hobby goods and supplies merchant wholesalers","12","173","6699","33",
"New Hampshire","2008","42394 ","Jewelry, watch, precious stone, and precious metal merchant wholesalers","12","83","3327","33",
"New Hampshire","2008","424110","Printing and writing paper merchant wholesalers","3","0","0","33",
"New Hampshire","2008","42412 ","Stationery and office supplies merchant wholesalers","27","371","16941","33",
"New Hampshire","2008","424120","Stationery and office supplies merchant wholesalers","27","371","16941","33",
"New Hampshire","2008","4242  ","Drugs and druggists' sundries merchant wholesalers","22","494","29046","33",
"New Hampshire","2008","42421 ","Drugs and druggists' sundries merchant wholesalers","22","494","29046","33",
"New Hampshire","2008","424210","Drugs and druggists' sundries merchant wholesalers","22","494","29046","33",
"New Hampshire","2008","4243  ","Apparel, piece goods, and notions merchant wholesalers","39","918","52278","33",
"New Hampshire","2008","424320","Men's and boys' clothing and furnishings merchant wholesalers","13","204","6222","33",
"New Hampshire","2008","42433 ","Women's, children's, and infants' clothing and accessories merchant wholesalers","9","0","0","33",
"New Hampshire","2008","42441 ","General line grocery merchant wholesalers","3","0","0","33",
"New Hampshire","2008","42443 ","Dairy product (except dried or canned) merchant wholesalers","7","79","3480","33",
"New Hampshire","2008","424430","Dairy product (except dried or canned) merchant wholesalers","7","79","3480","33",
"New Hampshire","2008","42446 ","Fish and seafood merchant wholesalers","8","101","4142","33",
"New Hampshire","2008","424460","Fish and seafood merchant wholesalers","8","101","4142","33",
"New Hampshire","2008","42449 ","Other grocery and related products merchant wholesalers","52","984","47068","33",
"New Hampshire","2008","42459 ","Other farm product raw material merchant wholesalers","3","8","144","33",
"New Hampshire","2008","424590","Other farm product raw material merchant wholesalers","3","8","144","33",
"New Hampshire","2008","424610","Plastics materials and basic forms and shapes merchant wholesalers","21","300","15247","33",
"New Hampshire","2008","424710","Petroleum bulk stations and terminals","19","646","32098","33",
"New Hampshire","2008","424310","Piece goods, notions, and other dry goods merchant wholesalers","5","62","2823","33",
"New Hampshire","2008","42432 ","Men's and boys' clothing and furnishings merchant wholesalers","13","204","6222","33",
"New Hampshire","2008","424330","Women's, children's, and infants' clothing and accessories merchant wholesalers","9","0","0","33",
"New Hampshire","2008","42434 ","Footwear merchant wholesalers","12","460","32674","33",
"New Hampshire","2008","424340","Footwear merchant wholesalers","12","460","32674","33",
"New Hampshire","2008","4244  ","Grocery and related product merchant wholesalers","102","2659","122166","33",
"New Hampshire","2008","424410","General line grocery merchant wholesalers","3","0","0","33",
"New Hampshire","2008","42442 ","Packaged frozen food merchant wholesalers","9","0","0","33",
"New Hampshire","2008","424420","Packaged frozen food merchant wholesalers","9","0","0","33",
"New Hampshire","2008","42444 ","Poultry and poultry product merchant wholesalers","4","0","0","33",
"New Hampshire","2008","424440","Poultry and poultry product merchant wholesalers","4","0","0","33",
"New Hampshire","2008","42445 ","Confectionery merchant wholesalers","6","0","0","33",
"New Hampshire","2008","424450","Confectionery merchant wholesalers","6","0","0","33",
"New Hampshire","2008","42447 ","Meat and meat product merchant wholesalers","2","0","0","33",
"New Hampshire","2008","424470","Meat and meat product merchant wholesalers","2","0","0","33",
"New Hampshire","2008","42448 ","Fresh fruit and vegetable merchant wholesalers","11","191","5932","33",
"New Hampshire","2008","424480","Fresh fruit and vegetable merchant wholesalers","11","191","5932","33",
"New Hampshire","2008","424490","Other grocery and related products merchant wholesalers","52","984","47068","33",
"New Hampshire","2008","4245  ","Farm product raw material merchant wholesalers","3","8","144","33",
"New Hampshire","2008","4246  ","Chemical and allied products merchant wholesalers","64","638","41553","33",
"New Hampshire","2008","42461 ","Plastics materials and basic forms and shapes merchant wholesalers","21","300","15247","33",
"New Hampshire","2008","42469 ","Other chemical and allied products merchant wholesalers","43","338","26306","33",
"New Hampshire","2008","424690","Other chemical and allied products merchant wholesalers","43","338","26306","33",
"New Hampshire","2008","4247  ","Petroleum and petroleum products merchant wholesalers","27","678","34373","33",
"New Hampshire","2008","42471 ","Petroleum bulk stations and terminals","19","646","32098","33",
"New Hampshire","2008","4248  ","Beer, wine, and distilled alcoholic beverage merchant wholesalers","15","947","52813","33",
"New Hampshire","2008","424820","Wine and distilled alcoholic beverage merchant wholesalers","6","0","0","33",
"New Hampshire","2008","424920","Book, periodical, and newspaper merchant wholesalers","13","501","16982","33",
"New Hampshire","2008","42472 ","Petroleum and petroleum products merchant wholesalers (except bulk stations and terminals)","8","0","2275","33",
"New Hampshire","2008","424720","Petroleum and petroleum products merchant wholesalers (except bulk stations and terminals)","8","0","2275","33",
"New Hampshire","2008","42481 ","Beer and ale merchant wholesalers","9","836","38824","33",
"New Hampshire","2008","424810","Beer and ale merchant wholesalers","9","836","38824","33",
"New Hampshire","2008","42482 ","Wine and distilled alcoholic beverage merchant wholesalers","6","0","0","33",
"New Hampshire","2008","4249  ","Miscellaneous nondurable goods merchant wholesalers","81","1404","48120","33",
"New Hampshire","2008","42491 ","Farm supplies merchant wholesalers","13","72","2292","33",
"New Hampshire","2008","424910","Farm supplies merchant wholesalers","13","72","2292","33",
"New Hampshire","2008","42492 ","Book, periodical, and newspaper merchant wholesalers","13","501","16982","33",
"New Hampshire","2008","42493 ","Flower, nursery stock, and florists' supplies merchant wholesalers","13","109","2500","33",
"New Hampshire","2008","424940","Tobacco and tobacco product merchant wholesalers","8","0","0","33",
"New Hampshire","2008","42495 ","Paint, varnish, and supplies merchant wholesalers","2","0","0","33",
"New Hampshire","2008","4251  ","Wholesale electronic markets and agents and brokers","281","1018","67456","33",
"New Hampshire","2008","42512 ","Wholesale trade agents and brokers","280","1017","67427","33",
"New Hampshire","2008","425120","Wholesale trade agents and brokers","280","1017","67427","33",
"New Hampshire","2008","44-45 ","Retail trade","6473","101591","2436953","33",
"New Hampshire","2008","44112 ","Used car dealers","158","900","30194","33",
"New Hampshire","2008","441120","Used car dealers","158","900","30194","33",
"New Hampshire","2008","441222","Boat dealers","39","345","13511","33",
"New Hampshire","2008","44131 ","Automotive parts and accessories stores","222","2101","59331","33",
"New Hampshire","2008","441310","Automotive parts and accessories stores","222","2101","59331","33",
"New Hampshire","2008","442   ","Furniture and home furnishings stores","387","3267","83586","33",
"New Hampshire","2008","4421  ","Furniture stores","163","1322","38940","33",
"New Hampshire","2008","442210","Floor covering stores","87","430","15359","33",
"New Hampshire","2008","424930","Flower, nursery stock, and florists' supplies merchant wholesalers","13","109","2500","33",
"New Hampshire","2008","42494 ","Tobacco and tobacco product merchant wholesalers","8","0","0","33",
"New Hampshire","2008","424950","Paint, varnish, and supplies merchant wholesalers","2","0","0","33",
"New Hampshire","2008","42499 ","Other miscellaneous nondurable goods merchant wholesalers","32","116","4693","33",
"New Hampshire","2008","424990","Other miscellaneous nondurable goods merchant wholesalers","32","116","4693","33",
"New Hampshire","2008","425   ","Wholesale electronic markets and agents and brokers","281","1018","67456","33",
"New Hampshire","2008","42511 ","Business to business electronic markets","1","0","0","33",
"New Hampshire","2008","425110","Business to business electronic markets","1","0","0","33",
"New Hampshire","2008","441   ","Motor vehicle and parts dealers","803","12840","496377","33",
"New Hampshire","2008","4411  ","Automobile dealers","343","8380","351489","33",
"New Hampshire","2008","44111 ","New car dealers","185","7480","321295","33",
"New Hampshire","2008","441110","New car dealers","185","7480","321295","33",
"New Hampshire","2008","4412  ","Other motor vehicle dealers","144","1447","51467","33",
"New Hampshire","2008","44121 ","Recreational vehicle dealers","29","257","7830","33",
"New Hampshire","2008","441210","Recreational vehicle dealers","29","257","7830","33",
"New Hampshire","2008","44122 ","Motorcycle, boat, and other motor vehicle dealers","115","1190","43637","33",
"New Hampshire","2008","441221","Motorcycle, ATV, and personal watercraft dealers","58","724","25798","33",
"New Hampshire","2008","441229","All other motor vehicle dealers","18","121","4328","33",
"New Hampshire","2008","4413  ","Automotive parts, accessories, and tire stores","316","3013","93421","33",
"New Hampshire","2008","44132 ","Tire dealers","94","0","34090","33",
"New Hampshire","2008","441320","Tire dealers","94","0","34090","33",
"New Hampshire","2008","44211 ","Furniture stores","163","1322","38940","33",
"New Hampshire","2008","442110","Furniture stores","163","1322","38940","33",
"New Hampshire","2008","4422  ","Home furnishings stores","224","1945","44646","33",
"New Hampshire","2008","44221 ","Floor covering stores","87","430","15359","33",
"New Hampshire","2008","443   ","Electronics and appliance stores","311","3024","72005","33",
"New Hampshire","2008","443111","Household appliance stores","57","339","14790","33",
"New Hampshire","2008","44229 ","Other home furnishings stores","137","1515","29287","33",
"New Hampshire","2008","442291","Window treatment stores","12","43","687","33",
"New Hampshire","2008","442299","All other home furnishings stores","125","1472","28600","33",
"New Hampshire","2008","4431  ","Electronics and appliance stores","311","3024","72005","33",
"New Hampshire","2008","44311 ","Appliance, television, and other electronics stores","215","2311","53430","33",
"New Hampshire","2008","443112","Radio, television, and other electronics stores","158","1972","38640","33",
"New Hampshire","2008","44312 ","Computer and software stores","77","610","16059","33",
"New Hampshire","2008","4441  ","Building material and supplies dealers","471","9134","290361","33",
"New Hampshire","2008","444120","Paint and wallpaper stores","35","215","8118","33",
"New Hampshire","2008","44413 ","Hardware stores","117","930","22766","33",
"New Hampshire","2008","44419 ","Other building material dealers","258","3261","141154","33",
"New Hampshire","2008","444210","Outdoor power equipment stores","43","284","9247","33",
"New Hampshire","2008","445   ","Food and beverage stores","706","22699","393297","33",
"New Hampshire","2008","4451  ","Grocery stores","483","21050","361729","33",
"New Hampshire","2008","44511 ","Supermarkets and other grocery (except convenience) stores","270","19913","343960","33",
"New Hampshire","2008","445110","Supermarkets and other grocery (except convenience) stores","270","19913","343960","33",
"New Hampshire","2008","4452  ","Specialty food stores","132","855","15973","33",
"New Hampshire","2008","443120","Computer and software stores","77","610","16059","33",
"New Hampshire","2008","44313 ","Camera and photographic supplies stores","19","0","2516","33",
"New Hampshire","2008","443130","Camera and photographic supplies stores","19","0","2516","33",
"New Hampshire","2008","444   ","Building material and garden equipment and supplies dealers","615","10081","319330","33",
"New Hampshire","2008","44411 ","Home centers","61","0","0","33",
"New Hampshire","2008","444110","Home centers","61","0","0","33",
"New Hampshire","2008","44412 ","Paint and wallpaper stores","35","215","8118","33",
"New Hampshire","2008","444130","Hardware stores","117","930","22766","33",
"New Hampshire","2008","444190","Other building material dealers","258","3261","141154","33",
"New Hampshire","2008","4442  ","Lawn and garden equipment and supplies stores","144","947","28969","33",
"New Hampshire","2008","44421 ","Outdoor power equipment stores","43","284","9247","33",
"New Hampshire","2008","44422 ","Nursery, garden center, and farm supply stores","101","663","19722","33",
"New Hampshire","2008","444220","Nursery, garden center, and farm supply stores","101","663","19722","33",
"New Hampshire","2008","44512 ","Convenience stores","213","1137","17769","33",
"New Hampshire","2008","445120","Convenience stores","213","1137","17769","33",
"New Hampshire","2008","44521 ","Meat markets","25","286","6488","33",
"New Hampshire","2008","445210","Meat markets","25","286","6488","33",
"New Hampshire","2008","445291","Baked goods stores","13","44","795","33",
"New Hampshire","2008","4453  ","Beer, wine, and liquor stores","91","0","0","33",
"New Hampshire","2008","44531 ","Beer, wine, and liquor stores","91","0","0","33",
"New Hampshire","2008","4461  ","Health and personal care stores","384","4691","134950","33",
"New Hampshire","2008","44611 ","Pharmacies and drug stores","175","3521","107001","33",
"New Hampshire","2008","446191","Food (health) supplement stores","44","199","3979","33",
"New Hampshire","2008","44522 ","Fish and seafood markets","14","83","2011","33",
"New Hampshire","2008","445220","Fish and seafood markets","14","83","2011","33",
"New Hampshire","2008","44523 ","Fruit and vegetable markets","12","161","2142","33",
"New Hampshire","2008","445230","Fruit and vegetable markets","12","161","2142","33",
"New Hampshire","2008","44529 ","Other specialty food stores","81","325","5332","33",
"New Hampshire","2008","445292","Confectionery and nut stores","39","198","2328","33",
"New Hampshire","2008","445299","All other specialty food stores","29","83","2209","33",
"New Hampshire","2008","445310","Beer, wine, and liquor stores","91","0","0","33",
"New Hampshire","2008","446   ","Health and personal care stores","384","4691","134950","33",
"New Hampshire","2008","446110","Pharmacies and drug stores","175","3521","107001","33",
"New Hampshire","2008","44612 ","Cosmetics, beauty supplies, and perfume stores","43","343","5221","33",
"New Hampshire","2008","446120","Cosmetics, beauty supplies, and perfume stores","43","343","5221","33",
"New Hampshire","2008","44613 ","Optical goods stores","66","0","9026","33",
"New Hampshire","2008","446130","Optical goods stores","66","0","9026","33",
"New Hampshire","2008","44619 ","Other health and personal care stores","100","432","13702","33",
"New Hampshire","2008","446199","All other health and personal care stores","56","233","9723","33",
"New Hampshire","2008","447110","Gasoline stations with convenience stores","513","4227","68826","33",
"New Hampshire","2008","44719 ","Other gasoline stations","121","727","15873","33",
"New Hampshire","2008","448110","Men's clothing stores","26","188","4665","33",
"New Hampshire","2008","447   ","Gasoline stations","634","4954","84699","33",
"New Hampshire","2008","4471  ","Gasoline stations","634","4954","84699","33",
"New Hampshire","2008","44711 ","Gasoline stations with convenience stores","513","4227","68826","33",
"New Hampshire","2008","447190","Other gasoline stations","121","727","15873","33",
"New Hampshire","2008","448   ","Clothing and clothing accessories stores","768","8926","132150","33",
"New Hampshire","2008","4481  ","Clothing stores","470","6790","89816","33",
"New Hampshire","2008","44811 ","Men's clothing stores","26","188","4665","33",
"New Hampshire","2008","44812 ","Women's clothing stores","164","1704","21086","33",
"New Hampshire","2008","44814 ","Family clothing stores","148","3651","45408","33",
"New Hampshire","2008","448140","Family clothing stores","148","3651","45408","33",
"New Hampshire","2008","4482  ","Shoe stores","140","1078","16633","33",
"New Hampshire","2008","44821 ","Shoe stores","140","1078","16633","33",
"New Hampshire","2008","44832 ","Luggage and leather goods stores","9","0","0","33",
"New Hampshire","2008","448120","Women's clothing stores","164","1704","21086","33",
"New Hampshire","2008","44813 ","Children's and infants' clothing stores","39","588","6341","33",
"New Hampshire","2008","448130","Children's and infants' clothing stores","39","588","6341","33",
"New Hampshire","2008","44815 ","Clothing accessories stores","35","0","3398","33",
"New Hampshire","2008","448150","Clothing accessories stores","35","0","3398","33",
"New Hampshire","2008","44819 ","Other clothing stores","58","538","8918","33",
"New Hampshire","2008","448190","Other clothing stores","58","538","8918","33",
"New Hampshire","2008","448210","Shoe stores","140","1078","16633","33",
"New Hampshire","2008","4483  ","Jewelry, luggage, and leather goods stores","158","1058","25701","33",
"New Hampshire","2008","44831 ","Jewelry stores","149","1031","25269","33",
"New Hampshire","2008","448310","Jewelry stores","149","1031","25269","33",
"New Hampshire","2008","451110","Sporting goods stores","209","2085","36705","33",
"New Hampshire","2008","45112 ","Hobby, toy, and game stores","85","972","13396","33",
"New Hampshire","2008","451212","News dealers and newsstands","5","0","239","33",
"New Hampshire","2008","45122 ","Prerecorded tape, compact disc, and record stores","26","137","2417","33",
"New Hampshire","2008","452   ","General merchandise stores","194","15958","319951","33",
"New Hampshire","2008","4521  ","Department stores","62","9480","179983","33",
"New Hampshire","2008","45211 ","Department stores","62","9480","179983","33",
"New Hampshire","2008","453   ","Miscellaneous store retailers","743","4627","85162","33",
"New Hampshire","2008","4532  ","Office supplies, stationery, and gift stores","294","2185","34073","33",
"New Hampshire","2008","45321 ","Office supplies and stationery stores","42","0","0","33",
"New Hampshire","2008","45331 ","Used merchandise stores","92","457","7514","33",
"New Hampshire","2008","448320","Luggage and leather goods stores","9","0","0","33",
"New Hampshire","2008","451   ","Sporting goods, hobby, book, and music stores","474","4676","76313","33",
"New Hampshire","2008","4511  ","Sporting goods, hobby, and musical instrument stores","372","3608","60701","33",
"New Hampshire","2008","45111 ","Sporting goods stores","209","2085","36705","33",
"New Hampshire","2008","451120","Hobby, toy, and game stores","85","972","13396","33",
"New Hampshire","2008","45113 ","Sewing, needlework, and piece goods stores","48","338","4416","33",
"New Hampshire","2008","451130","Sewing, needlework, and piece goods stores","48","338","4416","33",
"New Hampshire","2008","45114 ","Musical instrument and supplies stores","30","213","6184","33",
"New Hampshire","2008","451140","Musical instrument and supplies stores","30","213","6184","33",
"New Hampshire","2008","4512  ","Book, periodical, and music stores","102","1068","15612","33",
"New Hampshire","2008","45121 ","Book stores and news dealers","76","931","13195","33",
"New Hampshire","2008","451211","Book stores","71","917","12956","33",
"New Hampshire","2008","451220","Prerecorded tape, compact disc, and record stores","26","137","2417","33",
"New Hampshire","2008","452111","Department stores (except discount department stores)","20","3040","50428","33",
"New Hampshire","2008","452112","Discount department stores","42","0","0","33",
"New Hampshire","2008","4529  ","Other general merchandise stores","132","0","0","33",
"New Hampshire","2008","45291 ","Warehouse clubs and supercenters","22","0","0","33",
"New Hampshire","2008","452910","Warehouse clubs and supercenters","22","0","0","33",
"New Hampshire","2008","45299 ","All other general merchandise stores","110","1115","15639","33",
"New Hampshire","2008","452990","All other general merchandise stores","110","1115","15639","33",
"New Hampshire","2008","4531  ","Florists","104","449","7380","33",
"New Hampshire","2008","45311 ","Florists","104","449","7380","33",
"New Hampshire","2008","453110","Florists","104","449","7380","33",
"New Hampshire","2008","453210","Office supplies and stationery stores","42","0","0","33",
"New Hampshire","2008","45322 ","Gift, novelty, and souvenir stores","252","1439","19174","33",
"New Hampshire","2008","453220","Gift, novelty, and souvenir stores","252","1439","19174","33",
"New Hampshire","2008","4533  ","Used merchandise stores","92","457","7514","33",
"New Hampshire","2008","453310","Used merchandise stores","92","457","7514","33",
"New Hampshire","2008","453910","Pet and pet supplies stores","64","739","12990","33",
"New Hampshire","2008","45392 ","Art dealers","18","62","1296","33",
"New Hampshire","2008","453920","Art dealers","18","62","1296","33",
"New Hampshire","2008","453998","All other miscellaneous store retailers (except tobacco stores)","124","520","15695","33",
"New Hampshire","2008","45411 ","Electronic shopping and mail-order houses","179","2972","115979","33",
"New Hampshire","2008","454111","Electronic shopping","110","524","21322","33",
"New Hampshire","2008","454112","Electronic auctions","2","0","0","33",
"New Hampshire","2008","4542  ","Vending machine operators","18","97","2698","33",
"New Hampshire","2008","4543  ","Direct selling establishments","257","2779","120456","33",
"New Hampshire","2008","45431 ","Fuel dealers","163","2368","106612","33",
"New Hampshire","2008","454311","Heating oil dealers","127","1626","72721","33",
"New Hampshire","2008","454319","Other fuel dealers","2","0","0","33",
"New Hampshire","2008","45439 ","Other direct selling establishments","94","411","13844","33",
"New Hampshire","2008","454390","Other direct selling establishments","94","411","13844","33",
"New Hampshire","2008","48-49 ","Transportation and warehousing","856","13011","441821","33",
"New Hampshire","2008","481111","Scheduled passenger air transportation","9","285","8428","33",
"New Hampshire","2008","481211","Nonscheduled chartered passenger air transportation","13","129","7649","33",
"New Hampshire","2008","481212","Nonscheduled chartered freight air transportation","1","0","0","33",
"New Hampshire","2008","483   ","Water transportation","4","0","207","33",
"New Hampshire","2008","483211","Inland water freight transportation","1","0","0","33",
"New Hampshire","2008","4841  ","General freight trucking","216","2176","87982","33",
"New Hampshire","2008","48411 ","General freight trucking, local","130","1100","36791","33",
"New Hampshire","2008","484110","General freight trucking, local","130","1100","36791","33",
"New Hampshire","2008","48423 ","Specialized freight (except used goods) trucking, long-distance","30","319","12619","33",
"New Hampshire","2008","4539  ","Other miscellaneous store retailers","253","1536","36195","33",
"New Hampshire","2008","45391 ","Pet and pet supplies stores","64","739","12990","33",
"New Hampshire","2008","48421 ","Used household and office goods moving","50","401","11373","33",
"New Hampshire","2008","45393 ","Manufactured (mobile) home dealers","15","67","2571","33",
"New Hampshire","2008","484220","Specialized freight (except used goods) trucking, local","145","398","15449","33",
"New Hampshire","2008","453930","Manufactured (mobile) home dealers","15","67","2571","33",
"New Hampshire","2008","45399 ","All other miscellaneous store retailers","156","668","19338","33",
"New Hampshire","2008","453991","Tobacco stores","32","148","3643","33",
"New Hampshire","2008","454   ","Nonstore retailers","454","5848","239133","33",
"New Hampshire","2008","4541  ","Electronic shopping and mail-order houses","179","2972","115979","33",
