"GEO_TTL","YEAR","NAICS2002","NAICS2002_TTL","ESTAB","EMP","PAYANN","state",
"Hawaii","2005","212313","Crushed and Broken Granite Mining and Quarrying","1","0","0","15",
"Hawaii","2005","212319","Other Crushed and Broken Stone Mining and Quarrying","2","0","0","15",
"Hawaii","2005","21232 ","Sand, Gravel, Clay, and Ceramic and Refractory Minerals Mining and Quarrying","1","0","0","15",
"Hawaii","2005","212325","Clay and Ceramic and Refractory Minerals Mining","1","0","0","15",
"Hawaii","2005","21239 ","Other Nonmetallic Mineral Mining and Quarrying","1","0","0","15",
"Hawaii","2005","1133  ","Logging","1","0","0","15",
"Hawaii","2005","00    ","Total","32244","490682","16163137","15",
"Hawaii","2005","11    ","Forestry, Fishing, Hunting, and Agriculture Support","46","350","7001","15",
"Hawaii","2005","113   ","Forestry and Logging","1","0","0","15",
"Hawaii","2005","11331 ","Logging","1","0","0","15",
"Hawaii","2005","11411 ","Fishing","24","0","0","15",
"Hawaii","2005","113310","Logging","1","0","0","15",
"Hawaii","2005","114   ","Fishing, Hunting and Trapping","24","0","0","15",
"Hawaii","2005","1141  ","Fishing","24","0","0","15",
"Hawaii","2005","114111","Finfish Fishing","22","0","0","15",
"Hawaii","2005","11511 ","Support Activities for Crop Production","9","0","0","15",
"Hawaii","2005","114112","Shellfish Fishing","2","0","0","15",
"Hawaii","2005","115   ","Support Activities for Agriculture and Forestry","21","0","0","15",
"Hawaii","2005","1151  ","Support Activities for Crop Production","9","0","0","15",
"Hawaii","2005","115112","Soil Preparation, Planting, and Cultivating","1","0","0","15",
"Hawaii","2005","115113","Crop Harvesting, Primarily by Machine","2","0","0","15",
"Hawaii","2005","115114","Postharvest Crop Activities (except Cotton Ginning)","4","0","0","15",
"Hawaii","2005","115115","Farm Labor Contractors and Crew Leaders","1","0","0","15",
"Hawaii","2005","115116","Farm Management Services","1","0","0","15",
"Hawaii","2005","1152  ","Support Activities for Animal Production","10","0","0","15",
"Hawaii","2005","11521 ","Support Activities for Animal Production","10","0","0","15",
"Hawaii","2005","115210","Support Activities for Animal Production","10","0","0","15",
"Hawaii","2005","1153  ","Support Activities for Forestry","2","0","0","15",
"Hawaii","2005","11531 ","Support Activities for Forestry","2","0","0","15",
"Hawaii","2005","115310","Support Activities for Forestry","2","0","0","15",
"Hawaii","2005","21    ","Mining","9","0","0","15",
"Hawaii","2005","211   ","Oil and Gas Extraction","1","0","0","15",
"Hawaii","2005","2111  ","Oil and Gas Extraction","1","0","0","15",
"Hawaii","2005","21111 ","Oil and Gas Extraction","1","0","0","15",
"Hawaii","2005","211111","Crude Petroleum and Natural Gas Extraction","1","0","0","15",
"Hawaii","2005","212   ","Mining (except Oil and Gas)","6","0","0","15",
"Hawaii","2005","2123  ","Nonmetallic Mineral Mining and Quarrying","6","0","0","15",
"Hawaii","2005","21231 ","Stone Mining and Quarrying","4","0","0","15",
"Hawaii","2005","212312","Crushed and Broken Limestone Mining and Quarrying","1","0","0","15",
"Hawaii","2005","5174  ","Satellite Telecommunications","10","0","0","15",
"Hawaii","2005","4889  ","Other Support Activities for Transportation","4","0","0","15",
"Hawaii","2005","48899 ","Other Support Activities for Transportation","4","0","0","15",
"Hawaii","2005","488991","Packing and Crating","4","0","0","15",
"Hawaii","2005","492   ","Couriers and Messengers","64","1305","40581","15",
"Hawaii","2005","4921  ","Couriers","37","1000","34373","15",
"Hawaii","2005","524126","Direct Property and Casualty Insurance Carriers","27","0","0","15",
"Hawaii","2005","51741 ","Satellite Telecommunications","10","0","0","15",
"Hawaii","2005","517410","Satellite Telecommunications","10","0","0","15",
"Hawaii","2005","5175  ","Cable and Other Program Distribution","8","0","0","15",
"Hawaii","2005","524130","Reinsurance Carriers","1","0","0","15",
"Hawaii","2005","524127","Direct Title Insurance Carriers","32","0","0","15",
"Hawaii","2005","524128","Other Direct Insurance (except Life, Health, and Medical) Carriers","1","0","0","15",
"Hawaii","2005","52413 ","Reinsurance Carriers","1","0","0","15",
"Hawaii","2005","54    ","Professional, Scientific, and Technical Services","3257","24724","1218103","15",
"Hawaii","2005","541110","Offices of Lawyers","760","3507","232234","15",
"Hawaii","2005","541   ","Professional, Scientific, and Technical Services","3257","24724","1218103","15",
"Hawaii","2005","5411  ","Legal Services","776","3912","251742","15",
"Hawaii","2005","54111 ","Offices of Lawyers","760","3507","232234","15",
"Hawaii","2005","541870","Advertising Material Distribution Services","3","0","0","15",
"Hawaii","2005","54189 ","Other Services Related to Advertising","25","211","2720","15",
"Hawaii","2005","56174 ","Carpet and Upholstery Cleaning Services","24","145","1728","15",
"Hawaii","2005","541890","Other Services Related to Advertising","25","211","2720","15",
"Hawaii","2005","5419  ","Other Professional, Scientific, and Technical Services","272","2182","46747","15",
"Hawaii","2005","54191 ","Marketing Research and Public Opinion Polling","15","400","5913","15",
"Hawaii","2005","561740","Carpet and Upholstery Cleaning Services","24","145","1728","15",
"Hawaii","2005","621310","Offices of Chiropractors","96","224","6200","15",
"Hawaii","2005","56179 ","Other Services to Buildings and Dwellings","37","120","3205","15",
"Hawaii","2005","561790","Other Services to Buildings and Dwellings","37","120","3205","15",
"Hawaii","2005","5619  ","Other Support Services","89","916","22793","15",
"Hawaii","2005","621330","Offices of Mental Health Practitioners (except Physicians)","100","1195","33725","15",
"Hawaii","2005","62132 ","Offices of Optometrists","106","434","12318","15",
"Hawaii","2005","621320","Offices of Optometrists","106","434","12318","15",
"Hawaii","2005","62133 ","Offices of Mental Health Practitioners (except Physicians)","100","1195","33725","15",
"Hawaii","2005","6243  ","Vocational Rehabilitation Services","65","1390","29647","15",
"Hawaii","2005","7221  ","Full-Service Restaurants","1167","30609","506800","15",
"Hawaii","2005","62431 ","Vocational Rehabilitation Services","65","1390","29647","15",
"Hawaii","2005","624310","Vocational Rehabilitation Services","65","1390","29647","15",
"Hawaii","2005","6244  ","Child Day Care Services","205","2080","32992","15",
"Hawaii","2005","72211 ","Full-Service Restaurants","1167","30609","506800","15",
"Hawaii","2005","81291 ","Pet Care (except Veterinary) Services","18","44","948","15",
"Hawaii","2005","722110","Full-Service Restaurants","1167","30609","506800","15",
"Hawaii","2005","7222  ","Limited-Service Eating Places","1521","22149","280226","15",
"Hawaii","2005","72221 ","Limited-Service Eating Places","1521","22149","280226","15",
"Hawaii","2005","238210","Electrical Contractors","301","2707","151373","15",
"Hawaii","2005","812910","Pet Care (except Veterinary) Services","18","44","948","15",
"Hawaii","2005","81292 ","Photofinishing","22","101","2591","15",
"Hawaii","2005","812921","Photofinishing Laboratories (except One-Hour)","10","74","2288","15",
"Hawaii","2005","2382  ","Building Equipment Contractors","634","5993","331276","15",
"Hawaii","2005","23821 ","Electrical Contractors","301","2707","151373","15",
"Hawaii","2005","23822 ","Plumbing, Heating, and Air-Conditioning Contractors","306","2826","145951","15",
"Hawaii","2005","238220","Plumbing, Heating, and Air-Conditioning Contractors","306","2826","145951","15",
"Hawaii","2005","311920","Coffee and Tea Manufacturing","8","123","3941","15",
"Hawaii","2005","311911","Roasted Nuts and Peanut Butter Manufacturing","4","0","0","15",
"Hawaii","2005","311919","Other Snack Food Manufacturing","7","0","0","15",
"Hawaii","2005","31192 ","Coffee and Tea Manufacturing","8","123","3941","15",
"Hawaii","2005","31193 ","Flavoring Syrup and Concentrate Manufacturing","2","0","0","15",
"Hawaii","2005","321992","Prefabricated Wood Building Manufacturing","1","0","0","15",
"Hawaii","2005","32192 ","Wood Container and Pallet Manufacturing","4","0","0","15",
"Hawaii","2005","321920","Wood Container and Pallet Manufacturing","4","0","0","15",
"Hawaii","2005","32199 ","All Other Wood Product Manufacturing","7","0","0","15",
"Hawaii","2005","327320","Ready-Mix Concrete Manufacturing","13","483","29860","15",
"Hawaii","2005","327215","Glass Product Manufacturing Made of Purchased Glass","7","0","0","15",
"Hawaii","2005","3273  ","Cement and Concrete Product Manufacturing","30","894","50386","15",
"Hawaii","2005","32732 ","Ready-Mix Concrete Manufacturing","13","483","29860","15",
"Hawaii","2005","334210","Telephone Apparatus Manufacturing","1","0","0","15",
"Hawaii","2005","334119","Other Computer Peripheral Equipment Manufacturing","1","0","0","15",
"Hawaii","2005","3342  ","Communications Equipment Manufacturing","2","0","0","15",
"Hawaii","2005","33421 ","Telephone Apparatus Manufacturing","1","0","0","15",
"Hawaii","2005","339114","Dental Equipment and Supplies Manufacturing","1","0","0","15",
"Hawaii","2005","33991 ","Jewelry and Silverware Manufacturing","33","528","12701","15",
"Hawaii","2005","339115","Ophthalmic Goods Manufacturing","2","0","0","15",
"Hawaii","2005","339116","Dental Laboratories","38","0","0","15",
"Hawaii","2005","3399  ","Other Miscellaneous Manufacturing","103","927","23006","15",
"Hawaii","2005","42373 ","Warm Air Heating and Air-Conditioning Equipment and Supplies Merchant Wholesalers","17","0","0","15",
"Hawaii","2005","423710","Hardware Merchant Wholesalers","26","210","8787","15",
"Hawaii","2005","42372 ","Plumbing and Heating Equipment and Supplies (Hydronics) Merchant Wholesalers","24","274","12827","15",
"Hawaii","2005","423720","Plumbing and Heating Equipment and Supplies (Hydronics) Merchant Wholesalers","24","274","12827","15",
"Hawaii","2005","42371 ","Hardware Merchant Wholesalers","26","210","8787","15",
"Hawaii","2005","4245  ","Farm Product Raw Material Merchant Wholesalers","2","0","0","15",
"Hawaii","2005","424480","Fresh Fruit and Vegetable Merchant Wholesalers","49","845","25637","15",
"Hawaii","2005","42449 ","Other Grocery and Related Products Merchant Wholesalers","77","1559","45298","15",
"Hawaii","2005","424490","Other Grocery and Related Products Merchant Wholesalers","77","1559","45298","15",
"Hawaii","2005","443112","Radio, Television, and Other Electronics Stores","88","563","19673","15",
"Hawaii","2005","443130","Camera and Photographic Supplies Stores","15","0","0","15",
"Hawaii","2005","44312 ","Computer and Software Stores","37","0","0","15",
"Hawaii","2005","443120","Computer and Software Stores","37","0","0","15",
"Hawaii","2005","44313 ","Camera and Photographic Supplies Stores","15","0","0","15",
"Hawaii","2005","451   ","Sporting Goods, Hobby, Book, and Music Stores","326","3141","48992","15",
"Hawaii","2005","45112 ","Hobby, Toy, and Game Stores","58","587","8727","15",
"Hawaii","2005","4511  ","Sporting Goods, Hobby, and Musical Instrument Stores","242","1980","32823","15",
"Hawaii","2005","45111 ","Sporting Goods Stores","146","1197","20257","15",
"Hawaii","2005","451110","Sporting Goods Stores","146","1197","20257","15",
"Hawaii","2005","4832  ","Inland Water Transportation","6","0","0","15",
"Hawaii","2005","484   ","Truck Transportation","199","3433","119129","15",
"Hawaii","2005","48321 ","Inland Water Transportation","6","0","0","15",
"Hawaii","2005","483211","Inland Water Freight Transportation","1","0","0","15",
"Hawaii","2005","483212","Inland Water Passenger Transportation","5","0","0","15",
"Hawaii","2005","49211 ","Couriers","37","1000","34373","15",
"Hawaii","2005","492110","Couriers","37","1000","34373","15",
"Hawaii","2005","51751 ","Cable and Other Program Distribution","8","0","0","15",
"Hawaii","2005","4922  ","Local Messengers and Local Delivery","27","305","6208","15",
"Hawaii","2005","49221 ","Local Messengers and Local Delivery","27","305","6208","15",
"Hawaii","2005","492210","Local Messengers and Local Delivery","27","305","6208","15",
"Hawaii","2005","517510","Cable and Other Program Distribution","8","0","0","15",
"Hawaii","2005","5242  ","Agencies, Brokerages, and Other Insurance Related Activities","391","2791","145213","15",
"Hawaii","2005","5179  ","Other Telecommunications","2","0","0","15",
"Hawaii","2005","51791 ","Other Telecommunications","2","0","0","15",
"Hawaii","2005","517910","Other Telecommunications","2","0","0","15",
"Hawaii","2005","524291","Claims Adjusting","23","190","7867","15",
"Hawaii","2005","52421 ","Insurance Agencies and Brokerages","339","2203","105937","15",
"Hawaii","2005","524210","Insurance Agencies and Brokerages","339","2203","105937","15",
"Hawaii","2005","52429 ","Other Insurance Related Activities","52","588","39276","15",
"Hawaii","2005","54119 ","Other Legal Services","16","405","19508","15",
"Hawaii","2005","541191","Title Abstract and Settlement Offices","9","393","19277","15",
"Hawaii","2005","541910","Marketing Research and Public Opinion Polling","15","400","5913","15",
"Hawaii","2005","541199","All Other Legal Services","7","12","231","15",
"Hawaii","2005","5412  ","Accounting, Tax Preparation, Bookkeeping, and Payroll Services","567","5992","176996","15",
"Hawaii","2005","54121 ","Accounting, Tax Preparation, Bookkeeping, and Payroll Services","567","5992","176996","15",
"Hawaii","2005","54193 ","Translation and Interpretation Services","9","20","885","15",
"Hawaii","2005","54192 ","Photographic Services","128","802","13552","15",
"Hawaii","2005","541921","Photography Studios, Portrait","102","692","11373","15",
"Hawaii","2005","541922","Commercial Photography","26","110","2179","15",
"Hawaii","2005","56191 ","Packaging and Labeling Services","1","0","0","15",
"Hawaii","2005","561910","Packaging and Labeling Services","1","0","0","15",
"Hawaii","2005","62134 ","Offices of Physical, Occupational and Speech Therapists, and Audiologists","122","734","25132","15",
"Hawaii","2005","56192 ","Convention and Trade Show Organizers","24","0","0","15",
"Hawaii","2005","561920","Convention and Trade Show Organizers","24","0","0","15",
"Hawaii","2005","56199 ","All Other Support Services","64","0","0","15",
"Hawaii","2005","62441 ","Child Day Care Services","205","2080","32992","15",
"Hawaii","2005","621340","Offices of Physical, Occupational and Speech Therapists, and Audiologists","122","734","25132","15",
"Hawaii","2005","62139 ","Offices of All Other Health Practitioners","76","152","5257","15",
"Hawaii","2005","621391","Offices of Podiatrists","15","0","0","15",
"Hawaii","2005","624410","Child Day Care Services","205","2080","32992","15",
"Hawaii","2005","722211","Limited-Service Restaurants","1208","17143","218562","15",
"Hawaii","2005","71    ","Arts, Entertainment, and Recreation","490","11854","231148","15",
"Hawaii","2005","711   ","Performing Arts, Spectator Sports, and Related Industries","151","2385","46102","15",
"Hawaii","2005","7111  ","Performing Arts Companies","55","1792","32112","15",
"Hawaii","2005","722212","Cafeterias","23","606","7356","15",
"Hawaii","2005","812922","One-Hour Photofinishing","12","27","303","15",
"Hawaii","2005","722213","Snack and Nonalcoholic Beverage Bars","290","4400","54308","15",
"Hawaii","2005","7223  ","Special Food Services","122","3246","60076","15",
"Hawaii","2005","72231 ","Food Service Contractors","64","2500","49328","15",
"Hawaii","2005","81293 ","Parking Lots and Garages","165","1042","14944","15",
"Hawaii","2005","812930","Parking Lots and Garages","165","1042","14944","15",
"Hawaii","2005","21311 ","Support Activities for Mining","2","0","0","15",
"Hawaii","2005","81299 ","All Other Personal Services","89","439","10219","15",
"Hawaii","2005","812990","All Other Personal Services","89","439","10219","15",
"Hawaii","2005","212399","All Other Nonmetallic Mineral Mining","1","0","0","15",
"Hawaii","2005","213   ","Support Activities for Mining","2","0","0","15",
"Hawaii","2005","2131  ","Support Activities for Mining","2","0","0","15",
"Hawaii","2005","213111","Drilling Oil and Gas Wells","1","0","0","15",
"Hawaii","2005","23831 ","Drywall and Insulation Contractors","74","1284","73035","15",
"Hawaii","2005","23829 ","Other Building Equipment Contractors","27","460","33952","15",
"Hawaii","2005","238290","Other Building Equipment Contractors","27","460","33952","15",
"Hawaii","2005","2383  ","Building Finishing Contractors","489","4560","207008","15",
"Hawaii","2005","311942","Spice and Extract Manufacturing","3","0","0","15",
"Hawaii","2005","311930","Flavoring Syrup and Concentrate Manufacturing","2","0","0","15",
"Hawaii","2005","31194 ","Seasoning and Dressing Manufacturing","8","0","0","15",
"Hawaii","2005","311941","Mayonnaise, Dressing, and Other Prepared Sauce Manufacturing","5","76","2102","15",
"Hawaii","2005","321999","All Other Miscellaneous Wood Product Manufacturing","6","0","0","15",
"Hawaii","2005","322211","Corrugated and Solid Fiber Box Manufacturing","2","0","0","15",
"Hawaii","2005","322   ","Paper Manufacturing","7","0","0","15",
"Hawaii","2005","3222  ","Converted Paper Product Manufacturing","7","0","0","15",
"Hawaii","2005","32221 ","Paperboard Container Manufacturing","4","0","0","15",
"Hawaii","2005","32733 ","Concrete Pipe, Brick, and Block Manufacturing","4","129","7865","15",
"Hawaii","2005","327390","Other Concrete Product Manufacturing","13","282","12661","15",
"Hawaii","2005","327331","Concrete Block and Brick Manufacturing","3","0","0","15",
"Hawaii","2005","327332","Concrete Pipe Manufacturing","1","0","0","15",
"Hawaii","2005","32739 ","Other Concrete Product Manufacturing","13","282","12661","15",
"Hawaii","2005","33429 ","Other Communications Equipment Manufacturing","1","0","0","15",
"Hawaii","2005","334310","Audio and Video Equipment Manufacturing","1","0","0","15",
"Hawaii","2005","334290","Other Communications Equipment Manufacturing","1","0","0","15",
"Hawaii","2005","3343  ","Audio and Video Equipment Manufacturing","1","0","0","15",
"Hawaii","2005","33431 ","Audio and Video Equipment Manufacturing","1","0","0","15",
"Hawaii","2005","339911","Jewelry (except Costume) Manufacturing","28","498","11475","15",
"Hawaii","2005","339920","Sporting and Athletic Goods Manufacturing","22","122","2767","15",
"Hawaii","2005","339913","Jewelers' Material and Lapidary Work Manufacturing","1","0","0","15",
"Hawaii","2005","339914","Costume Jewelry and Novelty Manufacturing","4","0","0","15",
"Hawaii","2005","33992 ","Sporting and Athletic Goods Manufacturing","22","122","2767","15",
"Hawaii","2005","4238  ","Machinery, Equipment, and Supplies Merchant Wholesalers","105","1133","51567","15",
"Hawaii","2005","423730","Warm Air Heating and Air-Conditioning Equipment and Supplies Merchant Wholesalers","17","0","0","15",
"Hawaii","2005","42374 ","Refrigeration Equipment and Supplies Merchant Wholesalers","6","0","0","15",
"Hawaii","2005","423740","Refrigeration Equipment and Supplies Merchant Wholesalers","6","0","0","15",
"Hawaii","2005","42451 ","Grain and Field Bean Merchant Wholesalers","1","0","0","15",
"Hawaii","2005","4246  ","Chemical and Allied Products Merchant Wholesalers","31","0","0","15",
"Hawaii","2005","424510","Grain and Field Bean Merchant Wholesalers","1","0","0","15",
"Hawaii","2005","42459 ","Other Farm Product Raw Material Merchant Wholesalers","1","0","0","15",
"Hawaii","2005","424590","Other Farm Product Raw Material Merchant Wholesalers","1","0","0","15",
"Hawaii","2005","444   ","Building Material and Garden Equipment and Supplies Dealers","267","4322","123256","15",
"Hawaii","2005","44412 ","Paint and Wallpaper Stores","26","145","5678","15",
"Hawaii","2005","4441  ","Building Material and Supplies Dealers","217","3954","114146","15",
"Hawaii","2005","44411 ","Home Centers","23","2247","56418","15",
"Hawaii","2005","444110","Home Centers","23","2247","56418","15",
"Hawaii","2005","451120","Hobby, Toy, and Game Stores","58","587","8727","15",
"Hawaii","2005","451140","Musical Instrument and Supplies Stores","25","129","2768","15",
"Hawaii","2005","45113 ","Sewing, Needlework, and Piece Goods Stores","13","67","1071","15",
"Hawaii","2005","451130","Sewing, Needlework, and Piece Goods Stores","13","67","1071","15",
"Hawaii","2005","45114 ","Musical Instrument and Supplies Stores","25","129","2768","15",
"Hawaii","2005","4841  ","General Freight Trucking","90","1624","50460","15",
"Hawaii","2005","484121","General Freight Trucking, Long-Distance, Truckload","13","0","0","15",
"Hawaii","2005","48411 ","General Freight Trucking, Local","72","1310","41297","15",
"Hawaii","2005","484110","General Freight Trucking, Local","72","1310","41297","15",
"Hawaii","2005","48412 ","General Freight Trucking, Long-Distance","18","314","9163","15",
"Hawaii","2005","493   ","Warehousing and Storage","47","0","0","15",
"Hawaii","2005","4931  ","Warehousing and Storage","47","0","0","15",
"Hawaii","2005","518   ","Internet Service Providers, Web Search Portals, and Data Processing Services","85","1258","54922","15",
"Hawaii","2005","49311 ","General Warehousing and Storage","28","506","16181","15",
"Hawaii","2005","493110","General Warehousing and Storage","28","506","16181","15",
"Hawaii","2005","49312 ","Refrigerated Warehousing and Storage","7","161","6107","15",
"Hawaii","2005","5181  ","Internet Service Providers and Web Search Portals","14","92","2986","15",
"Hawaii","2005","524292","Third Party Administration of Insurance and Pension Funds","22","346","29255","15",
"Hawaii","2005","51811 ","Internet Service Providers and Web Search Portals","14","92","2986","15",
"Hawaii","2005","518111","Internet Service Providers","14","92","2986","15",
"Hawaii","2005","5182  ","Data Processing, Hosting, and Related Services","71","1166","51936","15",
"Hawaii","2005","541211","Offices of Certified Public Accountants","289","1762","74961","15",
"Hawaii","2005","524298","All Other Insurance Related Activities","7","52","2154","15",
"Hawaii","2005","525   ","Funds, Trusts, and Other Financial Vehicles","4","0","0","15",
"Hawaii","2005","5259  ","Other Investment Pools and Funds","4","0","0","15",
"Hawaii","2005","541930","Translation and Interpretation Services","9","20","885","15",
"Hawaii","2005","541213","Tax Preparation Services","81","659","7127","15",
"Hawaii","2005","541214","Payroll Services","20","1785","53898","15",
"Hawaii","2005","541219","Other Accounting Services","177","1786","41010","15",
"Hawaii","2005","561990","All Other Support Services","64","0","0","15",
"Hawaii","2005","54194 ","Veterinary Services","80","760","22605","15",
"Hawaii","2005","541940","Veterinary Services","80","760","22605","15",
"Hawaii","2005","54199 ","All Other Professional, Scientific, and Technical Services","40","200","3792","15",
"Hawaii","2005","562   ","Waste Management and Remediation Services","93","1439","60100","15",
"Hawaii","2005","621399","Offices of All Other Miscellaneous Health Practitioners","61","0","0","15",
"Hawaii","2005","5621  ","Waste Collection","33","555","20045","15",
"Hawaii","2005","56211 ","Waste Collection","33","555","20045","15",
"Hawaii","2005","562111","Solid Waste Collection","28","513","18092","15",
"Hawaii","2005","6214  ","Outpatient Care Centers","117","5061","199590","15",
"Hawaii","2005","71111 ","Theater Companies and Dinner Theaters","30","1221","21074","15",
"Hawaii","2005","62141 ","Family Planning Centers","9","54","1387","15",
"Hawaii","2005","621410","Family Planning Centers","9","54","1387","15",
"Hawaii","2005","62142 ","Outpatient Mental Health and Substance Abuse Centers","28","891","21521","15",
"Hawaii","2005","711110","Theater Companies and Dinner Theaters","30","1221","21074","15",
"Hawaii","2005","722310","Food Service Contractors","64","2500","49328","15",
"Hawaii","2005","71112 ","Dance Companies","9","0","0","15",
"Hawaii","2005","711120","Dance Companies","9","0","0","15",
"Hawaii","2005","71113 ","Musical Groups and Artists","15","0","0","15",
"Hawaii","2005","72232 ","Caterers","42","0","0","15",
"Hawaii","2005","813   ","Religious, Grantmaking, Civic, Professional, and Similar Organizations","1810","13178","317343","15",
"Hawaii","2005","722320","Caterers","42","0","0","15",
"Hawaii","2005","72233 ","Mobile Food Services","16","0","0","15",
"Hawaii","2005","722330","Mobile Food Services","16","0","0","15",
"Hawaii","2005","8131  ","Religious Organizations","505","4312","84807","15",
"Hawaii","2005","81311 ","Religious Organizations","505","4312","84807","15",
"Hawaii","2005","23833 ","Flooring Contractors","76","446","15300","15",
"Hawaii","2005","813110","Religious Organizations","505","4312","84807","15",
"Hawaii","2005","8132  ","Grantmaking and Giving Services","68","519","19866","15",
"Hawaii","2005","213112","Support Activities for Oil and Gas Operations","1","0","0","15",
"Hawaii","2005","22    ","Utilities","46","2730","187927","15",
"Hawaii","2005","221   ","Utilities","46","2730","187927","15",
"Hawaii","2005","2211  ","Electric Power Generation, Transmission and Distribution","21","0","0","15",
"Hawaii","2005","238310","Drywall and Insulation Contractors","74","1284","73035","15",
"Hawaii","2005","23832 ","Painting and Wall Covering Contractors","175","1539","63316","15",
"Hawaii","2005","238320","Painting and Wall Covering Contractors","175","1539","63316","15",
"Hawaii","2005","238330","Flooring Contractors","76","446","15300","15",
"Hawaii","2005","31199 ","All Other Food Manufacturing","38","690","13788","15",
"Hawaii","2005","311991","Perishable Prepared Food Manufacturing","29","571","11397","15",
"Hawaii","2005","322212","Folding Paperboard Box Manufacturing","1","0","0","15",
"Hawaii","2005","311999","All Other Miscellaneous Food Manufacturing","9","119","2391","15",
"Hawaii","2005","312   ","Beverage and Tobacco Product Manufacturing","28","752","25464","15",
"Hawaii","2005","3121  ","Beverage Manufacturing","28","752","25464","15",
