"New Mexico","2006","624210","Community Food Services","22","163","2755","35",
"New Mexico","2006","624190","Other Individual and Family Services","292","2647","60060","35",
"New Mexico","2006","6242  ","Community Food and Housing, and Emergency and Other Relief Services","102","1262","27088","35",
"New Mexico","2006","62421 ","Community Food Services","22","163","2755","35",
"New Mexico","2006","811192","Car Washes","106","865","12917","35",
"New Mexico","2006","811122","Automotive Glass Replacement Shops","64","300","7830","35",
"New Mexico","2006","81119 ","Other Automotive Repair and Maintenance","211","1762","30611","35",
"New Mexico","2006","811191","Automotive Oil Change and Lubrication Shops","86","844","15688","35",
"New Mexico","2006","238210","Electrical Contractors","680","6613","243180","35",
"New Mexico","2006","213   ","Support Activities for Mining","431","11202","620838","35",
"New Mexico","2006","2131  ","Support Activities for Mining","431","11202","620838","35",
"New Mexico","2006","21311 ","Support Activities for Mining","431","11202","620838","35",
"New Mexico","2006","213111","Drilling Oil and Gas Wells","77","4205","260106","35",
"New Mexico","2006","23821 ","Electrical Contractors","680","6613","243180","35",
"New Mexico","2006","23822 ","Plumbing, Heating, and Air-Conditioning Contractors","667","6272","225765","35",
"New Mexico","2006","31194 ","Seasoning and Dressing Manufacturing","6","252","6053","35",
"New Mexico","2006","238220","Plumbing, Heating, and Air-Conditioning Contractors","667","6272","225765","35",
"New Mexico","2006","23829 ","Other Building Equipment Contractors","30","344","14830","35",
"New Mexico","2006","311919","Other Snack Food Manufacturing","2","0","0","35",
"New Mexico","2006","321   ","Wood Product Manufacturing","85","1841","51503","35",
"New Mexico","2006","311941","Mayonnaise, Dressing, and Other Prepared Sauce Manufacturing","3","0","0","35",
"New Mexico","2006","311942","Spice and Extract Manufacturing","3","0","0","35",
"New Mexico","2006","31199 ","All Other Food Manufacturing","10","0","0","35",
"New Mexico","2006","3211  ","Sawmills and Wood Preservation","15","44","1029","35",
"New Mexico","2006","3254  ","Pharmaceutical and Medicine Manufacturing","5","0","0","35",
"New Mexico","2006","32111 ","Sawmills and Wood Preservation","15","44","1029","35",
"New Mexico","2006","321113","Sawmills","13","0","0","35",
"New Mexico","2006","321114","Wood Preservation","2","0","0","35",
"New Mexico","2006","32541 ","Pharmaceutical and Medicine Manufacturing","5","0","0","35",
"New Mexico","2006","327993","Mineral Wool Manufacturing","2","0","0","35",
"New Mexico","2006","325411","Medicinal and Botanical Manufacturing","1","0","0","35",
"New Mexico","2006","325412","Pharmaceutical Preparation Manufacturing","1","0","0","35",
"New Mexico","2006","327992","Ground or Treated Mineral and Earth Manufacturing","2","0","0","35",
"New Mexico","2006","334220","Radio and Television Broadcasting and Wireless Communications Equipment Manufacturing","3","0","0","35",
"New Mexico","2006","327999","All Other Miscellaneous Nonmetallic Mineral Product Manufacturing","4","0","0","35",
"New Mexico","2006","331   ","Primary Metal Manufacturing","24","424","15690","35",
"New Mexico","2006","33422 ","Radio and Television Broadcasting and Wireless Communications Equipment Manufacturing","3","0","0","35",
"New Mexico","2006","334613","Magnetic and Optical Recording Media Manufacturing","1","0","0","35",
"New Mexico","2006","3343  ","Audio and Video Equipment Manufacturing","5","0","0","35",
"New Mexico","2006","33431 ","Audio and Video Equipment Manufacturing","5","0","0","35",
"New Mexico","2006","334612","Prerecorded Compact Disc (except Software), Tape, and Record Reproducing","2","0","0","35",
"New Mexico","2006","3363  ","Motor Vehicle Parts Manufacturing","15","0","0","35",
"New Mexico","2006","335   ","Electrical Equipment, Appliance, and Component Manufacturing","22","1512","62296","35",
"New Mexico","2006","3351  ","Electric Lighting Equipment Manufacturing","7","0","0","35",
"New Mexico","2006","336214","Travel Trailer and Camper Manufacturing","2","0","0","35",
"New Mexico","2006","33631 ","Motor Vehicle Gasoline Engine and Engine Parts Manufacturing","4","9","258","35",
"New Mexico","2006","337129","Wood Television, Radio, and Sewing Machine Cabinet Manufacturing","5","0","0","35",
"New Mexico","2006","336312","Gasoline Engine and Engine Parts Manufacturing","4","9","258","35",
"New Mexico","2006","33632 ","Motor Vehicle Electrical and Electronic Equipment Manufacturing","4","0","0","35",
"New Mexico","2006","337127","Institutional Furniture Manufacturing","2","0","0","35",
"New Mexico","2006","4231  ","Motor Vehicle and Motor Vehicle Parts and Supplies Merchant Wholesalers","112","1047","34999","35",
"New Mexico","2006","3372  ","Office Furniture (including Fixtures) Manufacturing","18","0","0","35",
"New Mexico","2006","33721 ","Office Furniture (including Fixtures) Manufacturing","18","0","0","35",
"New Mexico","2006","423   ","Merchant Wholesalers, Durable Goods","1213","12322","538797","35",
"New Mexico","2006","42352 ","Coal and Other Mineral and Ore Merchant Wholesalers","4","7","491","35",
"New Mexico","2006","42311 ","Automobile and Other Motor Vehicle Merchant Wholesalers","27","201","9227","35",
"New Mexico","2006","423110","Automobile and Other Motor Vehicle Merchant Wholesalers","27","201","9227","35",
"New Mexico","2006","423510","Metal Service Centers and Other Metal Merchant Wholesalers","51","505","20607","35",
"New Mexico","2006","423520","Coal and Other Mineral and Ore Merchant Wholesalers","4","7","491","35",
"New Mexico","2006","42411 ","Printing and Writing Paper Merchant Wholesalers","6","0","0","35",
"New Mexico","2006","4236  ","Electrical and Electronic Goods Merchant Wholesalers","124","1122","68654","35",
"New Mexico","2006","424   ","Merchant Wholesalers, Nondurable Goods","601","8621","306609","35",
"New Mexico","2006","4241  ","Paper and Paper Product Merchant Wholesalers","43","0","0","35",
"New Mexico","2006","42471 ","Petroleum Bulk Stations and Terminals","57","669","19494","35",
"New Mexico","2006","424110","Printing and Writing Paper Merchant Wholesalers","6","0","0","35",
"New Mexico","2006","42412 ","Stationery and Office Supplies Merchant Wholesalers","27","0","0","35",
"New Mexico","2006","4247  ","Petroleum and Petroleum Products Merchant Wholesalers","78","881","25566","35",
"New Mexico","2006","424710","Petroleum Bulk Stations and Terminals","57","669","19494","35",
"New Mexico","2006","443111","Household Appliance Stores","57","519","14459","35",
"New Mexico","2006","42472 ","Petroleum and Petroleum Products Merchant Wholesalers (except Bulk Stations and Terminals)","21","212","6072","35",
"New Mexico","2006","4431  ","Electronics and Appliance Stores","294","3431","85345","35",
"New Mexico","2006","44311 ","Appliance, Television, and Other Electronics Stores","208","2819","70167","35",
"New Mexico","2006","44814 ","Family Clothing Stores","190","2860","32624","35",
"New Mexico","2006","443112","Radio, Television, and Other Electronics Stores","151","2300","55708","35",
"New Mexico","2006","44312 ","Computer and Software Stores","74","0","0","35",
"New Mexico","2006","448130","Children's and Infants' Clothing Stores","25","207","3272","35",
"New Mexico","2006","448140","Family Clothing Stores","190","2860","32624","35",
"New Mexico","2006","45431 ","Fuel Dealers","118","781","19799","35",
"New Mexico","2006","44815 ","Clothing Accessories Stores","58","209","3871","35",
"New Mexico","2006","448150","Clothing Accessories Stores","58","209","3871","35",
"New Mexico","2006","4543  ","Direct Selling Establishments","222","1454","36539","35",
"New Mexico","2006","454311","Heating Oil Dealers","10","77","2760","35",
"New Mexico","2006","454312","Liquefied Petroleum Gas (Bottled Gas) Dealers","105","698","16951","35",
"New Mexico","2006","512230","Music Publishers","2","0","0","35",
"New Mexico","2006","454319","Other Fuel Dealers","3","6","88","35",
"New Mexico","2006","512220","Integrated Record Production/Distribution","2","0","0","35",
"New Mexico","2006","51223 ","Music Publishers","2","0","0","35",
"New Mexico","2006","51731 ","Telecommunications Resellers","7","0","0","35",
"New Mexico","2006","51224 ","Sound Recording Studios","8","0","0","35",
"New Mexico","2006","517212","Cellular and Other Wireless Telecommunications","73","0","0","35",
"New Mexico","2006","5173  ","Telecommunications Resellers","7","0","0","35",
"New Mexico","2006","517310","Telecommunications Resellers","7","0","0","35",
"New Mexico","2006","522120","Savings Institutions","51","1076","43312","35",
"New Mexico","2006","5174  ","Satellite Telecommunications","5","0","0","35",
"New Mexico","2006","522110","Commercial Banking","469","8014","283317","35",
"New Mexico","2006","52212 ","Savings Institutions","51","1076","43312","35",
"New Mexico","2006","52213 ","Credit Unions","116","2026","66216","35",
"New Mexico","2006","52399 ","All Other Financial Investment Activities","25","0","0","35",
"New Mexico","2006","522130","Credit Unions","116","2026","66216","35",
"New Mexico","2006","52393 ","Investment Advice","79","325","33188","35",
"New Mexico","2006","523930","Investment Advice","79","325","33188","35",
"New Mexico","2006","53121 ","Offices of Real Estate Agents and Brokers","815","1870","71869","35",
"New Mexico","2006","523991","Trust, Fiduciary, and Custody Activities","21","0","0","35",
"New Mexico","2006","523920","Portfolio Management","53","384","70573","35",
"New Mexico","2006","5312  ","Offices of Real Estate Agents and Brokers","815","1870","71869","35",
"New Mexico","2006","531210","Offices of Real Estate Agents and Brokers","815","1870","71869","35",
"New Mexico","2006","5313  ","Activities Related to Real Estate","428","1844","56814","35",
"New Mexico","2006","5411  ","Legal Services","1212","5765","302607","35",
"New Mexico","2006","53131 ","Real Estate Property Managers","226","1349","39100","35",
"New Mexico","2006","54    ","Professional, Scientific, and Technical Services","4807","38700","1902813","35",
"New Mexico","2006","541   ","Professional, Scientific, and Technical Services","4807","38700","1902813","35",
"New Mexico","2006","54111 ","Offices of Lawyers","1145","5181","279015","35",
"New Mexico","2006","54162 ","Environmental Consulting Services","107","824","42566","35",
"New Mexico","2006","541110","Offices of Lawyers","1145","5181","279015","35",
"New Mexico","2006","541614","Process, Physical Distribution, and Logistics Consulting Services","30","166","13169","35",
"New Mexico","2006","541618","Other Management Consulting Services","12","0","0","35",
"New Mexico","2006","541620","Environmental Consulting Services","107","824","42566","35",
"New Mexico","2006","561310","Employment Placement Agencies","28","0","0","35",
"New Mexico","2006","54169 ","Other Scientific and Technical Consulting Services","113","603","37663","35",
"New Mexico","2006","5613  ","Employment Services","189","21489","419156","35",
"New Mexico","2006","56131 ","Employment Placement Agencies","28","0","0","35",
"New Mexico","2006","56132 ","Temporary Help Services","152","9496","228324","35",
"New Mexico","2006","5622  ","Waste Treatment and Disposal","23","266","16873","35",
"New Mexico","2006","561320","Temporary Help Services","152","9496","228324","35",
"New Mexico","2006","562112","Hazardous Waste Collection","5","0","0","35",
"New Mexico","2006","562119","Other Waste Collection","7","0","0","35",
"New Mexico","2006","56221 ","Waste Treatment and Disposal","23","266","16873","35",
"New Mexico","2006","562211","Hazardous Waste Treatment and Disposal","8","0","0","35",
"New Mexico","2006","62134 ","Offices of Physical, Occupational and Speech Therapists, and Audiologists","233","1269","42870","35",
"New Mexico","2006","621320","Offices of Optometrists","125","767","21556","35",
"New Mexico","2006","62133 ","Offices of Mental Health Practitioners (except Physicians)","132","389","9496","35",
"New Mexico","2006","621330","Offices of Mental Health Practitioners (except Physicians)","132","389","9496","35",
"New Mexico","2006","62423 ","Emergency and Other Relief Services","8","59","1409","35",
"New Mexico","2006","62422 ","Community Housing Services","72","1040","22924","35",
"New Mexico","2006","624221","Temporary Shelters","40","777","16105","35",
"New Mexico","2006","624229","Other Community Housing Services","32","263","6819","35",
"New Mexico","2006","624230","Emergency and Other Relief Services","8","59","1409","35",
"New Mexico","2006","238290","Other Building Equipment Contractors","30","344","14830","35",
"New Mexico","2006","213112","Support Activities for Oil and Gas Operations","345","6715","343673","35",
"New Mexico","2006","213113","Support Activities for Coal Mining","1","0","0","35",
"New Mexico","2006","213114","Support Activities for Metal Mining","1","0","0","35",
"New Mexico","2006","213115","Support Activities for Nonmetallic Minerals (except Fuels)","7","0","0","35",
"New Mexico","2006","22    ","Utilities","223","4141","246654","35",
"New Mexico","2006","2383  ","Building Finishing Contractors","686","6250","167831","35",
"New Mexico","2006","311999","All Other Miscellaneous Food Manufacturing","2","0","0","35",
"New Mexico","2006","23831 ","Drywall and Insulation Contractors","196","3155","86306","35",
"New Mexico","2006","238310","Drywall and Insulation Contractors","196","3155","86306","35",
"New Mexico","2006","311991","Perishable Prepared Food Manufacturing","8","0","0","35",
"New Mexico","2006","32121 ","Veneer, Plywood, and Engineered Wood Product Manufacturing","17","478","14566","35",
"New Mexico","2006","312   ","Beverage and Tobacco Product Manufacturing","25","220","6405","35",
"New Mexico","2006","3121  ","Beverage Manufacturing","24","0","0","35",
"New Mexico","2006","3212  ","Veneer, Plywood, and Engineered Wood Product Manufacturing","17","478","14566","35",
"New Mexico","2006","325414","Biological Product (except Diagnostic) Manufacturing","2","0","0","35",
"New Mexico","2006","321213","Engineered Wood Member (except Truss) Manufacturing","1","0","0","35",
"New Mexico","2006","321214","Truss Manufacturing","16","0","0","35",
"New Mexico","2006","325413","In-Vitro Diagnostic Substance Manufacturing","1","0","0","35",
"New Mexico","2006","3255  ","Paint, Coating, and Adhesive Manufacturing","3","0","0","35",
"New Mexico","2006","33111 ","Iron and Steel Mills and Ferroalloy Manufacturing","6","29","793","35",
"New Mexico","2006","32551 ","Paint and Coating Manufacturing","2","0","0","35",
"New Mexico","2006","325510","Paint and Coating Manufacturing","2","0","0","35",
"New Mexico","2006","3311  ","Iron and Steel Mills and Ferroalloy Manufacturing","6","29","793","35",
"New Mexico","2006","335121","Residential Electric Lighting Fixture Manufacturing","4","0","0","35",
"New Mexico","2006","331111","Iron and Steel Mills","6","29","793","35",
"New Mexico","2006","3312  ","Steel Product Manufacturing from Purchased Steel","2","0","0","35",
"New Mexico","2006","33512 ","Lighting Fixture Manufacturing","7","0","0","35",
"New Mexico","2006","33633 ","Motor Vehicle Steering and Suspension Components (except Spring) Manufacturing","1","0","0","35",
"New Mexico","2006","335122","Commercial, Industrial, and Institutional Electric Lighting Fixture Manufacturing","1","0","0","35",
"New Mexico","2006","335129","Other Lighting Equipment Manufacturing","2","0","0","35",
"New Mexico","2006","336322","Other Motor Vehicle Electrical and Electronic Equipment Manufacturing","4","0","0","35",
"New Mexico","2006","42312 ","Motor Vehicle Supplies and New Parts Merchant Wholesalers","58","615","18654","35",
"New Mexico","2006","336330","Motor Vehicle Steering and Suspension Components (except Spring) Manufacturing","1","0","0","35",
"New Mexico","2006","337212","Custom Architectural Woodwork and Millwork Manufacturing","12","0","0","35",
"New Mexico","2006","337214","Office Furniture (except Wood) Manufacturing","1","0","0","35",
"New Mexico","2006","337215","Showcase, Partition, Shelving, and Locker Manufacturing","5","0","0","35",
"New Mexico","2006","3379  ","Other Furniture Related Product Manufacturing","6","0","0","35",
"New Mexico","2006","423120","Motor Vehicle Supplies and New Parts Merchant Wholesalers","58","615","18654","35",
"New Mexico","2006","423610","Electrical Apparatus and Equipment, Wiring Supplies, and Related Equipment Merchant","58","0","0","35",
"New Mexico","2006","42313 ","Tire and Tube Merchant Wholesalers","15","161","5380","35",
"New Mexico","2006","423130","Tire and Tube Merchant Wholesalers","15","161","5380","35",
"New Mexico","2006","42361 ","Electrical Apparatus and Equipment, Wiring Supplies, and Related Equipment Merchant","58","0","0","35",
"New Mexico","2006","42413 ","Industrial and Personal Service Paper Merchant Wholesalers","10","0","0","35",
"New Mexico","2006","42362 ","Electrical and Electronic Appliance, Television, and Radio Set Merchant Wholesalers","5","0","0","35",
"New Mexico","2006","423620","Electrical and Electronic Appliance, Television, and Radio Set Merchant Wholesalers","5","0","0","35",
"New Mexico","2006","424120","Stationery and Office Supplies Merchant Wholesalers","27","0","0","35",
"New Mexico","2006","4248  ","Beer, Wine, and Distilled Alcoholic Beverage Merchant Wholesalers","30","1434","49375","35",
"New Mexico","2006","424130","Industrial and Personal Service Paper Merchant Wholesalers","10","0","0","35",
"New Mexico","2006","4242  ","Drugs and Druggists' Sundries Merchant Wholesalers","28","474","23307","35",
"New Mexico","2006","424720","Petroleum and Petroleum Products Merchant Wholesalers (except Bulk Stations and Terminals)","21","212","6072","35",
"New Mexico","2006","42481 ","Beer and Ale Merchant Wholesalers","20","769","26030","35",
"New Mexico","2006","443130","Camera and Photographic Supplies Stores","12","0","0","35",
"New Mexico","2006","424810","Beer and Ale Merchant Wholesalers","20","769","26030","35",
"New Mexico","2006","443120","Computer and Software Stores","74","0","0","35",
"New Mexico","2006","44313 ","Camera and Photographic Supplies Stores","12","0","0","35",
"New Mexico","2006","4482  ","Shoe Stores","168","992","14580","35",
"New Mexico","2006","444   ","Building Material and Garden Equipment and Supplies Dealers","574","8611","224946","35",
"New Mexico","2006","44819 ","Other Clothing Stores","82","396","5852","35",
"New Mexico","2006","448190","Other Clothing Stores","82","396","5852","35",
"New Mexico","2006","454390","Other Direct Selling Establishments","104","673","16740","35",
"New Mexico","2006","44821 ","Shoe Stores","168","992","14580","35",
"New Mexico","2006","448210","Shoe Stores","168","992","14580","35",
"New Mexico","2006","45439 ","Other Direct Selling Establishments","104","673","16740","35",
"New Mexico","2006","48-49 ","Transportation and Warehousing","1325","15872","559789","35",
"New Mexico","2006","517410","Satellite Telecommunications","5","0","0","35",
"New Mexico","2006","481   ","Air Transportation","47","1277","48953","35",
"New Mexico","2006","4811  ","Scheduled Air Transportation","22","1021","35977","35",
"New Mexico","2006","51741 ","Satellite Telecommunications","5","0","0","35",
"New Mexico","2006","5175  ","Cable and Other Program Distribution","48","0","0","35",
"New Mexico","2006","52221 ","Credit Card Issuing","2","0","0","35",
"New Mexico","2006","51751 ","Cable and Other Program Distribution","48","0","0","35",
"New Mexico","2006","517510","Cable and Other Program Distribution","48","0","0","35",
"New Mexico","2006","5222  ","Nondepository Credit Intermediation","571","2711","110362","35",
"New Mexico","2006","522210","Credit Card Issuing","2","0","0","35",
"New Mexico","2006","52222 ","Sales Financing","32","0","0","35",
"New Mexico","2006","5241  ","Insurance Carriers","179","3819","208669","35",
"New Mexico","2006","522220","Sales Financing","32","0","0","35",
"New Mexico","2006","523999","Miscellaneous Financial Investment Activities","4","0","0","35",
"New Mexico","2006","524   ","Insurance Carriers and Related Activities","1037","7733","352610","35",
"New Mexico","2006","52411 ","Direct Life, Health, and Medical Insurance Carriers","60","2674","148702","35",
"New Mexico","2006","53132 ","Offices of Real Estate Appraisers","123","254","9492","35",
"New Mexico","2006","524113","Direct Life Insurance Carriers","36","338","11902","35",
"New Mexico","2006","531311","Residential Property Managers","128","806","22680","35",
"New Mexico","2006","531312","Nonresidential Property Managers","98","543","16420","35",
"New Mexico","2006","541191","Title Abstract and Settlement Offices","58","553","22781","35",
"New Mexico","2006","531320","Offices of Real Estate Appraisers","123","254","9492","35",
"New Mexico","2006","53139 ","Other Activities Related to Real Estate","79","241","8222","35",
"New Mexico","2006","54119 ","Other Legal Services","67","584","23592","35",
"New Mexico","2006","541199","All Other Legal Services","9","31","811","35",
"New Mexico","2006","5412  ","Accounting, Tax Preparation, Bookkeeping, and Payroll Services","739","5137","192516","35",
"New Mexico","2006","54171 ","Research and Development in the Physical, Engineering, and Life Sciences","182","4513","331677","35",
"New Mexico","2006","54121 ","Accounting, Tax Preparation, Bookkeeping, and Payroll Services","739","5137","192516","35",
"New Mexico","2006","541690","Other Scientific and Technical Consulting Services","113","603","37663","35",
"New Mexico","2006","5417  ","Scientific Research and Development Services","213","4678","337743","35",
"New Mexico","2006","5614  ","Business Support Services","218","2799","61601","35",
"New Mexico","2006","541710","Research and Development in the Physical, Engineering, and Life Sciences","182","4513","331677","35",
"New Mexico","2006","56133 ","Professional Employer Organizations","9","0","0","35",
"New Mexico","2006","561330","Professional Employer Organizations","9","0","0","35",
"New Mexico","2006","56141 ","Document Preparation Services","26","0","0","35",
"New Mexico","2006","562219","Other Nonhazardous Waste Treatment and Disposal","3","0","0","35",
"New Mexico","2006","561410","Document Preparation Services","26","0","0","35",
"New Mexico","2006","562212","Solid Waste Landfill","11","189","12708","35",
"New Mexico","2006","562213","Solid Waste Combustors and Incinerators","1","0","0","35",
"New Mexico","2006","5629  ","Remediation and Other Waste Management Services","66","791","33091","35",
"New Mexico","2006","621391","Offices of Podiatrists","35","204","6750","35",
"New Mexico","2006","56291 ","Remediation Services","24","0","0","35",
"New Mexico","2006","621340","Offices of Physical, Occupational and Speech Therapists, and Audiologists","233","1269","42870","35",
"New Mexico","2006","62139 ","Offices of All Other Health Practitioners","191","737","19867","35",
"New Mexico","2006","621399","Offices of All Other Miscellaneous Health Practitioners","156","533","13117","35",
"New Mexico","2006","6244  ","Child Day Care Services","362","4637","68315","35",
"New Mexico","2006","6243  ","Vocational Rehabilitation Services","31","1915","38954","35",
"New Mexico","2006","62431 ","Vocational Rehabilitation Services","31","1915","38954","35",
"New Mexico","2006","624310","Vocational Rehabilitation Services","31","1915","38954","35",
"New Mexico","2006","238320","Painting and Wall Covering Contractors","192","1491","38499","35",
"New Mexico","2006","62441 ","Child Day Care Services","362","4637","68315","35",
"New Mexico","2006","221   ","Utilities","223","4141","246654","35",
"New Mexico","2006","2211  ","Electric Power Generation, Transmission and Distribution","105","3602","231174","35",
"New Mexico","2006","22111 ","Electric Power Generation","49","1973","129748","35",
"New Mexico","2006","221112","Fossil Fuel Electric Power Generation","49","1973","129748","35",
"New Mexico","2006","22112 ","Electric Power Transmission, Control, and Distribution","56","1629","101426","35",
"New Mexico","2006","23832 ","Painting and Wall Covering Contractors","192","1491","38499","35",
"New Mexico","2006","23833 ","Flooring Contractors","64","360","11690","35",
"New Mexico","2006","312111","Soft Drink Manufacturing","2","0","0","35",
"New Mexico","2006","238330","Flooring Contractors","64","360","11690","35",
"New Mexico","2006","23834 ","Tile and Terrazzo Contractors","88","558","12912","35",
"New Mexico","2006","31211 ","Soft Drink and Ice Manufacturing","9","0","0","35",
"New Mexico","2006","312112","Bottled Water Manufacturing","5","0","0","35",
"New Mexico","2006","3219  ","Other Wood Product Manufacturing","53","1319","35908","35",
"New Mexico","2006","312113","Ice Manufacturing","2","0","0","35",
"New Mexico","2006","31212 ","Breweries","3","0","0","35",
"New Mexico","2006","312120","Breweries","3","0","0","35",
"New Mexico","2006","32191 ","Millwork","31","0","0","35",
"New Mexico","2006","321911","Wood Window and Door Manufacturing","16","212","5483","35",
"New Mexico","2006","325520","Adhesive Manufacturing","1","0","0","35",
"New Mexico","2006","321912","Cut Stock, Resawing Lumber, and Planing","5","0","0","35",
"New Mexico","2006","321918","Other Millwork (including Flooring)","10","292","9302","35",
"New Mexico","2006","32552 ","Adhesive Manufacturing","1","0","0","35",
"New Mexico","2006","3256  ","Soap, Cleaning Compound, and Toilet Preparation Manufacturing","8","0","0","35",
"New Mexico","2006","33122 ","Rolling and Drawing of Purchased Steel","1","0","0","35",
"New Mexico","2006","32561 ","Soap and Cleaning Compound Manufacturing","3","0","0","35",
"New Mexico","2006","33121 ","Iron and Steel Pipe and Tube Manufacturing from Purchased Steel","1","0","0","35",
"New Mexico","2006","331210","Iron and Steel Pipe and Tube Manufacturing from Purchased Steel","1","0","0","35",
