"Wyoming","2003","56152 ","Tour Operators","14","0","0","56",
"Wyoming","2003","54192 ","Photographic Services","44","0","0","56",
"Wyoming","2003","541921","Photography Studios, Portrait","39","0","0","56",
"Wyoming","2003","561510","Travel Agencies","32","0","0","56",
"Wyoming","2003","561520","Tour Operators","14","0","0","56",
"Wyoming","2003","611420","Computer Training","1","0","0","56",
"Wyoming","2003","56159 ","Other Travel Arrangement and Reservation Services","19","0","0","56",
"Wyoming","2003","561591","Convention and Visitors Bureaus","12","0","0","56",
"Wyoming","2003","61142 ","Computer Training","1","0","0","56",
"Wyoming","2003","61143 ","Professional and Management Development Training","6","0","0","56",
"Wyoming","2003","62199 ","All Other Ambulatory Health Care Services","12","0","0","56",
"Wyoming","2003","611430","Professional and Management Development Training","6","0","0","56",
"Wyoming","2003","62191 ","Ambulance Services","8","0","0","56",
"Wyoming","2003","621910","Ambulance Services","8","0","0","56",
"Wyoming","2003","71132 ","Promoters of Performing Arts, Sports, and Similar Events without Facilities","9","0","0","56",
"Wyoming","2003","621991","Blood and Organ Banks","3","0","0","56",
"Wyoming","2003","621999","All Other Miscellaneous Ambulatory Health Care Services","9","0","0","56",
"Wyoming","2003","711310","Promoters of Performing Arts, Sports, and Similar Events with Facilities","8","0","0","56",
"Wyoming","2003","711320","Promoters of Performing Arts, Sports, and Similar Events without Facilities","9","0","0","56",
"Wyoming","2003","81111 ","Automotive Mechanical and Electrical Repair and Maintenance","270","1049","25714","56",
"Wyoming","2003","7114  ","Agents and Managers for Artists, Athletes, Entertainers, and Other Public Figures","3","0","0","56",
"Wyoming","2003","811   ","Repair and Maintenance","698","3040","82829","56",
"Wyoming","2003","8111  ","Automotive Repair and Maintenance","477","2064","48937","56",
"Wyoming","2003","115116","Farm Management Services","2","0","0","56",
"Wyoming","2003","1153  ","Support Activities for Forestry","5","0","0","56",
"Wyoming","2003","811111","General Automotive Repair","232","921","22444","56",
"Wyoming","2003","811112","Automotive Exhaust System Repair","3","9","200","56",
"Wyoming","2003","1152  ","Support Activities for Animal Production","19","0","0","56",
"Wyoming","2003","11521 ","Support Activities for Animal Production","19","0","0","56",
"Wyoming","2003","115210","Support Activities for Animal Production","19","0","0","56",
"Wyoming","2003","23721 ","Land Subdivision","25","50","2674","56",
"Wyoming","2003","23713 ","Power and Communication Line and Related Structures Construction","23","0","0","56",
"Wyoming","2003","237130","Power and Communication Line and Related Structures Construction","23","0","0","56",
"Wyoming","2003","2372  ","Land Subdivision","25","50","2674","56",
"Wyoming","2003","31151 ","Dairy Product (except Frozen) Manufacturing","1","0","0","56",
"Wyoming","2003","311611","Animal (except Poultry) Slaughtering","24","0","0","56",
"Wyoming","2003","311514","Dry, Condensed, and Evaporated Dairy Product Manufacturing","1","0","0","56",
"Wyoming","2003","3116  ","Animal Slaughtering and Processing","33","118","1752","56",
"Wyoming","2003","31161 ","Animal Slaughtering and Processing","33","118","1752","56",
"Wyoming","2003","33243 ","Metal Can, Box, and Other Metal Container (Light Gauge) Manufacturing","1","0","0","56",
"Wyoming","2003","332510","Hardware Manufacturing","2","0","0","56",
"Wyoming","2003","332431","Metal Can Manufacturing","1","0","0","56",
"Wyoming","2003","3325  ","Hardware Manufacturing","2","0","0","56",
"Wyoming","2003","33251 ","Hardware Manufacturing","2","0","0","56",
"Wyoming","2003","332999","All Other Miscellaneous Fabricated Metal Product Manufacturing","10","155","4985","56",
"Wyoming","2003","333111","Farm Machinery and Equipment Manufacturing","5","0","0","56",
"Wyoming","2003","333   ","Machinery Manufacturing","29","610","20588","56",
"Wyoming","2003","3331  ","Agriculture, Construction, and Mining Machinery Manufacturing","16","0","0","56",
"Wyoming","2003","33311 ","Agricultural Implement Manufacturing","6","0","0","56",
"Wyoming","2003","33411 ","Computer and Peripheral Equipment Manufacturing","2","0","0","56",
"Wyoming","2003","333999","All Other Miscellaneous General Purpose Machinery Manufacturing","1","0","0","56",
"Wyoming","2003","334   ","Computer and Electronic Product Manufacturing","14","0","0","56",
"Wyoming","2003","3341  ","Computer and Peripheral Equipment Manufacturing","2","0","0","56",
"Wyoming","2003","335991","Carbon and Graphite Product Manufacturing","1","0","0","56",
"Wyoming","2003","33611 ","Automobile and Light Duty Motor Vehicle Manufacturing","1","0","0","56",
"Wyoming","2003","335999","All Other Miscellaneous Electrical Equipment and Component Manufacturing","1","0","0","56",
"Wyoming","2003","336   ","Transportation Equipment Manufacturing","22","502","15093","56",
"Wyoming","2003","3361  ","Motor Vehicle Manufacturing","1","0","0","56",
"Wyoming","2003","339   ","Miscellaneous Manufacturing","46","350","9437","56",
"Wyoming","2003","33721 ","Office Furniture (including Fixtures) Manufacturing","7","0","0","56",
"Wyoming","2003","337212","Custom Architectural Woodwork and Millwork Manufacturing","6","0","0","56",
"Wyoming","2003","337215","Showcase, Partition, Shelving, and Locker Manufacturing","1","0","0","56",
"Wyoming","2003","42331 ","Lumber, Plywood, Millwork, and Wood Panel Merchant Wholesalers","13","98","3938","56",
"Wyoming","2003","423810","Construction and Mining (except Oil Well) Machinery and Equipment Merchant Wholesalers","23","711","37332","56",
"Wyoming","2003","423310","Lumber, Plywood, Millwork, and Wood Panel Merchant Wholesalers","13","98","3938","56",
"Wyoming","2003","42332 ","Brick, Stone, and Related Construction Material Merchant Wholesalers","7","0","0","56",
"Wyoming","2003","423320","Brick, Stone, and Related Construction Material Merchant Wholesalers","7","0","0","56",
"Wyoming","2003","424430","Dairy Product (except Dried or Canned) Merchant Wholesalers","9","0","0","56",
"Wyoming","2003","42382 ","Farm and Garden Machinery and Equipment Merchant Wholesalers","29","240","6415","56",
"Wyoming","2003","423820","Farm and Garden Machinery and Equipment Merchant Wholesalers","29","240","6415","56",
"Wyoming","2003","42383 ","Industrial Machinery and Equipment Merchant Wholesalers","145","1366","62139","56",
"Wyoming","2003","424470","Meat and Meat Product Merchant Wholesalers","3","0","0","56",
"Wyoming","2003","42445 ","Confectionery Merchant Wholesalers","3","0","0","56",
"Wyoming","2003","424450","Confectionery Merchant Wholesalers","3","0","0","56",
"Wyoming","2003","42447 ","Meat and Meat Product Merchant Wholesalers","3","0","0","56",
"Wyoming","2003","44112 ","Used Car Dealers","53","0","0","56",
"Wyoming","2003","441210","Recreational Vehicle Dealers","20","0","0","56",
"Wyoming","2003","441120","Used Car Dealers","53","0","0","56",
"Wyoming","2003","4412  ","Other Motor Vehicle Dealers","64","0","0","56",
"Wyoming","2003","44121 ","Recreational Vehicle Dealers","20","0","0","56",
"Wyoming","2003","44531 ","Beer, Wine, and Liquor Stores","112","786","10826","56",
"Wyoming","2003","44611 ","Pharmacies and Drug Stores","57","566","12458","56",
"Wyoming","2003","445310","Beer, Wine, and Liquor Stores","112","786","10826","56",
"Wyoming","2003","446   ","Health and Personal Care Stores","123","840","17039","56",
"Wyoming","2003","4461  ","Health and Personal Care Stores","123","840","17039","56",
"Wyoming","2003","453110","Florists","63","358","3400","56",
"Wyoming","2003","45322 ","Gift, Novelty, and Souvenir Stores","112","483","15951","56",
"Wyoming","2003","4532  ","Office Supplies, Stationery, and Gift Stores","143","742","21314","56",
"Wyoming","2003","45321 ","Office Supplies and Stationery Stores","31","259","5363","56",
"Wyoming","2003","453210","Office Supplies and Stationery Stores","31","259","5363","56",
"Wyoming","2003","485310","Taxi Service","10","0","0","56",
"Wyoming","2003","48532 ","Limousine Service","3","0","0","56",
"Wyoming","2003","518210","Data Processing, Hosting, and Related Services","15","0","0","56",
"Wyoming","2003","485320","Limousine Service","3","0","0","56",
"Wyoming","2003","4854  ","School and Employee Bus Transportation","2","0","0","56",
"Wyoming","2003","48541 ","School and Employee Bus Transportation","2","0","0","56",
"Wyoming","2003","519110","News Syndicates","1","0","0","56",
"Wyoming","2003","519   ","Other Information Services","5","0","0","56",
"Wyoming","2003","5191  ","Other Information Services","5","0","0","56",
"Wyoming","2003","51911 ","News Syndicates","1","0","0","56",
"Wyoming","2003","522292","Real Estate Credit","29","0","0","56",
"Wyoming","2003","52231 ","Mortgage and Nonmortgage Loan Brokers","16","0","0","56",
"Wyoming","2003","522294","Secondary Market Financing","3","0","0","56",
"Wyoming","2003","522298","All Other Nondepository Credit Intermediation","19","0","0","56",
"Wyoming","2003","5223  ","Activities Related to Credit Intermediation","38","0","0","56",
"Wyoming","2003","524   ","Insurance Carriers and Related Activities","393","0","0","56",
"Wyoming","2003","524114","Direct Health and Medical Insurance Carriers","16","0","0","56",
"Wyoming","2003","5241  ","Insurance Carriers","80","980","32450","56",
"Wyoming","2003","52411 ","Direct Life, Health, and Medical Insurance Carriers","30","0","0","56",
"Wyoming","2003","524113","Direct Life Insurance Carriers","14","0","0","56",
"Wyoming","2003","53119 ","Lessors of Other Real Estate Property","57","0","0","56",
"Wyoming","2003","531190","Lessors of Other Real Estate Property","57","0","0","56",
"Wyoming","2003","53242 ","Office Machinery and Equipment Rental and Leasing","2","0","0","56",
"Wyoming","2003","5312  ","Offices of Real Estate Agents and Brokers","226","499","11948","56",
"Wyoming","2003","53121 ","Offices of Real Estate Agents and Brokers","226","499","11948","56",
"Wyoming","2003","531210","Offices of Real Estate Agents and Brokers","226","499","11948","56",
"Wyoming","2003","541410","Interior Design Services","9","0","0","56",
"Wyoming","2003","532420","Office Machinery and Equipment Rental and Leasing","2","0","0","56",
"Wyoming","2003","53249 ","Other Commercial and Industrial Machinery and Equipment Rental and Leasing","17","272","9740","56",
"Wyoming","2003","532490","Other Commercial and Industrial Machinery and Equipment Rental and Leasing","17","272","9740","56",
"Wyoming","2003","54143 ","Graphic Design Services","12","0","0","56",
"Wyoming","2003","541922","Commercial Photography","5","0","0","56",
"Wyoming","2003","541430","Graphic Design Services","12","0","0","56",
"Wyoming","2003","54149 ","Other Specialized Design Services","4","0","0","56",
"Wyoming","2003","541490","Other Specialized Design Services","4","0","0","56",
"Wyoming","2003","54193 ","Translation and Interpretation Services","2","0","0","56",
"Wyoming","2003","561599","All Other Travel Arrangement and Reservation Services","7","0","0","56",
"Wyoming","2003","541930","Translation and Interpretation Services","2","0","0","56",
"Wyoming","2003","54194 ","Veterinary Services","100","675","11399","56",
"Wyoming","2003","541940","Veterinary Services","100","675","11399","56",
"Wyoming","2003","5616  ","Investigation and Security Services","43","0","0","56",
"Wyoming","2003","6115  ","Technical and Trade Schools","18","0","0","56",
"Wyoming","2003","56161 ","Investigation, Guard, and Armored Car Services","26","0","0","56",
"Wyoming","2003","561611","Investigation Services","8","0","0","56",
"Wyoming","2003","561612","Security Guards and Patrol Services","16","0","0","56",
"Wyoming","2003","61151 ","Technical and Trade Schools","18","0","0","56",
"Wyoming","2003","611511","Cosmetology and Barber Schools","6","0","0","56",
"Wyoming","2003","6221  ","General Medical and Surgical Hospitals","26","0","0","56",
"Wyoming","2003","611512","Flight Training","2","0","0","56",
"Wyoming","2003","611513","Apprenticeship Training","6","0","0","56",
"Wyoming","2003","622   ","Hospitals","31","0","0","56",
"Wyoming","2003","71141 ","Agents and Managers for Artists, Athletes, Entertainers, and Other Public Figures","3","0","0","56",
"Wyoming","2003","62211 ","General Medical and Surgical Hospitals","26","0","0","56",
"Wyoming","2003","622110","General Medical and Surgical Hospitals","26","0","0","56",
"Wyoming","2003","6222  ","Psychiatric and Substance Abuse Hospitals","5","0","0","56",
"Wyoming","2003","711410","Agents and Managers for Artists, Athletes, Entertainers, and Other Public Figures","3","0","0","56",
"Wyoming","2003","811118","Other Automotive Mechanical and Electrical Repair and Maintenance","22","73","1633","56",
"Wyoming","2003","7115  ","Independent Artists, Writers, and Performers","41","78","1768","56",
"Wyoming","2003","71151 ","Independent Artists, Writers, and Performers","41","78","1768","56",
"Wyoming","2003","811113","Automotive Transmission Repair","13","46","1437","56",
"Wyoming","2003","11531 ","Support Activities for Forestry","5","0","0","56",
"Wyoming","2003","115310","Support Activities for Forestry","5","0","0","56",
"Wyoming","2003","21    ","Mining","760","16824","917049","56",
"Wyoming","2003","211   ","Oil and Gas Extraction","213","2511","157313","56",
"Wyoming","2003","23731 ","Highway, Street, and Bridge Construction","62","1334","62597","56",
"Wyoming","2003","81112 ","Automotive Body, Paint, Interior, and Glass Repair","126","564","15926","56",
"Wyoming","2003","811121","Automotive Body, Paint, and Interior Repair and Maintenance","94","0","0","56",
"Wyoming","2003","2111  ","Oil and Gas Extraction","213","2511","157313","56",
"Wyoming","2003","237210","Land Subdivision","25","50","2674","56",
"Wyoming","2003","2373  ","Highway, Street, and Bridge Construction","62","1334","62597","56",
"Wyoming","2003","237310","Highway, Street, and Bridge Construction","62","1334","62597","56",
"Wyoming","2003","3118  ","Bakeries and Tortilla Manufacturing","8","0","0","56",
"Wyoming","2003","2379  ","Other Heavy and Civil Engineering Construction","31","172","6013","56",
"Wyoming","2003","311612","Meat Processed from Carcasses","6","0","0","56",
"Wyoming","2003","311615","Poultry Processing","3","0","0","56",
"Wyoming","2003","31181 ","Bread and Bakery Product Manufacturing","7","0","0","56",
"Wyoming","2003","333120","Construction Machinery Manufacturing","1","0","0","56",
"Wyoming","2003","311811","Retail Bakeries","5","0","0","56",
"Wyoming","2003","333112","Lawn and Garden Tractor and Home Lawn and Garden Equipment Manufacturing","1","0","0","56",
"Wyoming","2003","33312 ","Construction Machinery Manufacturing","1","0","0","56",
"Wyoming","2003","3343  ","Audio and Video Equipment Manufacturing","1","0","0","56",
"Wyoming","2003","33313 ","Mining and Oil and Gas Field Machinery Manufacturing","9","214","9400","56",
"Wyoming","2003","334111","Electronic Computer Manufacturing","1","0","0","56",
"Wyoming","2003","334112","Computer Storage Device Manufacturing","1","0","0","56",
"Wyoming","2003","33431 ","Audio and Video Equipment Manufacturing","1","0","0","56",
"Wyoming","2003","33621 ","Motor Vehicle Body and Trailer Manufacturing","6","0","0","56",
"Wyoming","2003","334310","Audio and Video Equipment Manufacturing","1","0","0","56",
"Wyoming","2003","336112","Light Truck and Utility Vehicle Manufacturing","1","0","0","56",
"Wyoming","2003","3362  ","Motor Vehicle Body and Trailer Manufacturing","6","0","0","56",
"Wyoming","2003","339111","Laboratory Apparatus and Furniture Manufacturing","1","0","0","56",
"Wyoming","2003","336211","Motor Vehicle Body Manufacturing","1","0","0","56",
"Wyoming","2003","3391  ","Medical Equipment and Supplies Manufacturing","17","0","0","56",
"Wyoming","2003","33911 ","Medical Equipment and Supplies Manufacturing","17","0","0","56",
"Wyoming","2003","339113","Surgical Appliance and Supplies Manufacturing","3","0","0","56",
"Wyoming","2003","42384 ","Industrial Supplies Merchant Wholesalers","28","163","6781","56",
"Wyoming","2003","42333 ","Roofing, Siding, and Insulation Material Merchant Wholesalers","6","0","0","56",
"Wyoming","2003","423330","Roofing, Siding, and Insulation Material Merchant Wholesalers","6","0","0","56",
"Wyoming","2003","42339 ","Other Construction Material Merchant Wholesalers","7","0","0","56",
"Wyoming","2003","423390","Other Construction Material Merchant Wholesalers","7","0","0","56",
"Wyoming","2003","423830","Industrial Machinery and Equipment Merchant Wholesalers","145","1366","62139","56",
"Wyoming","2003","423840","Industrial Supplies Merchant Wholesalers","28","163","6781","56",
"Wyoming","2003","42385 ","Service Establishment Equipment and Supplies Merchant Wholesalers","7","0","0","56",
"Wyoming","2003","42449 ","Other Grocery and Related Products Merchant Wholesalers","34","495","13226","56",
"Wyoming","2003","423850","Service Establishment Equipment and Supplies Merchant Wholesalers","7","0","0","56",
"Wyoming","2003","42448 ","Fresh Fruit and Vegetable Merchant Wholesalers","5","0","0","56",
"Wyoming","2003","424480","Fresh Fruit and Vegetable Merchant Wholesalers","5","0","0","56",
"Wyoming","2003","441222","Boat Dealers","4","0","0","56",
"Wyoming","2003","424490","Other Grocery and Related Products Merchant Wholesalers","34","495","13226","56",
"Wyoming","2003","44122 ","Motorcycle, Boat, and Other Motor Vehicle Dealers","44","0","0","56",
"Wyoming","2003","441221","Motorcycle Dealers","24","0","0","56",
"Wyoming","2003","441229","All Other Motor Vehicle Dealers","16","0","0","56",
"Wyoming","2003","446120","Cosmetics, Beauty Supplies, and Perfume Stores","17","0","0","56",
"Wyoming","2003","4413  ","Automotive Parts, Accessories, and Tire Stores","183","0","0","56",
"Wyoming","2003","446110","Pharmacies and Drug Stores","57","566","12458","56",
"Wyoming","2003","44612 ","Cosmetics, Beauty Supplies, and Perfume Stores","17","0","0","56",
"Wyoming","2003","44613 ","Optical Goods Stores","18","88","1843","56",
"Wyoming","2003","45331 ","Used Merchandise Stores","57","234","3321","56",
"Wyoming","2003","446130","Optical Goods Stores","18","88","1843","56",
"Wyoming","2003","453220","Gift, Novelty, and Souvenir Stores","112","483","15951","56",
"Wyoming","2003","4533  ","Used Merchandise Stores","57","234","3321","56",
"Wyoming","2003","453310","Used Merchandise Stores","57","234","3321","56",
"Wyoming","2003","48551 ","Charter Bus Industry","3","0","0","56",
"Wyoming","2003","4539  ","Other Miscellaneous Store Retailers","158","682","14769","56",
"Wyoming","2003","485410","School and Employee Bus Transportation","2","0","0","56",
"Wyoming","2003","4855  ","Charter Bus Industry","3","0","0","56",
"Wyoming","2003","485510","Charter Bus Industry","3","0","0","56",
"Wyoming","2003","4859  ","Other Transit and Ground Passenger Transportation","4","0","0","56",
"Wyoming","2003","524126","Direct Property and Casualty Insurance Carriers","25","491","14731","56",
"Wyoming","2003","522310","Mortgage and Nonmortgage Loan Brokers","16","0","0","56",
"Wyoming","2003","52232 ","Financial Transactions Processing, Reserve, and Clearinghouse Activities","2","0","0","56",
"Wyoming","2003","522320","Financial Transactions Processing, Reserve, and Clearinghouse Activities","2","0","0","56",
"Wyoming","2003","52239 ","Other Activities Related to Credit Intermediation","20","0","0","56",
"Wyoming","2003","52412 ","Direct Insurance (except Life, Health, and Medical) Carriers","49","0","0","56",
"Wyoming","2003","524127","Direct Title Insurance Carriers","23","0","0","56",
"Wyoming","2003","531311","Residential Property Managers","37","0","0","56",
"Wyoming","2003","524128","Other Direct Insurance (except Life, Health, and Medical) Carriers","1","0","0","56",
"Wyoming","2003","5313  ","Activities Related to Real Estate","118","474","12771","56",
"Wyoming","2003","53131 ","Real Estate Property Managers","51","0","0","56",
"Wyoming","2003","531312","Nonresidential Property Managers","14","0","0","56",
"Wyoming","2003","53311 ","Lessors of Nonfinancial Intangible Assets (except Copyrighted Works)","6","0","0","56",
"Wyoming","2003","53132 ","Offices of Real Estate Appraisers","41","0","0","56",
"Wyoming","2003","533   ","Lessors of Nonfinancial Intangible Assets (except Copyrighted Works)","6","0","0","56",
"Wyoming","2003","5331  ","Lessors of Nonfinancial Intangible Assets (except Copyrighted Works)","6","0","0","56",
"Wyoming","2003","541512","Computer Systems Design Services","36","0","0","56",
"Wyoming","2003","5415  ","Computer Systems Design and Related Services","91","475","10433","56",
"Wyoming","2003","54151 ","Computer Systems Design and Related Services","91","475","10433","56",
"Wyoming","2003","541511","Custom Computer Programming Services","39","0","0","56",
"Wyoming","2003","541513","Computer Facilities Management Services","3","0","0","56",
"Wyoming","2003","551   ","Management of Companies and Enterprises","79","892","52115","56",
"Wyoming","2003","54199 ","All Other Professional, Scientific, and Technical Services","51","0","0","56",
"Wyoming","2003","541990","All Other Professional, Scientific, and Technical Services","51","0","0","56",
"Wyoming","2003","55    ","Management of Companies and Enterprises","79","892","52115","56",
"Wyoming","2003","561622","Locksmiths","7","0","0","56",
"Wyoming","2003","561613","Armored Car Services","2","0","0","56",
"Wyoming","2003","56162 ","Security Systems Services","17","0","0","56",
"Wyoming","2003","561621","Security Systems Services (except Locksmiths)","10","0","0","56",
"Wyoming","2003","5617  ","Services to Buildings and Dwellings","391","1633","31052","56",
"Wyoming","2003","611519","Other Technical and Trade Schools","4","0","0","56",
"Wyoming","2003","61162 ","Sports and Recreation Instruction","34","0","0","56",
"Wyoming","2003","6116  ","Other Schools and Instruction","72","520","8915","56",
"Wyoming","2003","61161 ","Fine Arts Schools","18","0","0","56",
"Wyoming","2003","611610","Fine Arts Schools","18","0","0","56",
"Wyoming","2003","6231  ","Nursing Care Facilities","26","2532","53220","56",
"Wyoming","2003","62221 ","Psychiatric and Substance Abuse Hospitals","5","0","0","56",
"Wyoming","2003","622210","Psychiatric and Substance Abuse Hospitals","5","0","0","56",
"Wyoming","2003","623   ","Nursing and Residential Care Facilities","108","0","0","56",
"Wyoming","2003","71211 ","Museums","33","0","0","56",
"Wyoming","2003","711510","Independent Artists, Writers, and Performers","41","78","1768","56",
"Wyoming","2003","712   ","Museums, Historical Sites, and Similar Institutions","43","312","7543","56",
"Wyoming","2003","7121  ","Museums, Historical Sites, and Similar Institutions","43","312","7543","56",
"Wyoming","2003","712110","Museums","33","0","0","56",
"Wyoming","2003","811192","Car Washes","47","213","2515","56",
"Wyoming","2003","811122","Automotive Glass Replacement Shops","32","0","0","56",
"Wyoming","2003","81119 ","Other Automotive Repair and Maintenance","81","451","7297","56",
"Wyoming","2003","811191","Automotive Oil Change and Lubrication Shops","28","211","3663","56",
"Wyoming","2003","811198","All Other Automotive Repair and Maintenance","6","27","1119","56",
"Wyoming","2003","21111 ","Oil and Gas Extraction","213","2511","157313","56",
"Wyoming","2003","211111","Crude Petroleum and Natural Gas Extraction","179","1874","113128","56",
"Wyoming","2003","23799 ","Other Heavy and Civil Engineering Construction","31","172","6013","56",
"Wyoming","2003","211112","Natural Gas Liquid Extraction","34","637","44185","56",
"Wyoming","2003","212   ","Mining (except Oil and Gas)","66","6249","370846","56",
"Wyoming","2003","2121  ","Coal Mining","19","4910","313370","56",
"Wyoming","2003","237990","Other Heavy and Civil Engineering Construction","31","172","6013","56",
"Wyoming","2003","31183 ","Tortilla Manufacturing","1","0","0","56",
"Wyoming","2003","238   ","Specialty Trade Contractors","1502","7130","225540","56",
"Wyoming","2003","2381  ","Foundation, Structure, and Building Exterior Contractors","407","1861","51261","56",
"Wyoming","2003","311812","Commercial Bakeries","2","0","0","56",
"Wyoming","2003","3344  ","Semiconductor and Other Electronic Component Manufacturing","2","0","0","56",
"Wyoming","2003","311830","Tortilla Manufacturing","1","0","0","56",
"Wyoming","2003","3119  ","Other Food Manufacturing","5","0","0","56",
"Wyoming","2003","31191 ","Snack Food Manufacturing","1","0","0","56",
"Wyoming","2003","33441 ","Semiconductor and Other Electronic Component Manufacturing","2","0","0","56",
"Wyoming","2003","336214","Travel Trailer and Camper Manufacturing","3","0","0","56",
"Wyoming","2003","334419","Other Electronic Component Manufacturing","2","0","0","56",
"Wyoming","2003","3345  ","Navigational, Measuring, Electromedical, and Control Instruments Manufacturing","9","0","0","56",
"Wyoming","2003","336212","Truck Trailer Manufacturing","2","0","0","56",
"Wyoming","2003","339115","Ophthalmic Goods Manufacturing","1","0","0","56",
"Wyoming","2003","3363  ","Motor Vehicle Parts Manufacturing","11","0","0","56",
"Wyoming","2003","33631 ","Motor Vehicle Gasoline Engine and Engine Parts Manufacturing","5","0","0","56",
"Wyoming","2003","336312","Gasoline Engine and Engine Parts Manufacturing","5","0","0","56",
"Wyoming","2003","339116","Dental Laboratories","12","0","0","56",
"Wyoming","2003","3399  ","Other Miscellaneous Manufacturing","29","0","0","56",
"Wyoming","2003","42342 ","Office Equipment Merchant Wholesalers","12","0","0","56",
"Wyoming","2003","33991 ","Jewelry and Silverware Manufacturing","2","0","0","56",
"Wyoming","2003","339911","Jewelry (except Costume) Manufacturing","2","0","0","56",
"Wyoming","2003","4234  ","Professional and Commercial Equipment and Supplies Merchant Wholesalers","37","264","8734","56",
