"Pennsylvania","2007","332994","Small Arms Manufacturing","12","0","0","42",
"Pennsylvania","2007","333294","Food Product Machinery Manufacturing","19","634","40012","42",
"Pennsylvania","2007","332996","Fabricated Pipe and Pipe Fitting Manufacturing","42","1939","85950","42",
"Pennsylvania","2007","332997","Industrial Pattern Manufacturing","39","264","8593","42",
"Pennsylvania","2007","333293","Printing Machinery and Equipment Manufacturing","23","0","0","42",
"Pennsylvania","2007","3336  ","Engine, Turbine, and Power Transmission Equipment Manufacturing","36","2317","116307","42",
"Pennsylvania","2007","333295","Semiconductor Machinery Manufacturing","7","386","29676","42",
"Pennsylvania","2007","333298","All Other Industrial Machinery Manufacturing","86","2661","125446","42",
"Pennsylvania","2007","333518","Other Metalworking Machinery Manufacturing","16","524","27261","42",
"Pennsylvania","2007","33411 ","Computer and Peripheral Equipment Manufacturing","52","2321","135091","42",
"Pennsylvania","2007","33361 ","Engine, Turbine, and Power Transmission Equipment Manufacturing","36","2317","116307","42",
"Pennsylvania","2007","333611","Turbine and Turbine Generator Set Units Manufacturing","11","1365","69058","42",
"Pennsylvania","2007","3341  ","Computer and Peripheral Equipment Manufacturing","52","2321","135091","42",
"Pennsylvania","2007","334111","Electronic Computer Manufacturing","11","309","15649","42",
"Pennsylvania","2007","334612","Prerecorded Compact Disc (except Software), Tape, and Record Reproducing","15","0","0","42",
"Pennsylvania","2007","334112","Computer Storage Device Manufacturing","1","0","0","42",
"Pennsylvania","2007","334417","Electronic Connector Manufacturing","16","2153","96705","42",
"Pennsylvania","2007","334418","Printed Circuit Assembly (Electronic Assembly) Manufacturing","42","2361","97210","42",
"Pennsylvania","2007","334419","Other Electronic Component Manufacturing","72","3241","122700","42",
"Pennsylvania","2007","3345  ","Navigational, Measuring, Electromedical, and Control Instruments Manufacturing","276","15844","933005","42",
"Pennsylvania","2007","334613","Magnetic and Optical Recording Media Manufacturing","7","102","4927","42",
"Pennsylvania","2007","335313","Switchgear and Switchboard Apparatus Manufacturing","29","1592","80804","42",
"Pennsylvania","2007","335   ","Electrical Equipment, Appliance, and Component Manufacturing","306","23869","1155453","42",
"Pennsylvania","2007","3351  ","Electric Lighting Equipment Manufacturing","62","3392","139274","42",
"Pennsylvania","2007","335312","Motor and Generator Manufacturing","18","1149","47993","42",
"Pennsylvania","2007","336213","Motor Home Manufacturing","3","0","0","42",
"Pennsylvania","2007","335314","Relay and Industrial Control Manufacturing","51","1832","103954","42",
"Pennsylvania","2007","3359  ","Other Electrical Equipment and Component Manufacturing","125","14427","723400","42",
"Pennsylvania","2007","336212","Truck Trailer Manufacturing","18","1727","54573","42",
"Pennsylvania","2007","336214","Travel Trailer and Camper Manufacturing","29","1325","41341","42",
"Pennsylvania","2007","336411","Aircraft Manufacturing","8","0","0","42",
"Pennsylvania","2007","3363  ","Motor Vehicle Parts Manufacturing","149","10986","430058","42",
"Pennsylvania","2007","3364  ","Aerospace Product and Parts Manufacturing","32","0","0","42",
"Pennsylvania","2007","33641 ","Aerospace Product and Parts Manufacturing","32","0","0","42",
"Pennsylvania","2007","337122","Nonupholstered Wood Household Furniture Manufacturing","181","1464","44345","42",
"Pennsylvania","2007","336412","Aircraft Engine and Engine Parts Manufacturing","7","0","0","42",
"Pennsylvania","2007","33712 ","Household and Institutional Furniture Manufacturing","290","4507","145174","42",
"Pennsylvania","2007","337121","Upholstered Household Furniture Manufacturing","38","0","0","42",
"Pennsylvania","2007","339116","Dental Laboratories","216","1684","58624","42",
"Pennsylvania","2007","337124","Metal Household Furniture Manufacturing","15","498","19826","42",
"Pennsylvania","2007","339114","Dental Equipment and Supplies Manufacturing","35","717","30976","42",
"Pennsylvania","2007","339115","Ophthalmic Goods Manufacturing","32","0","0","42",
"Pennsylvania","2007","339992","Musical Instrument Manufacturing","20","0","0","42",
"Pennsylvania","2007","3399  ","Other Miscellaneous Manufacturing","765","16542","686608","42",
"Pennsylvania","2007","33999 ","All Other Miscellaneous Manufacturing","336","8115","334863","42",
"Pennsylvania","2007","339991","Gasket, Packing, and Sealing Device Manufacturing","28","1420","77865","42",
"Pennsylvania","2007","423220","Home Furnishing Merchant Wholesalers","189","3098","143265","42",
"Pennsylvania","2007","339993","Fastener, Button, Needle, and Pin Manufacturing","7","142","3372","42",
"Pennsylvania","2007","423210","Furniture Merchant Wholesalers","184","3000","124869","42",
"Pennsylvania","2007","42322 ","Home Furnishing Merchant Wholesalers","189","3098","143265","42",
"Pennsylvania","2007","423440","Other Commercial Equipment Merchant Wholesalers","178","1913","85771","42",
"Pennsylvania","2007","4233  ","Lumber and Other Construction Materials Merchant Wholesalers","745","10987","528129","42",
"Pennsylvania","2007","423430","Computer and Computer Peripheral Equipment and Software Merchant Wholesalers","320","7741","633788","42",
"Pennsylvania","2007","42344 ","Other Commercial Equipment Merchant Wholesalers","178","1913","85771","42",
"Pennsylvania","2007","423690","Other Electronic Parts and Equipment Merchant Wholesalers","384","5380","379760","42",
"Pennsylvania","2007","42345 ","Medical, Dental, and Hospital Equipment and Supplies Merchant Wholesalers","314","6026","487140","42",
"Pennsylvania","2007","423620","Electrical and Electronic Appliance, Television, and Radio Set Merchant Wholesalers","74","1091","65259","42",
"Pennsylvania","2007","42369 ","Other Electronic Parts and Equipment Merchant Wholesalers","384","5380","379760","42",
"Pennsylvania","2007","423840","Industrial Supplies Merchant Wholesalers","491","5623","324391","42",
"Pennsylvania","2007","4237  ","Hardware, and Plumbing and Heating Equipment and Supplies Merchant Wholesalers","851","9582","492273","42",
"Pennsylvania","2007","423830","Industrial Machinery and Equipment Merchant Wholesalers","1145","14525","871834","42",
"Pennsylvania","2007","42384 ","Industrial Supplies Merchant Wholesalers","491","5623","324391","42",
"Pennsylvania","2007","42411 ","Printing and Writing Paper Merchant Wholesalers","65","886","61804","42",
"Pennsylvania","2007","42385 ","Service Establishment Equipment and Supplies Merchant Wholesalers","219","2287","94647","42",
"Pennsylvania","2007","424   ","Merchant Wholesalers, Nondurable Goods","4211","86198","4656521","42",
"Pennsylvania","2007","4241  ","Paper and Paper Product Merchant Wholesalers","451","6450","352436","42",
"Pennsylvania","2007","42443 ","Dairy Product (except Dried or Canned) Merchant Wholesalers","85","1292","65455","42",
"Pennsylvania","2007","424110","Printing and Writing Paper Merchant Wholesalers","65","886","61804","42",
"Pennsylvania","2007","42442 ","Packaged Frozen Food Merchant Wholesalers","102","4275","167722","42",
"Pennsylvania","2007","424420","Packaged Frozen Food Merchant Wholesalers","102","4275","167722","42",
"Pennsylvania","2007","42459 ","Other Farm Product Raw Material Merchant Wholesalers","20","127","7466","42",
"Pennsylvania","2007","424430","Dairy Product (except Dried or Canned) Merchant Wholesalers","85","1292","65455","42",
"Pennsylvania","2007","42452 ","Livestock Merchant Wholesalers","24","223","2773","42",
"Pennsylvania","2007","424520","Livestock Merchant Wholesalers","24","223","2773","42",
"Pennsylvania","2007","424590","Other Farm Product Raw Material Merchant Wholesalers","20","127","7466","42",
"Pennsylvania","2007","424820","Wine and Distilled Alcoholic Beverage Merchant Wholesalers","44","661","31545","42",
"Pennsylvania","2007","42481 ","Beer and Ale Merchant Wholesalers","184","3338","148646","42",
"Pennsylvania","2007","424810","Beer and Ale Merchant Wholesalers","184","3338","148646","42",
"Pennsylvania","2007","42482 ","Wine and Distilled Alcoholic Beverage Merchant Wholesalers","44","661","31545","42",
"Pennsylvania","2007","4251  ","Wholesale Electronic Markets and Agents and Brokers","2346","16100","750454","42",
"Pennsylvania","2007","42499 ","Other Miscellaneous Nondurable Goods Merchant Wholesalers","279","2762","129103","42",
"Pennsylvania","2007","424990","Other Miscellaneous Nondurable Goods Merchant Wholesalers","279","2762","129103","42",
"Pennsylvania","2007","425   ","Wholesale Electronic Markets and Agents and Brokers","2346","16100","750454","42",
"Pennsylvania","2007","441222","Boat Dealers","92","515","16230","42",
"Pennsylvania","2007","441210","Recreational Vehicle Dealers","107","1212","44940","42",
"Pennsylvania","2007","44122 ","Motorcycle, Boat, and Other Motor Vehicle Dealers","418","3995","128246","42",
"Pennsylvania","2007","441221","Motorcycle Dealers","267","2836","88543","42",
"Pennsylvania","2007","443112","Radio, Television, and Other Electronics Stores","988","11001","235469","42",
"Pennsylvania","2007","441229","All Other Motor Vehicle Dealers","59","644","23473","42",
"Pennsylvania","2007","44311 ","Appliance, Television, and Other Electronics Stores","1371","13512","303562","42",
"Pennsylvania","2007","443111","Household Appliance Stores","383","2511","68093","42",
"Pennsylvania","2007","44312 ","Computer and Software Stores","415","3159","77023","42",
"Pennsylvania","2007","44511 ","Supermarkets and Other Grocery (except Convenience) Stores","2514","123444","2136206","42",
"Pennsylvania","2007","444220","Nursery, Garden Center, and Farm Supply Stores","613","4688","115644","42",
"Pennsylvania","2007","445   ","Food and Beverage Stores","6752","147870","2590357","42",
"Pennsylvania","2007","4451  ","Grocery Stores","3593","131681","2266726","42",
"Pennsylvania","2007","5223  ","Activities Related to Credit Intermediation","1365","7459","307201","42",
"Pennsylvania","2007","4461  ","Health and Personal Care Stores","4085","52755","1434678","42",
"Pennsylvania","2007","44611 ","Pharmacies and Drug Stores","2180","41909","1147998","42",
"Pennsylvania","2007","446110","Pharmacies and Drug Stores","2180","41909","1147998","42",
"Pennsylvania","2007","44612 ","Cosmetics, Beauty Supplies, and Perfume Stores","486","3099","49463","42",
"Pennsylvania","2007","522293","International Trade Financing","5","0","0","42",
"Pennsylvania","2007","522294","Secondary Market Financing","15","0","0","42",
"Pennsylvania","2007","522298","All Other Nondepository Credit Intermediation","73","823","57194","42",
"Pennsylvania","2007","53119 ","Lessors of Other Real Estate Property","267","1570","57629","42",
"Pennsylvania","2007","52231 ","Mortgage and Nonmortgage Loan Brokers","845","4300","172417","42",
"Pennsylvania","2007","53113 ","Lessors of Miniwarehouses and Self-Storage Units","269","666","14580","42",
"Pennsylvania","2007","531130","Lessors of Miniwarehouses and Self-Storage Units","269","666","14580","42",
"Pennsylvania","2007","541320","Landscape Architectural Services","231","1293","69108","42",
"Pennsylvania","2007","531190","Lessors of Other Real Estate Property","267","1570","57629","42",
"Pennsylvania","2007","541310","Architectural Services","771","8295","552736","42",
"Pennsylvania","2007","54132 ","Landscape Architectural Services","231","1293","69108","42",
"Pennsylvania","2007","54133 ","Engineering Services","2147","38872","2730123","42",
"Pennsylvania","2007","54193 ","Translation and Interpretation Services","50","258","11315","42",
"Pennsylvania","2007","54192 ","Photographic Services","735","3349","61882","42",
"Pennsylvania","2007","541921","Photography Studios, Portrait","610","2888","46950","42",
"Pennsylvania","2007","541922","Commercial Photography","125","461","14932","42",
"Pennsylvania","2007","56174 ","Carpet and Upholstery Cleaning Services","253","1445","35485","42",
"Pennsylvania","2007","561720","Janitorial Services","2174","39566","676010","42",
"Pennsylvania","2007","56173 ","Landscaping Services","4193","17071","628188","42",
"Pennsylvania","2007","561730","Landscaping Services","4193","17071","628188","42",
"Pennsylvania","2007","611710","Educational Support Services","270","4193","163726","42",
"Pennsylvania","2007","611699","All Other Miscellaneous Schools and Instruction","152","1373","39831","42",
"Pennsylvania","2007","6117  ","Educational Support Services","270","4193","163726","42",
"Pennsylvania","2007","61171 ","Educational Support Services","270","4193","163726","42",
"Pennsylvania","2007","713   ","Amusement, Gambling, and Recreation Industries","3233","54153","957678","42",
"Pennsylvania","2007","623220","Residential Mental Health and Substance Abuse Facilities","432","11162","301508","42",
"Pennsylvania","2007","6233  ","Community Care Facilities for the Elderly","968","58441","1293359","42",
"Pennsylvania","2007","62331 ","Community Care Facilities for the Elderly","968","58441","1293359","42",
"Pennsylvania","2007","71219 ","Nature Parks and Other Similar Institutions","32","225","5859","42",
"Pennsylvania","2007","712190","Nature Parks and Other Similar Institutions","32","225","5859","42",
"Pennsylvania","2007","7131  ","Amusement Parks and Arcades","125","4032","108564","42",
"Pennsylvania","2007","8133  ","Social Advocacy Organizations","590","5622","177525","42",
"Pennsylvania","2007","811121","Automotive Body, Paint, and Interior Repair and Maintenance","1654","9384","315287","42",
"Pennsylvania","2007","811122","Automotive Glass Replacement Shops","211","888","31668","42",
"Pennsylvania","2007","81119 ","Other Automotive Repair and Maintenance","879","6593","107514","42",
"Pennsylvania","2007","811191","Automotive Oil Change and Lubrication Shops","185","1537","28166","42",
"Pennsylvania","2007","813219","Other Grantmaking and Giving Services","155","1189","52575","42",
"Pennsylvania","2007","81331 ","Social Advocacy Organizations","590","5622","177525","42",
"Pennsylvania","2007","813311","Human Rights Organizations","88","946","29166","42",
"Pennsylvania","2007","52232 ","Financial Transactions Processing, Reserve, and Clearinghouse Activities","102","1622","63079","42",
"Pennsylvania","2007","516   ","Internet Publishing and Broadcasting","75","1188","79180","42",
"Pennsylvania","2007","5161  ","Internet Publishing and Broadcasting","75","1188","79180","42",
"Pennsylvania","2007","51611 ","Internet Publishing and Broadcasting","75","1188","79180","42",
"Pennsylvania","2007","516110","Internet Publishing and Broadcasting","75","1188","79180","42",
"Pennsylvania","2007","522310","Mortgage and Nonmortgage Loan Brokers","845","4300","172417","42",
"Pennsylvania","2007","531210","Offices of Real Estate Agents and Brokers","2239","9878","430568","42",
"Pennsylvania","2007","522320","Financial Transactions Processing, Reserve, and Clearinghouse Activities","102","1622","63079","42",
"Pennsylvania","2007","5312  ","Offices of Real Estate Agents and Brokers","2239","9878","430568","42",
"Pennsylvania","2007","53121 ","Offices of Real Estate Agents and Brokers","2239","9878","430568","42",
"Pennsylvania","2007","541340","Drafting Services","141","619","30246","42",
"Pennsylvania","2007","5313  ","Activities Related to Real Estate","2170","19116","911812","42",
"Pennsylvania","2007","541330","Engineering Services","2147","38872","2730123","42",
"Pennsylvania","2007","54134 ","Drafting Services","141","619","30246","42",
"Pennsylvania","2007","54135 ","Building Inspection Services","251","1010","38819","42",
"Pennsylvania","2007","541940","Veterinary Services","1023","11010","336465","42",
"Pennsylvania","2007","541350","Building Inspection Services","251","1010","38819","42",
"Pennsylvania","2007","541930","Translation and Interpretation Services","50","258","11315","42",
"Pennsylvania","2007","54194 ","Veterinary Services","1023","11010","336465","42",
"Pennsylvania","2007","54199 ","All Other Professional, Scientific, and Technical Services","732","4340","202453","42",
"Pennsylvania","2007","561790","Other Services to Buildings and Dwellings","366","2259","75516","42",
"Pennsylvania","2007","541990","All Other Professional, Scientific, and Technical Services","732","4340","202453","42",
"Pennsylvania","2007","561740","Carpet and Upholstery Cleaning Services","253","1445","35485","42",
"Pennsylvania","2007","56179 ","Other Services to Buildings and Dwellings","366","2259","75516","42",
"Pennsylvania","2007","6211  ","Offices of Physicians","9015","116570","7805378","42",
"Pennsylvania","2007","5619  ","Other Support Services","773","12348","395182","42",
"Pennsylvania","2007","62    ","Health Care and Social Assistance","35243","882034","33511282","42",
"Pennsylvania","2007","621   ","Ambulatory Health Care Services","23195","292874","13961655","42",
"Pennsylvania","2007","62111 ","Offices of Physicians","9015","116570","7805378","42",
"Pennsylvania","2007","6239  ","Other Residential Care Facilities","315","9136","250042","42",
"Pennsylvania","2007","621111","Offices of Physicians (except Mental Health Specialists)","8630","114178","7706391","42",
"Pennsylvania","2007","623311","Continuing Care Retirement Communities","318","39757","955878","42",
"Pennsylvania","2007","623312","Homes for the Elderly","650","18684","337481","42",
"Pennsylvania","2007","62399 ","Other Residential Care Facilities","315","9136","250042","42",
"Pennsylvania","2007","71312 ","Amusement Arcades","93","926","9646","42",
"Pennsylvania","2007","623990","Other Residential Care Facilities","315","9136","250042","42",
"Pennsylvania","2007","71311 ","Amusement and Theme Parks","32","3106","98918","42",
"Pennsylvania","2007","713110","Amusement and Theme Parks","32","3106","98918","42",
"Pennsylvania","2007","713120","Amusement Arcades","93","926","9646","42",
"Pennsylvania","2007","8112  ","Electronic and Precision Equipment Repair and Maintenance","448","5418","284583","42",
"Pennsylvania","2007","7132  ","Gambling Industries","45","1560","58154","42",
"Pennsylvania","2007","811192","Car Washes","613","4790","72459","42",
"Pennsylvania","2007","811198","All Other Automotive Repair and Maintenance","81","266","6889","42",
"Pennsylvania","2007","8134  ","Civic and Social Organizations","2608","22959","306874","42",
"Pennsylvania","2007","81121 ","Electronic and Precision Equipment Repair and Maintenance","448","5418","284583","42",
"Pennsylvania","2007","813312","Environment, Conservation and Wildlife Organizations","231","2154","59333","42",
"Pennsylvania","2007","813319","Other Social Advocacy Organizations","271","2522","89026","42",
"Pennsylvania","2007","523   ","Securities, Commodity Contracts, and Other Financial Investments and Related Activities","3390","48564","5062761","42",
"Pennsylvania","2007","81341 ","Civic and Social Organizations","2608","22959","306874","42",
"Pennsylvania","2007","517   ","Telecommunications","2055","54292","2980973","42",
"Pennsylvania","2007","5171  ","Wired Telecommunications Carriers","1277","0","1402898","42",
"Pennsylvania","2007","51711 ","Wired Telecommunications Carriers","1277","0","1402898","42",
"Pennsylvania","2007","517110","Wired Telecommunications Carriers","1277","0","1402898","42",
"Pennsylvania","2007","52239 ","Other Activities Related to Credit Intermediation","418","1537","71705","42",
"Pennsylvania","2007","522390","Other Activities Related to Credit Intermediation","418","1537","71705","42",
"Pennsylvania","2007","54136 ","Geophysical Surveying and Mapping Services","22","118","4194","42",
"Pennsylvania","2007","5231  ","Securities and Commodity Contracts Intermediation and Brokerage","1558","18586","1878724","42",
"Pennsylvania","2007","53131 ","Real Estate Property Managers","1232","14307","679720","42",
"Pennsylvania","2007","531311","Residential Property Managers","759","9213","388185","42",
"Pennsylvania","2007","531312","Nonresidential Property Managers","473","5094","291535","42",
"Pennsylvania","2007","53132 ","Offices of Real Estate Appraisers","438","1831","69277","42",
"Pennsylvania","2007","541360","Geophysical Surveying and Mapping Services","22","118","4194","42",
"Pennsylvania","2007","551   ","Management of Companies and Enterprises","2091","140905","13796449","42",
"Pennsylvania","2007","54137 ","Surveying and Mapping (except Geophysical) Services","317","1601","65166","42",
"Pennsylvania","2007","541370","Surveying and Mapping (except Geophysical) Services","317","1601","65166","42",
"Pennsylvania","2007","55    ","Management of Companies and Enterprises","2091","140905","13796449","42",
"Pennsylvania","2007","56192 ","Convention and Trade Show Organizers","113","1782","54314","42",
"Pennsylvania","2007","5511  ","Management of Companies and Enterprises","2091","140905","13796449","42",
"Pennsylvania","2007","56191 ","Packaging and Labeling Services","85","3359","102414","42",
"Pennsylvania","2007","561910","Packaging and Labeling Services","85","3359","102414","42",
"Pennsylvania","2007","624   ","Social Assistance","7413","127001","2441214","42",
"Pennsylvania","2007","561920","Convention and Trade Show Organizers","113","1782","54314","42",
"Pennsylvania","2007","621112","Offices of Physicians, Mental Health Specialists","385","2392","98987","42",
"Pennsylvania","2007","6212  ","Offices of Dentists","5277","33574","1286701","42",
"Pennsylvania","2007","62121 ","Offices of Dentists","5277","33574","1286701","42",
"Pennsylvania","2007","621210","Offices of Dentists","5277","33574","1286701","42",
"Pennsylvania","2007","6241  ","Individual and Family Services","3247","63702","1380071","42",
"Pennsylvania","2007","713210","Casinos (except Casino Hotels)","3","0","0","42",
"Pennsylvania","2007","62411 ","Child and Youth Services","539","11345","289813","42",
"Pennsylvania","2007","624110","Child and Youth Services","539","11345","289813","42",
"Pennsylvania","2007","71321 ","Casinos (except Casino Hotels)","3","0","0","42",
"Pennsylvania","2007","71329 ","Other Gambling Industries","42","711","16909","42",
"Pennsylvania","2007","813410","Civic and Social Organizations","2608","22959","306874","42",
"Pennsylvania","2007","713290","Other Gambling Industries","42","711","16909","42",
"Pennsylvania","2007","811211","Consumer Electronics Repair and Maintenance","89","449","15350","42",
"Pennsylvania","2007","811212","Computer and Office Machine Repair and Maintenance","144","1321","64075","42",
"Pennsylvania","2007","811213","Communication Equipment Repair and Maintenance","62","0","0","42",
"Pennsylvania","2007","811219","Other Electronic and Precision Equipment Repair and Maintenance","153","2139","127552","42",
"Pennsylvania","2007","8139  ","Business, Professional, Labor, Political, and Similar Organizations","2272","21597","709866","42",
"Pennsylvania","2007","81391 ","Business Associations","524","3341","157632","42",
"Pennsylvania","2007","531320","Offices of Real Estate Appraisers","438","1831","69277","42",
"Pennsylvania","2007","813910","Business Associations","524","3341","157632","42",
"Pennsylvania","2007","5172  ","Wireless Telecommunications Carriers (except Satellite)","383","9153","518227","42",
"Pennsylvania","2007","51721 ","Wireless Telecommunications Carriers (except Satellite)","383","9153","518227","42",
"Pennsylvania","2007","517211","Paging","7","0","0","42",
"Pennsylvania","2007","517212","Cellular and Other Wireless Telecommunications","376","9080","514209","42",
"Pennsylvania","2007","52311 ","Investment Banking and Securities Dealing","595","0","852520","42",
"Pennsylvania","2007","523110","Investment Banking and Securities Dealing","595","0","852520","42",
"Pennsylvania","2007","52312 ","Securities Brokerage","937","8700","1014609","42",
"Pennsylvania","2007","523120","Securities Brokerage","937","8700","1014609","42",
"Pennsylvania","2007","53139 ","Other Activities Related to Real Estate","500","2978","162815","42",
"Pennsylvania","2007","541380","Testing Laboratories","267","6291","312608","42",
"Pennsylvania","2007","531390","Other Activities Related to Real Estate","500","2978","162815","42",
"Pennsylvania","2007","532   ","Rental and Leasing Services","2239","23363","773838","42",
"Pennsylvania","2007","54138 ","Testing Laboratories","267","6291","312608","42",
"Pennsylvania","2007","551111","Offices of Bank Holding Companies","32","0","0","42",
"Pennsylvania","2007","5414  ","Specialized Design Services","917","4443","227613","42",
"Pennsylvania","2007","54141 ","Interior Design Services","310","1516","83465","42",
"Pennsylvania","2007","55111 ","Management of Companies and Enterprises","2091","140905","13796449","42",
"Pennsylvania","2007","551112","Offices of Other Holding Companies","242","7006","625314","42",
"Pennsylvania","2007","562   ","Waste Management and Remediation Services","986","17010","700310","42",
"Pennsylvania","2007","551114","Corporate, Subsidiary, and Regional Managing Offices","1817","131489","12920298","42",
"Pennsylvania","2007","56199 ","All Other Support Services","575","7207","238454","42",
"Pennsylvania","2007","561990","All Other Support Services","575","7207","238454","42",
"Pennsylvania","2007","62131 ","Offices of Chiropractors","1890","6957","164709","42",
"Pennsylvania","2007","5621  ","Waste Collection","461","8115","333680","42",
"Pennsylvania","2007","56211 ","Waste Collection","461","8115","333680","42",
"Pennsylvania","2007","6213  ","Offices of Other Health Practitioners","5524","34208","1034781","42",
"Pennsylvania","2007","624120","Services for the Elderly and Persons with Disabilities","1439","25797","453204","42",
"Pennsylvania","2007","621310","Offices of Chiropractors","1890","6957","164709","42",
"Pennsylvania","2007","62132 ","Offices of Optometrists","906","4513","142878","42",
