"Nevada","2003","51791 ","Other Telecommunications","4","0","0","32",
"Nevada","2003","524113","Direct Life Insurance Carriers","37","0","0","32",
"Nevada","2003","52412 ","Direct Insurance (except Life, Health, and Medical) Carriers","159","3148","155478","32",
"Nevada","2003","5331  ","Lessors of Nonfinancial Intangible Assets (except Copyrighted Works)","59","248","9469","32",
"Nevada","2003","524126","Direct Property and Casualty Insurance Carriers","92","1679","81945","32",
"Nevada","2003","532490","Other Commercial and Industrial Machinery and Equipment Rental and Leasing","78","979","38311","32",
"Nevada","2003","533   ","Lessors of Nonfinancial Intangible Assets (except Copyrighted Works)","59","248","9469","32",
"Nevada","2003","54185 ","Display Advertising","31","286","10984","32",
"Nevada","2003","53311 ","Lessors of Nonfinancial Intangible Assets (except Copyrighted Works)","59","248","9469","32",
"Nevada","2003","54184 ","Media Representatives","20","77","2663","32",
"Nevada","2003","541840","Media Representatives","20","77","2663","32",
"Nevada","2003","541850","Display Advertising","31","286","10984","32",
"Nevada","2003","56171 ","Exterminating and Pest Control Services","128","761","21823","32",
"Nevada","2003","54186 ","Direct Mail Advertising","29","309","9215","32",
"Nevada","2003","541860","Direct Mail Advertising","29","309","9215","32",
"Nevada","2003","5617  ","Services to Buildings and Dwellings","1480","14655","307471","32",
"Nevada","2003","561710","Exterminating and Pest Control Services","128","761","21823","32",
"Nevada","2003","56172 ","Janitorial Services","511","5511","75858","32",
"Nevada","2003","6212  ","Offices of Dentists","786","5701","235360","32",
"Nevada","2003","561720","Janitorial Services","511","5511","75858","32",
"Nevada","2003","621111","Offices of Physicians (except Mental Health Specialists)","1739","13206","844531","32",
"Nevada","2003","621112","Offices of Physicians, Mental Health Specialists","45","119","6180","32",
"Nevada","2003","62121 ","Offices of Dentists","786","5701","235360","32",
"Nevada","2003","62422 ","Community Housing Services","38","482","10474","32",
"Nevada","2003","621210","Offices of Dentists","786","5701","235360","32",
"Nevada","2003","62421 ","Community Food Services","16","284","4346","32",
"Nevada","2003","624210","Community Food Services","16","284","4346","32",
"Nevada","2003","624221","Temporary Shelters","23","352","6844","32",
"Nevada","2003","721120","Casino Hotels","156","191798","5390598","32",
"Nevada","2003","624229","Other Community Housing Services","15","130","3630","32",
"Nevada","2003","721110","Hotels (except Casino Hotels) and Motels","406","9029","171420","32",
"Nevada","2003","72112 ","Casino Hotels","156","191798","5390598","32",
"Nevada","2003","72119 ","Other Traveler Accommodation","9","46","719","32",
"Nevada","2003","81221 ","Funeral Homes and Funeral Services","46","358","12560","32",
"Nevada","2003","721191","Bed-and-Breakfast Inns","4","0","0","32",
"Nevada","2003","721199","All Other Traveler Accommodation","5","0","0","32",
"Nevada","2003","8122  ","Death Care Services","57","436","14547","32",
"Nevada","2003","812210","Funeral Homes and Funeral Services","46","358","12560","32",
"Nevada","2003","81222 ","Cemeteries and Crematories","11","78","1987","32",
"Nevada","2003","11311 ","Timber Tract Operations","2","0","0","32",
"Nevada","2003","113110","Timber Tract Operations","2","0","0","32",
"Nevada","2003","221310","Water Supply and Irrigation Systems","25","0","0","32",
"Nevada","2003","812220","Cemeteries and Crematories","11","78","1987","32",
"Nevada","2003","1132  ","Forest Nurseries and Gathering of Forest Products","1","0","0","32",
"Nevada","2003","11321 ","Forest Nurseries and Gathering of Forest Products","1","0","0","32",
"Nevada","2003","2213  ","Water, Sewage and Other Systems","29","0","0","32",
"Nevada","2003","22131 ","Water Supply and Irrigation Systems","25","0","0","32",
"Nevada","2003","23891 ","Site Preparation Contractors","273","4466","197897","32",
"Nevada","2003","22132 ","Sewage Treatment Facilities","2","0","0","32",
"Nevada","2003","221320","Sewage Treatment Facilities","2","0","0","32",
"Nevada","2003","2389  ","Other Specialty Trade Contractors","606","7258","304364","32",
"Nevada","2003","313111","Yarn Spinning Mills","1","0","0","32",
"Nevada","2003","238910","Site Preparation Contractors","273","4466","197897","32",
"Nevada","2003","23899 ","All Other Specialty Trade Contractors","333","2792","106467","32",
"Nevada","2003","238990","All Other Specialty Trade Contractors","333","2792","106467","32",
"Nevada","2003","3132  ","Fabric Mills","1","0","0","32",
"Nevada","2003","31321 ","Broadwoven Fabric Mills","1","0","0","32",
"Nevada","2003","322299","All Other Converted Paper Product Manufacturing","5","0","0","32",
"Nevada","2003","313210","Broadwoven Fabric Mills","1","0","0","32",
"Nevada","2003","3133  ","Textile and Fabric Finishing and Fabric Coating Mills","2","0","0","32",
"Nevada","2003","322291","Sanitary Paper Product Manufacturing","2","0","0","32",
"Nevada","2003","323   ","Printing and Related Support Activities","200","2957","101877","32",
"Nevada","2003","326122","Plastics Pipe and Pipe Fitting Manufacturing","6","158","6727","32",
"Nevada","2003","3231  ","Printing and Related Support Activities","200","2957","101877","32",
"Nevada","2003","32311 ","Printing","183","2876","100153","32",
"Nevada","2003","326121","Unlaminated Plastics Profile Shape Manufacturing","1","0","0","32",
"Nevada","2003","331491","Nonferrous Metal (except Copper and Aluminum) Rolling, Drawing, and Extruding","3","0","0","32",
"Nevada","2003","32613 ","Laminated Plastics Plate, Sheet (except Packaging), and Shape Manufacturing","2","0","0","32",
"Nevada","2003","326130","Laminated Plastics Plate, Sheet (except Packaging), and Shape Manufacturing","2","0","0","32",
"Nevada","2003","33149 ","Nonferrous Metal (except Copper and Aluminum) Rolling, Drawing, Extruding, and Alloying","4","0","0","32",
"Nevada","2003","33321 ","Sawmill and Woodworking Machinery Manufacturing","1","0","0","32",
"Nevada","2003","331492","Secondary Smelting, Refining, and Alloying of Nonferrous Metal (except Copper and Aluminum)","1","0","0","32",
"Nevada","2003","3315  ","Foundries","8","233","9559","32",
"Nevada","2003","3332  ","Industrial Machinery Manufacturing","17","0","0","32",
"Nevada","2003","334416","Electronic Coil, Transformer, and Other Inductor Manufacturing","2","0","0","32",
"Nevada","2003","333210","Sawmill and Woodworking Machinery Manufacturing","1","0","0","32",
"Nevada","2003","33322 ","Plastics and Rubber Industry Machinery Manufacturing","2","0","0","32",
"Nevada","2003","334414","Electronic Capacitor Manufacturing","2","0","0","32",
"Nevada","2003","33634 ","Motor Vehicle Brake System Manufacturing","2","0","0","32",
"Nevada","2003","334417","Electronic Connector Manufacturing","2","0","0","32",
"Nevada","2003","334418","Printed Circuit Assembly (Electronic Assembly) Manufacturing","5","0","0","32",
"Nevada","2003","336330","Motor Vehicle Steering and Suspension Components (except Spring) Manufacturing","1","0","0","32",
"Nevada","2003","336340","Motor Vehicle Brake System Manufacturing","2","0","0","32",
"Nevada","2003","423110","Automobile and Other Motor Vehicle Merchant Wholesalers","40","768","27142","32",
"Nevada","2003","33636 ","Motor Vehicle Seating and Interior Trim Manufacturing","1","0","0","32",
"Nevada","2003","336360","Motor Vehicle Seating and Interior Trim Manufacturing","1","0","0","32",
"Nevada","2003","42311 ","Automobile and Other Motor Vehicle Merchant Wholesalers","40","768","27142","32",
"Nevada","2003","42312 ","Motor Vehicle Supplies and New Parts Merchant Wholesalers","98","1620","65261","32",
"Nevada","2003","423850","Service Establishment Equipment and Supplies Merchant Wholesalers","36","307","15686","32",
"Nevada","2003","423120","Motor Vehicle Supplies and New Parts Merchant Wholesalers","98","1620","65261","32",
"Nevada","2003","423840","Industrial Supplies Merchant Wholesalers","59","542","18159","32",
"Nevada","2003","42385 ","Service Establishment Equipment and Supplies Merchant Wholesalers","36","307","15686","32",
"Nevada","2003","42472 ","Petroleum and Petroleum Products Merchant Wholesalers (except Bulk Stations and Terminals)","18","0","0","32",
"Nevada","2003","42386 ","Transportation Equipment and Supplies (except Motor Vehicle) Merchant Wholesalers","16","115","5427","32",
"Nevada","2003","42471 ","Petroleum Bulk Stations and Terminals","21","237","9477","32",
"Nevada","2003","424710","Petroleum Bulk Stations and Terminals","21","237","9477","32",
"Nevada","2003","44421 ","Outdoor Power Equipment Stores","14","75","1881","32",
"Nevada","2003","424720","Petroleum and Petroleum Products Merchant Wholesalers (except Bulk Stations and Terminals)","18","0","0","32",
"Nevada","2003","444190","Other Building Material Dealers","249","2859","101326","32",
"Nevada","2003","4442  ","Lawn and Garden Equipment and Supplies Stores","83","1088","24548","32",
"Nevada","2003","451220","Prerecorded Tape, Compact Disc, and Record Stores","41","332","4524","32",
"Nevada","2003","444210","Outdoor Power Equipment Stores","14","75","1881","32",
"Nevada","2003","44422 ","Nursery, Garden Center, and Farm Supply Stores","69","1013","22667","32",
"Nevada","2003","45122 ","Prerecorded Tape, Compact Disc, and Record Stores","41","332","4524","32",
"Nevada","2003","452   ","General Merchandise Stores","204","21009","415447","32",
"Nevada","2003","484210","Used Household and Office Goods Moving","41","663","18244","32",
"Nevada","2003","4521  ","Department Stores","77","13124","230570","32",
"Nevada","2003","45211 ","Department Stores","77","13124","230570","32",
"Nevada","2003","48421 ","Used Household and Office Goods Moving","41","663","18244","32",
"Nevada","2003","48422 ","Specialized Freight (except Used Goods) Trucking, Local","145","926","34584","32",
"Nevada","2003","484220","Specialized Freight (except Used Goods) Trucking, Local","145","926","34584","32",
"Nevada","2003","493   ","Warehousing and Storage","120","6488","179905","32",
"Nevada","2003","48423 ","Specialized Freight (except Used Goods) Trucking, Long-Distance","56","264","9598","32",
"Nevada","2003","49221 ","Local Messengers and Local Delivery","39","302","5648","32",
"Nevada","2003","492210","Local Messengers and Local Delivery","39","302","5648","32",
"Nevada","2003","518   ","Internet Service Providers, Web Search Portals, and Data Processing Services","210","868","35737","32",
"Nevada","2003","4931  ","Warehousing and Storage","120","6488","179905","32",
"Nevada","2003","49311 ","General Warehousing and Storage","92","5556","143533","32",
"Nevada","2003","517910","Other Telecommunications","4","0","0","32",
"Nevada","2003","5181  ","Internet Service Providers and Web Search Portals","83","350","15156","32",
"Nevada","2003","52413 ","Reinsurance Carriers","1","0","0","32",
"Nevada","2003","51811 ","Internet Service Providers and Web Search Portals","83","350","15156","32",
"Nevada","2003","524127","Direct Title Insurance Carriers","62","1428","71631","32",
"Nevada","2003","524128","Other Direct Insurance (except Life, Health, and Medical) Carriers","5","41","1902","32",
"Nevada","2003","524130","Reinsurance Carriers","1","0","0","32",
"Nevada","2003","541   ","Professional, Scientific, and Technical Services","6623","50846","2571208","32",
"Nevada","2003","5242  ","Agencies, Brokerages, and Other Insurance Related Activities","988","4760","200734","32",
"Nevada","2003","533110","Lessors of Nonfinancial Intangible Assets (except Copyrighted Works)","59","248","9469","32",
"Nevada","2003","54    ","Professional, Scientific, and Technical Services","6623","50846","2571208","32",
"Nevada","2003","54189 ","Other Services Related to Advertising","76","518","25712","32",
"Nevada","2003","5411  ","Legal Services","1362","8383","648557","32",
"Nevada","2003","54187 ","Advertising Material Distribution Services","9","123","4595","32",
"Nevada","2003","541870","Advertising Material Distribution Services","9","123","4595","32",
"Nevada","2003","56174 ","Carpet and Upholstery Cleaning Services","104","658","13520","32",
"Nevada","2003","541890","Other Services Related to Advertising","76","518","25712","32",
"Nevada","2003","56173 ","Landscaping Services","607","7069","181009","32",
"Nevada","2003","561730","Landscaping Services","607","7069","181009","32",
"Nevada","2003","561740","Carpet and Upholstery Cleaning Services","104","658","13520","32",
"Nevada","2003","621310","Offices of Chiropractors","270","813","21511","32",
"Nevada","2003","56179 ","Other Services to Buildings and Dwellings","130","656","15261","32",
"Nevada","2003","6213  ","Offices of Other Health Practitioners","742","3026","97694","32",
"Nevada","2003","62131 ","Offices of Chiropractors","270","813","21511","32",
"Nevada","2003","62132 ","Offices of Optometrists","156","707","20748","32",
"Nevada","2003","6243  ","Vocational Rehabilitation Services","55","2615","37017","32",
"Nevada","2003","621320","Offices of Optometrists","156","707","20748","32",
"Nevada","2003","62423 ","Emergency and Other Relief Services","5","83","2065","32",
"Nevada","2003","624230","Emergency and Other Relief Services","5","83","2065","32",
"Nevada","2003","62431 ","Vocational Rehabilitation Services","55","2615","37017","32",
"Nevada","2003","721211","RV (Recreational Vehicle) Parks and Campgrounds","40","0","0","32",
"Nevada","2003","624310","Vocational Rehabilitation Services","55","2615","37017","32",
"Nevada","2003","7212  ","RV (Recreational Vehicle) Parks and Recreational Camps","45","0","0","32",
"Nevada","2003","72121 ","RV (Recreational Vehicle) Parks and Recreational Camps","45","0","0","32",
"Nevada","2003","812310","Coin-Operated Laundries and Drycleaners","56","271","4854","32",
"Nevada","2003","721214","Recreational and Vacation Camps (except Campgrounds)","5","0","0","32",
"Nevada","2003","8123  ","Drycleaning and Laundry Services","272","4403","99042","32",
"Nevada","2003","81231 ","Coin-Operated Laundries and Drycleaners","56","271","4854","32",
"Nevada","2003","81232 ","Drycleaning and Laundry Services (except Coin-Operated)","196","1679","29969","32",
"Nevada","2003","113210","Forest Nurseries and Gathering of Forest Products","1","0","0","32",
"Nevada","2003","1133  ","Logging","7","0","0","32",
"Nevada","2003","11331 ","Logging","7","0","0","32",
"Nevada","2003","22133 ","Steam and Air-Conditioning Supply","2","0","0","32",
"Nevada","2003","113310","Logging","7","0","0","32",
"Nevada","2003","114   ","Fishing, Hunting and Trapping","7","0","0","32",
"Nevada","2003","1141  ","Fishing","7","0","0","32",
"Nevada","2003","221330","Steam and Air-Conditioning Supply","2","0","0","32",
"Nevada","2003","23    ","Construction","5091","93327","3744903","32",
"Nevada","2003","311   ","Food Manufacturing","145","3760","113090","32",
"Nevada","2003","236   ","Construction of Buildings","1405","15678","834499","32",
"Nevada","2003","2361  ","Residential Building Construction","1000","8953","452216","32",
"Nevada","2003","31-33 ","Manufacturing","1772","41216","1668458","32",
"Nevada","2003","31331 ","Textile and Fabric Finishing Mills","1","0","0","32",
"Nevada","2003","3111  ","Animal Food Manufacturing","4","0","0","32",
"Nevada","2003","31111 ","Animal Food Manufacturing","4","0","0","32",
"Nevada","2003","311111","Dog and Cat Food Manufacturing","1","0","0","32",
"Nevada","2003","313312","Textile and Fabric Finishing (except Broadwoven Fabric) Mills","1","0","0","32",
"Nevada","2003","31332 ","Fabric Coating Mills","1","0","0","32",
"Nevada","2003","323111","Commercial Gravure Printing","4","0","0","32",
"Nevada","2003","313320","Fabric Coating Mills","1","0","0","32",
"Nevada","2003","314   ","Textile Product Mills","42","712","18969","32",
"Nevada","2003","323110","Commercial Lithographic Printing","75","1309","48306","32",
"Nevada","2003","32614 ","Polystyrene Foam Product Manufacturing","5","200","7192","32",
"Nevada","2003","323112","Commercial Flexographic Printing","2","0","0","32",
"Nevada","2003","323113","Commercial Screen Printing","24","339","7939","32",
"Nevada","2003","323114","Quick Printing","41","175","5153","32",
"Nevada","2003","326140","Polystyrene Foam Product Manufacturing","5","200","7192","32",
"Nevada","2003","331511","Iron Foundries","2","0","0","32",
"Nevada","2003","32615 ","Urethane and Other Foam Product (except Polystyrene) Manufacturing","3","0","0","32",
"Nevada","2003","326150","Urethane and Other Foam Product (except Polystyrene) Manufacturing","3","0","0","32",
"Nevada","2003","33151 ","Ferrous Metal Foundries","3","0","0","32",
"Nevada","2003","331512","Steel Investment Foundries","1","0","0","32",
"Nevada","2003","33329 ","Other Industrial Machinery Manufacturing","14","0","0","32",
"Nevada","2003","33152 ","Nonferrous Metal Foundries","5","0","0","32",
"Nevada","2003","331522","Nonferrous (except Aluminum) Die-Casting Foundries","2","0","0","32",
"Nevada","2003","333220","Plastics and Rubber Industry Machinery Manufacturing","2","0","0","32",
"Nevada","2003","333291","Paper Industry Machinery Manufacturing","1","0","0","32",
"Nevada","2003","3345  ","Navigational, Measuring, Electromedical, and Control Instruments Manufacturing","30","1731","100158","32",
"Nevada","2003","333292","Textile Machinery Manufacturing","1","0","0","32",
"Nevada","2003","333293","Printing Machinery and Equipment Manufacturing","1","0","0","32",
"Nevada","2003","334419","Other Electronic Component Manufacturing","9","210","7992","32",
"Nevada","2003","33451 ","Navigational, Measuring, Electromedical, and Control Instruments Manufacturing","30","1731","100158","32",
"Nevada","2003","3364  ","Aerospace Product and Parts Manufacturing","13","0","0","32",
"Nevada","2003","334510","Electromedical and Electrotherapeutic Apparatus Manufacturing","2","0","0","32",
"Nevada","2003","33639 ","Other Motor Vehicle Parts Manufacturing","7","215","7405","32",
"Nevada","2003","336399","All Other Motor Vehicle Parts Manufacturing","7","215","7405","32",
"Nevada","2003","42314 ","Motor Vehicle Parts (Used) Merchant Wholesalers","11","60","2126","32",
"Nevada","2003","33641 ","Aerospace Product and Parts Manufacturing","13","0","0","32",
"Nevada","2003","42313 ","Tire and Tube Merchant Wholesalers","29","275","8739","32",
"Nevada","2003","423130","Tire and Tube Merchant Wholesalers","29","275","8739","32",
"Nevada","2003","4239  ","Miscellaneous Durable Goods Merchant Wholesalers","231","3709","171389","32",
"Nevada","2003","423140","Motor Vehicle Parts (Used) Merchant Wholesalers","11","60","2126","32",
"Nevada","2003","4232  ","Furniture and Home Furnishing Merchant Wholesalers","71","565","25020","32",
"Nevada","2003","423860","Transportation Equipment and Supplies (except Motor Vehicle) Merchant Wholesalers","16","115","5427","32",
"Nevada","2003","42481 ","Beer and Ale Merchant Wholesalers","16","963","42067","32",
"Nevada","2003","42391 ","Sporting and Recreational Goods and Supplies Merchant Wholesalers","47","514","16893","32",
"Nevada","2003","423910","Sporting and Recreational Goods and Supplies Merchant Wholesalers","47","514","16893","32",
"Nevada","2003","4248  ","Beer, Wine, and Distilled Alcoholic Beverage Merchant Wholesalers","35","1825","106608","32",
"Nevada","2003","424810","Beer and Ale Merchant Wholesalers","16","963","42067","32",
"Nevada","2003","4451  ","Grocery Stores","604","19494","426393","32",
"Nevada","2003","42482 ","Wine and Distilled Alcoholic Beverage Merchant Wholesalers","19","862","64541","32",
"Nevada","2003","444220","Nursery, Garden Center, and Farm Supply Stores","69","1013","22667","32",
"Nevada","2003","445   ","Food and Beverage Stores","830","20854","448927","32",
"Nevada","2003","4529  ","Other General Merchandise Stores","127","7885","184877","32",
"Nevada","2003","44511 ","Supermarkets and Other Grocery (except Convenience) Stores","374","18030","404193","32",
"Nevada","2003","452111","Department Stores (except Discount Department Stores)","32","5346","105054","32",
"Nevada","2003","452112","Discount Department Stores","45","7778","125516","32",
"Nevada","2003","4851  ","Urban Transit Systems","9","1422","41062","32",
"Nevada","2003","45291 ","Warehouse Clubs and Supercenters","23","6615","162551","32",
"Nevada","2003","484230","Specialized Freight (except Used Goods) Trucking, Long-Distance","56","264","9598","32",
"Nevada","2003","485   ","Transit and Ground Passenger Transportation","111","11509","228591","32",
"Nevada","2003","493120","Refrigerated Warehousing and Storage","8","0","0","32",
"Nevada","2003","48511 ","Urban Transit Systems","9","1422","41062","32",
"Nevada","2003","493110","General Warehousing and Storage","92","5556","143533","32",
"Nevada","2003","49312 ","Refrigerated Warehousing and Storage","8","0","0","32",
"Nevada","2003","5182  ","Data Processing, Hosting, and Related Services","127","518","20581","32",
"Nevada","2003","49313 ","Farm Product Warehousing and Storage","4","0","0","32",
"Nevada","2003","518111","Internet Service Providers","76","0","0","32",
"Nevada","2003","518112","Web Search Portals","7","0","0","32",
"Nevada","2003","51821 ","Data Processing, Hosting, and Related Services","127","518","20581","32",
"Nevada","2003","52429 ","Other Insurance Related Activities","135","1303","48691","32",
"Nevada","2003","518210","Data Processing, Hosting, and Related Services","127","518","20581","32",
"Nevada","2003","52421 ","Insurance Agencies and Brokerages","853","3457","152043","32",
"Nevada","2003","524210","Insurance Agencies and Brokerages","853","3457","152043","32",
"Nevada","2003","54119 ","Other Legal Services","90","1003","52291","32",
"Nevada","2003","524291","Claims Adjusting","51","247","8688","32",
"Nevada","2003","54111 ","Offices of Lawyers","1272","7380","596266","32",
"Nevada","2003","541110","Offices of Lawyers","1272","7380","596266","32",
"Nevada","2003","541191","Title Abstract and Settlement Offices","47","844","48059","32",
"Nevada","2003","541910","Marketing Research and Public Opinion Polling","40","761","10318","32",
"Nevada","2003","541199","All Other Legal Services","43","159","4232","32",
"Nevada","2003","5419  ","Other Professional, Scientific, and Technical Services","592","4324","97356","32",
"Nevada","2003","54191 ","Marketing Research and Public Opinion Polling","40","761","10318","32",
"Nevada","2003","54192 ","Photographic Services","152","642","13634","32",
"Nevada","2003","56191 ","Packaging and Labeling Services","9","130","2579","32",
"Nevada","2003","541921","Photography Studios, Portrait","101","464","9993","32",
"Nevada","2003","561790","Other Services to Buildings and Dwellings","130","656","15261","32",
"Nevada","2003","5619  ","Other Support Services","288","8603","209130","32",
"Nevada","2003","561910","Packaging and Labeling Services","9","130","2579","32",
"Nevada","2003","62134 ","Offices of Physical, Occupational and Speech Therapists, and Audiologists","128","851","29886","32",
"Nevada","2003","56192 ","Convention and Trade Show Organizers","123","6999","174519","32",
"Nevada","2003","62133 ","Offices of Mental Health Practitioners (except Physicians)","66","286","11038","32",
"Nevada","2003","621330","Offices of Mental Health Practitioners (except Physicians)","66","286","11038","32",
"Nevada","2003","621340","Offices of Physical, Occupational and Speech Therapists, and Audiologists","128","851","29886","32",
"Nevada","2003","71    ","Arts, Entertainment, and Recreation","1144","25725","628283","32",
"Nevada","2003","6244  ","Child Day Care Services","325","4896","69130","32",
"Nevada","2003","62441 ","Child Day Care Services","325","4896","69130","32",
"Nevada","2003","624410","Child Day Care Services","325","4896","69130","32",
"Nevada","2003","721310","Rooming and Boarding Houses","5","0","0","32",
"Nevada","2003","711   ","Performing Arts, Spectator Sports, and Related Industries","474","3242","175534","32",
"Nevada","2003","7213  ","Rooming and Boarding Houses","5","0","0","32",
"Nevada","2003","72131 ","Rooming and Boarding Houses","5","0","0","32",
"Nevada","2003","722   ","Food Services and Drinking Places","3829","71485","982876","32",
"Nevada","2003","812331","Linen Supply","11","0","0","32",
"Nevada","2003","7221  ","Full-Service Restaurants","1267","34125","518061","32",
"Nevada","2003","812320","Drycleaning and Laundry Services (except Coin-Operated)","196","1679","29969","32",
"Nevada","2003","81233 ","Linen and Uniform Supply","20","2453","64219","32",
"Nevada","2003","812332","Industrial Launderers","9","0","0","32",
"Nevada","2003","8129  ","Other Personal Services","328","2142","36562","32",
"Nevada","2003","11411 ","Fishing","7","0","0","32",
"Nevada","2003","114111","Finfish Fishing","7","0","0","32",
"Nevada","2003","23611 ","Residential Building Construction","1000","8953","452216","32",
"Nevada","2003","115   ","Support Activities for Agriculture and Forestry","48","200","4855","32",
"Nevada","2003","1151  ","Support Activities for Crop Production","12","0","0","32",
"Nevada","2003","11511 ","Support Activities for Crop Production","12","0","0","32",
"Nevada","2003","236115","New Single-Family Housing Construction (except Operative Builders)","605","3701","141013","32",
"Nevada","2003","311119","Other Animal Food Manufacturing","3","0","0","32",
"Nevada","2003","236116","New Multifamily Housing Construction (except Operative Builders)","36","452","25901","32",
"Nevada","2003","236117","New Housing Operative Builders","89","3121","232915","32",
"Nevada","2003","236118","Residential Remodelers","270","1679","52387","32",
"Nevada","2003","3112  ","Grain and Oilseed Milling","1","0","0","32",
"Nevada","2003","3141  ","Textile Furnishings Mills","18","303","7251","32",
"Nevada","2003","31123 ","Breakfast Cereal Manufacturing","1","0","0","32",
