"Montana","2007","811121","Automotive Body, Paint, and Interior Repair and Maintenance","183","1062","31121","30",
"Montana","2007","811112","Automotive Exhaust System Repair","16","53","1244","30",
"Montana","2007","8123  ","Drycleaning and Laundry Services","85","879","17152","30",
"Montana","2007","81231 ","Coin-Operated Laundries and Drycleaners","40","227","2103","30",
"Montana","2007","221310","Water Supply and Irrigation Systems","36","154","5409","30",
"Montana","2007","812310","Coin-Operated Laundries and Drycleaners","40","227","2103","30",
"Montana","2007","1141  ","Fishing","3","0","96","30",
"Montana","2007","11411 ","Fishing","3","0","96","30",
"Montana","2007","114111","Finfish Fishing","3","0","96","30",
"Montana","2007","1142  ","Hunting and Trapping","9","0","0","30",
"Montana","2007","11421 ","Hunting and Trapping","9","0","0","30",
"Montana","2007","221210","Natural Gas Distribution","27","0","0","30",
"Montana","2007","2213  ","Water, Sewage and Other Systems","36","154","5409","30",
"Montana","2007","22131 ","Water Supply and Irrigation Systems","36","154","5409","30",
"Montana","2007","23    ","Construction","6163","29090","1178907","30",
"Montana","2007","2389  ","Other Specialty Trade Contractors","684","2471","100259","30",
"Montana","2007","238350","Finish Carpentry Contractors","206","426","12282","30",
"Montana","2007","23839 ","Other Building Finishing Contractors","29","68","1351","30",
"Montana","2007","238390","Other Building Finishing Contractors","29","68","1351","30",
"Montana","2007","311942","Spice and Extract Manufacturing","1","0","0","30",
"Montana","2007","312   ","Beverage and Tobacco Product Manufacturing","32","467","12244","30",
"Montana","2007","31199 ","All Other Food Manufacturing","6","27","499","30",
"Montana","2007","311991","Perishable Prepared Food Manufacturing","2","0","0","30",
"Montana","2007","311999","All Other Miscellaneous Food Manufacturing","4","0","434","30",
"Montana","2007","3322  ","Cutlery and Handtool Manufacturing","7","21","579","30",
"Montana","2007","332214","Kitchen Utensil, Pot, and Pan Manufacturing","1","0","0","30",
"Montana","2007","33221 ","Cutlery and Handtool Manufacturing","7","21","579","30",
"Montana","2007","332211","Cutlery and Flatware (except Precious) Manufacturing","3","4","113","30",
"Montana","2007","332212","Hand and Edge Tool Manufacturing","3","0","0","30",
"Montana","2007","332721","Precision Turned Product Manufacturing","1","0","0","30",
"Montana","2007","33271 ","Machine Shops","72","513","17255","30",
"Montana","2007","332710","Machine Shops","72","513","17255","30",
"Montana","2007","33272 ","Turned Product and Screw, Nut, and Bolt Manufacturing","2","0","0","30",
"Montana","2007","3333  ","Commercial and Service Industry Machinery Manufacturing","4","0","920","30",
"Montana","2007","333294","Food Product Machinery Manufacturing","1","0","0","30",
"Montana","2007","333295","Semiconductor Machinery Manufacturing","1","0","0","30",
"Montana","2007","333298","All Other Industrial Machinery Manufacturing","2","0","0","30",
"Montana","2007","334   ","Computer and Electronic Product Manufacturing","25","445","18263","30",
"Montana","2007","33522 ","Major Appliance Manufacturing","1","0","0","30",
"Montana","2007","3341  ","Computer and Peripheral Equipment Manufacturing","2","0","0","30",
"Montana","2007","33411 ","Computer and Peripheral Equipment Manufacturing","2","0","0","30",
"Montana","2007","334119","Other Computer Peripheral Equipment Manufacturing","2","0","0","30",
"Montana","2007","335312","Motor and Generator Manufacturing","1","0","0","30",
"Montana","2007","335221","Household Cooking Appliance Manufacturing","1","0","0","30",
"Montana","2007","3353  ","Electrical Equipment Manufacturing","1","0","0","30",
"Montana","2007","33531 ","Electrical Equipment Manufacturing","1","0","0","30",
"Montana","2007","336999","All Other Transportation Equipment Manufacturing","2","0","0","30",
"Montana","2007","423   ","Merchant Wholesalers, Durable Goods","851","7746","327155","30",
"Montana","2007","337   ","Furniture and Related Product Manufacturing","148","961","25420","30",
"Montana","2007","3371  ","Household and Institutional Furniture and Kitchen Cabinet Manufacturing","129","714","18315","30",
"Montana","2007","33711 ","Wood Kitchen Cabinet and Countertop Manufacturing","73","422","12073","30",
"Montana","2007","423620","Electrical and Electronic Appliance, Television, and Radio Set Merchant Wholesalers","2","0","0","30",
"Montana","2007","4231  ","Motor Vehicle and Motor Vehicle Parts and Supplies Merchant Wholesalers","93","1117","41834","30",
"Montana","2007","42311 ","Automobile and Other Motor Vehicle Merchant Wholesalers","33","507","19577","30",
"Montana","2007","423110","Automobile and Other Motor Vehicle Merchant Wholesalers","33","507","19577","30",
"Montana","2007","42432 ","Men's and Boys' Clothing and Furnishings Merchant Wholesalers","10","120","3928","30",
"Montana","2007","42369 ","Other Electronic Parts and Equipment Merchant Wholesalers","23","108","4396","30",
"Montana","2007","423690","Other Electronic Parts and Equipment Merchant Wholesalers","23","108","4396","30",
"Montana","2007","4237  ","Hardware, and Plumbing and Heating Equipment and Supplies Merchant Wholesalers","66","811","35914","30",
"Montana","2007","424990","Other Miscellaneous Nondurable Goods Merchant Wholesalers","32","213","6385","30",
"Montana","2007","424320","Men's and Boys' Clothing and Furnishings Merchant Wholesalers","10","120","3928","30",
"Montana","2007","42433 ","Women's, Children's, and Infants' Clothing and Accessories Merchant Wholesalers","8","0","0","30",
"Montana","2007","42495 ","Paint, Varnish, and Supplies Merchant Wholesalers","2","0","0","30",
"Montana","2007","424950","Paint, Varnish, and Supplies Merchant Wholesalers","2","0","0","30",
"Montana","2007","42499 ","Other Miscellaneous Nondurable Goods Merchant Wholesalers","32","213","6385","30",
"Montana","2007","445110","Supermarkets and Other Grocery (except Convenience) Stores","236","7685","163358","30",
"Montana","2007","484121","General Freight Trucking, Long-Distance, Truckload","224","1446","50985","30",
"Montana","2007","44512 ","Convenience Stores","30","0","4079","30",
"Montana","2007","445120","Convenience Stores","30","0","4079","30",
"Montana","2007","4452  ","Specialty Food Stores","102","462","6910","30",
"Montana","2007","484122","General Freight Trucking, Long-Distance, Less Than Truckload","65","640","30577","30",
"Montana","2007","485510","Charter Bus Industry","7","115","1630","30",
"Montana","2007","4842  ","Specialized Freight Trucking","409","2339","80931","30",
"Montana","2007","48421 ","Used Household and Office Goods Moving","39","453","12159","30",
"Montana","2007","48551 ","Charter Bus Industry","7","115","1630","30",
"Montana","2007","48811 ","Airport Operations","28","0","6382","30",
"Montana","2007","4859  ","Other Transit and Ground Passenger Transportation","6","10","125","30",
"Montana","2007","48599 ","Other Transit and Ground Passenger Transportation","6","10","125","30",
"Montana","2007","485991","Special Needs Transportation","4","0","88","30",
"Montana","2007","488111","Air Traffic Control","6","0","0","30",
"Montana","2007","51    ","Information","637","8131","323213","30",
"Montana","2007","488119","Other Airport Operations","22","269","5480","30",
"Montana","2007","48819 ","Other Support Activities for Air Transportation","40","329","10154","30",
"Montana","2007","488190","Other Support Activities for Air Transportation","40","329","10154","30",
"Montana","2007","515111","Radio Networks","7","0","1904","30",
"Montana","2007","511   ","Publishing Industries (except Internet)","161","2402","101451","30",
"Montana","2007","5111  ","Newspaper, Periodical, Book, and Directory Publishers","144","2197","60466","30",
"Montana","2007","51111 ","Newspaper Publishers","79","1826","49060","30",
"Montana","2007","515112","Radio Stations","63","0","15788","30",
"Montana","2007","519120","Libraries and Archives","2","0","0","30",
"Montana","2007","51512 ","Television Broadcasting","25","699","22620","30",
"Montana","2007","515120","Television Broadcasting","25","699","22620","30",
"Montana","2007","5152  ","Cable and Other Subscription Programming","3","0","0","30",
"Montana","2007","51919 ","All Other Information Services","1","0","0","30",
"Montana","2007","52392 ","Portfolio Management","36","108","7420","30",
"Montana","2007","519190","All Other Information Services","1","0","0","30",
"Montana","2007","52    ","Finance and Insurance","2116","17211","740362","30",
"Montana","2007","521   ","Monetary Authorities - Central Bank","1","0","0","30",
"Montana","2007","523920","Portfolio Management","36","108","7420","30",
"Montana","2007","53211 ","Passenger Car Rental and Leasing","39","698","13752","30",
"Montana","2007","52393 ","Investment Advice","82","228","10727","30",
"Montana","2007","523930","Investment Advice","82","228","10727","30",
"Montana","2007","5321  ","Automotive Equipment Rental and Leasing","56","774","15884","30",
"Montana","2007","54135 ","Building Inspection Services","30","44","739","30",
"Montana","2007","532111","Passenger Car Rental","38","690","13535","30",
"Montana","2007","532112","Passenger Car Leasing","1","0","0","30",
"Montana","2007","53212 ","Truck, Utility Trailer, and RV (Recreational Vehicle) Rental and Leasing","17","0","2132","30",
"Montana","2007","541350","Building Inspection Services","30","44","739","30",
"Montana","2007","541922","Commercial Photography","15","21","930","30",
"Montana","2007","54136 ","Geophysical Surveying and Mapping Services","31","246","10924","30",
"Montana","2007","541360","Geophysical Surveying and Mapping Services","31","246","10924","30",
"Montana","2007","54137 ","Surveying and Mapping (except Geophysical) Services","65","273","8803","30",
"Montana","2007","54193 ","Translation and Interpretation Services","1","0","0","30",
"Montana","2007","56173 ","Landscaping Services","427","1035","31991","30",
"Montana","2007","541930","Translation and Interpretation Services","1","0","0","30",
"Montana","2007","54194 ","Veterinary Services","213","1333","29016","30",
"Montana","2007","561720","Janitorial Services","311","1962","22458","30",
"Montana","2007","561730","Landscaping Services","427","1035","31991","30",
"Montana","2007","62399 ","Other Residential Care Facilities","49","976","20374","30",
"Montana","2007","56174 ","Carpet and Upholstery Cleaning Services","63","471","11570","30",
"Montana","2007","561740","Carpet and Upholstery Cleaning Services","63","471","11570","30",
"Montana","2007","6239  ","Other Residential Care Facilities","49","976","20374","30",
"Montana","2007","7111  ","Performing Arts Companies","43","483","6209","30",
"Montana","2007","623990","Other Residential Care Facilities","49","976","20374","30",
"Montana","2007","624   ","Social Assistance","947","10276","151309","30",
"Montana","2007","711   ","Performing Arts, Spectator Sports, and Related Industries","177","887","12830","30",
"Montana","2007","71212 ","Historical Sites","8","0","506","30",
"Montana","2007","71111 ","Theater Companies and Dinner Theaters","22","0","4232","30",
"Montana","2007","711110","Theater Companies and Dinner Theaters","22","0","4232","30",
"Montana","2007","712110","Museums","53","265","4649","30",
"Montana","2007","712120","Historical Sites","8","0","506","30",
"Montana","2007","72119 ","Other Traveler Accommodation","54","165","3301","30",
"Montana","2007","71213 ","Zoos and Botanical Gardens","3","0","0","30",
"Montana","2007","712130","Zoos and Botanical Gardens","3","0","0","30",
"Montana","2007","721120","Casino Hotels","6","389","7865","30",
"Montana","2007","721191","Bed-and-Breakfast Inns","35","135","2280","30",
"Montana","2007","81119 ","Other Automotive Repair and Maintenance","143","942","15385","30",
"Montana","2007","721199","All Other Traveler Accommodation","19","30","1021","30",
"Montana","2007","7212  ","RV (Recreational Vehicle) Parks and Recreational Camps","123","485","15142","30",
"Montana","2007","811122","Automotive Glass Replacement Shops","49","161","4484","30",
"Montana","2007","812320","Drycleaning and Laundry Services (except Coin-Operated)","31","293","4953","30",
"Montana","2007","811191","Automotive Oil Change and Lubrication Shops","48","372","6860","30",
"Montana","2007","811192","Car Washes","88","535","7401","30",
"Montana","2007","81232 ","Drycleaning and Laundry Services (except Coin-Operated)","31","293","4953","30",
"Montana","2007","115112","Soil Preparation, Planting, and Cultivating","29","57","2010","30",
"Montana","2007","81233 ","Linen and Uniform Supply","14","359","10096","30",
"Montana","2007","812331","Linen Supply","6","215","5930","30",
"Montana","2007","812332","Industrial Launderers","8","144","4166","30",
"Montana","2007","114210","Hunting and Trapping","9","0","0","30",
"Montana","2007","115   ","Support Activities for Agriculture and Forestry","183","377","15209","30",
"Montana","2007","1151  ","Support Activities for Crop Production","50","140","4698","30",
"Montana","2007","11511 ","Support Activities for Crop Production","50","140","4698","30",
"Montana","2007","236   ","Construction of Buildings","2149","9210","328914","30",
"Montana","2007","23891 ","Site Preparation Contractors","420","1621","71345","30",
"Montana","2007","2361  ","Residential Building Construction","1951","6843","220038","30",
"Montana","2007","23611 ","Residential Building Construction","1951","6843","220038","30",
"Montana","2007","236115","New Single-Family Housing Construction (except Operative Builders)","949","3972","136227","30",
"Montana","2007","31-33 ","Manufacturing","1301","20301","798938","30",
"Montana","2007","238910","Site Preparation Contractors","420","1621","71345","30",
"Montana","2007","23899 ","All Other Specialty Trade Contractors","264","850","28914","30",
"Montana","2007","238990","All Other Specialty Trade Contractors","264","850","28914","30",
"Montana","2007","312112","Bottled Water Manufacturing","1","0","0","30",
"Montana","2007","3121  ","Beverage Manufacturing","32","467","12244","30",
"Montana","2007","31211 ","Soft Drink and Ice Manufacturing","12","335","8825","30",
"Montana","2007","312111","Soft Drink Manufacturing","5","279","7759","30",
"Montana","2007","332722","Bolt, Nut, Screw, Rivet, and Washer Manufacturing","1","0","0","30",
"Montana","2007","33331 ","Commercial and Service Industry Machinery Manufacturing","4","0","920","30",
"Montana","2007","3328  ","Coating, Engraving, Heat Treating, and Allied Activities","9","70","1372","30",
"Montana","2007","33281 ","Coating, Engraving, Heat Treating, and Allied Activities","9","70","1372","30",
"Montana","2007","332812","Metal Coating, Engraving (except Jewelry and Silverware), and Allied Services to Manufacturers","6","62","1224","30",
"Montana","2007","3342  ","Communications Equipment Manufacturing","3","42","1115","30",
"Montana","2007","333315","Photographic and Photocopying Equipment Manufacturing","1","0","0","30",
"Montana","2007","333319","Other Commercial and Service Industry Machinery Manufacturing","3","0","884","30",
"Montana","2007","3334  ","Ventilation, Heating, Air-Conditioning, and Commercial Refrigeration Equipment Manufacturing","2","0","0","30",
"Montana","2007","3359  ","Other Electrical Equipment and Component Manufacturing","4","89","3209","30",
"Montana","2007","33422 ","Radio and Television Broadcasting and Wireless Communications Equipment Manufacturing","3","42","1115","30",
"Montana","2007","334220","Radio and Television Broadcasting and Wireless Communications Equipment Manufacturing","3","42","1115","30",
"Montana","2007","3343  ","Audio and Video Equipment Manufacturing","1","0","0","30",
"Montana","2007","337110","Wood Kitchen Cabinet and Countertop Manufacturing","73","422","12073","30",
"Montana","2007","33592 ","Communication and Energy Wire and Cable Manufacturing","1","0","0","30",
"Montana","2007","335929","Other Communication and Energy Wire Manufacturing","1","0","0","30",
"Montana","2007","33599 ","All Other Electrical Equipment and Component Manufacturing","3","0","0","30",
"Montana","2007","42312 ","Motor Vehicle Supplies and New Parts Merchant Wholesalers","44","505","18002","30",
"Montana","2007","33712 ","Household and Institutional Furniture Manufacturing","56","292","6242","30",
"Montana","2007","337121","Upholstered Household Furniture Manufacturing","3","0","450","30",
"Montana","2007","337122","Nonupholstered Wood Household Furniture Manufacturing","46","205","4894","30",
"Montana","2007","42371 ","Hardware Merchant Wholesalers","15","134","5405","30",
"Montana","2007","423120","Motor Vehicle Supplies and New Parts Merchant Wholesalers","44","505","18002","30",
"Montana","2007","42313 ","Tire and Tube Merchant Wholesalers","9","84","3762","30",
"Montana","2007","423130","Tire and Tube Merchant Wholesalers","9","84","3762","30",
"Montana","2007","424330","Women's, Children's, and Infants' Clothing and Accessories Merchant Wholesalers","8","0","0","30",
"Montana","2007","423710","Hardware Merchant Wholesalers","15","134","5405","30",
"Montana","2007","42372 ","Plumbing and Heating Equipment and Supplies (Hydronics) Merchant Wholesalers","27","460","20387","30",
"Montana","2007","423720","Plumbing and Heating Equipment and Supplies (Hydronics) Merchant Wholesalers","27","460","20387","30",
"Montana","2007","42434 ","Footwear Merchant Wholesalers","4","0","0","30",
"Montana","2007","425   ","Wholesale Electronic Markets and Agents and Brokers","156","552","19212","30",
"Montana","2007","424340","Footwear Merchant Wholesalers","4","0","0","30",
"Montana","2007","4244  ","Grocery and Related Product Wholesalers","109","1857","73093","30",
"Montana","2007","42441 ","General Line Grocery Merchant Wholesalers","14","570","27758","30",
"Montana","2007","44521 ","Meat Markets","26","142","3101","30",
"Montana","2007","4251  ","Wholesale Electronic Markets and Agents and Brokers","156","552","19212","30",
"Montana","2007","42511 ","Business to Business Electronic Markets","4","0","0","30",
"Montana","2007","425110","Business to Business Electronic Markets","4","0","0","30",
"Montana","2007","445210","Meat Markets","26","142","3101","30",
"Montana","2007","485999","All Other Transit and Ground Passenger Transportation","2","0","0","30",
"Montana","2007","44522 ","Fish and Seafood Markets","1","0","0","30",
"Montana","2007","445220","Fish and Seafood Markets","1","0","0","30",
"Montana","2007","44523 ","Fruit and Vegetable Markets","5","0","141","30",
"Montana","2007","4882  ","Support Activities for Rail Transportation","7","0","3102","30",
"Montana","2007","486   ","Pipeline Transportation","14","84","6354","30",
"Montana","2007","4861  ","Pipeline Transportation of Crude Oil","4","0","0","30",
"Montana","2007","48611 ","Pipeline Transportation of Crude Oil","4","0","0","30",
"Montana","2007","511110","Newspaper Publishers","79","1826","49060","30",
"Montana","2007","48821 ","Support Activities for Rail Transportation","7","0","3102","30",
"Montana","2007","488210","Support Activities for Rail Transportation","7","0","3102","30",
"Montana","2007","4884  ","Support Activities for Road Transportation","36","206","4000","30",
"Montana","2007","51112 ","Periodical Publishers","33","231","6591","30",
"Montana","2007","51521 ","Cable and Other Subscription Programming","3","0","0","30",
"Montana","2007","511120","Periodical Publishers","33","231","6591","30",
"Montana","2007","51113 ","Book Publishers","22","70","2469","30",
"Montana","2007","511130","Book Publishers","22","70","2469","30",
"Montana","2007","515210","Cable and Other Subscription Programming","3","0","0","30",
"Montana","2007","52111 ","Monetary Authorities - Central Bank","1","0","0","30",
"Montana","2007","516   ","Internet Publishing and Broadcasting","3","0","0","30",
"Montana","2007","5161  ","Internet Publishing and Broadcasting","3","0","0","30",
"Montana","2007","5211  ","Monetary Authorities - Central Bank","1","0","0","30",
"Montana","2007","523991","Trust, Fiduciary, and Custody Activities","14","0","0","30",
"Montana","2007","521110","Monetary Authorities - Central Bank","1","0","0","30",
"Montana","2007","522   ","Credit Intermediation and Related Activities","881","10319","394303","30",
"Montana","2007","52399 ","All Other Financial Investment Activities","27","0","0","30",
"Montana","2007","532120","Truck, Utility Trailer, and RV (Recreational Vehicle) Rental and Leasing","17","0","2132","30",
"Montana","2007","523999","Miscellaneous Financial Investment Activities","13","22","1472","30",
"Montana","2007","524   ","Insurance Carriers and Related Activities","880","5398","225212","30",
"Montana","2007","5241  ","Insurance Carriers","123","1488","71150","30",
"Montana","2007","5322  ","Consumer Goods Rental","144","725","10240","30",
"Montana","2007","54138 ","Testing Laboratories","31","323","26657","30",
"Montana","2007","53221 ","Consumer Electronics and Appliances Rental","4","0","0","30",
"Montana","2007","532210","Consumer Electronics and Appliances Rental","4","0","0","30",
"Montana","2007","541370","Surveying and Mapping (except Geophysical) Services","65","273","8803","30",
"Montana","2007","54199 ","All Other Professional, Scientific, and Technical Services","45","301","6974","30",
"Montana","2007","541380","Testing Laboratories","31","323","26657","30",
"Montana","2007","5414  ","Specialized Design Services","90","238","7291","30",
"Montana","2007","541940","Veterinary Services","213","1333","29016","30",
"Montana","2007","541990","All Other Professional, Scientific, and Technical Services","45","301","6974","30",
"Montana","2007","71112 ","Dance Companies","3","9","50","30",
"Montana","2007","55    ","Management of Companies and Enterprises","126","2992","161636","30",
"Montana","2007","56179 ","Other Services to Buildings and Dwellings","30","260","3231","30",
"Montana","2007","561790","Other Services to Buildings and Dwellings","30","260","3231","30",
"Montana","2007","5619  ","Other Support Services","132","819","21458","30",
"Montana","2007","56191 ","Packaging and Labeling Services","6","0","0","30",
"Montana","2007","711120","Dance Companies","3","9","50","30",
"Montana","2007","71113 ","Musical Groups and Artists","17","142","1402","30",
"Montana","2007","712190","Nature Parks and Other Similar Institutions","10","46","853","30",
"Montana","2007","711130","Musical Groups and Artists","17","142","1402","30",
"Montana","2007","71119 ","Other Performing Arts Companies","1","0","0","30",
"Montana","2007","71219 ","Nature Parks and Other Similar Institutions","10","46","853","30",
"Montana","2007","713   ","Amusement, Gambling, and Recreation Industries","914","9467","140665","30",
"Montana","2007","8112  ","Electronic and Precision Equipment Repair and Maintenance","53","242","7466","30",
"Montana","2007","7131  ","Amusement Parks and Arcades","10","0","1006","30",
"Montana","2007","72121 ","RV (Recreational Vehicle) Parks and Recreational Camps","123","485","15142","30",
"Montana","2007","721211","RV (Recreational Vehicle) Parks and Campgrounds","55","119","3751","30",
"Montana","2007","721214","Recreational and Vacation Camps (except Campgrounds)","68","366","11391","30",
"Montana","2007","811198","All Other Automotive Repair and Maintenance","7","0","1124","30",
"Montana","2007","81291 ","Pet Care (except Veterinary) Services","57","185","1874","30",
"Montana","2007","81121 ","Electronic and Precision Equipment Repair and Maintenance","53","242","7466","30",
"Montana","2007","811211","Consumer Electronics Repair and Maintenance","12","39","671","30",
"Montana","2007","8129  ","Other Personal Services","103","337","4331","30",
"Montana","2007","812910","Pet Care (except Veterinary) Services","57","185","1874","30",
"Montana","2007","311   ","Food Manufacturing","173","2777","82817","30",
"Montana","2007","81292 ","Photofinishing","10","0","566","30",
"Montana","2007","115113","Crop Harvesting, Primarily by Machine","3","0","0","30",
"Montana","2007","115114","Postharvest Crop Activities (except Cotton Ginning)","9","0","1341","30",
"Montana","2007","115115","Farm Labor Contractors and Crew Leaders","2","0","0","30",
"Montana","2007","115116","Farm Management Services","7","0","0","30",
"Montana","2007","236116","New Multifamily Housing Construction (except Operative Builders)","39","134","4176","30",
"Montana","2007","236117","New Housing Operative Builders","350","1124","36221","30",
"Montana","2007","236118","Residential Remodelers","613","1613","43414","30",
"Montana","2007","2362  ","Nonresidential Building Construction","198","2367","108876","30",
"Montana","2007","312113","Ice Manufacturing","6","23","449","30",
"Montana","2007","3111  ","Animal Food Manufacturing","17","152","5028","30",
"Montana","2007","31111 ","Animal Food Manufacturing","17","152","5028","30",
"Montana","2007","311111","Dog and Cat Food Manufacturing","1","0","0","30",
"Montana","2007","31212 ","Breweries","20","132","3419","30",
"Montana","2007","33341 ","Ventilation, Heating, Air-Conditioning, and Commercial Refrigeration Equipment Manufacturing","2","0","0","30",
"Montana","2007","312120","Breweries","20","132","3419","30",
"Montana","2007","313   ","Textile Mills","5","0","617","30",
"Montana","2007","3132  ","Fabric Mills","1","0","0","30",
"Montana","2007","33441 ","Semiconductor and Other Electronic Component Manufacturing","6","0","3839","30",
"Montana","2007","333414","Heating Equipment (except Warm Air Furnaces) Manufacturing","1","0","0","30",
"Montana","2007","333415","Air-Conditioning and Warm Air Heating Equipment and Commercial and Industrial Refrigeration Equipment Manufacturing","1","0","0","30",
"Montana","2007","33431 ","Audio and Video Equipment Manufacturing","1","0","0","30",
"Montana","2007","334310","Audio and Video Equipment Manufacturing","1","0","0","30",
