"Hawaii","2005","23731 ","Highway, Street, and Bridge Construction","29","1013","63675","15",
"Hawaii","2005","237310","Highway, Street, and Bridge Construction","29","1013","63675","15",
"Hawaii","2005","2379  ","Other Heavy and Civil Engineering Construction","19","423","28838","15",
"Hawaii","2005","23799 ","Other Heavy and Civil Engineering Construction","19","423","28838","15",
"Hawaii","2005","31152 ","Ice Cream and Frozen Dessert Manufacturing","6","0","0","15",
"Hawaii","2005","311520","Ice Cream and Frozen Dessert Manufacturing","6","0","0","15",
"Hawaii","2005","3116  ","Animal Slaughtering and Processing","22","546","11621","15",
"Hawaii","2005","31161 ","Animal Slaughtering and Processing","22","546","11621","15",
"Hawaii","2005","315234","Women's and Girls' Cut and Sew Suit, Coat, Tailored Jacket, and Skirt Manufacturing","1","0","0","15",
"Hawaii","2005","315239","Women's and Girls' Cut and Sew Other Outerwear Manufacturing","3","0","0","15",
"Hawaii","2005","325992","Photographic Film, Paper, Plate, and Chemical Manufacturing","1","0","0","15",
"Hawaii","2005","31529 ","Other Cut and Sew Apparel Manufacturing","1","0","0","15",
"Hawaii","2005","315291","Infants' Cut and Sew Apparel Manufacturing","1","0","0","15",
"Hawaii","2005","325991","Custom Compounding of Purchased Resins","2","0","0","15",
"Hawaii","2005","33299 ","All Other Fabricated Metal Product Manufacturing","3","0","0","15",
"Hawaii","2005","326   ","Plastics and Rubber Products Manufacturing","16","0","0","15",
"Hawaii","2005","3261  ","Plastics Product Manufacturing","15","0","0","15",
"Hawaii","2005","3329  ","Other Fabricated Metal Product Manufacturing","3","0","0","15",
"Hawaii","2005","332996","Fabricated Pipe and Pipe Fitting Manufacturing","1","0","0","15",
"Hawaii","2005","3371  ","Household and Institutional Furniture and Kitchen Cabinet Manufacturing","41","322","11620","15",
"Hawaii","2005","332999","All Other Miscellaneous Fabricated Metal Product Manufacturing","2","0","0","15",
"Hawaii","2005","333   ","Machinery Manufacturing","10","0","0","15",
"Hawaii","2005","337   ","Furniture and Related Product Manufacturing","53","443","15413","15",
"Hawaii","2005","33711 ","Wood Kitchen Cabinet and Countertop Manufacturing","29","220","8642","15",
"Hawaii","2005","423440","Other Commercial Equipment Merchant Wholesalers","28","185","7964","15",
"Hawaii","2005","337110","Wood Kitchen Cabinet and Countertop Manufacturing","29","220","8642","15",
"Hawaii","2005","423430","Computer and Computer Peripheral Equipment and Software Merchant Wholesalers","24","258","15430","15",
"Hawaii","2005","42344 ","Other Commercial Equipment Merchant Wholesalers","28","185","7964","15",
"Hawaii","2005","44121 ","Recreational Vehicle Dealers","2","0","0","15",
"Hawaii","2005","42345 ","Medical, Dental, and Hospital Equipment and Supplies Merchant Wholesalers","33","255","12652","15",
"Hawaii","2005","42432 ","Men's and Boys' Clothing and Furnishings Merchant Wholesalers","47","397","11063","15",
"Hawaii","2005","424320","Men's and Boys' Clothing and Furnishings Merchant Wholesalers","47","397","11063","15",
"Hawaii","2005","42433 ","Women's, Children's, and Infants' Clothing and Accessories Merchant Wholesalers","46","167","4063","15",
"Hawaii","2005","424330","Women's, Children's, and Infants' Clothing and Accessories Merchant Wholesalers","46","167","4063","15",
"Hawaii","2005","441210","Recreational Vehicle Dealers","2","0","0","15",
"Hawaii","2005","44122 ","Motorcycle, Boat, and Other Motor Vehicle Dealers","37","0","0","15",
"Hawaii","2005","44719 ","Other Gasoline Stations","88","791","15608","15",
"Hawaii","2005","441221","Motorcycle Dealers","20","305","11496","15",
"Hawaii","2005","441222","Boat Dealers","15","0","0","15",
"Hawaii","2005","447110","Gasoline Stations with Convenience Stores","213","2628","69317","15",
"Hawaii","2005","447190","Other Gasoline Stations","88","791","15608","15",
"Hawaii","2005","4543  ","Direct Selling Establishments","83","0","0","15",
"Hawaii","2005","448   ","Clothing and Clothing Accessories Stores","1228","12387","231170","15",
"Hawaii","2005","4481  ","Clothing Stores","715","8909","138499","15",
"Hawaii","2005","454210","Vending Machine Operators","13","0","0","15",
"Hawaii","2005","45431 ","Fuel Dealers","9","0","0","15",
"Hawaii","2005","454311","Heating Oil Dealers","2","0","0","15",
"Hawaii","2005","48811 ","Airport Operations","17","0","0","15",
"Hawaii","2005","454312","Liquefied Petroleum Gas (Bottled Gas) Dealers","7","0","0","15",
"Hawaii","2005","488   ","Support Activities for Transportation","171","4099","143727","15",
"Hawaii","2005","4881  ","Support Activities for Air Transportation","36","2262","55992","15",
"Hawaii","2005","488111","Air Traffic Control","2","0","0","15",
"Hawaii","2005","5152  ","Cable and Other Subscription Programming","2","0","0","15",
"Hawaii","2005","488119","Other Airport Operations","15","0","0","15",
"Hawaii","2005","51512 ","Television Broadcasting","14","0","0","15",
"Hawaii","2005","515120","Television Broadcasting","14","0","0","15",
"Hawaii","2005","51521 ","Cable and Other Subscription Programming","2","0","0","15",
"Hawaii","2005","52314 ","Commodity Contracts Brokerage","1","0","0","15",
"Hawaii","2005","515210","Cable and Other Subscription Programming","2","0","0","15",
"Hawaii","2005","52313 ","Commodity Contracts Dealing","9","0","0","15",
"Hawaii","2005","523130","Commodity Contracts Dealing","9","0","0","15",
"Hawaii","2005","523140","Commodity Contracts Brokerage","1","0","0","15",
"Hawaii","2005","53231 ","General Rental Centers","23","140","3864","15",
"Hawaii","2005","5239  ","Other Financial Investment Activities","140","0","0","15",
"Hawaii","2005","532299","All Other Consumer Goods Rental","26","204","4209","15",
"Hawaii","2005","5323  ","General Rental Centers","23","140","3864","15",
"Hawaii","2005","532310","General Rental Centers","23","140","3864","15",
"Hawaii","2005","541710","Research and Development in the Physical, Engineering, and Life Sciences","90","0","0","15",
"Hawaii","2005","5324  ","Commercial and Industrial Machinery and Equipment Rental and Leasing","77","458","20373","15",
"Hawaii","2005","5417  ","Scientific Research and Development Services","101","2019","127810","15",
"Hawaii","2005","54171 ","Research and Development in the Physical, Engineering, and Life Sciences","90","0","0","15",
"Hawaii","2005","561591","Convention and Visitors Bureaus","16","90","5185","15",
"Hawaii","2005","54172 ","Research and Development in the Social Sciences and Humanities","11","0","0","15",
"Hawaii","2005","561520","Tour Operators","144","2030","55240","15",
"Hawaii","2005","56159 ","Other Travel Arrangement and Reservation Services","66","1827","69119","15",
"Hawaii","2005","561599","All Other Travel Arrangement and Reservation Services","50","1737","63934","15",
"Hawaii","2005","61169 ","All Other Schools and Instruction","87","652","9737","15",
"Hawaii","2005","5616  ","Investigation and Security Services","128","5937","126486","15",
"Hawaii","2005","61163 ","Language Schools","22","178","3113","15",
"Hawaii","2005","611630","Language Schools","22","178","3113","15",
"Hawaii","2005","611691","Exam Preparation and Tutoring","57","473","4841","15",
"Hawaii","2005","623990","Other Residential Care Facilities","8","0","0","15",
"Hawaii","2005","611692","Automobile Driving Schools","3","0","0","15",
"Hawaii","2005","6239  ","Other Residential Care Facilities","8","0","0","15",
"Hawaii","2005","62399 ","Other Residential Care Facilities","8","0","0","15",
"Hawaii","2005","623312","Homes for the Elderly","25","0","0","15",
"Hawaii","2005","624   ","Social Assistance","607","11583","226657","15",
"Hawaii","2005","72    ","Accommodation and Food Services","3393","99886","2308858","15",
"Hawaii","2005","713950","Bowling Centers","12","243","2994","15",
"Hawaii","2005","71399 ","All Other Amusement and Recreation Industries","112","1625","34317","15",
"Hawaii","2005","713990","All Other Amusement and Recreation Industries","112","1625","34317","15",
"Hawaii","2005","812113","Nail Salons","37","111","1961","15",
"Hawaii","2005","721   ","Accommodation","326","41992","1434641","15",
"Hawaii","2005","812111","Barber Shops","32","172","3116","15",
"Hawaii","2005","812112","Beauty Salons","305","2089","42019","15",
"Hawaii","2005","81219 ","Other Personal Care Services","62","343","5011","15",
"Hawaii","2005","812191","Diet and Weight Reducing Centers","4","0","0","15",
"Hawaii","2005","311612","Meat Processed from Carcasses","12","365","7977","15",
"Hawaii","2005","237990","Other Heavy and Civil Engineering Construction","19","423","28838","15",
"Hawaii","2005","238   ","Specialty Trade Contractors","1652","16887","841592","15",
"Hawaii","2005","2381  ","Foundation, Structure, and Building Exterior Contractors","334","3965","177327","15",
"Hawaii","2005","23811 ","Poured Concrete Foundation and Structure Contractors","54","510","23063","15",
"Hawaii","2005","238110","Poured Concrete Foundation and Structure Contractors","54","510","23063","15",
"Hawaii","2005","311613","Rendering and Meat Byproduct Processing","1","0","0","15",
"Hawaii","2005","31599 ","Apparel Accessories and Other Apparel Manufacturing","2","0","0","15",
"Hawaii","2005","311615","Poultry Processing","2","0","0","15",
"Hawaii","2005","3117  ","Seafood Product Preparation and Packaging","3","0","0","15",
"Hawaii","2005","3159  ","Apparel Accessories and Other Apparel Manufacturing","2","0","0","15",
"Hawaii","2005","315999","Other Apparel Accessories and Other Apparel Manufacturing","2","0","0","15",
"Hawaii","2005","326111","Plastics Bag Manufacturing","2","0","0","15",
"Hawaii","2005","316   ","Leather and Allied Product Manufacturing","2","0","0","15",
"Hawaii","2005","3162  ","Footwear Manufacturing","2","0","0","15",
"Hawaii","2005","32611 ","Plastics Packaging Materials and Unlaminated Film and Sheet Manufacturing","5","0","0","15",
"Hawaii","2005","326113","Unlaminated Plastics Film and Sheet (except Packaging) Manufacturing","3","0","0","15",
"Hawaii","2005","33329 ","Other Industrial Machinery Manufacturing","2","0","0","15",
"Hawaii","2005","32616 ","Plastics Bottle Manufacturing","2","0","0","15",
"Hawaii","2005","326160","Plastics Bottle Manufacturing","2","0","0","15",
"Hawaii","2005","3332  ","Industrial Machinery Manufacturing","2","0","0","15",
"Hawaii","2005","333294","Food Product Machinery Manufacturing","2","0","0","15",
"Hawaii","2005","337122","Nonupholstered Wood Household Furniture Manufacturing","9","0","0","15",
"Hawaii","2005","3333  ","Commercial and Service Industry Machinery Manufacturing","4","0","0","15",
"Hawaii","2005","33712 ","Household and Institutional Furniture Manufacturing","12","102","2978","15",
"Hawaii","2005","337121","Upholstered Household Furniture Manufacturing","1","0","0","15",
"Hawaii","2005","42346 ","Ophthalmic Goods Merchant Wholesalers","3","0","0","15",
"Hawaii","2005","337124","Metal Household Furniture Manufacturing","1","0","0","15",
"Hawaii","2005","337125","Household Furniture (except Wood and Metal) Manufacturing","1","0","0","15",
"Hawaii","2005","423450","Medical, Dental, and Hospital Equipment and Supplies Merchant Wholesalers","33","255","12652","15",
"Hawaii","2005","423460","Ophthalmic Goods Merchant Wholesalers","3","0","0","15",
"Hawaii","2005","424340","Footwear Merchant Wholesalers","8","51","1147","15",
"Hawaii","2005","42349 ","Other Professional Equipment and Supplies Merchant Wholesalers","9","0","0","15",
"Hawaii","2005","423490","Other Professional Equipment and Supplies Merchant Wholesalers","9","0","0","15",
"Hawaii","2005","42434 ","Footwear Merchant Wholesalers","8","51","1147","15",
"Hawaii","2005","4244  ","Grocery and Related Product Wholesalers","315","5618","184370","15",
"Hawaii","2005","44131 ","Automotive Parts and Accessories Stores","140","1303","29115","15",
"Hawaii","2005","42441 ","General Line Grocery Merchant Wholesalers","39","347","11676","15",
"Hawaii","2005","441229","All Other Motor Vehicle Dealers","2","0","0","15",
"Hawaii","2005","4413  ","Automotive Parts, Accessories, and Tire Stores","186","1729","44164","15",
"Hawaii","2005","448110","Men's Clothing Stores","54","737","11820","15",
"Hawaii","2005","441310","Automotive Parts and Accessories Stores","140","1303","29115","15",
"Hawaii","2005","44132 ","Tire Dealers","46","426","15049","15",
"Hawaii","2005","44811 ","Men's Clothing Stores","54","737","11820","15",
"Hawaii","2005","44812 ","Women's Clothing Stores","220","1750","26957","15",
"Hawaii","2005","454390","Other Direct Selling Establishments","74","426","9100","15",
"Hawaii","2005","448120","Women's Clothing Stores","220","1750","26957","15",
"Hawaii","2005","44813 ","Children's and Infants' Clothing Stores","20","150","1996","15",
"Hawaii","2005","45439 ","Other Direct Selling Establishments","74","426","9100","15",
"Hawaii","2005","48-49 ","Transportation and Warehousing","850","26490","926945","15",
"Hawaii","2005","481   ","Air Transportation","58","7633","283557","15",
"Hawaii","2005","4883  ","Support Activities for Water Transportation","23","837","59300","15",
"Hawaii","2005","4811  ","Scheduled Air Transportation","44","7514","277884","15",
"Hawaii","2005","48819 ","Other Support Activities for Air Transportation","19","0","0","15",
"Hawaii","2005","488190","Other Support Activities for Air Transportation","19","0","0","15",
"Hawaii","2005","48831 ","Port and Harbor Operations","2","0","0","15",
"Hawaii","2005","51611 ","Internet Publishing and Broadcasting","18","137","4789","15",
"Hawaii","2005","488310","Port and Harbor Operations","2","0","0","15",
"Hawaii","2005","516   ","Internet Publishing and Broadcasting","18","137","4789","15",
"Hawaii","2005","5161  ","Internet Publishing and Broadcasting","18","137","4789","15",
"Hawaii","2005","516110","Internet Publishing and Broadcasting","18","137","4789","15",
"Hawaii","2005","52392 ","Portfolio Management","42","155","12579","15",
"Hawaii","2005","517   ","Telecommunications","252","4266","236685","15",
"Hawaii","2005","52391 ","Miscellaneous Intermediation","36","0","0","15",
"Hawaii","2005","523910","Miscellaneous Intermediation","36","0","0","15",
"Hawaii","2005","523920","Portfolio Management","42","155","12579","15",
"Hawaii","2005","532412","Construction, Mining, and Forestry Machinery and Equipment Rental and Leasing","17","0","0","15",
"Hawaii","2005","52393 ","Investment Advice","53","208","14265","15",
"Hawaii","2005","53241 ","Construction, Transportation, Mining, and Forestry Machinery and Equipment Rental and Leasing","18","0","0","15",
"Hawaii","2005","532411","Commercial Air, Rail, and Water Transportation Equipment Rental and Leasing","1","0","0","15",
"Hawaii","2005","541810","Advertising Agencies","54","442","17308","15",
"Hawaii","2005","541720","Research and Development in the Social Sciences and Humanities","11","0","0","15",
"Hawaii","2005","5418  ","Advertising and Related Services","131","943","32479","15",
"Hawaii","2005","54181 ","Advertising Agencies","54","442","17308","15",
"Hawaii","2005","561612","Security Guards and Patrol Services","60","5257","102710","15",
"Hawaii","2005","54182 ","Public Relations Agencies","28","191","9631","15",
"Hawaii","2005","56161 ","Investigation, Guard, and Armored Car Services","86","5619","113090","15",
"Hawaii","2005","561611","Investigation Services","15","72","1742","15",
"Hawaii","2005","561613","Armored Car Services","11","290","8638","15",
"Hawaii","2005","61171 ","Educational Support Services","34","413","9321","15",
"Hawaii","2005","56162 ","Security Systems Services","42","318","13396","15",
"Hawaii","2005","611699","All Other Miscellaneous Schools and Instruction","27","0","0","15",
"Hawaii","2005","6117  ","Educational Support Services","34","413","9321","15",
"Hawaii","2005","611710","Educational Support Services","34","413","9321","15",
"Hawaii","2005","624110","Child and Youth Services","64","738","22077","15",
"Hawaii","2005","62    ","Health Care and Social Assistance","3389","61005","2358932","15",
"Hawaii","2005","6241  ","Individual and Family Services","268","7248","141814","15",
"Hawaii","2005","62411 ","Child and Youth Services","64","738","22077","15",
"Hawaii","2005","62412 ","Services for the Elderly and Persons with Disabilities","71","3793","51794","15",
"Hawaii","2005","721110","Hotels (except Casino Hotels) and Motels","262","41673","1429103","15",
"Hawaii","2005","624120","Services for the Elderly and Persons with Disabilities","71","3793","51794","15",
"Hawaii","2005","7211  ","Traveler Accommodation","314","41954","1433919","15",
"Hawaii","2005","72111 ","Hotels (except Casino Hotels) and Motels","262","41673","1429103","15",
"Hawaii","2005","72119 ","Other Traveler Accommodation","52","281","4816","15",
"Hawaii","2005","81221 ","Funeral Homes and Funeral Services","20","388","9586","15",
"Hawaii","2005","721191","Bed-and-Breakfast Inns","20","73","987","15",
"Hawaii","2005","812199","Other Personal Care Services","58","0","0","15",
"Hawaii","2005","8122  ","Death Care Services","36","731","18261","15",
"Hawaii","2005","812210","Funeral Homes and Funeral Services","20","388","9586","15",
"Hawaii","2005","311712","Fresh and Frozen Seafood Processing","2","0","0","15",
"Hawaii","2005","81222 ","Cemeteries and Crematories","16","343","8675","15",
"Hawaii","2005","23812 ","Structural Steel and Precast Concrete Contractors","20","552","32488","15",
"Hawaii","2005","238120","Structural Steel and Precast Concrete Contractors","20","552","32488","15",
"Hawaii","2005","23813 ","Framing Contractors","25","438","21357","15",
"Hawaii","2005","238130","Framing Contractors","25","438","21357","15",
"Hawaii","2005","31171 ","Seafood Product Preparation and Packaging","3","0","0","15",
"Hawaii","2005","311711","Seafood Canning","1","0","0","15",
"Hawaii","2005","316213","Men's Footwear (except Athletic) Manufacturing","1","0","0","15",
"Hawaii","2005","3118  ","Bakeries and Tortilla Manufacturing","100","1731","39692","15",
"Hawaii","2005","31181 ","Bread and Bakery Product Manufacturing","76","1501","35068","15",
"Hawaii","2005","31621 ","Footwear Manufacturing","2","0","0","15",
"Hawaii","2005","316214","Women's Footwear (except Athletic) Manufacturing","1","0","0","15",
"Hawaii","2005","326199","All Other Plastics Product Manufacturing","8","0","0","15",
"Hawaii","2005","321   ","Wood Product Manufacturing","32","343","11448","15",
"Hawaii","2005","3211  ","Sawmills and Wood Preservation","5","0","0","15",
"Hawaii","2005","32619 ","Other Plastics Product Manufacturing","8","0","0","15",
"Hawaii","2005","3262  ","Rubber Product Manufacturing","1","0","0","15",
"Hawaii","2005","333314","Optical Instrument and Lens Manufacturing","1","0","0","15",
"Hawaii","2005","32621 ","Tire Manufacturing","1","0","0","15",
"Hawaii","2005","326212","Tire Retreading","1","0","0","15",
"Hawaii","2005","33331 ","Commercial and Service Industry Machinery Manufacturing","4","0","0","15",
"Hawaii","2005","333319","Other Commercial and Service Industry Machinery Manufacturing","3","0","0","15",
"Hawaii","2005","337212","Custom Architectural Woodwork and Millwork Manufacturing","3","0","0","15",
"Hawaii","2005","3334  ","Ventilation, Heating, Air-Conditioning, and Commercial Refrigeration Equipment Manufacturing","2","0","0","15",
"Hawaii","2005","3372  ","Office Furniture (including Fixtures) Manufacturing","8","0","0","15",
"Hawaii","2005","33721 ","Office Furniture (including Fixtures) Manufacturing","8","0","0","15",
"Hawaii","2005","423510","Metal Service Centers and Other Metal Merchant Wholesalers","19","136","7644","15",
"Hawaii","2005","337215","Showcase, Partition, Shelving, and Locker Manufacturing","5","0","0","15",
"Hawaii","2005","4235  ","Metal and Mineral (except Petroleum) Merchant Wholesalers","19","136","7644","15",
"Hawaii","2005","42351 ","Metal Service Centers and Other Metal Merchant Wholesalers","19","136","7644","15",
"Hawaii","2005","424420","Packaged Frozen Food Merchant Wholesalers","63","1450","57104","15",
"Hawaii","2005","4236  ","Electrical and Electronic Goods Merchant Wholesalers","87","818","39253","15",
"Hawaii","2005","424410","General Line Grocery Merchant Wholesalers","39","347","11676","15",
"Hawaii","2005","42442 ","Packaged Frozen Food Merchant Wholesalers","63","1450","57104","15",
"Hawaii","2005","42443 ","Dairy Product (except Dried or Canned) Merchant Wholesalers","10","146","5889","15",
"Hawaii","2005","4421  ","Furniture Stores","84","822","28283","15",
"Hawaii","2005","424430","Dairy Product (except Dried or Canned) Merchant Wholesalers","10","146","5889","15",
"Hawaii","2005","441320","Tire Dealers","46","426","15049","15",
"Hawaii","2005","442   ","Furniture and Home Furnishings Stores","188","1807","53270","15",
"Hawaii","2005","44211 ","Furniture Stores","84","822","28283","15",
"Hawaii","2005","448140","Family Clothing Stores","199","4755","67727","15",
"Hawaii","2005","442110","Furniture Stores","84","822","28283","15",
"Hawaii","2005","448130","Children's and Infants' Clothing Stores","20","150","1996","15",
"Hawaii","2005","44814 ","Family Clothing Stores","199","4755","67727","15",
"Hawaii","2005","44815 ","Clothing Accessories Stores","77","518","13221","15",
"Hawaii","2005","481112","Scheduled Freight Air Transportation","4","39","1766","15",
"Hawaii","2005","448150","Clothing Accessories Stores","77","518","13221","15",
"Hawaii","2005","48111 ","Scheduled Air Transportation","44","7514","277884","15",
"Hawaii","2005","481111","Scheduled Passenger Air Transportation","40","7475","276118","15",
"Hawaii","2005","4812  ","Nonscheduled Air Transportation","14","119","5673","15",
"Hawaii","2005","48833 ","Navigational Services to Shipping","6","0","0","15",
"Hawaii","2005","48121 ","Nonscheduled Air Transportation","14","119","5673","15",
"Hawaii","2005","48832 ","Marine Cargo Handling","8","694","53061","15",
"Hawaii","2005","488320","Marine Cargo Handling","8","694","53061","15",
"Hawaii","2005","488330","Navigational Services to Shipping","6","0","0","15",
"Hawaii","2005","517110","Wired Telecommunications Carriers","134","2464","136783","15",
"Hawaii","2005","48839 ","Other Support Activities for Water Transportation","7","0","0","15",
"Hawaii","2005","5171  ","Wired Telecommunications Carriers","134","2464","136783","15",
"Hawaii","2005","51711 ","Wired Telecommunications Carriers","134","2464","136783","15",
"Hawaii","2005","5172  ","Wireless Telecommunications Carriers (except Satellite)","85","0","0","15",
"Hawaii","2005","523991","Trust, Fiduciary, and Custody Activities","9","0","0","15",
"Hawaii","2005","51721 ","Wireless Telecommunications Carriers (except Satellite)","85","0","0","15",
"Hawaii","2005","523930","Investment Advice","53","208","14265","15",
"Hawaii","2005","52399 ","All Other Financial Investment Activities","9","0","0","15",
"Hawaii","2005","524   ","Insurance Carriers and Related Activities","513","6709","374388","15",
"Hawaii","2005","53249 ","Other Commercial and Industrial Machinery and Equipment Rental and Leasing","57","355","15828","15",
"Hawaii","2005","5241  ","Insurance Carriers","122","3918","229175","15",
"Hawaii","2005","53242 ","Office Machinery and Equipment Rental and Leasing","2","0","0","15",
"Hawaii","2005","532420","Office Machinery and Equipment Rental and Leasing","2","0","0","15",
"Hawaii","2005","532490","Other Commercial and Industrial Machinery and Equipment Rental and Leasing","57","355","15828","15",
"Hawaii","2005","54184 ","Media Representatives","13","0","0","15",
"Hawaii","2005","541820","Public Relations Agencies","28","191","9631","15",
"Hawaii","2005","54183 ","Media Buying Agencies","2","0","0","15",
"Hawaii","2005","541830","Media Buying Agencies","2","0","0","15",
"Hawaii","2005","541840","Media Representatives","13","0","0","15",
"Hawaii","2005","56171 ","Exterminating and Pest Control Services","70","862","27689","15",
"Hawaii","2005","561621","Security Systems Services (except Locksmiths)","24","253","11261","15",
"Hawaii","2005","561622","Locksmiths","18","65","2135","15",
"Hawaii","2005","5617  ","Services to Buildings and Dwellings","651","9174","185672","15",
"Hawaii","2005","621111","Offices of Physicians (except Mental Health Specialists)","1128","7038","490471","15",
"Hawaii","2005","621   ","Ambulatory Health Care Services","2637","23923","1110633","15",
"Hawaii","2005","6211  ","Offices of Physicians","1187","7150","496345","15",
"Hawaii","2005","62111 ","Offices of Physicians","1187","7150","496345","15",
"Hawaii","2005","6242  ","Community Food and Housing, and Emergency and Other Relief Services","69","865","22204","15",
"Hawaii","2005","621112","Offices of Physicians, Mental Health Specialists","59","112","5874","15",
"Hawaii","2005","62419 ","Other Individual and Family Services","133","2717","67943","15",
"Hawaii","2005","624190","Other Individual and Family Services","133","2717","67943","15",
"Hawaii","2005","62421 ","Community Food Services","12","99","2662","15",
"Hawaii","2005","72121 ","RV (Recreational Vehicle) Parks and Recreational Camps","5","0","0","15",
"Hawaii","2005","624210","Community Food Services","12","99","2662","15",
"Hawaii","2005","721199","All Other Traveler Accommodation","32","208","3829","15",
"Hawaii","2005","7212  ","RV (Recreational Vehicle) Parks and Recreational Camps","5","0","0","15",
"Hawaii","2005","721211","RV (Recreational Vehicle) Parks and Campgrounds","1","0","0","15",
"Hawaii","2005","812310","Coin-Operated Laundries and Drycleaners","28","0","0","15",
"Hawaii","2005","812220","Cemeteries and Crematories","16","343","8675","15",
"Hawaii","2005","8123  ","Drycleaning and Laundry Services","88","1990","39842","15",
"Hawaii","2005","81231 ","Coin-Operated Laundries and Drycleaners","28","0","0","15",
"Hawaii","2005","81232 ","Drycleaning and Laundry Services (except Coin-Operated)","41","1216","22579","15",
