"Nevada","2003","45331 ","Used Merchandise Stores","95","824","12770","32",
"Nevada","2003","485410","School and Employee Bus Transportation","3","0","0","32",
"Nevada","2003","453310","Used Merchandise Stores","95","824","12770","32",
"Nevada","2003","4854  ","School and Employee Bus Transportation","3","0","0","32",
"Nevada","2003","48541 ","School and Employee Bus Transportation","3","0","0","32",
"Nevada","2003","4855  ","Charter Bus Industry","24","873","21789","32",
"Nevada","2003","51114 ","Directory and Mailing List Publishers","15","0","0","32",
"Nevada","2003","48551 ","Charter Bus Industry","24","873","21789","32",
"Nevada","2003","51113 ","Book Publishers","27","0","0","32",
"Nevada","2003","511130","Book Publishers","27","0","0","32",
"Nevada","2003","511140","Directory and Mailing List Publishers","15","0","0","32",
"Nevada","2003","522110","Commercial Banking","493","10883","387924","32",
"Nevada","2003","51119 ","Other Publishers","7","0","0","32",
"Nevada","2003","5221  ","Depository Credit Intermediation","663","13029","472973","32",
"Nevada","2003","52211 ","Commercial Banking","493","10883","387924","32",
"Nevada","2003","52212 ","Savings Institutions","77","605","30707","32",
"Nevada","2003","5311  ","Lessors of Real Estate","1145","5732","147819","32",
"Nevada","2003","522120","Savings Institutions","77","605","30707","32",
"Nevada","2003","53    ","Real Estate and Rental and Leasing","3472","23995","726601","32",
"Nevada","2003","531   ","Real Estate","2772","16276","499133","32",
"Nevada","2003","53111 ","Lessors of Residential Buildings and Dwellings","577","3300","78985","32",
"Nevada","2003","541330","Engineering Services","464","10699","606390","32",
"Nevada","2003","531110","Lessors of Residential Buildings and Dwellings","577","3300","78985","32",
"Nevada","2003","541320","Landscape Architectural Services","49","461","17884","32",
"Nevada","2003","54133 ","Engineering Services","464","10699","606390","32",
"Nevada","2003","54134 ","Drafting Services","27","0","0","32",
"Nevada","2003","551111","Offices of Bank Holding Companies","76","119","4348","32",
"Nevada","2003","541340","Drafting Services","27","0","0","32",
"Nevada","2003","5511  ","Management of Companies and Enterprises","798","11645","855881","32",
"Nevada","2003","55111 ","Management of Companies and Enterprises","798","11645","855881","32",
"Nevada","2003","551112","Offices of Other Holding Companies","453","1366","66293","32",
"Nevada","2003","562212","Solid Waste Landfill","2","0","0","32",
"Nevada","2003","551114","Corporate, Subsidiary, and Regional Managing Offices","269","10160","785240","32",
"Nevada","2003","56221 ","Waste Treatment and Disposal","8","0","0","32",
"Nevada","2003","562211","Hazardous Waste Treatment and Disposal","6","0","0","32",
"Nevada","2003","5629  ","Remediation and Other Waste Management Services","43","0","0","32",
"Nevada","2003","6215  ","Medical and Diagnostic Laboratories","96","3131","156807","32",
"Nevada","2003","621492","Kidney Dialysis Centers","16","0","0","32",
"Nevada","2003","621493","Freestanding Ambulatory Surgical and Emergency Centers","39","1017","33448","32",
"Nevada","2003","621498","All Other Outpatient Care Centers","75","945","31901","32",
"Nevada","2003","711219","Other Spectator Sports","24","82","13000","32",
"Nevada","2003","71121 ","Spectator Sports","32","359","22079","32",
"Nevada","2003","711211","Sports Teams and Clubs","6","0","0","32",
"Nevada","2003","711212","Racetracks","2","0","0","32",
"Nevada","2003","72233 ","Mobile Food Services","17","71","887","32",
"Nevada","2003","7113  ","Promoters of Performing Arts, Sports, and Similar Events","62","275","12603","32",
"Nevada","2003","72232 ","Caterers","52","331","3540","32",
"Nevada","2003","722320","Caterers","52","331","3540","32",
"Nevada","2003","722330","Mobile Food Services","17","71","887","32",
"Nevada","2003","7224  ","Drinking Places (Alcoholic Beverages)","578","6668","91747","32",
"Nevada","2003","8132  ","Grantmaking and Giving Services","85","463","16343","32",
"Nevada","2003","8131  ","Religious Organizations","417","4773","82928","32",
"Nevada","2003","81311 ","Religious Organizations","417","4773","82928","32",
"Nevada","2003","813110","Religious Organizations","417","4773","82928","32",
"Nevada","2003","81321 ","Grantmaking and Giving Services","85","463","16343","32",
"Nevada","2003","11531 ","Support Activities for Forestry","6","0","0","32",
"Nevada","2003","115310","Support Activities for Forestry","6","0","0","32",
"Nevada","2003","23712 ","Oil and Gas Pipeline and Related Structures Construction","10","808","29027","32",
"Nevada","2003","21    ","Mining","182","8186","497784","32",
"Nevada","2003","211   ","Oil and Gas Extraction","20","66","4649","32",
"Nevada","2003","2111  ","Oil and Gas Extraction","20","66","4649","32",
"Nevada","2003","237120","Oil and Gas Pipeline and Related Structures Construction","10","808","29027","32",
"Nevada","2003","3115  ","Dairy Product Manufacturing","8","976","36714","32",
"Nevada","2003","23713 ","Power and Communication Line and Related Structures Construction","42","1061","41563","32",
"Nevada","2003","237130","Power and Communication Line and Related Structures Construction","42","1061","41563","32",
"Nevada","2003","311423","Dried and Dehydrated Food Manufacturing","2","0","0","32",
"Nevada","2003","315212","Women's, Girls', and Infants' Cut and Sew Apparel Contractors","16","40","1781","32",
"Nevada","2003","31151 ","Dairy Product (except Frozen) Manufacturing","4","0","0","32",
"Nevada","2003","311511","Fluid Milk Manufacturing","2","0","0","32",
"Nevada","2003","315211","Men's and Boys' Cut and Sew Apparel Contractors","5","57","696","32",
"Nevada","2003","32419 ","Other Petroleum and Coal Products Manufacturing","1","0","0","32",
"Nevada","2003","31522 ","Men's and Boys' Cut and Sew Apparel Manufacturing","2","0","0","32",
"Nevada","2003","315222","Men's and Boys' Cut and Sew Suit, Coat, and Overcoat Manufacturing","1","0","0","32",
"Nevada","2003","324122","Asphalt Shingle and Coating Materials Manufacturing","1","0","0","32",
"Nevada","2003","324191","Petroleum Lubricating Oil and Grease Manufacturing","1","0","0","32",
"Nevada","2003","32711 ","Pottery, Ceramics, and Plumbing Fixture Manufacturing","5","0","0","32",
"Nevada","2003","325   ","Chemical Manufacturing","60","1218","54577","32",
"Nevada","2003","3251  ","Basic Chemical Manufacturing","14","429","23144","32",
"Nevada","2003","3271  ","Clay Product and Refractory Manufacturing","7","0","0","32",
"Nevada","2003","332311","Prefabricated Metal Building and Component Manufacturing","4","0","0","32",
"Nevada","2003","327111","Vitreous China Plumbing Fixture and China and Earthenware Bathroom Accessories Manufacturing","1","0","0","32",
"Nevada","2003","327112","Vitreous China, Fine Earthenware, and Other Pottery Product Manufacturing","3","0","0","32",
"Nevada","2003","33231 ","Plate Work and Fabricated Structural Product Manufacturing","31","1040","38559","32",
"Nevada","2003","333414","Heating Equipment (except Warm Air Furnaces) Manufacturing","1","0","0","32",
"Nevada","2003","332312","Fabricated Structural Metal Manufacturing","24","869","34730","32",
"Nevada","2003","332313","Plate Work Manufacturing","3","0","0","32",
"Nevada","2003","333412","Industrial and Commercial Fan and Blower Manufacturing","2","0","0","32",
"Nevada","2003","333415","Air-Conditioning and Warm Air Heating Equipment and Commercial and Industrial Refrigeration Equipment Manufacturing","2","0","0","32",
"Nevada","2003","3371  ","Household and Institutional Furniture and Kitchen Cabinet Manufacturing","95","1506","48132","32",
"Nevada","2003","3335  ","Metalworking Machinery Manufacturing","17","0","0","32",
"Nevada","2003","334613","Magnetic and Optical Recording Media Manufacturing","4","0","0","32",
"Nevada","2003","335   ","Electrical Equipment, Appliance, and Component Manufacturing","45","775","29232","32",
"Nevada","2003","3351  ","Electric Lighting Equipment Manufacturing","11","234","7859","32",
"Nevada","2003","33512 ","Lighting Fixture Manufacturing","11","234","7859","32",
"Nevada","2003","33711 ","Wood Kitchen Cabinet and Countertop Manufacturing","65","1151","36855","32",
"Nevada","2003","4234  ","Professional and Commercial Equipment and Supplies Merchant Wholesalers","276","3675","163435","32",
"Nevada","2003","337110","Wood Kitchen Cabinet and Countertop Manufacturing","65","1151","36855","32",
"Nevada","2003","33712 ","Household and Institutional Furniture Manufacturing","30","355","11277","32",
"Nevada","2003","423390","Other Construction Material Merchant Wholesalers","31","284","13374","32",
"Nevada","2003","42341 ","Photographic Equipment and Supplies Merchant Wholesalers","14","57","2984","32",
"Nevada","2003","424120","Stationery and Office Supplies Merchant Wholesalers","32","332","14759","32",
"Nevada","2003","423410","Photographic Equipment and Supplies Merchant Wholesalers","14","57","2984","32",
"Nevada","2003","42342 ","Office Equipment Merchant Wholesalers","45","964","39492","32",
"Nevada","2003","42412 ","Stationery and Office Supplies Merchant Wholesalers","32","332","14759","32",
"Nevada","2003","42413 ","Industrial and Personal Service Paper Merchant Wholesalers","19","83","3640","32",
"Nevada","2003","425   ","Wholesale Electronic Markets and Agents and Brokers","229","1391","43432","32",
"Nevada","2003","424130","Industrial and Personal Service Paper Merchant Wholesalers","19","83","3640","32",
"Nevada","2003","4242  ","Drugs and Druggists' Sundries Merchant Wholesalers","97","1083","50057","32",
"Nevada","2003","424990","Other Miscellaneous Nondurable Goods Merchant Wholesalers","143","977","30942","32",
"Nevada","2003","4251  ","Wholesale Electronic Markets and Agents and Brokers","229","1391","43432","32",
"Nevada","2003","446   ","Health and Personal Care Stores","577","7250","148137","32",
"Nevada","2003","42511 ","Business to Business Electronic Markets","5","11","398","32",
"Nevada","2003","44531 ","Beer, Wine, and Liquor Stores","85","468","7707","32",
"Nevada","2003","445310","Beer, Wine, and Liquor Stores","85","468","7707","32",
"Nevada","2003","4461  ","Health and Personal Care Stores","577","7250","148137","32",
"Nevada","2003","453910","Pet and Pet Supplies Stores","58","866","13791","32",
"Nevada","2003","44611 ","Pharmacies and Drug Stores","200","4592","97079","32",
"Nevada","2003","4539  ","Other Miscellaneous Store Retailers","410","2679","56836","32",
"Nevada","2003","45391 ","Pet and Pet Supplies Stores","58","866","13791","32",
"Nevada","2003","4859  ","Other Transit and Ground Passenger Transportation","14","0","0","32",
"Nevada","2003","45392 ","Art Dealers","53","304","9473","32",
"Nevada","2003","453920","Art Dealers","53","304","9473","32",
"Nevada","2003","485510","Charter Bus Industry","24","873","21789","32",
"Nevada","2003","48599 ","Other Transit and Ground Passenger Transportation","14","0","0","32",
"Nevada","2003","511199","All Other Publishers","6","0","0","32",
"Nevada","2003","485991","Special Needs Transportation","5","0","0","32",
"Nevada","2003","485999","All Other Transit and Ground Passenger Transportation","9","487","7249","32",
"Nevada","2003","511191","Greeting Card Publishers","1","0","0","32",
"Nevada","2003","5112  ","Software Publishers","58","1446","103862","32",
"Nevada","2003","51121 ","Software Publishers","58","1446","103862","32",
"Nevada","2003","52219 ","Other Depository Credit Intermediation","5","34","1710","32",
"Nevada","2003","511210","Software Publishers","58","1446","103862","32",
"Nevada","2003","52213 ","Credit Unions","88","1507","52632","32",
"Nevada","2003","522130","Credit Unions","88","1507","52632","32",
"Nevada","2003","522190","Other Depository Credit Intermediation","5","34","1710","32",
"Nevada","2003","53113 ","Lessors of Miniwarehouses and Self-Storage Units","166","483","7397","32",
"Nevada","2003","5222  ","Nondepository Credit Intermediation","638","7904","403772","32",
"Nevada","2003","53112 ","Lessors of Nonresidential Buildings (except Miniwarehouses)","253","1470","51209","32",
"Nevada","2003","531120","Lessors of Nonresidential Buildings (except Miniwarehouses)","253","1470","51209","32",
"Nevada","2003","54136 ","Geophysical Surveying and Mapping Services","9","0","0","32",
"Nevada","2003","531130","Lessors of Miniwarehouses and Self-Storage Units","166","483","7397","32",
"Nevada","2003","54135 ","Building Inspection Services","43","93","4037","32",
"Nevada","2003","541350","Building Inspection Services","43","93","4037","32",
"Nevada","2003","541360","Geophysical Surveying and Mapping Services","9","0","0","32",
"Nevada","2003","5611  ","Office Administrative Services","427","4585","155736","32",
"Nevada","2003","54137 ","Surveying and Mapping (except Geophysical) Services","59","431","19249","32",
"Nevada","2003","56    ","Administrative and Support and Waste Management and Remediation Services","3520","80471","2237960","32",
"Nevada","2003","561   ","Administrative and Support Services","3424","77852","2134493","32",
"Nevada","2003","56292 ","Materials Recovery Facilities","1","0","0","32",
"Nevada","2003","56111 ","Office Administrative Services","427","4585","155736","32",
"Nevada","2003","56291 ","Remediation Services","14","172","8857","32",
"Nevada","2003","562910","Remediation Services","14","172","8857","32",
"Nevada","2003","562920","Materials Recovery Facilities","1","0","0","32",
"Nevada","2003","621512","Diagnostic Imaging Centers","54","1261","75907","32",
"Nevada","2003","56299 ","All Other Waste Management Services","28","0","0","32",
"Nevada","2003","62151 ","Medical and Diagnostic Laboratories","96","3131","156807","32",
"Nevada","2003","621511","Medical Laboratories","42","1870","80900","32",
"Nevada","2003","6216  ","Home Health Care Services","130","3200","81020","32",
"Nevada","2003","62161 ","Home Health Care Services","130","3200","81020","32",
"Nevada","2003","722410","Drinking Places (Alcoholic Beverages)","578","6668","91747","32",
"Nevada","2003","71131 ","Promoters of Performing Arts, Sports, and Similar Events with Facilities","14","0","0","32",
"Nevada","2003","711310","Promoters of Performing Arts, Sports, and Similar Events with Facilities","14","0","0","32",
"Nevada","2003","71132 ","Promoters of Performing Arts, Sports, and Similar Events without Facilities","48","0","0","32",
"Nevada","2003","711320","Promoters of Performing Arts, Sports, and Similar Events without Facilities","48","0","0","32",
"Nevada","2003","72241 ","Drinking Places (Alcoholic Beverages)","578","6668","91747","32",
"Nevada","2003","81    ","Other Services (except Public Administration)","3818","29874","695999","32",
"Nevada","2003","811   ","Repair and Maintenance","1525","9643","280052","32",
"Nevada","2003","813219","Other Grantmaking and Giving Services","11","94","3013","32",
"Nevada","2003","8111  ","Automotive Repair and Maintenance","1155","7208","181871","32",
"Nevada","2003","813211","Grantmaking Foundations","46","196","7629","32",
"Nevada","2003","813212","Voluntary Health Organizations","28","173","5701","32",
"Nevada","2003","8133  ","Social Advocacy Organizations","55","284","6665","32",
"Nevada","2003","21111 ","Oil and Gas Extraction","20","66","4649","32",
"Nevada","2003","211111","Crude Petroleum and Natural Gas Extraction","17","0","0","32",
"Nevada","2003","211112","Natural Gas Liquid Extraction","3","0","0","32",
"Nevada","2003","237210","Land Subdivision","121","2385","67220","32",
"Nevada","2003","81331 ","Social Advocacy Organizations","55","284","6665","32",
"Nevada","2003","212   ","Mining (except Oil and Gas)","109","7358","451637","32",
"Nevada","2003","2122  ","Metal Ore Mining","46","6259","406002","32",
"Nevada","2003","2372  ","Land Subdivision","121","2385","67220","32",
"Nevada","2003","23721 ","Land Subdivision","121","2385","67220","32",
"Nevada","2003","31152 ","Ice Cream and Frozen Dessert Manufacturing","4","0","0","32",
"Nevada","2003","2373  ","Highway, Street, and Bridge Construction","50","2997","195504","32",
"Nevada","2003","23731 ","Highway, Street, and Bridge Construction","50","2997","195504","32",
"Nevada","2003","311513","Cheese Manufacturing","2","0","0","32",
"Nevada","2003","311520","Ice Cream and Frozen Dessert Manufacturing","4","0","0","32",
"Nevada","2003","31523 ","Women's and Girls' Cut and Sew Apparel Manufacturing","2","0","0","32",
"Nevada","2003","3116  ","Animal Slaughtering and Processing","9","192","7027","32",
"Nevada","2003","31161 ","Animal Slaughtering and Processing","9","192","7027","32",
"Nevada","2003","315223","Men's and Boys' Cut and Sew Shirt (except Work Shirt) Manufacturing","1","0","0","32",
"Nevada","2003","315232","Women's and Girls' Cut and Sew Blouse and Shirt Manufacturing","2","0","0","32",
"Nevada","2003","32518 ","Other Basic Inorganic Chemical Manufacturing","7","392","22161","32",
"Nevada","2003","31529 ","Other Cut and Sew Apparel Manufacturing","2","0","0","32",
"Nevada","2003","32512 ","Industrial Gas Manufacturing","4","0","0","32",
"Nevada","2003","325120","Industrial Gas Manufacturing","4","0","0","32",
"Nevada","2003","32712 ","Clay Building Material and Refractories Manufacturing","2","0","0","32",
"Nevada","2003","325181","Alkalies and Chlorine Manufacturing","1","0","0","32",
"Nevada","2003","325188","All Other Basic Inorganic Chemical Manufacturing","6","0","0","32",
"Nevada","2003","327113","Porcelain Electrical Supply Manufacturing","1","0","0","32",
"Nevada","2003","327125","Nonclay Refractory Manufacturing","2","0","0","32",
"Nevada","2003","332321","Metal Window and Door Manufacturing","10","367","12563","32",
"Nevada","2003","3272  ","Glass and Glass Product Manufacturing","15","243","6920","32",
"Nevada","2003","32721 ","Glass and Glass Product Manufacturing","15","243","6920","32",
"Nevada","2003","33232 ","Ornamental and Architectural Metal Products Manufacturing","51","1221","47117","32",
"Nevada","2003","332322","Sheet Metal Work Manufacturing","24","716","28750","32",
"Nevada","2003","333511","Industrial Mold Manufacturing","4","0","0","32",
"Nevada","2003","332323","Ornamental and Architectural Metal Work Manufacturing","17","138","5804","32",
"Nevada","2003","3324  ","Boiler, Tank, and Shipping Container Manufacturing","1","0","0","32",
"Nevada","2003","33351 ","Metalworking Machinery Manufacturing","17","0","0","32",
"Nevada","2003","333513","Machine Tool (Metal Forming Types) Manufacturing","2","0","0","32",
"Nevada","2003","335122","Commercial, Industrial, and Institutional Electric Lighting Fixture Manufacturing","4","38","1189","32",
"Nevada","2003","333514","Special Die and Tool, Die Set, Jig, and Fixture Manufacturing","6","0","0","32",
"Nevada","2003","333515","Cutting Tool and Machine Tool Accessory Manufacturing","5","30","1159","32",
"Nevada","2003","335121","Residential Electric Lighting Fixture Manufacturing","4","0","0","32",
"Nevada","2003","335129","Other Lighting Equipment Manufacturing","3","0","0","32",
"Nevada","2003","337122","Nonupholstered Wood Household Furniture Manufacturing","13","0","0","32",
"Nevada","2003","3352  ","Household Appliance Manufacturing","3","0","0","32",
"Nevada","2003","33521 ","Small Electrical Appliance Manufacturing","1","0","0","32",
"Nevada","2003","337121","Upholstered Household Furniture Manufacturing","11","0","0","32",
"Nevada","2003","337124","Metal Household Furniture Manufacturing","2","0","0","32",
"Nevada","2003","42421 ","Drugs and Druggists' Sundries Merchant Wholesalers","97","1083","50057","32",
"Nevada","2003","337127","Institutional Furniture Manufacturing","4","0","0","32",
"Nevada","2003","423420","Office Equipment Merchant Wholesalers","45","964","39492","32",
"Nevada","2003","42343 ","Computer and Computer Peripheral Equipment and Software Merchant Wholesalers","95","1436","64863","32",
"Nevada","2003","423430","Computer and Computer Peripheral Equipment and Software Merchant Wholesalers","95","1436","64863","32",
"Nevada","2003","42344 ","Other Commercial Equipment Merchant Wholesalers","41","400","17726","32",
"Nevada","2003","424210","Drugs and Druggists' Sundries Merchant Wholesalers","97","1083","50057","32",
"Nevada","2003","4243  ","Apparel, Piece Goods, and Notions Merchant Wholesalers","71","853","34892","32",
"Nevada","2003","425120","Wholesale Trade Agents and Brokers","224","1380","43034","32",
"Nevada","2003","42431 ","Piece Goods, Notions, and Other Dry Goods Merchant Wholesalers","12","81","5558","32",
"Nevada","2003","425110","Business to Business Electronic Markets","5","11","398","32",
"Nevada","2003","42512 ","Wholesale Trade Agents and Brokers","224","1380","43034","32",
"Nevada","2003","44-45 ","Retail Trade","7599","120598","2851751","32",
"Nevada","2003","446120","Cosmetics, Beauty Supplies, and Perfume Stores","124","1245","14493","32",
"Nevada","2003","441   ","Motor Vehicle and Parts Dealers","740","16178","634570","32",
"Nevada","2003","446110","Pharmacies and Drug Stores","200","4592","97079","32",
"Nevada","2003","44612 ","Cosmetics, Beauty Supplies, and Perfume Stores","124","1245","14493","32",
"Nevada","2003","44613 ","Optical Goods Stores","87","625","14361","32",
"Nevada","2003","45399 ","All Other Miscellaneous Store Retailers","261","1327","27813","32",
"Nevada","2003","446130","Optical Goods Stores","87","625","14361","32",
"Nevada","2003","45393 ","Manufactured (Mobile) Home Dealers","38","182","5759","32",
"Nevada","2003","453930","Manufactured (Mobile) Home Dealers","38","182","5759","32",
"Nevada","2003","453991","Tobacco Stores","90","432","7699","32",
"Nevada","2003","48621 ","Pipeline Transportation of Natural Gas","9","0","0","32",
"Nevada","2003","453998","All Other Miscellaneous Store Retailers (except Tobacco Stores)","171","895","20114","32",
"Nevada","2003","486   ","Pipeline Transportation","10","0","0","32",
"Nevada","2003","4862  ","Pipeline Transportation of Natural Gas","9","0","0","32",
"Nevada","2003","51211 ","Motion Picture and Video Production","67","154","12584","32",
"Nevada","2003","486210","Pipeline Transportation of Natural Gas","9","0","0","32",
"Nevada","2003","512   ","Motion Picture and Sound Recording Industries","132","1369","30436","32",
"Nevada","2003","5121  ","Motion Picture and Video Industries","112","1339","28818","32",
"Nevada","2003","512110","Motion Picture and Video Production","67","154","12584","32",
"Nevada","2003","52222 ","Sales Financing","68","0","0","32",
"Nevada","2003","51213 ","Motion Picture and Video Exhibition","35","0","0","32",
"Nevada","2003","52221 ","Credit Card Issuing","7","0","0","32",
"Nevada","2003","522210","Credit Card Issuing","7","0","0","32",
"Nevada","2003","522220","Sales Financing","68","0","0","32",
"Nevada","2003","5312  ","Offices of Real Estate Agents and Brokers","903","4295","153286","32",
"Nevada","2003","52229 ","Other Nondepository Credit Intermediation","563","4711","279130","32",
"Nevada","2003","53119 ","Lessors of Other Real Estate Property","149","479","10228","32",
"Nevada","2003","531190","Lessors of Other Real Estate Property","149","479","10228","32",
"Nevada","2003","53121 ","Offices of Real Estate Agents and Brokers","903","4295","153286","32",
"Nevada","2003","541380","Testing Laboratories","49","423","17157","32",
"Nevada","2003","531210","Offices of Real Estate Agents and Brokers","903","4295","153286","32",
"Nevada","2003","541370","Surveying and Mapping (except Geophysical) Services","59","431","19249","32",
"Nevada","2003","54138 ","Testing Laboratories","49","423","17157","32",
"Nevada","2003","5414  ","Specialized Design Services","226","1123","44122","32",
"Nevada","2003","561210","Facilities Support Services","32","916","34897","32",
"Nevada","2003","561110","Office Administrative Services","427","4585","155736","32",
"Nevada","2003","5612  ","Facilities Support Services","32","916","34897","32",
"Nevada","2003","56121 ","Facilities Support Services","32","916","34897","32",
"Nevada","2003","61    ","Educational Services","454","5036","119440","32",
"Nevada","2003","5613  ","Employment Services","338","32021","1002052","32",
"Nevada","2003","562991","Septic Tank and Related Services","23","0","0","32",
"Nevada","2003","562998","All Other Miscellaneous Waste Management Services","5","0","0","32",
"Nevada","2003","611   ","Educational Services","454","5036","119440","32",
"Nevada","2003","6111  ","Elementary and Secondary Schools","64","1458","37278","32",
"Nevada","2003","621910","Ambulance Services","12","757","24072","32",
"Nevada","2003","621610","Home Health Care Services","130","3200","81020","32",
"Nevada","2003","6219  ","Other Ambulatory Health Care Services","70","1828","63421","32",
"Nevada","2003","62191 ","Ambulance Services","12","757","24072","32",
"Nevada","2003","62199 ","All Other Ambulatory Health Care Services","58","1071","39349","32",
"Nevada","2003","811112","Automotive Exhaust System Repair","22","81","1923","32",
"Nevada","2003","7114  ","Agents and Managers for Artists, Athletes, Entertainers, and Other Public Figures","54","385","27203","32",
"Nevada","2003","71141 ","Agents and Managers for Artists, Athletes, Entertainers, and Other Public Figures","54","385","27203","32",
"Nevada","2003","711410","Agents and Managers for Artists, Athletes, Entertainers, and Other Public Figures","54","385","27203","32",
"Nevada","2003","81111 ","Automotive Mechanical and Electrical Repair and Maintenance","677","3022","87316","32",
"Nevada","2003","811111","General Automotive Repair","547","2480","71388","32",
"Nevada","2003","811113","Automotive Transmission Repair","47","212","6462","32",
"Nevada","2003","8134  ","Civic and Social Organizations","113","912","15864","32",
"Nevada","2003","813311","Human Rights Organizations","12","0","0","32",
"Nevada","2003","813312","Environment, Conservation and Wildlife Organizations","22","192","4693","32",
