"New Mexico","2006","212321","Construction Sand and Gravel Mining","23","0","0","35",
"New Mexico","2006","23815 ","Glass and Glazing Contractors","47","418","12427","35",
"New Mexico","2006","238150","Glass and Glazing Contractors","47","418","12427","35",
"New Mexico","2006","311812","Commercial Bakeries","11","238","8997","35",
"New Mexico","2006","238160","Roofing Contractors","161","1833","43882","35",
"New Mexico","2006","23817 ","Siding Contractors","11","79","2554","35",
"New Mexico","2006","311811","Retail Bakeries","25","0","0","35",
"New Mexico","2006","31611 ","Leather and Hide Tanning and Finishing","3","0","0","35",
"New Mexico","2006","31182 ","Cookie, Cracker, and Pasta Manufacturing","1","0","0","35",
"New Mexico","2006","311821","Cookie and Cracker Manufacturing","1","0","0","35",
"New Mexico","2006","3161  ","Leather and Hide Tanning and Finishing","3","0","0","35",
"New Mexico","2006","316110","Leather and Hide Tanning and Finishing","3","0","0","35",
"New Mexico","2006","325199","All Other Basic Organic Chemical Manufacturing","2","0","0","35",
"New Mexico","2006","3169  ","Other Leather and Allied Product Manufacturing","13","0","0","35",
"New Mexico","2006","32519 ","Other Basic Organic Chemical Manufacturing","3","0","0","35",
"New Mexico","2006","325193","Ethyl Alcohol Manufacturing","1","0","0","35",
"New Mexico","2006","3274  ","Lime and Gypsum Product Manufacturing","8","110","4074","35",
"New Mexico","2006","3253  ","Pesticide, Fertilizer, and Other Agricultural Chemical Manufacturing","5","0","0","35",
"New Mexico","2006","32739 ","Other Concrete Product Manufacturing","12","310","9354","35",
"New Mexico","2006","327390","Other Concrete Product Manufacturing","12","310","9354","35",
"New Mexico","2006","333132","Oil and Gas Field Machinery and Equipment Manufacturing","6","0","0","35",
"New Mexico","2006","32741 ","Lime Manufacturing","1","0","0","35",
"New Mexico","2006","327410","Lime Manufacturing","1","0","0","35",
"New Mexico","2006","333131","Mining Machinery and Equipment Manufacturing","2","0","0","35",
"New Mexico","2006","333415","Air-Conditioning and Warm Air Heating Equipment and Commercial and Industrial Refrigeration Equipment Manufacturing","3","0","0","35",
"New Mexico","2006","3332  ","Industrial Machinery Manufacturing","13","296","11195","35",
"New Mexico","2006","33322 ","Plastics and Rubber Industry Machinery Manufacturing","1","0","0","35",
"New Mexico","2006","333411","Air Purification Equipment Manufacturing","1","0","0","35",
"New Mexico","2006","3341  ","Computer and Peripheral Equipment Manufacturing","4","0","0","35",
"New Mexico","2006","3335  ","Metalworking Machinery Manufacturing","12","169","6470","35",
"New Mexico","2006","333999","All Other Miscellaneous General Purpose Machinery Manufacturing","4","0","0","35",
"New Mexico","2006","334   ","Computer and Electronic Product Manufacturing","77","9036","478565","35",
"New Mexico","2006","3361  ","Motor Vehicle Manufacturing","2","0","0","35",
"New Mexico","2006","33411 ","Computer and Peripheral Equipment Manufacturing","4","0","0","35",
"New Mexico","2006","334512","Automatic Environmental Control Manufacturing for Residential, Commercial, and Appliance Use","1","0","0","35",
"New Mexico","2006","334513","Instruments and Related Products Manufacturing for Measuring, Displaying, and Controlling Industrial Process Variables","5","0","0","35",
"New Mexico","2006","334515","Instrument Manufacturing for Measuring and Testing Electricity and Electrical Signals","5","0","0","35",
"New Mexico","2006","336   ","Transportation Equipment Manufacturing","37","1645","109614","35",
"New Mexico","2006","33612 ","Heavy Duty Truck Manufacturing","2","0","0","35",
"New Mexico","2006","3371  ","Household and Institutional Furniture and Kitchen Cabinet Manufacturing","120","816","19316","35",
"New Mexico","2006","336120","Heavy Duty Truck Manufacturing","2","0","0","35",
"New Mexico","2006","3362  ","Motor Vehicle Body and Trailer Manufacturing","8","0","0","35",
"New Mexico","2006","337   ","Furniture and Related Product Manufacturing","144","1042","26116","35",
"New Mexico","2006","33711 ","Wood Kitchen Cabinet and Countertop Manufacturing","59","456","10574","35",
"New Mexico","2006","337110","Wood Kitchen Cabinet and Countertop Manufacturing","59","456","10574","35",
"New Mexico","2006","33995 ","Sign Manufacturing","35","0","0","35",
"New Mexico","2006","33712 ","Household and Institutional Furniture Manufacturing","61","360","8742","35",
"New Mexico","2006","33994 ","Office Supplies (except Paper) Manufacturing","1","0","0","35",
"New Mexico","2006","339942","Lead Pencil and Art Good Manufacturing","1","0","0","35",
"New Mexico","2006","339950","Sign Manufacturing","35","0","0","35",
"New Mexico","2006","42346 ","Ophthalmic Goods Merchant Wholesalers","5","0","0","35",
"New Mexico","2006","33999 ","All Other Miscellaneous Manufacturing","36","0","0","35",
"New Mexico","2006","42345 ","Medical, Dental, and Hospital Equipment and Supplies Merchant Wholesalers","45","360","15265","35",
"New Mexico","2006","423450","Medical, Dental, and Hospital Equipment and Supplies Merchant Wholesalers","45","360","15265","35",
"New Mexico","2006","42393 ","Recyclable Material Merchant Wholesalers","31","314","9731","35",
"New Mexico","2006","423460","Ophthalmic Goods Merchant Wholesalers","5","0","0","35",
"New Mexico","2006","42392 ","Toy and Hobby Goods and Supplies Merchant Wholesalers","6","0","0","35",
"New Mexico","2006","423920","Toy and Hobby Goods and Supplies Merchant Wholesalers","6","0","0","35",
"New Mexico","2006","423930","Recyclable Material Merchant Wholesalers","31","314","9731","35",
"New Mexico","2006","44211 ","Furniture Stores","184","1887","52472","35",
"New Mexico","2006","424520","Livestock Merchant Wholesalers","9","0","0","35",
"New Mexico","2006","42459 ","Other Farm Product Raw Material Merchant Wholesalers","2","0","0","35",
"New Mexico","2006","424590","Other Farm Product Raw Material Merchant Wholesalers","2","0","0","35",
"New Mexico","2006","4246  ","Chemical and Allied Products Merchant Wholesalers","81","560","27032","35",
"New Mexico","2006","4421  ","Furniture Stores","184","1887","52472","35",
"New Mexico","2006","442110","Furniture Stores","184","1887","52472","35",
"New Mexico","2006","4422  ","Home Furnishings Stores","233","1479","38891","35",
"New Mexico","2006","447190","Other Gasoline Stations","193","2557","64509","35",
"New Mexico","2006","44221 ","Floor Covering Stores","93","614","22322","35",
"New Mexico","2006","447110","Gasoline Stations with Convenience Stores","786","6794","100779","35",
"New Mexico","2006","44719 ","Other Gasoline Stations","193","2557","64509","35",
"New Mexico","2006","448   ","Clothing and Clothing Accessories Stores","958","7336","108911","35",
"New Mexico","2006","4541  ","Electronic Shopping and Mail-Order Houses","79","1734","56182","35",
"New Mexico","2006","4481  ","Clothing Stores","570","5100","65140","35",
"New Mexico","2006","453998","All Other Miscellaneous Store Retailers (except Tobacco Stores)","145","681","17286","35",
"New Mexico","2006","454   ","Nonstore Retailers","327","3358","96596","35",
"New Mexico","2006","45411 ","Electronic Shopping and Mail-Order Houses","79","1734","56182","35",
"New Mexico","2006","48899 ","Other Support Activities for Transportation","10","0","0","35",
"New Mexico","2006","454111","Electronic Shopping","27","0","0","35",
"New Mexico","2006","488510","Freight Transportation Arrangement","35","0","0","35",
"New Mexico","2006","4889  ","Other Support Activities for Transportation","10","0","0","35",
"New Mexico","2006","488991","Packing and Crating","9","0","0","35",
"New Mexico","2006","493190","Other Warehousing and Storage","12","0","0","35",
"New Mexico","2006","488999","All Other Support Activities for Transportation","1","0","0","35",
"New Mexico","2006","493130","Farm Product Warehousing and Storage","4","0","0","35",
"New Mexico","2006","49319 ","Other Warehousing and Storage","12","0","0","35",
"New Mexico","2006","51    ","Information","796","12288","481390","35",
"New Mexico","2006","512131","Motion Picture Theaters (except Drive-Ins)","27","0","0","35",
"New Mexico","2006","511   ","Publishing Industries (except Internet)","177","3006","117625","35",
"New Mexico","2006","512120","Motion Picture and Video Distribution","1","0","0","35",
"New Mexico","2006","51213 ","Motion Picture and Video Exhibition","29","705","5653","35",
"New Mexico","2006","512132","Drive-In Motion Picture Theaters","2","0","0","35",
"New Mexico","2006","5171  ","Wired Telecommunications Carriers","135","1896","103918","35",
"New Mexico","2006","51611 ","Internet Publishing and Broadcasting","10","0","0","35",
"New Mexico","2006","516110","Internet Publishing and Broadcasting","10","0","0","35",
"New Mexico","2006","517   ","Telecommunications","291","5014","220532","35",
"New Mexico","2006","51912 ","Libraries and Archives","9","0","0","35",
"New Mexico","2006","51711 ","Wired Telecommunications Carriers","135","1896","103918","35",
"New Mexico","2006","51911 ","News Syndicates","7","0","0","35",
"New Mexico","2006","519110","News Syndicates","7","0","0","35",
"New Mexico","2006","519120","Libraries and Archives","9","0","0","35",
"New Mexico","2006","51919 ","All Other Information Services","2","0","0","35",
"New Mexico","2006","52314 ","Commodity Contracts Brokerage","6","0","0","35",
"New Mexico","2006","523120","Securities Brokerage","127","794","75879","35",
"New Mexico","2006","52313 ","Commodity Contracts Dealing","2","0","0","35",
"New Mexico","2006","523130","Commodity Contracts Dealing","2","0","0","35",
"New Mexico","2006","53112 ","Lessors of Nonresidential Buildings (except Miniwarehouses)","183","569","15913","35",
"New Mexico","2006","523140","Commodity Contracts Brokerage","6","0","0","35",
"New Mexico","2006","53111 ","Lessors of Residential Buildings and Dwellings","316","1362","32856","35",
"New Mexico","2006","531110","Lessors of Residential Buildings and Dwellings","316","1362","32856","35",
"New Mexico","2006","531120","Lessors of Nonresidential Buildings (except Miniwarehouses)","183","569","15913","35",
"New Mexico","2006","541513","Computer Facilities Management Services","22","1351","56015","35",
"New Mexico","2006","532420","Office Machinery and Equipment Rental and Leasing","5","0","0","35",
"New Mexico","2006","53249 ","Other Commercial and Industrial Machinery and Equipment Rental and Leasing","40","579","27191","35",
"New Mexico","2006","532490","Other Commercial and Industrial Machinery and Equipment Rental and Leasing","40","579","27191","35",
"New Mexico","2006","533   ","Lessors of Nonfinancial Intangible Assets (except Copyrighted Works)","14","0","0","35",
"New Mexico","2006","541512","Computer Systems Design Services","151","1426","73079","35",
"New Mexico","2006","541519","Other Computer Related Services","31","278","6458","35",
"New Mexico","2006","5416  ","Management, Scientific, and Technical Consulting Services","656","4211","189258","35",
"New Mexico","2006","5611  ","Office Administrative Services","133","1334","50383","35",
"New Mexico","2006","551114","Corporate, Subsidiary, and Regional Managing Offices","213","13695","859832","35",
"New Mexico","2006","56    ","Administrative and Support and Waste Management and Remediation Services","1890","44961","1073144","35",
"New Mexico","2006","561   ","Administrative and Support Services","1762","43236","996273","35",
"New Mexico","2006","56199 ","All Other Support Services","109","1046","28026","35",
"New Mexico","2006","561910","Packaging and Labeling Services","4","10","324","35",
"New Mexico","2006","56192 ","Convention and Trade Show Organizers","14","132","2541","35",
"New Mexico","2006","561920","Convention and Trade Show Organizers","14","132","2541","35",
"New Mexico","2006","561990","All Other Support Services","109","1046","28026","35",
"New Mexico","2006","62121 ","Offices of Dentists","607","4348","180373","35",
"New Mexico","2006","621111","Offices of Physicians (except Mental Health Specialists)","969","10538","652919","35",
"New Mexico","2006","621112","Offices of Physicians, Mental Health Specialists","72","324","12257","35",
"New Mexico","2006","6212  ","Offices of Dentists","607","4348","180373","35",
"New Mexico","2006","624120","Services for the Elderly and Persons with Disabilities","166","7265","108664","35",
"New Mexico","2006","62411 ","Child and Youth Services","92","1242","26268","35",
"New Mexico","2006","624110","Child and Youth Services","92","1242","26268","35",
"New Mexico","2006","62412 ","Services for the Elderly and Persons with Disabilities","166","7265","108664","35",
"New Mexico","2006","62419 ","Other Individual and Family Services","292","2647","60060","35",
"New Mexico","2006","722213","Snack and Nonalcoholic Beverage Bars","215","2252","26717","35",
"New Mexico","2006","72221 ","Limited-Service Eating Places","1492","30858","327829","35",
"New Mexico","2006","722211","Limited-Service Restaurants","1223","26847","280764","35",
"New Mexico","2006","722212","Cafeterias","54","1759","20348","35",
"New Mexico","2006","7223  ","Special Food Services","167","2240","39569","35",
"New Mexico","2006","81112 ","Automotive Body, Paint, Interior, and Glass Repair","267","1434","40075","35",
"New Mexico","2006","811112","Automotive Exhaust System Repair","18","33","700","35",
"New Mexico","2006","811113","Automotive Transmission Repair","40","199","5288","35",
"New Mexico","2006","811118","Other Automotive Mechanical and Electrical Repair and Maintenance","65","320","8595","35",
"New Mexico","2006","811121","Automotive Body, Paint, and Interior Repair and Maintenance","203","1134","32245","35",
"New Mexico","2006","238170","Siding Contractors","11","79","2554","35",
"New Mexico","2006","212325","Clay and Ceramic and Refractory Minerals Mining","1","0","0","35",
"New Mexico","2006","21239 ","Other Nonmetallic Mineral Mining and Quarrying","14","761","32842","35",
"New Mexico","2006","212391","Potash, Soda, and Borate Mineral Mining","1","0","0","35",
"New Mexico","2006","212393","Other Chemical and Fertilizer Mineral Mining","3","0","0","35",
"New Mexico","2006","212399","All Other Nonmetallic Mineral Mining","10","0","0","35",
"New Mexico","2006","23819 ","Other Foundation, Structure, and Building Exterior Contractors","46","269","7298","35",
"New Mexico","2006","238190","Other Foundation, Structure, and Building Exterior Contractors","46","269","7298","35",
"New Mexico","2006","3119  ","Other Food Manufacturing","20","573","12373","35",
"New Mexico","2006","2382  ","Building Equipment Contractors","1377","13229","483775","35",
"New Mexico","2006","31183 ","Tortilla Manufacturing","9","341","7319","35",
"New Mexico","2006","311830","Tortilla Manufacturing","9","341","7319","35",
"New Mexico","2006","316991","Luggage Manufacturing","1","0","0","35",
"New Mexico","2006","31191 ","Snack Food Manufacturing","4","0","0","35",
"New Mexico","2006","311911","Roasted Nuts and Peanut Butter Manufacturing","2","0","0","35",
"New Mexico","2006","31699 ","Other Leather and Allied Product Manufacturing","13","0","0","35",
"New Mexico","2006","316992","Women's Handbag and Purse Manufacturing","3","0","0","35",
"New Mexico","2006","325311","Nitrogenous Fertilizer Manufacturing","2","0","0","35",
"New Mexico","2006","316993","Personal Leather Good (except Women's Handbag and Purse) Manufacturing","3","0","0","35",
"New Mexico","2006","316999","All Other Leather Good Manufacturing","6","0","0","35",
"New Mexico","2006","32531 ","Fertilizer Manufacturing","3","0","0","35",
"New Mexico","2006","325314","Fertilizer (Mixing Only) Manufacturing","1","0","0","35",
"New Mexico","2006","327420","Gypsum Product Manufacturing","7","0","0","35",
"New Mexico","2006","32532 ","Pesticide and Other Agricultural Chemical Manufacturing","2","0","0","35",
"New Mexico","2006","325320","Pesticide and Other Agricultural Chemical Manufacturing","2","0","0","35",
"New Mexico","2006","32742 ","Gypsum Product Manufacturing","7","0","0","35",
"New Mexico","2006","3279  ","Other Nonmetallic Mineral Product Manufacturing","20","506","21241","35",
"New Mexico","2006","333511","Industrial Mold Manufacturing","2","0","0","35",
"New Mexico","2006","32799 ","All Other Nonmetallic Mineral Product Manufacturing","20","506","21241","35",
"New Mexico","2006","327991","Cut Stone and Stone Product Manufacturing","12","233","8738","35",
"New Mexico","2006","33351 ","Metalworking Machinery Manufacturing","12","169","6470","35",
"New Mexico","2006","333513","Machine Tool (Metal Forming Types) Manufacturing","3","0","0","35",
"New Mexico","2006","334119","Other Computer Peripheral Equipment Manufacturing","2","0","0","35",
"New Mexico","2006","333514","Special Die and Tool, Die Set, Jig, and Fixture Manufacturing","4","0","0","35",
"New Mexico","2006","333515","Cutting Tool and Machine Tool Accessory Manufacturing","2","0","0","35",
"New Mexico","2006","334111","Electronic Computer Manufacturing","2","0","0","35",
"New Mexico","2006","3342  ","Communications Equipment Manufacturing","4","0","0","35",
"New Mexico","2006","334517","Irradiation Apparatus Manufacturing","1","0","0","35",
"New Mexico","2006","33421 ","Telephone Apparatus Manufacturing","1","0","0","35",
"New Mexico","2006","334210","Telephone Apparatus Manufacturing","1","0","0","35",
"New Mexico","2006","334516","Analytical Laboratory Instrument Manufacturing","2","0","0","35",
"New Mexico","2006","334519","Other Measuring and Controlling Device Manufacturing","6","0","0","35",
"New Mexico","2006","336211","Motor Vehicle Body Manufacturing","3","0","0","35",
"New Mexico","2006","3346  ","Manufacturing and Reproducing Magnetic and Optical Media","3","0","0","35",
"New Mexico","2006","33461 ","Manufacturing and Reproducing Magnetic and Optical Media","3","0","0","35",
"New Mexico","2006","33621 ","Motor Vehicle Body and Trailer Manufacturing","8","0","0","35",
"New Mexico","2006","336212","Truck Trailer Manufacturing","2","0","0","35",
"New Mexico","2006","337124","Metal Household Furniture Manufacturing","4","0","0","35",
"New Mexico","2006","336213","Motor Home Manufacturing","1","0","0","35",
"New Mexico","2006","337121","Upholstered Household Furniture Manufacturing","6","0","0","35",
"New Mexico","2006","337122","Nonupholstered Wood Household Furniture Manufacturing","43","295","7148","35",
"New Mexico","2006","339993","Fastener, Button, Needle, and Pin Manufacturing","4","0","0","35",
"New Mexico","2006","337125","Household Furniture (except Wood and Metal) Manufacturing","1","0","0","35",
"New Mexico","2006","339991","Gasket, Packing, and Sealing Device Manufacturing","2","0","0","35",
"New Mexico","2006","339992","Musical Instrument Manufacturing","3","0","0","35",
"New Mexico","2006","423490","Other Professional Equipment and Supplies Merchant Wholesalers","11","0","0","35",
"New Mexico","2006","339999","All Other Miscellaneous Manufacturing","27","0","0","35",
"New Mexico","2006","42    ","Wholesale Trade","1991","21844","876064","35",
"New Mexico","2006","42349 ","Other Professional Equipment and Supplies Merchant Wholesalers","11","0","0","35",
"New Mexico","2006","4235  ","Metal and Mineral (except Petroleum) Merchant Wholesalers","55","512","21098","35",
"New Mexico","2006","42399 ","Other Miscellaneous Durable Goods Merchant Wholesalers","37","316","14390","35",
"New Mexico","2006","42351 ","Metal Service Centers and Other Metal Merchant Wholesalers","51","505","20607","35",
"New Mexico","2006","42394 ","Jewelry, Watch, Precious Stone, and Precious Metal Merchant Wholesalers","62","735","22936","35",
"New Mexico","2006","423940","Jewelry, Watch, Precious Stone, and Precious Metal Merchant Wholesalers","62","735","22936","35",
"New Mexico","2006","42469 ","Other Chemical and Allied Products Merchant Wholesalers","70","489","24214","35",
"New Mexico","2006","423990","Other Miscellaneous Durable Goods Merchant Wholesalers","37","316","14390","35",
"New Mexico","2006","42461 ","Plastics Materials and Basic Forms and Shapes Merchant Wholesalers","11","71","2818","35",
"New Mexico","2006","424610","Plastics Materials and Basic Forms and Shapes Merchant Wholesalers","11","71","2818","35",
"New Mexico","2006","442291","Window Treatment Stores","13","24","509","35",
"New Mexico","2006","424690","Other Chemical and Allied Products Merchant Wholesalers","70","489","24214","35",
"New Mexico","2006","442210","Floor Covering Stores","93","614","22322","35",
"New Mexico","2006","44229 ","Other Home Furnishings Stores","140","865","16569","35",
"New Mexico","2006","442299","All Other Home Furnishings Stores","127","841","16060","35",
"New Mexico","2006","44812 ","Women's Clothing Stores","177","1157","15563","35",
"New Mexico","2006","443   ","Electronics and Appliance Stores","294","3431","85345","35",
"New Mexico","2006","44811 ","Men's Clothing Stores","38","271","3958","35",
"New Mexico","2006","448110","Men's Clothing Stores","38","271","3958","35",
"New Mexico","2006","448120","Women's Clothing Stores","177","1157","15563","35",
"New Mexico","2006","4542  ","Vending Machine Operators","26","170","3875","35",
"New Mexico","2006","44813 ","Children's and Infants' Clothing Stores","25","207","3272","35",
"New Mexico","2006","454112","Electronic Auctions","7","0","0","35",
"New Mexico","2006","454113","Mail-Order Houses","45","1231","43264","35",
"New Mexico","2006","45421 ","Vending Machine Operators","26","170","3875","35",
"New Mexico","2006","511110","Newspaper Publishers","48","1905","59470","35",
"New Mexico","2006","454210","Vending Machine Operators","26","170","3875","35",
"New Mexico","2006","5111  ","Newspaper, Periodical, Book, and Directory Publishers","145","2703","94497","35",
"New Mexico","2006","51111 ","Newspaper Publishers","48","1905","59470","35",
"New Mexico","2006","51112 ","Periodical Publishers","56","393","16617","35",
"New Mexico","2006","512199","Other Motion Picture and Video Industries","1","0","0","35",
"New Mexico","2006","511120","Periodical Publishers","56","393","16617","35",
"New Mexico","2006","51219 ","Postproduction Services and Other Motion Picture and Video Industries","7","0","0","35",
"New Mexico","2006","512191","Teleproduction and Other Postproduction Services","6","0","0","35",
"New Mexico","2006","5122  ","Sound Recording Industries","14","0","0","35",
"New Mexico","2006","51721 ","Wireless Telecommunications Carriers (except Satellite)","93","0","0","35",
"New Mexico","2006","51222 ","Integrated Record Production/Distribution","2","0","0","35",
"New Mexico","2006","517110","Wired Telecommunications Carriers","135","1896","103918","35",
"New Mexico","2006","5172  ","Wireless Telecommunications Carriers (except Satellite)","93","0","0","35",
"New Mexico","2006","522   ","Credit Intermediation and Related Activities","1472","15839","566844","35",
"New Mexico","2006","517211","Paging","20","59","2386","35",
"New Mexico","2006","519190","All Other Information Services","2","0","0","35",
"New Mexico","2006","52    ","Finance and Insurance","2857","25441","1117696","35",
"New Mexico","2006","5221  ","Depository Credit Intermediation","636","11116","392845","35",
"New Mexico","2006","523910","Miscellaneous Intermediation","30","0","0","35",
"New Mexico","2006","52211 ","Commercial Banking","469","8014","283317","35",
"New Mexico","2006","5239  ","Other Financial Investment Activities","187","923","110993","35",
"New Mexico","2006","52391 ","Miscellaneous Intermediation","30","0","0","35",
"New Mexico","2006","52392 ","Portfolio Management","53","384","70573","35",
"New Mexico","2006","531190","Lessors of Other Real Estate Property","122","388","7237","35",
"New Mexico","2006","53113 ","Lessors of Miniwarehouses and Self-Storage Units","150","0","0","35",
"New Mexico","2006","531130","Lessors of Miniwarehouses and Self-Storage Units","150","0","0","35",
"New Mexico","2006","53119 ","Lessors of Other Real Estate Property","122","388","7237","35",
"New Mexico","2006","541612","Human Resources and Executive Search Consulting Services","42","1187","11292","35",
"New Mexico","2006","5331  ","Lessors of Nonfinancial Intangible Assets (except Copyrighted Works)","14","0","0","35",
"New Mexico","2006","53311 ","Lessors of Nonfinancial Intangible Assets (except Copyrighted Works)","14","0","0","35",
"New Mexico","2006","533110","Lessors of Nonfinancial Intangible Assets (except Copyrighted Works)","14","0","0","35",
"New Mexico","2006","54161 ","Management Consulting Services","436","2784","109029","35",
"New Mexico","2006","541611","Administrative Management and General Management Consulting Services","290","1277","78460","35",
"New Mexico","2006","541613","Marketing Consulting Services","62","0","0","35",
"New Mexico","2006","56121 ","Facilities Support Services","53","3289","158412","35",
"New Mexico","2006","56111 ","Office Administrative Services","133","1334","50383","35",
"New Mexico","2006","561110","Office Administrative Services","133","1334","50383","35",
"New Mexico","2006","5612  ","Facilities Support Services","53","3289","158412","35",
"New Mexico","2006","56211 ","Waste Collection","39","668","26907","35",
"New Mexico","2006","561210","Facilities Support Services","53","3289","158412","35",
"New Mexico","2006","562   ","Waste Management and Remediation Services","128","1725","76871","35",
"New Mexico","2006","5621  ","Waste Collection","39","668","26907","35",
"New Mexico","2006","562111","Solid Waste Collection","27","0","0","35",
"New Mexico","2006","621310","Offices of Chiropractors","170","587","15144","35",
"New Mexico","2006","621210","Offices of Dentists","607","4348","180373","35",
"New Mexico","2006","6213  ","Offices of Other Health Practitioners","851","3749","108933","35",
"New Mexico","2006","62131 ","Offices of Chiropractors","170","587","15144","35",
"New Mexico","2006","62132 ","Offices of Optometrists","125","767","21556","35",
