"GEO_TTL","YEAR","NAICS2007","NAICS2007_TTL","ESTAB","EMP","PAYANN","state",
"Rhode Island","2010","00    ","Total for all sectors","28521","399000","16831981","44",
"Rhode Island","2010","11    ","Agriculture, forestry, fishing and hunting","44","98","3658","44",
"Rhode Island","2010","113   ","Forestry and logging","2","0","0","44",
"Rhode Island","2010","1133  ","Logging","2","0","0","44",
"Rhode Island","2010","11331 ","Logging","2","0","0","44",
"Rhode Island","2010","113310","Logging","2","0","0","44",
"Rhode Island","2010","114   ","Fishing, hunting and trapping","29","0","2489","44",
"Rhode Island","2010","1141  ","Fishing","29","0","2489","44",
"Rhode Island","2010","11411 ","Fishing","29","0","2489","44",
"Rhode Island","2010","114111","Finfish fishing","11","6","777","44",
"Rhode Island","2010","114112","Shellfish fishing","18","0","1712","44",
"Rhode Island","2010","115   ","Support activities for agriculture and forestry","13","0","0","44",
"Rhode Island","2010","1151  ","Support activities for crop production","2","0","0","44",
"Rhode Island","2010","11511 ","Support activities for crop production","2","0","0","44",
"Rhode Island","2010","115112","Soil preparation, planting, and cultivating","2","0","0","44",
"Rhode Island","2010","1152  ","Support activities for animal production","10","0","0","44",
"Rhode Island","2010","11521 ","Support activities for animal production","10","0","0","44",
"Rhode Island","2010","115210","Support activities for animal production","10","0","0","44",
"Rhode Island","2010","1153  ","Support activities for forestry","1","0","0","44",
"Rhode Island","2010","11531 ","Support activities for forestry","1","0","0","44",
"Rhode Island","2010","115310","Support activities for forestry","1","0","0","44",
"Rhode Island","2010","21    ","Mining, quarrying, and oil and gas extraction","22","144","8273","44",
"Rhode Island","2010","211   ","Oil and gas extraction","2","0","0","44",
"Rhode Island","2010","2111  ","Oil and gas extraction","2","0","0","44",
"Rhode Island","2010","21111 ","Oil and gas extraction","2","0","0","44",
"Rhode Island","2010","211111","Crude petroleum and natural gas extraction","2","0","0","44",
"Rhode Island","2010","212   ","Mining (except oil and gas)","18","139","7888","44",
"Rhode Island","2010","2123  ","Nonmetallic mineral mining and quarrying","18","139","7888","44",
"Rhode Island","2010","21231 ","Stone mining and quarrying","8","0","0","44",
"Rhode Island","2010","212311","Dimension stone mining and quarrying","1","0","0","44",
"Rhode Island","2010","212313","Crushed and broken granite mining and quarrying","4","0","815","44",
"Rhode Island","2010","212319","Other crushed and broken stone mining and quarrying","3","0","0","44",
"Rhode Island","2010","21232 ","Sand, gravel, clay, and ceramic and refractory minerals mining and quarrying","10","0","3787","44",
"Rhode Island","2010","212321","Construction sand and gravel mining","9","0","2391","44",
"Rhode Island","2010","212322","Industrial sand mining","1","0","0","44",
"Rhode Island","2010","213   ","Support activities for mining","2","0","0","44",
"Rhode Island","2010","2131  ","Support activities for mining","2","0","0","44",
"Rhode Island","2010","21311 ","Support activities for mining","2","0","0","44",
"Rhode Island","2010","213112","Support activities for oil and gas operations","1","0","0","44",
"Rhode Island","2010","213114","Support activities for metal mining","1","0","0","44",
"Rhode Island","2010","22    ","Utilities","31","1136","98596","44",
"Rhode Island","2010","221   ","Utilities","31","1136","98596","44",
"Rhode Island","2010","2211  ","Electric power generation, transmission and distribution","18","0","0","44",
"Rhode Island","2010","22111 ","Electric power generation","6","0","0","44",
"Rhode Island","2010","221111","Hydroelectric power generation","1","0","0","44",
"Rhode Island","2010","221112","Fossil fuel electric power generation","2","0","0","44",
"Rhode Island","2010","221119","Other electric power generation","3","0","1218","44",
"Rhode Island","2010","22112 ","Electric power transmission, control, and distribution","12","0","0","44",
"Rhode Island","2010","221122","Electric power distribution","12","0","0","44",
"Rhode Island","2010","2212  ","Natural gas distribution","4","0","0","44",
"Rhode Island","2010","22121 ","Natural gas distribution","4","0","0","44",
"Rhode Island","2010","221210","Natural gas distribution","4","0","0","44",
"Rhode Island","2010","2213  ","Water, sewage and other systems","9","0","0","44",
"Rhode Island","2010","22131 ","Water supply and irrigation systems","4","0","0","44",
"Rhode Island","2010","221310","Water supply and irrigation systems","4","0","0","44",
"Rhode Island","2010","22132 ","Sewage treatment facilities","5","0","0","44",
"Rhode Island","2010","221320","Sewage treatment facilities","5","0","0","44",
"Rhode Island","2010","23    ","Construction","3091","16079","862498","44",
"Rhode Island","2010","236   ","Construction of buildings","966","4437","241749","44",
"Rhode Island","2010","2361  ","Residential building construction","828","2722","120043","44",
"Rhode Island","2010","23611 ","Residential building construction","828","2722","120043","44",
"Rhode Island","2010","236115","New single-family housing construction (except operative builders)","198","673","26196","44",
"Rhode Island","2010","236116","New multifamily housing construction (except operative builders)","12","322","28212","44",
"Rhode Island","2010","236117","New housing operative builders","73","238","8314","44",
"Rhode Island","2010","236118","Residential remodelers","545","1489","57321","44",
"Rhode Island","2010","2362  ","Nonresidential building construction","138","1715","121706","44",
"Rhode Island","2010","23621 ","Industrial building construction","13","52","2283","44",
"Rhode Island","2010","236210","Industrial building construction","13","52","2283","44",
"Rhode Island","2010","23622 ","Commercial and institutional building construction","125","1663","119423","44",
"Rhode Island","2010","236220","Commercial and institutional building construction","125","1663","119423","44",
"Rhode Island","2010","237   ","Heavy and civil engineering construction","102","1102","88725","44",
"Rhode Island","2010","2371  ","Utility system construction","46","431","33091","44",
"Rhode Island","2010","23711 ","Water and sewer line and related structures construction","35","243","16237","44",
"Rhode Island","2010","237110","Water and sewer line and related structures construction","35","243","16237","44",
"Rhode Island","2010","23712 ","Oil and gas pipeline and related structures construction","5","103","11670","44",
"Rhode Island","2010","237120","Oil and gas pipeline and related structures construction","5","103","11670","44",
"Rhode Island","2010","23713 ","Power and communication line and related structures construction","6","85","5184","44",
"Rhode Island","2010","237130","Power and communication line and related structures construction","6","85","5184","44",
"Rhode Island","2010","2372  ","Land subdivision","15","159","6233","44",
"Rhode Island","2010","23721 ","Land subdivision","15","159","6233","44",
"Rhode Island","2010","237210","Land subdivision","15","159","6233","44",
"Rhode Island","2010","2373  ","Highway, street, and bridge construction","30","444","45377","44",
"Rhode Island","2010","23731 ","Highway, street, and bridge construction","30","444","45377","44",
"Rhode Island","2010","237310","Highway, street, and bridge construction","30","444","45377","44",
"Rhode Island","2010","2379  ","Other heavy and civil engineering construction","11","68","4024","44",
"Rhode Island","2010","23799 ","Other heavy and civil engineering construction","11","68","4024","44",
"Rhode Island","2010","237990","Other heavy and civil engineering construction","11","68","4024","44",
"Rhode Island","2010","238   ","Specialty trade contractors","2023","10540","532024","44",
"Rhode Island","2010","2381  ","Foundation, structure, and building exterior contractors","382","2194","114629","44",
"Rhode Island","2010","23811 ","Poured concrete foundation and structure contractors","65","367","22797","44",
"Rhode Island","2010","238110","Poured concrete foundation and structure contractors","65","367","22797","44",
"Rhode Island","2010","23812 ","Structural steel and precast concrete contractors","13","0","0","44",
"Rhode Island","2010","238120","Structural steel and precast concrete contractors","13","0","0","44",
"Rhode Island","2010","23813 ","Framing contractors","43","131","4319","44",
"Rhode Island","2010","238130","Framing contractors","43","131","4319","44",
"Rhode Island","2010","23814 ","Masonry contractors","108","467","23201","44",
"Rhode Island","2010","238140","Masonry contractors","108","467","23201","44",
"Rhode Island","2010","23815 ","Glass and glazing contractors","28","275","12141","44",
"Rhode Island","2010","238150","Glass and glazing contractors","28","275","12141","44",
"Rhode Island","2010","23816 ","Roofing contractors","64","366","17333","44",
"Rhode Island","2010","238160","Roofing contractors","64","366","17333","44",
"Rhode Island","2010","23817 ","Siding contractors","49","154","6591","44",
"Rhode Island","2010","238170","Siding contractors","49","154","6591","44",
"Rhode Island","2010","23819 ","Other foundation, structure, and building exterior contractors","12","0","1403","44",
"Rhode Island","2010","238190","Other foundation, structure, and building exterior contractors","12","0","1403","44",
"Rhode Island","2010","2382  ","Building equipment contractors","733","4282","234821","44",
"Rhode Island","2010","23821 ","Electrical contractors and other wiring installation contractors","310","1545","79033","44",
"Rhode Island","2010","238210","Electrical contractors and other wiring installation contractors","310","1545","79033","44",
"Rhode Island","2010","23822 ","Plumbing, heating, and air-conditioning contractors","408","2617","148642","44",
"Rhode Island","2010","238220","Plumbing, heating, and air-conditioning contractors","408","2617","148642","44",
"Rhode Island","2010","23829 ","Other building equipment contractors","15","120","7146","44",
"Rhode Island","2010","238290","Other building equipment contractors","15","120","7146","44",
"Rhode Island","2010","2383  ","Building finishing contractors","580","2779","118350","44",
"Rhode Island","2010","23831 ","Drywall and insulation contractors","103","1312","61673","44",
"Rhode Island","2010","238310","Drywall and insulation contractors","103","1312","61673","44",
"Rhode Island","2010","23832 ","Painting and wall covering contractors","205","521","21431","44",
"Rhode Island","2010","238320","Painting and wall covering contractors","205","521","21431","44",
"Rhode Island","2010","23833 ","Flooring contractors","68","169","5491","44",
"Rhode Island","2010","238330","Flooring contractors","68","169","5491","44",
"Rhode Island","2010","23834 ","Tile and terrazzo contractors","25","0","2340","44",
"Rhode Island","2010","238340","Tile and terrazzo contractors","25","0","2340","44",
"Rhode Island","2010","23835 ","Finish carpentry contractors","162","636","24281","44",
"Rhode Island","2010","238350","Finish carpentry contractors","162","636","24281","44",
"Rhode Island","2010","23839 ","Other building finishing contractors","17","64","3134","44",
"Rhode Island","2010","238390","Other building finishing contractors","17","64","3134","44",
"Rhode Island","2010","2389  ","Other specialty trade contractors","328","1285","64224","44",
"Rhode Island","2010","23891 ","Site preparation contractors","191","990","43052","44",
"Rhode Island","2010","238910","Site preparation contractors","191","990","43052","44",
"Rhode Island","2010","23899 ","All other specialty trade contractors","137","295","21172","44",
"Rhode Island","2010","238990","All other specialty trade contractors","137","295","21172","44",
"Rhode Island","2010","31-33 ","Manufacturing","1554","40628","2025206","44",
"Rhode Island","2010","311   ","Food manufacturing","136","2262","70576","44",
"Rhode Island","2010","3111  ","Animal food manufacturing","2","0","0","44",
"Rhode Island","2010","31111 ","Animal food manufacturing","2","0","0","44",
"Rhode Island","2010","311111","Dog and cat food manufacturing","2","0","0","44",
"Rhode Island","2010","3112  ","Grain and oilseed milling","1","0","0","44",
"Rhode Island","2010","31121 ","Flour milling and malt manufacturing","1","0","0","44",
"Rhode Island","2010","311211","Flour milling","1","0","0","44",
"Rhode Island","2010","3113  ","Sugar and confectionery product manufacturing","7","63","626","44",
"Rhode Island","2010","31132 ","Chocolate and confectionery manufacturing from cacao beans","1","0","0","44",
"Rhode Island","2010","311320","Chocolate and confectionery manufacturing from cacao beans","1","0","0","44",
"Rhode Island","2010","31133 ","Confectionery manufacturing from purchased chocolate","6","63","622","44",
"Rhode Island","2010","311330","Confectionery manufacturing from purchased chocolate","6","63","622","44",
"Rhode Island","2010","3114  ","Fruit and vegetable preserving and specialty food manufacturing","8","177","4220","44",
"Rhode Island","2010","31141 ","Frozen food manufacturing","3","26","991","44",
"Rhode Island","2010","311411","Frozen fruit, juice, and vegetable manufacturing","3","26","991","44",
"Rhode Island","2010","31142 ","Fruit and vegetable canning, pickling, and drying","5","0","3229","44",
"Rhode Island","2010","311421","Fruit and vegetable canning","3","0","0","44",
"Rhode Island","2010","311422","Specialty canning","1","0","0","44",
"Rhode Island","2010","311423","Dried and dehydrated food manufacturing","1","0","0","44",
"Rhode Island","2010","3115  ","Dairy product manufacturing","8","144","4881","44",
"Rhode Island","2010","31151 ","Dairy product (except frozen) manufacturing","6","125","4271","44",
"Rhode Island","2010","311511","Fluid milk manufacturing","4","0","0","44",
"Rhode Island","2010","311513","Cheese manufacturing","2","0","0","44",
"Rhode Island","2010","31152 ","Ice cream and frozen dessert manufacturing","2","0","0","44",
"Rhode Island","2010","311520","Ice cream and frozen dessert manufacturing","2","0","0","44",
"Rhode Island","2010","3116  ","Animal slaughtering and processing","14","281","12035","44",
"Rhode Island","2010","31161 ","Animal slaughtering and processing","14","281","12035","44",
"Rhode Island","2010","311611","Animal (except poultry) slaughtering","2","0","0","44",
"Rhode Island","2010","311612","Meat processed from carcasses","12","267","11732","44",
"Rhode Island","2010","3117  ","Seafood product preparation and packaging","5","193","6096","44",
"Rhode Island","2010","31171 ","Seafood product preparation and packaging","5","193","6096","44",
"Rhode Island","2010","311711","Seafood canning","1","0","0","44",
"Rhode Island","2010","311712","Fresh and frozen seafood processing","4","193","6054","44",
"Rhode Island","2010","3118  ","Bakeries and tortilla manufacturing","81","1239","36806","44",
"Rhode Island","2010","31181 ","Bread and bakery product manufacturing","74","1197","35801","44",
"Rhode Island","2010","311811","Retail bakeries","55","597","10735","44",
"Rhode Island","2010","311812","Commercial bakeries","19","600","25066","44",
"Rhode Island","2010","31182 ","Cookie, cracker, and pasta manufacturing","7","0","1005","44",
"Rhode Island","2010","311821","Cookie and cracker manufacturing","4","0","697","44",
"Rhode Island","2010","311822","Flour mixes and dough manufacturing from purchased flour","3","12","308","44",
"Rhode Island","2010","3119  ","Other food manufacturing","10","157","5751","44",
"Rhode Island","2010","31191 ","Snack food manufacturing","2","0","0","44",
"Rhode Island","2010","311911","Roasted nuts and peanut butter manufacturing","1","0","0","44",
"Rhode Island","2010","311919","Other snack food manufacturing","1","0","0","44",
"Rhode Island","2010","31192 ","Coffee and tea manufacturing","1","0","0","44",
"Rhode Island","2010","311920","Coffee and tea manufacturing","1","0","0","44",
"Rhode Island","2010","31193 ","Flavoring syrup and concentrate manufacturing","2","0","0","44",
"Rhode Island","2010","311930","Flavoring syrup and concentrate manufacturing","2","0","0","44",
"Rhode Island","2010","31199 ","All other food manufacturing","5","126","4224","44",
"Rhode Island","2010","311991","Perishable prepared food manufacturing","4","126","4160","44",
"Rhode Island","2010","311999","All other miscellaneous food manufacturing","1","0","0","44",
"Rhode Island","2010","312   ","Beverage and tobacco product manufacturing","13","0","0","44",
"Rhode Island","2010","3121  ","Beverage manufacturing","13","0","0","44",
"Rhode Island","2010","31211 ","Soft drink and ice manufacturing","7","0","0","44",
"Rhode Island","2010","312111","Soft drink manufacturing","3","0","0","44",
"Rhode Island","2010","312112","Bottled water manufacturing","1","0","0","44",
"Rhode Island","2010","312113","Ice manufacturing","3","0","0","44",
"Rhode Island","2010","31212 ","Breweries","2","0","0","44",
"Rhode Island","2010","312120","Breweries","2","0","0","44",
"Rhode Island","2010","31213 ","Wineries","4","0","0","44",
"Rhode Island","2010","312130","Wineries","4","0","0","44",
"Rhode Island","2010","313   ","Textile mills","50","1654","69740","44",
"Rhode Island","2010","3131  ","Fiber, yarn, and thread mills","7","0","4983","44",
"Rhode Island","2010","31311 ","Fiber, yarn, and thread mills","7","0","4983","44",
"Rhode Island","2010","313111","Yarn spinning mills","2","0","0","44",
"Rhode Island","2010","313112","Yarn texturizing, throwing, and twisting mills","4","97","3781","44",
"Rhode Island","2010","313113","Thread mills","1","0","0","44",
"Rhode Island","2010","3132  ","Fabric mills","28","971","37219","44",
"Rhode Island","2010","31321 ","Broadwoven fabric mills","2","0","0","44",
"Rhode Island","2010","313210","Broadwoven fabric mills","2","0","0","44",
"Rhode Island","2010","31322 ","Narrow fabric mills and schiffli machine embroidery","15","499","19379","44",
"Rhode Island","2010","313221","Narrow fabric mills","12","492","19282","44",
"Rhode Island","2010","313222","Schiffli machine embroidery","3","0","0","44",
"Rhode Island","2010","31323 ","Nonwoven fabric mills","3","0","0","44",
"Rhode Island","2010","313230","Nonwoven fabric mills","3","0","0","44",
"Rhode Island","2010","31324 ","Knit fabric mills","8","311","11908","44",
"Rhode Island","2010","313241","Weft knit fabric mills","1","0","0","44",
"Rhode Island","2010","313249","Other knit fabric and lace mills","7","279","10916","44",
"Rhode Island","2010","3133  ","Textile and fabric finishing and fabric coating mills","15","547","27538","44",
"Rhode Island","2010","31331 ","Textile and fabric finishing mills","9","241","11211","44",
"Rhode Island","2010","313311","Broadwoven fabric finishing mills","6","178","8190","44",
"Rhode Island","2010","313312","Textile and fabric finishing (except broadwoven fabric) mills","3","0","0","44",
"Rhode Island","2010","31332 ","Fabric coating mills","6","306","16327","44",
"Rhode Island","2010","313320","Fabric coating mills","6","306","16327","44",
"Rhode Island","2010","314   ","Textile product mills","45","392","14209","44",
"Rhode Island","2010","3141  ","Textile furnishings mills","13","170","5740","44",
"Rhode Island","2010","31411 ","Carpet and rug mills","6","103","3162","44",
"Rhode Island","2010","314110","Carpet and rug mills","6","103","3162","44",
"Rhode Island","2010","31412 ","Curtain and linen mills","7","0","2578","44",
"Rhode Island","2010","314121","Curtain and drapery mills","5","38","1146","44",
"Rhode Island","2010","314129","Other household textile product mills","2","0","0","44",
"Rhode Island","2010","3149  ","Other textile product mills","32","222","8469","44",
"Rhode Island","2010","31491 ","Textile bag and canvas mills","16","80","3112","44",
"Rhode Island","2010","314911","Textile bag mills","2","0","0","44",
"Rhode Island","2010","314912","Canvas and related product mills","14","54","2130","44",
"Rhode Island","2010","31499 ","All other textile product mills","16","0","5357","44",
"Rhode Island","2010","314991","Rope, cordage, and twine mills","3","0","0","44",
"Rhode Island","2010","314999","All other miscellaneous textile product mills","13","0","1653","44",
"Rhode Island","2010","315   ","Apparel manufacturing","12","21","430","44",
"Rhode Island","2010","3151  ","Apparel knitting mills","1","0","0","44",
"Rhode Island","2010","31519 ","Other apparel knitting mills","1","0","0","44",
"Rhode Island","2010","315191","Outerwear knitting mills","1","0","0","44",
"Rhode Island","2010","3152  ","Cut and sew apparel manufacturing","7","12","276","44",
"Rhode Island","2010","31521 ","Cut and sew apparel contractors","4","0","113","44",
"Rhode Island","2010","315211","Men's and boys' cut and sew apparel contractors","2","0","0","44",
"Rhode Island","2010","315212","Women's, girls', and infants' cut and sew apparel contractors","2","0","0","44",
"Rhode Island","2010","31522 ","Men's and boys' cut and sew apparel manufacturing","1","0","0","44",
"Rhode Island","2010","315222","Men's and boys' cut and sew suit, coat, and overcoat manufacturing","1","0","0","44",
"Rhode Island","2010","31529 ","Other cut and sew apparel manufacturing","2","0","0","44",
"Rhode Island","2010","315299","All other cut and sew apparel manufacturing","2","0","0","44",
"Rhode Island","2010","3159  ","Apparel accessories and other apparel manufacturing","4","0","0","44",
"Rhode Island","2010","31599 ","Apparel accessories and other apparel manufacturing","4","0","0","44",
"Rhode Island","2010","315999","Other apparel accessories and other apparel manufacturing","4","0","0","44",
"Rhode Island","2010","316   ","Leather and allied product manufacturing","8","0","2066","44",
"Rhode Island","2010","3169  ","Other leather and allied product manufacturing","8","0","2066","44",
"Rhode Island","2010","31699 ","Other leather and allied product manufacturing","8","0","2066","44",
"Rhode Island","2010","316991","Luggage manufacturing","1","0","0","44",
"Rhode Island","2010","316992","Women's handbag and purse manufacturing","1","0","0","44",
"Rhode Island","2010","316993","Personal leather good (except women's handbag and purse) manufacturing","3","0","0","44",
"Rhode Island","2010","316999","All other leather good and allied product manufacturing","3","0","0","44",
"Rhode Island","2010","321   ","Wood product manufacturing","31","424","15873","44",
"Rhode Island","2010","3211  ","Sawmills and wood preservation","4","81","3802","44",
"Rhode Island","2010","32111 ","Sawmills and wood preservation","4","81","3802","44",
"Rhode Island","2010","321113","Sawmills","2","0","0","44",
"Rhode Island","2010","321114","Wood preservation","2","0","0","44",
"Rhode Island","2010","3212  ","Veneer, plywood, and engineered wood product manufacturing","2","0","0","44",
"Rhode Island","2010","32121 ","Veneer, plywood, and engineered wood product manufacturing","2","0","0","44",
"Rhode Island","2010","321214","Truss manufacturing","1","0","0","44",
"Rhode Island","2010","321219","Reconstituted wood product manufacturing","1","0","0","44",
"Rhode Island","2010","3219  ","Other wood product manufacturing","25","329","11601","44",
"Rhode Island","2010","32191 ","Millwork","11","112","4455","44",
"Rhode Island","2010","321911","Wood window and door manufacturing","5","76","2665","44",
"Rhode Island","2010","321912","Cut stock, resawing lumber, and planing","1","0","0","44",
"Rhode Island","2010","321918","Other millwork (including flooring)","5","0","1676","44",
"Rhode Island","2010","32192 ","Wood container and pallet manufacturing","6","151","4658","44",
"Rhode Island","2010","321920","Wood container and pallet manufacturing","6","151","4658","44",
"Rhode Island","2010","32199 ","All other wood product manufacturing","8","0","2488","44",
"Rhode Island","2010","321999","All other miscellaneous wood product manufacturing","8","0","2488","44",
"Rhode Island","2010","322   ","Paper manufacturing","24","915","43146","44",
"Rhode Island","2010","3222  ","Converted paper product manufacturing","24","915","43146","44",
"Rhode Island","2010","32221 ","Paperboard container manufacturing","14","613","28112","44",
"Rhode Island","2010","322211","Corrugated and solid fiber box manufacturing","4","211","13948","44",
"Rhode Island","2010","322212","Folding paperboard box manufacturing","4","0","0","44",
"Rhode Island","2010","322213","Setup paperboard box manufacturing","4","168","4804","44",
"Rhode Island","2010","322214","Fiber can, tube, drum, and similar products manufacturing","2","0","0","44",
"Rhode Island","2010","32222 ","Paper bag and coated and treated paper manufacturing","6","271","13986","44",
"Rhode Island","2010","322221","Coated and laminated packaging paper manufacturing","1","0","0","44",
"Rhode Island","2010","322222","Coated and laminated paper manufacturing","4","249","13057","44",
"Rhode Island","2010","322226","Surface-coated paperboard manufacturing","1","0","0","44",
"Rhode Island","2010","32229 ","Other converted paper product manufacturing","4","31","1048","44",
"Rhode Island","2010","322291","Sanitary paper product manufacturing","1","0","0","44",
"Rhode Island","2010","322299","All other converted paper product manufacturing","3","25","603","44",
"Rhode Island","2010","323   ","Printing and related support activities","128","1900","84672","44",
"Rhode Island","2010","3231  ","Printing and related support activities","128","1900","84672","44",
"Rhode Island","2010","32311 ","Printing","120","1814","78527","44",
"Rhode Island","2010","323110","Commercial lithographic printing","42","585","21402","44",
"Rhode Island","2010","323111","Commercial gravure printing","3","0","0","44",
"Rhode Island","2010","323112","Commercial flexographic printing","7","131","10954","44",
