"Wyoming","2011","3256  ","Soap, cleaning compound, and toilet preparation manufacturing","3","0","0","56",
"Wyoming","2011","32561 ","Soap and cleaning compound manufacturing","3","0","0","56",
"Wyoming","2011","325611","Soap and other detergent manufacturing","1","0","0","56",
"Wyoming","2011","3259  ","Other chemical product and preparation manufacturing","11","0","0","56",
"Wyoming","2011","32592 ","Explosives manufacturing","3","0","0","56",
"Wyoming","2011","325920","Explosives manufacturing","3","0","0","56",
"Wyoming","2011","32599 ","All other chemical product and preparation manufacturing","8","0","3153","56",
"Wyoming","2011","325992","Photographic film, paper, plate, and chemical manufacturing","2","0","0","56",
"Wyoming","2011","325998","All other miscellaneous chemical product and preparation manufacturing","6","0","2928","56",
"Wyoming","2011","326   ","Plastics and rubber products manufacturing","12","0","15355","56",
"Wyoming","2011","3261  ","Plastics product manufacturing","10","0","15123","56",
"Wyoming","2011","32611 ","Plastics packaging materials and unlaminated film and sheet manufacturing","1","0","0","56",
"Wyoming","2011","326113","Unlaminated plastics film and sheet (except packaging) manufacturing","1","0","0","56",
"Wyoming","2011","326122","Plastics pipe and pipe fitting manufacturing","3","99","3084","56",
"Wyoming","2011","3271  ","Clay product and refractory manufacturing","1","0","0","56",
"Wyoming","2011","3273  ","Cement and concrete product manufacturing","49","731","37781","56",
"Wyoming","2011","327320","Ready-mix concrete manufacturing","40","543","27105","56",
"Wyoming","2011","33711 ","Wood kitchen cabinet and countertop manufacturing","19","124","3400","56",
"Wyoming","2011","32614 ","Polystyrene foam product manufacturing","1","0","0","56",
"Wyoming","2011","326140","Polystyrene foam product manufacturing","1","0","0","56",
"Wyoming","2011","32619 ","Other plastics product manufacturing","4","0","0","56",
"Wyoming","2011","326199","All other plastics product manufacturing","4","0","0","56",
"Wyoming","2011","3262  ","Rubber product manufacturing","2","0","0","56",
"Wyoming","2011","32621 ","Tire manufacturing","1","0","0","56",
"Wyoming","2011","32742 ","Gypsum product manufacturing","3","0","0","56",
"Wyoming","2011","326212","Tire retreading","1","0","0","56",
"Wyoming","2011","32629 ","Other rubber product manufacturing","1","0","0","56",
"Wyoming","2011","327420","Gypsum product manufacturing","3","0","0","56",
"Wyoming","2011","326299","All other rubber product manufacturing","1","0","0","56",
"Wyoming","2011","327   ","Nonmetallic mineral product manufacturing","62","888","45784","56",
"Wyoming","2011","32711 ","Pottery, ceramics, and plumbing fixture manufacturing","1","0","0","56",
"Wyoming","2011","327991","Cut stone and stone product manufacturing","6","14","647","56",
"Wyoming","2011","327112","Vitreous china, fine earthenware, and other pottery product manufacturing","1","0","0","56",
"Wyoming","2011","32731 ","Cement manufacturing","1","0","0","56",
"Wyoming","2011","327310","Cement manufacturing","1","0","0","56",
"Wyoming","2011","32732 ","Ready-mix concrete manufacturing","40","543","27105","56",
"Wyoming","2011","32733 ","Concrete pipe, brick, and block manufacturing","5","31","1247","56",
"Wyoming","2011","3312  ","Steel product manufacturing from purchased steel","2","0","0","56",
"Wyoming","2011","327331","Concrete block and brick manufacturing","3","0","0","56",
"Wyoming","2011","327332","Concrete pipe manufacturing","2","0","0","56",
"Wyoming","2011","32739 ","Other concrete product manufacturing","3","0","175","56",
"Wyoming","2011","327390","Other concrete product manufacturing","3","0","175","56",
"Wyoming","2011","3274  ","Lime and gypsum product manufacturing","3","0","0","56",
"Wyoming","2011","3279  ","Other nonmetallic mineral product manufacturing","9","26","1289","56",
"Wyoming","2011","32799 ","All other nonmetallic mineral product manufacturing","9","26","1289","56",
"Wyoming","2011","327992","Ground or treated mineral and earth manufacturing","3","0","0","56",
"Wyoming","2011","331   ","Primary metal manufacturing","9","0","4994","56",
"Wyoming","2011","3311  ","Iron and steel mills and ferroalloy manufacturing","2","0","0","56",
"Wyoming","2011","33111 ","Iron and steel mills and ferroalloy manufacturing","2","0","0","56",
"Wyoming","2011","331111","Iron and steel mills","2","0","0","56",
"Wyoming","2011","33122 ","Rolling and drawing of purchased steel","2","0","0","56",
"Wyoming","2011","331222","Steel wire drawing","2","0","0","56",
"Wyoming","2011","3314  ","Nonferrous metal (except aluminum) production and processing","1","0","0","56",
"Wyoming","2011","33149 ","Nonferrous metal (except copper and aluminum) rolling, drawing, extruding, and alloying","1","0","0","56",
"Wyoming","2011","331491","Nonferrous metal, except Cu and Al, shaping","1","0","0","56",
"Wyoming","2011","3315  ","Foundries","4","0","0","56",
"Wyoming","2011","33241 ","Power boiler and heat exchanger manufacturing","1","0","0","56",
"Wyoming","2011","33151 ","Ferrous metal foundries","1","0","0","56",
"Wyoming","2011","331511","Iron foundries","1","0","0","56",
"Wyoming","2011","33152 ","Nonferrous metal foundries","3","0","0","56",
"Wyoming","2011","331525","Copper foundries (except die-casting)","3","0","0","56",
"Wyoming","2011","332   ","Fabricated metal product manufacturing","100","1201","64720","56",
"Wyoming","2011","3321  ","Forging and stamping","1","0","0","56",
"Wyoming","2011","3326  ","Spring and wire product manufacturing","4","0","0","56",
"Wyoming","2011","33211 ","Forging and stamping","1","0","0","56",
"Wyoming","2011","332115","Crown and closure manufacturing","1","0","0","56",
"Wyoming","2011","3323  ","Architectural and structural metals manufacturing","21","189","9011","56",
"Wyoming","2011","33231 ","Plate work and fabricated structural product manufacturing","11","146","6782","56",
"Wyoming","2011","332312","Fabricated structural metal manufacturing","8","0","4978","56",
"Wyoming","2011","332313","Plate work manufacturing","3","0","0","56",
"Wyoming","2011","33232 ","Ornamental and architectural metal products manufacturing","10","0","2229","56",
"Wyoming","2011","332322","Sheet metal work manufacturing","3","0","0","56",
"Wyoming","2011","332323","Ornamental and architectural metal work manufacturing","7","0","835","56",
"Wyoming","2011","33281 ","Coating, engraving, heat treating, and allied activities","4","0","0","56",
"Wyoming","2011","3324  ","Boiler, tank, and shipping container manufacturing","3","166","8931","56",
"Wyoming","2011","332410","Power boiler and heat exchanger manufacturing","1","0","0","56",
"Wyoming","2011","33242 ","Metal tank (heavy gauge) manufacturing","1","0","0","56",
"Wyoming","2011","332420","Metal tank (heavy gauge) manufacturing","1","0","0","56",
"Wyoming","2011","33243 ","Metal can, box, and other metal container (light gauge) manufacturing","1","0","0","56",
"Wyoming","2011","332431","Metal can manufacturing","1","0","0","56",
"Wyoming","2011","3325  ","Hardware manufacturing","2","0","0","56",
"Wyoming","2011","33251 ","Hardware manufacturing","2","0","0","56",
"Wyoming","2011","332510","Hardware manufacturing","2","0","0","56",
"Wyoming","2011","33313 ","Mining and oil and gas field machinery manufacturing","14","432","26217","56",
"Wyoming","2011","33261 ","Spring and wire product manufacturing","4","0","0","56",
"Wyoming","2011","332618","Other fabricated wire product manufacturing","4","0","0","56",
"Wyoming","2011","3335  ","Metalworking machinery manufacturing","4","28","1256","56",
"Wyoming","2011","3327  ","Machine shops; turned product; and screw, nut, and bolt manufacturing","50","535","31332","56",
"Wyoming","2011","33271 ","Machine shops","50","535","31332","56",
"Wyoming","2011","332710","Machine shops","50","535","31332","56",
"Wyoming","2011","3328  ","Coating, engraving, heat treating, and allied activities","4","0","0","56",
"Wyoming","2011","332811","Metal heat treating","1","0","0","56",
"Wyoming","2011","332812","Metal coating, engraving (except jewelry and silverware), and allied services to manufacturers","2","0","0","56",
"Wyoming","2011","332813","Electroplating, plating, polishing, anodizing, and coloring","1","0","0","56",
"Wyoming","2011","3329  ","Other fabricated metal product manufacturing","15","191","7134","56",
"Wyoming","2011","33291 ","Metal valve manufacturing","3","0","0","56",
"Wyoming","2011","332911","Industrial valve manufacturing","1","0","0","56",
"Wyoming","2011","332912","Fluid power valve and hose fitting manufacturing","1","0","0","56",
"Wyoming","2011","332919","Other metal valve and pipe fitting manufacturing","1","0","0","56",
"Wyoming","2011","33299 ","All other fabricated metal product manufacturing","12","171","5878","56",
"Wyoming","2011","332992","Small arms ammunition manufacturing","1","0","0","56",
"Wyoming","2011","333   ","Machinery manufacturing","36","1179","70088","56",
"Wyoming","2011","332994","Small arms manufacturing","3","0","0","56",
"Wyoming","2011","3331  ","Agriculture, construction, and mining machinery manufacturing","17","622","37490","56",
"Wyoming","2011","332999","All other miscellaneous fabricated metal product manufacturing","8","147","5217","56",
"Wyoming","2011","33311 ","Agricultural implement manufacturing","2","0","0","56",
"Wyoming","2011","333111","Farm machinery and equipment manufacturing","2","0","0","56",
"Wyoming","2011","33312 ","Construction machinery manufacturing","1","0","0","56",
"Wyoming","2011","333120","Construction machinery manufacturing","1","0","0","56",
"Wyoming","2011","333131","Mining machinery and equipment manufacturing","3","0","0","56",
"Wyoming","2011","333132","Oil and gas field machinery and equipment manufacturing","11","385","22852","56",
"Wyoming","2011","3332  ","Industrial machinery manufacturing","5","22","899","56",
"Wyoming","2011","3333  ","Commercial and service industry machinery manufacturing","1","0","0","56",
"Wyoming","2011","33322 ","Plastics and rubber industry machinery manufacturing","1","0","0","56",
"Wyoming","2011","333220","Plastics and rubber industry machinery manufacturing","1","0","0","56",
"Wyoming","2011","3334  ","Ventilation, heating, air-conditioning, and commercial refrigeration equipment manufacturing","1","0","0","56",
"Wyoming","2011","33329 ","Other industrial machinery manufacturing","4","0","0","56",
"Wyoming","2011","33341 ","HVAC and commercial refrigeration equipment","1","0","0","56",
"Wyoming","2011","333292","Textile machinery manufacturing","2","0","0","56",
"Wyoming","2011","333294","Food product machinery manufacturing","1","0","0","56",
"Wyoming","2011","333298","All other industrial machinery manufacturing","1","0","0","56",
"Wyoming","2011","33331 ","Commercial and service industry machinery manufacturing","1","0","0","56",
"Wyoming","2011","333319","Other commercial and service industry machinery manufacturing","1","0","0","56",
"Wyoming","2011","3336  ","Engine, turbine, and power transmission equipment manufacturing","1","0","0","56",
"Wyoming","2011","333415","Air-conditioning and warm air heating equipment and commercial and industrial refrigeration equipment manufacturing","1","0","0","56",
"Wyoming","2011","33351 ","Metalworking machinery manufacturing","4","28","1256","56",
"Wyoming","2011","333514","Special die and tool, die set, jig, and fixture manufacturing","1","0","0","56",
"Wyoming","2011","333515","Cutting tool and machine tool accessory manufacturing","3","25","1053","56",
"Wyoming","2011","33361 ","Engine, turbine, and power transmission equipment manufacturing","1","0","0","56",
"Wyoming","2011","333611","Turbine and turbine generator set units manufacturing","1","0","0","56",
"Wyoming","2011","3339  ","Other general purpose machinery manufacturing","7","198","11647","56",
"Wyoming","2011","33391 ","Pump and compressor manufacturing","3","116","5900","56",
"Wyoming","2011","333911","Pump and pumping equipment manufacturing","2","0","0","56",
"Wyoming","2011","334119","Other computer peripheral equipment manufacturing","1","0","0","56",
"Wyoming","2011","3342  ","Communications equipment manufacturing","1","0","0","56",
"Wyoming","2011","333913","Measuring and dispensing pump manufacturing","1","0","0","56",
"Wyoming","2011","33399 ","All other general purpose machinery manufacturing","4","0","0","56",
"Wyoming","2011","333992","Welding and soldering equipment manufacturing","2","0","0","56",
"Wyoming","2011","333999","All other miscellaneous general purpose machinery manufacturing","2","0","0","56",
"Wyoming","2011","334   ","Computer and electronic product manufacturing","11","0","0","56",
"Wyoming","2011","3341  ","Computer and peripheral equipment manufacturing","2","0","0","56",
"Wyoming","2011","33451 ","Electronic instrument manufacturing","5","0","3272","56",
"Wyoming","2011","33411 ","Computer and peripheral equipment manufacturing","2","0","0","56",
"Wyoming","2011","334111","Electronic computer manufacturing","1","0","0","56",
"Wyoming","2011","33422 ","Radio and television broadcasting and wireless communications equipment manufacturing","1","0","0","56",
"Wyoming","2011","334220","Broadcast and wireless communications equip.","1","0","0","56",
"Wyoming","2011","33461 ","Manufacturing and reproducing magnetic and optical media","1","0","0","56",
"Wyoming","2011","3344  ","Semiconductor and other electronic component manufacturing","2","0","0","56",
"Wyoming","2011","33441 ","Semiconductor and other electronic component manufacturing","2","0","0","56",
"Wyoming","2011","334412","Bare printed circuit board manufacturing","1","0","0","56",
"Wyoming","2011","334419","Other electronic component manufacturing","1","0","0","56",
"Wyoming","2011","3345  ","Navigational, measuring, electromedical, and control instruments manufacturing","5","0","3272","56",
"Wyoming","2011","334510","Electromedical and electrotherapeutic apparatus manufacturing","1","0","0","56",
"Wyoming","2011","334516","Analytical laboratory instrument manufacturing","2","0","0","56",
"Wyoming","2011","33599 ","All other electrical equipment and component manufacturing","2","0","0","56",
"Wyoming","2011","334519","Other measuring and controlling device manufacturing","2","0","0","56",
"Wyoming","2011","3346  ","Manufacturing and reproducing magnetic and optical media","1","0","0","56",
"Wyoming","2011","334611","Software reproducing","1","0","0","56",
"Wyoming","2011","3362  ","Motor vehicle body and trailer manufacturing","1","0","0","56",
"Wyoming","2011","335   ","Electrical equipment, appliance, and component manufacturing","7","113","6911","56",
"Wyoming","2011","3351  ","Electric lighting equipment manufacturing","3","0","0","56",
"Wyoming","2011","33512 ","Lighting fixture manufacturing","3","0","0","56",
"Wyoming","2011","335121","Residential electric lighting fixture manufacturing","2","0","0","56",
"Wyoming","2011","335122","Commercial, industrial, and institutional electric lighting fixture manufacturing","1","0","0","56",
"Wyoming","2011","3353  ","Electrical equipment manufacturing","2","0","0","56",
"Wyoming","2011","33531 ","Electrical equipment manufacturing","2","0","0","56",
"Wyoming","2011","335312","Motor and generator manufacturing","2","0","0","56",
"Wyoming","2011","336399","All other motor vehicle parts manufacturing","2","0","0","56",
"Wyoming","2011","3359  ","Other electrical equipment and component manufacturing","2","0","0","56",
"Wyoming","2011","3364  ","Aerospace product and parts manufacturing","4","42","1555","56",
"Wyoming","2011","335991","Carbon and graphite product manufacturing","1","0","0","56",
"Wyoming","2011","335999","All other miscellaneous electrical equipment and component manufacturing","1","0","0","56",
"Wyoming","2011","336   ","Transportation equipment manufacturing","12","121","3547","56",
"Wyoming","2011","336411","Aircraft manufacturing","3","39","1365","56",
"Wyoming","2011","33621 ","Motor vehicle body and trailer manufacturing","1","0","0","56",
"Wyoming","2011","336212","Truck trailer manufacturing","1","0","0","56",
"Wyoming","2011","3363  ","Motor vehicle parts manufacturing","6","67","1765","56",
"Wyoming","2011","33631 ","Motor vehicle gasoline engine and engine parts manufacturing","3","0","0","56",
"Wyoming","2011","336312","Gasoline engine and engine parts manufacturing","3","0","0","56",
"Wyoming","2011","33633 ","Motor vehicle steering and suspension components (except spring) manufacturing","1","0","0","56",
"Wyoming","2011","336330","Motor vehicle steering and suspension components (except spring) manufacturing","1","0","0","56",
"Wyoming","2011","33639 ","Other motor vehicle parts manufacturing","2","0","0","56",
"Wyoming","2011","33641 ","Aerospace product and parts manufacturing","4","42","1555","56",
"Wyoming","2011","336412","Aircraft engine and engine parts manufacturing","1","0","0","56",
"Wyoming","2011","3369  ","Other transportation equipment manufacturing","1","0","0","56",
"Wyoming","2011","33699 ","Other transportation equipment manufacturing","1","0","0","56",
"Wyoming","2011","336991","Motorcycle, bicycle, and parts manufacturing","1","0","0","56",
"Wyoming","2011","337   ","Furniture and related product manufacturing","37","162","4402","56",
"Wyoming","2011","3371  ","Household and institutional furniture and kitchen cabinet manufacturing","33","149","4095","56",
"Wyoming","2011","337110","Wood kitchen cabinet and countertop manufacturing","19","124","3400","56",
"Wyoming","2011","337121","Upholstered household furniture manufacturing","2","0","0","56",
"Wyoming","2011","337127","Institutional furniture manufacturing","1","0","0","56",
"Wyoming","2011","423130","Tire and tube merchant wholesalers","4","0","0","56",
"Wyoming","2011","424690","Other chemical and allied products merchant wholesalers","34","273","19823","56",
"Wyoming","2011","33712 ","Household and institutional furniture manufacturing","14","0","695","56",
"Wyoming","2011","339116","Dental laboratories","10","0","541","56",
"Wyoming","2011","337122","Nonupholstered wood household furniture manufacturing","8","12","382","56",
"Wyoming","2011","337124","Metal household furniture manufacturing","3","0","0","56",
"Wyoming","2011","3372  ","Office furniture (including fixtures) manufacturing","3","0","306","56",
"Wyoming","2011","33721 ","Office furniture (including fixtures) manufacturing","3","0","306","56",
"Wyoming","2011","339920","Sporting and athletic goods manufacturing","5","143","4334","56",
"Wyoming","2011","337212","Custom architectural woodwork and millwork manufacturing","3","0","306","56",
"Wyoming","2011","3379  ","Other furniture related product manufacturing","1","0","0","56",
"Wyoming","2011","33792 ","Blind and shade manufacturing","1","0","0","56",
"Wyoming","2011","337920","Blind and shade manufacturing","1","0","0","56",
"Wyoming","2011","339   ","Miscellaneous manufacturing","43","254","8386","56",
"Wyoming","2011","3391  ","Medical equipment and supplies manufacturing","11","0","664","56",
"Wyoming","2011","33911 ","Medical equipment and supplies manufacturing","11","0","664","56",
"Wyoming","2011","339113","Surgical appliance and supplies manufacturing","1","0","0","56",
"Wyoming","2011","339999","All other miscellaneous manufacturing","5","0","0","56",
"Wyoming","2011","3399  ","Other miscellaneous manufacturing","32","233","7722","56",
"Wyoming","2011","33991 ","Jewelry and silverware manufacturing","1","0","0","56",
"Wyoming","2011","339911","Jewelry (except costume) manufacturing","1","0","0","56",
"Wyoming","2011","33992 ","Sporting and athletic goods manufacturing","5","143","4334","56",
"Wyoming","2011","4231  ","Motor vehicle and motor vehicle parts and supplies merchant wholesalers","41","682","35485","56",
"Wyoming","2011","33993 ","Doll, toy, and game manufacturing","2","0","0","56",
"Wyoming","2011","423110","Automobile and other motor vehicle merchant wholesalers","12","247","12120","56",
"Wyoming","2011","339932","Game, toy, and children's vehicle manufacturing","2","0","0","56",
"Wyoming","2011","33994 ","Office supplies (except paper) manufacturing","1","0","0","56",
"Wyoming","2011","339943","Marking device manufacturing","1","0","0","56",
"Wyoming","2011","33995 ","Sign manufacturing","17","59","2404","56",
"Wyoming","2011","339950","Sign manufacturing","17","59","2404","56",
"Wyoming","2011","33999 ","All other miscellaneous manufacturing","6","27","759","56",
"Wyoming","2011","339991","Gasket, packing, and sealing device manufacturing","1","0","0","56",
"Wyoming","2011","42    ","Wholesale trade","830","7826","462807","56",
"Wyoming","2011","4232  ","Furniture and home furnishing merchant wholesalers","5","0","0","56",
"Wyoming","2011","423   ","Merchant wholesalers, durable goods","538","5452","348573","56",
"Wyoming","2011","423210","Furniture merchant wholesalers","1","0","0","56",
"Wyoming","2011","42311 ","Automobile and other motor vehicle merchant wholesalers","12","247","12120","56",
"Wyoming","2011","42312 ","Motor vehicle supplies and new parts merchant wholesalers","21","313","16667","56",
"Wyoming","2011","423120","Motor vehicle supplies and new parts merchant wholesalers","21","313","16667","56",
"Wyoming","2011","42313 ","Tire and tube merchant wholesalers","4","0","0","56",
"Wyoming","2011","42314 ","Motor vehicle parts (used) merchant wholesalers","4","0","0","56",
"Wyoming","2011","423140","Motor vehicle parts (used) merchant wholesalers","4","0","0","56",
"Wyoming","2011","42321 ","Furniture merchant wholesalers","1","0","0","56",
"Wyoming","2011","42322 ","Home furnishing merchant wholesalers","4","0","0","56",
"Wyoming","2011","423220","Home furnishing merchant wholesalers","4","0","0","56",
"Wyoming","2011","4233  ","Lumber and other construction materials merchant wholesalers","27","138","5858","56",
"Wyoming","2011","42331 ","Lumber, plywood, millwork, and wood panel merchant wholesalers","10","99","3122","56",
"Wyoming","2011","423310","Lumber, plywood, millwork, and wood panel merchant wholesalers","10","99","3122","56",
"Wyoming","2011","424450","Confectionery merchant wholesalers","4","0","0","56",
"Wyoming","2011","42332 ","Brick, stone, and related construction material merchant wholesalers","6","18","1323","56",
"Wyoming","2011","423320","Brick, stone, and related construction material merchant wholesalers","6","18","1323","56",
"Wyoming","2011","42333 ","Roofing, siding, and insulation material merchant wholesalers","6","0","496","56",
"Wyoming","2011","423330","Roofing, siding, and insulation material merchant wholesalers","6","0","496","56",
"Wyoming","2011","42361 ","Electrical apparatus and equipment, wiring supplies, and related equipment merchant wholesalers","33","0","11897","56",
"Wyoming","2011","42339 ","Other construction material merchant wholesalers","5","12","917","56",
"Wyoming","2011","423390","Other construction material merchant wholesalers","5","12","917","56",
"Wyoming","2011","4234  ","Professional and commercial equipment and supplies merchant wholesalers","41","178","10542","56",
"Wyoming","2011","42342 ","Office equipment merchant wholesalers","13","66","2817","56",
"Wyoming","2011","423420","Office equipment merchant wholesalers","13","66","2817","56",
"Wyoming","2011","42343 ","Computer and computer peripheral equipment and software merchant wholesalers","10","44","4638","56",
"Wyoming","2011","423430","Computer and computer peripheral equipment and software merchant wholesalers","10","44","4638","56",
"Wyoming","2011","42344 ","Other commercial equipment merchant wholesalers","3","0","0","56",
"Wyoming","2011","423440","Other commercial equipment merchant wholesalers","3","0","0","56",
"Wyoming","2011","42345 ","Medical, dental, and hospital equipment and supplies merchant wholesalers","7","0","0","56",
"Wyoming","2011","423450","Medical, dental, and hospital equipment and supplies merchant wholesalers","7","0","0","56",
"Wyoming","2011","42346 ","Ophthalmic goods merchant wholesalers","2","0","0","56",
"Wyoming","2011","423460","Ophthalmic goods merchant wholesalers","2","0","0","56",
"Wyoming","2011","42349 ","Other professional equipment and supplies merchant wholesalers","6","0","414","56",
"Wyoming","2011","423490","Other professional equipment and supplies merchant wholesalers","6","0","414","56",
"Wyoming","2011","4235  ","Metal and mineral (except petroleum) merchant wholesalers","23","224","12545","56",
"Wyoming","2011","42351 ","Metal service centers and other metal merchant wholesalers","22","222","12377","56",
"Wyoming","2011","423510","Metal service centers and other metal merchant wholesalers","22","222","12377","56",
"Wyoming","2011","42352 ","Coal and other mineral and ore merchant wholesalers","1","0","0","56",
"Wyoming","2011","423520","Coal and other mineral and ore merchant wholesalers","1","0","0","56",
"Wyoming","2011","4236  ","Electrical and electronic goods merchant wholesalers","46","406","38808","56",
"Wyoming","2011","423610","Electrical apparatus and equipment, wiring supplies, and related equipment merchant wholesalers","33","0","11897","56",
"Wyoming","2011","42362 ","Electrical and electronic appliance, television, and radio set merchant wholesalers","3","0","0","56",
"Wyoming","2011","423620","Electrical and electronic appliance, television, and radio set merchant wholesalers","3","0","0","56",
"Wyoming","2011","42369 ","Other electronic parts and equipment merchant wholesalers","10","0","0","56",
"Wyoming","2011","423690","Other electronic parts and equipment merchant wholesalers","10","0","0","56",
"Wyoming","2011","4237  ","Hardware, plumbing and heating equipment and supplies merchant wholesalers","28","121","6183","56",
"Wyoming","2011","42371 ","Hardware merchant wholesalers","5","28","1170","56",
"Wyoming","2011","42372 ","Plumbing and heating equipment and supplies (hydronics) merchant wholesalers","18","73","3892","56",
