"Puerto Rico","2005","531190","Lessors of Other Real Estate Property","16","53","1162","72",
"Puerto Rico","2005","5312  ","Offices of Real Estate Agents and Brokers","226","818","20183","72",
"Puerto Rico","2005","53229 ","Other Consumer Goods Rental","104","780","14131","72",
"Puerto Rico","2005","481111","Scheduled Passenger Air Transportation","35","2775","96977","72",
"Puerto Rico","2005","532291","Home Health Equipment Rental","35","264","5685","72",
"Puerto Rico","2005","532292","Recreational Goods Rental","28","297","4977","72",
"Puerto Rico","2005","532299","All Other Consumer Goods Rental","41","219","3469","72",
"Puerto Rico","2005","48-49 ","Transportation and Warehousing","1093","16610","398824","72",
"Puerto Rico","2005","481   ","Air Transportation","59","2964","102082","72",
"Puerto Rico","2005","4811  ","Scheduled Air Transportation","48","2907","101110","72",
"Puerto Rico","2005","48111 ","Scheduled Air Transportation","48","2907","101110","72",
"Puerto Rico","2005","48411 ","General Freight Trucking, Local","378","2425","42381","72",
"Puerto Rico","2005","48531 ","Taxi Service","12","42","314","72",
"Puerto Rico","2005","484110","General Freight Trucking, Local","378","2425","42381","72",
"Puerto Rico","2005","48412 ","General Freight Trucking, Long-Distance","18","86","2839","72",
"Puerto Rico","2005","484121","General Freight Trucking, Long-Distance, Truckload","15","78","2471","72",
"Puerto Rico","2005","485310","Taxi Service","12","42","314","72",
"Puerto Rico","2005","4872  ","Scenic and Sightseeing Transportation, Water","6","80","1752","72",
"Puerto Rico","2005","48532 ","Limousine Service","5","0","0","72",
"Puerto Rico","2005","485320","Limousine Service","5","0","0","72",
"Puerto Rico","2005","4854  ","School and Employee Bus Transportation","113","640","5902","72",
"Puerto Rico","2005","48821 ","Support Activities for Rail Transportation","1","0","0","72",
"Puerto Rico","2005","48721 ","Scenic and Sightseeing Transportation, Water","6","80","1752","72",
"Puerto Rico","2005","487210","Scenic and Sightseeing Transportation, Water","6","80","1752","72",
"Puerto Rico","2005","4879  ","Scenic and Sightseeing Transportation, Other","3","35","1244","72",
"Puerto Rico","2005","48849 ","Other Support Activities for Road Transportation","7","121","2506","72",
"Puerto Rico","2005","488210","Support Activities for Rail Transportation","1","0","0","72",
"Puerto Rico","2005","4883  ","Support Activities for Water Transportation","44","1885","58692","72",
"Puerto Rico","2005","48831 ","Port and Harbor Operations","3","0","0","72",
"Puerto Rico","2005","49312 ","Refrigerated Warehousing and Storage","13","0","0","72",
"Puerto Rico","2005","488490","Other Support Activities for Road Transportation","7","121","2506","72",
"Puerto Rico","2005","4885  ","Freight Transportation Arrangement","75","1725","34409","72",
"Puerto Rico","2005","48851 ","Freight Transportation Arrangement","75","1725","34409","72",
"Puerto Rico","2005","511199","All Other Publishers","22","0","0","72",
"Puerto Rico","2005","493120","Refrigerated Warehousing and Storage","13","0","0","72",
"Puerto Rico","2005","49313 ","Farm Product Warehousing and Storage","2","0","0","72",
"Puerto Rico","2005","493130","Farm Product Warehousing and Storage","2","0","0","72",
"Puerto Rico","2005","512   ","Motion Picture and Sound Recording Industries","138","2046","33303","72",
"Puerto Rico","2005","5112  ","Software Publishers","7","118","5054","72",
"Puerto Rico","2005","51121 ","Software Publishers","7","118","5054","72",
"Puerto Rico","2005","511210","Software Publishers","7","118","5054","72",
"Puerto Rico","2005","512210","Record Production","6","0","0","72",
"Puerto Rico","2005","51222 ","Integrated Record Production/Distribution","1","0","0","72",
"Puerto Rico","2005","5161  ","Internet Publishing and Broadcasting","4","40","799","72",
"Puerto Rico","2005","512220","Integrated Record Production/Distribution","1","0","0","72",
"Puerto Rico","2005","51223 ","Music Publishers","1","0","0","72",
"Puerto Rico","2005","512230","Music Publishers","1","0","0","72",
"Puerto Rico","2005","51751 ","Cable and Other Program Distribution","10","1145","29010","72",
"Puerto Rico","2005","51611 ","Internet Publishing and Broadcasting","4","40","799","72",
"Puerto Rico","2005","516110","Internet Publishing and Broadcasting","4","40","799","72",
"Puerto Rico","2005","517   ","Telecommunications","200","10449","408974","72",
"Puerto Rico","2005","517510","Cable and Other Program Distribution","10","1145","29010","72",
"Puerto Rico","2005","51919 ","All Other Information Services","22","0","0","72",
"Puerto Rico","2005","5179  ","Other Telecommunications","18","298","10007","72",
"Puerto Rico","2005","51791 ","Other Telecommunications","18","298","10007","72",
"Puerto Rico","2005","517910","Other Telecommunications","18","298","10007","72",
"Puerto Rico","2005","5211  ","Monetary Authorities - Central Bank","2","0","0","72",
"Puerto Rico","2005","519190","All Other Information Services","22","0","0","72",
"Puerto Rico","2005","52    ","Finance and Insurance","1806","36577","1273184","72",
"Puerto Rico","2005","521   ","Monetary Authorities - Central Bank","2","0","0","72",
"Puerto Rico","2005","522210","Credit Card Issuing","192","0","0","72",
"Puerto Rico","2005","52222 ","Sales Financing","39","0","0","72",
"Puerto Rico","2005","52311 ","Investment Banking and Securities Dealing","9","62","7212","72",
"Puerto Rico","2005","522220","Sales Financing","39","0","0","72",
"Puerto Rico","2005","52229 ","Other Nondepository Credit Intermediation","377","5849","178532","72",
"Puerto Rico","2005","522291","Consumer Lending","169","1623","44135","72",
"Puerto Rico","2005","523991","Trust, Fiduciary, and Custody Activities","7","0","0","72",
"Puerto Rico","2005","523110","Investment Banking and Securities Dealing","9","62","7212","72",
"Puerto Rico","2005","52312 ","Securities Brokerage","25","662","36470","72",
"Puerto Rico","2005","523120","Securities Brokerage","25","662","36470","72",
"Puerto Rico","2005","523999","Miscellaneous Financial Investment Activities","3","0","0","72",
"Puerto Rico","2005","524298","All Other Insurance Related Activities","13","61","2098","72",
"Puerto Rico","2005","524   ","Insurance Carriers and Related Activities","511","10545","391635","72",
"Puerto Rico","2005","5241  ","Insurance Carriers","142","6853","256473","72",
"Puerto Rico","2005","524292","Third Party Administration of Insurance and Pension Funds","22","233","6571","72",
"Puerto Rico","2005","531210","Offices of Real Estate Agents and Brokers","226","818","20183","72",
"Puerto Rico","2005","525   ","Funds, Trusts, and Other Financial Vehicles","6","0","0","72",
"Puerto Rico","2005","5259  ","Other Investment Pools and Funds","6","0","0","72",
"Puerto Rico","2005","53121 ","Offices of Real Estate Agents and Brokers","226","818","20183","72",
"Puerto Rico","2005","5323  ","General Rental Centers","60","0","0","72",
"Puerto Rico","2005","5313  ","Activities Related to Real Estate","266","3670","74212","72",
"Puerto Rico","2005","53131 ","Real Estate Property Managers","185","2686","50045","72",
"Puerto Rico","2005","531311","Residential Property Managers","118","1935","34667","72",
"Puerto Rico","2005","53231 ","General Rental Centers","60","0","0","72",
"Puerto Rico","2005","11511 ","Support Activities for Crop Production","5","9","189","72",
"Puerto Rico","2005","532310","General Rental Centers","60","0","0","72",
"Puerto Rico","2005","5324  ","Commercial and Industrial Machinery and Equipment Rental and Leasing","224","1933","34701","72",
"Puerto Rico","2005","1151  ","Support Activities for Crop Production","5","9","189","72",
"Puerto Rico","2005","212311","Dimension Stone Mining and Quarrying","1","0","0","72",
"Puerto Rico","2005","115112","Soil Preparation, Planting, and Cultivating","1","0","0","72",
"Puerto Rico","2005","115113","Crop Harvesting, Primarily by Machine","1","0","0","72",
"Puerto Rico","2005","115114","Postharvest Crop Activities (except Cotton Ginning)","3","0","0","72",
"Puerto Rico","2005","212312","Crushed and Broken Limestone Mining and Quarrying","3","0","0","72",
"Puerto Rico","2005","2213  ","Water, Sewage and Other Systems","16","91","3135","72",
"Puerto Rico","2005","212313","Crushed and Broken Granite Mining and Quarrying","1","0","0","72",
"Puerto Rico","2005","212319","Other Crushed and Broken Stone Mining and Quarrying","3","0","0","72",
"Puerto Rico","2005","221210","Natural Gas Distribution","8","72","1353","72",
"Puerto Rico","2005","23713 ","Power and Communication Line and Related Structures Construction","29","740","10462","72",
"Puerto Rico","2005","22131 ","Water Supply and Irrigation Systems","12","65","2364","72",
"Puerto Rico","2005","221310","Water Supply and Irrigation Systems","12","65","2364","72",
"Puerto Rico","2005","22132 ","Sewage Treatment Facilities","3","0","0","72",
"Puerto Rico","2005","237130","Power and Communication Line and Related Structures Construction","29","740","10462","72",
"Puerto Rico","2005","238190","Other Foundation, Structure, and Building Exterior Contractors","17","189","3966","72",
"Puerto Rico","2005","2372  ","Land Subdivision","90","855","16693","72",
"Puerto Rico","2005","23721 ","Land Subdivision","90","855","16693","72",
"Puerto Rico","2005","23819 ","Other Foundation, Structure, and Building Exterior Contractors","17","189","3966","72",
"Puerto Rico","2005","3111  ","Animal Food Manufacturing","15","0","0","72",
"Puerto Rico","2005","2382  ","Building Equipment Contractors","639","12538","233120","72",
"Puerto Rico","2005","23821 ","Electrical Contractors","396","7748","142681","72",
"Puerto Rico","2005","311   ","Food Manufacturing","438","12484","252057","72",
"Puerto Rico","2005","311511","Fluid Milk Manufacturing","5","0","0","72",
"Puerto Rico","2005","31111 ","Animal Food Manufacturing","15","0","0","72",
"Puerto Rico","2005","311111","Dog and Cat Food Manufacturing","4","0","0","72",
"Puerto Rico","2005","311119","Other Animal Food Manufacturing","11","303","6889","72",
"Puerto Rico","2005","311512","Creamery Butter Manufacturing","1","0","0","72",
"Puerto Rico","2005","311513","Cheese Manufacturing","3","0","0","72",
"Puerto Rico","2005","49319 ","Other Warehousing and Storage","13","449","12283","72",
"Puerto Rico","2005","31152 ","Ice Cream and Frozen Dessert Manufacturing","9","50","458","72",
"Puerto Rico","2005","311520","Ice Cream and Frozen Dessert Manufacturing","9","50","458","72",
"Puerto Rico","2005","488510","Freight Transportation Arrangement","75","1725","34409","72",
"Puerto Rico","2005","4889  ","Other Support Activities for Transportation","5","0","0","72",
"Puerto Rico","2005","48899 ","Other Support Activities for Transportation","5","0","0","72",
"Puerto Rico","2005","488991","Packing and Crating","5","0","0","72",
"Puerto Rico","2005","492   ","Couriers and Messengers","44","942","26039","72",
"Puerto Rico","2005","5111  ","Newspaper, Periodical, Book, and Directory Publishers","87","4287","153766","72",
"Puerto Rico","2005","493190","Other Warehousing and Storage","13","449","12283","72",
"Puerto Rico","2005","51    ","Information","592","22137","768337","72",
"Puerto Rico","2005","511   ","Publishing Industries (except Internet)","94","4405","158820","72",
"Puerto Rico","2005","51212 ","Motion Picture and Video Distribution","3","9","464","72",
"Puerto Rico","2005","5121  ","Motion Picture and Video Industries","118","1966","31026","72",
"Puerto Rico","2005","51211 ","Motion Picture and Video Production","41","172","5951","72",
"Puerto Rico","2005","512110","Motion Picture and Video Production","41","172","5951","72",
"Puerto Rico","2005","51224 ","Sound Recording Studios","7","38","877","72",
"Puerto Rico","2005","515   ","Broadcasting (except Internet)","77","2277","63674","72",
"Puerto Rico","2005","512240","Sound Recording Studios","7","38","877","72",
"Puerto Rico","2005","51229 ","Other Sound Recording Industries","5","25","910","72",
"Puerto Rico","2005","512290","Other Sound Recording Industries","5","25","910","72",
"Puerto Rico","2005","5171  ","Wired Telecommunications Carriers","24","5899","251134","72",
"Puerto Rico","2005","51721 ","Wireless Telecommunications Carriers (except Satellite)","138","2924","110341","72",
"Puerto Rico","2005","51711 ","Wired Telecommunications Carriers","24","5899","251134","72",
"Puerto Rico","2005","517110","Wired Telecommunications Carriers","24","5899","251134","72",
"Puerto Rico","2005","5172  ","Wireless Telecommunications Carriers (except Satellite)","138","2924","110341","72",
"Puerto Rico","2005","518   ","Internet Service Providers, Web Search Portals, and Data Processing Services","50","2181","86680","72",
"Puerto Rico","2005","52111 ","Monetary Authorities - Central Bank","2","0","0","72",
"Puerto Rico","2005","5181  ","Internet Service Providers and Web Search Portals","23","308","6983","72",
"Puerto Rico","2005","51811 ","Internet Service Providers and Web Search Portals","23","308","6983","72",
"Puerto Rico","2005","518111","Internet Service Providers","22","0","0","72",
"Puerto Rico","2005","522292","Real Estate Credit","180","4027","127872","72",
"Puerto Rico","2005","521110","Monetary Authorities - Central Bank","2","0","0","72",
"Puerto Rico","2005","522   ","Credit Intermediation and Related Activities","1195","24899","820888","72",
"Puerto Rico","2005","5221  ","Depository Credit Intermediation","472","11426","383769","72",
"Puerto Rico","2005","5223  ","Activities Related to Credit Intermediation","115","1646","43971","72",
"Puerto Rico","2005","522293","International Trade Financing","3","0","0","72",
"Puerto Rico","2005","522294","Secondary Market Financing","1","0","0","72",
"Puerto Rico","2005","522298","All Other Nondepository Credit Intermediation","24","186","6170","72",
"Puerto Rico","2005","52313 ","Commodity Contracts Dealing","1","0","0","72",
"Puerto Rico","2005","523130","Commodity Contracts Dealing","1","0","0","72",
"Puerto Rico","2005","52411 ","Direct Life, Health, and Medical Insurance Carriers","78","4533","168297","72",
"Puerto Rico","2005","52314 ","Commodity Contracts Brokerage","2","0","0","72",
"Puerto Rico","2005","523140","Commodity Contracts Brokerage","2","0","0","72",
"Puerto Rico","2005","5232  ","Securities and Commodity Exchanges","1","0","0","72",
"Puerto Rico","2005","524113","Direct Life Insurance Carriers","34","1635","54586","72",
"Puerto Rico","2005","52591 ","Open-End Investment Funds","2","0","0","72",
"Puerto Rico","2005","524114","Direct Health and Medical Insurance Carriers","44","2898","113711","72",
"Puerto Rico","2005","52412 ","Direct Insurance (except Life, Health, and Medical) Carriers","56","2287","87395","72",
"Puerto Rico","2005","524126","Direct Property and Casualty Insurance Carriers","33","1435","58422","72",
"Puerto Rico","2005","525910","Open-End Investment Funds","2","0","0","72",
"Puerto Rico","2005","531312","Nonresidential Property Managers","67","751","15378","72",
"Puerto Rico","2005","52593 ","Real Estate Investment Trusts","3","1","42","72",
"Puerto Rico","2005","525930","Real Estate Investment Trusts","3","1","42","72",
"Puerto Rico","2005","52599 ","Other Financial Vehicles","1","0","0","72",
"Puerto Rico","2005","53241 ","Construction, Transportation, Mining, and Forestry Machinery and Equipment Rental and Leasing","127","1333","23156","72",
"Puerto Rico","2005","53132 ","Offices of Real Estate Appraisers","43","155","5870","72",
"Puerto Rico","2005","531320","Offices of Real Estate Appraisers","43","155","5870","72",
"Puerto Rico","2005","53139 ","Other Activities Related to Real Estate","38","829","18297","72",
"Puerto Rico","2005","1152  ","Support Activities for Animal Production","9","30","291","72",
"Puerto Rico","2005","532411","Commercial Air, Rail, and Water Transportation Equipment Rental and Leasing","24","129","1704","72",
"Puerto Rico","2005","532412","Construction, Mining, and Forestry Machinery and Equipment Rental and Leasing","103","1204","21452","72",
"Puerto Rico","2005","53242 ","Office Machinery and Equipment Rental and Leasing","9","22","776","72",
"Puerto Rico","2005","21232 ","Sand, Gravel, Clay, and Ceramic and Refractory Minerals Mining and Quarrying","33","0","0","72",
"Puerto Rico","2005","11521 ","Support Activities for Animal Production","9","30","291","72",
"Puerto Rico","2005","115210","Support Activities for Animal Production","9","30","291","72",
"Puerto Rico","2005","21    ","Mining","46","889","20148","72",
"Puerto Rico","2005","212321","Construction Sand and Gravel Mining","32","0","0","72",
"Puerto Rico","2005","221320","Sewage Treatment Facilities","3","0","0","72",
"Puerto Rico","2005","212322","Industrial Sand Mining","1","0","0","72",
"Puerto Rico","2005","213   ","Support Activities for Mining","3","0","0","72",
"Puerto Rico","2005","2131  ","Support Activities for Mining","3","0","0","72",
"Puerto Rico","2005","22133 ","Steam and Air-Conditioning Supply","1","0","0","72",
"Puerto Rico","2005","237210","Land Subdivision","90","855","16693","72",
"Puerto Rico","2005","221330","Steam and Air-Conditioning Supply","1","0","0","72",
"Puerto Rico","2005","23    ","Construction","2920","62181","1008863","72",
"Puerto Rico","2005","236   ","Construction of Buildings","1395","33932","521623","72",
"Puerto Rico","2005","2373  ","Highway, Street, and Bridge Construction","121","4956","74284","72",
"Puerto Rico","2005","238210","Electrical Contractors","396","7748","142681","72",
"Puerto Rico","2005","23731 ","Highway, Street, and Bridge Construction","121","4956","74284","72",
"Puerto Rico","2005","237310","Highway, Street, and Bridge Construction","121","4956","74284","72",
"Puerto Rico","2005","2379  ","Other Heavy and Civil Engineering Construction","16","562","9646","72",
"Puerto Rico","2005","23822 ","Plumbing, Heating, and Air-Conditioning Contractors","214","4364","76819","72",
"Puerto Rico","2005","3112  ","Grain and Oilseed Milling","6","221","14270","72",
"Puerto Rico","2005","238220","Plumbing, Heating, and Air-Conditioning Contractors","214","4364","76819","72",
"Puerto Rico","2005","23829 ","Other Building Equipment Contractors","29","426","13620","72",
"Puerto Rico","2005","238290","Other Building Equipment Contractors","29","426","13620","72",
"Puerto Rico","2005","31121 ","Flour Milling and Malt Manufacturing","5","0","0","72",
"Puerto Rico","2005","3116  ","Animal Slaughtering and Processing","19","1789","33906","72",
"Puerto Rico","2005","311211","Flour Milling","4","0","0","72",
"Puerto Rico","2005","311212","Rice Milling","1","0","0","72",
"Puerto Rico","2005","31122 ","Starch and Vegetable Fats and Oils Manufacturing","1","0","0","72",
"Puerto Rico","2005","31161 ","Animal Slaughtering and Processing","19","1789","33906","72",
"Puerto Rico","2005","31199 ","All Other Food Manufacturing","26","1054","20740","72",
"Puerto Rico","2005","311611","Animal (except Poultry) Slaughtering","8","263","3672","72",
"Puerto Rico","2005","311612","Meat Processed from Carcasses","7","0","0","72",
"Puerto Rico","2005","311942","Spice and Extract Manufacturing","5","0","0","72",
"Puerto Rico","2005","313249","Other Knit Fabric and Lace Mills","4","0","0","72",
"Puerto Rico","2005","311991","Perishable Prepared Food Manufacturing","6","120","2347","72",
"Puerto Rico","2005","311999","All Other Miscellaneous Food Manufacturing","20","934","18393","72",
"Puerto Rico","2005","313241","Weft Knit Fabric Mills","1","0","0","72",
"Puerto Rico","2005","315223","Men's and Boys' Cut and Sew Shirt (except Work Shirt) Manufacturing","3","62","511","72",
"Puerto Rico","2005","3133  ","Textile and Fabric Finishing and Fabric Coating Mills","6","0","0","72",
"Puerto Rico","2005","31331 ","Textile and Fabric Finishing Mills","6","0","0","72",
"Puerto Rico","2005","315222","Men's and Boys' Cut and Sew Suit, Coat, and Overcoat Manufacturing","7","673","5579","72",
"Puerto Rico","2005","32121 ","Veneer, Plywood, and Engineered Wood Product Manufacturing","7","284","3534","72",
"Puerto Rico","2005","315224","Men's and Boys' Cut and Sew Trouser, Slack, and Jean Manufacturing","9","0","0","72",
"Puerto Rico","2005","3211  ","Sawmills and Wood Preservation","4","51","861","72",
"Puerto Rico","2005","32111 ","Sawmills and Wood Preservation","4","51","861","72",
"Puerto Rico","2005","321113","Sawmills","4","51","861","72",
"Puerto Rico","2005","3212  ","Veneer, Plywood, and Engineered Wood Product Manufacturing","7","284","3534","72",
"Puerto Rico","2005","322226","Surface-Coated Paperboard Manufacturing","1","0","0","72",
"Puerto Rico","2005","32223 ","Stationery Product Manufacturing","7","195","3449","72",
"Puerto Rico","2005","322231","Die-Cut Paper and Paperboard Office Supplies Manufacturing","2","0","0","72",
"Puerto Rico","2005","325110","Petrochemical Manufacturing","2","0","0","72",
"Puerto Rico","2005","322232","Envelope Manufacturing","2","0","0","72",
"Puerto Rico","2005","322233","Stationery, Tablet, and Related Product Manufacturing","3","65","1163","72",
"Puerto Rico","2005","32511 ","Petrochemical Manufacturing","2","0","0","72",
"Puerto Rico","2005","32512 ","Industrial Gas Manufacturing","8","0","0","72",
"Puerto Rico","2005","325611","Soap and Other Detergent Manufacturing","8","270","7726","72",
"Puerto Rico","2005","325120","Industrial Gas Manufacturing","8","0","0","72",
"Puerto Rico","2005","32513 ","Synthetic Dye and Pigment Manufacturing","1","0","0","72",
"Puerto Rico","2005","32561 ","Soap and Cleaning Compound Manufacturing","19","489","12445","72",
"Puerto Rico","2005","325612","Polish and Other Sanitation Good Manufacturing","11","219","4719","72",
"Puerto Rico","2005","52211 ","Commercial Banking","322","8900","329761","72",
"Puerto Rico","2005","32562 ","Toilet Preparation Manufacturing","8","1633","41550","72",
"Puerto Rico","2005","325620","Toilet Preparation Manufacturing","8","1633","41550","72",
"Puerto Rico","2005","518112","Web Search Portals","1","0","0","72",
"Puerto Rico","2005","5182  ","Data Processing, Hosting, and Related Services","27","1873","79697","72",
"Puerto Rico","2005","51821 ","Data Processing, Hosting, and Related Services","27","1873","79697","72",
"Puerto Rico","2005","518210","Data Processing, Hosting, and Related Services","27","1873","79697","72",
"Puerto Rico","2005","519   ","Other Information Services","29","739","16087","72",
"Puerto Rico","2005","52213 ","Credit Unions","138","2390","51081","72",
"Puerto Rico","2005","522110","Commercial Banking","322","8900","329761","72",
"Puerto Rico","2005","52212 ","Savings Institutions","6","0","0","72",
"Puerto Rico","2005","522120","Savings Institutions","6","0","0","72",
"Puerto Rico","2005","522320","Financial Transactions Processing, Reserve, and Clearinghouse Activities","14","392","9540","72",
"Puerto Rico","2005","52231 ","Mortgage and Nonmortgage Loan Brokers","27","616","20814","72",
"Puerto Rico","2005","522310","Mortgage and Nonmortgage Loan Brokers","27","616","20814","72",
"Puerto Rico","2005","52232 ","Financial Transactions Processing, Reserve, and Clearinghouse Activities","14","392","9540","72",
"Puerto Rico","2005","52321 ","Securities and Commodity Exchanges","1","0","0","72",
"Puerto Rico","2005","523910","Miscellaneous Intermediation","5","0","0","72",
"Puerto Rico","2005","523210","Securities and Commodity Exchanges","1","0","0","72",
"Puerto Rico","2005","5239  ","Other Financial Investment Activities","54","0","0","72",
"Puerto Rico","2005","52391 ","Miscellaneous Intermediation","5","0","0","72",
"Puerto Rico","2005","524127","Direct Title Insurance Carriers","16","0","0","72",
"Puerto Rico","2005","525990","Other Financial Vehicles","1","0","0","72",
"Puerto Rico","2005","524128","Other Direct Insurance (except Life, Health, and Medical) Carriers","7","0","0","72",
"Puerto Rico","2005","52413 ","Reinsurance Carriers","8","33","781","72",
"Puerto Rico","2005","524130","Reinsurance Carriers","8","33","781","72",
"Puerto Rico","2005","53111 ","Lessors of Residential Buildings and Dwellings","264","1970","31807","72",
"Puerto Rico","2005","53    ","Real Estate and Rental and Leasing","1817","16760","315911","72",
"Puerto Rico","2005","531   ","Real Estate","1163","10662","212983","72",
"Puerto Rico","2005","5311  ","Lessors of Real Estate","671","6174","118588","72",
"Puerto Rico","2005","531390","Other Activities Related to Real Estate","38","829","18297","72",
"Puerto Rico","2005","532   ","Rental and Leasing Services","648","0","0","72",
"Puerto Rico","2005","532420","Office Machinery and Equipment Rental and Leasing","9","22","776","72",
"Puerto Rico","2005","5321  ","Automotive Equipment Rental and Leasing","130","1264","27055","72",
"Puerto Rico","2005","53211 ","Passenger Car Rental and Leasing","112","1045","21135","72",
"Puerto Rico","2005","532111","Passenger Car Rental","106","1018","20808","72",
"Puerto Rico","2005","211   ","Oil and Gas Extraction","1","0","0","72",
"Puerto Rico","2005","53249 ","Other Commercial and Industrial Machinery and Equipment Rental and Leasing","88","578","10769","72",
"Puerto Rico","2005","532490","Other Commercial and Industrial Machinery and Equipment Rental and Leasing","88","578","10769","72",
"Puerto Rico","2005","533   ","Lessors of Nonfinancial Intangible Assets (except Copyrighted Works)","6","0","0","72",
"Puerto Rico","2005","2111  ","Oil and Gas Extraction","1","0","0","72",
"Puerto Rico","2005","21311 ","Support Activities for Mining","3","0","0","72",
"Puerto Rico","2005","21111 ","Oil and Gas Extraction","1","0","0","72",
"Puerto Rico","2005","211111","Crude Petroleum and Natural Gas Extraction","1","0","0","72",
"Puerto Rico","2005","212   ","Mining (except Oil and Gas)","42","867","19879","72",
"Puerto Rico","2005","22    ","Utilities","28","351","17039","72",
"Puerto Rico","2005","213111","Drilling Oil and Gas Wells","1","0","0","72",
