"Montana","2007","327320","Ready-Mix Concrete Manufacturing","37","531","19087","30",
"Montana","2007","327999","All Other Miscellaneous Nonmetallic Mineral Product Manufacturing","2","0","0","30",
"Montana","2007","32733 ","Concrete Pipe, Brick, and Block Manufacturing","4","0","3301","30",
"Montana","2007","327331","Concrete Block and Brick Manufacturing","2","0","0","30",
"Montana","2007","327332","Concrete Pipe Manufacturing","2","0","0","30",
"Montana","2007","331513","Steel Foundries (except Investment)","2","0","0","30",
"Montana","2007","331   ","Primary Metal Manufacturing","26","0","0","30",
"Montana","2007","3311  ","Iron and Steel Mills and Ferroalloy Manufacturing","4","59","2088","30",
"Montana","2007","33111 ","Iron and Steel Mills and Ferroalloy Manufacturing","4","59","2088","30",
"Montana","2007","33152 ","Nonferrous Metal Foundries","12","172","3887","30",
"Montana","2007","33243 ","Metal Can, Box, and Other Metal Container (Light Gauge) Manufacturing","1","0","0","30",
"Montana","2007","331522","Nonferrous (except Aluminum) Die-Casting Foundries","4","0","0","30",
"Montana","2007","331524","Aluminum Foundries (except Die-Casting)","1","0","0","30",
"Montana","2007","331525","Copper Foundries (except Die-Casting)","7","87","1741","30",
"Montana","2007","333120","Construction Machinery Manufacturing","4","0","1364","30",
"Montana","2007","332439","Other Metal Container Manufacturing","1","0","0","30",
"Montana","2007","3325  ","Hardware Manufacturing","2","0","0","30",
"Montana","2007","33251 ","Hardware Manufacturing","2","0","0","30",
"Montana","2007","33313 ","Mining and Oil and Gas Field Machinery Manufacturing","1","0","0","30",
"Montana","2007","333923","Overhead Traveling Crane, Hoist, and Monorail System Manufacturing","2","0","0","30",
"Montana","2007","333131","Mining Machinery and Equipment Manufacturing","1","0","0","30",
"Montana","2007","3332  ","Industrial Machinery Manufacturing","7","0","0","30",
"Montana","2007","33392 ","Material Handling Equipment Manufacturing","3","0","0","30",
"Montana","2007","33461 ","Manufacturing and Reproducing Magnetic and Optical Media","1","0","0","30",
"Montana","2007","333924","Industrial Truck, Tractor, Trailer, and Stacker Machinery Manufacturing","1","0","0","30",
"Montana","2007","33399 ","All Other General Purpose Machinery Manufacturing","6","69","1524","30",
"Montana","2007","3346  ","Manufacturing and Reproducing Magnetic and Optical Media","1","0","0","30",
"Montana","2007","336413","Other Aircraft Parts and Auxiliary Equipment Manufacturing","5","0","0","30",
"Montana","2007","334612","Prerecorded Compact Disc (except Software), Tape, and Record Reproducing","1","0","0","30",
"Montana","2007","335   ","Electrical Equipment, Appliance, and Component Manufacturing","11","134","4606","30",
"Montana","2007","336411","Aircraft Manufacturing","2","0","0","30",
"Montana","2007","339943","Marking Device Manufacturing","2","0","0","30",
"Montana","2007","3366  ","Ship and Boat Building","5","0","307","30",
"Montana","2007","33661 ","Ship and Boat Building","5","0","307","30",
"Montana","2007","336611","Ship Building and Repairing","1","0","0","30",
"Montana","2007","33995 ","Sign Manufacturing","29","175","5929","30",
"Montana","2007","4235  ","Metal and Mineral (except Petroleum) Merchant Wholesalers","32","306","13389","30",
"Montana","2007","339950","Sign Manufacturing","29","175","5929","30",
"Montana","2007","33999 ","All Other Miscellaneous Manufacturing","22","367","11416","30",
"Montana","2007","339991","Gasket, Packing, and Sealing Device Manufacturing","1","0","0","30",
"Montana","2007","42351 ","Metal Service Centers and Other Metal Merchant Wholesalers","32","306","13389","30",
"Montana","2007","424130","Industrial and Personal Service Paper Merchant Wholesalers","4","0","903","30",
"Montana","2007","423510","Metal Service Centers and Other Metal Merchant Wholesalers","32","306","13389","30",
"Montana","2007","4236  ","Electrical and Electronic Goods Merchant Wholesalers","60","375","18631","30",
"Montana","2007","42413 ","Industrial and Personal Service Paper Merchant Wholesalers","4","0","903","30",
"Montana","2007","424910","Farm Supplies Merchant Wholesalers","70","475","14615","30",
"Montana","2007","4242  ","Drugs and Druggists' Sundries Merchant Wholesalers","17","284","13603","30",
"Montana","2007","42421 ","Drugs and Druggists' Sundries Merchant Wholesalers","17","284","13603","30",
"Montana","2007","42491 ","Farm Supplies Merchant Wholesalers","70","475","14615","30",
"Montana","2007","4442  ","Lawn and Garden Equipment and Supplies Stores","145","1421","35283","30",
"Montana","2007","42492 ","Book, Periodical, and Newspaper Merchant Wholesalers","14","0","2449","30",
"Montana","2007","424920","Book, Periodical, and Newspaper Merchant Wholesalers","14","0","2449","30",
"Montana","2007","444190","Other Building Material Dealers","291","2865","91510","30",
"Montana","2007","4533  ","Used Merchandise Stores","105","620","8002","30",
"Montana","2007","44421 ","Outdoor Power Equipment Stores","15","100","2672","30",
"Montana","2007","444210","Outdoor Power Equipment Stores","15","100","2672","30",
"Montana","2007","44422 ","Nursery, Garden Center, and Farm Supply Stores","130","1321","32611","30",
"Montana","2007","45331 ","Used Merchandise Stores","105","620","8002","30",
"Montana","2007","454113","Mail-Order Houses","25","94","2401","30",
"Montana","2007","453310","Used Merchandise Stores","105","620","8002","30",
"Montana","2007","4539  ","Other Miscellaneous Store Retailers","242","1140","25691","30",
"Montana","2007","45391 ","Pet and Pet Supplies Stores","24","253","4519","30",
"Montana","2007","4542  ","Vending Machine Operators","20","98","1766","30",
"Montana","2007","45421 ","Vending Machine Operators","20","98","1766","30",
"Montana","2007","48311 ","Deep Sea, Coastal, and Great Lakes Water Transportation","1","0","0","30",
"Montana","2007","454210","Vending Machine Operators","20","98","1766","30",
"Montana","2007","4543  ","Direct Selling Establishments","158","1469","37627","30",
"Montana","2007","4831  ","Deep Sea, Coastal, and Great Lakes Water Transportation","1","0","0","30",
"Montana","2007","48531 ","Taxi Service","19","166","1926","30",
"Montana","2007","483111","Deep Sea Freight Transportation","1","0","0","30",
"Montana","2007","484   ","Truck Transportation","821","4930","178488","30",
"Montana","2007","4853  ","Taxi and Limousine Service","23","180","2059","30",
"Montana","2007","4872  ","Scenic and Sightseeing Transportation, Water","3","0","0","30",
"Montana","2007","485310","Taxi Service","19","166","1926","30",
"Montana","2007","48532 ","Limousine Service","4","14","133","30",
"Montana","2007","485320","Limousine Service","4","14","133","30",
"Montana","2007","48721 ","Scenic and Sightseeing Transportation, Water","3","0","0","30",
"Montana","2007","49311 ","General Warehousing and Storage","25","0","0","30",
"Montana","2007","487210","Scenic and Sightseeing Transportation, Water","3","0","0","30",
"Montana","2007","4879  ","Scenic and Sightseeing Transportation, Other","4","0","468","30",
"Montana","2007","4931  ","Warehousing and Storage","37","0","0","30",
"Montana","2007","512220","Integrated Record Production/Distribution","1","0","0","30",
"Montana","2007","493110","General Warehousing and Storage","25","0","0","30",
"Montana","2007","49312 ","Refrigerated Warehousing and Storage","1","0","0","30",
"Montana","2007","51222 ","Integrated Record Production/Distribution","1","0","0","30",
"Montana","2007","51224 ","Sound Recording Studios","4","5","95","30",
"Montana","2007","51821 ","Data Processing, Hosting, and Related Services","58","914","39620","30",
"Montana","2007","512240","Sound Recording Studios","4","5","95","30",
"Montana","2007","518112","Web Search Portals","3","0","0","30",
"Montana","2007","5182  ","Data Processing, Hosting, and Related Services","58","914","39620","30",
"Montana","2007","523140","Commodity Contracts Brokerage","6","0","832","30",
"Montana","2007","518210","Data Processing, Hosting, and Related Services","58","914","39620","30",
"Montana","2007","523130","Commodity Contracts Dealing","3","0","0","30",
"Montana","2007","52314 ","Commodity Contracts Brokerage","6","0","832","30",
"Montana","2007","5413  ","Architectural, Engineering, and Related Services","680","4760","245384","30",
"Montana","2007","5232  ","Securities and Commodity Exchanges","1","0","0","30",
"Montana","2007","53131 ","Real Estate Property Managers","186","793","20271","30",
"Montana","2007","531311","Residential Property Managers","122","596","12142","30",
"Montana","2007","531312","Nonresidential Property Managers","64","197","8129","30",
"Montana","2007","53132 ","Offices of Real Estate Appraisers","108","0","5224","30",
"Montana","2007","54131 ","Architectural Services","157","965","46807","30",
"Montana","2007","541310","Architectural Services","157","965","46807","30",
"Montana","2007","541870","Advertising Material Distribution Services","3","0","0","30",
"Montana","2007","54132 ","Landscape Architectural Services","31","81","3631","30",
"Montana","2007","541320","Landscape Architectural Services","31","81","3631","30",
"Montana","2007","54187 ","Advertising Material Distribution Services","3","0","0","30",
"Montana","2007","54189 ","Other Services Related to Advertising","36","219","4453","30",
"Montana","2007","561613","Armored Car Services","11","173","4199","30",
"Montana","2007","541890","Other Services Related to Advertising","36","219","4453","30",
"Montana","2007","5419  ","Other Professional, Scientific, and Technical Services","343","1841","41007","30",
"Montana","2007","561612","Security Guards and Patrol Services","29","493","8635","30",
"Montana","2007","56162 ","Security Systems Services","35","251","8630","30",
"Montana","2007","561621","Security Systems Services (except Locksmiths)","22","200","7214","30",
"Montana","2007","6214  ","Outpatient Care Centers","134","2480","78055","30",
"Montana","2007","561622","Locksmiths","13","0","1416","30",
"Montana","2007","621391","Offices of Podiatrists","21","80","2587","30",
"Montana","2007","621399","Offices of All Other Miscellaneous Health Practitioners","79","185","5487","30",
"Montana","2007","621910","Ambulance Services","24","323","8720","30",
"Montana","2007","62141 ","Family Planning Centers","17","117","2703","30",
"Montana","2007","6219  ","Other Ambulatory Health Care Services","56","896","18030","30",
"Montana","2007","62191 ","Ambulance Services","24","323","8720","30",
"Montana","2007","62322 ","Residential Mental Health and Substance Abuse Facilities","37","794","18159","30",
"Montana","2007","62199 ","All Other Ambulatory Health Care Services","32","573","9310","30",
"Montana","2007","62321 ","Residential Mental Retardation Facilities","90","1492","25059","30",
"Montana","2007","623210","Residential Mental Retardation Facilities","90","1492","25059","30",
"Montana","2007","6243  ","Vocational Rehabilitation Services","66","1546","23502","30",
"Montana","2007","623220","Residential Mental Health and Substance Abuse Facilities","37","794","18159","30",
"Montana","2007","62423 ","Emergency and Other Relief Services","6","0","1002","30",
"Montana","2007","624230","Emergency and Other Relief Services","6","0","1002","30",
"Montana","2007","62431 ","Vocational Rehabilitation Services","66","1546","23502","30",
"Montana","2007","7115  ","Independent Artists, Writers, and Performers","88","138","2835","30",
"Montana","2007","624310","Vocational Rehabilitation Services","66","1546","23502","30",
"Montana","2007","71141 ","Agents and Managers for Artists, Athletes, Entertainers, and Other Public Figures","3","0","0","30",
"Montana","2007","711410","Agents and Managers for Artists, Athletes, Entertainers, and Other Public Figures","3","0","0","30",
"Montana","2007","713990","All Other Amusement and Recreation Industries","244","775","21007","30",
"Montana","2007","71151 ","Independent Artists, Writers, and Performers","88","138","2835","30",
"Montana","2007","713950","Bowling Centers","44","533","5593","30",
"Montana","2007","71399 ","All Other Amusement and Recreation Industries","244","775","21007","30",
"Montana","2007","72    ","Accommodation and Food Services","3364","45103","557021","30",
"Montana","2007","811111","General Automotive Repair","355","1197","32719","30",
"Montana","2007","811   ","Repair and Maintenance","1096","4707","122096","30",
"Montana","2007","8111  ","Automotive Repair and Maintenance","806","3654","91764","30",
"Montana","2007","81111 ","Automotive Mechanical and Electrical Repair and Maintenance","431","1489","40774","30",
"Montana","2007","812210","Funeral Homes and Funeral Services","56","292","8512","30",
"Montana","2007","812199","Other Personal Care Services","51","153","1452","30",
"Montana","2007","8122  ","Death Care Services","81","361","10171","30",
"Montana","2007","81221 ","Funeral Homes and Funeral Services","56","292","8512","30",
"Montana","2007","813990","Other Similar Organizations (except Business, Professional, Labor, and Political Organizations)","59","157","3009","30",
"Montana","2007","81222 ","Cemeteries and Crematories","25","69","1659","30",
"Montana","2007","813940","Political Organizations","15","0","0","30",
"Montana","2007","81399 ","Other Similar Organizations (except Business, Professional, Labor, and Political Organizations)","59","157","3009","30",
"Montana","2007","22121 ","Natural Gas Distribution","27","0","0","30",
"Montana","2007","99    ","Unclassified","41","0","1063","30",
"Montana","2007","113210","Forest Nurseries and Gathering of Forest Products","3","0","0","30",
"Montana","2007","1133  ","Logging","227","1102","36834","30",
"Montana","2007","11331 ","Logging","227","1102","36834","30",
"Montana","2007","113310","Logging","227","1102","36834","30",
"Montana","2007","114   ","Fishing, Hunting and Trapping","12","0","0","30",
"Montana","2007","221121","Electric Bulk Power Transmission and Control","2","0","0","30",
"Montana","2007","221122","Electric Power Distribution","113","2191","150099","30",
"Montana","2007","2212  ","Natural Gas Distribution","27","0","0","30",
"Montana","2007","23833 ","Flooring Contractors","97","258","6170","30",
"Montana","2007","23835 ","Finish Carpentry Contractors","206","426","12282","30",
"Montana","2007","238330","Flooring Contractors","97","258","6170","30",
"Montana","2007","23834 ","Tile and Terrazzo Contractors","89","288","7484","30",
"Montana","2007","238340","Tile and Terrazzo Contractors","89","288","7484","30",
"Montana","2007","31194 ","Seasoning and Dressing Manufacturing","1","0","0","30",
"Montana","2007","3119  ","Other Food Manufacturing","10","44","877","30",
"Montana","2007","31192 ","Coffee and Tea Manufacturing","3","0","0","30",
"Montana","2007","311920","Coffee and Tea Manufacturing","3","0","0","30",
"Montana","2007","331111","Iron and Steel Mills","4","59","2088","30",
"Montana","2007","332   ","Fabricated Metal Product Manufacturing","167","1566","54904","30",
"Montana","2007","3312  ","Steel Product Manufacturing from Purchased Steel","1","0","0","30",
"Montana","2007","33122 ","Rolling and Drawing of Purchased Steel","1","0","0","30",
"Montana","2007","331222","Steel Wire Drawing","1","0","0","30",
"Montana","2007","332510","Hardware Manufacturing","2","0","0","30",
"Montana","2007","3321  ","Forging and Stamping","2","0","0","30",
"Montana","2007","33211 ","Forging and Stamping","2","0","0","30",
"Montana","2007","332111","Iron and Steel Forging","2","0","0","30",
"Montana","2007","3326  ","Spring and Wire Product Manufacturing","1","0","0","30",
"Montana","2007","33321 ","Sawmill and Woodworking Machinery Manufacturing","1","0","0","30",
"Montana","2007","33261 ","Spring and Wire Product Manufacturing","1","0","0","30",
"Montana","2007","332618","Other Fabricated Wire Product Manufacturing","1","0","0","30",
"Montana","2007","3327  ","Machine Shops; Turned Product; and Screw, Nut, and Bolt Manufacturing","74","532","18026","30",
"Montana","2007","333210","Sawmill and Woodworking Machinery Manufacturing","1","0","0","30",
"Montana","2007","333993","Packaging Machinery Manufacturing","1","0","0","30",
"Montana","2007","33329 ","Other Industrial Machinery Manufacturing","6","0","0","30",
"Montana","2007","333292","Textile Machinery Manufacturing","1","0","0","30",
"Montana","2007","333293","Printing Machinery and Equipment Manufacturing","1","0","0","30",
"Montana","2007","3351  ","Electric Lighting Equipment Manufacturing","5","0","1100","30",
"Montana","2007","333994","Industrial Process Furnace and Oven Manufacturing","1","0","0","30",
"Montana","2007","333997","Scale and Balance (except Laboratory) Manufacturing","2","0","0","30",
"Montana","2007","333999","All Other Miscellaneous General Purpose Machinery Manufacturing","2","0","0","30",
"Montana","2007","336991","Motorcycle, Bicycle, and Parts Manufacturing","6","0","237","30",
"Montana","2007","33512 ","Lighting Fixture Manufacturing","5","0","1100","30",
"Montana","2007","335121","Residential Electric Lighting Fixture Manufacturing","5","0","1100","30",
"Montana","2007","3352  ","Household Appliance Manufacturing","1","0","0","30",
"Montana","2007","339992","Musical Instrument Manufacturing","3","0","0","30",
"Montana","2007","336612","Boat Building","4","9","181","30",
"Montana","2007","3369  ","Other Transportation Equipment Manufacturing","8","0","346","30",
"Montana","2007","33699 ","Other Transportation Equipment Manufacturing","8","0","346","30",
"Montana","2007","42361 ","Electrical Apparatus and Equipment, Wiring Supplies, and Related Equipment Merchant","35","259","14051","30",
"Montana","2007","339994","Broom, Brush, and Mop Manufacturing","1","0","0","30",
"Montana","2007","339999","All Other Miscellaneous Manufacturing","17","223","7269","30",
"Montana","2007","42    ","Wholesale Trade","1522","14092","556343","30",
"Montana","2007","424310","Piece Goods, Notions, and Other Dry Goods Merchant Wholesalers","5","0","117","30",
"Montana","2007","423610","Electrical Apparatus and Equipment, Wiring Supplies, and Related Equipment Merchant","35","259","14051","30",
"Montana","2007","42362 ","Electrical and Electronic Appliance, Television, and Radio Set Merchant Wholesalers","2","0","0","30",
"Montana","2007","424210","Drugs and Druggists' Sundries Merchant Wholesalers","17","284","13603","30",
"Montana","2007","4243  ","Apparel, Piece Goods, and Notions Merchant Wholesalers","27","337","10161","30",
"Montana","2007","42431 ","Piece Goods, Notions, and Other Dry Goods Merchant Wholesalers","5","0","117","30",
"Montana","2007","42493 ","Flower, Nursery Stock, and Florists' Supplies Merchant Wholesalers","6","40","455","30",
"Montana","2007","444220","Nursery, Garden Center, and Farm Supply Stores","130","1321","32611","30",
"Montana","2007","424930","Flower, Nursery Stock, and Florists' Supplies Merchant Wholesalers","6","40","455","30",
"Montana","2007","42494 ","Tobacco and Tobacco Product Merchant Wholesalers","8","0","0","30",
"Montana","2007","424940","Tobacco and Tobacco Product Merchant Wholesalers","8","0","0","30",
"Montana","2007","45431 ","Fuel Dealers","74","910","25960","30",
"Montana","2007","445   ","Food and Beverage Stores","440","8769","180534","30",
"Montana","2007","4451  ","Grocery Stores","266","7929","167437","30",
"Montana","2007","44511 ","Supermarkets and Other Grocery (except Convenience) Stores","236","7685","163358","30",
"Montana","2007","454311","Heating Oil Dealers","10","0","1081","30",
"Montana","2007","4841  ","General Freight Trucking","412","2591","97557","30",
"Montana","2007","454312","Liquefied Petroleum Gas (Bottled Gas) Dealers","59","858","24686","30",
"Montana","2007","454319","Other Fuel Dealers","5","0","193","30",
"Montana","2007","45439 ","Other Direct Selling Establishments","84","559","11667","30",
"Montana","2007","48411 ","General Freight Trucking, Local","123","505","15995","30",
"Montana","2007","48541 ","School and Employee Bus Transportation","61","963","14525","30",
"Montana","2007","484110","General Freight Trucking, Local","123","505","15995","30",
"Montana","2007","48412 ","General Freight Trucking, Long-Distance","289","2086","81562","30",
"Montana","2007","4854  ","School and Employee Bus Transportation","61","963","14525","30",
"Montana","2007","487990","Scenic and Sightseeing Transportation, Other","4","0","468","30",
"Montana","2007","485410","School and Employee Bus Transportation","61","963","14525","30",
"Montana","2007","4855  ","Charter Bus Industry","7","115","1630","30",
"Montana","2007","48799 ","Scenic and Sightseeing Transportation, Other","4","0","468","30",
"Montana","2007","49313 ","Farm Product Warehousing and Storage","5","0","0","30",
"Montana","2007","488   ","Support Activities for Transportation","192","1366","40975","30",
"Montana","2007","4881  ","Support Activities for Air Transportation","68","625","16536","30",
"Montana","2007","493120","Refrigerated Warehousing and Storage","1","0","0","30",
"Montana","2007","51229 ","Other Sound Recording Industries","1","0","0","30",
"Montana","2007","493130","Farm Product Warehousing and Storage","5","0","0","30",
"Montana","2007","49319 ","Other Warehousing and Storage","6","0","0","30",
"Montana","2007","493190","Other Warehousing and Storage","6","0","0","30",
"Montana","2007","512290","Other Sound Recording Industries","1","0","0","30",
"Montana","2007","515   ","Broadcasting (except Internet)","98","1409","45904","30",
"Montana","2007","5191  ","Other Information Services","5","0","0","30",
"Montana","2007","5151  ","Radio and Television Broadcasting","95","1272","40312","30",
"Montana","2007","51511 ","Radio Broadcasting","70","573","17692","30",
"Montana","2007","519   ","Other Information Services","5","0","0","30",
"Montana","2007","51911 ","News Syndicates","2","0","0","30",
"Montana","2007","523210","Securities and Commodity Exchanges","1","0","0","30",
"Montana","2007","519110","News Syndicates","2","0","0","30",
"Montana","2007","51912 ","Libraries and Archives","2","0","0","30",
"Montana","2007","52321 ","Securities and Commodity Exchanges","1","0","0","30",
"Montana","2007","531320","Offices of Real Estate Appraisers","108","0","5224","30",
"Montana","2007","5239  ","Other Financial Investment Activities","169","534","30717","30",
"Montana","2007","52391 ","Miscellaneous Intermediation","24","107","6369","30",
"Montana","2007","523910","Miscellaneous Intermediation","24","107","6369","30",
"Montana","2007","53139 ","Other Activities Related to Real Estate","60","91","3022","30",
"Montana","2007","541330","Engineering Services","309","2790","145704","30",
"Montana","2007","531390","Other Activities Related to Real Estate","60","91","3022","30",
"Montana","2007","532   ","Rental and Leasing Services","305","2067","45863","30",
"Montana","2007","54133 ","Engineering Services","309","2790","145704","30",
"Montana","2007","541910","Marketing Research and Public Opinion Polling","9","49","1825","30",
"Montana","2007","54134 ","Drafting Services","26","38","2119","30",
"Montana","2007","541340","Drafting Services","26","38","2119","30",
"Montana","2007","54191 ","Marketing Research and Public Opinion Polling","9","49","1825","30",
"Montana","2007","56171 ","Exterminating and Pest Control Services","21","58","2007","30",
"Montana","2007","54192 ","Photographic Services","75","156","3180","30",
"Montana","2007","541921","Photography Studios, Portrait","60","135","2250","30",
"Montana","2007","5617  ","Services to Buildings and Dwellings","852","3786","71257","30",
"Montana","2007","621999","All Other Miscellaneous Ambulatory Health Care Services","26","133","3837","30",
"Montana","2007","561710","Exterminating and Pest Control Services","21","58","2007","30",
"Montana","2007","56172 ","Janitorial Services","311","1962","22458","30",
"Montana","2007","621991","Blood and Organ Banks","6","0","0","30",
"Montana","2007","62331 ","Community Care Facilities for the Elderly","124","2445","41842","30",
"Montana","2007","622   ","Hospitals","64","20295","870470","30",
"Montana","2007","6221  ","General Medical and Surgical Hospitals","59","19366","832039","30",
"Montana","2007","6233  ","Community Care Facilities for the Elderly","124","2445","41842","30",
"Montana","2007","62441 ","Child Day Care Services","451","2848","31741","30",
"Montana","2007","623311","Continuing Care Retirement Communities","36","1140","20525","30",
"Montana","2007","623312","Homes for the Elderly","88","1305","21317","30",
"Montana","2007","6244  ","Child Day Care Services","451","2848","31741","30",
"Montana","2007","712   ","Museums, Historical Sites, and Similar Institutions","74","356","6298","30",
"Montana","2007","624410","Child Day Care Services","451","2848","31741","30",
"Montana","2007","71    ","Arts, Entertainment, and Recreation","1165","10710","159793","30",
"Montana","2007","711510","Independent Artists, Writers, and Performers","88","138","2835","30",
"Montana","2007","7121  ","Museums, Historical Sites, and Similar Institutions","74","356","6298","30",
"Montana","2007","72111 ","Hotels (except Casino Hotels) and Motels","504","8720","125953","30",
"Montana","2007","71211 ","Museums","53","265","4649","30",
"Montana","2007","721   ","Accommodation","702","9791","152690","30",
"Montana","2007","7211  ","Traveler Accommodation","564","9274","137119","30",
"Montana","2007","811118","Other Automotive Mechanical and Electrical Repair and Maintenance","36","122","3253","30",
"Montana","2007","721110","Hotels (except Casino Hotels) and Motels","504","8720","125953","30",
"Montana","2007","72112 ","Casino Hotels","6","389","7865","30",
"Montana","2007","811113","Automotive Transmission Repair","24","117","3558","30",
"Montana","2007","812220","Cemeteries and Crematories","25","69","1659","30",
"Montana","2007","81112 ","Automotive Body, Paint, Interior, and Glass Repair","232","1223","35605","30",
