"Maine","2005","45311 ","Florists","141","613","8024","23",
"Maine","2005","4532  ","Office Supplies, Stationery, and Gift Stores","336","1540","26438","23",
"Maine","2005","48321 ","Inland Water Transportation","5","0","0","23",
"Maine","2005","45321 ","Office Supplies and Stationery Stores","35","510","10925","23",
"Maine","2005","483114","Coastal and Great Lakes Passenger Transportation","7","0","0","23",
"Maine","2005","4832  ","Inland Water Transportation","5","0","0","23",
"Maine","2005","483212","Inland Water Passenger Transportation","5","0","0","23",
"Maine","2005","48799 ","Scenic and Sightseeing Transportation, Other","1","0","0","23",
"Maine","2005","484   ","Truck Transportation","795","6003","206117","23",
"Maine","2005","487210","Scenic and Sightseeing Transportation, Water","46","64","3315","23",
"Maine","2005","4879  ","Scenic and Sightseeing Transportation, Other","1","0","0","23",
"Maine","2005","487990","Scenic and Sightseeing Transportation, Other","1","0","0","23",
"Maine","2005","51121 ","Software Publishers","21","718","44300","23",
"Maine","2005","488   ","Support Activities for Transportation","176","1430","47991","23",
"Maine","2005","511199","All Other Publishers","13","0","0","23",
"Maine","2005","5112  ","Software Publishers","21","718","44300","23",
"Maine","2005","511210","Software Publishers","21","718","44300","23",
"Maine","2005","519190","All Other Information Services","3","0","0","23",
"Maine","2005","512   ","Motion Picture and Sound Recording Industries","93","507","9886","23",
"Maine","2005","519120","Libraries and Archives","93","414","6609","23",
"Maine","2005","51919 ","All Other Information Services","3","0","0","23",
"Maine","2005","52    ","Finance and Insurance","1921","29421","1293728","23",
"Maine","2005","525990","Other Financial Vehicles","4","0","0","23",
"Maine","2005","522   ","Credit Intermediation and Related Activities","879","13191","550766","23",
"Maine","2005","525930","Real Estate Investment Trusts","5","0","0","23",
"Maine","2005","52599 ","Other Financial Vehicles","4","0","0","23",
"Maine","2005","53    ","Real Estate and Rental and Leasing","1744","6807","205083","23",
"Maine","2005","541990","All Other Professional, Scientific, and Technical Services","65","0","0","23",
"Maine","2005","531   ","Real Estate","1404","4377","141786","23",
"Maine","2005","541940","Veterinary Services","165","1473","43642","23",
"Maine","2005","54199 ","All Other Professional, Scientific, and Technical Services","65","0","0","23",
"Maine","2005","55    ","Management of Companies and Enterprises","187","6067","389693","23",
"Maine","2005","56143 ","Business Service Centers","38","176","7738","23",
"Maine","2005","551   ","Management of Companies and Enterprises","187","6067","389693","23",
"Maine","2005","561421","Telephone Answering Services","12","89","1713","23",
"Maine","2005","561422","Telemarketing Bureaus","34","4606","142781","23",
"Maine","2005","561431","Private Mail Centers","21","77","1228","23",
"Maine","2005","561740","Carpet and Upholstery Cleaning Services","31","178","3918","23",
"Maine","2005","561439","Other Business Service Centers (including Copy Shops)","17","99","6510","23",
"Maine","2005","561730","Landscaping Services","573","1957","65623","23",
"Maine","2005","56174 ","Carpet and Upholstery Cleaning Services","31","178","3918","23",
"Maine","2005","56179 ","Other Services to Buildings and Dwellings","58","211","5885","23",
"Maine","2005","611310","Colleges, Universities, and Professional Schools","22","6638","185406","23",
"Maine","2005","611210","Junior Colleges","2","0","0","23",
"Maine","2005","6113  ","Colleges, Universities, and Professional Schools","22","6638","185406","23",
"Maine","2005","61131 ","Colleges, Universities, and Professional Schools","22","6638","185406","23",
"Maine","2005","621330","Offices of Mental Health Practitioners (except Physicians)","102","196","5709","23",
"Maine","2005","6114  ","Business Schools and Computer and Management Training","32","0","0","23",
"Maine","2005","621320","Offices of Optometrists","118","676","22097","23",
"Maine","2005","62133 ","Offices of Mental Health Practitioners (except Physicians)","102","196","5709","23",
"Maine","2005","62134 ","Offices of Physical, Occupational and Speech Therapists, and Audiologists","167","818","28994","23",
"Maine","2005","621340","Offices of Physical, Occupational and Speech Therapists, and Audiologists","167","818","28994","23",
"Maine","2005","62331 ","Community Care Facilities for the Elderly","163","5353","96092","23",
"Maine","2005","62322 ","Residential Mental Health and Substance Abuse Facilities","158","2333","58155","23",
"Maine","2005","623220","Residential Mental Health and Substance Abuse Facilities","158","2333","58155","23",
"Maine","2005","6233  ","Community Care Facilities for the Elderly","163","5353","96092","23",
"Maine","2005","711510","Independent Artists, Writers, and Performers","69","103","4079","23",
"Maine","2005","711410","Agents and Managers for Artists, Athletes, Entertainers, and Other Public Figures","8","0","0","23",
"Maine","2005","7115  ","Independent Artists, Writers, and Performers","69","103","4079","23",
"Maine","2005","71151 ","Independent Artists, Writers, and Performers","69","103","4079","23",
"Maine","2005","72231 ","Food Service Contractors","72","1158","15607","23",
"Maine","2005","722212","Cafeterias","13","144","2146","23",
"Maine","2005","722213","Snack and Nonalcoholic Beverage Bars","318","2719","35378","23",
"Maine","2005","7223  ","Special Food Services","139","1542","21895","23",
"Maine","2005","722310","Food Service Contractors","72","1158","15607","23",
"Maine","2005","812320","Drycleaning and Laundry Services (except Coin-Operated)","44","397","5703","23",
"Maine","2005","81231 ","Coin-Operated Laundries and Drycleaners","78","430","6560","23",
"Maine","2005","812310","Coin-Operated Laundries and Drycleaners","78","430","6560","23",
"Maine","2005","81232 ","Drycleaning and Laundry Services (except Coin-Operated)","44","397","5703","23",
"Maine","2005","23829 ","Other Building Equipment Contractors","33","447","17083","23",
"Maine","2005","212399","All Other Nonmetallic Mineral Mining","2","0","0","23",
"Maine","2005","213   ","Support Activities for Mining","1","0","0","23",
"Maine","2005","2131  ","Support Activities for Mining","1","0","0","23",
"Maine","2005","21311 ","Support Activities for Mining","1","0","0","23",
"Maine","2005","213114","Support Activities for Metal Mining","1","0","0","23",
"Maine","2005","238290","Other Building Equipment Contractors","33","447","17083","23",
"Maine","2005","2383  ","Building Finishing Contractors","757","2559","81665","23",
"Maine","2005","311999","All Other Miscellaneous Food Manufacturing","1","0","0","23",
"Maine","2005","23831 ","Drywall and Insulation Contractors","112","650","22634","23",
"Maine","2005","31199 ","All Other Food Manufacturing","7","0","0","23",
"Maine","2005","311991","Perishable Prepared Food Manufacturing","6","0","0","23",
"Maine","2005","3219  ","Other Wood Product Manufacturing","138","2732","74948","23",
"Maine","2005","312   ","Beverage and Tobacco Product Manufacturing","23","0","0","23",
"Maine","2005","3121  ","Beverage Manufacturing","23","0","0","23",
"Maine","2005","321219","Reconstituted Wood Product Manufacturing","6","496","22392","23",
"Maine","2005","32191 ","Millwork","50","720","20200","23",
"Maine","2005","32551 ","Paint and Coating Manufacturing","1","0","0","23",
"Maine","2005","321911","Wood Window and Door Manufacturing","6","265","8651","23",
"Maine","2005","321912","Cut Stock, Resawing Lumber, and Planing","23","376","9098","23",
"Maine","2005","3255  ","Paint, Coating, and Adhesive Manufacturing","2","0","0","23",
"Maine","2005","325510","Paint and Coating Manufacturing","1","0","0","23",
"Maine","2005","331491","Nonferrous Metal (except Copper and Aluminum) Rolling, Drawing, and Extruding","1","0","0","23",
"Maine","2005","32552 ","Adhesive Manufacturing","1","0","0","23",
"Maine","2005","3314  ","Nonferrous Metal (except Aluminum) Production and Processing","1","0","0","23",
"Maine","2005","33149 ","Nonferrous Metal (except Copper and Aluminum) Rolling, Drawing, Extruding, and Alloying","1","0","0","23",
"Maine","2005","333319","Other Commercial and Service Industry Machinery Manufacturing","4","0","0","23",
"Maine","2005","3315  ","Foundries","5","0","0","23",
"Maine","2005","33331 ","Commercial and Service Industry Machinery Manufacturing","5","0","0","23",
"Maine","2005","333313","Office Machinery Manufacturing","1","0","0","23",
"Maine","2005","335121","Residential Electric Lighting Fixture Manufacturing","2","0","0","23",
"Maine","2005","3334  ","Ventilation, Heating, Air-Conditioning, and Commercial Refrigeration Equipment Manufacturing","9","375","16181","23",
"Maine","2005","335110","Electric Lamp Bulb and Part Manufacturing","5","0","0","23",
"Maine","2005","33512 ","Lighting Fixture Manufacturing","2","0","0","23",
"Maine","2005","33991 ","Jewelry and Silverware Manufacturing","24","0","0","23",
"Maine","2005","3353  ","Electrical Equipment Manufacturing","6","0","0","23",
"Maine","2005","33531 ","Electrical Equipment Manufacturing","6","0","0","23",
"Maine","2005","3399  ","Other Miscellaneous Manufacturing","136","1489","49449","23",
"Maine","2005","339911","Jewelry (except Costume) Manufacturing","14","34","730","23",
"Maine","2005","339913","Jewelers' Material and Lapidary Work Manufacturing","3","0","0","23",
"Maine","2005","424820","Wine and Distilled Alcoholic Beverage Merchant Wholesalers","8","0","0","23",
"Maine","2005","339914","Costume Jewelry and Novelty Manufacturing","7","0","0","23",
"Maine","2005","424810","Beer and Ale Merchant Wholesalers","9","0","0","23",
"Maine","2005","42482 ","Wine and Distilled Alcoholic Beverage Merchant Wholesalers","8","0","0","23",
"Maine","2005","4249  ","Miscellaneous Nondurable Goods Merchant Wholesalers","111","904","29319","23",
"Maine","2005","441222","Boat Dealers","79","560","18132","23",
"Maine","2005","42491 ","Farm Supplies Merchant Wholesalers","18","96","3129","23",
"Maine","2005","44122 ","Motorcycle, Boat, and Other Motor Vehicle Dealers","163","1187","36104","23",
"Maine","2005","441221","Motorcycle Dealers","42","364","11034","23",
"Maine","2005","441229","All Other Motor Vehicle Dealers","42","263","6938","23",
"Maine","2005","4413  ","Automotive Parts, Accessories, and Tire Stores","330","2665","69490","23",
"Maine","2005","445   ","Food and Beverage Stores","900","18985","311633","23",
"Maine","2005","444210","Outdoor Power Equipment Stores","43","320","9973","23",
"Maine","2005","44422 ","Nursery, Garden Center, and Farm Supply Stores","85","562","13007","23",
"Maine","2005","444220","Nursery, Garden Center, and Farm Supply Stores","85","562","13007","23",
"Maine","2005","448130","Children's and Infants' Clothing Stores","24","0","0","23",
"Maine","2005","4451  ","Grocery Stores","704","18047","293700","23",
"Maine","2005","448120","Women's Clothing Stores","119","790","10800","23",
"Maine","2005","44813 ","Children's and Infants' Clothing Stores","24","0","0","23",
"Maine","2005","44814 ","Family Clothing Stores","131","3524","48761","23",
"Maine","2005","453220","Gift, Novelty, and Souvenir Stores","301","1030","15513","23",
"Maine","2005","448140","Family Clothing Stores","131","3524","48761","23",
"Maine","2005","453210","Office Supplies and Stationery Stores","35","510","10925","23",
"Maine","2005","45322 ","Gift, Novelty, and Souvenir Stores","301","1030","15513","23",
"Maine","2005","4533  ","Used Merchandise Stores","125","640","9508","23",
"Maine","2005","45331 ","Used Merchandise Stores","125","640","9508","23",
"Maine","2005","48412 ","General Freight Trucking, Long-Distance","224","2680","101737","23",
"Maine","2005","4841  ","General Freight Trucking","337","3531","133290","23",
"Maine","2005","48411 ","General Freight Trucking, Local","113","851","31553","23",
"Maine","2005","484110","General Freight Trucking, Local","113","851","31553","23",
"Maine","2005","484121","General Freight Trucking, Long-Distance, Truckload","196","2312","84262","23",
"Maine","2005","48819 ","Other Support Activities for Air Transportation","9","0","0","23",
"Maine","2005","4881  ","Support Activities for Air Transportation","18","396","13677","23",
"Maine","2005","48811 ","Airport Operations","9","0","0","23",
"Maine","2005","488119","Other Airport Operations","9","0","0","23",
"Maine","2005","512110","Motion Picture and Video Production","34","0","0","23",
"Maine","2005","488190","Other Support Activities for Air Transportation","9","0","0","23",
"Maine","2005","5121  ","Motion Picture and Video Industries","87","0","0","23",
"Maine","2005","51211 ","Motion Picture and Video Production","34","0","0","23",
"Maine","2005","51212 ","Motion Picture and Video Distribution","1","0","0","23",
"Maine","2005","522110","Commercial Banking","346","5540","229581","23",
"Maine","2005","512120","Motion Picture and Video Distribution","1","0","0","23",
"Maine","2005","5221  ","Depository Credit Intermediation","684","10430","396362","23",
"Maine","2005","52211 ","Commercial Banking","346","5540","229581","23",
"Maine","2005","52212 ","Savings Institutions","202","3019","110430","23",
"Maine","2005","531110","Lessors of Residential Buildings and Dwellings","238","683","15694","23",
"Maine","2005","522120","Savings Institutions","202","3019","110430","23",
"Maine","2005","5311  ","Lessors of Real Estate","478","1411","36558","23",
"Maine","2005","53111 ","Lessors of Residential Buildings and Dwellings","238","683","15694","23",
"Maine","2005","53112 ","Lessors of Nonresidential Buildings (except Miniwarehouses)","152","454","13776","23",
"Maine","2005","561450","Credit Bureaus","5","77","3954","23",
"Maine","2005","56144 ","Collection Agencies","16","181","5138","23",
"Maine","2005","561440","Collection Agencies","16","181","5138","23",
"Maine","2005","56145 ","Credit Bureaus","5","77","3954","23",
"Maine","2005","56149 ","Other Business Support Services","35","128","3901","23",
"Maine","2005","561910","Packaging and Labeling Services","5","27","273","23",
"Maine","2005","561790","Other Services to Buildings and Dwellings","58","211","5885","23",
"Maine","2005","5619  ","Other Support Services","171","1779","54260","23",
"Maine","2005","56191 ","Packaging and Labeling Services","5","27","273","23",
"Maine","2005","56192 ","Convention and Trade Show Organizers","15","160","9360","23",
"Maine","2005","611420","Computer Training","9","0","0","23",
"Maine","2005","61141 ","Business and Secretarial Schools","1","0","0","23",
"Maine","2005","611410","Business and Secretarial Schools","1","0","0","23",
"Maine","2005","61142 ","Computer Training","9","0","0","23",
"Maine","2005","61143 ","Professional and Management Development Training","22","0","0","23",
"Maine","2005","6214  ","Outpatient Care Centers","170","4361","162714","23",
"Maine","2005","62139 ","Offices of All Other Health Practitioners","115","415","15542","23",
"Maine","2005","621391","Offices of Podiatrists","46","180","6331","23",
"Maine","2005","621399","Offices of All Other Miscellaneous Health Practitioners","69","235","9211","23",
"Maine","2005","62399 ","Other Residential Care Facilities","113","1478","36598","23",
"Maine","2005","623311","Continuing Care Retirement Communities","28","2470","48272","23",
"Maine","2005","623312","Homes for the Elderly","135","2883","47820","23",
"Maine","2005","6239  ","Other Residential Care Facilities","113","1478","36598","23",
"Maine","2005","623990","Other Residential Care Facilities","113","1478","36598","23",
"Maine","2005","712110","Museums","72","360","9373","23",
"Maine","2005","712   ","Museums, Historical Sites, and Similar Institutions","98","512","14150","23",
"Maine","2005","7121  ","Museums, Historical Sites, and Similar Institutions","98","512","14150","23",
"Maine","2005","71211 ","Museums","72","360","9373","23",
"Maine","2005","71212 ","Historical Sites","11","0","0","23",
"Maine","2005","722330","Mobile Food Services","14","0","0","23",
"Maine","2005","72232 ","Caterers","53","0","0","23",
"Maine","2005","722320","Caterers","53","0","0","23",
"Maine","2005","72233 ","Mobile Food Services","14","0","0","23",
"Maine","2005","7224  ","Drinking Places (Alcoholic Beverages)","134","893","10772","23",
"Maine","2005","8129  ","Other Personal Services","145","676","12873","23",
"Maine","2005","81233 ","Linen and Uniform Supply","20","455","11684","23",
"Maine","2005","812331","Linen Supply","8","64","1259","23",
"Maine","2005","812332","Industrial Launderers","12","391","10425","23",
"Maine","2005","81291 ","Pet Care (except Veterinary) Services","84","313","4068","23",
"Maine","2005","238310","Drywall and Insulation Contractors","112","650","22634","23",
"Maine","2005","22    ","Utilities","109","2345","130042","23",
"Maine","2005","221   ","Utilities","109","2345","130042","23",
"Maine","2005","2211  ","Electric Power Generation, Transmission and Distribution","80","2148","121187","23",
"Maine","2005","22111 ","Electric Power Generation","41","474","31584","23",
"Maine","2005","221111","Hydroelectric Power Generation","26","139","7742","23",
"Maine","2005","23832 ","Painting and Wall Covering Contractors","244","757","21091","23",
"Maine","2005","238320","Painting and Wall Covering Contractors","244","757","21091","23",
"Maine","2005","23833 ","Flooring Contractors","98","313","9674","23",
"Maine","2005","312113","Ice Manufacturing","4","0","0","23",
"Maine","2005","238330","Flooring Contractors","98","313","9674","23",
"Maine","2005","31211 ","Soft Drink and Ice Manufacturing","10","0","0","23",
"Maine","2005","312112","Bottled Water Manufacturing","6","0","0","23",
"Maine","2005","31212 ","Breweries","9","0","0","23",
"Maine","2005","321920","Wood Container and Pallet Manufacturing","18","243","7241","23",
"Maine","2005","312120","Breweries","9","0","0","23",
"Maine","2005","321918","Other Millwork (including Flooring)","21","79","2451","23",
"Maine","2005","32192 ","Wood Container and Pallet Manufacturing","18","243","7241","23",
"Maine","2005","3256  ","Soap, Cleaning Compound, and Toilet Preparation Manufacturing","7","0","0","23",
"Maine","2005","32199 ","All Other Wood Product Manufacturing","70","1769","47507","23",
"Maine","2005","321991","Manufactured Home (Mobile Home) Manufacturing","2","0","0","23",
"Maine","2005","325520","Adhesive Manufacturing","1","0","0","23",
"Maine","2005","32561 ","Soap and Cleaning Compound Manufacturing","3","0","0","23",
"Maine","2005","325612","Polish and Other Sanitation Good Manufacturing","3","0","0","23",
"Maine","2005","331513","Steel Foundries (except Investment)","1","0","0","23",
"Maine","2005","32562 ","Toilet Preparation Manufacturing","4","0","0","23",
"Maine","2005","33151 ","Ferrous Metal Foundries","4","0","0","23",
"Maine","2005","331511","Iron Foundries","3","0","0","23",
"Maine","2005","33152 ","Nonferrous Metal Foundries","1","0","0","23",
"Maine","2005","333414","Heating Equipment (except Warm Air Furnaces) Manufacturing","4","0","0","23",
"Maine","2005","331524","Aluminum Foundries (except Die-Casting)","1","0","0","23",
"Maine","2005","33341 ","Ventilation, Heating, Air-Conditioning, and Commercial Refrigeration Equipment Manufacturing","9","375","16181","23",
"Maine","2005","333411","Air Purification Equipment Manufacturing","2","0","0","23",
"Maine","2005","3359  ","Other Electrical Equipment and Component Manufacturing","5","0","0","23",
"Maine","2005","333415","Air-Conditioning and Warm Air Heating Equipment and Commercial and Industrial Refrigeration Equipment Manufacturing","3","0","0","23",
"Maine","2005","335312","Motor and Generator Manufacturing","1","0","0","23",
"Maine","2005","335314","Relay and Industrial Control Manufacturing","5","0","0","23",
"Maine","2005","33993 ","Doll, Toy, and Game Manufacturing","10","0","0","23",
"Maine","2005","33593 ","Wiring Device Manufacturing","2","0","0","23",
"Maine","2005","33992 ","Sporting and Athletic Goods Manufacturing","10","76","4355","23",
"Maine","2005","339920","Sporting and Athletic Goods Manufacturing","10","76","4355","23",
"Maine","2005","339931","Doll and Stuffed Toy Manufacturing","2","0","0","23",
"Maine","2005","441320","Tire Dealers","72","703","20648","23",
"Maine","2005","44131 ","Automotive Parts and Accessories Stores","258","1962","48842","23",
"Maine","2005","441310","Automotive Parts and Accessories Stores","258","1962","48842","23",
"Maine","2005","44132 ","Tire Dealers","72","703","20648","23",
"Maine","2005","442   ","Furniture and Home Furnishings Stores","353","2300","54724","23",
"Maine","2005","445120","Convenience Stores","325","1886","23118","23",
"Maine","2005","44511 ","Supermarkets and Other Grocery (except Convenience) Stores","379","16161","270582","23",
"Maine","2005","445110","Supermarkets and Other Grocery (except Convenience) Stores","379","16161","270582","23",
"Maine","2005","44512 ","Convenience Stores","325","1886","23118","23",
"Maine","2005","44819 ","Other Clothing Stores","65","429","8305","23",
"Maine","2005","4452  ","Specialty Food Stores","153","687","13967","23",
"Maine","2005","44815 ","Clothing Accessories Stores","22","0","0","23",
"Maine","2005","448150","Clothing Accessories Stores","22","0","0","23",
"Maine","2005","448190","Other Clothing Stores","65","429","8305","23",
"Maine","2005","45391 ","Pet and Pet Supplies Stores","54","344","5250","23",
"Maine","2005","4482  ","Shoe Stores","112","742","15861","23",
"Maine","2005","453310","Used Merchandise Stores","125","640","9508","23",
"Maine","2005","4539  ","Other Miscellaneous Store Retailers","334","1628","39147","23",
"Maine","2005","453910","Pet and Pet Supplies Stores","54","344","5250","23",
"Maine","2005","45392 ","Art Dealers","55","77","2083","23",
"Maine","2005","484210","Used Household and Office Goods Moving","41","536","15851","23",
"Maine","2005","484122","General Freight Trucking, Long-Distance, Less Than Truckload","28","368","17475","23",
"Maine","2005","4842  ","Specialized Freight Trucking","458","2472","72827","23",
"Maine","2005","48421 ","Used Household and Office Goods Moving","41","536","15851","23",
"Maine","2005","488210","Support Activities for Rail Transportation","1","0","0","23",
"Maine","2005","48422 ","Specialized Freight (except Used Goods) Trucking, Local","301","1223","34255","23",
"Maine","2005","4882  ","Support Activities for Rail Transportation","1","0","0","23",
"Maine","2005","48821 ","Support Activities for Rail Transportation","1","0","0","23",
"Maine","2005","4883  ","Support Activities for Water Transportation","32","0","0","23",
"Maine","2005","51219 ","Postproduction Services and Other Motion Picture and Video Industries","6","0","0","23",
"Maine","2005","51213 ","Motion Picture and Video Exhibition","46","0","0","23",
"Maine","2005","512131","Motion Picture Theaters (except Drive-Ins)","42","0","0","23",
"Maine","2005","512132","Drive-In Motion Picture Theaters","4","0","0","23",
"Maine","2005","52221 ","Credit Card Issuing","4","0","0","23",
"Maine","2005","52213 ","Credit Unions","136","1871","56351","23",
"Maine","2005","522130","Credit Unions","136","1871","56351","23",
"Maine","2005","5222  ","Nondepository Credit Intermediation","128","859","61094","23",
"Maine","2005","522210","Credit Card Issuing","4","0","0","23",
"Maine","2005","53119 ","Lessors of Other Real Estate Property","36","0","0","23",
"Maine","2005","531120","Lessors of Nonresidential Buildings (except Miniwarehouses)","152","454","13776","23",
"Maine","2005","53113 ","Lessors of Miniwarehouses and Self-Storage Units","52","0","0","23",
"Maine","2005","531130","Lessors of Miniwarehouses and Self-Storage Units","52","0","0","23",
"Maine","2005","531190","Lessors of Other Real Estate Property","36","0","0","23",
"Maine","2005","562   ","Waste Management and Remediation Services","195","1982","64129","23",
"Maine","2005","561920","Convention and Trade Show Organizers","15","160","9360","23",
"Maine","2005","56199 ","All Other Support Services","151","1592","44627","23",
"Maine","2005","561990","All Other Support Services","151","1592","44627","23",
"Maine","2005","5621  ","Waste Collection","102","1234","37400","23",
"Maine","2005","611511","Cosmetology and Barber Schools","8","0","0","23",
"Maine","2005","611430","Professional and Management Development Training","22","0","0","23",
"Maine","2005","6115  ","Technical and Trade Schools","33","626","14934","23",
"Maine","2005","61151 ","Technical and Trade Schools","33","626","14934","23",
"Maine","2005","621420","Outpatient Mental Health and Substance Abuse Centers","77","1803","57542","23",
"Maine","2005","62141 ","Family Planning Centers","9","0","0","23",
"Maine","2005","621410","Family Planning Centers","9","0","0","23",
"Maine","2005","62142 ","Outpatient Mental Health and Substance Abuse Centers","77","1803","57542","23",
"Maine","2005","62149 ","Other Outpatient Care Centers","84","0","0","23",
"Maine","2005","624110","Child and Youth Services","72","1200","32250","23",
"Maine","2005","624   ","Social Assistance","1309","18201","353948","23",
"Maine","2005","6241  ","Individual and Family Services","546","11901","247600","23",
"Maine","2005","62411 ","Child and Youth Services","72","1200","32250","23",
"Maine","2005","62412 ","Services for the Elderly and Persons with Disabilities","185","6444","107389","23",
"Maine","2005","71219 ","Nature Parks and Other Similar Institutions","7","0","0","23",
"Maine","2005","712120","Historical Sites","11","0","0","23",
"Maine","2005","71213 ","Zoos and Botanical Gardens","8","53","2153","23",
"Maine","2005","712130","Zoos and Botanical Gardens","8","53","2153","23",
"Maine","2005","712190","Nature Parks and Other Similar Institutions","7","0","0","23",
"Maine","2005","72241 ","Drinking Places (Alcoholic Beverages)","134","893","10772","23",
