"Wyoming","2011","423710","Hardware merchant wholesalers","5","28","1170","56",
"Wyoming","2011","423720","Plumbing and heating equipment and supplies (hydronics) merchant wholesalers","18","73","3892","56",
"Wyoming","2011","42373 ","Warm air heating and air-conditioning equipment and supplies merchant wholesalers","4","0","1061","56",
"Wyoming","2011","423740","Refrigeration equipment and supplies merchant wholesalers","1","0","0","56",
"Wyoming","2011","423730","Warm air heating and air-conditioning equipment and supplies merchant wholesalers","4","0","1061","56",
"Wyoming","2011","4238  ","Machinery, equipment, and supplies merchant wholesalers","270","3312","218325","56",
"Wyoming","2011","42374 ","Refrigeration equipment and supplies merchant wholesalers","1","0","0","56",
"Wyoming","2011","42381 ","Construction and mining (except oil well) machinery and equipment merchant wholesalers","34","955","72369","56",
"Wyoming","2011","423810","Construction and mining (except oil well) machinery and equipment merchant wholesalers","34","955","72369","56",
"Wyoming","2011","42382 ","Farm and garden machinery and equipment merchant wholesalers","30","272","13177","56",
"Wyoming","2011","423820","Farm and garden machinery and equipment merchant wholesalers","30","272","13177","56",
"Wyoming","2011","42383 ","Industrial machinery and equipment merchant wholesalers","174","1853","123206","56",
"Wyoming","2011","423830","Industrial machinery and equipment merchant wholesalers","174","1853","123206","56",
"Wyoming","2011","42384 ","Industrial supplies merchant wholesalers","24","0","8329","56",
"Wyoming","2011","423840","Industrial supplies merchant wholesalers","24","0","8329","56",
"Wyoming","2011","42385 ","Service establishment equipment and supplies merchant wholesalers","5","0","0","56",
"Wyoming","2011","423850","Service establishment equipment and supplies merchant wholesalers","5","0","0","56",
"Wyoming","2011","42386 ","Transportation equipment and supplies (except motor vehicle) merchant wholesalers","3","0","0","56",
"Wyoming","2011","423860","Transportation equipment and supplies (except motor vehicle) merchant wholesalers","3","0","0","56",
"Wyoming","2011","4239  ","Miscellaneous durable goods merchant wholesalers","57","325","14850","56",
"Wyoming","2011","42391 ","Sporting and recreational goods and supplies merchant wholesalers","7","28","765","56",
"Wyoming","2011","423920","Toy and hobby goods and supplies merchant wholesalers","7","0","0","56",
"Wyoming","2011","423910","Sporting and recreational goods and supplies merchant wholesalers","7","28","765","56",
"Wyoming","2011","42392 ","Toy and hobby goods and supplies merchant wholesalers","7","0","0","56",
"Wyoming","2011","42393 ","Recyclable material merchant wholesalers","16","107","6777","56",
"Wyoming","2011","423930","Recyclable material merchant wholesalers","16","107","6777","56",
"Wyoming","2011","423940","Jewelry, watch, precious stone, and precious metal merchant wholesalers","4","0","0","56",
"Wyoming","2011","42394 ","Jewelry, watch, precious stone, and precious metal merchant wholesalers","4","0","0","56",
"Wyoming","2011","42399 ","Other miscellaneous durable goods merchant wholesalers","23","157","6365","56",
"Wyoming","2011","423990","Other miscellaneous durable goods merchant wholesalers","23","157","6365","56",
"Wyoming","2011","424   ","Merchant wholesalers, nondurable goods","239","2080","104184","56",
"Wyoming","2011","4245  ","Farm product raw material merchant wholesalers","11","46","2101","56",
"Wyoming","2011","4241  ","Paper and paper product merchant wholesalers","9","0","1464","56",
"Wyoming","2011","42411 ","Printing and writing paper merchant wholesalers","1","0","0","56",
"Wyoming","2011","424110","Printing and writing paper merchant wholesalers","1","0","0","56",
"Wyoming","2011","42412 ","Stationery and office supplies merchant wholesalers","7","0","1266","56",
"Wyoming","2011","424120","Stationery and office supplies merchant wholesalers","7","0","1266","56",
"Wyoming","2011","42413 ","Industrial and personal service paper merchant wholesalers","1","0","0","56",
"Wyoming","2011","424130","Industrial and personal service paper merchant wholesalers","1","0","0","56",
"Wyoming","2011","4242  ","Drugs and druggists' sundries merchant wholesalers","10","114","12196","56",
"Wyoming","2011","424210","Drugs and druggists' sundries merchant wholesalers","10","114","12196","56",
"Wyoming","2011","42421 ","Drugs and druggists' sundries merchant wholesalers","10","114","12196","56",
"Wyoming","2011","4243  ","Apparel, piece goods, and notions merchant wholesalers","6","0","305","56",
"Wyoming","2011","42431 ","Piece goods, notions, and other dry goods merchant wholesalers","2","0","0","56",
"Wyoming","2011","424310","Piece goods, notions, and other dry goods merchant wholesalers","2","0","0","56",
"Wyoming","2011","42433 ","Women's, children's, and infants' clothing and accessories merchant wholesalers","4","0","181","56",
"Wyoming","2011","424330","Women's, children's, and infants' clothing and accessories merchant wholesalers","4","0","181","56",
"Wyoming","2011","4244  ","Grocery and related product merchant wholesalers","60","609","21884","56",
"Wyoming","2011","42441 ","General line grocery merchant wholesalers","2","0","0","56",
"Wyoming","2011","424410","General line grocery merchant wholesalers","2","0","0","56",
"Wyoming","2011","42442 ","Packaged frozen food merchant wholesalers","1","0","0","56",
"Wyoming","2011","424420","Packaged frozen food merchant wholesalers","1","0","0","56",
"Wyoming","2011","42443 ","Dairy product (except dried or canned) merchant wholesalers","3","0","660","56",
"Wyoming","2011","424430","Dairy product (except dried or canned) merchant wholesalers","3","0","660","56",
"Wyoming","2011","42445 ","Confectionery merchant wholesalers","4","0","0","56",
"Wyoming","2011","42446 ","Fish and seafood merchant wholesalers","3","0","76","56",
"Wyoming","2011","424460","Fish and seafood merchant wholesalers","3","0","76","56",
"Wyoming","2011","424470","Meat and meat product merchant wholesalers","1","0","0","56",
"Wyoming","2011","42447 ","Meat and meat product merchant wholesalers","1","0","0","56",
"Wyoming","2011","42448 ","Fresh fruit and vegetable merchant wholesalers","4","0","0","56",
"Wyoming","2011","424480","Fresh fruit and vegetable merchant wholesalers","4","0","0","56",
"Wyoming","2011","42449 ","Other grocery and related products merchant wholesalers","42","543","19199","56",
"Wyoming","2011","424490","Other grocery and related products merchant wholesalers","42","543","19199","56",
"Wyoming","2011","42451 ","Grain and field bean merchant wholesalers","9","40","1882","56",
"Wyoming","2011","424510","Grain and field bean merchant wholesalers","9","40","1882","56",
"Wyoming","2011","42452 ","Livestock merchant wholesalers","2","0","0","56",
"Wyoming","2011","424520","Livestock merchant wholesalers","2","0","0","56",
"Wyoming","2011","424610","Plastics materials and basic forms and shapes merchant wholesalers","4","0","1643","56",
"Wyoming","2011","4246  ","Chemical and allied products merchant wholesalers","38","291","21466","56",
"Wyoming","2011","42461 ","Plastics materials and basic forms and shapes merchant wholesalers","4","0","1643","56",
"Wyoming","2011","42469 ","Other chemical and allied products merchant wholesalers","34","273","19823","56",
"Wyoming","2011","42471 ","Petroleum bulk stations and terminals","34","362","19658","56",
"Wyoming","2011","424810","Beer and ale merchant wholesalers","19","269","12798","56",
"Wyoming","2011","45113 ","Sewing, needlework, and piece goods stores","27","101","843","56",
"Wyoming","2011","4247  ","Petroleum and petroleum products merchant wholesalers","44","438","23164","56",
"Wyoming","2011","424710","Petroleum bulk stations and terminals","34","362","19658","56",
"Wyoming","2011","42472 ","Petroleum and petroleum products merchant wholesalers (except bulk stations and terminals)","10","76","3506","56",
"Wyoming","2011","424720","Petroleum and petroleum products merchant wholesalers (except bulk stations and terminals)","10","76","3506","56",
"Wyoming","2011","4248  ","Beer, wine, and distilled alcoholic beverage merchant wholesalers","20","307","14303","56",
"Wyoming","2011","42481 ","Beer and ale merchant wholesalers","19","269","12798","56",
"Wyoming","2011","42482 ","Wine and distilled alcoholic beverage merchant wholesalers","1","0","0","56",
"Wyoming","2011","424820","Wine and distilled alcoholic beverage merchant wholesalers","1","0","0","56",
"Wyoming","2011","4249  ","Miscellaneous nondurable goods merchant wholesalers","41","199","7301","56",
"Wyoming","2011","42491 ","Farm supplies merchant wholesalers","18","109","4844","56",
"Wyoming","2011","424910","Farm supplies merchant wholesalers","18","109","4844","56",
"Wyoming","2011","42492 ","Book, periodical, and newspaper merchant wholesalers","8","0","581","56",
"Wyoming","2011","424920","Book, periodical, and newspaper merchant wholesalers","8","0","581","56",
"Wyoming","2011","42493 ","Flower, nursery stock, and florists' supplies merchant wholesalers","4","0","0","56",
"Wyoming","2011","424930","Flower, nursery stock, and florists' supplies merchant wholesalers","4","0","0","56",
"Wyoming","2011","42494 ","Tobacco and tobacco product merchant wholesalers","2","0","0","56",
"Wyoming","2011","424940","Tobacco and tobacco product merchant wholesalers","2","0","0","56",
"Wyoming","2011","42495 ","Paint, varnish, and supplies merchant wholesalers","3","0","295","56",
"Wyoming","2011","424950","Paint, varnish, and supplies merchant wholesalers","3","0","295","56",
"Wyoming","2011","42499 ","Other miscellaneous nondurable goods merchant wholesalers","6","26","908","56",
"Wyoming","2011","424990","Other miscellaneous nondurable goods merchant wholesalers","6","26","908","56",
"Wyoming","2011","425   ","Wholesale electronic markets and agents and brokers","53","294","10050","56",
"Wyoming","2011","4251  ","Wholesale electronic markets and agents and brokers","53","294","10050","56",
"Wyoming","2011","42511 ","Business to business electronic markets","1","0","0","56",
"Wyoming","2011","425110","Business to business electronic markets","1","0","0","56",
"Wyoming","2011","42512 ","Wholesale trade agents and brokers","52","293","10014","56",
"Wyoming","2011","425120","Wholesale trade agents and brokers","52","293","10014","56",
"Wyoming","2011","44-45 ","Retail trade","2686","30100","767017","56",
"Wyoming","2011","441   ","Motor vehicle and parts dealers","369","4229","164676","56",
"Wyoming","2011","4411  ","Automobile dealers","138","2443","105372","56",
"Wyoming","2011","44111 ","New car dealers","72","2204","97644","56",
"Wyoming","2011","441110","New car dealers","72","2204","97644","56",
"Wyoming","2011","44112 ","Used car dealers","66","239","7728","56",
"Wyoming","2011","441120","Used car dealers","66","239","7728","56",
"Wyoming","2011","4412  ","Other motor vehicle dealers","67","420","15679","56",
"Wyoming","2011","441320","Tire dealers","65","611","21956","56",
"Wyoming","2011","44121 ","Recreational vehicle dealers","21","134","6300","56",
"Wyoming","2011","441210","Recreational vehicle dealers","21","134","6300","56",
"Wyoming","2011","44122 ","Motorcycle, boat, and other motor vehicle dealers","46","286","9379","56",
"Wyoming","2011","44211 ","Furniture stores","53","332","8714","56",
"Wyoming","2011","441221","Motorcycle, ATV, and personal watercraft dealers","29","213","7252","56",
"Wyoming","2011","441222","Boat dealers","5","19","714","56",
"Wyoming","2011","441229","All other motor vehicle dealers","12","0","1413","56",
"Wyoming","2011","4413  ","Automotive parts, accessories, and tire stores","164","1366","43625","56",
"Wyoming","2011","442210","Floor covering stores","42","201","7303","56",
"Wyoming","2011","44131 ","Automotive parts and accessories stores","99","755","21669","56",
"Wyoming","2011","441310","Automotive parts and accessories stores","99","755","21669","56",
"Wyoming","2011","44132 ","Tire dealers","65","611","21956","56",
"Wyoming","2011","442   ","Furniture and home furnishings stores","133","687","18737","56",
"Wyoming","2011","4421  ","Furniture stores","53","332","8714","56",
"Wyoming","2011","442110","Furniture stores","53","332","8714","56",
"Wyoming","2011","4422  ","Home furnishings stores","80","355","10023","56",
"Wyoming","2011","44221 ","Floor covering stores","42","201","7303","56",
"Wyoming","2011","44229 ","Other home furnishings stores","38","154","2720","56",
"Wyoming","2011","444   ","Building material and garden equipment and supplies dealers","253","2813","83905","56",
"Wyoming","2011","442291","Window treatment stores","7","0","390","56",
"Wyoming","2011","442299","All other home furnishings stores","31","141","2330","56",
"Wyoming","2011","443   ","Electronics and appliance stores","125","754","17758","56",
"Wyoming","2011","4431  ","Electronics and appliance stores","125","754","17758","56",
"Wyoming","2011","44311 ","Appliance, television, and other electronics stores","97","633","14955","56",
"Wyoming","2011","443111","Household appliance stores","19","108","2512","56",
"Wyoming","2011","443112","Radio, television, and other electronics stores","78","525","12443","56",
"Wyoming","2011","44312 ","Computer and software stores","26","0","2612","56",
"Wyoming","2011","443120","Computer and software stores","26","0","2612","56",
"Wyoming","2011","44313 ","Camera and photographic supplies stores","2","0","0","56",
"Wyoming","2011","443130","Camera and photographic supplies stores","2","0","0","56",
"Wyoming","2011","4441  ","Building material and supplies dealers","202","2394","73469","56",
"Wyoming","2011","44411 ","Home centers","10","0","0","56",
"Wyoming","2011","444110","Home centers","10","0","0","56",
"Wyoming","2011","445   ","Food and beverage stores","271","5393","109976","56",
"Wyoming","2011","44412 ","Paint and wallpaper stores","12","0","1532","56",
"Wyoming","2011","444120","Paint and wallpaper stores","12","0","1532","56",
"Wyoming","2011","44413 ","Hardware stores","66","590","15647","56",
"Wyoming","2011","444130","Hardware stores","66","590","15647","56",
"Wyoming","2011","44419 ","Other building material dealers","114","854","33437","56",
"Wyoming","2011","444190","Other building material dealers","114","854","33437","56",
"Wyoming","2011","4442  ","Lawn and garden equipment and supplies stores","51","419","10436","56",
"Wyoming","2011","44421 ","Outdoor power equipment stores","4","0","0","56",
"Wyoming","2011","444210","Outdoor power equipment stores","4","0","0","56",
"Wyoming","2011","44521 ","Meat markets","14","0","1230","56",
"Wyoming","2011","44422 ","Nursery, garden center, and farm supply stores","47","394","9286","56",
"Wyoming","2011","444220","Nursery, garden center, and farm supply stores","47","394","9286","56",
"Wyoming","2011","4451  ","Grocery stores","122","4445","95197","56",
"Wyoming","2011","44511 ","Supermarkets and other grocery (except convenience) stores","101","4372","94236","56",
"Wyoming","2011","445110","Supermarkets and other grocery (except convenience) stores","101","4372","94236","56",
"Wyoming","2011","44512 ","Convenience stores","21","73","961","56",
"Wyoming","2011","445120","Convenience stores","21","73","961","56",
"Wyoming","2011","4452  ","Specialty food stores","37","180","2882","56",
"Wyoming","2011","445210","Meat markets","14","0","1230","56",
"Wyoming","2011","446110","Pharmacies and drug stores","57","581","21122","56",
"Wyoming","2011","44523 ","Fruit and vegetable markets","2","0","0","56",
"Wyoming","2011","445230","Fruit and vegetable markets","2","0","0","56",
"Wyoming","2011","44529 ","Other specialty food stores","21","120","1642","56",
"Wyoming","2011","445291","Baked goods stores","5","12","305","56",
"Wyoming","2011","445292","Confectionery and nut stores","5","0","0","56",
"Wyoming","2011","44619 ","Other health and personal care stores","41","136","4196","56",
"Wyoming","2011","445299","All other specialty food stores","11","88","947","56",
"Wyoming","2011","4453  ","Beer, wine, and liquor stores","112","768","11897","56",
"Wyoming","2011","44531 ","Beer, wine, and liquor stores","112","768","11897","56",
"Wyoming","2011","445310","Beer, wine, and liquor stores","112","768","11897","56",
"Wyoming","2011","446   ","Health and personal care stores","131","866","28439","56",
"Wyoming","2011","4461  ","Health and personal care stores","131","866","28439","56",
"Wyoming","2011","44611 ","Pharmacies and drug stores","57","581","21122","56",
"Wyoming","2011","447110","Gasoline stations with convenience stores","252","1982","39110","56",
"Wyoming","2011","44612 ","Cosmetics, beauty supplies, and perfume stores","16","68","993","56",
"Wyoming","2011","446120","Cosmetics, beauty supplies, and perfume stores","16","68","993","56",
"Wyoming","2011","44613 ","Optical goods stores","17","81","2128","56",
"Wyoming","2011","448   ","Clothing and clothing accessories stores","260","1609","28902","56",
"Wyoming","2011","446130","Optical goods stores","17","81","2128","56",
"Wyoming","2011","446191","Food (health) supplement stores","25","76","1767","56",
"Wyoming","2011","446199","All other health and personal care stores","16","60","2429","56",
"Wyoming","2011","447   ","Gasoline stations","342","3506","76215","56",
"Wyoming","2011","4471  ","Gasoline stations","342","3506","76215","56",
"Wyoming","2011","44813 ","Children's and infants' clothing stores","8","29","269","56",
"Wyoming","2011","44711 ","Gasoline stations with convenience stores","252","1982","39110","56",
"Wyoming","2011","44719 ","Other gasoline stations","90","1524","37105","56",
"Wyoming","2011","447190","Other gasoline stations","90","1524","37105","56",
"Wyoming","2011","4481  ","Clothing stores","180","1208","20186","56",
"Wyoming","2011","44811 ","Men's clothing stores","10","0","0","56",
"Wyoming","2011","448110","Men's clothing stores","10","0","0","56",
"Wyoming","2011","44812 ","Women's clothing stores","63","380","4601","56",
"Wyoming","2011","448120","Women's clothing stores","63","380","4601","56",
"Wyoming","2011","448130","Children's and infants' clothing stores","8","29","269","56",
"Wyoming","2011","44814 ","Family clothing stores","59","602","10287","56",
"Wyoming","2011","448140","Family clothing stores","59","602","10287","56",
"Wyoming","2011","44815 ","Clothing accessories stores","11","29","338","56",
"Wyoming","2011","448150","Clothing accessories stores","11","29","338","56",
"Wyoming","2011","44819 ","Other clothing stores","29","125","3035","56",
"Wyoming","2011","448190","Other clothing stores","29","125","3035","56",
"Wyoming","2011","4482  ","Shoe stores","34","176","2755","56",
"Wyoming","2011","451120","Hobby, toy, and game stores","17","124","1991","56",
"Wyoming","2011","44821 ","Shoe stores","34","176","2755","56",
"Wyoming","2011","448210","Shoe stores","34","176","2755","56",
"Wyoming","2011","4483  ","Jewelry, luggage, and leather goods stores","46","225","5961","56",
"Wyoming","2011","44831 ","Jewelry stores","46","225","5961","56",
"Wyoming","2011","448310","Jewelry stores","46","225","5961","56",
"Wyoming","2011","451   ","Sporting goods, hobby, book, and music stores","199","1318","22822","56",
"Wyoming","2011","4511  ","Sporting goods, hobby, and musical instrument stores","150","1007","18327","56",
"Wyoming","2011","45111 ","Sporting goods stores","100","755","15028","56",
"Wyoming","2011","451110","Sporting goods stores","100","755","15028","56",
"Wyoming","2011","45112 ","Hobby, toy, and game stores","17","124","1991","56",
"Wyoming","2011","45114 ","Musical instrument and supplies stores","6","0","465","56",
"Wyoming","2011","4529  ","Other general merchandise stores","78","0","0","56",
"Wyoming","2011","5111  ","Newspaper, periodical, book, and directory publishers","56","1051","30043","56",
"Wyoming","2011","451130","Sewing, needlework, and piece goods stores","27","101","843","56",
"Wyoming","2011","451140","Musical instrument and supplies stores","6","0","465","56",
"Wyoming","2011","452990","All other general merchandise stores","66","0","14517","56",
"Wyoming","2011","4512  ","Book, periodical, and music stores","49","311","4495","56",
"Wyoming","2011","45121 ","Book stores and news dealers","40","184","2853","56",
"Wyoming","2011","451211","Book stores","39","179","2817","56",
"Wyoming","2011","451212","News dealers and newsstands","1","0","0","56",
"Wyoming","2011","45122 ","Prerecorded tape, compact disc, and record stores","9","127","1642","56",
"Wyoming","2011","451220","Prerecorded tape, compact disc, and record stores","9","127","1642","56",
"Wyoming","2011","452   ","General merchandise stores","98","0","0","56",
"Wyoming","2011","4532  ","Office supplies, stationery, and gift stores","102","526","10596","56",
"Wyoming","2011","4521  ","Department stores","20","0","27171","56",
"Wyoming","2011","45211 ","Department stores","20","0","27171","56",
"Wyoming","2011","452111","Department stores (except discount department stores)","7","475","9060","56",
"Wyoming","2011","452112","Discount department stores","13","0","0","56",
"Wyoming","2011","453210","Office supplies and stationery stores","33","252","6144","56",
"Wyoming","2011","45291 ","Warehouse clubs and supercenters","12","0","0","56",
"Wyoming","2011","452910","Warehouse clubs and supercenters","12","0","0","56",
"Wyoming","2011","45299 ","All other general merchandise stores","66","0","14517","56",
"Wyoming","2011","453220","Gift, novelty, and souvenir stores","69","274","4452","56",
"Wyoming","2011","453   ","Miscellaneous store retailers","350","1474","28667","56",
"Wyoming","2011","4531  ","Florists","55","201","3158","56",
"Wyoming","2011","45311 ","Florists","55","201","3158","56",
"Wyoming","2011","453110","Florists","55","201","3158","56",
"Wyoming","2011","45391 ","Pet and pet supplies stores","17","130","1780","56",
"Wyoming","2011","45321 ","Office supplies and stationery stores","33","252","6144","56",
"Wyoming","2011","45322 ","Gift, novelty, and souvenir stores","69","274","4452","56",
"Wyoming","2011","4533  ","Used merchandise stores","58","293","4257","56",
"Wyoming","2011","45331 ","Used merchandise stores","58","293","4257","56",
"Wyoming","2011","453310","Used merchandise stores","58","293","4257","56",
"Wyoming","2011","4539  ","Other miscellaneous store retailers","135","454","10656","56",
"Wyoming","2011","453910","Pet and pet supplies stores","17","130","1780","56",
"Wyoming","2011","45392 ","Art dealers","34","77","2908","56",
"Wyoming","2011","453920","Art dealers","34","77","2908","56",
"Wyoming","2011","45393 ","Manufactured (mobile) home dealers","12","30","1106","56",
"Wyoming","2011","453930","Manufactured (mobile) home dealers","12","30","1106","56",
"Wyoming","2011","45399 ","All other miscellaneous store retailers","72","217","4862","56",
"Wyoming","2011","453991","Tobacco stores","23","0","1426","56",
"Wyoming","2011","453998","All other miscellaneous store retailers (except tobacco stores)","49","0","3436","56",
"Wyoming","2011","454312","Liquefied petroleum gas (bottled gas) dealers","38","0","10686","56",
"Wyoming","2011","454   ","Nonstore retailers","155","1237","44406","56",
"Wyoming","2011","4541  ","Electronic shopping and mail-order houses","32","656","24015","56",
"Wyoming","2011","45411 ","Electronic shopping and mail-order houses","32","656","24015","56",
"Wyoming","2011","454111","Electronic shopping","22","49","1490","56",
"Wyoming","2011","454113","Mail-order houses","10","607","22525","56",
"Wyoming","2011","4542  ","Vending machine operators","7","24","472","56",
"Wyoming","2011","45421 ","Vending machine operators","7","24","472","56",
"Wyoming","2011","454210","Vending machine operators","7","24","472","56",
"Wyoming","2011","4812  ","Nonscheduled air transportation","11","124","8028","56",
"Wyoming","2011","4543  ","Direct selling establishments","116","557","19919","56",
"Wyoming","2011","48121 ","Nonscheduled air transportation","11","124","8028","56",
"Wyoming","2011","45431 ","Fuel dealers","41","266","11628","56",
"Wyoming","2011","454311","Heating oil dealers","2","0","0","56",
"Wyoming","2011","481219","Other nonscheduled air transportation","1","0","0","56",
"Wyoming","2011","454319","Other fuel dealers","1","0","0","56",
"Wyoming","2011","4841  ","General freight trucking","314","2608","115662","56",
"Wyoming","2011","45439 ","Other direct selling establishments","75","291","8291","56",
"Wyoming","2011","454390","Other direct selling establishments","75","291","8291","56",
"Wyoming","2011","484110","General freight trucking, local","128","449","18797","56",
"Wyoming","2011","48-49 ","Transportation and warehousing","949","10111","510387","56",
"Wyoming","2011","48412 ","General freight trucking, long-distance","186","2159","96865","56",
"Wyoming","2011","481   ","Air transportation","27","0","29445","56",
"Wyoming","2011","4811  ","Scheduled air transportation","16","0","0","56",
"Wyoming","2011","484122","General freight trucking, long-distance, less than truckload","48","329","17456","56",
"Wyoming","2011","48111 ","Scheduled air transportation","16","0","0","56",
"Wyoming","2011","481111","Scheduled passenger air transportation","15","0","0","56",
"Wyoming","2011","481112","Scheduled freight air transportation","1","0","0","56",
"Wyoming","2011","481211","Nonscheduled chartered passenger air transportation","8","97","6478","56",
"Wyoming","2011","481212","Nonscheduled chartered freight air transportation","2","0","0","56",
"Wyoming","2011","484   ","Truck transportation","626","5374","265572","56",
"Wyoming","2011","484220","Specialized freight (except used goods) trucking, local","213","1707","100873","56",
"Wyoming","2011","48411 ","General freight trucking, local","128","449","18797","56",
"Wyoming","2011","484121","General freight trucking, long-distance, truckload","138","1830","79409","56",
