"GEO_TTL","YEAR","NAICS2002","NAICS2002_TTL","ESTAB","EMP","PAYANN","state",
"New Mexico","2006","212111","Bituminous Coal and Lignite Surface Mining","7","0","0","35",
"New Mexico","2006","212112","Bituminous Coal Underground Mining","1","0","0","35",
"New Mexico","2006","2122  ","Metal Ore Mining","7","0","0","35",
"New Mexico","2006","21222 ","Gold Ore and Silver Ore Mining","1","0","0","35",
"New Mexico","2006","212221","Gold Ore Mining","1","0","0","35",
"New Mexico","2006","2379  ","Other Heavy and Civil Engineering Construction","23","397","19576","35",
"New Mexico","2006","23799 ","Other Heavy and Civil Engineering Construction","23","397","19576","35",
"New Mexico","2006","237990","Other Heavy and Civil Engineering Construction","23","397","19576","35",
"New Mexico","2006","3115  ","Dairy Product Manufacturing","10","1182","47618","35",
"New Mexico","2006","238   ","Specialty Trade Contractors","3186","31878","993968","35",
"New Mexico","2006","311422","Specialty Canning","3","0","0","35",
"New Mexico","2006","311423","Dried and Dehydrated Food Manufacturing","9","0","0","35",
"New Mexico","2006","31151 ","Dairy Product (except Frozen) Manufacturing","10","1182","47618","35",
"New Mexico","2006","315232","Women's and Girls' Cut and Sew Blouse and Shirt Manufacturing","1","0","0","35",
"New Mexico","2006","311511","Fluid Milk Manufacturing","2","0","0","35",
"New Mexico","2006","315228","Men's and Boys' Cut and Sew Other Outerwear Manufacturing","1","0","0","35",
"New Mexico","2006","31523 ","Women's and Girls' Cut and Sew Apparel Manufacturing","3","0","0","35",
"New Mexico","2006","32412 ","Asphalt Paving, Roofing, and Saturated Materials Manufacturing","10","0","0","35",
"New Mexico","2006","315233","Women's and Girls' Cut and Sew Dress Manufacturing","1","0","0","35",
"New Mexico","2006","32411 ","Petroleum Refineries","3","0","0","35",
"New Mexico","2006","324110","Petroleum Refineries","3","0","0","35",
"New Mexico","2006","324121","Asphalt Paving Mixture and Block Manufacturing","10","0","0","35",
"New Mexico","2006","3272  ","Glass and Glass Product Manufacturing","16","341","11294","35",
"New Mexico","2006","32419 ","Other Petroleum and Coal Products Manufacturing","3","0","0","35",
"New Mexico","2006","327123","Other Structural Clay Product Manufacturing","4","0","0","35",
"New Mexico","2006","327125","Nonclay Refractory Manufacturing","1","0","0","35",
"New Mexico","2006","32721 ","Glass and Glass Product Manufacturing","16","341","11294","35",
"New Mexico","2006","332410","Power Boiler and Heat Exchanger Manufacturing","1","0","0","35",
"New Mexico","2006","327212","Other Pressed and Blown Glass and Glassware Manufacturing","3","0","0","35",
"New Mexico","2006","3324  ","Boiler, Tank, and Shipping Container Manufacturing","11","398","13719","35",
"New Mexico","2006","33241 ","Power Boiler and Heat Exchanger Manufacturing","1","0","0","35",
"New Mexico","2006","33261 ","Spring and Wire Product Manufacturing","1","0","0","35",
"New Mexico","2006","33242 ","Metal Tank (Heavy Gauge) Manufacturing","8","0","0","35",
"New Mexico","2006","332510","Hardware Manufacturing","4","0","0","35",
"New Mexico","2006","3326  ","Spring and Wire Product Manufacturing","1","0","0","35",
"New Mexico","2006","332710","Machine Shops","83","0","0","35",
"New Mexico","2006","332618","Other Fabricated Wire Product Manufacturing","1","0","0","35",
"New Mexico","2006","3327  ","Machine Shops; Turned Product; and Screw, Nut, and Bolt Manufacturing","87","910","33684","35",
"New Mexico","2006","33271 ","Machine Shops","83","0","0","35",
"New Mexico","2006","33272 ","Turned Product and Screw, Nut, and Bolt Manufacturing","4","0","0","35",
"New Mexico","2006","33299 ","All Other Fabricated Metal Product Manufacturing","12","0","0","35",
"New Mexico","2006","332721","Precision Turned Product Manufacturing","3","0","0","35",
"New Mexico","2006","332911","Industrial Valve Manufacturing","1","0","0","35",
"New Mexico","2006","332912","Fluid Power Valve and Hose Fitting Manufacturing","1","0","0","35",
"New Mexico","2006","332994","Small Arms Manufacturing","1","0","0","35",
"New Mexico","2006","333293","Printing Machinery and Equipment Manufacturing","4","47","1995","35",
"New Mexico","2006","332995","Other Ordnance and Accessories Manufacturing","1","0","0","35",
"New Mexico","2006","333220","Plastics and Rubber Industry Machinery Manufacturing","1","0","0","35",
"New Mexico","2006","33329 ","Other Industrial Machinery Manufacturing","12","0","0","35",
"New Mexico","2006","333294","Food Product Machinery Manufacturing","1","0","0","35",
"New Mexico","2006","3344  ","Semiconductor and Other Electronic Component Manufacturing","31","6338","343412","35",
"New Mexico","2006","333518","Other Metalworking Machinery Manufacturing","1","0","0","35",
"New Mexico","2006","3336  ","Engine, Turbine, and Power Transmission Equipment Manufacturing","2","0","0","35",
"New Mexico","2006","33361 ","Engine, Turbine, and Power Transmission Equipment Manufacturing","2","0","0","35",
"New Mexico","2006","333618","Other Engine Equipment Manufacturing","2","0","0","35",
"New Mexico","2006","334310","Audio and Video Equipment Manufacturing","5","0","0","35",
"New Mexico","2006","33441 ","Semiconductor and Other Electronic Component Manufacturing","31","6338","343412","35",
"New Mexico","2006","335312","Motor and Generator Manufacturing","5","0","0","35",
"New Mexico","2006","334412","Bare Printed Circuit Board Manufacturing","6","261","12732","35",
"New Mexico","2006","3353  ","Electrical Equipment Manufacturing","8","0","0","35",
"New Mexico","2006","33531 ","Electrical Equipment Manufacturing","8","0","0","35",
"New Mexico","2006","335313","Switchgear and Switchboard Apparatus Manufacturing","2","0","0","35",
"New Mexico","2006","336411","Aircraft Manufacturing","3","0","0","35",
"New Mexico","2006","336399","All Other Motor Vehicle Parts Manufacturing","3","0","0","35",
"New Mexico","2006","3364  ","Aerospace Product and Parts Manufacturing","10","1203","96942","35",
"New Mexico","2006","33641 ","Aerospace Product and Parts Manufacturing","10","1203","96942","35",
"New Mexico","2006","3399  ","Other Miscellaneous Manufacturing","177","0","0","35",
"New Mexico","2006","339114","Dental Equipment and Supplies Manufacturing","6","0","0","35",
"New Mexico","2006","339115","Ophthalmic Goods Manufacturing","2","0","0","35",
"New Mexico","2006","339116","Dental Laboratories","39","0","0","35",
"New Mexico","2006","4234  ","Professional and Commercial Equipment and Supplies Merchant Wholesalers","172","1667","79861","35",
"New Mexico","2006","423330","Roofing, Siding, and Insulation Material Merchant Wholesalers","10","75","3891","35",
"New Mexico","2006","42339 ","Other Construction Material Merchant Wholesalers","23","226","7196","35",
"New Mexico","2006","423390","Other Construction Material Merchant Wholesalers","23","226","7196","35",
"New Mexico","2006","42384 ","Industrial Supplies Merchant Wholesalers","54","389","15168","35",
"New Mexico","2006","423820","Farm and Garden Machinery and Equipment Merchant Wholesalers","43","340","10820","35",
"New Mexico","2006","42383 ","Industrial Machinery and Equipment Merchant Wholesalers","169","1852","85975","35",
"New Mexico","2006","423830","Industrial Machinery and Equipment Merchant Wholesalers","169","1852","85975","35",
"New Mexico","2006","42447 ","Meat and Meat Product Merchant Wholesalers","14","104","2108","35",
"New Mexico","2006","424450","Confectionery Merchant Wholesalers","11","0","0","35",
"New Mexico","2006","42446 ","Fish and Seafood Merchant Wholesalers","4","25","450","35",
"New Mexico","2006","424460","Fish and Seafood Merchant Wholesalers","4","25","450","35",
"New Mexico","2006","441210","Recreational Vehicle Dealers","32","439","16029","35",
"New Mexico","2006","441120","Used Car Dealers","180","1086","34303","35",
"New Mexico","2006","4412  ","Other Motor Vehicle Dealers","105","1152","37815","35",
"New Mexico","2006","44121 ","Recreational Vehicle Dealers","32","439","16029","35",
"New Mexico","2006","44611 ","Pharmacies and Drug Stores","166","4418","106964","35",
"New Mexico","2006","44122 ","Motorcycle, Boat, and Other Motor Vehicle Dealers","73","713","21786","35",
"New Mexico","2006","446   ","Health and Personal Care Stores","426","5825","139150","35",
"New Mexico","2006","4461  ","Health and Personal Care Stores","426","5825","139150","35",
"New Mexico","2006","446110","Pharmacies and Drug Stores","166","4418","106964","35",
"New Mexico","2006","44612 ","Cosmetics, Beauty Supplies, and Perfume Stores","58","272","3936","35",
"New Mexico","2006","45331 ","Used Merchandise Stores","124","977","18406","35",
"New Mexico","2006","45322 ","Gift, Novelty, and Souvenir Stores","259","1200","20646","35",
"New Mexico","2006","453220","Gift, Novelty, and Souvenir Stores","259","1200","20646","35",
"New Mexico","2006","4533  ","Used Merchandise Stores","124","977","18406","35",
"New Mexico","2006","453310","Used Merchandise Stores","124","977","18406","35",
"New Mexico","2006","485999","All Other Transit and Ground Passenger Transportation","8","78","838","35",
"New Mexico","2006","4859  ","Other Transit and Ground Passenger Transportation","22","607","10107","35",
"New Mexico","2006","48599 ","Other Transit and Ground Passenger Transportation","22","607","10107","35",
"New Mexico","2006","485991","Special Needs Transportation","14","529","9269","35",
"New Mexico","2006","486   ","Pipeline Transportation","59","630","51071","35",
"New Mexico","2006","48691 ","Pipeline Transportation of Refined Petroleum Products","11","0","0","35",
"New Mexico","2006","48621 ","Pipeline Transportation of Natural Gas","36","283","23370","35",
"New Mexico","2006","486210","Pipeline Transportation of Natural Gas","36","283","23370","35",
"New Mexico","2006","4869  ","Other Pipeline Transportation","11","0","0","35",
"New Mexico","2006","486910","Pipeline Transportation of Refined Petroleum Products","11","0","0","35",
"New Mexico","2006","487110","Scenic and Sightseeing Transportation, Land","4","0","0","35",
"New Mexico","2006","487   ","Scenic and Sightseeing Transportation","5","0","0","35",
"New Mexico","2006","4871  ","Scenic and Sightseeing Transportation, Land","4","0","0","35",
"New Mexico","2006","48711 ","Scenic and Sightseeing Transportation, Land","4","0","0","35",
"New Mexico","2006","488210","Support Activities for Rail Transportation","2","0","0","35",
"New Mexico","2006","488190","Other Support Activities for Air Transportation","27","414","13447","35",
"New Mexico","2006","4882  ","Support Activities for Rail Transportation","2","0","0","35",
"New Mexico","2006","48821 ","Support Activities for Rail Transportation","2","0","0","35",
"New Mexico","2006","4883  ","Support Activities for Water Transportation","1","0","0","35",
"New Mexico","2006","492110","Couriers","67","1946","72303","35",
"New Mexico","2006","492   ","Couriers and Messengers","88","2131","76651","35",
"New Mexico","2006","4921  ","Couriers","67","1946","72303","35",
"New Mexico","2006","49211 ","Couriers","67","1946","72303","35",
"New Mexico","2006","4922  ","Local Messengers and Local Delivery","21","185","4348","35",
"New Mexico","2006","511140","Directory and Mailing List Publishers","6","0","0","35",
"New Mexico","2006","51113 ","Book Publishers","24","0","0","35",
"New Mexico","2006","511130","Book Publishers","24","0","0","35",
"New Mexico","2006","51114 ","Directory and Mailing List Publishers","6","0","0","35",
"New Mexico","2006","51119 ","Other Publishers","11","38","1045","35",
"New Mexico","2006","512240","Sound Recording Studios","8","0","0","35",
"New Mexico","2006","5151  ","Radio and Television Broadcasting","105","0","0","35",
"New Mexico","2006","51229 ","Other Sound Recording Industries","2","0","0","35",
"New Mexico","2006","512290","Other Sound Recording Industries","2","0","0","35",
"New Mexico","2006","515   ","Broadcasting (except Internet)","106","1595","58275","35",
"New Mexico","2006","518   ","Internet Service Providers, Web Search Portals, and Data Processing Services","95","1677","68647","35",
"New Mexico","2006","5179  ","Other Telecommunications","3","0","0","35",
"New Mexico","2006","51791 ","Other Telecommunications","3","0","0","35",
"New Mexico","2006","517910","Other Telecommunications","3","0","0","35",
"New Mexico","2006","522298","All Other Nondepository Credit Intermediation","61","0","0","35",
"New Mexico","2006","52232 ","Financial Transactions Processing, Reserve, and Clearinghouse Activities","17","0","0","35",
"New Mexico","2006","5223  ","Activities Related to Credit Intermediation","265","2012","63637","35",
"New Mexico","2006","52231 ","Mortgage and Nonmortgage Loan Brokers","142","476","20873","35",
"New Mexico","2006","522310","Mortgage and Nonmortgage Loan Brokers","142","476","20873","35",
"New Mexico","2006","524292","Third Party Administration of Insurance and Pension Funds","30","339","12391","35",
"New Mexico","2006","524210","Insurance Agencies and Brokerages","783","3327","124380","35",
"New Mexico","2006","52429 ","Other Insurance Related Activities","75","587","19561","35",
"New Mexico","2006","524291","Claims Adjusting","35","232","6588","35",
"New Mexico","2006","53223 ","Video Tape and Disc Rental","125","1001","8239","35",
"New Mexico","2006","532292","Recreational Goods Rental","25","110","1116","35",
"New Mexico","2006","532230","Video Tape and Disc Rental","125","1001","8239","35",
"New Mexico","2006","53229 ","Other Consumer Goods Rental","112","785","23391","35",
"New Mexico","2006","532291","Home Health Equipment Rental","54","406","14138","35",
"New Mexico","2006","541370","Surveying and Mapping (except Geophysical) Services","93","548","22544","35",
"New Mexico","2006","54141 ","Interior Design Services","48","104","3311","35",
"New Mexico","2006","54138 ","Testing Laboratories","31","506","23379","35",
"New Mexico","2006","541380","Testing Laboratories","31","506","23379","35",
"New Mexico","2006","5414  ","Specialized Design Services","156","529","21472","35",
"New Mexico","2006","541921","Photography Studios, Portrait","77","283","5490","35",
"New Mexico","2006","54194 ","Veterinary Services","213","1723","52540","35",
"New Mexico","2006","541922","Commercial Photography","35","0","0","35",
"New Mexico","2006","54193 ","Translation and Interpretation Services","7","0","0","35",
"New Mexico","2006","541930","Translation and Interpretation Services","7","0","0","35",
"New Mexico","2006","561622","Locksmiths","29","136","4203","35",
"New Mexico","2006","61162 ","Sports and Recreation Instruction","61","293","3829","35",
"New Mexico","2006","5617  ","Services to Buildings and Dwellings","770","6851","131586","35",
"New Mexico","2006","56171 ","Exterminating and Pest Control Services","75","402","10292","35",
"New Mexico","2006","561710","Exterminating and Pest Control Services","75","402","10292","35",
"New Mexico","2006","61169 ","All Other Schools and Instruction","76","0","0","35",
"New Mexico","2006","611620","Sports and Recreation Instruction","61","293","3829","35",
"New Mexico","2006","61163 ","Language Schools","3","0","0","35",
"New Mexico","2006","611630","Language Schools","3","0","0","35",
"New Mexico","2006","62321 ","Residential Mental Retardation Facilities","205","3147","57118","35",
"New Mexico","2006","713110","Amusement and Theme Parks","2","0","0","35",
"New Mexico","2006","623210","Residential Mental Retardation Facilities","205","3147","57118","35",
"New Mexico","2006","62322 ","Residential Mental Health and Substance Abuse Facilities","21","470","10914","35",
"New Mexico","2006","623220","Residential Mental Health and Substance Abuse Facilities","21","470","10914","35",
"New Mexico","2006","71321 ","Casinos (except Casino Hotels)","14","5421","151064","35",
"New Mexico","2006","71312 ","Amusement Arcades","16","0","0","35",
"New Mexico","2006","713120","Amusement Arcades","16","0","0","35",
"New Mexico","2006","7132  ","Gambling Industries","26","5622","155412","35",
"New Mexico","2006","71391 ","Golf Courses and Country Clubs","45","1192","21993","35",
"New Mexico","2006","713910","Golf Courses and Country Clubs","45","1192","21993","35",
"New Mexico","2006","713930","Marinas","8","49","1006","35",
"New Mexico","2006","71392 ","Skiing Facilities","7","1483","11553","35",
"New Mexico","2006","713920","Skiing Facilities","7","1483","11553","35",
"New Mexico","2006","71393 ","Marinas","8","49","1006","35",
"New Mexico","2006","71394 ","Fitness and Recreational Sports Centers","153","1998","21957","35",
"New Mexico","2006","71399 ","All Other Amusement and Recreation Industries","82","392","5851","35",
"New Mexico","2006","713940","Fitness and Recreational Sports Centers","153","1998","21957","35",
"New Mexico","2006","71395 ","Bowling Centers","21","472","4801","35",
"New Mexico","2006","713950","Bowling Centers","21","472","4801","35",
"New Mexico","2006","721191","Bed-and-Breakfast Inns","70","0","0","35",
"New Mexico","2006","721199","All Other Traveler Accommodation","11","0","0","35",
"New Mexico","2006","72231 ","Food Service Contractors","116","1924","34520","35",
"New Mexico","2006","7212  ","RV (Recreational Vehicle) Parks and Recreational Camps","81","0","0","35",
"New Mexico","2006","72121 ","RV (Recreational Vehicle) Parks and Recreational Camps","81","0","0","35",
"New Mexico","2006","721211","RV (Recreational Vehicle) Parks and Campgrounds","53","0","0","35",
"New Mexico","2006","72233 ","Mobile Food Services","8","13","536","35",
"New Mexico","2006","722310","Food Service Contractors","116","1924","34520","35",
"New Mexico","2006","72232 ","Caterers","43","303","4513","35",
"New Mexico","2006","722320","Caterers","43","303","4513","35",
"New Mexico","2006","811198","All Other Automotive Repair and Maintenance","19","53","2006","35",
"New Mexico","2006","8112  ","Electronic and Precision Equipment Repair and Maintenance","75","558","22446","35",
"New Mexico","2006","23811 ","Poured Concrete Foundation and Structure Contractors","171","2598","73640","35",
"New Mexico","2006","81121 ","Electronic and Precision Equipment Repair and Maintenance","75","558","22446","35",
"New Mexico","2006","811211","Consumer Electronics Repair and Maintenance","13","0","0","35",
"New Mexico","2006","21223 ","Copper, Nickel, Lead, and Zinc Mining","3","0","0","35",
"New Mexico","2006","212234","Copper Ore and Nickel Ore Mining","3","0","0","35",
"New Mexico","2006","21229 ","Other Metal Ore Mining","3","0","0","35",
"New Mexico","2006","212291","Uranium-Radium-Vanadium Ore Mining","2","0","0","35",
"New Mexico","2006","2381  ","Foundation, Structure, and Building Exterior Contractors","747","8746","223989","35",
"New Mexico","2006","238110","Poured Concrete Foundation and Structure Contractors","171","2598","73640","35",
"New Mexico","2006","3116  ","Animal Slaughtering and Processing","18","400","10659","35",
"New Mexico","2006","23812 ","Structural Steel and Precast Concrete Contractors","26","268","9169","35",
"New Mexico","2006","311513","Cheese Manufacturing","6","909","37300","35",
"New Mexico","2006","311514","Dry, Condensed, and Evaporated Dairy Product Manufacturing","2","0","0","35",
"New Mexico","2006","31529 ","Other Cut and Sew Apparel Manufacturing","3","0","0","35",
"New Mexico","2006","31161 ","Animal Slaughtering and Processing","18","400","10659","35",
"New Mexico","2006","311611","Animal (except Poultry) Slaughtering","5","0","0","35",
"New Mexico","2006","315234","Women's and Girls' Cut and Sew Suit, Coat, Tailored Jacket, and Skirt Manufacturing","1","0","0","35",
"New Mexico","2006","315292","Fur and Leather Apparel Manufacturing","2","0","0","35",
"New Mexico","2006","3251  ","Basic Chemical Manufacturing","9","586","38322","35",
"New Mexico","2006","315299","All Other Cut and Sew Apparel Manufacturing","1","0","0","35",
"New Mexico","2006","324191","Petroleum Lubricating Oil and Grease Manufacturing","3","0","0","35",
"New Mexico","2006","325   ","Chemical Manufacturing","37","887","48837","35",
"New Mexico","2006","3273  ","Cement and Concrete Product Manufacturing","64","1414","54718","35",
"New Mexico","2006","32512 ","Industrial Gas Manufacturing","4","0","0","35",
"New Mexico","2006","325120","Industrial Gas Manufacturing","4","0","0","35",
"New Mexico","2006","327215","Glass Product Manufacturing Made of Purchased Glass","13","0","0","35",
"New Mexico","2006","32731 ","Cement Manufacturing","1","0","0","35",
"New Mexico","2006","33243 ","Metal Can, Box, and Other Metal Container (Light Gauge) Manufacturing","2","0","0","35",
"New Mexico","2006","327310","Cement Manufacturing","1","0","0","35",
"New Mexico","2006","32732 ","Ready-Mix Concrete Manufacturing","43","770","29984","35",
"New Mexico","2006","332420","Metal Tank (Heavy Gauge) Manufacturing","8","0","0","35",
"New Mexico","2006","332439","Other Metal Container Manufacturing","2","0","0","35",
"New Mexico","2006","3328  ","Coating, Engraving, Heat Treating, and Allied Activities","14","0","0","35",
"New Mexico","2006","3325  ","Hardware Manufacturing","4","0","0","35",
"New Mexico","2006","33251 ","Hardware Manufacturing","4","0","0","35",
"New Mexico","2006","332722","Bolt, Nut, Screw, Rivet, and Washer Manufacturing","1","0","0","35",
"New Mexico","2006","33281 ","Coating, Engraving, Heat Treating, and Allied Activities","14","0","0","35",
"New Mexico","2006","333   ","Machinery Manufacturing","75","1645","70355","35",
"New Mexico","2006","332811","Metal Heat Treating","4","57","1652","35",
"New Mexico","2006","332996","Fabricated Pipe and Pipe Fitting Manufacturing","3","0","0","35",
"New Mexico","2006","332999","All Other Miscellaneous Fabricated Metal Product Manufacturing","7","0","0","35",
"New Mexico","2006","3333  ","Commercial and Service Industry Machinery Manufacturing","12","267","16024","35",
"New Mexico","2006","3331  ","Agriculture, Construction, and Mining Machinery Manufacturing","19","596","25566","35",
"New Mexico","2006","333295","Semiconductor Machinery Manufacturing","2","0","0","35",
"New Mexico","2006","333298","All Other Industrial Machinery Manufacturing","5","0","0","35",
"New Mexico","2006","33331 ","Commercial and Service Industry Machinery Manufacturing","12","267","16024","35",
"New Mexico","2006","333911","Pump and Pumping Equipment Manufacturing","1","0","0","35",
"New Mexico","2006","333311","Automatic Vending Machine Manufacturing","1","0","0","35",
"New Mexico","2006","3339  ","Other General Purpose Machinery Manufacturing","13","0","0","35",
"New Mexico","2006","33391 ","Pump and Compressor Manufacturing","5","0","0","35",
"New Mexico","2006","333912","Air and Gas Compressor Manufacturing","4","44","1376","35",
"New Mexico","2006","334418","Printed Circuit Assembly (Electronic Assembly) Manufacturing","3","0","0","35",
"New Mexico","2006","33392 ","Material Handling Equipment Manufacturing","1","0","0","35",
"New Mexico","2006","334413","Semiconductor and Related Device Manufacturing","12","0","0","35",
"New Mexico","2006","334415","Electronic Resistor Manufacturing","1","0","0","35",
"New Mexico","2006","334419","Other Electronic Component Manufacturing","9","256","11934","35",
"New Mexico","2006","335921","Fiber Optic Cable Manufacturing","1","0","0","35",
"New Mexico","2006","335314","Relay and Industrial Control Manufacturing","1","0","0","35",
"New Mexico","2006","3359  ","Other Electrical Equipment and Component Manufacturing","7","0","0","35",
"New Mexico","2006","33592 ","Communication and Energy Wire and Cable Manufacturing","2","0","0","35",
"New Mexico","2006","336414","Guided Missile and Space Vehicle Manufacturing","1","0","0","35",
"New Mexico","2006","335929","Other Communication and Energy Wire Manufacturing","1","0","0","35",
"New Mexico","2006","336412","Aircraft Engine and Engine Parts Manufacturing","3","0","0","35",
"New Mexico","2006","336413","Other Aircraft Parts and Auxiliary Equipment Manufacturing","3","0","0","35",
"New Mexico","2006","3366  ","Ship and Boat Building","1","0","0","35",
"New Mexico","2006","339912","Silverware and Hollowware Manufacturing","2","0","0","35",
"New Mexico","2006","33661 ","Ship and Boat Building","1","0","0","35",
"New Mexico","2006","33991 ","Jewelry and Silverware Manufacturing","98","1372","33025","35",
"New Mexico","2006","339911","Jewelry (except Costume) Manufacturing","77","1178","27527","35",
"New Mexico","2006","339913","Jewelers' Material and Lapidary Work Manufacturing","5","0","0","35",
"New Mexico","2006","42342 ","Office Equipment Merchant Wholesalers","38","412","16974","35",
"New Mexico","2006","339914","Costume Jewelry and Novelty Manufacturing","14","0","0","35",
"New Mexico","2006","42341 ","Photographic Equipment and Supplies Merchant Wholesalers","3","0","0","35",
"New Mexico","2006","423410","Photographic Equipment and Supplies Merchant Wholesalers","3","0","0","35",
"New Mexico","2006","423420","Office Equipment Merchant Wholesalers","38","412","16974","35",
"New Mexico","2006","42386 ","Transportation Equipment and Supplies (except Motor Vehicle) Merchant Wholesalers","4","12","547","35",
"New Mexico","2006","423840","Industrial Supplies Merchant Wholesalers","54","389","15168","35",
"New Mexico","2006","42385 ","Service Establishment Equipment and Supplies Merchant Wholesalers","34","196","7266","35",
"New Mexico","2006","423850","Service Establishment Equipment and Supplies Merchant Wholesalers","34","196","7266","35",
"New Mexico","2006","42449 ","Other Grocery and Related Products Merchant Wholesalers","91","1325","43690","35",
"New Mexico","2006","424470","Meat and Meat Product Merchant Wholesalers","14","104","2108","35",
"New Mexico","2006","42448 ","Fresh Fruit and Vegetable Merchant Wholesalers","21","221","8474","35",
"New Mexico","2006","424480","Fresh Fruit and Vegetable Merchant Wholesalers","21","221","8474","35",
