"Nevada","2003","311230","Breakfast Cereal Manufacturing","1","0","0","32",
"Nevada","2003","3113  ","Sugar and Confectionery Product Manufacturing","10","290","8094","32",
"Nevada","2003","31411 ","Carpet and Rug Mills","3","0","0","32",
"Nevada","2003","323115","Digital Printing","23","269","10019","32",
"Nevada","2003","314110","Carpet and Rug Mills","3","0","0","32",
"Nevada","2003","31412 ","Curtain and Linen Mills","15","0","0","32",
"Nevada","2003","314121","Curtain and Drapery Mills","13","0","0","32",
"Nevada","2003","323116","Manifold Business Forms Printing","3","0","0","32",
"Nevada","2003","32616 ","Plastics Bottle Manufacturing","1","0","0","32",
"Nevada","2003","323117","Books Printing","3","0","0","32",
"Nevada","2003","323118","Blankbook, Looseleaf Binders, and Devices Manufacturing","3","0","0","32",
"Nevada","2003","323119","Other Commercial Printing","5","94","3310","32",
"Nevada","2003","326160","Plastics Bottle Manufacturing","1","0","0","32",
"Nevada","2003","331524","Aluminum Foundries (except Die-Casting)","2","0","0","32",
"Nevada","2003","32619 ","Other Plastics Product Manufacturing","59","1857","59341","32",
"Nevada","2003","326191","Plastics Plumbing Fixture Manufacturing","4","0","0","32",
"Nevada","2003","326199","All Other Plastics Product Manufacturing","55","0","0","32",
"Nevada","2003","331525","Copper Foundries (except Die-Casting)","1","0","0","32",
"Nevada","2003","333294","Food Product Machinery Manufacturing","3","0","0","32",
"Nevada","2003","332   ","Fabricated Metal Product Manufacturing","268","5111","195282","32",
"Nevada","2003","3321  ","Forging and Stamping","12","265","12887","32",
"Nevada","2003","33211 ","Forging and Stamping","12","265","12887","32",
"Nevada","2003","333295","Semiconductor Machinery Manufacturing","1","0","0","32",
"Nevada","2003","334512","Automatic Environmental Control Manufacturing for Residential, Commercial, and Appliance Use","3","0","0","32",
"Nevada","2003","333298","All Other Industrial Machinery Manufacturing","7","86","3347","32",
"Nevada","2003","3333  ","Commercial and Service Industry Machinery Manufacturing","16","289","9453","32",
"Nevada","2003","334511","Search, Detection, Navigation, Guidance, Aeronautical, and Nautical System and Instrument Manufacturing","3","0","0","32",
"Nevada","2003","336413","Other Aircraft Parts and Auxiliary Equipment Manufacturing","7","0","0","32",
"Nevada","2003","334513","Instruments and Related Products Manufacturing for Measuring, Displaying, and Controlling Industrial Process Variables","8","0","0","32",
"Nevada","2003","336411","Aircraft Manufacturing","3","3","183","32",
"Nevada","2003","336412","Aircraft Engine and Engine Parts Manufacturing","3","0","0","32",
"Nevada","2003","423210","Furniture Merchant Wholesalers","28","238","9764","32",
"Nevada","2003","3365  ","Railroad Rolling Stock Manufacturing","1","0","0","32",
"Nevada","2003","33651 ","Railroad Rolling Stock Manufacturing","1","0","0","32",
"Nevada","2003","42321 ","Furniture Merchant Wholesalers","28","238","9764","32",
"Nevada","2003","42322 ","Home Furnishing Merchant Wholesalers","43","327","15256","32",
"Nevada","2003","424820","Wine and Distilled Alcoholic Beverage Merchant Wholesalers","19","862","64541","32",
"Nevada","2003","423220","Home Furnishing Merchant Wholesalers","43","327","15256","32",
"Nevada","2003","42392 ","Toy and Hobby Goods and Supplies Merchant Wholesalers","28","339","10038","32",
"Nevada","2003","423920","Toy and Hobby Goods and Supplies Merchant Wholesalers","28","339","10038","32",
"Nevada","2003","42393 ","Recyclable Material Merchant Wholesalers","29","280","9985","32",
"Nevada","2003","423930","Recyclable Material Merchant Wholesalers","29","280","9985","32",
"Nevada","2003","4249  ","Miscellaneous Nondurable Goods Merchant Wholesalers","248","2380","69435","32",
"Nevada","2003","42491 ","Farm Supplies Merchant Wholesalers","26","107","3874","32",
"Nevada","2003","44512 ","Convenience Stores","230","1464","22200","32",
"Nevada","2003","424910","Farm Supplies Merchant Wholesalers","26","107","3874","32",
"Nevada","2003","42492 ","Book, Periodical, and Newspaper Merchant Wholesalers","24","750","19836","32",
"Nevada","2003","445110","Supermarkets and Other Grocery (except Convenience) Stores","374","18030","404193","32",
"Nevada","2003","445120","Convenience Stores","230","1464","22200","32",
"Nevada","2003","4452  ","Specialty Food Stores","141","892","14827","32",
"Nevada","2003","452990","All Other General Merchandise Stores","104","1270","22326","32",
"Nevada","2003","44521 ","Meat Markets","18","0","0","32",
"Nevada","2003","452910","Warehouse Clubs and Supercenters","23","6615","162551","32",
"Nevada","2003","45299 ","All Other General Merchandise Stores","104","1270","22326","32",
"Nevada","2003","453   ","Miscellaneous Store Retailers","1048","7993","146962","32",
"Nevada","2003","4852  ","Interurban and Rural Bus Transportation","5","0","0","32",
"Nevada","2003","4531  ","Florists","112","555","7707","32",
"Nevada","2003","485113","Bus and Other Motor Vehicle Transit Systems","8","0","0","32",
"Nevada","2003","485119","Other Urban Transit Systems","1","0","0","32",
"Nevada","2003","48521 ","Interurban and Rural Bus Transportation","5","0","0","32",
"Nevada","2003","493190","Other Warehousing and Storage","16","734","28662","32",
"Nevada","2003","485210","Interurban and Rural Bus Transportation","5","0","0","32",
"Nevada","2003","493130","Farm Product Warehousing and Storage","4","0","0","32",
"Nevada","2003","49319 ","Other Warehousing and Storage","16","734","28662","32",
"Nevada","2003","51    ","Information","1028","16651","708195","32",
"Nevada","2003","51911 ","News Syndicates","4","0","0","32",
"Nevada","2003","511   ","Publishing Industries (except Internet)","212","4328","207588","32",
"Nevada","2003","519   ","Other Information Services","19","120","3170","32",
"Nevada","2003","5191  ","Other Information Services","19","120","3170","32",
"Nevada","2003","519110","News Syndicates","4","0","0","32",
"Nevada","2003","525   ","Funds, Trusts, and Other Financial Vehicles","45","226","8000","32",
"Nevada","2003","51912 ","Libraries and Archives","9","27","1030","32",
"Nevada","2003","524292","Third Party Administration of Insurance and Pension Funds","62","988","35818","32",
"Nevada","2003","524298","All Other Insurance Related Activities","22","68","4185","32",
"Nevada","2003","5259  ","Other Investment Pools and Funds","45","226","8000","32",
"Nevada","2003","541211","Offices of Certified Public Accountants","328","1813","89524","32",
"Nevada","2003","52591 ","Open-End Investment Funds","7","0","0","32",
"Nevada","2003","5412  ","Accounting, Tax Preparation, Bookkeeping, and Payroll Services","876","8680","282833","32",
"Nevada","2003","54121 ","Accounting, Tax Preparation, Bookkeeping, and Payroll Services","876","8680","282833","32",
"Nevada","2003","541213","Tax Preparation Services","194","1509","10100","32",
"Nevada","2003","541930","Translation and Interpretation Services","8","12","462","32",
"Nevada","2003","541214","Payroll Services","51","4165","142352","32",
"Nevada","2003","541922","Commercial Photography","51","178","3641","32",
"Nevada","2003","54193 ","Translation and Interpretation Services","8","12","462","32",
"Nevada","2003","54194 ","Veterinary Services","164","2103","51148","32",
"Nevada","2003","561990","All Other Support Services","156","1474","32032","32",
"Nevada","2003","541940","Veterinary Services","164","2103","51148","32",
"Nevada","2003","561920","Convention and Trade Show Organizers","123","6999","174519","32",
"Nevada","2003","56199 ","All Other Support Services","156","1474","32032","32",
"Nevada","2003","562   ","Waste Management and Remediation Services","96","2619","103467","32",
"Nevada","2003","6214  ","Outpatient Care Centers","183","3102","110913","32",
"Nevada","2003","62139 ","Offices of All Other Health Practitioners","122","369","14511","32",
"Nevada","2003","621391","Offices of Podiatrists","50","182","6803","32",
"Nevada","2003","621399","Offices of All Other Miscellaneous Health Practitioners","72","187","7708","32",
"Nevada","2003","711110","Theater Companies and Dinner Theaters","42","792","40894","32",
"Nevada","2003","62141 ","Family Planning Centers","11","0","0","32",
"Nevada","2003","7111  ","Performing Arts Companies","138","1681","78292","32",
"Nevada","2003","71111 ","Theater Companies and Dinner Theaters","42","792","40894","32",
"Nevada","2003","71112 ","Dance Companies","7","0","0","32",
"Nevada","2003","72221 ","Limited-Service Eating Places","1859","28222","322973","32",
"Nevada","2003","72211 ","Full-Service Restaurants","1267","34125","518061","32",
"Nevada","2003","722110","Full-Service Restaurants","1267","34125","518061","32",
"Nevada","2003","7222  ","Limited-Service Eating Places","1859","28222","322973","32",
"Nevada","2003","81292 ","Photofinishing","30","230","4821","32",
"Nevada","2003","722211","Limited-Service Restaurants","1538","25372","290771","32",
"Nevada","2003","81291 ","Pet Care (except Veterinary) Services","63","223","3088","32",
"Nevada","2003","812910","Pet Care (except Veterinary) Services","63","223","3088","32",
"Nevada","2003","812921","Photofinishing Laboratories (except One-Hour)","9","66","2063","32",
"Nevada","2003","812922","One-Hour Photofinishing","21","164","2758","32",
"Nevada","2003","115112","Soil Preparation, Planting, and Cultivating","6","0","0","32",
"Nevada","2003","115113","Crop Harvesting, Primarily by Machine","1","0","0","32",
"Nevada","2003","23621 ","Industrial Building Construction","11","190","11110","32",
"Nevada","2003","115114","Postharvest Crop Activities (except Cotton Ginning)","1","0","0","32",
"Nevada","2003","115115","Farm Labor Contractors and Crew Leaders","2","0","0","32",
"Nevada","2003","2362  ","Nonresidential Building Construction","405","6725","382283","32",
"Nevada","2003","236210","Industrial Building Construction","11","190","11110","32",
"Nevada","2003","314129","Other Household Textile Product Mills","2","0","0","32",
"Nevada","2003","23622 ","Commercial and Institutional Building Construction","394","6535","371173","32",
"Nevada","2003","31133 ","Confectionery Manufacturing from Purchased Chocolate","7","0","0","32",
"Nevada","2003","311330","Confectionery Manufacturing from Purchased Chocolate","7","0","0","32",
"Nevada","2003","31134 ","Nonchocolate Confectionery Manufacturing","3","0","0","32",
"Nevada","2003","311340","Nonchocolate Confectionery Manufacturing","3","0","0","32",
"Nevada","2003","3149  ","Other Textile Product Mills","24","409","11718","32",
"Nevada","2003","31491 ","Textile Bag and Canvas Mills","8","0","0","32",
"Nevada","2003","323121","Tradebinding and Related Work","6","0","0","32",
"Nevada","2003","314912","Canvas and Related Product Mills","8","0","0","32",
"Nevada","2003","31499 ","All Other Textile Product Mills","16","0","0","32",
"Nevada","2003","32312 ","Support Activities for Printing","17","81","1724","32",
"Nevada","2003","323122","Prepress Services","11","0","0","32",
"Nevada","2003","32621 ","Tire Manufacturing","1","0","0","32",
"Nevada","2003","324   ","Petroleum and Coal Products Manufacturing","9","182","7203","32",
"Nevada","2003","3241  ","Petroleum and Coal Products Manufacturing","9","182","7203","32",
"Nevada","2003","3262  ","Rubber Product Manufacturing","6","0","0","32",
"Nevada","2003","326212","Tire Retreading","1","0","0","32",
"Nevada","2003","332114","Custom Roll Forming","2","0","0","32",
"Nevada","2003","32622 ","Rubber and Plastics Hoses and Belting Manufacturing","2","0","0","32",
"Nevada","2003","326220","Rubber and Plastics Hoses and Belting Manufacturing","2","0","0","32",
"Nevada","2003","332112","Nonferrous Forging","1","0","0","32",
"Nevada","2003","332116","Metal Stamping","8","0","0","32",
"Nevada","2003","333311","Automatic Vending Machine Manufacturing","1","0","0","32",
"Nevada","2003","332117","Powder Metallurgy Part Manufacturing","1","0","0","32",
"Nevada","2003","3322  ","Cutlery and Handtool Manufacturing","6","0","0","32",
"Nevada","2003","33331 ","Commercial and Service Industry Machinery Manufacturing","16","289","9453","32",
"Nevada","2003","333314","Optical Instrument and Lens Manufacturing","1","0","0","32",
"Nevada","2003","334515","Instrument Manufacturing for Measuring and Testing Electricity and Electrical Signals","4","110","5024","32",
"Nevada","2003","333315","Photographic and Photocopying Equipment Manufacturing","1","0","0","32",
"Nevada","2003","333319","Other Commercial and Service Industry Machinery Manufacturing","13","0","0","32",
"Nevada","2003","334514","Totalizing Fluid Meter and Counting Device Manufacturing","1","0","0","32",
"Nevada","2003","334516","Analytical Laboratory Instrument Manufacturing","5","284","13885","32",
"Nevada","2003","3366  ","Ship and Boat Building","2","0","0","32",
"Nevada","2003","334518","Watch, Clock, and Part Manufacturing","1","0","0","32",
"Nevada","2003","334519","Other Measuring and Controlling Device Manufacturing","3","0","0","32",
"Nevada","2003","336510","Railroad Rolling Stock Manufacturing","1","0","0","32",
"Nevada","2003","33661 ","Ship and Boat Building","2","0","0","32",
"Nevada","2003","42331 ","Lumber, Plywood, Millwork, and Wood Panel Merchant Wholesalers","71","1398","56371","32",
"Nevada","2003","336611","Ship Building and Repairing","1","0","0","32",
"Nevada","2003","336612","Boat Building","1","0","0","32",
"Nevada","2003","4233  ","Lumber and Other Construction Materials Merchant Wholesalers","159","2276","91405","32",
"Nevada","2003","423310","Lumber, Plywood, Millwork, and Wood Panel Merchant Wholesalers","71","1398","56371","32",
"Nevada","2003","42399 ","Other Miscellaneous Durable Goods Merchant Wholesalers","94","2299","125192","32",
"Nevada","2003","42332 ","Brick, Stone, and Related Construction Material Merchant Wholesalers","44","455","16423","32",
"Nevada","2003","42394 ","Jewelry, Watch, Precious Stone, and Precious Metal Merchant Wholesalers","33","277","9281","32",
"Nevada","2003","423940","Jewelry, Watch, Precious Stone, and Precious Metal Merchant Wholesalers","33","277","9281","32",
"Nevada","2003","424930","Flower, Nursery Stock, and Florists' Supplies Merchant Wholesalers","21","106","3324","32",
"Nevada","2003","423990","Other Miscellaneous Durable Goods Merchant Wholesalers","94","2299","125192","32",
"Nevada","2003","424920","Book, Periodical, and Newspaper Merchant Wholesalers","24","750","19836","32",
"Nevada","2003","42493 ","Flower, Nursery Stock, and Florists' Supplies Merchant Wholesalers","21","106","3324","32",
"Nevada","2003","445220","Fish and Seafood Markets","3","0","0","32",
"Nevada","2003","42494 ","Tobacco and Tobacco Product Merchant Wholesalers","17","307","6633","32",
"Nevada","2003","445210","Meat Markets","18","0","0","32",
"Nevada","2003","44522 ","Fish and Seafood Markets","3","0","0","32",
"Nevada","2003","44523 ","Fruit and Vegetable Markets","4","0","0","32",
"Nevada","2003","4532  ","Office Supplies, Stationery, and Gift Stores","431","3935","69649","32",
"Nevada","2003","445230","Fruit and Vegetable Markets","4","0","0","32",
"Nevada","2003","45311 ","Florists","112","555","7707","32",
"Nevada","2003","453110","Florists","112","555","7707","32",
"Nevada","2003","45321 ","Office Supplies and Stationery Stores","76","1041","22994","32",
"Nevada","2003","485310","Taxi Service","28","7115","128856","32",
"Nevada","2003","453210","Office Supplies and Stationery Stores","76","1041","22994","32",
"Nevada","2003","4853  ","Taxi and Limousine Service","56","8403","150592","32",
"Nevada","2003","48531 ","Taxi Service","28","7115","128856","32",
"Nevada","2003","48532 ","Limousine Service","28","1288","21736","32",
"Nevada","2003","511110","Newspaper Publishers","48","2044","70121","32",
"Nevada","2003","485320","Limousine Service","28","1288","21736","32",
"Nevada","2003","5111  ","Newspaper, Periodical, Book, and Directory Publishers","154","2882","103726","32",
"Nevada","2003","51111 ","Newspaper Publishers","48","2044","70121","32",
"Nevada","2003","51112 ","Periodical Publishers","57","360","12842","32",
"Nevada","2003","519190","All Other Information Services","6","0","0","32",
"Nevada","2003","511120","Periodical Publishers","57","360","12842","32",
"Nevada","2003","519120","Libraries and Archives","9","27","1030","32",
"Nevada","2003","51919 ","All Other Information Services","6","0","0","32",
"Nevada","2003","52    ","Finance and Insurance","4164","37431","1685891","32",
"Nevada","2003","525930","Real Estate Investment Trusts","14","0","0","32",
"Nevada","2003","522   ","Credit Intermediation and Related Activities","1709","23258","970638","32",
"Nevada","2003","525910","Open-End Investment Funds","7","0","0","32",
"Nevada","2003","52593 ","Real Estate Investment Trusts","14","0","0","32",
"Nevada","2003","52599 ","Other Financial Vehicles","24","0","0","32",
"Nevada","2003","525990","Other Financial Vehicles","24","0","0","32",
"Nevada","2003","541310","Architectural Services","161","1279","72600","32",
"Nevada","2003","541219","Other Accounting Services","303","1193","40857","32",
"Nevada","2003","5413  ","Architectural, Engineering, and Related Services","861","13482","740254","32",
"Nevada","2003","54131 ","Architectural Services","161","1279","72600","32",
"Nevada","2003","55    ","Management of Companies and Enterprises","798","11645","855881","32",
"Nevada","2003","54132 ","Landscape Architectural Services","49","461","17884","32",
"Nevada","2003","54199 ","All Other Professional, Scientific, and Technical Services","228","806","21794","32",
"Nevada","2003","541990","All Other Professional, Scientific, and Technical Services","228","806","21794","32",
"Nevada","2003","551   ","Management of Companies and Enterprises","798","11645","855881","32",
"Nevada","2003","562112","Hazardous Waste Collection","1","0","0","32",
"Nevada","2003","5621  ","Waste Collection","45","1882","79436","32",
"Nevada","2003","56211 ","Waste Collection","45","1882","79436","32",
"Nevada","2003","562111","Solid Waste Collection","41","0","0","32",
"Nevada","2003","562119","Other Waste Collection","3","0","0","32",
"Nevada","2003","621420","Outpatient Mental Health and Substance Abuse Centers","38","0","0","32",
"Nevada","2003","5622  ","Waste Treatment and Disposal","8","0","0","32",
"Nevada","2003","621410","Family Planning Centers","11","0","0","32",
"Nevada","2003","62142 ","Outpatient Mental Health and Substance Abuse Centers","38","0","0","32",
"Nevada","2003","62149 ","Other Outpatient Care Centers","134","2567","91875","32",
"Nevada","2003","711130","Musical Groups and Artists","60","0","0","32",
"Nevada","2003","621491","HMO Medical Centers","4","0","0","32",
"Nevada","2003","711120","Dance Companies","7","0","0","32",
"Nevada","2003","71113 ","Musical Groups and Artists","60","0","0","32",
"Nevada","2003","71119 ","Other Performing Arts Companies","29","256","16803","32",
"Nevada","2003","711190","Other Performing Arts Companies","29","256","16803","32",
"Nevada","2003","7223  ","Special Food Services","125","2470","50095","32",
"Nevada","2003","7112  ","Spectator Sports","32","359","22079","32",
"Nevada","2003","722212","Cafeterias","23","250","2523","32",
"Nevada","2003","722213","Snack and Nonalcoholic Beverage Bars","298","2600","29679","32",
"Nevada","2003","72231 ","Food Service Contractors","56","2068","45668","32",
"Nevada","2003","722310","Food Service Contractors","56","2068","45668","32",
"Nevada","2003","812990","All Other Personal Services","200","1348","24726","32",
"Nevada","2003","81293 ","Parking Lots and Garages","35","341","3927","32",
"Nevada","2003","812930","Parking Lots and Garages","35","341","3927","32",
"Nevada","2003","81299 ","All Other Personal Services","200","1348","24726","32",
"Nevada","2003","813   ","Religious, Grantmaking, Civic, Professional, and Similar Organizations","1106","9746","216052","32",
"Nevada","2003","115116","Farm Management Services","2","0","0","32",
"Nevada","2003","1152  ","Support Activities for Animal Production","30","132","2415","32",
"Nevada","2003","11521 ","Support Activities for Animal Production","30","132","2415","32",
"Nevada","2003","237   ","Heavy and Civil Engineering Construction","345","10171","484073","32",
"Nevada","2003","115210","Support Activities for Animal Production","30","132","2415","32",
"Nevada","2003","1153  ","Support Activities for Forestry","6","0","0","32",
"Nevada","2003","236220","Commercial and Institutional Building Construction","394","6535","371173","32",
"Nevada","2003","2371  ","Utility System Construction","141","4073","175825","32",
"Nevada","2003","31141 ","Frozen Food Manufacturing","3","0","0","32",
"Nevada","2003","23711 ","Water and Sewer Line and Related Structures Construction","89","2204","105235","32",
"Nevada","2003","237110","Water and Sewer Line and Related Structures Construction","89","2204","105235","32",
"Nevada","2003","3114  ","Fruit and Vegetable Preserving and Specialty Food Manufacturing","5","0","0","32",
"Nevada","2003","311411","Frozen Fruit, Juice, and Vegetable Manufacturing","2","0","0","32",
"Nevada","2003","314999","All Other Miscellaneous Textile Product Mills","14","0","0","32",
"Nevada","2003","311412","Frozen Specialty Food Manufacturing","1","0","0","32",
"Nevada","2003","31142 ","Fruit and Vegetable Canning, Pickling, and Drying","2","0","0","32",
"Nevada","2003","314991","Rope, Cordage, and Twine Mills","2","0","0","32",
"Nevada","2003","315   ","Apparel Manufacturing","31","152","3731","32",
"Nevada","2003","324110","Petroleum Refineries","3","0","0","32",
"Nevada","2003","3152  ","Cut and Sew Apparel Manufacturing","27","0","0","32",
"Nevada","2003","31521 ","Cut and Sew Apparel Contractors","21","97","2477","32",
"Nevada","2003","32411 ","Petroleum Refineries","3","0","0","32",
"Nevada","2003","32412 ","Asphalt Paving, Roofing, and Saturated Materials Manufacturing","5","0","0","32",
"Nevada","2003","33221 ","Cutlery and Handtool Manufacturing","6","0","0","32",
"Nevada","2003","324121","Asphalt Paving Mixture and Block Manufacturing","4","0","0","32",
"Nevada","2003","32629 ","Other Rubber Product Manufacturing","3","0","0","32",
"Nevada","2003","326291","Rubber Product Manufacturing for Mechanical Use","1","0","0","32",
"Nevada","2003","326299","All Other Rubber Product Manufacturing","2","0","0","32",
"Nevada","2003","327   ","Nonmetallic Mineral Product Manufacturing","126","3944","167862","32",
"Nevada","2003","332211","Cutlery and Flatware (except Precious) Manufacturing","1","0","0","32",
"Nevada","2003","332212","Hand and Edge Tool Manufacturing","4","0","0","32",
"Nevada","2003","33341 ","Ventilation, Heating, Air-Conditioning, and Commercial Refrigeration Equipment Manufacturing","9","225","6845","32",
"Nevada","2003","332213","Saw Blade and Handsaw Manufacturing","1","0","0","32",
"Nevada","2003","3323  ","Architectural and Structural Metals Manufacturing","82","2261","85676","32",
"Nevada","2003","3334  ","Ventilation, Heating, Air-Conditioning, and Commercial Refrigeration Equipment Manufacturing","9","225","6845","32",
"Nevada","2003","3369  ","Other Transportation Equipment Manufacturing","7","62","3279","32",
"Nevada","2003","333411","Air Purification Equipment Manufacturing","4","0","0","32",
"Nevada","2003","3346  ","Manufacturing and Reproducing Magnetic and Optical Media","8","0","0","32",
"Nevada","2003","33461 ","Manufacturing and Reproducing Magnetic and Optical Media","8","0","0","32",
"Nevada","2003","334611","Software Reproducing","1","0","0","32",
"Nevada","2003","334612","Prerecorded Compact Disc (except Software), Tape, and Record Reproducing","3","0","0","32",
"Nevada","2003","33699 ","Other Transportation Equipment Manufacturing","7","62","3279","32",
"Nevada","2003","336991","Motorcycle, Bicycle, and Parts Manufacturing","6","0","0","32",
"Nevada","2003","42333 ","Roofing, Siding, and Insulation Material Merchant Wholesalers","13","139","5237","32",
"Nevada","2003","336999","All Other Transportation Equipment Manufacturing","1","0","0","32",
"Nevada","2003","337   ","Furniture and Related Product Manufacturing","128","2382","78365","32",
"Nevada","2003","423320","Brick, Stone, and Related Construction Material Merchant Wholesalers","44","455","16423","32",
"Nevada","2003","423330","Roofing, Siding, and Insulation Material Merchant Wholesalers","13","139","5237","32",
"Nevada","2003","42411 ","Printing and Writing Paper Merchant Wholesalers","11","113","4063","32",
"Nevada","2003","42339 ","Other Construction Material Merchant Wholesalers","31","284","13374","32",
"Nevada","2003","424   ","Merchant Wholesalers, Nondurable Goods","862","11842","482374","32",
"Nevada","2003","4241  ","Paper and Paper Product Merchant Wholesalers","62","528","22462","32",
"Nevada","2003","424950","Paint, Varnish, and Supplies Merchant Wholesalers","17","133","4826","32",
"Nevada","2003","424110","Printing and Writing Paper Merchant Wholesalers","11","113","4063","32",
"Nevada","2003","424940","Tobacco and Tobacco Product Merchant Wholesalers","17","307","6633","32",
"Nevada","2003","42495 ","Paint, Varnish, and Supplies Merchant Wholesalers","17","133","4826","32",
"Nevada","2003","445292","Confectionery and Nut Stores","42","259","4337","32",
"Nevada","2003","42499 ","Other Miscellaneous Nondurable Goods Merchant Wholesalers","143","977","30942","32",
"Nevada","2003","44529 ","Other Specialty Food Stores","116","0","0","32",
"Nevada","2003","445291","Baked Goods Stores","19","0","0","32",
"Nevada","2003","445299","All Other Specialty Food Stores","55","0","0","32",
"Nevada","2003","4533  ","Used Merchandise Stores","95","824","12770","32",
"Nevada","2003","4453  ","Beer, Wine, and Liquor Stores","85","468","7707","32",
"Nevada","2003","45322 ","Gift, Novelty, and Souvenir Stores","355","2894","46655","32",
"Nevada","2003","453220","Gift, Novelty, and Souvenir Stores","355","2894","46655","32",
