"South Dakota","2003","56179 ","Other Services to Buildings and Dwellings","21","63","1235","46",
"South Dakota","2003","561790","Other Services to Buildings and Dwellings","21","63","1235","46",
"South Dakota","2003","562111","Solid Waste Collection","67","0","0","46",
"South Dakota","2003","56221 ","Waste Treatment and Disposal","10","0","0","46",
"South Dakota","2003","562112","Hazardous Waste Collection","1","0","0","46",
"South Dakota","2003","562119","Other Waste Collection","2","0","0","46",
"South Dakota","2003","5622  ","Waste Treatment and Disposal","10","0","0","46",
"South Dakota","2003","61111 ","Elementary and Secondary Schools","74","4178","90083","46",
"South Dakota","2003","611210","Junior Colleges","7","584","10781","46",
"South Dakota","2003","611110","Elementary and Secondary Schools","74","4178","90083","46",
"South Dakota","2003","6112  ","Junior Colleges","7","584","10781","46",
"South Dakota","2003","61121 ","Junior Colleges","7","584","10781","46",
"South Dakota","2003","61151 ","Technical and Trade Schools","15","0","0","46",
"South Dakota","2003","611519","Other Technical and Trade Schools","5","0","0","46",
"South Dakota","2003","611511","Cosmetology and Barber Schools","3","0","0","46",
"South Dakota","2003","611512","Flight Training","3","0","0","46",
"South Dakota","2003","611513","Apprenticeship Training","4","0","0","46",
"South Dakota","2003","22131 ","Water Supply and Irrigation Systems","30","0","0","46",
"South Dakota","2003","115310","Support Activities for Forestry","3","0","0","46",
"South Dakota","2003","21    ","Mining","65","1003","42662","46",
"South Dakota","2003","211   ","Oil and Gas Extraction","7","0","0","46",
"South Dakota","2003","2111  ","Oil and Gas Extraction","7","0","0","46",
"South Dakota","2003","21111 ","Oil and Gas Extraction","7","0","0","46",
"South Dakota","2003","221310","Water Supply and Irrigation Systems","30","0","0","46",
"South Dakota","2003","22132 ","Sewage Treatment Facilities","4","0","0","46",
"South Dakota","2003","23819 ","Other Foundation, Structure, and Building Exterior Contractors","5","0","0","46",
"South Dakota","2003","221320","Sewage Treatment Facilities","4","0","0","46",
"South Dakota","2003","23    ","Construction","2996","16476","552123","46",
"South Dakota","2003","238170","Siding Contractors","41","185","4460","46",
"South Dakota","2003","238190","Other Foundation, Structure, and Building Exterior Contractors","5","0","0","46",
"South Dakota","2003","311811","Retail Bakeries","19","0","0","46",
"South Dakota","2003","2382  ","Building Equipment Contractors","628","4544","145413","46",
"South Dakota","2003","23821 ","Electrical Contractors","264","1809","54563","46",
"South Dakota","2003","31181 ","Bread and Bakery Product Manufacturing","26","0","0","46",
"South Dakota","2003","311812","Commercial Bakeries","6","0","0","46",
"South Dakota","2003","3212  ","Veneer, Plywood, and Engineered Wood Product Manufacturing","11","591","21710","46",
"South Dakota","2003","311813","Frozen Cakes, Pies, and Other Pastries Manufacturing","1","0","0","46",
"South Dakota","2003","31182 ","Cookie, Cracker, and Pasta Manufacturing","3","0","0","46",
"South Dakota","2003","321114","Wood Preservation","4","0","0","46",
"South Dakota","2003","32121 ","Veneer, Plywood, and Engineered Wood Product Manufacturing","11","591","21710","46",
"South Dakota","2003","325611","Soap and Other Detergent Manufacturing","1","0","0","46",
"South Dakota","2003","321211","Hardwood Veneer and Plywood Manufacturing","2","0","0","46",
"South Dakota","2003","3256  ","Soap, Cleaning Compound, and Toilet Preparation Manufacturing","3","0","0","46",
"South Dakota","2003","32561 ","Soap and Cleaning Compound Manufacturing","2","0","0","46",
"South Dakota","2003","325612","Polish and Other Sanitation Good Manufacturing","1","0","0","46",
"South Dakota","2003","33122 ","Rolling and Drawing of Purchased Steel","2","0","0","46",
"South Dakota","2003","32562 ","Toilet Preparation Manufacturing","1","0","0","46",
"South Dakota","2003","331111","Iron and Steel Mills","3","0","0","46",
"South Dakota","2003","3312  ","Steel Product Manufacturing from Purchased Steel","2","0","0","46",
"South Dakota","2003","33621 ","Motor Vehicle Body and Trailer Manufacturing","16","945","32276","46",
"South Dakota","2003","331221","Rolled Steel Shape Manufacturing","1","0","0","46",
"South Dakota","2003","336120","Heavy Duty Truck Manufacturing","1","0","0","46",
"South Dakota","2003","3362  ","Motor Vehicle Body and Trailer Manufacturing","16","945","32276","46",
"South Dakota","2003","337110","Wood Kitchen Cabinet and Countertop Manufacturing","37","1078","31533","46",
"South Dakota","2003","336211","Motor Vehicle Body Manufacturing","3","0","0","46",
"South Dakota","2003","3371  ","Household and Institutional Furniture and Kitchen Cabinet Manufacturing","51","0","0","46",
"South Dakota","2003","33711 ","Wood Kitchen Cabinet and Countertop Manufacturing","37","1078","31533","46",
"South Dakota","2003","339991","Gasket, Packing, and Sealing Device Manufacturing","1","0","0","46",
"South Dakota","2003","33712 ","Household and Institutional Furniture Manufacturing","14","0","0","46",
"South Dakota","2003","339950","Sign Manufacturing","19","1823","48538","46",
"South Dakota","2003","33999 ","All Other Miscellaneous Manufacturing","16","0","0","46",
"South Dakota","2003","339992","Musical Instrument Manufacturing","2","0","0","46",
"South Dakota","2003","42346 ","Ophthalmic Goods Merchant Wholesalers","5","39","939","46",
"South Dakota","2003","339994","Broom, Brush, and Mop Manufacturing","1","0","0","46",
"South Dakota","2003","42345 ","Medical, Dental, and Hospital Equipment and Supplies Merchant Wholesalers","14","67","3305","46",
"South Dakota","2003","423450","Medical, Dental, and Hospital Equipment and Supplies Merchant Wholesalers","14","67","3305","46",
"South Dakota","2003","42391 ","Sporting and Recreational Goods and Supplies Merchant Wholesalers","6","0","0","46",
"South Dakota","2003","423460","Ophthalmic Goods Merchant Wholesalers","5","39","939","46",
"South Dakota","2003","423860","Transportation Equipment and Supplies (except Motor Vehicle) Merchant Wholesalers","2","0","0","46",
"South Dakota","2003","4239  ","Miscellaneous Durable Goods Merchant Wholesalers","88","851","34145","46",
"South Dakota","2003","42449 ","Other Grocery and Related Products Merchant Wholesalers","25","488","15564","46",
"South Dakota","2003","423910","Sporting and Recreational Goods and Supplies Merchant Wholesalers","6","0","0","46",
"South Dakota","2003","42448 ","Fresh Fruit and Vegetable Merchant Wholesalers","5","0","0","46",
"South Dakota","2003","424480","Fresh Fruit and Vegetable Merchant Wholesalers","5","0","0","46",
"South Dakota","2003","424490","Other Grocery and Related Products Merchant Wholesalers","25","488","15564","46",
"South Dakota","2003","6221  ","General Medical and Surgical Hospitals","57","21441","853899","46",
"South Dakota","2003","621420","Outpatient Mental Health and Substance Abuse Centers","43","0","0","46",
"South Dakota","2003","62149 ","Other Outpatient Care Centers","56","0","0","46",
"South Dakota","2003","621492","Kidney Dialysis Centers","5","0","0","46",
"South Dakota","2003","621493","Freestanding Ambulatory Surgical and Emergency Centers","11","0","0","46",
"South Dakota","2003","622   ","Hospitals","62","22251","882390","46",
"South Dakota","2003","62211 ","General Medical and Surgical Hospitals","57","21441","853899","46",
"South Dakota","2003","622110","General Medical and Surgical Hospitals","57","21441","853899","46",
"South Dakota","2003","623312","Homes for the Elderly","57","0","0","46",
"South Dakota","2003","6223  ","Specialty (except Psychiatric and Substance Abuse) Hospitals","5","810","28491","46",
"South Dakota","2003","62331 ","Community Care Facilities for the Elderly","88","1954","28727","46",
"South Dakota","2003","623311","Continuing Care Retirement Communities","31","0","0","46",
"South Dakota","2003","6239  ","Other Residential Care Facilities","16","643","14040","46",
"South Dakota","2003","624230","Emergency and Other Relief Services","11","38","459","46",
"South Dakota","2003","62399 ","Other Residential Care Facilities","16","643","14040","46",
"South Dakota","2003","624229","Other Community Housing Services","26","0","0","46",
"South Dakota","2003","62423 ","Emergency and Other Relief Services","11","38","459","46",
"South Dakota","2003","6243  ","Vocational Rehabilitation Services","23","904","12409","46",
"South Dakota","2003","711130","Musical Groups and Artists","9","0","0","46",
"South Dakota","2003","71112 ","Dance Companies","1","0","0","46",
"South Dakota","2003","711120","Dance Companies","1","0","0","46",
"South Dakota","2003","71113 ","Musical Groups and Artists","9","0","0","46",
"South Dakota","2003","71141 ","Agents and Managers for Artists, Athletes, Entertainers, and Other Public Figures","5","0","0","46",
"South Dakota","2003","7112  ","Spectator Sports","21","89","2058","46",
"South Dakota","2003","711320","Promoters of Performing Arts, Sports, and Similar Events without Facilities","11","0","0","46",
"South Dakota","2003","7114  ","Agents and Managers for Artists, Athletes, Entertainers, and Other Public Figures","5","0","0","46",
"South Dakota","2003","711410","Agents and Managers for Artists, Athletes, Entertainers, and Other Public Figures","5","0","0","46",
"South Dakota","2003","712190","Nature Parks and Other Similar Institutions","9","0","0","46",
"South Dakota","2003","71213 ","Zoos and Botanical Gardens","3","0","0","46",
"South Dakota","2003","712130","Zoos and Botanical Gardens","3","0","0","46",
"South Dakota","2003","71219 ","Nature Parks and Other Similar Institutions","9","0","0","46",
"South Dakota","2003","71391 ","Golf Courses and Country Clubs","75","479","13231","46",
"South Dakota","2003","713   ","Amusement, Gambling, and Recreation Industries","471","4684","74688","46",
"South Dakota","2003","713290","Other Gambling Industries","99","894","16381","46",
"South Dakota","2003","7139  ","Other Amusement and Recreation Industries","299","0","0","46",
"South Dakota","2003","713910","Golf Courses and Country Clubs","75","479","13231","46",
"South Dakota","2003","71392 ","Skiing Facilities","3","0","0","46",
"South Dakota","2003","721110","Hotels (except Casino Hotels) and Motels","399","6052","80030","46",
"South Dakota","2003","721   ","Accommodation","504","7488","108452","46",
"South Dakota","2003","7211  ","Traveler Accommodation","432","7362","103792","46",
"South Dakota","2003","72111 ","Hotels (except Casino Hotels) and Motels","399","6052","80030","46",
"South Dakota","2003","7221  ","Full-Service Restaurants","655","10997","105945","46",
"South Dakota","2003","72131 ","Rooming and Boarding Houses","14","0","0","46",
"South Dakota","2003","721310","Rooming and Boarding Houses","14","0","0","46",
"South Dakota","2003","722   ","Food Services and Drinking Places","1656","24433","234732","46",
"South Dakota","2003","722330","Mobile Food Services","13","0","0","46",
"South Dakota","2003","72232 ","Caterers","15","0","0","46",
"South Dakota","2003","722320","Caterers","15","0","0","46",
"South Dakota","2003","72233 ","Mobile Food Services","13","0","0","46",
"South Dakota","2003","7224  ","Drinking Places (Alcoholic Beverages)","362","2442","22252","46",
"South Dakota","2003","811122","Automotive Glass Replacement Shops","25","72","2042","46",
"South Dakota","2003","811118","Other Automotive Mechanical and Electrical Repair and Maintenance","28","132","3367","46",
"South Dakota","2003","81112 ","Automotive Body, Paint, Interior, and Glass Repair","187","689","16964","46",
"South Dakota","2003","811121","Automotive Body, Paint, and Interior Repair and Maintenance","162","617","14922","46",
"South Dakota","2003","236   ","Construction of Buildings","929","4807","146276","46",
"South Dakota","2003","211111","Crude Petroleum and Natural Gas Extraction","7","0","0","46",
"South Dakota","2003","212   ","Mining (except Oil and Gas)","44","839","36625","46",
"South Dakota","2003","2121  ","Coal Mining","1","0","0","46",
"South Dakota","2003","21211 ","Coal Mining","1","0","0","46",
"South Dakota","2003","212111","Bituminous Coal and Lignite Surface Mining","1","0","0","46",
"South Dakota","2003","2361  ","Residential Building Construction","755","2571","62490","46",
"South Dakota","2003","23611 ","Residential Building Construction","755","2571","62490","46",
"South Dakota","2003","238220","Plumbing, Heating, and Air-Conditioning Contractors","341","2636","86701","46",
"South Dakota","2003","236115","New Single-Family Housing Construction (except Operative Builders)","487","1668","40735","46",
"South Dakota","2003","238210","Electrical Contractors","264","1809","54563","46",
"South Dakota","2003","23822 ","Plumbing, Heating, and Air-Conditioning Contractors","341","2636","86701","46",
"South Dakota","2003","311823","Dry Pasta Manufacturing","1","0","0","46",
"South Dakota","2003","23829 ","Other Building Equipment Contractors","23","99","4149","46",
"South Dakota","2003","311821","Cookie and Cracker Manufacturing","1","0","0","46",
"South Dakota","2003","311822","Flour Mixes and Dough Manufacturing from Purchased Flour","1","0","0","46",
"South Dakota","2003","3219  ","Other Wood Product Manufacturing","34","470","9396","46",
"South Dakota","2003","3119  ","Other Food Manufacturing","7","0","0","46",
"South Dakota","2003","321214","Truss Manufacturing","8","0","0","46",
"South Dakota","2003","321219","Reconstituted Wood Product Manufacturing","1","0","0","46",
"South Dakota","2003","32191 ","Millwork","18","255","4899","46",
"South Dakota","2003","32591 ","Printing Ink Manufacturing","1","0","0","46",
"South Dakota","2003","321911","Wood Window and Door Manufacturing","4","0","0","46",
"South Dakota","2003","325620","Toilet Preparation Manufacturing","1","0","0","46",
"South Dakota","2003","3259  ","Other Chemical Product and Preparation Manufacturing","8","0","0","46",
"South Dakota","2003","33131 ","Alumina and Aluminum Production and Processing","3","0","0","46",
"South Dakota","2003","325910","Printing Ink Manufacturing","1","0","0","46",
"South Dakota","2003","331222","Steel Wire Drawing","1","0","0","46",
"South Dakota","2003","3313  ","Alumina and Aluminum Production and Processing","3","0","0","46",
"South Dakota","2003","331314","Secondary Smelting and Alloying of Aluminum","1","0","0","46",
"South Dakota","2003","337127","Institutional Furniture Manufacturing","1","0","0","46",
"South Dakota","2003","331315","Aluminum Sheet, Plate, and Foil Manufacturing","1","0","0","46",
"South Dakota","2003","337121","Upholstered Household Furniture Manufacturing","3","0","0","46",
"South Dakota","2003","337122","Nonupholstered Wood Household Furniture Manufacturing","10","216","6239","46",
"South Dakota","2003","423   ","Merchant Wholesalers, Durable Goods","690","7640","280863","46",
"South Dakota","2003","3372  ","Office Furniture (including Fixtures) Manufacturing","11","0","0","46",
"South Dakota","2003","339999","All Other Miscellaneous Manufacturing","12","0","0","46",
"South Dakota","2003","42    ","Wholesale Trade","1295","14650","484115","46",
"South Dakota","2003","4235  ","Metal and Mineral (except Petroleum) Merchant Wholesalers","12","0","0","46",
"South Dakota","2003","4231  ","Motor Vehicle and Motor Vehicle Parts and Supplies Merchant Wholesalers","98","1320","38419","46",
"South Dakota","2003","42349 ","Other Professional Equipment and Supplies Merchant Wholesalers","8","128","4083","46",
"South Dakota","2003","423490","Other Professional Equipment and Supplies Merchant Wholesalers","8","128","4083","46",
"South Dakota","2003","42393 ","Recyclable Material Merchant Wholesalers","20","153","3899","46",
"South Dakota","2003","42351 ","Metal Service Centers and Other Metal Merchant Wholesalers","10","0","0","46",
"South Dakota","2003","42392 ","Toy and Hobby Goods and Supplies Merchant Wholesalers","7","0","0","46",
"South Dakota","2003","423920","Toy and Hobby Goods and Supplies Merchant Wholesalers","7","0","0","46",
"South Dakota","2003","424510","Grain and Field Bean Merchant Wholesalers","167","1323","45001","46",
"South Dakota","2003","423930","Recyclable Material Merchant Wholesalers","20","153","3899","46",
"South Dakota","2003","4245  ","Farm Product Raw Material Merchant Wholesalers","200","1679","48633","46",
"South Dakota","2003","42451 ","Grain and Field Bean Merchant Wholesalers","167","1323","45001","46",
"South Dakota","2003","42452 ","Livestock Merchant Wholesalers","29","342","3080","46",
"South Dakota","2003","81131 ","Commercial and Industrial Machinery and Equipment (except Automotive and Electronic) Repair and Maintenance","110","386","8918","46",
"South Dakota","2003","424520","Livestock Merchant Wholesalers","29","342","3080","46",
"South Dakota","2003","811219","Other Electronic and Precision Equipment Repair and Maintenance","2","0","0","46",
"South Dakota","2003","8113  ","Commercial and Industrial Machinery and Equipment (except Automotive and Electronic) Repair and Maintenance","110","386","8918","46",
"South Dakota","2003","8121  ","Personal Care Services","262","1241","18713","46",
"South Dakota","2003","81149 ","Other Personal and Household Goods Repair and Maintenance","28","73","1395","46",
"South Dakota","2003","811490","Other Personal and Household Goods Repair and Maintenance","28","73","1395","46",
"South Dakota","2003","812   ","Personal and Laundry Services","522","2678","45654","46",
"South Dakota","2003","812331","Linen Supply","3","0","0","46",
"South Dakota","2003","81232 ","Drycleaning and Laundry Services (except Coin-Operated)","39","307","4158","46",
"South Dakota","2003","812320","Drycleaning and Laundry Services (except Coin-Operated)","39","307","4158","46",
"South Dakota","2003","81233 ","Linen and Uniform Supply","10","0","0","46",
"South Dakota","2003","813211","Grantmaking Foundations","20","173","4320","46",
"South Dakota","2003","813110","Religious Organizations","837","5049","67869","46",
"South Dakota","2003","8132  ","Grantmaking and Giving Services","54","292","7606","46",
"South Dakota","2003","81321 ","Grantmaking and Giving Services","54","292","7606","46",
"South Dakota","2003","813212","Voluntary Health Organizations","18","0","0","46",
"South Dakota","2003","512290","Other Sound Recording Industries","1","0","0","46",
"South Dakota","2003","81399 ","Other Similar Organizations (except Business, Professional, Labor, and Political Organizations)","31","0","0","46",
"South Dakota","2003","813990","Other Similar Organizations (except Business, Professional, Labor, and Political Organizations)","31","0","0","46",
"South Dakota","2003","99    ","Unclassified","172","0","0","46",
"South Dakota","2003","512240","Sound Recording Studios","1","0","0","46",
"South Dakota","2003","51229 ","Other Sound Recording Industries","1","0","0","46",
"South Dakota","2003","515   ","Broadcasting (except Internet)","56","1301","34034","46",
"South Dakota","2003","5151  ","Radio and Television Broadcasting","56","1301","34034","46",
"South Dakota","2003","5172  ","Wireless Telecommunications Carriers (except Satellite)","36","0","0","46",
"South Dakota","2003","5171  ","Wired Telecommunications Carriers","113","0","0","46",
"South Dakota","2003","51711 ","Wired Telecommunications Carriers","113","0","0","46",
"South Dakota","2003","517110","Wired Telecommunications Carriers","113","0","0","46",
"South Dakota","2003","51821 ","Data Processing, Hosting, and Related Services","23","728","18325","46",
"South Dakota","2003","518111","Internet Service Providers","15","0","0","46",
"South Dakota","2003","518112","Web Search Portals","2","0","0","46",
"South Dakota","2003","5182  ","Data Processing, Hosting, and Related Services","23","728","18325","46",
"South Dakota","2003","5222  ","Nondepository Credit Intermediation","171","8411","293454","46",
"South Dakota","2003","522120","Savings Institutions","52","484","16359","46",
"South Dakota","2003","52213 ","Credit Unions","83","705","19236","46",
"South Dakota","2003","522130","Credit Unions","83","705","19236","46",
"South Dakota","2003","52221 ","Credit Card Issuing","15","6143","192871","46",
"South Dakota","2003","48423 ","Specialized Freight (except Used Goods) Trucking, Long-Distance","106","0","0","46",
"South Dakota","2003","48511 ","Urban Transit Systems","5","0","0","46",
"South Dakota","2003","484230","Specialized Freight (except Used Goods) Trucking, Long-Distance","106","0","0","46",
"South Dakota","2003","485   ","Transit and Ground Passenger Transportation","72","871","12300","46",
"South Dakota","2003","4851  ","Urban Transit Systems","5","0","0","46",
"South Dakota","2003","21222 ","Gold Ore and Silver Ore Mining","5","0","0","46",
"South Dakota","2003","00    ","Total","24468","299779","7961531","46",
"South Dakota","2003","11    ","Forestry, Fishing, Hunting, and Agriculture Support","131","0","0","46",
"South Dakota","2003","113   ","Forestry and Logging","22","0","0","46",
"South Dakota","2003","1131  ","Timber Tract Operations","3","0","0","46",
"South Dakota","2003","2122  ","Metal Ore Mining","5","0","0","46",
"South Dakota","2003","212221","Gold Ore Mining","4","0","0","46",
"South Dakota","2003","236118","Residential Remodelers","183","529","10597","46",
"South Dakota","2003","212222","Silver Ore Mining","1","0","0","46",
"South Dakota","2003","236116","New Multifamily Housing Construction (except Operative Builders)","22","153","4729","46",
"South Dakota","2003","236117","New Housing Operative Builders","63","221","6429","46",
"South Dakota","2003","2383  ","Building Finishing Contractors","369","1490","36586","46",
"South Dakota","2003","2362  ","Nonresidential Building Construction","174","2236","83786","46",
"South Dakota","2003","23621 ","Industrial Building Construction","4","0","0","46",
"South Dakota","2003","238290","Other Building Equipment Contractors","23","99","4149","46",
"South Dakota","2003","23831 ","Drywall and Insulation Contractors","92","534","14679","46",
"South Dakota","2003","238310","Drywall and Insulation Contractors","92","534","14679","46",
"South Dakota","2003","31199 ","All Other Food Manufacturing","5","0","0","46",
"South Dakota","2003","23832 ","Painting and Wall Covering Contractors","109","348","7867","46",
"South Dakota","2003","31191 ","Snack Food Manufacturing","2","0","0","46",
"South Dakota","2003","311919","Other Snack Food Manufacturing","2","0","0","46",
"South Dakota","2003","311999","All Other Miscellaneous Food Manufacturing","5","0","0","46",
"South Dakota","2003","32192 ","Wood Container and Pallet Manufacturing","5","0","0","46",
"South Dakota","2003","312   ","Beverage and Tobacco Product Manufacturing","5","265","7642","46",
"South Dakota","2003","321912","Cut Stock, Resawing Lumber, and Planing","11","211","4089","46",
"South Dakota","2003","321918","Other Millwork (including Flooring)","3","0","0","46",
"South Dakota","2003","321920","Wood Container and Pallet Manufacturing","5","0","0","46",
"South Dakota","2003","325991","Custom Compounding of Purchased Resins","1","0","0","46",
"South Dakota","2003","32592 ","Explosives Manufacturing","1","0","0","46",
"South Dakota","2003","325920","Explosives Manufacturing","1","0","0","46",
"South Dakota","2003","32599 ","All Other Chemical Product and Preparation Manufacturing","6","0","0","46",
"South Dakota","2003","33141 ","Nonferrous Metal (except Aluminum) Smelting and Refining","1","0","0","46",
"South Dakota","2003","325992","Photographic Film, Paper, Plate, and Chemical Manufacturing","2","0","0","46",
"South Dakota","2003","331316","Aluminum Extruded Product Manufacturing","1","0","0","46",
"South Dakota","2003","3314  ","Nonferrous Metal (except Aluminum) Production and Processing","2","0","0","46",
"South Dakota","2003","42312 ","Motor Vehicle Supplies and New Parts Merchant Wholesalers","49","676","18969","46",
"South Dakota","2003","331419","Primary Smelting and Refining of Nonferrous Metal (except Copper and Aluminum)","1","0","0","46",
"South Dakota","2003","42311 ","Automobile and Other Motor Vehicle Merchant Wholesalers","31","438","12578","46",
"South Dakota","2003","423110","Automobile and Other Motor Vehicle Merchant Wholesalers","31","438","12578","46",
"South Dakota","2003","423520","Coal and Other Mineral and Ore Merchant Wholesalers","2","0","0","46",
"South Dakota","2003","423120","Motor Vehicle Supplies and New Parts Merchant Wholesalers","49","676","18969","46",
"South Dakota","2003","423510","Metal Service Centers and Other Metal Merchant Wholesalers","10","0","0","46",
"South Dakota","2003","42352 ","Coal and Other Mineral and Ore Merchant Wholesalers","2","0","0","46",
"South Dakota","2003","42399 ","Other Miscellaneous Durable Goods Merchant Wholesalers","37","376","17695","46",
"South Dakota","2003","4236  ","Electrical and Electronic Goods Merchant Wholesalers","47","579","29217","46",
"South Dakota","2003","42394 ","Jewelry, Watch, Precious Stone, and Precious Metal Merchant Wholesalers","18","0","0","46",
"South Dakota","2003","423940","Jewelry, Watch, Precious Stone, and Precious Metal Merchant Wholesalers","18","0","0","46",
"South Dakota","2003","4246  ","Chemical and Allied Products Merchant Wholesalers","21","0","0","46",
"South Dakota","2003","423990","Other Miscellaneous Durable Goods Merchant Wholesalers","37","376","17695","46",
"South Dakota","2003","42459 ","Other Farm Product Raw Material Merchant Wholesalers","4","14","552","46",
"South Dakota","2003","424590","Other Farm Product Raw Material Merchant Wholesalers","4","14","552","46",
"South Dakota","2003","42461 ","Plastics Materials and Basic Forms and Shapes Merchant Wholesalers","2","0","0","46",
"South Dakota","2003","52229 ","Other Nondepository Credit Intermediation","138","1657","81106","46",
