"Hawaii","2005","3279  ","Other Nonmetallic Mineral Product Manufacturing","16","117","4068","15",
"Hawaii","2005","322215","Nonfolding Sanitary Food Container Manufacturing","1","0","0","15",
"Hawaii","2005","32222 ","Paper Bag and Coated and Treated Paper Manufacturing","1","0","0","15",
"Hawaii","2005","322221","Coated and Laminated Packaging Paper and Plastics Film Manufacturing","1","0","0","15",
"Hawaii","2005","3344  ","Semiconductor and Other Electronic Component Manufacturing","1","0","0","15",
"Hawaii","2005","32799 ","All Other Nonmetallic Mineral Product Manufacturing","16","117","4068","15",
"Hawaii","2005","327991","Cut Stone and Stone Product Manufacturing","15","0","0","15",
"Hawaii","2005","327993","Mineral Wool Manufacturing","1","0","0","15",
"Hawaii","2005","33994 ","Office Supplies (except Paper) Manufacturing","2","0","0","15",
"Hawaii","2005","33441 ","Semiconductor and Other Electronic Component Manufacturing","1","0","0","15",
"Hawaii","2005","334418","Printed Circuit Assembly (Electronic Assembly) Manufacturing","1","0","0","15",
"Hawaii","2005","3345  ","Navigational, Measuring, Electromedical, and Control Instruments Manufacturing","6","63","3815","15",
"Hawaii","2005","33999 ","All Other Miscellaneous Manufacturing","19","0","0","15",
"Hawaii","2005","339943","Marking Device Manufacturing","2","0","0","15",
"Hawaii","2005","33995 ","Sign Manufacturing","27","120","3295","15",
"Hawaii","2005","339950","Sign Manufacturing","27","120","3295","15",
"Hawaii","2005","42381 ","Construction and Mining (except Oil Well) Machinery and Equipment Merchant Wholesalers","14","246","11543","15",
"Hawaii","2005","424690","Other Chemical and Allied Products Merchant Wholesalers","24","156","7064","15",
"Hawaii","2005","423810","Construction and Mining (except Oil Well) Machinery and Equipment Merchant Wholesalers","14","246","11543","15",
"Hawaii","2005","42382 ","Farm and Garden Machinery and Equipment Merchant Wholesalers","13","87","7094","15",
"Hawaii","2005","42461 ","Plastics Materials and Basic Forms and Shapes Merchant Wholesalers","7","0","0","15",
"Hawaii","2005","424610","Plastics Materials and Basic Forms and Shapes Merchant Wholesalers","7","0","0","15",
"Hawaii","2005","42469 ","Other Chemical and Allied Products Merchant Wholesalers","24","156","7064","15",
"Hawaii","2005","444120","Paint and Wallpaper Stores","26","145","5678","15",
"Hawaii","2005","444190","Other Building Material Dealers","122","937","37969","15",
"Hawaii","2005","44413 ","Hardware Stores","46","625","14081","15",
"Hawaii","2005","444130","Hardware Stores","46","625","14081","15",
"Hawaii","2005","44419 ","Other Building Material Dealers","122","937","37969","15",
"Hawaii","2005","4512  ","Book, Periodical, and Music Stores","84","1161","16169","15",
"Hawaii","2005","45122 ","Prerecorded Tape, Compact Disc, and Record Stores","28","331","2908","15",
"Hawaii","2005","45121 ","Book Stores and News Dealers","56","830","13261","15",
"Hawaii","2005","451211","Book Stores","52","0","0","15",
"Hawaii","2005","451212","News Dealers and Newsstands","4","0","0","15",
"Hawaii","2005","484122","General Freight Trucking, Long-Distance, Less Than Truckload","5","0","0","15",
"Hawaii","2005","493120","Refrigerated Warehousing and Storage","7","161","6107","15",
"Hawaii","2005","4842  ","Specialized Freight Trucking","109","1809","68669","15",
"Hawaii","2005","48421 ","Used Household and Office Goods Moving","28","1051","37468","15",
"Hawaii","2005","484210","Used Household and Office Goods Moving","28","1051","37468","15",
"Hawaii","2005","49319 ","Other Warehousing and Storage","12","0","0","15",
"Hawaii","2005","51821 ","Data Processing, Hosting, and Related Services","71","1166","51936","15",
"Hawaii","2005","493190","Other Warehousing and Storage","12","0","0","15",
"Hawaii","2005","51    ","Information","631","10291","471448","15",
"Hawaii","2005","511   ","Publishing Industries (except Internet)","100","2397","107100","15",
"Hawaii","2005","52593 ","Real Estate Investment Trusts","3","0","0","15",
"Hawaii","2005","518210","Data Processing, Hosting, and Related Services","71","1166","51936","15",
"Hawaii","2005","519   ","Other Information Services","10","75","1799","15",
"Hawaii","2005","5191  ","Other Information Services","10","75","1799","15",
"Hawaii","2005","525930","Real Estate Investment Trusts","3","0","0","15",
"Hawaii","2005","5413  ","Architectural, Engineering, and Related Services","634","5340","337121","15",
"Hawaii","2005","52599 ","Other Financial Vehicles","1","0","0","15",
"Hawaii","2005","525990","Other Financial Vehicles","1","0","0","15",
"Hawaii","2005","53    ","Real Estate and Rental and Leasing","2111","15047","564209","15",
"Hawaii","2005","54131 ","Architectural Services","195","1209","82774","15",
"Hawaii","2005","541310","Architectural Services","195","1209","82774","15",
"Hawaii","2005","55    ","Management of Companies and Enterprises","227","5542","330894","15",
"Hawaii","2005","54132 ","Landscape Architectural Services","39","276","15523","15",
"Hawaii","2005","541320","Landscape Architectural Services","39","276","15523","15",
"Hawaii","2005","541990","All Other Professional, Scientific, and Technical Services","40","200","3792","15",
"Hawaii","2005","562112","Hazardous Waste Collection","2","0","0","15",
"Hawaii","2005","551   ","Management of Companies and Enterprises","227","5542","330894","15",
"Hawaii","2005","5511  ","Management of Companies and Enterprises","227","5542","330894","15",
"Hawaii","2005","55111 ","Management of Companies and Enterprises","227","5542","330894","15",
"Hawaii","2005","562119","Other Waste Collection","3","0","0","15",
"Hawaii","2005","5622  ","Waste Treatment and Disposal","17","332","17427","15",
"Hawaii","2005","62149 ","Other Outpatient Care Centers","80","4116","176682","15",
"Hawaii","2005","56221 ","Waste Treatment and Disposal","17","332","17427","15",
"Hawaii","2005","562211","Hazardous Waste Treatment and Disposal","9","0","0","15",
"Hawaii","2005","621420","Outpatient Mental Health and Substance Abuse Centers","28","891","21521","15",
"Hawaii","2005","71119 ","Other Performing Arts Companies","1","0","0","15",
"Hawaii","2005","621491","HMO Medical Centers","19","0","0","15",
"Hawaii","2005","621492","Kidney Dialysis Centers","15","0","0","15",
"Hawaii","2005","711130","Musical Groups and Artists","15","0","0","15",
"Hawaii","2005","711190","Other Performing Arts Companies","1","0","0","15",
"Hawaii","2005","72241 ","Drinking Places (Alcoholic Beverages)","257","1890","27115","15",
"Hawaii","2005","7112  ","Spectator Sports","8","0","0","15",
"Hawaii","2005","71121 ","Spectator Sports","8","0","0","15",
"Hawaii","2005","7224  ","Drinking Places (Alcoholic Beverages)","257","1890","27115","15",
"Hawaii","2005","722410","Drinking Places (Alcoholic Beverages)","257","1890","27115","15",
"Hawaii","2005","813211","Grantmaking Foundations","30","231","9098","15",
"Hawaii","2005","81    ","Other Services (except Public Administration)","3403","24304","588160","15",
"Hawaii","2005","811   ","Repair and Maintenance","739","4064","131905","15",
"Hawaii","2005","81321 ","Grantmaking and Giving Services","68","519","19866","15",
"Hawaii","2005","813212","Voluntary Health Organizations","26","0","0","15",
"Hawaii","2005","23834 ","Tile and Terrazzo Contractors","53","360","16307","15",
"Hawaii","2005","813219","Other Grantmaking and Giving Services","12","0","0","15",
"Hawaii","2005","8133  ","Social Advocacy Organizations","79","824","31127","15",
"Hawaii","2005","22111 ","Electric Power Generation","14","0","0","15",
"Hawaii","2005","221112","Fossil Fuel Electric Power Generation","10","0","0","15",
"Hawaii","2005","221119","Other Electric Power Generation","4","0","0","15",
"Hawaii","2005","22112 ","Electric Power Transmission, Control, and Distribution","7","0","0","15",
"Hawaii","2005","221122","Electric Power Distribution","7","0","0","15",
"Hawaii","2005","23839 ","Other Building Finishing Contractors","28","197","6676","15",
"Hawaii","2005","238340","Tile and Terrazzo Contractors","53","360","16307","15",
"Hawaii","2005","23835 ","Finish Carpentry Contractors","83","734","32374","15",
"Hawaii","2005","238350","Finish Carpentry Contractors","83","734","32374","15",
"Hawaii","2005","31211 ","Soft Drink and Ice Manufacturing","18","573","21486","15",
"Hawaii","2005","31212 ","Breweries","4","0","0","15",
"Hawaii","2005","312111","Soft Drink Manufacturing","6","445","17381","15",
"Hawaii","2005","312112","Bottled Water Manufacturing","7","87","2621","15",
"Hawaii","2005","312113","Ice Manufacturing","5","41","1484","15",
"Hawaii","2005","32229 ","Other Converted Paper Product Manufacturing","2","0","0","15",
"Hawaii","2005","322299","All Other Converted Paper Product Manufacturing","2","0","0","15",
"Hawaii","2005","331   ","Primary Metal Manufacturing","3","0","0","15",
"Hawaii","2005","323   ","Printing and Related Support Activities","128","1457","45244","15",
"Hawaii","2005","3231  ","Printing and Related Support Activities","128","1457","45244","15",
"Hawaii","2005","32311 ","Printing","125","1427","44052","15",
"Hawaii","2005","3311  ","Iron and Steel Mills and Ferroalloy Manufacturing","2","0","0","15",
"Hawaii","2005","33451 ","Navigational, Measuring, Electromedical, and Control Instruments Manufacturing","6","63","3815","15",
"Hawaii","2005","33111 ","Iron and Steel Mills and Ferroalloy Manufacturing","2","0","0","15",
"Hawaii","2005","331111","Iron and Steel Mills","2","0","0","15",
"Hawaii","2005","3312  ","Steel Product Manufacturing from Purchased Steel","1","0","0","15",
"Hawaii","2005","339992","Musical Instrument Manufacturing","6","0","0","15",
"Hawaii","2005","334510","Electromedical and Electrotherapeutic Apparatus Manufacturing","2","0","0","15",
"Hawaii","2005","334513","Instruments and Related Products Manufacturing for Measuring, Displaying, and Controlling Industrial Process Variables","2","0","0","15",
"Hawaii","2005","334516","Analytical Laboratory Instrument Manufacturing","1","0","0","15",
"Hawaii","2005","423   ","Merchant Wholesalers, Durable Goods","824","7751","337677","15",
"Hawaii","2005","339994","Broom, Brush, and Mop Manufacturing","1","0","0","15",
"Hawaii","2005","339999","All Other Miscellaneous Manufacturing","12","0","0","15",
"Hawaii","2005","42    ","Wholesale Trade","1861","19978","763702","15",
"Hawaii","2005","423820","Farm and Garden Machinery and Equipment Merchant Wholesalers","13","87","7094","15",
"Hawaii","2005","42383 ","Industrial Machinery and Equipment Merchant Wholesalers","43","413","17991","15",
"Hawaii","2005","4247  ","Petroleum and Petroleum Products Merchant Wholesalers","27","0","0","15",
"Hawaii","2005","423830","Industrial Machinery and Equipment Merchant Wholesalers","43","413","17991","15",
"Hawaii","2005","42384 ","Industrial Supplies Merchant Wholesalers","19","245","8533","15",
"Hawaii","2005","423840","Industrial Supplies Merchant Wholesalers","19","245","8533","15",
"Hawaii","2005","4442  ","Lawn and Garden Equipment and Supplies Stores","50","368","9110","15",
"Hawaii","2005","42471 ","Petroleum Bulk Stations and Terminals","19","0","0","15",
"Hawaii","2005","424710","Petroleum Bulk Stations and Terminals","19","0","0","15",
"Hawaii","2005","42472 ","Petroleum and Petroleum Products Merchant Wholesalers (except Bulk Stations and Terminals)","8","0","0","15",
"Hawaii","2005","44421 ","Outdoor Power Equipment Stores","7","58","1991","15",
"Hawaii","2005","45211 ","Department Stores","34","8132","163453","15",
"Hawaii","2005","444210","Outdoor Power Equipment Stores","7","58","1991","15",
"Hawaii","2005","44422 ","Nursery, Garden Center, and Farm Supply Stores","43","310","7119","15",
"Hawaii","2005","451220","Prerecorded Tape, Compact Disc, and Record Stores","28","331","2908","15",
"Hawaii","2005","452   ","General Merchandise Stores","108","12493","272596","15",
"Hawaii","2005","4521  ","Department Stores","34","8132","163453","15",
"Hawaii","2005","48422 ","Specialized Freight (except Used Goods) Trucking, Local","78","731","29813","15",
"Hawaii","2005","484220","Specialized Freight (except Used Goods) Trucking, Local","78","731","29813","15",
"Hawaii","2005","51111 ","Newspaper Publishers","24","1783","79281","15",
"Hawaii","2005","48423 ","Specialized Freight (except Used Goods) Trucking, Long-Distance","3","27","1388","15",
"Hawaii","2005","484230","Specialized Freight (except Used Goods) Trucking, Long-Distance","3","27","1388","15",
"Hawaii","2005","5111  ","Newspaper, Periodical, Book, and Directory Publishers","90","2326","104100","15",
"Hawaii","2005","51911 ","News Syndicates","3","0","0","15",
"Hawaii","2005","511110","Newspaper Publishers","24","1783","79281","15",
"Hawaii","2005","51112 ","Periodical Publishers","43","319","15012","15",
"Hawaii","2005","511120","Periodical Publishers","43","319","15012","15",
"Hawaii","2005","519110","News Syndicates","3","0","0","15",
"Hawaii","2005","51912 ","Libraries and Archives","4","0","0","15",
"Hawaii","2005","531   ","Real Estate","1671","10021","426806","15",
"Hawaii","2005","519120","Libraries and Archives","4","0","0","15",
"Hawaii","2005","51919 ","All Other Information Services","3","0","0","15",
"Hawaii","2005","519190","All Other Information Services","3","0","0","15",
"Hawaii","2005","5311  ","Lessors of Real Estate","634","2412","102972","15",
"Hawaii","2005","53111 ","Lessors of Residential Buildings and Dwellings","320","1064","30082","15",
"Hawaii","2005","541330","Engineering Services","308","3388","220207","15",
"Hawaii","2005","531110","Lessors of Residential Buildings and Dwellings","320","1064","30082","15",
"Hawaii","2005","53112 ","Lessors of Nonresidential Buildings (except Miniwarehouses)","244","970","47419","15",
"Hawaii","2005","54133 ","Engineering Services","308","3388","220207","15",
"Hawaii","2005","54134 ","Drafting Services","15","0","0","15",
"Hawaii","2005","551112","Offices of Other Holding Companies","20","0","0","15",
"Hawaii","2005","541340","Drafting Services","15","0","0","15",
"Hawaii","2005","54135 ","Building Inspection Services","20","0","0","15",
"Hawaii","2005","551111","Offices of Bank Holding Companies","1","0","0","15",
"Hawaii","2005","562213","Solid Waste Combustors and Incinerators","1","0","0","15",
"Hawaii","2005","551114","Corporate, Subsidiary, and Regional Managing Offices","206","5210","304622","15",
"Hawaii","2005","56    ","Administrative and Support and Waste Management and Remediation Services","1723","38021","973291","15",
"Hawaii","2005","562212","Solid Waste Landfill","7","0","0","15",
"Hawaii","2005","5629  ","Remediation and Other Waste Management Services","43","552","22628","15",
"Hawaii","2005","621498","All Other Outpatient Care Centers","34","1165","44838","15",
"Hawaii","2005","56291 ","Remediation Services","15","342","15153","15",
"Hawaii","2005","562910","Remediation Services","15","342","15153","15",
"Hawaii","2005","621493","Freestanding Ambulatory Surgical and Emergency Centers","12","196","11996","15",
"Hawaii","2005","6215  ","Medical and Diagnostic Laboratories","53","1709","78266","15",
"Hawaii","2005","711219","Other Spectator Sports","6","0","0","15",
"Hawaii","2005","62151 ","Medical and Diagnostic Laboratories","53","1709","78266","15",
"Hawaii","2005","621511","Medical Laboratories","34","1489","60700","15",
"Hawaii","2005","711211","Sports Teams and Clubs","2","0","0","15",
"Hawaii","2005","7113  ","Promoters of Performing Arts, Sports, and Similar Events","25","0","0","15",
"Hawaii","2005","81111 ","Automotive Mechanical and Electrical Repair and Maintenance","291","1214","37107","15",
"Hawaii","2005","71131 ","Promoters of Performing Arts, Sports, and Similar Events with Facilities","3","0","0","15",
"Hawaii","2005","711310","Promoters of Performing Arts, Sports, and Similar Events with Facilities","3","0","0","15",
"Hawaii","2005","8111  ","Automotive Repair and Maintenance","509","2755","85763","15",
"Hawaii","2005","81331 ","Social Advocacy Organizations","79","824","31127","15",
"Hawaii","2005","811111","General Automotive Repair","236","939","28716","15",
"Hawaii","2005","811112","Automotive Exhaust System Repair","18","132","4133","15",
"Hawaii","2005","811113","Automotive Transmission Repair","18","73","2094","15",
"Hawaii","2005","813311","Human Rights Organizations","9","45","2169","15",
"Hawaii","2005","813312","Environment, Conservation and Wildlife Organizations","38","358","11598","15",
"Hawaii","2005","238390","Other Building Finishing Contractors","28","197","6676","15",
"Hawaii","2005","813319","Other Social Advocacy Organizations","32","421","17360","15",
"Hawaii","2005","8134  ","Civic and Social Organizations","111","1774","27225","15",
"Hawaii","2005","2212  ","Natural Gas Distribution","1","0","0","15",
"Hawaii","2005","22121 ","Natural Gas Distribution","1","0","0","15",
"Hawaii","2005","221210","Natural Gas Distribution","1","0","0","15",
"Hawaii","2005","2213  ","Water, Sewage and Other Systems","24","0","0","15",
"Hawaii","2005","22131 ","Water Supply and Irrigation Systems","10","0","0","15",
"Hawaii","2005","2389  ","Other Specialty Trade Contractors","195","2369","125981","15",
"Hawaii","2005","312120","Breweries","4","0","0","15",
"Hawaii","2005","23891 ","Site Preparation Contractors","108","1437","85729","15",
"Hawaii","2005","238910","Site Preparation Contractors","108","1437","85729","15",
"Hawaii","2005","23899 ","All Other Specialty Trade Contractors","87","932","40252","15",
"Hawaii","2005","31213 ","Wineries","4","0","0","15",
"Hawaii","2005","312130","Wineries","4","0","0","15",
"Hawaii","2005","323110","Commercial Lithographic Printing","38","600","21073","15",
"Hawaii","2005","31214 ","Distilleries","2","0","0","15",
"Hawaii","2005","312140","Distilleries","2","0","0","15",
"Hawaii","2005","313   ","Textile Mills","2","0","0","15",
"Hawaii","2005","323111","Commercial Gravure Printing","2","0","0","15",
"Hawaii","2005","33122 ","Rolling and Drawing of Purchased Steel","1","0","0","15",
"Hawaii","2005","323113","Commercial Screen Printing","40","408","10207","15",
"Hawaii","2005","323114","Quick Printing","25","162","4823","15",
"Hawaii","2005","323115","Digital Printing","12","195","5870","15",
"Hawaii","2005","331221","Rolled Steel Shape Manufacturing","1","0","0","15",
"Hawaii","2005","334518","Watch, Clock, and Part Manufacturing","1","0","0","15",
"Hawaii","2005","332   ","Fabricated Metal Product Manufacturing","44","567","25095","15",
"Hawaii","2005","3321  ","Forging and Stamping","1","0","0","15",
"Hawaii","2005","33211 ","Forging and Stamping","1","0","0","15",
"Hawaii","2005","3346  ","Manufacturing and Reproducing Magnetic and Optical Media","2","0","0","15",
"Hawaii","2005","42311 ","Automobile and Other Motor Vehicle Merchant Wholesalers","15","102","4511","15",
"Hawaii","2005","33461 ","Manufacturing and Reproducing Magnetic and Optical Media","2","0","0","15",
"Hawaii","2005","334612","Prerecorded Compact Disc (except Software), Tape, and Record Reproducing","2","0","0","15",
"Hawaii","2005","4231  ","Motor Vehicle and Motor Vehicle Parts and Supplies Merchant Wholesalers","71","949","40513","15",
"Hawaii","2005","423850","Service Establishment Equipment and Supplies Merchant Wholesalers","13","104","4469","15",
"Hawaii","2005","423110","Automobile and Other Motor Vehicle Merchant Wholesalers","15","102","4511","15",
"Hawaii","2005","42312 ","Motor Vehicle Supplies and New Parts Merchant Wholesalers","44","733","31286","15",
"Hawaii","2005","42385 ","Service Establishment Equipment and Supplies Merchant Wholesalers","13","104","4469","15",
"Hawaii","2005","4248  ","Beer, Wine, and Distilled Alcoholic Beverage Merchant Wholesalers","29","1175","50149","15",
"Hawaii","2005","42386 ","Transportation Equipment and Supplies (except Motor Vehicle) Merchant Wholesalers","3","38","1937","15",
"Hawaii","2005","423860","Transportation Equipment and Supplies (except Motor Vehicle) Merchant Wholesalers","3","38","1937","15",
"Hawaii","2005","424720","Petroleum and Petroleum Products Merchant Wholesalers (except Bulk Stations and Terminals)","8","0","0","15",
"Hawaii","2005","445   ","Food and Beverage Stores","728","12923","263485","15",
"Hawaii","2005","42481 ","Beer and Ale Merchant Wholesalers","11","0","0","15",
"Hawaii","2005","424810","Beer and Ale Merchant Wholesalers","11","0","0","15",
"Hawaii","2005","444220","Nursery, Garden Center, and Farm Supply Stores","43","310","7119","15",
"Hawaii","2005","4451  ","Grocery Stores","494","11576","243977","15",
"Hawaii","2005","452112","Discount Department Stores","15","0","0","15",
"Hawaii","2005","44511 ","Supermarkets and Other Grocery (except Convenience) Stores","302","9669","203142","15",
"Hawaii","2005","445110","Supermarkets and Other Grocery (except Convenience) Stores","302","9669","203142","15",
"Hawaii","2005","452111","Department Stores (except Discount Department Stores)","19","0","0","15",
"Hawaii","2005","4529  ","Other General Merchandise Stores","74","4361","109143","15",
"Hawaii","2005","4851  ","Urban Transit Systems","5","0","0","15",
"Hawaii","2005","45291 ","Warehouse Clubs and Supercenters","11","2671","73362","15",
"Hawaii","2005","452910","Warehouse Clubs and Supercenters","11","2671","73362","15",
"Hawaii","2005","485   ","Transit and Ground Passenger Transportation","102","3453","99390","15",
"Hawaii","2005","48511 ","Urban Transit Systems","5","0","0","15",
"Hawaii","2005","511130","Book Publishers","13","0","0","15",
"Hawaii","2005","485113","Bus and Other Motor Vehicle Transit Systems","5","0","0","15",
"Hawaii","2005","4853  ","Taxi and Limousine Service","54","0","0","15",
"Hawaii","2005","51113 ","Book Publishers","13","0","0","15",
"Hawaii","2005","51114 ","Directory and Mailing List Publishers","7","0","0","15",
"Hawaii","2005","522   ","Credit Intermediation and Related Activities","833","11491","583794","15",
"Hawaii","2005","511140","Directory and Mailing List Publishers","7","0","0","15",
"Hawaii","2005","51119 ","Other Publishers","3","0","0","15",
"Hawaii","2005","52    ","Finance and Insurance","1600","19707","1060036","15",
"Hawaii","2005","53113 ","Lessors of Miniwarehouses and Self-Storage Units","38","217","4869","15",
"Hawaii","2005","5221  ","Depository Credit Intermediation","474","9391","441058","15",
"Hawaii","2005","52211 ","Commercial Banking","224","5727","299709","15",
"Hawaii","2005","531120","Lessors of Nonresidential Buildings (except Miniwarehouses)","244","970","47419","15",
"Hawaii","2005","531130","Lessors of Miniwarehouses and Self-Storage Units","38","217","4869","15",
"Hawaii","2005","541360","Geophysical Surveying and Mapping Services","3","0","0","15",
"Hawaii","2005","53119 ","Lessors of Other Real Estate Property","32","161","20602","15",
"Hawaii","2005","541350","Building Inspection Services","20","0","0","15",
"Hawaii","2005","54136 ","Geophysical Surveying and Mapping Services","3","0","0","15",
"Hawaii","2005","5611  ","Office Administrative Services","71","1003","41650","15",
"Hawaii","2005","54137 ","Surveying and Mapping (except Geophysical) Services","41","315","12707","15",
"Hawaii","2005","541370","Surveying and Mapping (except Geophysical) Services","41","315","12707","15",
"Hawaii","2005","561   ","Administrative and Support Services","1630","36582","913191","15",
"Hawaii","2005","56111 ","Office Administrative Services","71","1003","41650","15",
"Hawaii","2005","562920","Materials Recovery Facilities","2","0","0","15",
"Hawaii","2005","561110","Office Administrative Services","71","1003","41650","15",
"Hawaii","2005","5612  ","Facilities Support Services","19","240","8934","15",
"Hawaii","2005","56292 ","Materials Recovery Facilities","2","0","0","15",
"Hawaii","2005","56299 ","All Other Waste Management Services","26","0","0","15",
"Hawaii","2005","6216  ","Home Health Care Services","49","2393","50772","15",
"Hawaii","2005","562991","Septic Tank and Related Services","18","0","0","15",
"Hawaii","2005","562998","All Other Miscellaneous Waste Management Services","8","0","0","15",
"Hawaii","2005","621512","Diagnostic Imaging Centers","19","220","17566","15",
"Hawaii","2005","62161 ","Home Health Care Services","49","2393","50772","15",
"Hawaii","2005","711320","Promoters of Performing Arts, Sports, and Similar Events without Facilities","22","0","0","15",
"Hawaii","2005","621610","Home Health Care Services","49","2393","50772","15",
"Hawaii","2005","6219  ","Other Ambulatory Health Care Services","45","955","42812","15",
"Hawaii","2005","71132 ","Promoters of Performing Arts, Sports, and Similar Events without Facilities","22","0","0","15",
"Hawaii","2005","811121","Automotive Body, Paint, and Interior Repair and Maintenance","136","989","34468","15",
"Hawaii","2005","7114  ","Agents and Managers for Artists, Athletes, Entertainers, and Other Public Figures","8","0","0","15",
"Hawaii","2005","811118","Other Automotive Mechanical and Electrical Repair and Maintenance","19","70","2164","15",
"Hawaii","2005","81112 ","Automotive Body, Paint, Interior, and Glass Repair","163","1095","38462","15",
"Hawaii","2005","8139  ","Business, Professional, Labor, Political, and Similar Organizations","1047","5749","154318","15",
"Hawaii","2005","811122","Automotive Glass Replacement Shops","27","106","3994","15",
"Hawaii","2005","81341 ","Civic and Social Organizations","111","1774","27225","15",
"Hawaii","2005","813410","Civic and Social Organizations","111","1774","27225","15",
"Hawaii","2005","31-33 ","Manufacturing","946","14923","478722","15",
"Hawaii","2005","81391 ","Business Associations","59","284","12082","15",
"Hawaii","2005","221310","Water Supply and Irrigation Systems","10","0","0","15",
"Hawaii","2005","22132 ","Sewage Treatment Facilities","14","0","0","15",
"Hawaii","2005","221320","Sewage Treatment Facilities","14","0","0","15",
"Hawaii","2005","23    ","Construction","2753","29480","1556880","15",
