"GEO_TTL","YEAR","NAICS2007","NAICS2007_TTL","ESTAB","EMP","PAYANN","state",
"Oregon","2009","00    ","Total for all sectors","108040","1363826","53367462","41",
"Oregon","2009","11    ","Agriculture, forestry, fishing and hunting","1256","10560","355101","41",
"Oregon","2009","113   ","Forestry and logging","680","5337","195721","41",
"Oregon","2009","1131  ","Timber tract operations","30","125","5726","41",
"Oregon","2009","11321 ","Forest nurseries and gathering of forest products","9","0","0","41",
"Oregon","2009","11331 ","Logging","641","4911","184042","41",
"Oregon","2009","1141  ","Fishing","133","212","8369","41",
"Oregon","2009","11311 ","Timber tract operations","30","125","5726","41",
"Oregon","2009","113110","Timber tract operations","30","125","5726","41",
"Oregon","2009","1132  ","Forest nurseries and gathering of forest products","9","0","0","41",
"Oregon","2009","113210","Forest nurseries and gathering of forest products","9","0","0","41",
"Oregon","2009","1133  ","Logging","641","4911","184042","41",
"Oregon","2009","113310","Logging","641","4911","184042","41",
"Oregon","2009","114   ","Fishing, hunting and trapping","138","220","8427","41",
"Oregon","2009","11411 ","Fishing","133","212","8369","41",
"Oregon","2009","114210","Hunting and trapping","5","0","0","41",
"Oregon","2009","114111","Finfish fishing","97","113","4751","41",
"Oregon","2009","114112","Shellfish fishing","32","0","1826","41",
"Oregon","2009","114119","Other marine fishing","4","0","0","41",
"Oregon","2009","1142  ","Hunting and trapping","5","0","0","41",
"Oregon","2009","11421 ","Hunting and trapping","5","0","0","41",
"Oregon","2009","115   ","Support activities for agriculture and forestry","438","5003","150953","41",
"Oregon","2009","115115","Farm labor contractors and crew leaders","26","536","17078","41",
"Oregon","2009","1151  ","Support activities for crop production","113","1834","60740","41",
"Oregon","2009","11511 ","Support activities for crop production","113","1834","60740","41",
"Oregon","2009","115112","Soil preparation, planting, and cultivating","38","154","4162","41",
"Oregon","2009","115113","Crop harvesting, primarily by machine","9","112","4573","41",
"Oregon","2009","115114","Postharvest crop activities (except cotton ginning)","31","983","33477","41",
"Oregon","2009","115116","Farm management services","9","0","0","41",
"Oregon","2009","115310","Support activities for forestry","236","2972","86998","41",
"Oregon","2009","1152  ","Support activities for animal production","89","197","3215","41",
"Oregon","2009","11521 ","Support activities for animal production","89","197","3215","41",
"Oregon","2009","115210","Support activities for animal production","89","197","3215","41",
"Oregon","2009","1153  ","Support activities for forestry","236","2972","86998","41",
"Oregon","2009","11531 ","Support activities for forestry","236","2972","86998","41",
"Oregon","2009","21    ","Mining, quarrying, and oil and gas extraction","140","1352","73740","41",
"Oregon","2009","211   ","Oil and gas extraction","6","0","364","41",
"Oregon","2009","2111  ","Oil and gas extraction","6","0","364","41",
"Oregon","2009","21111 ","Oil and gas extraction","6","0","364","41",
"Oregon","2009","212   ","Mining (except oil and gas)","119","1201","63071","41",
"Oregon","2009","2121  ","Coal mining","1","0","0","41",
"Oregon","2009","21211 ","Coal mining","1","0","0","41",
"Oregon","2009","2123  ","Nonmetallic mineral mining and quarrying","115","1198","62860","41",
"Oregon","2009","21231 ","Stone mining and quarrying","67","663","40956","41",
"Oregon","2009","212311","Dimension stone mining and quarrying","1","0","0","41",
"Oregon","2009","212313","Crushed and broken granite mining and quarrying","21","0","0","41",
"Oregon","2009","212319","Other crushed and broken stone mining and quarrying","34","259","9896","41",
"Oregon","2009","212321","Construction sand and gravel mining","39","419","17169","41",
"Oregon","2009","21239 ","Other nonmetallic mineral mining and quarrying","4","47","1556","41",
"Oregon","2009","212399","All other nonmetallic mineral mining","4","47","1556","41",
"Oregon","2009","21311 ","Support activities for mining","15","145","10305","41",
"Oregon","2009","213114","Support activities for metal mining","4","0","0","41",
"Oregon","2009","2211  ","Electric power generation, transmission and distribution","169","6390","535637","41",
"Oregon","2009","2213  ","Water, sewage and other systems","81","249","7766","41",
"Oregon","2009","211111","Crude petroleum and natural gas extraction","6","0","364","41",
"Oregon","2009","212112","Bituminous coal underground mining","1","0","0","41",
"Oregon","2009","2122  ","Metal ore mining","3","0","0","41",
"Oregon","2009","21222 ","Gold ore and silver ore mining","3","0","0","41",
"Oregon","2009","212221","Gold ore mining","3","0","0","41",
"Oregon","2009","212312","Crushed and broken limestone mining and quarrying","11","180","20826","41",
"Oregon","2009","21232 ","Sand, gravel, clay, and ceramic and refractory minerals mining and quarrying","44","488","20348","41",
"Oregon","2009","212322","Industrial sand mining","3","0","0","41",
"Oregon","2009","212325","Clay and ceramic and refractory minerals mining","2","0","0","41",
"Oregon","2009","213   ","Support activities for mining","15","145","10305","41",
"Oregon","2009","2131  ","Support activities for mining","15","145","10305","41",
"Oregon","2009","213111","Drilling oil and gas wells","4","0","0","41",
"Oregon","2009","213112","Support activities for oil and gas operations","3","0","0","41",
"Oregon","2009","213115","Support activities for nonmetallic minerals (except fuels) mining","4","0","0","41",
"Oregon","2009","22    ","Utilities","267","7772","626395","41",
"Oregon","2009","221   ","Utilities","267","7772","626395","41",
"Oregon","2009","22111 ","Electric power generation","27","629","50945","41",
"Oregon","2009","221111","Hydroelectric power generation","7","0","0","41",
"Oregon","2009","221112","Fossil fuel electric power generation","6","0","0","41",
"Oregon","2009","221119","Other electric power generation","14","195","16417","41",
"Oregon","2009","22112 ","Electric power transmission, control, and distribution","142","5761","484692","41",
"Oregon","2009","221122","Electric power distribution","142","5761","484692","41",
"Oregon","2009","2212  ","Natural gas distribution","17","0","0","41",
"Oregon","2009","22121 ","Natural gas distribution","17","0","0","41",
"Oregon","2009","221210","Natural gas distribution","17","0","0","41",
"Oregon","2009","236   ","Construction of buildings","4201","17903","781259","41",
"Oregon","2009","22131 ","Water supply and irrigation systems","76","219","6047","41",
"Oregon","2009","221310","Water supply and irrigation systems","76","219","6047","41",
"Oregon","2009","22132 ","Sewage treatment facilities","5","0","0","41",
"Oregon","2009","221320","Sewage treatment facilities","5","0","0","41",
"Oregon","2009","23    ","Construction","12512","76311","3444665","41",
"Oregon","2009","2361  ","Residential building construction","3627","10855","377286","41",
"Oregon","2009","2362  ","Nonresidential building construction","574","7048","403973","41",
"Oregon","2009","23611 ","Residential building construction","3627","10855","377286","41",
"Oregon","2009","236115","New single-family housing construction (except operative builders)","1631","3885","115351","41",
"Oregon","2009","236116","New multifamily housing construction (except operative builders)","56","1060","66713","41",
"Oregon","2009","236117","New housing operative builders","413","1140","44053","41",
"Oregon","2009","236118","Residential remodelers","1527","4770","151169","41",
"Oregon","2009","236210","Industrial building construction","57","886","49629","41",
"Oregon","2009","23622 ","Commercial and institutional building construction","517","6162","354344","41",
"Oregon","2009","236220","Commercial and institutional building construction","517","6162","354344","41",
"Oregon","2009","237110","Water and sewer line and related structures construction","205","1974","114296","41",
"Oregon","2009","23712 ","Oil and gas pipeline and related structures construction","7","279","55293","41",
"Oregon","2009","237120","Oil and gas pipeline and related structures construction","7","279","55293","41",
"Oregon","2009","237130","Power and communication line and related structures construction","81","1099","82028","41",
"Oregon","2009","2372  ","Land subdivision","167","535","25477","41",
"Oregon","2009","237210","Land subdivision","167","535","25477","41",
"Oregon","2009","2373  ","Highway, street, and bridge construction","236","2916","181144","41",
"Oregon","2009","2379  ","Other heavy and civil engineering construction","76","714","47920","41",
"Oregon","2009","238   ","Specialty trade contractors","7539","50891","2157248","41",
"Oregon","2009","238110","Poured concrete foundation and structure contractors","374","2697","116670","41",
"Oregon","2009","238130","Framing contractors","286","1141","28752","41",
"Oregon","2009","23815 ","Glass and glazing contractors","93","941","40359","41",
"Oregon","2009","238190","Other foundation, structure, and building exterior contractors","37","210","7769","41",
"Oregon","2009","23621 ","Industrial building construction","57","886","49629","41",
"Oregon","2009","237   ","Heavy and civil engineering construction","772","7517","506158","41",
"Oregon","2009","2371  ","Utility system construction","293","3352","251617","41",
"Oregon","2009","23711 ","Water and sewer line and related structures construction","205","1974","114296","41",
"Oregon","2009","23713 ","Power and communication line and related structures construction","81","1099","82028","41",
"Oregon","2009","23721 ","Land subdivision","167","535","25477","41",
"Oregon","2009","23731 ","Highway, street, and bridge construction","236","2916","181144","41",
"Oregon","2009","237310","Highway, street, and bridge construction","236","2916","181144","41",
"Oregon","2009","23799 ","Other heavy and civil engineering construction","76","714","47920","41",
"Oregon","2009","237990","Other heavy and civil engineering construction","76","714","47920","41",
"Oregon","2009","2381  ","Foundation, structure, and building exterior contractors","1616","10787","388649","41",
"Oregon","2009","23811 ","Poured concrete foundation and structure contractors","374","2697","116670","41",
"Oregon","2009","23812 ","Structural steel and precast concrete contractors","46","591","29871","41",
"Oregon","2009","238120","Structural steel and precast concrete contractors","46","591","29871","41",
"Oregon","2009","23813 ","Framing contractors","286","1141","28752","41",
"Oregon","2009","23814 ","Masonry contractors","256","1534","47346","41",
"Oregon","2009","238140","Masonry contractors","256","1534","47346","41",
"Oregon","2009","238150","Glass and glazing contractors","93","941","40359","41",
"Oregon","2009","23816 ","Roofing contractors","321","2630","83430","41",
"Oregon","2009","238160","Roofing contractors","321","2630","83430","41",
"Oregon","2009","23817 ","Siding contractors","203","1043","34452","41",
"Oregon","2009","238170","Siding contractors","203","1043","34452","41",
"Oregon","2009","23819 ","Other foundation, structure, and building exterior contractors","37","210","7769","41",
"Oregon","2009","23829 ","Other building equipment contractors","99","1772","113404","41",
"Oregon","2009","2382  ","Building equipment contractors","2266","22752","1158981","41",
"Oregon","2009","23821 ","Electrical contractors and other wiring installation contractors","953","9421","461784","41",
"Oregon","2009","238210","Electrical contractors and other wiring installation contractors","953","9421","461784","41",
"Oregon","2009","23822 ","Plumbing, heating, and air-conditioning contractors","1214","11559","583793","41",
"Oregon","2009","238220","Plumbing, heating, and air-conditioning contractors","1214","11559","583793","41",
"Oregon","2009","238330","Flooring contractors","401","1433","44537","41",
"Oregon","2009","23834 ","Tile and terrazzo contractors","254","1036","27116","41",
"Oregon","2009","238340","Tile and terrazzo contractors","254","1036","27116","41",
"Oregon","2009","238910","Site preparation contractors","725","3792","162008","41",
"Oregon","2009","238290","Other building equipment contractors","99","1772","113404","41",
"Oregon","2009","2383  ","Building finishing contractors","2456","11264","364791","41",
"Oregon","2009","23831 ","Drywall and insulation contractors","391","3448","125604","41",
"Oregon","2009","238310","Drywall and insulation contractors","391","3448","125604","41",
"Oregon","2009","23832 ","Painting and wall covering contractors","822","3045","89960","41",
"Oregon","2009","238320","Painting and wall covering contractors","822","3045","89960","41",
"Oregon","2009","23833 ","Flooring contractors","401","1433","44537","41",
"Oregon","2009","23835 ","Finish carpentry contractors","495","1811","59988","41",
"Oregon","2009","238350","Finish carpentry contractors","495","1811","59988","41",
"Oregon","2009","23839 ","Other building finishing contractors","93","491","17586","41",
"Oregon","2009","238390","Other building finishing contractors","93","491","17586","41",
"Oregon","2009","2389  ","Other specialty trade contractors","1201","6088","244827","41",
"Oregon","2009","23891 ","Site preparation contractors","725","3792","162008","41",
"Oregon","2009","238990","All other specialty trade contractors","476","2296","82819","41",
"Oregon","2009","31-33 ","Manufacturing","5380","152428","6840061","41",
"Oregon","2009","311   ","Food manufacturing","505","20701","751593","41",
"Oregon","2009","31111 ","Animal food manufacturing","24","236","9349","41",
"Oregon","2009","311111","Dog and cat food manufacturing","5","0","0","41",
"Oregon","2009","3112  ","Grain and oilseed milling","12","569","27336","41",
"Oregon","2009","31121 ","Flour milling and malt manufacturing","7","0","0","41",
"Oregon","2009","31122 ","Starch and vegetable fats and oils manufacturing","3","0","0","41",
"Oregon","2009","311221","Wet corn milling","1","0","0","41",
"Oregon","2009","311230","Breakfast cereal manufacturing","2","0","0","41",
"Oregon","2009","311313","Beet sugar manufacturing","1","0","0","41",
"Oregon","2009","311330","Confectionery manufacturing from purchased chocolate","22","244","5749","41",
"Oregon","2009","3114  ","Fruit and vegetable preserving and specialty food manufacturing","71","7890","273179","41",
"Oregon","2009","311412","Frozen specialty food manufacturing","11","965","31063","41",
"Oregon","2009","31152 ","Ice cream and frozen dessert manufacturing","9","432","22101","41",
"Oregon","2009","311520","Ice cream and frozen dessert manufacturing","9","432","22101","41",
"Oregon","2009","3116  ","Animal slaughtering and processing","56","1515","47550","41",
"Oregon","2009","311615","Poultry processing","3","0","0","41",
"Oregon","2009","3117  ","Seafood product preparation and packaging","20","812","26202","41",
"Oregon","2009","31171 ","Seafood product preparation and packaging","20","812","26202","41",
"Oregon","2009","311812","Commercial bakeries","45","2412","93788","41",
"Oregon","2009","23899 ","All other specialty trade contractors","476","2296","82819","41",
"Oregon","2009","311811","Retail bakeries","90","859","14368","41",
"Oregon","2009","3111  ","Animal food manufacturing","24","236","9349","41",
"Oregon","2009","311119","Other animal food manufacturing","19","217","9080","41",
"Oregon","2009","311211","Flour milling","6","0","0","41",
"Oregon","2009","311212","Rice milling","1","0","0","41",
"Oregon","2009","311225","Fats and oils refining and blending","2","0","0","41",
"Oregon","2009","31123 ","Breakfast cereal manufacturing","2","0","0","41",
"Oregon","2009","3113  ","Sugar and confectionery product manufacturing","40","482","13315","41",
"Oregon","2009","31131 ","Sugar manufacturing","1","0","0","41",
"Oregon","2009","31132 ","Chocolate and confectionery manufacturing from cacao beans","8","78","1199","41",
"Oregon","2009","311320","Chocolate and confectionery manufacturing from cacao beans","8","78","1199","41",
"Oregon","2009","31133 ","Confectionery manufacturing from purchased chocolate","22","244","5749","41",
"Oregon","2009","31134 ","Nonchocolate confectionery manufacturing","9","0","0","41",
"Oregon","2009","311340","Nonchocolate confectionery manufacturing","9","0","0","41",
"Oregon","2009","31141 ","Frozen food manufacturing","28","5038","171482","41",
"Oregon","2009","311411","Frozen fruit, juice, and vegetable manufacturing","17","4073","140419","41",
"Oregon","2009","31142 ","Fruit and vegetable canning, pickling, and drying","43","2852","101697","41",
"Oregon","2009","311421","Fruit and vegetable canning","25","658","26254","41",
"Oregon","2009","311422","Specialty canning","3","0","0","41",
"Oregon","2009","311423","Dried and dehydrated food manufacturing","15","1048","32259","41",
"Oregon","2009","3115  ","Dairy product manufacturing","32","2488","117513","41",
"Oregon","2009","31151 ","Dairy product (except frozen) manufacturing","23","2056","95412","41",
"Oregon","2009","311511","Fluid milk manufacturing","14","1395","63758","41",
"Oregon","2009","311512","Creamery butter manufacturing","1","0","0","41",
"Oregon","2009","311513","Cheese manufacturing","6","0","0","41",
"Oregon","2009","311514","Dry, condensed, and evaporated dairy product manufacturing","2","0","0","41",
"Oregon","2009","31161 ","Animal slaughtering and processing","56","1515","47550","41",
"Oregon","2009","311611","Animal (except poultry) slaughtering","25","0","0","41",
"Oregon","2009","311612","Meat processed from carcasses","26","929","28981","41",
"Oregon","2009","311613","Rendering and meat byproduct processing","2","0","0","41",
"Oregon","2009","311711","Seafood canning","1","0","0","41",
"Oregon","2009","311712","Fresh and frozen seafood processing","19","799","26074","41",
"Oregon","2009","3118  ","Bakeries and tortilla manufacturing","162","4573","158891","41",
"Oregon","2009","31181 ","Bread and bakery product manufacturing","138","3440","113454","41",
"Oregon","2009","311813","Frozen cakes, pies, and other pastries manufacturing","3","0","0","41",
"Oregon","2009","311821","Cookie and cracker manufacturing","8","0","0","41",
"Oregon","2009","311822","Flour mixes and dough manufacturing from purchased flour","10","0","10810","41",
"Oregon","2009","31183 ","Tortilla manufacturing","5","0","0","41",
"Oregon","2009","311830","Tortilla manufacturing","5","0","0","41",
"Oregon","2009","3119  ","Other food manufacturing","88","2136","78258","41",
"Oregon","2009","311911","Roasted nuts and peanut butter manufacturing","5","57","2804","41",
"Oregon","2009","311919","Other snack food manufacturing","8","489","21870","41",
"Oregon","2009","31193 ","Flavoring syrup and concentrate manufacturing","2","0","0","41",
"Oregon","2009","311941","Mayonnaise, dressing, and other prepared sauce manufacturing","12","411","16851","41",
"Oregon","2009","311999","All other miscellaneous food manufacturing","14","96","2500","41",
"Oregon","2009","31211 ","Soft drink and ice manufacturing","21","403","14611","41",
"Oregon","2009","313   ","Textile mills","15","101","2710","41",
"Oregon","2009","31182 ","Cookie, cracker, and pasta manufacturing","19","0","0","41",
"Oregon","2009","311823","Dry pasta manufacturing","1","0","0","41",
"Oregon","2009","31191 ","Snack food manufacturing","13","546","24674","41",
"Oregon","2009","31192 ","Coffee and tea manufacturing","28","0","0","41",
"Oregon","2009","311920","Coffee and tea manufacturing","28","0","0","41",
"Oregon","2009","311930","Flavoring syrup and concentrate manufacturing","2","0","0","41",
"Oregon","2009","31194 ","Seasoning and dressing manufacturing","16","451","17498","41",
"Oregon","2009","311942","Spice and extract manufacturing","4","40","647","41",
"Oregon","2009","31199 ","All other food manufacturing","29","823","23823","41",
"Oregon","2009","311991","Perishable prepared food manufacturing","15","727","21323","41",
"Oregon","2009","312   ","Beverage and tobacco product manufacturing","191","2483","80316","41",
"Oregon","2009","3121  ","Beverage manufacturing","191","2483","80316","41",
"Oregon","2009","312111","Soft drink manufacturing","5","261","9674","41",
"Oregon","2009","312112","Bottled water manufacturing","8","102","3257","41",
"Oregon","2009","312113","Ice manufacturing","8","0","0","41",
"Oregon","2009","31212 ","Breweries","22","579","19263","41",
"Oregon","2009","312120","Breweries","22","579","19263","41",
"Oregon","2009","31213 ","Wineries","140","1426","42592","41",
"Oregon","2009","312130","Wineries","140","1426","42592","41",
"Oregon","2009","31214 ","Distilleries","8","0","0","41",
"Oregon","2009","312140","Distilleries","8","0","0","41",
"Oregon","2009","3131  ","Fiber, yarn, and thread mills","3","0","0","41",
"Oregon","2009","31311 ","Fiber, yarn, and thread mills","3","0","0","41",
"Oregon","2009","313111","Yarn spinning mills","3","0","0","41",
"Oregon","2009","3132  ","Fabric mills","7","68","1403","41",
"Oregon","2009","31321 ","Broadwoven fabric mills","3","0","0","41",
"Oregon","2009","31323 ","Nonwoven fabric mills","1","0","0","41",
"Oregon","2009","313230","Nonwoven fabric mills","1","0","0","41",
"Oregon","2009","31324 ","Knit fabric mills","1","0","0","41",
"Oregon","2009","313249","Other knit fabric and lace mills","1","0","0","41",
"Oregon","2009","313311","Broadwoven fabric finishing mills","1","0","0","41",
"Oregon","2009","313210","Broadwoven fabric mills","3","0","0","41",
"Oregon","2009","31322 ","Narrow fabric mills and schiffli machine embroidery","2","0","0","41",
"Oregon","2009","313222","Schiffli machine embroidery","2","0","0","41",
"Oregon","2009","3133  ","Textile and fabric finishing and fabric coating mills","5","0","0","41",
"Oregon","2009","31331 ","Textile and fabric finishing mills","5","0","0","41",
"Oregon","2009","314   ","Textile product mills","104","976","26039","41",
"Oregon","2009","3141  ","Textile furnishings mills","26","292","7446","41",
"Oregon","2009","31412 ","Curtain and linen mills","26","292","7446","41",
"Oregon","2009","314911","Textile bag mills","2","0","0","41",
"Oregon","2009","314912","Canvas and related product mills","34","190","5598","41",
"Oregon","2009","31499 ","All other textile product mills","42","483","12796","41",
"Oregon","2009","314999","All other miscellaneous textile product mills","40","459","12262","41",
"Oregon","2009","315   ","Apparel manufacturing","56","683","15413","41",
"Oregon","2009","31519 ","Other apparel knitting mills","3","0","0","41",
"Oregon","2009","315191","Outerwear knitting mills","2","0","0","41",
"Oregon","2009","315192","Underwear and nightwear knitting mills","1","0","0","41",
"Oregon","2009","31521 ","Cut and sew apparel contractors","24","0","0","41",
"Oregon","2009","315211","Men's and boys' cut and sew apparel contractors","9","0","0","41",
"Oregon","2009","31522 ","Men's and boys' cut and sew apparel manufacturing","5","0","0","41",
"Oregon","2009","315221","Men's and boys' cut and sew underwear and nightwear manufacturing","1","0","0","41",
"Oregon","2009","31523 ","Women's and girls' cut and sew apparel manufacturing","6","0","0","41",
"Oregon","2009","315232","Women's and girls' cut and sew blouse and shirt manufacturing","1","0","0","41",
"Oregon","2009","3159  ","Apparel accessories and other apparel manufacturing","11","77","2067","41",
"Oregon","2009","315992","Glove and mitten manufacturing","1","0","0","41",
"Oregon","2009","3212  ","Veneer, plywood, and engineered wood product manufacturing","92","7744","311069","41",
"Oregon","2009","313312","Textile and fabric finishing (except broadwoven fabric) mills","4","0","0","41",
"Oregon","2009","321114","Wood preservation","18","667","28688","41",
"Oregon","2009","314121","Curtain and drapery mills","19","142","3896","41",
"Oregon","2009","314129","Other household textile product mills","7","0","0","41",
"Oregon","2009","3149  ","Other textile product mills","78","684","18593","41",
"Oregon","2009","31491 ","Textile bag and canvas mills","36","201","5797","41",
"Oregon","2009","314991","Rope, cordage, and twine mills","2","0","0","41",
"Oregon","2009","3151  ","Apparel knitting mills","3","0","0","41",
"Oregon","2009","3152  ","Cut and sew apparel manufacturing","42","573","12740","41",
"Oregon","2009","315212","Women's, girls', and infants' cut and sew apparel contractors","15","49","806","41",
"Oregon","2009","315228","Men's and boys' cut and sew other outerwear manufacturing","4","0","0","41",
"Oregon","2009","315233","Women's and girls' cut and sew dress manufacturing","4","0","0","41",
"Oregon","2009","315234","Women's and girls' cut and sew suit, coat, tailored jacket, and skirt manufacturing","1","0","0","41",
"Oregon","2009","31529 ","Other cut and sew apparel manufacturing","7","0","1300","41",
"Oregon","2009","315291","Infants' cut and sew apparel manufacturing","1","0","0","41",
"Oregon","2009","315299","All other cut and sew apparel manufacturing","6","0","1291","41",
"Oregon","2009","31599 ","Apparel accessories and other apparel manufacturing","11","77","2067","41",
"Oregon","2009","315991","Hat, cap, and millinery manufacturing","2","0","0","41",
"Oregon","2009","315999","Other apparel accessories and other apparel manufacturing","8","0","1621","41",
"Oregon","2009","316   ","Leather and allied product manufacturing","25","0","14276","41",
"Oregon","2009","3162  ","Footwear manufacturing","10","0","0","41",
"Oregon","2009","31621 ","Footwear manufacturing","10","0","0","41",
"Oregon","2009","316211","Rubber and plastics footwear manufacturing","3","0","0","41",
"Oregon","2009","316213","Men's footwear (except athletic) manufacturing","4","0","0","41",
"Oregon","2009","316214","Women's footwear (except athletic) manufacturing","3","0","0","41",
