"Oregon","2009","423730","Warm air heating and air-conditioning equipment and supplies merchant wholesalers","55","586","27839","41",
"Oregon","2009","423320","Brick, stone, and related construction material merchant wholesalers","66","438","18932","41",
"Oregon","2009","42339 ","Other construction material merchant wholesalers","54","434","20463","41",
"Oregon","2009","42341 ","Photographic equipment and supplies merchant wholesalers","10","171","8359","41",
"Oregon","2009","423410","Photographic equipment and supplies merchant wholesalers","10","171","8359","41",
"Oregon","2009","423420","Office equipment merchant wholesalers","76","1696","88258","41",
"Oregon","2009","42343 ","Computer and computer peripheral equipment and software merchant wholesalers","111","1495","108684","41",
"Oregon","2009","42344 ","Other commercial equipment merchant wholesalers","63","769","36306","41",
"Oregon","2009","423440","Other commercial equipment merchant wholesalers","63","769","36306","41",
"Oregon","2009","423450","Medical, dental, and hospital equipment and supplies merchant wholesalers","81","1238","108747","41",
"Oregon","2009","42346 ","Ophthalmic goods merchant wholesalers","8","0","7907","41",
"Oregon","2009","42349 ","Other professional equipment and supplies merchant wholesalers","29","374","18475","41",
"Oregon","2009","423490","Other professional equipment and supplies merchant wholesalers","29","374","18475","41",
"Oregon","2009","42351 ","Metal service centers and other metal merchant wholesalers","138","2065","102803","41",
"Oregon","2009","423510","Metal service centers and other metal merchant wholesalers","138","2065","102803","41",
"Oregon","2009","42352 ","Coal and other mineral and ore merchant wholesalers","3","0","0","41",
"Oregon","2009","423520","Coal and other mineral and ore merchant wholesalers","3","0","0","41",
"Oregon","2009","4236  ","Electrical and electronic goods merchant wholesalers","389","0","0","41",
"Oregon","2009","42361 ","Electrical apparatus and equipment, wiring supplies, and related equipment merchant wholesalers","182","1758","88787","41",
"Oregon","2009","423610","Electrical apparatus and equipment, wiring supplies, and related equipment merchant wholesalers","182","1758","88787","41",
"Oregon","2009","42362 ","Electrical and electronic appliance, television, and radio set merchant wholesalers","42","499","23035","41",
"Oregon","2009","42369 ","Other electronic parts and equipment merchant wholesalers","165","0","0","41",
"Oregon","2009","423690","Other electronic parts and equipment merchant wholesalers","165","0","0","41",
"Oregon","2009","42371 ","Hardware merchant wholesalers","81","871","40746","41",
"Oregon","2009","423710","Hardware merchant wholesalers","81","871","40746","41",
"Oregon","2009","42372 ","Plumbing and heating equipment and supplies (hydronics) merchant wholesalers","80","922","48723","41",
"Oregon","2009","423720","Plumbing and heating equipment and supplies (hydronics) merchant wholesalers","80","922","48723","41",
"Oregon","2009","42373 ","Warm air heating and air-conditioning equipment and supplies merchant wholesalers","55","586","27839","41",
"Oregon","2009","42382 ","Farm and garden machinery and equipment merchant wholesalers","136","1504","60701","41",
"Oregon","2009","42374 ","Refrigeration equipment and supplies merchant wholesalers","13","214","11235","41",
"Oregon","2009","423740","Refrigeration equipment and supplies merchant wholesalers","13","214","11235","41",
"Oregon","2009","4238  ","Machinery, equipment, and supplies merchant wholesalers","772","9236","521154","41",
"Oregon","2009","42381 ","Construction and mining (except oil well) machinery and equipment merchant wholesalers","97","1376","91852","41",
"Oregon","2009","423810","Construction and mining (except oil well) machinery and equipment merchant wholesalers","97","1376","91852","41",
"Oregon","2009","42384 ","Industrial supplies merchant wholesalers","149","1256","60092","41",
"Oregon","2009","423840","Industrial supplies merchant wholesalers","149","1256","60092","41",
"Oregon","2009","423850","Service establishment equipment and supplies merchant wholesalers","50","438","18154","41",
"Oregon","2009","42386 ","Transportation equipment and supplies (except motor vehicle) merchant wholesalers","37","279","9979","41",
"Oregon","2009","4239  ","Miscellaneous durable goods merchant wholesalers","370","4177","167919","41",
"Oregon","2009","42391 ","Sporting and recreational goods and supplies merchant wholesalers","79","791","31359","41",
"Oregon","2009","42392 ","Toy and hobby goods and supplies merchant wholesalers","24","110","4833","41",
"Oregon","2009","423920","Toy and hobby goods and supplies merchant wholesalers","24","110","4833","41",
"Oregon","2009","423930","Recyclable material merchant wholesalers","95","1662","63372","41",
"Oregon","2009","42394 ","Jewelry, watch, precious stone, and precious metal merchant wholesalers","31","0","4879","41",
"Oregon","2009","423990","Other miscellaneous durable goods merchant wholesalers","141","1459","63476","41",
"Oregon","2009","42411 ","Printing and writing paper merchant wholesalers","10","98","5725","41",
"Oregon","2009","424120","Stationery and office supplies merchant wholesalers","67","637","28584","41",
"Oregon","2009","4242  ","Drugs and druggists' sundries merchant wholesalers","104","1000","57530","41",
"Oregon","2009","42442 ","Packaged frozen food merchant wholesalers","43","993","40877","41",
"Oregon","2009","423820","Farm and garden machinery and equipment merchant wholesalers","136","1504","60701","41",
"Oregon","2009","42383 ","Industrial machinery and equipment merchant wholesalers","303","4383","280376","41",
"Oregon","2009","423830","Industrial machinery and equipment merchant wholesalers","303","4383","280376","41",
"Oregon","2009","42385 ","Service establishment equipment and supplies merchant wholesalers","50","438","18154","41",
"Oregon","2009","423860","Transportation equipment and supplies (except motor vehicle) merchant wholesalers","37","279","9979","41",
"Oregon","2009","423910","Sporting and recreational goods and supplies merchant wholesalers","79","791","31359","41",
"Oregon","2009","42393 ","Recyclable material merchant wholesalers","95","1662","63372","41",
"Oregon","2009","423940","Jewelry, watch, precious stone, and precious metal merchant wholesalers","31","0","4879","41",
"Oregon","2009","42399 ","Other miscellaneous durable goods merchant wholesalers","141","1459","63476","41",
"Oregon","2009","424   ","Merchant wholesalers, nondurable goods","1551","26753","1215540","41",
"Oregon","2009","4241  ","Paper and paper product merchant wholesalers","136","1517","77433","41",
"Oregon","2009","424110","Printing and writing paper merchant wholesalers","10","98","5725","41",
"Oregon","2009","42412 ","Stationery and office supplies merchant wholesalers","67","637","28584","41",
"Oregon","2009","42413 ","Industrial and personal service paper merchant wholesalers","59","782","43124","41",
"Oregon","2009","424130","Industrial and personal service paper merchant wholesalers","59","782","43124","41",
"Oregon","2009","42421 ","Drugs and druggists' sundries merchant wholesalers","104","1000","57530","41",
"Oregon","2009","424210","Drugs and druggists' sundries merchant wholesalers","104","1000","57530","41",
"Oregon","2009","4243  ","Apparel, piece goods, and notions merchant wholesalers","101","2119","135387","41",
"Oregon","2009","42431 ","Piece goods, notions, and other dry goods merchant wholesalers","22","336","12270","41",
"Oregon","2009","424310","Piece goods, notions, and other dry goods merchant wholesalers","22","336","12270","41",
"Oregon","2009","42432 ","Men's and boys' clothing and furnishings merchant wholesalers","31","942","58850","41",
"Oregon","2009","424320","Men's and boys' clothing and furnishings merchant wholesalers","31","942","58850","41",
"Oregon","2009","42433 ","Women's, children's, and infants' clothing and accessories merchant wholesalers","33","202","8657","41",
"Oregon","2009","424330","Women's, children's, and infants' clothing and accessories merchant wholesalers","33","202","8657","41",
"Oregon","2009","42434 ","Footwear merchant wholesalers","15","639","55610","41",
"Oregon","2009","424340","Footwear merchant wholesalers","15","639","55610","41",
"Oregon","2009","4244  ","Grocery and related product merchant wholesalers","431","11200","465825","41",
"Oregon","2009","42441 ","General line grocery merchant wholesalers","26","1889","103444","41",
"Oregon","2009","424410","General line grocery merchant wholesalers","26","1889","103444","41",
"Oregon","2009","424420","Packaged frozen food merchant wholesalers","43","993","40877","41",
"Oregon","2009","424450","Confectionery merchant wholesalers","22","0","0","41",
"Oregon","2009","42443 ","Dairy product (except dried or canned) merchant wholesalers","22","648","23855","41",
"Oregon","2009","424430","Dairy product (except dried or canned) merchant wholesalers","22","648","23855","41",
"Oregon","2009","42444 ","Poultry and poultry product merchant wholesalers","3","154","7713","41",
"Oregon","2009","424440","Poultry and poultry product merchant wholesalers","3","154","7713","41",
"Oregon","2009","42445 ","Confectionery merchant wholesalers","22","0","0","41",
"Oregon","2009","424470","Meat and meat product merchant wholesalers","24","621","29142","41",
"Oregon","2009","42446 ","Fish and seafood merchant wholesalers","19","0","0","41",
"Oregon","2009","424460","Fish and seafood merchant wholesalers","19","0","0","41",
"Oregon","2009","42447 ","Meat and meat product merchant wholesalers","24","621","29142","41",
"Oregon","2009","42448 ","Fresh fruit and vegetable merchant wholesalers","74","2788","93044","41",
"Oregon","2009","424480","Fresh fruit and vegetable merchant wholesalers","74","2788","93044","41",
"Oregon","2009","424490","Other grocery and related products merchant wholesalers","198","3373","136350","41",
"Oregon","2009","4245  ","Farm product raw material merchant wholesalers","64","650","33709","41",
"Oregon","2009","424510","Grain and field bean merchant wholesalers","55","600","32478","41",
"Oregon","2009","42452 ","Livestock merchant wholesalers","2","0","0","41",
"Oregon","2009","424590","Other farm product raw material merchant wholesalers","7","45","1178","41",
"Oregon","2009","424610","Plastics materials and basic forms and shapes merchant wholesalers","32","195","9630","41",
"Oregon","2009","4247  ","Petroleum and petroleum products merchant wholesalers","97","1864","85294","41",
"Oregon","2009","42472 ","Petroleum and petroleum products merchant wholesalers (except bulk stations and terminals)","23","249","11583","41",
"Oregon","2009","42481 ","Beer and ale merchant wholesalers","40","1649","70440","41",
"Oregon","2009","42492 ","Book, periodical, and newspaper merchant wholesalers","30","597","19997","41",
"Oregon","2009","424930","Flower, nursery stock, and florists' supplies merchant wholesalers","80","902","28096","41",
"Oregon","2009","42495 ","Paint, varnish, and supplies merchant wholesalers","34","323","15397","41",
"Oregon","2009","42511 ","Business to business electronic markets","9","51","1247","41",
"Oregon","2009","42449 ","Other grocery and related products merchant wholesalers","198","3373","136350","41",
"Oregon","2009","42451 ","Grain and field bean merchant wholesalers","55","600","32478","41",
"Oregon","2009","424520","Livestock merchant wholesalers","2","0","0","41",
"Oregon","2009","42459 ","Other farm product raw material merchant wholesalers","7","45","1178","41",
"Oregon","2009","4246  ","Chemical and allied products merchant wholesalers","118","1015","54323","41",
"Oregon","2009","42461 ","Plastics materials and basic forms and shapes merchant wholesalers","32","195","9630","41",
"Oregon","2009","42469 ","Other chemical and allied products merchant wholesalers","86","820","44693","41",
"Oregon","2009","424690","Other chemical and allied products merchant wholesalers","86","820","44693","41",
"Oregon","2009","42471 ","Petroleum bulk stations and terminals","74","1615","73711","41",
"Oregon","2009","424710","Petroleum bulk stations and terminals","74","1615","73711","41",
"Oregon","2009","424720","Petroleum and petroleum products merchant wholesalers (except bulk stations and terminals)","23","249","11583","41",
"Oregon","2009","4248  ","Beer, wine, and distilled alcoholic beverage merchant wholesalers","81","2816","119325","41",
"Oregon","2009","424810","Beer and ale merchant wholesalers","40","1649","70440","41",
"Oregon","2009","42482 ","Wine and distilled alcoholic beverage merchant wholesalers","41","1167","48885","41",
"Oregon","2009","424820","Wine and distilled alcoholic beverage merchant wholesalers","41","1167","48885","41",
"Oregon","2009","4249  ","Miscellaneous nondurable goods merchant wholesalers","419","4572","186714","41",
"Oregon","2009","42491 ","Farm supplies merchant wholesalers","147","1641","85473","41",
"Oregon","2009","424910","Farm supplies merchant wholesalers","147","1641","85473","41",
"Oregon","2009","424920","Book, periodical, and newspaper merchant wholesalers","30","597","19997","41",
"Oregon","2009","42493 ","Flower, nursery stock, and florists' supplies merchant wholesalers","80","902","28096","41",
"Oregon","2009","42494 ","Tobacco and tobacco product merchant wholesalers","11","0","0","41",
"Oregon","2009","424940","Tobacco and tobacco product merchant wholesalers","11","0","0","41",
"Oregon","2009","424950","Paint, varnish, and supplies merchant wholesalers","34","323","15397","41",
"Oregon","2009","42499 ","Other miscellaneous nondurable goods merchant wholesalers","117","690","21135","41",
"Oregon","2009","424990","Other miscellaneous nondurable goods merchant wholesalers","117","690","21135","41",
"Oregon","2009","425   ","Wholesale electronic markets and agents and brokers","897","3616","176763","41",
"Oregon","2009","4251  ","Wholesale electronic markets and agents and brokers","897","3616","176763","41",
"Oregon","2009","4411  ","Automobile dealers","567","12263","476212","41",
"Oregon","2009","425110","Business to business electronic markets","9","51","1247","41",
"Oregon","2009","42512 ","Wholesale trade agents and brokers","888","3565","175516","41",
"Oregon","2009","425120","Wholesale trade agents and brokers","888","3565","175516","41",
"Oregon","2009","44-45 ","Retail trade","14085","186447","4580751","41",
"Oregon","2009","441   ","Motor vehicle and parts dealers","1644","21706","798837","41",
"Oregon","2009","44111 ","New car dealers","297","11044","438149","41",
"Oregon","2009","4412  ","Other motor vehicle dealers","302","2486","86032","41",
"Oregon","2009","441110","New car dealers","297","11044","438149","41",
"Oregon","2009","44112 ","Used car dealers","270","1219","38063","41",
"Oregon","2009","441120","Used car dealers","270","1219","38063","41",
"Oregon","2009","44121 ","Recreational vehicle dealers","97","1061","41944","41",
"Oregon","2009","441210","Recreational vehicle dealers","97","1061","41944","41",
"Oregon","2009","441221","Motorcycle, ATV, and personal watercraft dealers","100","883","26136","41",
"Oregon","2009","441222","Boat dealers","65","394","13199","41",
"Oregon","2009","44131 ","Automotive parts and accessories stores","524","3889","102549","41",
"Oregon","2009","441310","Automotive parts and accessories stores","524","3889","102549","41",
"Oregon","2009","442   ","Furniture and home furnishings stores","873","5916","148489","41",
"Oregon","2009","442110","Furniture stores","381","2770","74350","41",
"Oregon","2009","4422  ","Home furnishings stores","492","3146","74139","41",
"Oregon","2009","44229 ","Other home furnishings stores","308","2071","36792","41",
"Oregon","2009","4431  ","Electronics and appliance stores","645","5542","136208","41",
"Oregon","2009","443112","Radio, television, and other electronics stores","344","3002","65224","41",
"Oregon","2009","4441  ","Building material and supplies dealers","969","13231","399376","41",
"Oregon","2009","44122 ","Motorcycle, boat, and other motor vehicle dealers","205","1425","44088","41",
"Oregon","2009","441229","All other motor vehicle dealers","40","148","4753","41",
"Oregon","2009","4413  ","Automotive parts, accessories, and tire stores","775","6957","236593","41",
"Oregon","2009","44132 ","Tire dealers","251","3068","134044","41",
"Oregon","2009","441320","Tire dealers","251","3068","134044","41",
"Oregon","2009","4421  ","Furniture stores","381","2770","74350","41",
"Oregon","2009","44211 ","Furniture stores","381","2770","74350","41",
"Oregon","2009","44221 ","Floor covering stores","184","1075","37347","41",
"Oregon","2009","442210","Floor covering stores","184","1075","37347","41",
"Oregon","2009","442291","Window treatment stores","28","95","2703","41",
"Oregon","2009","442299","All other home furnishings stores","280","1976","34089","41",
"Oregon","2009","443   ","Electronics and appliance stores","645","5542","136208","41",
"Oregon","2009","44311 ","Appliance, television, and other electronics stores","482","4176","100167","41",
"Oregon","2009","443111","Household appliance stores","138","1174","34943","41",
"Oregon","2009","44312 ","Computer and software stores","122","1172","31825","41",
"Oregon","2009","443120","Computer and software stores","122","1172","31825","41",
"Oregon","2009","44313 ","Camera and photographic supplies stores","41","194","4216","41",
"Oregon","2009","443130","Camera and photographic supplies stores","41","194","4216","41",
"Oregon","2009","444   ","Building material and garden equipment and supplies dealers","1304","16137","476482","41",
"Oregon","2009","44411 ","Home centers","86","0","161467","41",
"Oregon","2009","44419 ","Other building material dealers","526","4576","167438","41",
"Oregon","2009","444110","Home centers","86","0","161467","41",
"Oregon","2009","44412 ","Paint and wallpaper stores","121","0","19003","41",
"Oregon","2009","444120","Paint and wallpaper stores","121","0","19003","41",
"Oregon","2009","44413 ","Hardware stores","236","1991","51468","41",
"Oregon","2009","444130","Hardware stores","236","1991","51468","41",
"Oregon","2009","444190","Other building material dealers","526","4576","167438","41",
"Oregon","2009","44422 ","Nursery, garden center, and farm supply stores","274","2529","65825","41",
"Oregon","2009","4451  ","Grocery stores","1455","33267","778636","41",
"Oregon","2009","4442  ","Lawn and garden equipment and supplies stores","335","2906","77106","41",
"Oregon","2009","44421 ","Outdoor power equipment stores","61","377","11281","41",
"Oregon","2009","444210","Outdoor power equipment stores","61","377","11281","41",
"Oregon","2009","444220","Nursery, garden center, and farm supply stores","274","2529","65825","41",
"Oregon","2009","445   ","Food and beverage stores","2026","37030","835831","41",
"Oregon","2009","44521 ","Meat markets","54","394","8423","41",
"Oregon","2009","44511 ","Supermarkets and other grocery (except convenience) stores","713","29127","714627","41",
"Oregon","2009","445110","Supermarkets and other grocery (except convenience) stores","713","29127","714627","41",
"Oregon","2009","44512 ","Convenience stores","742","4140","64009","41",
"Oregon","2009","445120","Convenience stores","742","4140","64009","41",
"Oregon","2009","4452  ","Specialty food stores","360","2796","41171","41",
"Oregon","2009","445210","Meat markets","54","394","8423","41",
"Oregon","2009","44522 ","Fish and seafood markets","23","151","3515","41",
"Oregon","2009","445220","Fish and seafood markets","23","151","3515","41",
"Oregon","2009","44529 ","Other specialty food stores","239","2011","24427","41",
"Oregon","2009","445291","Baked goods stores","19","75","1322","41",
"Oregon","2009","445299","All other specialty food stores","169","1619","19468","41",
"Oregon","2009","4453  ","Beer, wine, and liquor stores","211","967","16024","41",
"Oregon","2009","446   ","Health and personal care stores","831","8070","254560","41",
"Oregon","2009","4461  ","Health and personal care stores","831","8070","254560","41",
"Oregon","2009","44612 ","Cosmetics, beauty supplies, and perfume stores","123","834","14914","41",
"Oregon","2009","446130","Optical goods stores","129","695","17429","41",
"Oregon","2009","44619 ","Other health and personal care stores","256","1293","39235","41",
"Oregon","2009","447   ","Gasoline stations","980","9590","163574","41",
"Oregon","2009","447110","Gasoline stations with convenience stores","639","6064","94402","41",
"Oregon","2009","4481  ","Clothing stores","1089","12871","205829","41",
"Oregon","2009","448130","Children's and infants' clothing stores","93","874","9508","41",
"Oregon","2009","44523 ","Fruit and vegetable markets","44","240","4806","41",
"Oregon","2009","445230","Fruit and vegetable markets","44","240","4806","41",
"Oregon","2009","445292","Confectionery and nut stores","51","317","3637","41",
"Oregon","2009","44531 ","Beer, wine, and liquor stores","211","967","16024","41",
"Oregon","2009","445310","Beer, wine, and liquor stores","211","967","16024","41",
"Oregon","2009","44611 ","Pharmacies and drug stores","323","5248","182982","41",
"Oregon","2009","446110","Pharmacies and drug stores","323","5248","182982","41",
"Oregon","2009","446120","Cosmetics, beauty supplies, and perfume stores","123","834","14914","41",
"Oregon","2009","44613 ","Optical goods stores","129","695","17429","41",
"Oregon","2009","446191","Food (health) supplement stores","106","451","7629","41",
"Oregon","2009","446199","All other health and personal care stores","150","842","31606","41",
"Oregon","2009","4471  ","Gasoline stations","980","9590","163574","41",
"Oregon","2009","44711 ","Gasoline stations with convenience stores","639","6064","94402","41",
"Oregon","2009","44719 ","Other gasoline stations","341","3526","69172","41",
"Oregon","2009","447190","Other gasoline stations","341","3526","69172","41",
"Oregon","2009","448   ","Clothing and clothing accessories stores","1663","16742","288747","41",
"Oregon","2009","44811 ","Men's clothing stores","58","423","9553","41",
"Oregon","2009","448110","Men's clothing stores","58","423","9553","41",
"Oregon","2009","44812 ","Women's clothing stores","369","2994","44696","41",
"Oregon","2009","448120","Women's clothing stores","369","2994","44696","41",
"Oregon","2009","44813 ","Children's and infants' clothing stores","93","874","9508","41",
"Oregon","2009","44814 ","Family clothing stores","353","7301","121692","41",
"Oregon","2009","4482  ","Shoe stores","275","2223","39911","41",
"Oregon","2009","448140","Family clothing stores","353","7301","121692","41",
"Oregon","2009","44815 ","Clothing accessories stores","89","0","5899","41",
"Oregon","2009","448150","Clothing accessories stores","89","0","5899","41",
"Oregon","2009","44819 ","Other clothing stores","127","938","14481","41",
"Oregon","2009","448190","Other clothing stores","127","938","14481","41",
"Oregon","2009","44821 ","Shoe stores","275","2223","39911","41",
"Oregon","2009","448310","Jewelry stores","281","1525","39865","41",
"Oregon","2009","448210","Shoe stores","275","2223","39911","41",
"Oregon","2009","4483  ","Jewelry, luggage, and leather goods stores","299","1648","43007","41",
"Oregon","2009","44831 ","Jewelry stores","281","1525","39865","41",
"Oregon","2009","451110","Sporting goods stores","460","4722","81559","41",
"Oregon","2009","44832 ","Luggage and leather goods stores","18","123","3142","41",
"Oregon","2009","448320","Luggage and leather goods stores","18","123","3142","41",
"Oregon","2009","451   ","Sporting goods, hobby, book, and music stores","1029","10380","172985","41",
"Oregon","2009","4511  ","Sporting goods, hobby, and musical instrument stores","826","7867","130808","41",
"Oregon","2009","45111 ","Sporting goods stores","460","4722","81559","41",
"Oregon","2009","45112 ","Hobby, toy, and game stores","169","1540","24321","41",
"Oregon","2009","451120","Hobby, toy, and game stores","169","1540","24321","41",
"Oregon","2009","45113 ","Sewing, needlework, and piece goods stores","122","1136","14341","41",
"Oregon","2009","45114 ","Musical instrument and supplies stores","75","469","10587","41",
"Oregon","2009","451140","Musical instrument and supplies stores","75","469","10587","41",
"Oregon","2009","451211","Book stores","141","1982","32685","41",
"Oregon","2009","451212","News dealers and newsstands","8","55","1512","41",
"Oregon","2009","451220","Prerecorded tape, compact disc, and record stores","54","476","7980","41",
"Oregon","2009","452   ","General merchandise stores","416","36931","870729","41",
"Oregon","2009","452111","Department stores (except discount department stores)","35","4241","78539","41",
"Oregon","2009","452910","Warehouse clubs and supercenters","137","21544","586056","41",
"Oregon","2009","453   ","Miscellaneous store retailers","1786","11524","206506","41",
"Oregon","2009","4532  ","Office supplies, stationery, and gift stores","507","3285","53256","41",
"Oregon","2009","45322 ","Gift, novelty, and souvenir stores","364","1917","25193","41",
"Oregon","2009","453310","Used merchandise stores","380","3557","64186","41",
"Oregon","2009","453910","Pet and pet supplies stores","168","1577","27114","41",
"Oregon","2009","451130","Sewing, needlework, and piece goods stores","122","1136","14341","41",
"Oregon","2009","4512  ","Book, periodical, and music stores","203","2513","42177","41",
"Oregon","2009","45121 ","Book stores and news dealers","149","2037","34197","41",
"Oregon","2009","45122 ","Prerecorded tape, compact disc, and record stores","54","476","7980","41",
"Oregon","2009","4521  ","Department stores","95","12587","245551","41",
"Oregon","2009","45211 ","Department stores","95","12587","245551","41",
"Oregon","2009","452112","Discount department stores","60","0","0","41",
"Oregon","2009","4529  ","Other general merchandise stores","321","24344","625178","41",
