"Vermont","2003","44229 ","Other Home Furnishings Stores","83","652","12329","50",
"Vermont","2003","44815 ","Clothing Accessories Stores","15","92","1957","50",
"Vermont","2003","44819 ","Other Clothing Stores","29","213","2464","50",
"Vermont","2003","4812  ","Nonscheduled Air Transportation","5","0","0","50",
"Vermont","2003","448190","Other Clothing Stores","29","213","2464","50",
"Vermont","2003","4482  ","Shoe Stores","66","353","5745","50",
"Vermont","2003","481111","Scheduled Passenger Air Transportation","7","0","0","50",
"Vermont","2003","48121 ","Nonscheduled Air Transportation","5","0","0","50",
"Vermont","2003","488490","Other Support Activities for Road Transportation","3","0","0","50",
"Vermont","2003","481211","Nonscheduled Chartered Passenger Air Transportation","4","0","0","50",
"Vermont","2003","481219","Other Nonscheduled Air Transportation","1","0","0","50",
"Vermont","2003","48849 ","Other Support Activities for Road Transportation","3","0","0","50",
"Vermont","2003","4885  ","Freight Transportation Arrangement","27","161","5089","50",
"Vermont","2003","51721 ","Wireless Telecommunications Carriers (except Satellite)","19","0","0","50",
"Vermont","2003","48851 ","Freight Transportation Arrangement","27","161","5089","50",
"Vermont","2003","488510","Freight Transportation Arrangement","27","161","5089","50",
"Vermont","2003","5172  ","Wireless Telecommunications Carriers (except Satellite)","19","0","0","50",
"Vermont","2003","517211","Paging","8","0","0","50",
"Vermont","2003","52413 ","Reinsurance Carriers","3","0","0","50",
"Vermont","2003","517212","Cellular and Other Wireless Telecommunications","11","0","0","50",
"Vermont","2003","5173  ","Telecommunications Resellers","1","0","0","50",
"Vermont","2003","524128","Other Direct Insurance (except Life, Health, and Medical) Carriers","1","0","0","50",
"Vermont","2003","524130","Reinsurance Carriers","3","0","0","50",
"Vermont","2003","541110","Offices of Lawyers","452","2129","108943","50",
"Vermont","2003","5242  ","Agencies, Brokerages, and Other Insurance Related Activities","325","1957","81591","50",
"Vermont","2003","52421 ","Insurance Agencies and Brokerages","288","1681","70654","50",
"Vermont","2003","54111 ","Offices of Lawyers","452","2129","108943","50",
"Vermont","2003","54119 ","Other Legal Services","11","37","1154","50",
"Vermont","2003","561492","Court Reporting and Stenotype Services","8","0","0","50",
"Vermont","2003","541191","Title Abstract and Settlement Offices","6","0","0","50",
"Vermont","2003","541199","All Other Legal Services","5","0","0","50",
"Vermont","2003","561491","Repossession Services","4","0","0","50",
"Vermont","2003","561499","All Other Business Support Services","8","0","0","50",
"Vermont","2003","561730","Landscaping Services","306","681","24335","50",
"Vermont","2003","5615  ","Travel Arrangement and Reservation Services","53","0","0","50",
"Vermont","2003","56151 ","Travel Agencies","36","0","0","50",
"Vermont","2003","56173 ","Landscaping Services","306","681","24335","50",
"Vermont","2003","56174 ","Carpet and Upholstery Cleaning Services","19","0","0","50",
"Vermont","2003","561740","Carpet and Upholstery Cleaning Services","19","0","0","50",
"Vermont","2003","61    ","Educational Services","336","13237","295371","50",
"Vermont","2003","56179 ","Other Services to Buildings and Dwellings","28","0","0","50",
"Vermont","2003","562991","Septic Tank and Related Services","16","0","0","50",
"Vermont","2003","562998","All Other Miscellaneous Waste Management Services","1","0","0","50",
"Vermont","2003","611692","Automobile Driving Schools","4","0","0","50",
"Vermont","2003","611   ","Educational Services","336","13237","295371","50",
"Vermont","2003","6111  ","Elementary and Secondary Schools","114","3622","92705","50",
"Vermont","2003","611691","Exam Preparation and Tutoring","10","0","0","50",
"Vermont","2003","611699","All Other Miscellaneous Schools and Instruction","19","114","2514","50",
"Vermont","2003","6117  ","Educational Support Services","37","179","4366","50",
"Vermont","2003","621512","Diagnostic Imaging Centers","6","0","0","50",
"Vermont","2003","61171 ","Educational Support Services","37","179","4366","50",
"Vermont","2003","62151 ","Medical and Diagnostic Laboratories","9","0","0","50",
"Vermont","2003","621511","Medical Laboratories","3","0","0","50",
"Vermont","2003","6216  ","Home Health Care Services","42","2606","54920","50",
"Vermont","2003","624210","Community Food Services","24","0","0","50",
"Vermont","2003","62161 ","Home Health Care Services","42","2606","54920","50",
"Vermont","2003","6242  ","Community Food and Housing, and Emergency and Other Relief Services","66","0","0","50",
"Vermont","2003","62421 ","Community Food Services","24","0","0","50",
"Vermont","2003","712130","Zoos and Botanical Gardens","1","0","0","50",
"Vermont","2003","62422 ","Community Housing Services","33","0","0","50",
"Vermont","2003","712120","Historical Sites","9","0","0","50",
"Vermont","2003","71213 ","Zoos and Botanical Gardens","1","0","0","50",
"Vermont","2003","71219 ","Nature Parks and Other Similar Institutions","5","0","0","50",
"Vermont","2003","72233 ","Mobile Food Services","11","0","0","50",
"Vermont","2003","712190","Nature Parks and Other Similar Institutions","5","0","0","50",
"Vermont","2003","72232 ","Caterers","28","0","0","50",
"Vermont","2003","722320","Caterers","28","0","0","50",
"Vermont","2003","722330","Mobile Food Services","11","0","0","50",
"Vermont","2003","812310","Coin-Operated Laundries and Drycleaners","45","220","2687","50",
"Vermont","2003","7224  ","Drinking Places (Alcoholic Beverages)","136","817","8399","50",
"Vermont","2003","8123  ","Drycleaning and Laundry Services","74","565","10980","50",
"Vermont","2003","81231 ","Coin-Operated Laundries and Drycleaners","45","220","2687","50",
"Vermont","2003","81232 ","Drycleaning and Laundry Services (except Coin-Operated)","22","0","0","50",
"Vermont","2003","3116  ","Animal Slaughtering and Processing","12","0","0","50",
"Vermont","2003","812320","Drycleaning and Laundry Services (except Coin-Operated)","22","0","0","50",
"Vermont","2003","115113","Crop Harvesting, Primarily by Machine","2","0","0","50",
"Vermont","2003","115115","Farm Labor Contractors and Crew Leaders","1","0","0","50",
"Vermont","2003","115116","Farm Management Services","1","0","0","50",
"Vermont","2003","1152  ","Support Activities for Animal Production","20","0","0","50",
"Vermont","2003","23799 ","Other Heavy and Civil Engineering Construction","16","102","5400","50",
"Vermont","2003","237990","Other Heavy and Civil Engineering Construction","16","102","5400","50",
"Vermont","2003","238   ","Specialty Trade Contractors","1689","7317","279580","50",
"Vermont","2003","2381  ","Foundation, Structure, and Building Exterior Contractors","404","1436","60321","50",
"Vermont","2003","31161 ","Animal Slaughtering and Processing","12","0","0","50",
"Vermont","2003","311611","Animal (except Poultry) Slaughtering","7","0","0","50",
"Vermont","2003","315993","Men's and Boys' Neckwear Manufacturing","1","0","0","50",
"Vermont","2003","311612","Meat Processed from Carcasses","5","0","0","50",
"Vermont","2003","3118  ","Bakeries and Tortilla Manufacturing","60","760","16419","50",
"Vermont","2003","31599 ","Apparel Accessories and Other Apparel Manufacturing","2","0","0","50",
"Vermont","2003","315999","Other Apparel Accessories and Other Apparel Manufacturing","1","0","0","50",
"Vermont","2003","32521 ","Resin and Synthetic Rubber Manufacturing","3","0","0","50",
"Vermont","2003","316   ","Leather and Allied Product Manufacturing","4","0","0","50",
"Vermont","2003","3161  ","Leather and Hide Tanning and Finishing","1","0","0","50",
"Vermont","2003","3252  ","Resin, Synthetic Rubber, and Artificial Synthetic Fibers and Filaments Manufacturing","3","0","0","50",
"Vermont","2003","331312","Primary Aluminum Production","1","0","0","50",
"Vermont","2003","325211","Plastics Material and Resin Manufacturing","3","0","0","50",
"Vermont","2003","3253  ","Pesticide, Fertilizer, and Other Agricultural Chemical Manufacturing","2","0","0","50",
"Vermont","2003","33131 ","Alumina and Aluminum Production and Processing","2","0","0","50",
"Vermont","2003","333291","Paper Industry Machinery Manufacturing","1","0","0","50",
"Vermont","2003","331314","Secondary Smelting and Alloying of Aluminum","1","0","0","50",
"Vermont","2003","3314  ","Nonferrous Metal (except Aluminum) Production and Processing","3","0","0","50",
"Vermont","2003","33329 ","Other Industrial Machinery Manufacturing","14","0","0","50",
"Vermont","2003","33461 ","Manufacturing and Reproducing Magnetic and Optical Media","2","0","0","50",
"Vermont","2003","333292","Textile Machinery Manufacturing","3","0","0","50",
"Vermont","2003","333293","Printing Machinery and Equipment Manufacturing","3","0","0","50",
"Vermont","2003","3346  ","Manufacturing and Reproducing Magnetic and Optical Media","2","0","0","50",
"Vermont","2003","334612","Prerecorded Compact Disc (except Software), Tape, and Record Reproducing","2","0","0","50",
"Vermont","2003","339913","Jewelers' Material and Lapidary Work Manufacturing","1","0","0","50",
"Vermont","2003","335   ","Electrical Equipment, Appliance, and Component Manufacturing","19","1121","72295","50",
"Vermont","2003","339911","Jewelry (except Costume) Manufacturing","8","0","0","50",
"Vermont","2003","339912","Silverware and Hollowware Manufacturing","2","0","0","50",
"Vermont","2003","423690","Other Electronic Parts and Equipment Merchant Wholesalers","26","0","0","50",
"Vermont","2003","339914","Costume Jewelry and Novelty Manufacturing","4","0","0","50",
"Vermont","2003","33992 ","Sporting and Athletic Goods Manufacturing","12","0","0","50",
"Vermont","2003","42369 ","Other Electronic Parts and Equipment Merchant Wholesalers","26","0","0","50",
"Vermont","2003","4237  ","Hardware, and Plumbing and Heating Equipment and Supplies Merchant Wholesalers","42","408","15507","50",
"Vermont","2003","42447 ","Meat and Meat Product Merchant Wholesalers","8","0","0","50",
"Vermont","2003","42371 ","Hardware Merchant Wholesalers","8","0","0","50",
"Vermont","2003","423710","Hardware Merchant Wholesalers","8","0","0","50",
"Vermont","2003","424460","Fish and Seafood Merchant Wholesalers","5","0","0","50",
"Vermont","2003","424470","Meat and Meat Product Merchant Wholesalers","8","0","0","50",
"Vermont","2003","443   ","Electronics and Appliance Stores","112","744","17613","50",
"Vermont","2003","42448 ","Fresh Fruit and Vegetable Merchant Wholesalers","7","0","0","50",
"Vermont","2003","442291","Window Treatment Stores","3","0","0","50",
"Vermont","2003","442299","All Other Home Furnishings Stores","80","0","0","50",
"Vermont","2003","448210","Shoe Stores","66","353","5745","50",
"Vermont","2003","4431  ","Electronics and Appliance Stores","112","744","17613","50",
"Vermont","2003","44311 ","Appliance, Television, and Other Electronics Stores","87","0","0","50",
"Vermont","2003","44821 ","Shoe Stores","66","353","5745","50",
"Vermont","2003","4483  ","Jewelry, Luggage, and Leather Goods Stores","57","290","6618","50",
"Vermont","2003","44831 ","Jewelry Stores","53","0","0","50",
"Vermont","2003","4831  ","Deep Sea, Coastal, and Great Lakes Water Transportation","2","0","0","50",
"Vermont","2003","448310","Jewelry Stores","53","0","0","50",
"Vermont","2003","44832 ","Luggage and Leather Goods Stores","4","0","0","50",
"Vermont","2003","483   ","Water Transportation","4","0","0","50",
"Vermont","2003","48311 ","Deep Sea, Coastal, and Great Lakes Water Transportation","2","0","0","50",
"Vermont","2003","488991","Packing and Crating","3","0","0","50",
"Vermont","2003","483114","Coastal and Great Lakes Passenger Transportation","2","0","0","50",
"Vermont","2003","4889  ","Other Support Activities for Transportation","3","0","0","50",
"Vermont","2003","48899 ","Other Support Activities for Transportation","3","0","0","50",
"Vermont","2003","5174  ","Satellite Telecommunications","2","0","0","50",
"Vermont","2003","492   ","Couriers and Messengers","34","0","0","50",
"Vermont","2003","51731 ","Telecommunications Resellers","1","0","0","50",
"Vermont","2003","517310","Telecommunications Resellers","1","0","0","50",
"Vermont","2003","52429 ","Other Insurance Related Activities","37","276","10937","50",
"Vermont","2003","51741 ","Satellite Telecommunications","2","0","0","50",
"Vermont","2003","517410","Satellite Telecommunications","2","0","0","50",
"Vermont","2003","524210","Insurance Agencies and Brokerages","288","1681","70654","50",
"Vermont","2003","524291","Claims Adjusting","16","0","0","50",
"Vermont","2003","541211","Offices of Certified Public Accountants","128","771","30467","50",
"Vermont","2003","524292","Third Party Administration of Insurance and Pension Funds","14","0","0","50",
"Vermont","2003","5412  ","Accounting, Tax Preparation, Bookkeeping, and Payroll Services","262","3512","58774","50",
"Vermont","2003","54121 ","Accounting, Tax Preparation, Bookkeeping, and Payroll Services","262","3512","58774","50",
"Vermont","2003","56191 ","Packaging and Labeling Services","2","0","0","50",
"Vermont","2003","541213","Tax Preparation Services","39","248","2280","50",
"Vermont","2003","561790","Other Services to Buildings and Dwellings","28","0","0","50",
"Vermont","2003","5619  ","Other Support Services","64","317","7004","50",
"Vermont","2003","561910","Packaging and Labeling Services","2","0","0","50",
"Vermont","2003","6112  ","Junior Colleges","2","0","0","50",
"Vermont","2003","56192 ","Convention and Trade Show Organizers","10","0","0","50",
"Vermont","2003","61111 ","Elementary and Secondary Schools","114","3622","92705","50",
"Vermont","2003","611110","Elementary and Secondary Schools","114","3622","92705","50",
"Vermont","2003","62    ","Health Care and Social Assistance","2034","38480","1149446","50",
"Vermont","2003","61121 ","Junior Colleges","2","0","0","50",
"Vermont","2003","611210","Junior Colleges","2","0","0","50",
"Vermont","2003","611710","Educational Support Services","37","179","4366","50",
"Vermont","2003","621   ","Ambulatory Health Care Services","1221","14959","479122","50",
"Vermont","2003","6219  ","Other Ambulatory Health Care Services","42","0","0","50",
"Vermont","2003","6211  ","Offices of Physicians","428","4454","201532","50",
"Vermont","2003","62111 ","Offices of Physicians","428","4454","201532","50",
"Vermont","2003","621610","Home Health Care Services","42","2606","54920","50",
"Vermont","2003","62191 ","Ambulance Services","32","0","0","50",
"Vermont","2003","621910","Ambulance Services","32","0","0","50",
"Vermont","2003","62423 ","Emergency and Other Relief Services","9","66","1465","50",
"Vermont","2003","62199 ","All Other Ambulatory Health Care Services","10","0","0","50",
"Vermont","2003","624221","Temporary Shelters","16","191","3511","50",
"Vermont","2003","624229","Other Community Housing Services","17","0","0","50",
"Vermont","2003","624230","Emergency and Other Relief Services","9","66","1465","50",
"Vermont","2003","71311 ","Amusement and Theme Parks","1","0","0","50",
"Vermont","2003","6243  ","Vocational Rehabilitation Services","24","0","0","50",
"Vermont","2003","713   ","Amusement, Gambling, and Recreation Industries","279","7753","79794","50",
"Vermont","2003","7131  ","Amusement Parks and Arcades","8","0","0","50",
"Vermont","2003","713110","Amusement and Theme Parks","1","0","0","50",
"Vermont","2003","81    ","Other Services (except Public Administration)","2075","9480","214709","50",
"Vermont","2003","71312 ","Amusement Arcades","7","0","0","50",
"Vermont","2003","72241 ","Drinking Places (Alcoholic Beverages)","136","817","8399","50",
"Vermont","2003","722410","Drinking Places (Alcoholic Beverages)","136","817","8399","50",
"Vermont","2003","811   ","Repair and Maintenance","657","2439","63963","50",
"Vermont","2003","812332","Industrial Launderers","2","0","0","50",
"Vermont","2003","8111  ","Automotive Repair and Maintenance","504","1914","48403","50",
"Vermont","2003","81233 ","Linen and Uniform Supply","7","0","0","50",
"Vermont","2003","812331","Linen Supply","5","0","0","50",
"Vermont","2003","8129  ","Other Personal Services","84","371","5721","50",
"Vermont","2003","238110","Poured Concrete Foundation and Structure Contractors","99","338","21809","50",
"Vermont","2003","81291 ","Pet Care (except Veterinary) Services","31","92","1039","50",
"Vermont","2003","11521 ","Support Activities for Animal Production","20","0","0","50",
"Vermont","2003","115210","Support Activities for Animal Production","20","0","0","50",
"Vermont","2003","1153  ","Support Activities for Forestry","16","0","0","50",
"Vermont","2003","11531 ","Support Activities for Forestry","16","0","0","50",
"Vermont","2003","115310","Support Activities for Forestry","16","0","0","50",
"Vermont","2003","23811 ","Poured Concrete Foundation and Structure Contractors","99","338","21809","50",
"Vermont","2003","311811","Retail Bakeries","28","0","0","50",
"Vermont","2003","23812 ","Structural Steel and Precast Concrete Contractors","5","80","3349","50",
"Vermont","2003","238120","Structural Steel and Precast Concrete Contractors","5","80","3349","50",
"Vermont","2003","31181 ","Bread and Bakery Product Manufacturing","53","0","0","50",
"Vermont","2003","31611 ","Leather and Hide Tanning and Finishing","1","0","0","50",
"Vermont","2003","311812","Commercial Bakeries","24","0","0","50",
"Vermont","2003","311813","Frozen Cakes, Pies, and Other Pastries Manufacturing","1","0","0","50",
"Vermont","2003","31182 ","Cookie, Cracker, and Pasta Manufacturing","5","0","0","50",
"Vermont","2003","316110","Leather and Hide Tanning and Finishing","1","0","0","50",
"Vermont","2003","32531 ","Fertilizer Manufacturing","2","0","0","50",
"Vermont","2003","3162  ","Footwear Manufacturing","1","0","0","50",
"Vermont","2003","31621 ","Footwear Manufacturing","1","0","0","50",
"Vermont","2003","316212","House Slipper Manufacturing","1","0","0","50",
"Vermont","2003","325314","Fertilizer (Mixing Only) Manufacturing","2","0","0","50",
"Vermont","2003","3254  ","Pharmaceutical and Medicine Manufacturing","2","0","0","50",
"Vermont","2003","331421","Copper Rolling, Drawing, and Extruding","1","0","0","50",
"Vermont","2003","32541 ","Pharmaceutical and Medicine Manufacturing","2","0","0","50",
"Vermont","2003","325412","Pharmaceutical Preparation Manufacturing","2","0","0","50",
"Vermont","2003","33142 ","Copper Rolling, Drawing, Extruding, and Alloying","2","0","0","50",
"Vermont","2003","331422","Copper Wire (except Mechanical) Drawing","1","0","0","50",
"Vermont","2003","333298","All Other Industrial Machinery Manufacturing","3","0","0","50",
"Vermont","2003","33149 ","Nonferrous Metal (except Copper and Aluminum) Rolling, Drawing, Extruding, and Alloying","1","0","0","50",
"Vermont","2003","333294","Food Product Machinery Manufacturing","2","0","0","50",
"Vermont","2003","333295","Semiconductor Machinery Manufacturing","2","0","0","50",
"Vermont","2003","33512 ","Lighting Fixture Manufacturing","6","0","0","50",
"Vermont","2003","3333  ","Commercial and Service Industry Machinery Manufacturing","12","689","34720","50",
"Vermont","2003","33331 ","Commercial and Service Industry Machinery Manufacturing","12","689","34720","50",
"Vermont","2003","3351  ","Electric Lighting Equipment Manufacturing","6","0","0","50",
"Vermont","2003","335121","Residential Electric Lighting Fixture Manufacturing","2","0","0","50",
"Vermont","2003","33993 ","Doll, Toy, and Game Manufacturing","12","0","0","50",
"Vermont","2003","335122","Commercial, Industrial, and Institutional Electric Lighting Fixture Manufacturing","2","0","0","50",
"Vermont","2003","335129","Other Lighting Equipment Manufacturing","2","0","0","50",
"Vermont","2003","339920","Sporting and Athletic Goods Manufacturing","12","0","0","50",
"Vermont","2003","339931","Doll and Stuffed Toy Manufacturing","6","670","9415","50",
"Vermont","2003","42449 ","Other Grocery and Related Products Merchant Wholesalers","49","647","21385","50",
"Vermont","2003","339932","Game, Toy, and Children's Vehicle Manufacturing","6","0","0","50",
"Vermont","2003","42372 ","Plumbing and Heating Equipment and Supplies (Hydronics) Merchant Wholesalers","23","300","11700","50",
"Vermont","2003","423720","Plumbing and Heating Equipment and Supplies (Hydronics) Merchant Wholesalers","23","300","11700","50",
"Vermont","2003","42373 ","Warm Air Heating and Air-Conditioning Equipment and Supplies Merchant Wholesalers","8","0","0","50",
"Vermont","2003","424480","Fresh Fruit and Vegetable Merchant Wholesalers","7","0","0","50",
"Vermont","2003","424490","Other Grocery and Related Products Merchant Wholesalers","49","647","21385","50",
"Vermont","2003","443112","Radio, Television, and Other Electronics Stores","50","0","0","50",
"Vermont","2003","4245  ","Farm Product Raw Material Merchant Wholesalers","8","0","0","50",
"Vermont","2003","42451 ","Grain and Field Bean Merchant Wholesalers","2","0","0","50",
"Vermont","2003","443111","Household Appliance Stores","37","0","0","50",
"Vermont","2003","44312 ","Computer and Software Stores","16","0","0","50",
"Vermont","2003","4511  ","Sporting Goods, Hobby, and Musical Instrument Stores","219","1601","24877","50",
"Vermont","2003","443120","Computer and Software Stores","16","0","0","50",
"Vermont","2003","448320","Luggage and Leather Goods Stores","4","0","0","50",
"Vermont","2003","451   ","Sporting Goods, Hobby, Book, and Music Stores","292","2159","32058","50",
"Vermont","2003","483212","Inland Water Passenger Transportation","2","0","0","50",
"Vermont","2003","45111 ","Sporting Goods Stores","156","1199","18671","50",
"Vermont","2003","4832  ","Inland Water Transportation","2","0","0","50",
"Vermont","2003","48321 ","Inland Water Transportation","2","0","0","50",
"Vermont","2003","484   ","Truck Transportation","338","2401","79231","50",
"Vermont","2003","492110","Couriers","23","918","28998","50",
"Vermont","2003","4841  ","General Freight Trucking","143","1209","43417","50",
"Vermont","2003","4921  ","Couriers","23","918","28998","50",
"Vermont","2003","49211 ","Couriers","23","918","28998","50",
"Vermont","2003","4922  ","Local Messengers and Local Delivery","11","0","0","50",
"Vermont","2003","51751 ","Cable and Other Program Distribution","36","0","0","50",
"Vermont","2003","49221 ","Local Messengers and Local Delivery","11","0","0","50",
"Vermont","2003","492210","Local Messengers and Local Delivery","11","0","0","50",
"Vermont","2003","5175  ","Cable and Other Program Distribution","36","0","0","50",
"Vermont","2003","517510","Cable and Other Program Distribution","36","0","0","50",
"Vermont","2003","525   ","Funds, Trusts, and Other Financial Vehicles","2","0","0","50",
"Vermont","2003","5179  ","Other Telecommunications","1","0","0","50",
"Vermont","2003","51791 ","Other Telecommunications","1","0","0","50",
"Vermont","2003","524298","All Other Insurance Related Activities","7","0","0","50",
"Vermont","2003","5259  ","Other Investment Pools and Funds","2","0","0","50",
"Vermont","2003","52593 ","Real Estate Investment Trusts","1","0","0","50",
"Vermont","2003","5413  ","Architectural, Engineering, and Related Services","367","2158","100339","50",
"Vermont","2003","525930","Real Estate Investment Trusts","1","0","0","50",
"Vermont","2003","541214","Payroll Services","9","0","0","50",
"Vermont","2003","541219","Other Accounting Services","86","0","0","50",
"Vermont","2003","54131 ","Architectural Services","91","537","25942","50",
"Vermont","2003","611310","Colleges, Universities, and Professional Schools","22","7278","153907","50",
"Vermont","2003","541310","Architectural Services","91","537","25942","50",
"Vermont","2003","6113  ","Colleges, Universities, and Professional Schools","22","7278","153907","50",
"Vermont","2003","61131 ","Colleges, Universities, and Professional Schools","22","7278","153907","50",
"Vermont","2003","6212  ","Offices of Dentists","270","1883","68534","50",
"Vermont","2003","6114  ","Business Schools and Computer and Management Training","24","0","0","50",
"Vermont","2003","621111","Offices of Physicians (except Mental Health Specialists)","400","0","0","50",
"Vermont","2003","621112","Offices of Physicians, Mental Health Specialists","28","0","0","50",
"Vermont","2003","622   ","Hospitals","17","0","0","50",
"Vermont","2003","62121 ","Offices of Dentists","270","1883","68534","50",
"Vermont","2003","621991","Blood and Organ Banks","2","0","0","50",
"Vermont","2003","621999","All Other Miscellaneous Ambulatory Health Care Services","8","0","0","50",
"Vermont","2003","6221  ","General Medical and Surgical Hospitals","15","10219","395556","50",
"Vermont","2003","6244  ","Child Day Care Services","265","1909","26959","50",
"Vermont","2003","62211 ","General Medical and Surgical Hospitals","15","10219","395556","50",
"Vermont","2003","62431 ","Vocational Rehabilitation Services","24","0","0","50",
"Vermont","2003","624310","Vocational Rehabilitation Services","24","0","0","50",
"Vermont","2003","62441 ","Child Day Care Services","265","1909","26959","50",
"Vermont","2003","71329 ","Other Gambling Industries","2","0","0","50",
"Vermont","2003","624410","Child Day Care Services","265","1909","26959","50",
"Vermont","2003","713120","Amusement Arcades","7","0","0","50",
"Vermont","2003","7132  ","Gambling Industries","2","0","0","50",
"Vermont","2003","713290","Other Gambling Industries","2","0","0","50",
"Vermont","2003","811112","Automotive Exhaust System Repair","6","0","0","50",
"Vermont","2003","7139  ","Other Amusement and Recreation Industries","269","7726","79504","50",
"Vermont","2003","81111 ","Automotive Mechanical and Electrical Repair and Maintenance","343","1137","28676","50",
"Vermont","2003","811111","General Automotive Repair","317","1055","26314","50",
"Vermont","2003","811113","Automotive Transmission Repair","9","0","0","50",
