"Missouri","2006","561421","Telephone Answering Services","40","548","18133","29",
"Missouri","2006","561422","Telemarketing Bureaus","81","6645","145211","29",
"Missouri","2006","56143 ","Business Service Centers","200","1972","50878","29",
"Missouri","2006","561439","Other Business Service Centers (including Copy Shops)","114","1521","43550","29",
"Missouri","2006","611310","Colleges, Universities, and Professional Schools","123","40619","1396143","29",
"Missouri","2006","61142 ","Computer Training","27","0","0","29",
"Missouri","2006","6114  ","Business Schools and Computer and Management Training","136","612","22306","29",
"Missouri","2006","61141 ","Business and Secretarial Schools","5","0","0","29",
"Missouri","2006","611410","Business and Secretarial Schools","5","0","0","29",
"Missouri","2006","6223  ","Specialty (except Psychiatric and Substance Abuse) Hospitals","11","2226","102906","29",
"Missouri","2006","6222  ","Psychiatric and Substance Abuse Hospitals","17","6137","192106","29",
"Missouri","2006","62221 ","Psychiatric and Substance Abuse Hospitals","17","6137","192106","29",
"Missouri","2006","622210","Psychiatric and Substance Abuse Hospitals","17","6137","192106","29",
"Missouri","2006","71212 ","Historical Sites","20","0","0","29",
"Missouri","2006","7121  ","Museums, Historical Sites, and Similar Institutions","147","2324","61042","29",
"Missouri","2006","71211 ","Museums","94","1286","30432","29",
"Missouri","2006","712110","Museums","94","1286","30432","29",
"Missouri","2006","712120","Historical Sites","20","0","0","29",
"Missouri","2006","81119 ","Other Automotive Repair and Maintenance","676","4967","76066","29",
"Missouri","2006","81112 ","Automotive Body, Paint, Interior, and Glass Repair","981","6086","253369","29",
"Missouri","2006","811121","Automotive Body, Paint, and Interior Repair and Maintenance","842","5531","235889","29",
"Missouri","2006","811122","Automotive Glass Replacement Shops","139","555","17480","29",
"Missouri","2006","8134  ","Civic and Social Organizations","658","7114","112834","29",
"Missouri","2006","81391 ","Business Associations","388","2959","140432","29",
"Missouri","2006","81341 ","Civic and Social Organizations","658","7114","112834","29",
"Missouri","2006","813410","Civic and Social Organizations","658","7114","112834","29",
"Missouri","2006","8139  ","Business, Professional, Labor, Political, and Similar Organizations","1282","10351","334814","29",
"Missouri","2006","33651 ","Railroad Rolling Stock Manufacturing","7","0","0","29",
"Missouri","2006","336413","Other Aircraft Parts and Auxiliary Equipment Manufacturing","20","0","0","29",
"Missouri","2006","336415","Guided Missile and Space Vehicle Propulsion Unit and Propulsion Unit Parts Manufacturing","1","0","0","29",
"Missouri","2006","3365  ","Railroad Rolling Stock Manufacturing","7","0","0","29",
"Missouri","2006","42313 ","Tire and Tube Merchant Wholesalers","65","1005","34627","29",
"Missouri","2006","336510","Railroad Rolling Stock Manufacturing","7","0","0","29",
"Missouri","2006","42312 ","Motor Vehicle Supplies and New Parts Merchant Wholesalers","270","3970","140791","29",
"Missouri","2006","423120","Motor Vehicle Supplies and New Parts Merchant Wholesalers","270","3970","140791","29",
"Missouri","2006","423130","Tire and Tube Merchant Wholesalers","65","1005","34627","29",
"Missouri","2006","424710","Petroleum Bulk Stations and Terminals","119","1338","52437","29",
"Missouri","2006","42385 ","Service Establishment Equipment and Supplies Merchant Wholesalers","123","1330","53059","29",
"Missouri","2006","423850","Service Establishment Equipment and Supplies Merchant Wholesalers","123","1330","53059","29",
"Missouri","2006","42386 ","Transportation Equipment and Supplies (except Motor Vehicle) Merchant Wholesalers","40","367","17522","29",
"Missouri","2006","423860","Transportation Equipment and Supplies (except Motor Vehicle) Merchant Wholesalers","40","367","17522","29",
"Missouri","2006","42471 ","Petroleum Bulk Stations and Terminals","119","1338","52437","29",
"Missouri","2006","42472 ","Petroleum and Petroleum Products Merchant Wholesalers (except Bulk Stations and Terminals)","51","610","39228","29",
"Missouri","2006","424720","Petroleum and Petroleum Products Merchant Wholesalers (except Bulk Stations and Terminals)","51","610","39228","29",
"Missouri","2006","4442  ","Lawn and Garden Equipment and Supplies Stores","650","5909","128984","29",
"Missouri","2006","444130","Hardware Stores","287","2733","51780","29",
"Missouri","2006","44419 ","Other Building Material Dealers","903","10012","335512","29",
"Missouri","2006","444190","Other Building Material Dealers","903","10012","335512","29",
"Missouri","2006","44421 ","Outdoor Power Equipment Stores","98","690","17460","29",
"Missouri","2006","451212","News Dealers and Newsstands","13","51","753","29",
"Missouri","2006","4512  ","Book, Periodical, and Music Stores","296","3316","38467","29",
"Missouri","2006","45121 ","Book Stores and News Dealers","220","2538","29238","29",
"Missouri","2006","451211","Book Stores","207","2487","28485","29",
"Missouri","2006","45122 ","Prerecorded Tape, Compact Disc, and Record Stores","76","778","9229","29",
"Missouri","2006","484122","General Freight Trucking, Long-Distance, Less Than Truckload","186","7399","376631","29",
"Missouri","2006","484110","General Freight Trucking, Local","483","3386","108445","29",
"Missouri","2006","48412 ","General Freight Trucking, Long-Distance","1242","25570","1067046","29",
"Missouri","2006","484121","General Freight Trucking, Long-Distance, Truckload","1056","18171","690415","29",
"Missouri","2006","488490","Other Support Activities for Road Transportation","29","451","11959","29",
"Missouri","2006","48841 ","Motor Vehicle Towing","143","766","19222","29",
"Missouri","2006","488410","Motor Vehicle Towing","143","766","19222","29",
"Missouri","2006","48849 ","Other Support Activities for Road Transportation","29","451","11959","29",
"Missouri","2006","51611 ","Internet Publishing and Broadcasting","27","125","4521","29",
"Missouri","2006","515210","Cable and Other Subscription Programming","7","49","2002","29",
"Missouri","2006","516   ","Internet Publishing and Broadcasting","27","125","4521","29",
"Missouri","2006","5161  ","Internet Publishing and Broadcasting","27","125","4521","29",
"Missouri","2006","52312 ","Securities Brokerage","969","5836","502353","29",
"Missouri","2006","5231  ","Securities and Commodity Contracts Intermediation and Brokerage","1063","12158","990146","29",
"Missouri","2006","52311 ","Investment Banking and Securities Dealing","65","6192","472885","29",
"Missouri","2006","523110","Investment Banking and Securities Dealing","65","6192","472885","29",
"Missouri","2006","5322  ","Consumer Goods Rental","822","6065","123593","29",
"Missouri","2006","532112","Passenger Car Leasing","15","0","0","29",
"Missouri","2006","53212 ","Truck, Utility Trailer, and RV (Recreational Vehicle) Rental and Leasing","153","1039","39894","29",
"Missouri","2006","532120","Truck, Utility Trailer, and RV (Recreational Vehicle) Rental and Leasing","153","1039","39894","29",
"Missouri","2006","54161 ","Management Consulting Services","1543","14329","649852","29",
"Missouri","2006","541513","Computer Facilities Management Services","42","2001","168016","29",
"Missouri","2006","541519","Other Computer Related Services","147","1551","113922","29",
"Missouri","2006","5416  ","Management, Scientific, and Technical Consulting Services","1888","15839","736555","29",
"Missouri","2006","561450","Credit Bureaus","19","397","17387","29",
"Missouri","2006","56144 ","Collection Agencies","95","3790","98975","29",
"Missouri","2006","561440","Collection Agencies","95","3790","98975","29",
"Missouri","2006","56145 ","Credit Bureaus","19","397","17387","29",
"Missouri","2006","56149 ","Other Business Support Services","164","1451","64279","29",
"Missouri","2006","611420","Computer Training","27","0","0","29",
"Missouri","2006","61151 ","Technical and Trade Schools","173","2405","70929","29",
"Missouri","2006","61143 ","Professional and Management Development Training","104","402","16089","29",
"Missouri","2006","611430","Professional and Management Development Training","104","402","16089","29",
"Missouri","2006","6115  ","Technical and Trade Schools","173","2405","70929","29",
"Missouri","2006","6231  ","Nursing Care Facilities","559","43330","843405","29",
"Missouri","2006","62231 ","Specialty (except Psychiatric and Substance Abuse) Hospitals","11","2226","102906","29",
"Missouri","2006","622310","Specialty (except Psychiatric and Substance Abuse) Hospitals","11","2226","102906","29",
"Missouri","2006","623   ","Nursing and Residential Care Facilities","1584","69174","1344282","29",
"Missouri","2006","712190","Nature Parks and Other Similar Institutions","20","0","0","29",
"Missouri","2006","71213 ","Zoos and Botanical Gardens","13","0","0","29",
"Missouri","2006","712130","Zoos and Botanical Gardens","13","0","0","29",
"Missouri","2006","71219 ","Nature Parks and Other Similar Institutions","20","0","0","29",
"Missouri","2006","811191","Automotive Oil Change and Lubrication Shops","232","1796","30252","29",
"Missouri","2006","81121 ","Electronic and Precision Equipment Repair and Maintenance","250","1944","77845","29",
"Missouri","2006","811192","Car Washes","393","2829","37641","29",
"Missouri","2006","811198","All Other Automotive Repair and Maintenance","51","342","8173","29",
"Missouri","2006","8112  ","Electronic and Precision Equipment Repair and Maintenance","250","1944","77845","29",
"Missouri","2006","813910","Business Associations","388","2959","140432","29",
"Missouri","2006","813930","Labor Unions and Similar Labor Organizations","415","3899","95985","29",
"Missouri","2006","81392 ","Professional Organizations","124","1555","50559","29",
"Missouri","2006","813920","Professional Organizations","124","1555","50559","29",
"Missouri","2006","81393 ","Labor Unions and Similar Labor Organizations","415","3899","95985","29",
"Missouri","2006","336612","Boat Building","17","2639","67563","29",
"Missouri","2006","3366  ","Ship and Boat Building","26","3406","96228","29",
"Missouri","2006","33661 ","Ship and Boat Building","26","3406","96228","29",
"Missouri","2006","336611","Ship Building and Repairing","9","767","28665","29",
"Missouri","2006","4232  ","Furniture and Home Furnishing Merchant Wholesalers","179","2005","80979","29",
"Missouri","2006","3369  ","Other Transportation Equipment Manufacturing","21","0","0","29",
"Missouri","2006","42314 ","Motor Vehicle Parts (Used) Merchant Wholesalers","56","296","10810","29",
"Missouri","2006","423140","Motor Vehicle Parts (Used) Merchant Wholesalers","56","296","10810","29",
"Missouri","2006","42321 ","Furniture Merchant Wholesalers","74","856","32537","29",
"Missouri","2006","423210","Furniture Merchant Wholesalers","74","856","32537","29",
"Missouri","2006","42392 ","Toy and Hobby Goods and Supplies Merchant Wholesalers","37","277","9856","29",
"Missouri","2006","4239  ","Miscellaneous Durable Goods Merchant Wholesalers","489","5414","219955","29",
"Missouri","2006","42391 ","Sporting and Recreational Goods and Supplies Merchant Wholesalers","73","828","28915","29",
"Missouri","2006","423910","Sporting and Recreational Goods and Supplies Merchant Wholesalers","73","828","28915","29",
"Missouri","2006","42482 ","Wine and Distilled Alcoholic Beverage Merchant Wholesalers","25","1312","61635","29",
"Missouri","2006","4248  ","Beer, Wine, and Distilled Alcoholic Beverage Merchant Wholesalers","86","3895","165557","29",
"Missouri","2006","42481 ","Beer and Ale Merchant Wholesalers","61","2583","103922","29",
"Missouri","2006","424810","Beer and Ale Merchant Wholesalers","61","2583","103922","29",
"Missouri","2006","445   ","Food and Beverage Stores","2237","47713","841152","29",
"Missouri","2006","444210","Outdoor Power Equipment Stores","98","690","17460","29",
"Missouri","2006","44422 ","Nursery, Garden Center, and Farm Supply Stores","552","5219","111524","29",
"Missouri","2006","444220","Nursery, Garden Center, and Farm Supply Stores","552","5219","111524","29",
"Missouri","2006","45211 ","Department Stores","219","35490","596648","29",
"Missouri","2006","451220","Prerecorded Tape, Compact Disc, and Record Stores","76","778","9229","29",
"Missouri","2006","452   ","General Merchandise Stores","1069","70571","1245951","29",
"Missouri","2006","4521  ","Department Stores","219","35490","596648","29",
"Missouri","2006","452111","Department Stores (except Discount Department Stores)","66","12511","172131","29",
"Missouri","2006","4842  ","Specialized Freight Trucking","1584","13759","474630","29",
"Missouri","2006","484220","Specialized Freight (except Used Goods) Trucking, Local","926","4594","152148","29",
"Missouri","2006","48421 ","Used Household and Office Goods Moving","179","3162","94726","29",
"Missouri","2006","484210","Used Household and Office Goods Moving","179","3162","94726","29",
"Missouri","2006","48422 ","Specialized Freight (except Used Goods) Trucking, Local","926","4594","152148","29",
"Missouri","2006","4885  ","Freight Transportation Arrangement","349","3118","131799","29",
"Missouri","2006","48899 ","Other Support Activities for Transportation","23","249","3897","29",
"Missouri","2006","48851 ","Freight Transportation Arrangement","349","3118","131799","29",
"Missouri","2006","488510","Freight Transportation Arrangement","349","3118","131799","29",
"Missouri","2006","4889  ","Other Support Activities for Transportation","23","249","3897","29",
"Missouri","2006","516110","Internet Publishing and Broadcasting","27","125","4521","29",
"Missouri","2006","517110","Wired Telecommunications Carriers","621","19563","1167891","29",
"Missouri","2006","517   ","Telecommunications","961","25074","1435278","29",
"Missouri","2006","5171  ","Wired Telecommunications Carriers","621","19563","1167891","29",
"Missouri","2006","51711 ","Wired Telecommunications Carriers","621","19563","1167891","29",
"Missouri","2006","523120","Securities Brokerage","969","5836","502353","29",
"Missouri","2006","523140","Commodity Contracts Brokerage","19","96","13192","29",
"Missouri","2006","52313 ","Commodity Contracts Dealing","10","34","1716","29",
"Missouri","2006","523130","Commodity Contracts Dealing","10","34","1716","29",
"Missouri","2006","52314 ","Commodity Contracts Brokerage","19","96","13192","29",
"Missouri","2006","53221 ","Consumer Electronics and Appliances Rental","116","698","21789","29",
"Missouri","2006","53223 ","Video Tape and Disc Rental","435","3262","34027","29",
"Missouri","2006","532210","Consumer Electronics and Appliances Rental","116","698","21789","29",
"Missouri","2006","53222 ","Formal Wear and Costume Rental","39","176","3627","29",
"Missouri","2006","532220","Formal Wear and Costume Rental","39","176","3627","29",
"Missouri","2006","541611","Administrative Management and General Management Consulting Services","750","7398","296605","29",
"Missouri","2006","561499","All Other Business Support Services","98","1157","51986","29",
"Missouri","2006","541612","Human Resources and Executive Search Consulting Services","305","2711","164243","29",
"Missouri","2006","541613","Marketing Consulting Services","324","1768","74283","29",
"Missouri","2006","541614","Process, Physical Distribution, and Logistics Consulting Services","107","1606","93385","29",
"Missouri","2006","561491","Repossession Services","19","84","2312","29",
"Missouri","2006","561492","Court Reporting and Stenotype Services","47","210","9981","29",
"Missouri","2006","5615  ","Travel Arrangement and Reservation Services","404","4834","182078","29",
"Missouri","2006","611511","Cosmetology and Barber Schools","45","321","8864","29",
"Missouri","2006","6116  ","Other Schools and Instruction","593","4091","47396","29",
"Missouri","2006","611512","Flight Training","20","214","11804","29",
"Missouri","2006","611513","Apprenticeship Training","31","420","9548","29",
"Missouri","2006","611519","Other Technical and Trade Schools","77","1450","40713","29",
"Missouri","2006","62311 ","Nursing Care Facilities","559","43330","843405","29",
"Missouri","2006","623110","Nursing Care Facilities","559","43330","843405","29",
"Missouri","2006","713   ","Amusement, Gambling, and Recreation Industries","1440","28008","478943","29",
"Missouri","2006","6232  ","Residential Mental Retardation, Mental Health and Substance Abuse Facilities","466","9647","175310","29",
"Missouri","2006","62321 ","Residential Mental Retardation Facilities","314","6878","123484","29",
"Missouri","2006","623210","Residential Mental Retardation Facilities","314","6878","123484","29",
"Missouri","2006","7131  ","Amusement Parks and Arcades","65","4917","58591","29",
"Missouri","2006","811211","Consumer Electronics Repair and Maintenance","53","302","12394","29",
"Missouri","2006","71311 ","Amusement and Theme Parks","13","0","0","29",
"Missouri","2006","713110","Amusement and Theme Parks","13","0","0","29",
"Missouri","2006","71312 ","Amusement Arcades","52","0","0","29",
"Missouri","2006","81394 ","Political Organizations","60","264","9869","29",
"Missouri","2006","811212","Computer and Office Machine Repair and Maintenance","99","500","17663","29",
"Missouri","2006","811213","Communication Equipment Repair and Maintenance","36","468","15824","29",
"Missouri","2006","811219","Other Electronic and Precision Equipment Repair and Maintenance","62","674","31964","29",
"Missouri","2006","336992","Military Armored Vehicle, Tank, and Tank Component Manufacturing","1","0","0","29",
"Missouri","2006","813940","Political Organizations","60","264","9869","29",
"Missouri","2006","81399 ","Other Similar Organizations (except Business, Professional, Labor, and Political Organizations)","295","1674","37969","29",
"Missouri","2006","813990","Other Similar Organizations (except Business, Professional, Labor, and Political Organizations)","295","1674","37969","29",
"Missouri","2006","33699 ","Other Transportation Equipment Manufacturing","21","0","0","29",
"Missouri","2006","336991","Motorcycle, Bicycle, and Parts Manufacturing","10","0","0","29",
"Missouri","2006","336999","All Other Transportation Equipment Manufacturing","10","0","0","29",
"Missouri","2006","42331 ","Lumber, Plywood, Millwork, and Wood Panel Merchant Wholesalers","195","3131","138939","29",
"Missouri","2006","42322 ","Home Furnishing Merchant Wholesalers","105","1149","48442","29",
"Missouri","2006","423220","Home Furnishing Merchant Wholesalers","105","1149","48442","29",
"Missouri","2006","4233  ","Lumber and Other Construction Materials Merchant Wholesalers","399","5218","237254","29",
"Missouri","2006","42394 ","Jewelry, Watch, Precious Stone, and Precious Metal Merchant Wholesalers","62","323","13963","29",
"Missouri","2006","423920","Toy and Hobby Goods and Supplies Merchant Wholesalers","37","277","9856","29",
"Missouri","2006","42393 ","Recyclable Material Merchant Wholesalers","170","2346","102889","29",
"Missouri","2006","423930","Recyclable Material Merchant Wholesalers","170","2346","102889","29",
"Missouri","2006","424910","Farm Supplies Merchant Wholesalers","268","2539","91314","29",
"Missouri","2006","424820","Wine and Distilled Alcoholic Beverage Merchant Wholesalers","25","1312","61635","29",
"Missouri","2006","4249  ","Miscellaneous Nondurable Goods Merchant Wholesalers","599","9690","311872","29",
"Missouri","2006","42491 ","Farm Supplies Merchant Wholesalers","268","2539","91314","29",
"Missouri","2006","4451  ","Grocery Stores","1444","43418","777714","29",
"Missouri","2006","445120","Convenience Stores","308","1733","23814","29",
"Missouri","2006","44511 ","Supermarkets and Other Grocery (except Convenience) Stores","1136","41685","753900","29",
"Missouri","2006","445110","Supermarkets and Other Grocery (except Convenience) Stores","1136","41685","753900","29",
"Missouri","2006","44512 ","Convenience Stores","308","1733","23814","29",
"Missouri","2006","452112","Discount Department Stores","153","22979","424517","29",
"Missouri","2006","45299 ","All Other General Merchandise Stores","768","0","0","29",
"Missouri","2006","4529  ","Other General Merchandise Stores","850","35081","649303","29",
"Missouri","2006","45291 ","Warehouse Clubs and Supercenters","82","0","0","29",
"Missouri","2006","452910","Warehouse Clubs and Supercenters","82","0","0","29",
"Missouri","2006","4851  ","Urban Transit Systems","5","0","0","29",
"Missouri","2006","48423 ","Specialized Freight (except Used Goods) Trucking, Long-Distance","479","6003","227756","29",
"Missouri","2006","484230","Specialized Freight (except Used Goods) Trucking, Long-Distance","479","6003","227756","29",
"Missouri","2006","485   ","Transit and Ground Passenger Transportation","285","8327","135850","29",
"Missouri","2006","488991","Packing and Crating","21","0","0","29",
"Missouri","2006","49211 ","Couriers","181","8231","280196","29",
"Missouri","2006","488999","All Other Support Activities for Transportation","2","0","0","29",
"Missouri","2006","492   ","Couriers and Messengers","292","8925","299099","29",
"Missouri","2006","4921  ","Couriers","181","8231","280196","29",
"Missouri","2006","5172  ","Wireless Telecommunications Carriers (except Satellite)","184","0","0","29",
"Missouri","2006","5232  ","Securities and Commodity Exchanges","1","0","0","29",
"Missouri","2006","51721 ","Wireless Telecommunications Carriers (except Satellite)","184","0","0","29",
"Missouri","2006","517211","Paging","8","0","0","29",
"Missouri","2006","517212","Cellular and Other Wireless Telecommunications","176","2106","107168","29",
"Missouri","2006","52391 ","Miscellaneous Intermediation","89","0","0","29",
"Missouri","2006","52321 ","Securities and Commodity Exchanges","1","0","0","29",
"Missouri","2006","523210","Securities and Commodity Exchanges","1","0","0","29",
"Missouri","2006","5239  ","Other Financial Investment Activities","540","0","0","29",
"Missouri","2006","532230","Video Tape and Disc Rental","435","3262","34027","29",
"Missouri","2006","532299","All Other Consumer Goods Rental","98","0","0","29",
"Missouri","2006","53229 ","Other Consumer Goods Rental","232","1929","64150","29",
"Missouri","2006","532291","Home Health Equipment Rental","88","1034","38695","29",
"Missouri","2006","532292","Recreational Goods Rental","46","0","0","29",
"Missouri","2006","541618","Other Management Consulting Services","57","846","21336","29",
"Missouri","2006","54162 ","Environmental Consulting Services","99","798","38447","29",
"Missouri","2006","56151 ","Travel Agencies","258","2968","104577","29",
"Missouri","2006","541620","Environmental Consulting Services","99","798","38447","29",
"Missouri","2006","54169 ","Other Scientific and Technical Consulting Services","246","712","48256","29",
"Missouri","2006","541690","Other Scientific and Technical Consulting Services","246","712","48256","29",
"Missouri","2006","561510","Travel Agencies","258","2968","104577","29",
"Missouri","2006","61161 ","Fine Arts Schools","218","1455","14052","29",
"Missouri","2006","56152 ","Tour Operators","42","265","9223","29",
"Missouri","2006","561520","Tour Operators","42","265","9223","29",
"Missouri","2006","56159 ","Other Travel Arrangement and Reservation Services","104","1601","68278","29",
"Missouri","2006","61163 ","Language Schools","9","97","562","29",
"Missouri","2006","611610","Fine Arts Schools","218","1455","14052","29",
"Missouri","2006","61162 ","Sports and Recreation Instruction","196","1212","13659","29",
"Missouri","2006","611620","Sports and Recreation Instruction","196","1212","13659","29",
"Missouri","2006","62322 ","Residential Mental Health and Substance Abuse Facilities","152","2769","51826","29",
"Missouri","2006","713120","Amusement Arcades","52","0","0","29",
"Missouri","2006","623220","Residential Mental Health and Substance Abuse Facilities","152","2769","51826","29",
"Missouri","2006","6233  ","Community Care Facilities for the Elderly","433","12823","243007","29",
"Missouri","2006","62331 ","Community Care Facilities for the Elderly","433","12823","243007","29",
"Missouri","2006","7132  ","Gambling Industries","16","5859","155779","29",
"Missouri","2006","8113  ","Commercial and Industrial Machinery and Equipment (except Automotive and Electronic) Repair and Maintenance","559","3501","138997","29",
"Missouri","2006","71321 ","Casinos (except Casino Hotels)","8","5281","142697","29",
"Missouri","2006","713210","Casinos (except Casino Hotels)","8","5281","142697","29",
"Missouri","2006","71329 ","Other Gambling Industries","8","578","13082","29",
"Missouri","2006","33711 ","Wood Kitchen Cabinet and Countertop Manufacturing","255","3364","101919","29",
"Missouri","2006","81131 ","Commercial and Industrial Machinery and Equipment (except Automotive and Electronic) Repair and Maintenance","559","3501","138997","29",
"Missouri","2006","811310","Commercial and Industrial Machinery and Equipment (except Automotive and Electronic) Repair and Maintenance","559","3501","138997","29",
"Missouri","2006","99    ","Unclassified","2993","2011","19991","29",
"Missouri","2006","337   ","Furniture and Related Product Manufacturing","479","11021","351727","29",
"Missouri","2006","3371  ","Household and Institutional Furniture and Kitchen Cabinet Manufacturing","387","8297","254549","29",
"Missouri","2006","337110","Wood Kitchen Cabinet and Countertop Manufacturing","255","3364","101919","29",
"Missouri","2006","423310","Lumber, Plywood, Millwork, and Wood Panel Merchant Wholesalers","195","3131","138939","29",
"Missouri","2006","423990","Other Miscellaneous Durable Goods Merchant Wholesalers","147","1640","64332","29",
"Missouri","2006","42332 ","Brick, Stone, and Related Construction Material Merchant Wholesalers","59","577","26003","29",
"Missouri","2006","423320","Brick, Stone, and Related Construction Material Merchant Wholesalers","59","577","26003","29",
