"New Hampshire","2008","333913","Measuring and dispensing pump manufacturing","1","0","0","33",
"New Hampshire","2008","333923","Overhead traveling crane, hoist, and monorail system manufacturing","1","0","0","33",
"New Hampshire","2008","33399 ","All other general purpose machinery manufacturing","39","2924","188238","33",
"New Hampshire","2008","333991","Power-driven handtool manufacturing","1","0","0","33",
"New Hampshire","2008","333992","Welding and soldering equipment manufacturing","8","0","0","33",
"New Hampshire","2008","333999","All other miscellaneous general purpose machinery manufacturing","15","0","0","33",
"New Hampshire","2008","33421 ","Telephone apparatus manufacturing","7","237","12157","33",
"New Hampshire","2008","334210","Telephone apparatus manufacturing","7","237","12157","33",
"New Hampshire","2008","3343  ","Audio and video equipment manufacturing","5","0","0","33",
"New Hampshire","2008","33431 ","Audio and video equipment manufacturing","5","0","0","33",
"New Hampshire","2008","334417","Electronic connector manufacturing","4","417","13262","33",
"New Hampshire","2008","333411","Air purification equipment manufacturing","2","0","0","33",
"New Hampshire","2008","33441 ","Semiconductor and other electronic component manufacturing","98","5938","294655","33",
"New Hampshire","2008","334411","Electron tube manufacturing","1","0","0","33",
"New Hampshire","2008","333415","Air-conditioning and warm air heating equipment and commercial and industrial refrigeration equipment manufacturing","6","0","0","33",
"New Hampshire","2008","3335  ","Metalworking machinery manufacturing","39","658","35006","33",
"New Hampshire","2008","333511","Industrial mold manufacturing","13","82","4493","33",
"New Hampshire","2008","333512","Machine tool (metal cutting types) manufacturing","5","0","0","33",
"New Hampshire","2008","333515","Cutting tool and machine tool accessory manufacturing","6","126","5349","33",
"New Hampshire","2008","333518","Other metalworking machinery manufacturing","3","0","0","33",
"New Hampshire","2008","3336  ","Engine, turbine, and power transmission equipment manufacturing","4","0","0","33",
"New Hampshire","2008","33361 ","Engine, turbine, and power transmission equipment manufacturing","4","0","0","33",
"New Hampshire","2008","333611","Turbine and turbine generator set units manufacturing","1","0","0","33",
"New Hampshire","2008","3339  ","Other general purpose machinery manufacturing","46","3485","217570","33",
"New Hampshire","2008","33391 ","Pump and compressor manufacturing","4","0","0","33",
"New Hampshire","2008","333911","Pump and pumping equipment manufacturing","2","0","0","33",
"New Hampshire","2008","333912","Air and gas compressor manufacturing","1","0","0","33",
"New Hampshire","2008","33392 ","Material handling equipment manufacturing","3","0","0","33",
"New Hampshire","2008","333922","Conveyor and conveying equipment manufacturing","2","0","0","33",
"New Hampshire","2008","333993","Packaging machinery manufacturing","7","0","0","33",
"New Hampshire","2008","333994","Industrial process furnace and oven manufacturing","7","0","0","33",
"New Hampshire","2008","333995","Fluid power cylinder and actuator manufacturing","1","0","0","33",
"New Hampshire","2008","334   ","Computer and electronic product manufacturing","214","21283","1794235","33",
"New Hampshire","2008","3341  ","Computer and peripheral equipment manufacturing","18","2273","231037","33",
"New Hampshire","2008","33411 ","Computer and peripheral equipment manufacturing","18","2273","231037","33",
"New Hampshire","2008","334111","Electronic computer manufacturing","6","111","8346","33",
"New Hampshire","2008","334112","Computer storage device manufacturing","2","0","0","33",
"New Hampshire","2008","334113","Computer terminal manufacturing","1","0","0","33",
"New Hampshire","2008","334119","Other computer peripheral equipment manufacturing","9","0","0","33",
"New Hampshire","2008","3342  ","Communications equipment manufacturing","22","504","30875","33",
"New Hampshire","2008","33422 ","Radio and television broadcasting and wireless communications equipment manufacturing","12","259","18469","33",
"New Hampshire","2008","334220","Broadcast and wireless communications equip.","12","259","18469","33",
"New Hampshire","2008","33429 ","Other communications equipment manufacturing","3","8","249","33",
"New Hampshire","2008","334290","Other communications equipment manufacturing","3","8","249","33",
"New Hampshire","2008","334310","Audio and video equipment manufacturing","5","0","0","33",
"New Hampshire","2008","3344  ","Semiconductor and other electronic component manufacturing","98","5938","294655","33",
"New Hampshire","2008","334412","Bare printed circuit board manufacturing","15","1473","68375","33",
"New Hampshire","2008","334413","Semiconductor and related device manufacturing","16","664","37948","33",
"New Hampshire","2008","334415","Electronic resistor manufacturing","4","291","13449","33",
"New Hampshire","2008","334416","Electronic coil, transformer, and other inductor manufacturing","8","0","0","33",
"New Hampshire","2008","3345  ","Navigational, measuring, electromedical, and control instruments manufacturing","66","0","0","33",
"New Hampshire","2008","33451 ","Electronic instrument manufacturing","66","0","0","33",
"New Hampshire","2008","334511","Search, detection, navigation, guidance, aeronautical, and nautical system and instrument manufacturing","6","0","0","33",
"New Hampshire","2008","334512","Automatic environmental control manufacturing for residential, commercial, and appliance use","5","0","0","33",
"New Hampshire","2008","334513","Instruments and related products manufacturing for measuring, displaying, and controlling industrial process variables","9","211","12353","33",
"New Hampshire","2008","334514","Totalizing fluid meter and counting device manufacturing","1","0","0","33",
"New Hampshire","2008","334515","Instrument manufacturing for measuring and testing electricity and electrical signals","18","0","0","33",
"New Hampshire","2008","33461 ","Manufacturing and reproducing magnetic and optical media","5","61","3222","33",
"New Hampshire","2008","335110","Electric lamp bulb and part manufacturing","2","0","0","33",
"New Hampshire","2008","335122","Commercial, industrial, and institutional electric lighting fixture manufacturing","1","0","0","33",
"New Hampshire","2008","335129","Other lighting equipment manufacturing","1","0","0","33",
"New Hampshire","2008","33522 ","Major appliance manufacturing","1","0","0","33",
"New Hampshire","2008","335221","Household cooking appliance manufacturing","1","0","0","33",
"New Hampshire","2008","3353  ","Electrical equipment manufacturing","15","628","31489","33",
"New Hampshire","2008","3359  ","Other electrical equipment and component manufacturing","37","3047","149275","33",
"New Hampshire","2008","33592 ","Communication and energy wire and cable manufacturing","13","0","0","33",
"New Hampshire","2008","335991","Carbon and graphite product manufacturing","3","0","0","33",
"New Hampshire","2008","3361  ","Motor vehicle manufacturing","1","0","0","33",
"New Hampshire","2008","33611 ","Automobile and light duty motor vehicle manufacturing","1","0","0","33",
"New Hampshire","2008","336360","Motor vehicle seating and interior trim manufacturing","1","0","0","33",
"New Hampshire","2008","334418","Printed circuit assembly (electronic assembly) manufacturing","26","1637","78756","33",
"New Hampshire","2008","334419","Other electronic component manufacturing","24","1265","74685","33",
"New Hampshire","2008","336214","Travel trailer and camper manufacturing","1","0","0","33",
"New Hampshire","2008","334510","Electromedical and electrotherapeutic apparatus manufacturing","2","0","0","33",
"New Hampshire","2008","336312","Gasoline engine and engine parts manufacturing","3","0","0","33",
"New Hampshire","2008","33632 ","Motor vehicle electrical and electronic equipment manufacturing","7","744","44808","33",
"New Hampshire","2008","334516","Analytical laboratory instrument manufacturing","11","324","18813","33",
"New Hampshire","2008","33636 ","Motor vehicle seating and interior trim manufacturing","1","0","0","33",
"New Hampshire","2008","334517","Irradiation apparatus manufacturing","1","0","0","33",
"New Hampshire","2008","334519","Other measuring and controlling device manufacturing","13","676","38210","33",
"New Hampshire","2008","3346  ","Manufacturing and reproducing magnetic and optical media","5","61","3222","33",
"New Hampshire","2008","334612","Prerecorded compact disc (except software), tape, and record reproducing","2","0","0","33",
"New Hampshire","2008","334613","Magnetic and optical recording media manufacturing","3","0","869","33",
"New Hampshire","2008","335   ","Electrical equipment, appliance, and component manufacturing","58","4755","235185","33",
"New Hampshire","2008","3351  ","Electric lighting equipment manufacturing","5","0","0","33",
"New Hampshire","2008","33511 ","Electric lamp bulb and part manufacturing","2","0","0","33",
"New Hampshire","2008","33512 ","Lighting fixture manufacturing","3","0","0","33",
"New Hampshire","2008","335121","Residential electric lighting fixture manufacturing","1","0","0","33",
"New Hampshire","2008","3352  ","Household appliance manufacturing","1","0","0","33",
"New Hampshire","2008","33531 ","Electrical equipment manufacturing","15","628","31489","33",
"New Hampshire","2008","335311","Power, distribution, and specialty transformer manufacturing","3","101","3154","33",
"New Hampshire","2008","335312","Motor and generator manufacturing","5","133","7618","33",
"New Hampshire","2008","335314","Relay and industrial control manufacturing","7","394","20717","33",
"New Hampshire","2008","335921","Fiber optic cable manufacturing","3","0","0","33",
"New Hampshire","2008","335929","Other communication and energy wire manufacturing","10","1088","49264","33",
"New Hampshire","2008","33593 ","Wiring device manufacturing","7","0","0","33",
"New Hampshire","2008","335931","Current-carrying wiring device manufacturing","7","0","0","33",
"New Hampshire","2008","33599 ","All other electrical equipment and component manufacturing","17","426","24781","33",
"New Hampshire","2008","335999","All other miscellaneous electrical equipment and component manufacturing","14","358","18153","33",
"New Hampshire","2008","336   ","Transportation equipment manufacturing","40","2935","163221","33",
"New Hampshire","2008","336111","Automobile manufacturing","1","0","0","33",
"New Hampshire","2008","3362  ","Motor vehicle body and trailer manufacturing","7","159","6784","33",
"New Hampshire","2008","33621 ","Motor vehicle body and trailer manufacturing","7","159","6784","33",
"New Hampshire","2008","336211","Motor vehicle body manufacturing","6","151","6629","33",
"New Hampshire","2008","3363  ","Motor vehicle parts manufacturing","16","1450","70321","33",
"New Hampshire","2008","33631 ","Motor vehicle gasoline engine and engine parts manufacturing","3","0","0","33",
"New Hampshire","2008","336321","Vehicular lighting equipment manufacturing","2","0","0","33",
"New Hampshire","2008","336322","Other motor vehicle electrical and electronic equipment manufacturing","5","211","9843","33",
"New Hampshire","2008","33635 ","Motor vehicle transmission and power train parts manufacturing","2","0","0","33",
"New Hampshire","2008","336350","Motor vehicle transmission and power train parts manufacturing","2","0","0","33",
"New Hampshire","2008","33637 ","Motor vehicle metal stamping","2","0","0","33",
"New Hampshire","2008","33641 ","Aerospace product and parts manufacturing","5","0","0","33",
"New Hampshire","2008","3366  ","Ship and boat building","9","0","0","33",
"New Hampshire","2008","33661 ","Ship and boat building","9","0","0","33",
"New Hampshire","2008","336611","Ship building and repairing","5","0","0","33",
"New Hampshire","2008","336999","All other transportation equipment manufacturing","1","0","0","33",
"New Hampshire","2008","337   ","Furniture and related product manufacturing","89","1472","61293","33",
"New Hampshire","2008","33711 ","Wood kitchen cabinet and countertop manufacturing","33","315","13094","33",
"New Hampshire","2008","337110","Wood kitchen cabinet and countertop manufacturing","33","315","13094","33",
"New Hampshire","2008","33712 ","Household and institutional furniture manufacturing","32","0","0","33",
"New Hampshire","2008","337121","Upholstered household furniture manufacturing","2","0","0","33",
"New Hampshire","2008","337127","Institutional furniture manufacturing","3","0","0","33",
"New Hampshire","2008","3372  ","Office furniture (including fixtures) manufacturing","21","382","17788","33",
"New Hampshire","2008","337910","Mattress manufacturing","2","0","0","33",
"New Hampshire","2008","339   ","Miscellaneous manufacturing","160","5922","288276","33",
"New Hampshire","2008","3391  ","Medical equipment and supplies manufacturing","60","3118","170953","33",
"New Hampshire","2008","33911 ","Medical equipment and supplies manufacturing","60","3118","170953","33",
"New Hampshire","2008","339112","Surgical and medical instrument manufacturing","20","2024","117696","33",
"New Hampshire","2008","339116","Dental laboratories","21","221","6988","33",
"New Hampshire","2008","339911","Jewelry (except costume) manufacturing","5","25","528","33",
"New Hampshire","2008","339913","Jewelers' material and lapidary work manufacturing","1","0","0","33",
"New Hampshire","2008","339932","Game, toy, and children's vehicle manufacturing","3","0","0","33",
"New Hampshire","2008","336370","Motor vehicle metal stamping","2","0","0","33",
"New Hampshire","2008","339931","Doll and stuffed toy manufacturing","2","0","0","33",
"New Hampshire","2008","33639 ","Other motor vehicle parts manufacturing","1","0","0","33",
"New Hampshire","2008","336399","All other motor vehicle parts manufacturing","1","0","0","33",
"New Hampshire","2008","3364  ","Aerospace product and parts manufacturing","5","0","0","33",
"New Hampshire","2008","336412","Aircraft engine and engine parts manufacturing","3","0","0","33",
"New Hampshire","2008","336413","Other aircraft parts and auxiliary equipment manufacturing","2","0","0","33",
"New Hampshire","2008","336612","Boat building","4","0","0","33",
"New Hampshire","2008","3369  ","Other transportation equipment manufacturing","2","0","0","33",
"New Hampshire","2008","33699 ","Other transportation equipment manufacturing","2","0","0","33",
"New Hampshire","2008","336991","Motorcycle, bicycle, and parts manufacturing","1","0","0","33",
"New Hampshire","2008","3371  ","Household and institutional furniture and kitchen cabinet manufacturing","65","0","0","33",
"New Hampshire","2008","337122","Nonupholstered wood household furniture manufacturing","26","375","9721","33",
"New Hampshire","2008","337124","Metal household furniture manufacturing","1","0","0","33",
"New Hampshire","2008","33721 ","Office furniture (including fixtures) manufacturing","21","382","17788","33",
"New Hampshire","2008","337212","Custom architectural woodwork and millwork manufacturing","15","306","16131","33",
"New Hampshire","2008","337215","Showcase, partition, shelving, and locker manufacturing","6","76","1657","33",
"New Hampshire","2008","3379  ","Other furniture related product manufacturing","3","0","0","33",
"New Hampshire","2008","33791 ","Mattress manufacturing","2","0","0","33",
"New Hampshire","2008","33792 ","Blind and shade manufacturing","1","0","0","33",
"New Hampshire","2008","337920","Blind and shade manufacturing","1","0","0","33",
"New Hampshire","2008","339113","Surgical appliance and supplies manufacturing","16","845","44930","33",
"New Hampshire","2008","339114","Dental equipment and supplies manufacturing","2","0","0","33",
"New Hampshire","2008","339115","Ophthalmic goods manufacturing","1","0","0","33",
"New Hampshire","2008","3399  ","Other miscellaneous manufacturing","100","2804","117323","33",
"New Hampshire","2008","33991 ","Jewelry and silverware manufacturing","8","0","0","33",
"New Hampshire","2008","339914","Costume jewelry and novelty manufacturing","2","0","0","33",
"New Hampshire","2008","33992 ","Sporting and athletic goods manufacturing","5","0","2496","33",
"New Hampshire","2008","339920","Sporting and athletic goods manufacturing","5","0","2496","33",
"New Hampshire","2008","33993 ","Doll, toy, and game manufacturing","5","55","1656","33",
"New Hampshire","2008","33994 ","Office supplies (except paper) manufacturing","3","21","856","33",
"New Hampshire","2008","339991","Gasket, packing, and sealing device manufacturing","9","1292","46276","33",
"New Hampshire","2008","339992","Musical instrument manufacturing","4","0","122","33",
"New Hampshire","2008","339994","Broom, brush, and mop manufacturing","1","0","0","33",
"New Hampshire","2008","339995","Burial casket manufacturing","1","0","0","33",
"New Hampshire","2008","339999","All other miscellaneous manufacturing","22","365","20637","33",
"New Hampshire","2008","423   ","Merchant wholesalers, durable goods","1184","16985","1213265","33",
"New Hampshire","2008","423110","Automobile and other motor vehicle merchant wholesalers","27","479","22271","33",
"New Hampshire","2008","42312 ","Motor vehicle supplies and new parts merchant wholesalers","51","646","24149","33",
"New Hampshire","2008","423140","Motor vehicle parts (used) merchant wholesalers","11","105","4290","33",
"New Hampshire","2008","423210","Furniture merchant wholesalers","23","208","14632","33",
"New Hampshire","2008","42322 ","Home furnishing merchant wholesalers","17","154","7345","33",
"New Hampshire","2008","423220","Home furnishing merchant wholesalers","17","154","7345","33",
"New Hampshire","2008","423320","Brick, stone, and related construction material merchant wholesalers","22","152","9053","33",
"New Hampshire","2008","423420","Office equipment merchant wholesalers","35","588","35917","33",
"New Hampshire","2008","42344 ","Other commercial equipment merchant wholesalers","18","130","6928","33",
"New Hampshire","2008","42362 ","Electrical and electronic appliance, television, and radio set merchant wholesalers","14","0","0","33",
"New Hampshire","2008","339943","Marking device manufacturing","3","21","856","33",
"New Hampshire","2008","42349 ","Other professional equipment and supplies merchant wholesalers","19","0","34482","33",
"New Hampshire","2008","423490","Other professional equipment and supplies merchant wholesalers","19","0","34482","33",
"New Hampshire","2008","33995 ","Sign manufacturing","41","341","13080","33",
"New Hampshire","2008","339950","Sign manufacturing","41","341","13080","33",
"New Hampshire","2008","33999 ","All other miscellaneous manufacturing","38","2239","95959","33",
"New Hampshire","2008","339993","Fastener, button, needle, and pin manufacturing","1","0","0","33",
"New Hampshire","2008","423520","Coal and other mineral and ore merchant wholesalers","1","0","0","33",
"New Hampshire","2008","42    ","Wholesale trade","1860","26418","1692383","33",
"New Hampshire","2008","423610","Electrical apparatus and equipment, wiring supplies, and related equipment merchant wholesalers","64","819","50579","33",
"New Hampshire","2008","4231  ","Motor vehicle and motor vehicle parts and supplies merchant wholesalers","102","1353","55949","33",
"New Hampshire","2008","42311 ","Automobile and other motor vehicle merchant wholesalers","27","479","22271","33",
"New Hampshire","2008","423120","Motor vehicle supplies and new parts merchant wholesalers","51","646","24149","33",
"New Hampshire","2008","42313 ","Tire and tube merchant wholesalers","13","123","5239","33",
"New Hampshire","2008","423130","Tire and tube merchant wholesalers","13","123","5239","33",
"New Hampshire","2008","42314 ","Motor vehicle parts (used) merchant wholesalers","11","105","4290","33",
"New Hampshire","2008","4232  ","Furniture and home furnishing merchant wholesalers","40","362","21977","33",
"New Hampshire","2008","42321 ","Furniture merchant wholesalers","23","208","14632","33",
"New Hampshire","2008","4233  ","Lumber and other construction materials merchant wholesalers","96","1321","78228","33",
"New Hampshire","2008","42331 ","Lumber, plywood, millwork, and wood panel merchant wholesalers","50","796","48119","33",
"New Hampshire","2008","423310","Lumber, plywood, millwork, and wood panel merchant wholesalers","50","796","48119","33",
"New Hampshire","2008","42332 ","Brick, stone, and related construction material merchant wholesalers","22","152","9053","33",
"New Hampshire","2008","42333 ","Roofing, siding, and insulation material merchant wholesalers","13","315","16992","33",
"New Hampshire","2008","423330","Roofing, siding, and insulation material merchant wholesalers","13","315","16992","33",
"New Hampshire","2008","42339 ","Other construction material merchant wholesalers","11","58","4064","33",
"New Hampshire","2008","423390","Other construction material merchant wholesalers","11","58","4064","33",
"New Hampshire","2008","4234  ","Professional and commercial equipment and supplies merchant wholesalers","218","5205","498882","33",
"New Hampshire","2008","42341 ","Photographic equipment and supplies merchant wholesalers","3","0","0","33",
"New Hampshire","2008","423410","Photographic equipment and supplies merchant wholesalers","3","0","0","33",
"New Hampshire","2008","42342 ","Office equipment merchant wholesalers","35","588","35917","33",
"New Hampshire","2008","42343 ","Computer and computer peripheral equipment and software merchant wholesalers","102","3275","346187","33",
"New Hampshire","2008","423430","Computer and computer peripheral equipment and software merchant wholesalers","102","3275","346187","33",
"New Hampshire","2008","423440","Other commercial equipment merchant wholesalers","18","130","6928","33",
"New Hampshire","2008","42345 ","Medical, dental, and hospital equipment and supplies merchant wholesalers","36","757","72860","33",
"New Hampshire","2008","423450","Medical, dental, and hospital equipment and supplies merchant wholesalers","36","757","72860","33",
"New Hampshire","2008","42346 ","Ophthalmic goods merchant wholesalers","5","0","1837","33",
"New Hampshire","2008","423460","Ophthalmic goods merchant wholesalers","5","0","1837","33",
"New Hampshire","2008","4235  ","Metal and mineral (except petroleum) merchant wholesalers","30","545","30988","33",
"New Hampshire","2008","42351 ","Metal service centers and other metal merchant wholesalers","29","540","30735","33",
"New Hampshire","2008","423510","Metal service centers and other metal merchant wholesalers","29","540","30735","33",
"New Hampshire","2008","42352 ","Coal and other mineral and ore merchant wholesalers","1","0","0","33",
"New Hampshire","2008","4236  ","Electrical and electronic goods merchant wholesalers","207","3084","244073","33",
"New Hampshire","2008","42361 ","Electrical apparatus and equipment, wiring supplies, and related equipment merchant wholesalers","64","819","50579","33",
"New Hampshire","2008","423620","Electrical and electronic appliance, television, and radio set merchant wholesalers","14","0","0","33",
"New Hampshire","2008","4237  ","Hardware, plumbing and heating equipment and supplies merchant wholesalers","101","1020","54712","33",
"New Hampshire","2008","42371 ","Hardware merchant wholesalers","19","89","4671","33",
"New Hampshire","2008","423730","Warm air heating and air-conditioning equipment and supplies merchant wholesalers","23","198","11150","33",
"New Hampshire","2008","4238  ","Machinery, equipment, and supplies merchant wholesalers","262","2411","135636","33",
"New Hampshire","2008","42381 ","Construction and mining (except oil well) machinery and equipment merchant wholesalers","30","461","24049","33",
"New Hampshire","2008","423830","Industrial machinery and equipment merchant wholesalers","126","980","57681","33",
"New Hampshire","2008","42385 ","Service establishment equipment and supplies merchant wholesalers","19","116","4310","33",
"New Hampshire","2008","423850","Service establishment equipment and supplies merchant wholesalers","19","116","4310","33",
"New Hampshire","2008","42386 ","Transportation equipment and supplies (except motor vehicle) merchant wholesalers","13","0","7042","33",
"New Hampshire","2008","423910","Sporting and recreational goods and supplies merchant wholesalers","33","501","31948","33",
"New Hampshire","2008","42393 ","Recyclable material merchant wholesalers","34","0","0","33",
"New Hampshire","2008","423930","Recyclable material merchant wholesalers","34","0","0","33",
"New Hampshire","2008","423940","Jewelry, watch, precious stone, and precious metal merchant wholesalers","12","83","3327","33",
"New Hampshire","2008","42399 ","Other miscellaneous durable goods merchant wholesalers","37","474","20969","33",
"New Hampshire","2008","423990","Other miscellaneous durable goods merchant wholesalers","37","474","20969","33",
"New Hampshire","2008","424   ","Merchant wholesalers, nondurable goods","395","8415","411662","33",
"New Hampshire","2008","4241  ","Paper and paper product merchant wholesalers","42","669","31169","33",
"New Hampshire","2008","42411 ","Printing and writing paper merchant wholesalers","3","0","0","33",
"New Hampshire","2008","42413 ","Industrial and personal service paper merchant wholesalers","12","280","12471","33",
"New Hampshire","2008","424130","Industrial and personal service paper merchant wholesalers","12","280","12471","33",
"New Hampshire","2008","42431 ","Piece goods, notions, and other dry goods merchant wholesalers","5","62","2823","33",
"New Hampshire","2008","42369 ","Other electronic parts and equipment merchant wholesalers","129","1864","162680","33",
"New Hampshire","2008","423690","Other electronic parts and equipment merchant wholesalers","129","1864","162680","33",
"New Hampshire","2008","423710","Hardware merchant wholesalers","19","89","4671","33",
