"GEO_TTL","YEAR","NAICS2007","NAICS2007_TTL","ESTAB","EMP","PAYANN","state",
"North Carolina","2008","00    ","Total for all sectors","225158","3585123","132400692","37",
"North Carolina","2008","11    ","Agriculture, forestry, fishing and hunting","802","4595","144348","37",
"North Carolina","2008","113   ","Forestry and logging","521","3102","102416","37",
"North Carolina","2008","1131  ","Timber tract operations","22","0","4023","37",
"North Carolina","2008","11311 ","Timber tract operations","22","0","4023","37",
"North Carolina","2008","113210","Forest nurseries and gathering of forest products","13","81","2096","37",
"North Carolina","2008","113110","Timber tract operations","22","0","4023","37",
"North Carolina","2008","1132  ","Forest nurseries and gathering of forest products","13","81","2096","37",
"North Carolina","2008","11321 ","Forest nurseries and gathering of forest products","13","81","2096","37",
"North Carolina","2008","114   ","Fishing, hunting and trapping","20","64","1539","37",
"North Carolina","2008","114111","Finfish fishing","7","0","438","37",
"North Carolina","2008","1133  ","Logging","486","2942","96297","37",
"North Carolina","2008","11331 ","Logging","486","2942","96297","37",
"North Carolina","2008","113310","Logging","486","2942","96297","37",
"North Carolina","2008","1141  ","Fishing","13","0","908","37",
"North Carolina","2008","11411 ","Fishing","13","0","908","37",
"North Carolina","2008","114112","Shellfish fishing","6","0","470","37",
"North Carolina","2008","1142  ","Hunting and trapping","7","37","631","37",
"North Carolina","2008","115111","Cotton ginning","23","0","5697","37",
"North Carolina","2008","115114","Postharvest crop activities (except cotton ginning)","13","312","8931","37",
"North Carolina","2008","115115","Farm labor contractors and crew leaders","7","0","878","37",
"North Carolina","2008","11521 ","Support activities for animal production","110","411","11164","37",
"North Carolina","2008","115210","Support activities for animal production","110","411","11164","37",
"North Carolina","2008","211   ","Oil and gas extraction","4","0","986","37",
"North Carolina","2008","211111","Crude petroleum and natural gas extraction","4","0","986","37",
"North Carolina","2008","11421 ","Hunting and trapping","7","37","631","37",
"North Carolina","2008","114210","Hunting and trapping","7","37","631","37",
"North Carolina","2008","115   ","Support activities for agriculture and forestry","261","1429","40393","37",
"North Carolina","2008","1151  ","Support activities for crop production","82","719","20041","37",
"North Carolina","2008","11511 ","Support activities for crop production","82","719","20041","37",
"North Carolina","2008","115112","Soil preparation, planting, and cultivating","32","167","4074","37",
"North Carolina","2008","115113","Crop harvesting, primarily by machine","2","0","0","37",
"North Carolina","2008","115116","Farm management services","5","0","320","37",
"North Carolina","2008","1152  ","Support activities for animal production","110","411","11164","37",
"North Carolina","2008","1153  ","Support activities for forestry","69","299","9188","37",
"North Carolina","2008","11531 ","Support activities for forestry","69","299","9188","37",
"North Carolina","2008","115310","Support activities for forestry","69","299","9188","37",
"North Carolina","2008","21    ","Mining, quarrying, and oil and gas extraction","195","3371","151936","37",
"North Carolina","2008","2111  ","Oil and gas extraction","4","0","986","37",
"North Carolina","2008","21111 ","Oil and gas extraction","4","0","986","37",
"North Carolina","2008","212   ","Mining (except oil and gas)","168","3195","141994","37",
"North Carolina","2008","212299","All other metal ore mining","1","0","0","37",
"North Carolina","2008","2123  ","Nonmetallic mineral mining and quarrying","167","3184","141623","37",
"North Carolina","2008","21232 ","Sand, gravel, clay, and ceramic and refractory minerals mining and quarrying","42","700","24942","37",
"North Carolina","2008","212325","Clay and ceramic and refractory minerals mining","3","0","0","37",
"North Carolina","2008","21239 ","Other nonmetallic mineral mining and quarrying","12","468","22709","37",
"North Carolina","2008","213   ","Support activities for mining","23","161","8956","37",
"North Carolina","2008","2131  ","Support activities for mining","23","161","8956","37",
"North Carolina","2008","21311 ","Support activities for mining","23","161","8956","37",
"North Carolina","2008","213114","Support activities for metal mining","1","0","0","37",
"North Carolina","2008","2122  ","Metal ore mining","1","0","0","37",
"North Carolina","2008","21229 ","Other metal ore mining","1","0","0","37",
"North Carolina","2008","21231 ","Stone mining and quarrying","113","2016","93972","37",
"North Carolina","2008","212311","Dimension stone mining and quarrying","8","0","2486","37",
"North Carolina","2008","212312","Crushed and broken limestone mining and quarrying","16","224","9148","37",
"North Carolina","2008","212313","Crushed and broken granite mining and quarrying","73","1386","67160","37",
"North Carolina","2008","212319","Other crushed and broken stone mining and quarrying","16","341","15178","37",
"North Carolina","2008","212321","Construction sand and gravel mining","32","547","18785","37",
"North Carolina","2008","212322","Industrial sand mining","7","89","3525","37",
"North Carolina","2008","212399","All other nonmetallic mineral mining","12","468","22709","37",
"North Carolina","2008","213111","Drilling oil and gas wells","7","0","849","37",
"North Carolina","2008","213112","Support activities for oil and gas operations","7","0","0","37",
"North Carolina","2008","213113","Support activities for coal mining","1","0","0","37",
"North Carolina","2008","2211  ","Electric power generation, transmission and distribution","270","17901","1616112","37",
"North Carolina","2008","221112","Fossil fuel electric power generation","20","0","0","37",
"North Carolina","2008","213115","Support activities for nonmetallic minerals (except fuels) mining","7","27","982","37",
"North Carolina","2008","22    ","Utilities","435","20876","1783767","37",
"North Carolina","2008","221   ","Utilities","435","20876","1783767","37",
"North Carolina","2008","22111 ","Electric power generation","42","0","0","37",
"North Carolina","2008","221111","Hydroelectric power generation","7","0","0","37",
"North Carolina","2008","221113","Nuclear electric power generation","3","0","0","37",
"North Carolina","2008","221119","Other electric power generation","12","173","10942","37",
"North Carolina","2008","22121 ","Natural gas distribution","57","0","0","37",
"North Carolina","2008","221310","Water supply and irrigation systems","78","683","26373","37",
"North Carolina","2008","22133 ","Steam and air-conditioning supply","4","0","0","37",
"North Carolina","2008","221330","Steam and air-conditioning supply","4","0","0","37",
"North Carolina","2008","236115","New single-family housing construction (except operative builders)","3250","12858","424339","37",
"North Carolina","2008","22112 ","Electric power transmission, control, and distribution","228","14667","1299808","37",
"North Carolina","2008","221121","Electric bulk power transmission and control","1","0","0","37",
"North Carolina","2008","221122","Electric power distribution","227","14666","1299591","37",
"North Carolina","2008","2212  ","Natural gas distribution","57","0","0","37",
"North Carolina","2008","221210","Natural gas distribution","57","0","0","37",
"North Carolina","2008","2213  ","Water, sewage and other systems","108","852","32266","37",
"North Carolina","2008","22131 ","Water supply and irrigation systems","78","683","26373","37",
"North Carolina","2008","22132 ","Sewage treatment facilities","26","128","3579","37",
"North Carolina","2008","221320","Sewage treatment facilities","26","128","3579","37",
"North Carolina","2008","23    ","Construction","27325","239555","9040036","37",
"North Carolina","2008","236   ","Construction of buildings","8648","52193","2267936","37",
"North Carolina","2008","2361  ","Residential building construction","7344","31487","1207318","37",
"North Carolina","2008","23611 ","Residential building construction","7344","31487","1207318","37",
"North Carolina","2008","2362  ","Nonresidential building construction","1304","20706","1060618","37",
"North Carolina","2008","23622 ","Commercial and institutional building construction","1218","19118","976743","37",
"North Carolina","2008","236220","Commercial and institutional building construction","1218","19118","976743","37",
"North Carolina","2008","23712 ","Oil and gas pipeline and related structures construction","29","1150","51781","37",
"North Carolina","2008","237130","Power and communication line and related structures construction","257","11773","520466","37",
"North Carolina","2008","2372  ","Land subdivision","590","3168","140598","37",
"North Carolina","2008","23811 ","Poured concrete foundation and structure contractors","669","7582","238290","37",
"North Carolina","2008","236116","New multifamily housing construction (except operative builders)","121","888","42418","37",
"North Carolina","2008","236117","New housing operative builders","1590","10028","504998","37",
"North Carolina","2008","236118","Residential remodelers","2383","7713","235563","37",
"North Carolina","2008","23621 ","Industrial building construction","86","1588","83875","37",
"North Carolina","2008","236210","Industrial building construction","86","1588","83875","37",
"North Carolina","2008","237   ","Heavy and civil engineering construction","2013","38861","1637801","37",
"North Carolina","2008","2371  ","Utility system construction","803","21123","899749","37",
"North Carolina","2008","23711 ","Water and sewer line and related structures construction","517","8200","327502","37",
"North Carolina","2008","237110","Water and sewer line and related structures construction","517","8200","327502","37",
"North Carolina","2008","237120","Oil and gas pipeline and related structures construction","29","1150","51781","37",
"North Carolina","2008","23713 ","Power and communication line and related structures construction","257","11773","520466","37",
"North Carolina","2008","23721 ","Land subdivision","590","3168","140598","37",
"North Carolina","2008","237210","Land subdivision","590","3168","140598","37",
"North Carolina","2008","2373  ","Highway, street, and bridge construction","444","13199","548392","37",
"North Carolina","2008","23731 ","Highway, street, and bridge construction","444","13199","548392","37",
"North Carolina","2008","237310","Highway, street, and bridge construction","444","13199","548392","37",
"North Carolina","2008","2379  ","Other heavy and civil engineering construction","176","1371","49062","37",
"North Carolina","2008","23799 ","Other heavy and civil engineering construction","176","1371","49062","37",
"North Carolina","2008","237990","Other heavy and civil engineering construction","176","1371","49062","37",
"North Carolina","2008","238   ","Specialty trade contractors","16664","148501","5134299","37",
"North Carolina","2008","2381  ","Foundation, structure, and building exterior contractors","3688","33997","1024803","37",
"North Carolina","2008","238110","Poured concrete foundation and structure contractors","669","7582","238290","37",
"North Carolina","2008","23813 ","Framing contractors","532","2041","52528","37",
"North Carolina","2008","238130","Framing contractors","532","2041","52528","37",
"North Carolina","2008","238160","Roofing contractors","516","6073","189315","37",
"North Carolina","2008","23819 ","Other foundation, structure, and building exterior contractors","189","1490","51177","37",
"North Carolina","2008","238190","Other foundation, structure, and building exterior contractors","189","1490","51177","37",
"North Carolina","2008","23821 ","Electrical contractors and other wiring installation contractors","2966","27073","968227","37",
"North Carolina","2008","238210","Electrical contractors and other wiring installation contractors","2966","27073","968227","37",
"North Carolina","2008","23822 ","Plumbing, heating, and air-conditioning contractors","3511","39080","1523144","37",
"North Carolina","2008","238320","Painting and wall covering contractors","1151","6054","163001","37",
"North Carolina","2008","23834 ","Tile and terrazzo contractors","362","2041","66100","37",
"North Carolina","2008","238340","Tile and terrazzo contractors","362","2041","66100","37",
"North Carolina","2008","23835 ","Finish carpentry contractors","1010","4225","123487","37",
"North Carolina","2008","23891 ","Site preparation contractors","1494","13741","479776","37",
"North Carolina","2008","238990","All other specialty trade contractors","916","6744","213614","37",
"North Carolina","2008","31-33 ","Manufacturing","9832","502878","20050787","37",
"North Carolina","2008","31111 ","Animal food manufacturing","56","1253","49581","37",
"North Carolina","2008","311111","Dog and cat food manufacturing","5","0","0","37",
"North Carolina","2008","311213","Malt manufacturing","1","0","0","37",
"North Carolina","2008","23812 ","Structural steel and precast concrete contractors","115","3475","120518","37",
"North Carolina","2008","238120","Structural steel and precast concrete contractors","115","3475","120518","37",
"North Carolina","2008","23814 ","Masonry contractors","1066","9742","267082","37",
"North Carolina","2008","238140","Masonry contractors","1066","9742","267082","37",
"North Carolina","2008","23815 ","Glass and glazing contractors","181","1771","64359","37",
"North Carolina","2008","238150","Glass and glazing contractors","181","1771","64359","37",
"North Carolina","2008","23816 ","Roofing contractors","516","6073","189315","37",
"North Carolina","2008","23817 ","Siding contractors","420","1823","41534","37",
"North Carolina","2008","238170","Siding contractors","420","1823","41534","37",
"North Carolina","2008","2382  ","Building equipment contractors","6688","69668","2665937","37",
"North Carolina","2008","238220","Plumbing, heating, and air-conditioning contractors","3511","39080","1523144","37",
"North Carolina","2008","23829 ","Other building equipment contractors","211","3515","174566","37",
"North Carolina","2008","238290","Other building equipment contractors","211","3515","174566","37",
"North Carolina","2008","2383  ","Building finishing contractors","3878","24351","750169","37",
"North Carolina","2008","23831 ","Drywall and insulation contractors","616","7625","256932","37",
"North Carolina","2008","238310","Drywall and insulation contractors","616","7625","256932","37",
"North Carolina","2008","23832 ","Painting and wall covering contractors","1151","6054","163001","37",
"North Carolina","2008","23833 ","Flooring contractors","518","2643","82663","37",
"North Carolina","2008","238330","Flooring contractors","518","2643","82663","37",
"North Carolina","2008","238350","Finish carpentry contractors","1010","4225","123487","37",
"North Carolina","2008","23839 ","Other building finishing contractors","221","1763","57986","37",
"North Carolina","2008","238390","Other building finishing contractors","221","1763","57986","37",
"North Carolina","2008","2389  ","Other specialty trade contractors","2410","20485","693390","37",
"North Carolina","2008","238910","Site preparation contractors","1494","13741","479776","37",
"North Carolina","2008","23899 ","All other specialty trade contractors","916","6744","213614","37",
"North Carolina","2008","311   ","Food manufacturing","524","53952","1669522","37",
"North Carolina","2008","3111  ","Animal food manufacturing","56","1253","49581","37",
"North Carolina","2008","311119","Other animal food manufacturing","51","1074","41616","37",
"North Carolina","2008","3112  ","Grain and oilseed milling","27","870","41165","37",
"North Carolina","2008","31121 ","Flour milling and malt manufacturing","17","516","18917","37",
"North Carolina","2008","311211","Flour milling","16","501","18411","37",
"North Carolina","2008","311223","Other oilseed processing","1","0","0","37",
"North Carolina","2008","311230","Breakfast cereal manufacturing","1","0","0","37",
"North Carolina","2008","31122 ","Starch and vegetable fats and oils manufacturing","9","0","0","37",
"North Carolina","2008","311221","Wet corn milling","2","0","0","37",
"North Carolina","2008","311222","Soybean processing","4","0","0","37",
"North Carolina","2008","311225","Fats and oils refining and blending","2","0","0","37",
"North Carolina","2008","31123 ","Breakfast cereal manufacturing","1","0","0","37",
"North Carolina","2008","3113  ","Sugar and confectionery product manufacturing","29","562","17522","37",
"North Carolina","2008","31133 ","Confectionery manufacturing from purchased chocolate","19","195","3661","37",
"North Carolina","2008","31141 ","Frozen food manufacturing","9","0","0","37",
"North Carolina","2008","311421","Fruit and vegetable canning","19","1460","58058","37",
"North Carolina","2008","311422","Specialty canning","3","0","0","37",
"North Carolina","2008","311514","Dry, condensed, and evaporated dairy product manufacturing","1","0","0","37",
"North Carolina","2008","31152 ","Ice cream and frozen dessert manufacturing","8","84","1966","37",
"North Carolina","2008","311520","Ice cream and frozen dessert manufacturing","8","84","1966","37",
"North Carolina","2008","3116  ","Animal slaughtering and processing","125","34218","934599","37",
"North Carolina","2008","311612","Meat processed from carcasses","35","3341","93589","37",
"North Carolina","2008","311613","Rendering and meat byproduct processing","11","0","0","37",
"North Carolina","2008","31171 ","Seafood product preparation and packaging","18","232","5373","37",
"North Carolina","2008","311711","Seafood canning","1","0","0","37",
"North Carolina","2008","311813","Frozen cakes, pies, and other pastries manufacturing","5","0","0","37",
"North Carolina","2008","311822","Flour mixes and dough manufacturing from purchased flour","4","0","0","37",
"North Carolina","2008","31183 ","Tortilla manufacturing","7","811","23447","37",
"North Carolina","2008","3119  ","Other food manufacturing","61","3551","136645","37",
"North Carolina","2008","31191 ","Snack food manufacturing","14","1194","40171","37",
"North Carolina","2008","311911","Roasted nuts and peanut butter manufacturing","7","661","20018","37",
"North Carolina","2008","311942","Spice and extract manufacturing","3","0","0","37",
"North Carolina","2008","312   ","Beverage and tobacco product manufacturing","97","11341","647737","37",
"North Carolina","2008","311330","Confectionery manufacturing from purchased chocolate","19","195","3661","37",
"North Carolina","2008","311999","All other miscellaneous food manufacturing","20","0","0","37",
"North Carolina","2008","31134 ","Nonchocolate confectionery manufacturing","10","367","13861","37",
"North Carolina","2008","311340","Nonchocolate confectionery manufacturing","10","367","13861","37",
"North Carolina","2008","3114  ","Fruit and vegetable preserving and specialty food manufacturing","33","3366","120242","37",
"North Carolina","2008","311412","Frozen specialty food manufacturing","9","0","0","37",
"North Carolina","2008","31142 ","Fruit and vegetable canning, pickling, and drying","24","2264","92113","37",
"North Carolina","2008","311423","Dried and dehydrated food manufacturing","2","0","0","37",
"North Carolina","2008","3115  ","Dairy product manufacturing","19","1274","42811","37",
"North Carolina","2008","31151 ","Dairy product (except frozen) manufacturing","11","1190","40845","37",
"North Carolina","2008","311511","Fluid milk manufacturing","7","1158","40001","37",
"North Carolina","2008","311513","Cheese manufacturing","3","0","0","37",
"North Carolina","2008","31161 ","Animal slaughtering and processing","125","34218","934599","37",
"North Carolina","2008","311611","Animal (except poultry) slaughtering","47","0","0","37",
"North Carolina","2008","311615","Poultry processing","32","22279","568315","37",
"North Carolina","2008","3117  ","Seafood product preparation and packaging","18","232","5373","37",
"North Carolina","2008","311712","Fresh and frozen seafood processing","17","219","5248","37",
"North Carolina","2008","3118  ","Bakeries and tortilla manufacturing","156","8626","321584","37",
"North Carolina","2008","31181 ","Bread and bakery product manufacturing","141","5390","200960","37",
"North Carolina","2008","311811","Retail bakeries","72","601","9818","37",
"North Carolina","2008","311812","Commercial bakeries","64","4504","183472","37",
"North Carolina","2008","31182 ","Cookie, cracker, and pasta manufacturing","8","2425","97177","37",
"North Carolina","2008","311821","Cookie and cracker manufacturing","4","2306","92812","37",
"North Carolina","2008","311830","Tortilla manufacturing","7","811","23447","37",
"North Carolina","2008","311919","Other snack food manufacturing","7","0","0","37",
"North Carolina","2008","31192 ","Coffee and tea manufacturing","7","0","0","37",
"North Carolina","2008","311920","Coffee and tea manufacturing","7","0","0","37",
"North Carolina","2008","31193 ","Flavoring syrup and concentrate manufacturing","1","0","0","37",
"North Carolina","2008","311930","Flavoring syrup and concentrate manufacturing","1","0","0","37",
"North Carolina","2008","31194 ","Seasoning and dressing manufacturing","10","0","0","37",
"North Carolina","2008","311941","Mayonnaise, dressing, and other prepared sauce manufacturing","7","0","0","37",
"North Carolina","2008","31199 ","All other food manufacturing","29","1101","34324","37",
"North Carolina","2008","311991","Perishable prepared food manufacturing","9","324","8726","37",
"North Carolina","2008","3121  ","Beverage manufacturing","76","2805","124712","37",
"North Carolina","2008","31212 ","Breweries","9","0","0","37",
"North Carolina","2008","31214 ","Distilleries","1","0","0","37",
"North Carolina","2008","312140","Distilleries","1","0","0","37",
"North Carolina","2008","312210","Tobacco stemming and redrying","6","0","0","37",
"North Carolina","2008","31222 ","Tobacco product manufacturing","15","6679","475456","37",
"North Carolina","2008","31311 ","Fiber, yarn, and thread mills","104","13206","369812","37",
"North Carolina","2008","31211 ","Soft drink and ice manufacturing","37","1765","74748","37",
"North Carolina","2008","312111","Soft drink manufacturing","13","1336","60014","37",
"North Carolina","2008","312112","Bottled water manufacturing","11","0","0","37",
"North Carolina","2008","312113","Ice manufacturing","13","195","7287","37",
"North Carolina","2008","312120","Breweries","9","0","0","37",
"North Carolina","2008","31213 ","Wineries","29","372","9343","37",
"North Carolina","2008","312130","Wineries","29","372","9343","37",
"North Carolina","2008","3122  ","Tobacco manufacturing","21","8536","523025","37",
"North Carolina","2008","31221 ","Tobacco stemming and redrying","6","0","0","37",
"North Carolina","2008","312221","Cigarette manufacturing","11","6410","464357","37",
"North Carolina","2008","312229","Other tobacco product manufacturing","4","269","11099","37",
"North Carolina","2008","313   ","Textile mills","408","35307","1077232","37",
"North Carolina","2008","3131  ","Fiber, yarn, and thread mills","104","13206","369812","37",
"North Carolina","2008","3132  ","Fabric mills","163","13275","432212","37",
"North Carolina","2008","31321 ","Broadwoven fabric mills","47","4893","142723","37",
"North Carolina","2008","31322 ","Narrow fabric mills and schiffli machine embroidery","29","1131","31444","37",
"North Carolina","2008","313221","Narrow fabric mills","27","1127","31419","37",
"North Carolina","2008","313222","Schiffli machine embroidery","2","0","0","37",
"North Carolina","2008","313249","Other knit fabric and lace mills","30","2698","83880","37",
"North Carolina","2008","3133  ","Textile and fabric finishing and fabric coating mills","141","8826","275208","37",
"North Carolina","2008","313312","Textile and fabric finishing (except broadwoven fabric) mills","66","4195","121474","37",
"North Carolina","2008","31332 ","Fabric coating mills","15","1144","45331","37",
"North Carolina","2008","314   ","Textile product mills","321","8981","249045","37",
"North Carolina","2008","3141  ","Textile furnishings mills","134","4480","114839","37",
"North Carolina","2008","31411 ","Carpet and rug mills","16","1523","47121","37",
"North Carolina","2008","314110","Carpet and rug mills","16","1523","47121","37",
"North Carolina","2008","314912","Canvas and related product mills","38","524","14660","37",
"North Carolina","2008","31499 ","All other textile product mills","141","3782","116021","37",
"North Carolina","2008","314999","All other miscellaneous textile product mills","132","2949","82895","37",
"North Carolina","2008","315   ","Apparel manufacturing","250","13345","323098","37",
"North Carolina","2008","31519 ","Other apparel knitting mills","15","1663","49410","37",
"North Carolina","2008","315191","Outerwear knitting mills","11","1337","39406","37",
"North Carolina","2008","31521 ","Cut and sew apparel contractors","57","1073","19492","37",
"North Carolina","2008","315211","Men's and boys' cut and sew apparel contractors","24","830","15753","37",
"North Carolina","2008","31522 ","Men's and boys' cut and sew apparel manufacturing","17","981","19424","37",
"North Carolina","2008","315221","Men's and boys' cut and sew underwear and nightwear manufacturing","3","0","0","37",
"North Carolina","2008","315222","Men's and boys' cut and sew suit, coat, and overcoat manufacturing","3","0","148","37",
"North Carolina","2008","31523 ","Women's and girls' cut and sew apparel manufacturing","16","382","10078","37",
"North Carolina","2008","313111","Yarn spinning mills","71","8173","226797","37",
"North Carolina","2008","313112","Yarn texturizing, throwing, and twisting mills","26","4273","124908","37",
