"New York","2005","8132  ","Grantmaking and Giving Services","1607","19108","1016169","36",
"New York","2005","81321 ","Grantmaking and Giving Services","1607","19108","1016169","36",
"New York","2005","813211","Grantmaking Foundations","946","7617","412379","36",
"New York","2005","4842  ","Specialized Freight Trucking","1998","16280","577477","36",
"New York","2005","48412 ","General Freight Trucking, Long-Distance","900","15769","637849","36",
"New York","2005","484121","General Freight Trucking, Long-Distance, Truckload","673","9350","333885","36",
"New York","2005","484122","General Freight Trucking, Long-Distance, Less Than Truckload","227","6419","303964","36",
"New York","2005","488490","Other Support Activities for Road Transportation","71","0","0","36",
"New York","2005","48841 ","Motor Vehicle Towing","377","0","0","36",
"New York","2005","488410","Motor Vehicle Towing","377","0","0","36",
"New York","2005","48849 ","Other Support Activities for Road Transportation","71","0","0","36",
"New York","2005","4885  ","Freight Transportation Arrangement","1590","14991","756154","36",
"New York","2005","5161  ","Internet Publishing and Broadcasting","234","4960","456728","36",
"New York","2005","51521 ","Cable and Other Subscription Programming","90","10328","1123625","36",
"New York","2005","515210","Cable and Other Subscription Programming","90","10328","1123625","36",
"New York","2005","516   ","Internet Publishing and Broadcasting","234","4960","456728","36",
"New York","2005","51611 ","Internet Publishing and Broadcasting","234","4960","456728","36",
"New York","2005","522390","Other Activities Related to Credit Intermediation","457","4758","264618","36",
"New York","2005","532111","Passenger Car Rental","238","3884","104248","36",
"New York","2005","523   ","Securities, Commodity Contracts, and Other Financial Investments and Related Activities","7640","185442","51329102","36",
"New York","2005","5231  ","Securities and Commodity Contracts Intermediation and Brokerage","3339","129226","37407081","36",
"New York","2005","52311 ","Investment Banking and Securities Dealing","1127","64184","23399702","36",
"New York","2005","5321  ","Automotive Equipment Rental and Leasing","595","7545","245724","36",
"New York","2005","53211 ","Passenger Car Rental and Leasing","318","4489","130101","36",
"New York","2005","532112","Passenger Car Leasing","80","605","25853","36",
"New York","2005","5415  ","Computer Systems Design and Related Services","7344","58663","4383067","36",
"New York","2005","56141 ","Document Preparation Services","392","2959","94406","36",
"New York","2005","54151 ","Computer Systems Design and Related Services","7344","58663","4383067","36",
"New York","2005","541511","Custom Computer Programming Services","3231","28103","2148856","36",
"New York","2005","541512","Computer Systems Design Services","3009","22315","1633628","36",
"New York","2005","561330","Professional Employer Organizations","222","41003","2123788","36",
"New York","2005","5614  ","Business Support Services","2568","41735","1412657","36",
"New York","2005","561410","Document Preparation Services","392","2959","94406","36",
"New York","2005","611110","Elementary and Secondary Schools","1751","76103","2295360","36",
"New York","2005","6113  ","Colleges, Universities, and Professional Schools","266","209022","7019725","36",
"New York","2005","6112  ","Junior Colleges","70","11625","309684","36",
"New York","2005","61121 ","Junior Colleges","70","11625","309684","36",
"New York","2005","611210","Junior Colleges","70","11625","309684","36",
"New York","2005","62199 ","All Other Ambulatory Health Care Services","176","5291","223296","36",
"New York","2005","6221  ","General Medical and Surgical Hospitals","231","372486","19164412","36",
"New York","2005","621991","Blood and Organ Banks","26","2683","121833","36",
"New York","2005","621999","All Other Miscellaneous Ambulatory Health Care Services","150","2608","101463","36",
"New York","2005","622   ","Hospitals","298","417871","21494192","36",
"New York","2005","7114  ","Agents and Managers for Artists, Athletes, Entertainers, and Other Public Figures","801","3575","332025","36",
"New York","2005","8111  ","Automotive Repair and Maintenance","9705","40569","1074345","36",
"New York","2005","71141 ","Agents and Managers for Artists, Athletes, Entertainers, and Other Public Figures","801","3575","332025","36",
"New York","2005","711410","Agents and Managers for Artists, Athletes, Entertainers, and Other Public Figures","801","3575","332025","36",
"New York","2005","7115  ","Independent Artists, Writers, and Performers","2403","5545","585657","36",
"New York","2005","813219","Other Grantmaking and Giving Services","270","3288","165796","36",
"New York","2005","81111 ","Automotive Mechanical and Electrical Repair and Maintenance","6114","21126","581510","36",
"New York","2005","811111","General Automotive Repair","5289","17826","489878","36",
"New York","2005","811112","Automotive Exhaust System Repair","203","819","24385","36",
"New York","2005","48422 ","Specialized Freight (except Used Goods) Trucking, Local","1079","6066","233057","36",
"New York","2005","8133  ","Social Advocacy Organizations","1185","13257","473882","36",
"New York","2005","81331 ","Social Advocacy Organizations","1185","13257","473882","36",
"New York","2005","813311","Human Rights Organizations","263","4461","160479","36",
"New York","2005","48421 ","Used Household and Office Goods Moving","648","7464","229870","36",
"New York","2005","484210","Used Household and Office Goods Moving","648","7464","229870","36",
"New York","2005","484220","Specialized Freight (except Used Goods) Trucking, Local","1079","6066","233057","36",
"New York","2005","48899 ","Other Support Activities for Transportation","119","525","15443","36",
"New York","2005","48851 ","Freight Transportation Arrangement","1590","14991","756154","36",
"New York","2005","488510","Freight Transportation Arrangement","1590","14991","756154","36",
"New York","2005","4889  ","Other Support Activities for Transportation","119","525","15443","36",
"New York","2005","51711 ","Wired Telecommunications Carriers","1670","55707","3535022","36",
"New York","2005","516110","Internet Publishing and Broadcasting","234","4960","456728","36",
"New York","2005","517   ","Telecommunications","2984","83499","5119466","36",
"New York","2005","5171  ","Wired Telecommunications Carriers","1670","55707","3535022","36",
"New York","2005","52313 ","Commodity Contracts Dealing","186","2414","550634","36",
"New York","2005","523110","Investment Banking and Securities Dealing","1127","64184","23399702","36",
"New York","2005","52312 ","Securities Brokerage","1793","59014","13025434","36",
"New York","2005","523120","Securities Brokerage","1793","59014","13025434","36",
"New York","2005","523130","Commodity Contracts Dealing","186","2414","550634","36",
"New York","2005","53212 ","Truck, Utility Trailer, and RV (Recreational Vehicle) Rental and Leasing","277","3056","115623","36",
"New York","2005","532210","Consumer Electronics and Appliances Rental","220","1084","39732","36",
"New York","2005","532120","Truck, Utility Trailer, and RV (Recreational Vehicle) Rental and Leasing","277","3056","115623","36",
"New York","2005","5322  ","Consumer Goods Rental","1604","12685","265981","36",
"New York","2005","53221 ","Consumer Electronics and Appliances Rental","220","1084","39732","36",
"New York","2005","541513","Computer Facilities Management Services","243","2995","204620","36",
"New York","2005","541611","Administrative Management and General Management Consulting Services","3879","29963","2989500","36",
"New York","2005","541519","Other Computer Related Services","861","5250","395963","36",
"New York","2005","5416  ","Management, Scientific, and Technical Consulting Services","9404","62846","5403086","36",
"New York","2005","54161 ","Management Consulting Services","7882","55542","4895682","36",
"New York","2005","56142 ","Telephone Call Centers","313","12774","298311","36",
"New York","2005","561431","Private Mail Centers","206","958","20481","36",
"New York","2005","561421","Telephone Answering Services","121","2079","51611","36",
"New York","2005","561422","Telemarketing Bureaus","192","10695","246700","36",
"New York","2005","56143 ","Business Service Centers","725","7151","235923","36",
"New York","2005","61141 ","Business and Secretarial Schools","36","520","14923","36",
"New York","2005","61131 ","Colleges, Universities, and Professional Schools","266","209022","7019725","36",
"New York","2005","611310","Colleges, Universities, and Professional Schools","266","209022","7019725","36",
"New York","2005","6114  ","Business Schools and Computer and Management Training","430","5670","245016","36",
"New York","2005","62221 ","Psychiatric and Substance Abuse Hospitals","47","27893","1274352","36",
"New York","2005","62211 ","General Medical and Surgical Hospitals","231","372486","19164412","36",
"New York","2005","622110","General Medical and Surgical Hospitals","231","372486","19164412","36",
"New York","2005","6222  ","Psychiatric and Substance Abuse Hospitals","47","27893","1274352","36",
"New York","2005","7121  ","Museums, Historical Sites, and Similar Institutions","551","14858","536992","36",
"New York","2005","71151 ","Independent Artists, Writers, and Performers","2403","5545","585657","36",
"New York","2005","711510","Independent Artists, Writers, and Performers","2403","5545","585657","36",
"New York","2005","712   ","Museums, Historical Sites, and Similar Institutions","551","14858","536992","36",
"New York","2005","811113","Automotive Transmission Repair","379","1481","39076","36",
"New York","2005","813312","Environment, Conservation and Wildlife Organizations","337","3833","132268","36",
"New York","2005","811118","Other Automotive Mechanical and Electrical Repair and Maintenance","243","1000","28171","36",
"New York","2005","81112 ","Automotive Body, Paint, Interior, and Glass Repair","2499","11781","360402","36",
"New York","2005","811121","Automotive Body, Paint, and Interior Repair and Maintenance","2167","10294","310222","36",
"New York","2005","813410","Civic and Social Organizations","1650","27988","543719","36",
"New York","2005","813319","Other Social Advocacy Organizations","585","4963","181135","36",
"New York","2005","8134  ","Civic and Social Organizations","1650","27988","543719","36",
"New York","2005","81341 ","Civic and Social Organizations","1650","27988","543719","36",
"New York","2005","488991","Packing and Crating","99","0","0","36",
"New York","2005","48423 ","Specialized Freight (except Used Goods) Trucking, Long-Distance","271","2750","114550","36",
"New York","2005","484230","Specialized Freight (except Used Goods) Trucking, Long-Distance","271","2750","114550","36",
"New York","2005","485   ","Transit and Ground Passenger Transportation","2694","63303","1596309","36",
"New York","2005","4851  ","Urban Transit Systems","77","8564","342038","36",
"New York","2005","48511 ","Urban Transit Systems","77","8564","342038","36",
"New York","2005","49211 ","Couriers","562","32372","1080619","36",
"New York","2005","488999","All Other Support Activities for Transportation","20","0","0","36",
"New York","2005","492   ","Couriers and Messengers","1016","38469","1197271","36",
"New York","2005","4921  ","Couriers","562","32372","1080619","36",
"New York","2005","517110","Wired Telecommunications Carriers","1670","55707","3535022","36",
"New York","2005","517212","Cellular and Other Wireless Telecommunications","701","7883","455626","36",
"New York","2005","5172  ","Wireless Telecommunications Carriers (except Satellite)","763","8295","471219","36",
"New York","2005","51721 ","Wireless Telecommunications Carriers (except Satellite)","763","8295","471219","36",
"New York","2005","517211","Paging","62","412","15593","36",
"New York","2005","52314 ","Commodity Contracts Brokerage","233","3614","431311","36",
"New York","2005","523210","Securities and Commodity Exchanges","22","2852","329007","36",
"New York","2005","523140","Commodity Contracts Brokerage","233","3614","431311","36",
"New York","2005","5232  ","Securities and Commodity Exchanges","22","2852","329007","36",
"New York","2005","52321 ","Securities and Commodity Exchanges","22","2852","329007","36",
"New York","2005","532230","Video Tape and Disc Rental","905","6598","80966","36",
"New York","2005","53222 ","Formal Wear and Costume Rental","129","940","20142","36",
"New York","2005","532220","Formal Wear and Costume Rental","129","940","20142","36",
"New York","2005","53223 ","Video Tape and Disc Rental","905","6598","80966","36",
"New York","2005","541618","Other Management Consulting Services","511","1828","90761","36",
"New York","2005","541612","Human Resources and Executive Search Consulting Services","1333","10829","1050195","36",
"New York","2005","541613","Marketing Consulting Services","1766","10444","638703","36",
"New York","2005","541614","Process, Physical Distribution, and Logistics Consulting Services","393","2478","126523","36",
"New York","2005","561439","Other Business Service Centers (including Copy Shops)","519","6193","215442","36",
"New York","2005","561450","Credit Bureaus","73","1371","172630","36",
"New York","2005","56144 ","Collection Agencies","395","12689","409741","36",
"New York","2005","561440","Collection Agencies","395","12689","409741","36",
"New York","2005","56145 ","Credit Bureaus","73","1371","172630","36",
"New York","2005","611410","Business and Secretarial Schools","36","520","14923","36",
"New York","2005","611430","Professional and Management Development Training","242","3598","175983","36",
"New York","2005","61142 ","Computer Training","152","1552","54110","36",
"New York","2005","611420","Computer Training","152","1552","54110","36",
"New York","2005","61143 ","Professional and Management Development Training","242","3598","175983","36",
"New York","2005","622210","Psychiatric and Substance Abuse Hospitals","47","27893","1274352","36",
"New York","2005","71211 ","Museums","405","11040","410748","36",
"New York","2005","6223  ","Specialty (except Psychiatric and Substance Abuse) Hospitals","20","17492","1055428","36",
"New York","2005","62231 ","Specialty (except Psychiatric and Substance Abuse) Hospitals","20","17492","1055428","36",
"New York","2005","622310","Specialty (except Psychiatric and Substance Abuse) Hospitals","20","17492","1055428","36",
"New York","2005","71213 ","Zoos and Botanical Gardens","42","2635","88988","36",
"New York","2005","712110","Museums","405","11040","410748","36",
"New York","2005","71212 ","Historical Sites","78","614","16853","36",
"New York","2005","712120","Historical Sites","78","614","16853","36",
"New York","2005","811122","Automotive Glass Replacement Shops","332","1487","50180","36",
"New York","2005","811198","All Other Automotive Repair and Maintenance","107","543","17340","36",
"New York","2005","81119 ","Other Automotive Repair and Maintenance","1092","7662","132433","36",
"New York","2005","811191","Automotive Oil Change and Lubrication Shops","261","2245","37829","36",
"New York","2005","811192","Car Washes","724","4874","77264","36",
"New York","2005","8139  ","Business, Professional, Labor, Political, and Similar Organizations","7291","55369","2480519","36",
"New York","2005","485119","Other Urban Transit Systems","2","0","0","36",
"New York","2005","81391 ","Business Associations","783","5908","344696","36",
"New York","2005","813910","Business Associations","783","5908","344696","36",
"New York","2005","81392 ","Professional Organizations","474","5045","275498","36",
"New York","2005","485111","Mixed Mode Transit Systems","2","0","0","36",
"New York","2005","485113","Bus and Other Motor Vehicle Transit Systems","73","0","0","36",
"New York","2005","4852  ","Interurban and Rural Bus Transportation","39","1384","43592","36",
"New York","2005","492210","Local Messengers and Local Delivery","454","6097","116652","36",
"New York","2005","492110","Couriers","562","32372","1080619","36",
"New York","2005","4922  ","Local Messengers and Local Delivery","454","6097","116652","36",
"New York","2005","49221 ","Local Messengers and Local Delivery","454","6097","116652","36",
"New York","2005","493   ","Warehousing and Storage","547","20180","685259","36",
"New York","2005","5174  ","Satellite Telecommunications","39","0","0","36",
"New York","2005","5173  ","Telecommunications Resellers","239","0","0","36",
"New York","2005","51731 ","Telecommunications Resellers","239","0","0","36",
"New York","2005","517310","Telecommunications Resellers","239","0","0","36",
"New York","2005","52392 ","Portfolio Management","1787","27977","8985765","36",
"New York","2005","5239  ","Other Financial Investment Activities","4279","53364","13593014","36",
"New York","2005","52391 ","Miscellaneous Intermediation","485","3681","1244286","36",
"New York","2005","523910","Miscellaneous Intermediation","485","3681","1244286","36",
"New York","2005","53229 ","Other Consumer Goods Rental","350","4063","125141","36",
"New York","2005","5323  ","General Rental Centers","251","1406","51818","36",
"New York","2005","532291","Home Health Equipment Rental","102","0","0","36",
"New York","2005","532292","Recreational Goods Rental","59","0","0","36",
"New York","2005","532299","All Other Consumer Goods Rental","189","2738","78348","36",
"New York","2005","541690","Other Scientific and Technical Consulting Services","1065","4073","329769","36",
"New York","2005","54162 ","Environmental Consulting Services","457","3231","177635","36",
"New York","2005","541620","Environmental Consulting Services","457","3231","177635","36",
"New York","2005","54169 ","Other Scientific and Technical Consulting Services","1065","4073","329769","36",
"New York","2005","56149 ","Other Business Support Services","670","4791","201646","36",
"New York","2005","5615  ","Travel Arrangement and Reservation Services","2356","16163","1112225","36",
"New York","2005","561491","Repossession Services","55","181","5452","36",
"New York","2005","561492","Court Reporting and Stenotype Services","166","966","43334","36",
"New York","2005","561499","All Other Business Support Services","449","3644","152860","36",
"New York","2005","6115  ","Technical and Trade Schools","364","4982","148555","36",
"New York","2005","611513","Apprenticeship Training","58","610","16292","36",
"New York","2005","61151 ","Technical and Trade Schools","364","4982","148555","36",
"New York","2005","611511","Cosmetology and Barber Schools","64","684","15460","36",
"New York","2005","611512","Flight Training","36","216","5688","36",
"New York","2005","623   ","Nursing and Residential Care Facilities","4599","230631","6453224","36",
"New York","2005","6232  ","Residential Mental Retardation, Mental Health and Substance Abuse Facilities","2861","58196","1390690","36",
"New York","2005","6231  ","Nursing Care Facilities","700","136207","4203261","36",
"New York","2005","62311 ","Nursing Care Facilities","700","136207","4203261","36",
"New York","2005","623110","Nursing Care Facilities","700","136207","4203261","36",
"New York","2005","712130","Zoos and Botanical Gardens","42","2635","88988","36",
"New York","2005","7131  ","Amusement Parks and Arcades","191","2273","55432","36",
"New York","2005","71219 ","Nature Parks and Other Similar Institutions","26","569","20403","36",
"New York","2005","712190","Nature Parks and Other Similar Institutions","26","569","20403","36",
"New York","2005","713   ","Amusement, Gambling, and Recreation Industries","4837","69489","1477429","36",
"New York","2005","8112  ","Electronic and Precision Equipment Repair and Maintenance","798","5241","215551","36",
"New York","2005","813920","Professional Organizations","474","5045","275498","36",
"New York","2005","81121 ","Electronic and Precision Equipment Repair and Maintenance","798","5241","215551","36",
"New York","2005","811211","Consumer Electronics Repair and Maintenance","211","1821","55173","36",
"New York","2005","811212","Computer and Office Machine Repair and Maintenance","341","1812","77268","36",
"New York","2005","813940","Political Organizations","161","492","23237","36",
"New York","2005","81393 ","Labor Unions and Similar Labor Organizations","1212","16326","642204","36",
"New York","2005","813930","Labor Unions and Similar Labor Organizations","1212","16326","642204","36",
"New York","2005","81394 ","Political Organizations","161","492","23237","36",
"New York","2005","493110","General Warehousing and Storage","379","15133","538779","36",
"New York","2005","48521 ","Interurban and Rural Bus Transportation","39","1384","43592","36",
"New York","2005","485210","Interurban and Rural Bus Transportation","39","1384","43592","36",
"New York","2005","4853  ","Taxi and Limousine Service","1712","10225","242721","36",
"New York","2005","48531 ","Taxi Service","861","3408","60810","36",
"New York","2005","485310","Taxi Service","861","3408","60810","36",
"New York","2005","4931  ","Warehousing and Storage","547","20180","685259","36",
"New York","2005","49311 ","General Warehousing and Storage","379","15133","538779","36",
"New York","2005","49312 ","Refrigerated Warehousing and Storage","60","2628","75892","36",
"New York","2005","493120","Refrigerated Warehousing and Storage","60","2628","75892","36",
"New York","2005","51741 ","Satellite Telecommunications","39","0","0","36",
"New York","2005","517510","Cable and Other Program Distribution","220","15485","862574","36",
"New York","2005","517410","Satellite Telecommunications","39","0","0","36",
"New York","2005","5175  ","Cable and Other Program Distribution","220","15485","862574","36",
"New York","2005","51751 ","Cable and Other Program Distribution","220","15485","862574","36",
"New York","2005","523920","Portfolio Management","1787","27977","8985765","36",
"New York","2005","523991","Trust, Fiduciary, and Custody Activities","126","2179","174690","36",
"New York","2005","52393 ","Investment Advice","1822","15659","2738836","36",
"New York","2005","523930","Investment Advice","1822","15659","2738836","36",
"New York","2005","52399 ","All Other Financial Investment Activities","185","6047","624127","36",
"New York","2005","53231 ","General Rental Centers","251","1406","51818","36",
"New York","2005","532411","Commercial Air, Rail, and Water Transportation Equipment Rental and Leasing","30","139","21835","36",
"New York","2005","532310","General Rental Centers","251","1406","51818","36",
"New York","2005","5324  ","Commercial and Industrial Machinery and Equipment Rental and Leasing","636","6441","323091","36",
"New York","2005","53241 ","Construction, Transportation, Mining, and Forestry Machinery and Equipment Rental and Leasing","169","1452","94656","36",
"New York","2005","5417  ","Scientific Research and Development Services","959","56248","3334563","36",
"New York","2005","56151 ","Travel Agencies","1804","10158","651998","36",
"New York","2005","54171 ","Research and Development in the Physical, Engineering, and Life Sciences","771","52101","3038624","36",
"New York","2005","541710","Research and Development in the Physical, Engineering, and Life Sciences","771","52101","3038624","36",
"New York","2005","54172 ","Research and Development in the Social Sciences and Humanities","188","4147","295939","36",
"New York","2005","56159 ","Other Travel Arrangement and Reservation Services","234","3974","369942","36",
"New York","2005","561510","Travel Agencies","1804","10158","651998","36",
"New York","2005","56152 ","Tour Operators","318","2031","90285","36",
"New York","2005","561520","Tour Operators","318","2031","90285","36",
"New York","2005","611519","Other Technical and Trade Schools","206","3472","111115","36",
"New York","2005","61162 ","Sports and Recreation Instruction","823","5477","97108","36",
"New York","2005","6116  ","Other Schools and Instruction","2822","28303","611332","36",
"New York","2005","61161 ","Fine Arts Schools","921","7861","138381","36",
"New York","2005","611610","Fine Arts Schools","921","7861","138381","36",
"New York","2005","623220","Residential Mental Health and Substance Abuse Facilities","599","13230","345271","36",
"New York","2005","62321 ","Residential Mental Retardation Facilities","2262","44966","1045419","36",
"New York","2005","623210","Residential Mental Retardation Facilities","2262","44966","1045419","36",
"New York","2005","62322 ","Residential Mental Health and Substance Abuse Facilities","599","13230","345271","36",
"New York","2005","71311 ","Amusement and Theme Parks","42","846","38487","36",
"New York","2005","7132  ","Gambling Industries","43","5436","146119","36",
"New York","2005","713110","Amusement and Theme Parks","42","846","38487","36",
"New York","2005","71312 ","Amusement Arcades","149","1427","16945","36",
"New York","2005","713120","Amusement Arcades","149","1427","16945","36",
"New York","2005","811213","Communication Equipment Repair and Maintenance","83","606","20264","36",
"New York","2005","81399 ","Other Similar Organizations (except Business, Professional, Labor, and Political Organizations)","4661","27598","1194884","36",
"New York","2005","811219","Other Electronic and Precision Equipment Repair and Maintenance","163","1002","62846","36",
"New York","2005","8113  ","Commercial and Industrial Machinery and Equipment (except Automotive and Electronic) Repair and Maintenance","1002","6103","248507","36",
"New York","2005","81131 ","Commercial and Industrial Machinery and Equipment (except Automotive and Electronic) Repair and Maintenance","1002","6103","248507","36",
"New York","2005","49319 ","Other Warehousing and Storage","100","2366","68803","36",
"New York","2005","813990","Other Similar Organizations (except Business, Professional, Labor, and Political Organizations)","4661","27598","1194884","36",
"New York","2005","99    ","Unclassified","1735","2020","50819","36",
