"Puerto Rico","2005","213112","Support Activities for Oil and Gas Operations","1","0","0","72",
"Puerto Rico","2005","213114","Support Activities for Metal Mining","1","0","0","72",
"Puerto Rico","2005","2361  ","Residential Building Construction","1058","20761","299664","72",
"Puerto Rico","2005","23799 ","Other Heavy and Civil Engineering Construction","16","562","9646","72",
"Puerto Rico","2005","23611 ","Residential Building Construction","1058","20761","299664","72",
"Puerto Rico","2005","236115","New Single-Family Housing Construction (except Operative Builders)","847","16336","233578","72",
"Puerto Rico","2005","236116","New Multifamily Housing Construction (except Operative Builders)","16","894","12402","72",
"Puerto Rico","2005","2383  ","Building Finishing Contractors","205","1741","27066","72",
"Puerto Rico","2005","237990","Other Heavy and Civil Engineering Construction","16","562","9646","72",
"Puerto Rico","2005","238   ","Specialty Trade Contractors","1242","20223","357682","72",
"Puerto Rico","2005","2381  ","Foundation, Structure, and Building Exterior Contractors","250","4483","72250","72",
"Puerto Rico","2005","311225","Fats and Oils Refining and Blending","1","0","0","72",
"Puerto Rico","2005","23831 ","Drywall and Insulation Contractors","42","519","9719","72",
"Puerto Rico","2005","238310","Drywall and Insulation Contractors","42","519","9719","72",
"Puerto Rico","2005","23832 ","Painting and Wall Covering Contractors","66","668","8202","72",
"Puerto Rico","2005","311615","Poultry Processing","4","0","0","72",
"Puerto Rico","2005","3113  ","Sugar and Confectionery Product Manufacturing","26","877","18154","72",
"Puerto Rico","2005","31131 ","Sugar Manufacturing","4","63","1345","72",
"Puerto Rico","2005","311311","Sugarcane Mills","2","0","0","72",
"Puerto Rico","2005","3117  ","Seafood Product Preparation and Packaging","1","0","0","72",
"Puerto Rico","2005","312   ","Beverage and Tobacco Product Manufacturing","61","4309","134685","72",
"Puerto Rico","2005","31171 ","Seafood Product Preparation and Packaging","1","0","0","72",
"Puerto Rico","2005","311711","Seafood Canning","1","0","0","72",
"Puerto Rico","2005","3118  ","Bakeries and Tortilla Manufacturing","269","4662","68292","72",
"Puerto Rico","2005","3121  ","Beverage Manufacturing","57","0","0","72",
"Puerto Rico","2005","313311","Broadwoven Fabric Finishing Mills","3","0","0","72",
"Puerto Rico","2005","31211 ","Soft Drink and Ice Manufacturing","50","1664","52552","72",
"Puerto Rico","2005","312111","Soft Drink Manufacturing","14","1319","47971","72",
"Puerto Rico","2005","312112","Bottled Water Manufacturing","19","190","2597","72",
"Puerto Rico","2005","313312","Textile and Fabric Finishing (except Broadwoven Fabric) Mills","3","5","71","72",
"Puerto Rico","2005","315225","Men's and Boys' Cut and Sew Work Clothing Manufacturing","3","115","1208","72",
"Puerto Rico","2005","314   ","Textile Product Mills","50","2071","26347","72",
"Puerto Rico","2005","3141  ","Textile Furnishings Mills","23","0","0","72",
"Puerto Rico","2005","31411 ","Carpet and Rug Mills","4","0","0","72",
"Puerto Rico","2005","315228","Men's and Boys' Cut and Sew Other Outerwear Manufacturing","6","150","2065","72",
"Puerto Rico","2005","32191 ","Millwork","21","346","4453","72",
"Puerto Rico","2005","31523 ","Women's and Girls' Cut and Sew Apparel Manufacturing","30","2284","28202","72",
"Puerto Rico","2005","315231","Women's and Girls' Cut and Sew Lingerie, Loungewear, and Nightwear Manufacturing","6","1394","20215","72",
"Puerto Rico","2005","321211","Hardwood Veneer and Plywood Manufacturing","1","0","0","72",
"Puerto Rico","2005","321214","Truss Manufacturing","6","0","0","72",
"Puerto Rico","2005","3219  ","Other Wood Product Manufacturing","53","894","15733","72",
"Puerto Rico","2005","32229 ","Other Converted Paper Product Manufacturing","1","0","0","72",
"Puerto Rico","2005","325132","Synthetic Organic Dye and Pigment Manufacturing","1","0","0","72",
"Puerto Rico","2005","322299","All Other Converted Paper Product Manufacturing","1","0","0","72",
"Puerto Rico","2005","323   ","Printing and Related Support Activities","174","2740","60161","72",
"Puerto Rico","2005","3231  ","Printing and Related Support Activities","174","2740","60161","72",
"Puerto Rico","2005","32518 ","Other Basic Inorganic Chemical Manufacturing","4","0","0","72",
"Puerto Rico","2005","3259  ","Other Chemical Product and Preparation Manufacturing","5","34","1049","72",
"Puerto Rico","2005","325188","All Other Basic Inorganic Chemical Manufacturing","4","0","0","72",
"Puerto Rico","2005","32519 ","Other Basic Organic Chemical Manufacturing","1","0","0","72",
"Puerto Rico","2005","325199","All Other Basic Organic Chemical Manufacturing","1","0","0","72",
"Puerto Rico","2005","32591 ","Printing Ink Manufacturing","1","0","0","72",
"Puerto Rico","2005","3271  ","Clay Product and Refractory Manufacturing","4","0","0","72",
"Puerto Rico","2005","325910","Printing Ink Manufacturing","1","0","0","72",
"Puerto Rico","2005","32599 ","All Other Chemical Product and Preparation Manufacturing","4","0","0","72",
"Puerto Rico","2005","327   ","Nonmetallic Mineral Product Manufacturing","160","4208","91675","72",
"Puerto Rico","2005","33111 ","Iron and Steel Mills and Ferroalloy Manufacturing","13","245","4407","72",
"Puerto Rico","2005","32711 ","Pottery, Ceramics, and Plumbing Fixture Manufacturing","4","0","0","72",
"Puerto Rico","2005","327111","Vitreous China Plumbing Fixture and China and Earthenware Bathroom Accessories Manufacturing","1","0","0","72",
"Puerto Rico","2005","3311  ","Iron and Steel Mills and Ferroalloy Manufacturing","13","245","4407","72",
"Puerto Rico","2005","332116","Metal Stamping","8","86","1426","72",
"Puerto Rico","2005","331111","Iron and Steel Mills","13","245","4407","72",
"Puerto Rico","2005","3312  ","Steel Product Manufacturing from Purchased Steel","7","192","5058","72",
"Puerto Rico","2005","332114","Custom Roll Forming","1","0","0","72",
"Puerto Rico","2005","3322  ","Cutlery and Handtool Manufacturing","9","244","3296","72",
"Puerto Rico","2005","332618","Other Fabricated Wire Product Manufacturing","4","0","0","72",
"Puerto Rico","2005","33221 ","Cutlery and Handtool Manufacturing","9","244","3296","72",
"Puerto Rico","2005","332211","Cutlery and Flatware (except Precious) Manufacturing","2","0","0","72",
"Puerto Rico","2005","332612","Spring (Light Gauge) Manufacturing","2","0","0","72",
"Puerto Rico","2005","33329 ","Other Industrial Machinery Manufacturing","3","0","0","72",
"Puerto Rico","2005","3327  ","Machine Shops; Turned Product; and Screw, Nut, and Bolt Manufacturing","31","299","5158","72",
"Puerto Rico","2005","33271 ","Machine Shops","12","82","1282","72",
"Puerto Rico","2005","332710","Machine Shops","12","82","1282","72",
"Puerto Rico","2005","333294","Food Product Machinery Manufacturing","3","0","0","72",
"Puerto Rico","2005","3333  ","Commercial and Service Industry Machinery Manufacturing","3","0","0","72",
"Puerto Rico","2005","334111","Electronic Computer Manufacturing","2","0","0","72",
"Puerto Rico","2005","33331 ","Commercial and Service Industry Machinery Manufacturing","3","0","0","72",
"Puerto Rico","2005","333319","Other Commercial and Service Industry Machinery Manufacturing","3","0","0","72",
"Puerto Rico","2005","33411 ","Computer and Peripheral Equipment Manufacturing","5","0","0","72",
"Puerto Rico","2005","334119","Other Computer Peripheral Equipment Manufacturing","3","0","0","72",
"Puerto Rico","2005","334611","Software Reproducing","1","0","0","72",
"Puerto Rico","2005","3342  ","Communications Equipment Manufacturing","5","0","0","72",
"Puerto Rico","2005","33422 ","Radio and Television Broadcasting and Wireless Communications Equipment Manufacturing","4","0","0","72",
"Puerto Rico","2005","33461 ","Manufacturing and Reproducing Magnetic and Optical Media","3","0","0","72",
"Puerto Rico","2005","53113 ","Lessors of Miniwarehouses and Self-Storage Units","21","204","4273","72",
"Puerto Rico","2005","334612","Prerecorded Compact Disc (except Software), Tape, and Record Reproducing","1","0","0","72",
"Puerto Rico","2005","334613","Magnetic and Optical Recording Media Manufacturing","1","0","0","72",
"Puerto Rico","2005","531110","Lessors of Residential Buildings and Dwellings","264","1970","31807","72",
"Puerto Rico","2005","53112 ","Lessors of Nonresidential Buildings (except Miniwarehouses)","370","3947","81346","72",
"Puerto Rico","2005","531120","Lessors of Nonresidential Buildings (except Miniwarehouses)","370","3947","81346","72",
"Puerto Rico","2005","5322  ","Consumer Goods Rental","234","1996","27106","72",
"Puerto Rico","2005","532112","Passenger Car Leasing","6","27","327","72",
"Puerto Rico","2005","53212 ","Truck, Utility Trailer, and RV (Recreational Vehicle) Rental and Leasing","18","219","5920","72",
"Puerto Rico","2005","532120","Truck, Utility Trailer, and RV (Recreational Vehicle) Rental and Leasing","18","219","5920","72",
"Puerto Rico","2005","54    ","Professional, Scientific, and Technical Services","4230","31058","864348","72",
"Puerto Rico","2005","5331  ","Lessors of Nonfinancial Intangible Assets (except Copyrighted Works)","6","0","0","72",
"Puerto Rico","2005","53311 ","Lessors of Nonfinancial Intangible Assets (except Copyrighted Works)","6","0","0","72",
"Puerto Rico","2005","533110","Lessors of Nonfinancial Intangible Assets (except Copyrighted Works)","6","0","0","72",
"Puerto Rico","2005","2122  ","Metal Ore Mining","1","0","0","72",
"Puerto Rico","2005","21231 ","Stone Mining and Quarrying","8","0","0","72",
"Puerto Rico","2005","21229 ","Other Metal Ore Mining","1","0","0","72",
"Puerto Rico","2005","212299","All Other Metal Ore Mining","1","0","0","72",
"Puerto Rico","2005","2123  ","Nonmetallic Mineral Mining and Quarrying","41","0","0","72",
"Puerto Rico","2005","221119","Other Electric Power Generation","2","0","0","72",
"Puerto Rico","2005","221   ","Utilities","28","351","17039","72",
"Puerto Rico","2005","2211  ","Electric Power Generation, Transmission and Distribution","4","188","12551","72",
"Puerto Rico","2005","22111 ","Electric Power Generation","2","0","0","72",
"Puerto Rico","2005","236117","New Housing Operative Builders","24","385","5042","72",
"Puerto Rico","2005","236210","Industrial Building Construction","49","5056","86758","72",
"Puerto Rico","2005","236118","Residential Remodelers","171","3146","48642","72",
"Puerto Rico","2005","2362  ","Nonresidential Building Construction","337","13171","221959","72",
"Puerto Rico","2005","23621 ","Industrial Building Construction","49","5056","86758","72",
"Puerto Rico","2005","23811 ","Poured Concrete Foundation and Structure Contractors","60","2007","36182","72",
"Puerto Rico","2005","238320","Painting and Wall Covering Contractors","66","668","8202","72",
"Puerto Rico","2005","238110","Poured Concrete Foundation and Structure Contractors","60","2007","36182","72",
"Puerto Rico","2005","23812 ","Structural Steel and Precast Concrete Contractors","33","489","9230","72",
"Puerto Rico","2005","238120","Structural Steel and Precast Concrete Contractors","33","489","9230","72",
"Puerto Rico","2005","238340","Tile and Terrazzo Contractors","26","141","2568","72",
"Puerto Rico","2005","23833 ","Flooring Contractors","17","105","2566","72",
"Puerto Rico","2005","238330","Flooring Contractors","17","105","2566","72",
"Puerto Rico","2005","23834 ","Tile and Terrazzo Contractors","26","141","2568","72",
"Puerto Rico","2005","311312","Cane Sugar Refining","1","0","0","72",
"Puerto Rico","2005","31133 ","Confectionery Manufacturing from Purchased Chocolate","5","0","0","72",
"Puerto Rico","2005","311313","Beet Sugar Manufacturing","1","0","0","72",
"Puerto Rico","2005","31132 ","Chocolate and Confectionery Manufacturing from Cacao Beans","1","0","0","72",
"Puerto Rico","2005","311320","Chocolate and Confectionery Manufacturing from Cacao Beans","1","0","0","72",
"Puerto Rico","2005","31181 ","Bread and Bakery Product Manufacturing","253","4036","57179","72",
"Puerto Rico","2005","31182 ","Cookie, Cracker, and Pasta Manufacturing","13","618","11016","72",
"Puerto Rico","2005","311811","Retail Bakeries","206","2776","33477","72",
"Puerto Rico","2005","311812","Commercial Bakeries","45","0","0","72",
"Puerto Rico","2005","311813","Frozen Cakes, Pies, and Other Pastries Manufacturing","2","0","0","72",
"Puerto Rico","2005","312113","Ice Manufacturing","17","155","1984","72",
"Puerto Rico","2005","312130","Wineries","3","0","0","72",
"Puerto Rico","2005","31212 ","Breweries","1","0","0","72",
"Puerto Rico","2005","312120","Breweries","1","0","0","72",
"Puerto Rico","2005","31213 ","Wineries","3","0","0","72",
"Puerto Rico","2005","31214 ","Distilleries","3","0","0","72",
"Puerto Rico","2005","314110","Carpet and Rug Mills","4","0","0","72",
"Puerto Rico","2005","3149  ","Other Textile Product Mills","27","0","0","72",
"Puerto Rico","2005","31412 ","Curtain and Linen Mills","19","310","3807","72",
"Puerto Rico","2005","314121","Curtain and Drapery Mills","11","115","1482","72",
"Puerto Rico","2005","314129","Other Household Textile Product Mills","8","195","2325","72",
"Puerto Rico","2005","315232","Women's and Girls' Cut and Sew Blouse and Shirt Manufacturing","5","0","0","72",
"Puerto Rico","2005","321911","Wood Window and Door Manufacturing","9","244","2653","72",
"Puerto Rico","2005","315233","Women's and Girls' Cut and Sew Dress Manufacturing","8","180","1639","72",
"Puerto Rico","2005","315234","Women's and Girls' Cut and Sew Suit, Coat, Tailored Jacket, and Skirt Manufacturing","1","0","0","72",
"Puerto Rico","2005","315239","Women's and Girls' Cut and Sew Other Outerwear Manufacturing","10","483","4254","72",
"Puerto Rico","2005","321912","Cut Stock, Resawing Lumber, and Planing","2","0","0","72",
"Puerto Rico","2005","32311 ","Printing","161","2631","57963","72",
"Puerto Rico","2005","321918","Other Millwork (including Flooring)","10","0","0","72",
"Puerto Rico","2005","32192 ","Wood Container and Pallet Manufacturing","7","135","2891","72",
"Puerto Rico","2005","321920","Wood Container and Pallet Manufacturing","7","135","2891","72",
"Puerto Rico","2005","323114","Quick Printing","13","36","880","72",
"Puerto Rico","2005","323110","Commercial Lithographic Printing","132","2418","52652","72",
"Puerto Rico","2005","323112","Commercial Flexographic Printing","2","0","0","72",
"Puerto Rico","2005","323113","Commercial Screen Printing","1","0","0","72",
"Puerto Rico","2005","3252  ","Resin, Synthetic Rubber, and Artificial Synthetic Fibers and Filaments Manufacturing","5","1742","40445","72",
"Puerto Rico","2005","325998","All Other Miscellaneous Chemical Product and Preparation Manufacturing","4","0","0","72",
"Puerto Rico","2005","32521 ","Resin and Synthetic Rubber Manufacturing","5","1742","40445","72",
"Puerto Rico","2005","325211","Plastics Material and Resin Manufacturing","5","1742","40445","72",
"Puerto Rico","2005","3253  ","Pesticide, Fertilizer, and Other Agricultural Chemical Manufacturing","6","415","20543","72",
"Puerto Rico","2005","326   ","Plastics and Rubber Products Manufacturing","65","2985","63957","72",
"Puerto Rico","2005","327112","Vitreous China, Fine Earthenware, and Other Pottery Product Manufacturing","3","0","0","72",
"Puerto Rico","2005","3261  ","Plastics Product Manufacturing","55","2771","60202","72",
"Puerto Rico","2005","32611 ","Plastics Packaging Materials and Unlaminated Film and Sheet Manufacturing","5","176","2771","72",
"Puerto Rico","2005","326113","Unlaminated Plastics Film and Sheet (except Packaging) Manufacturing","5","176","2771","72",
"Puerto Rico","2005","33121 ","Iron and Steel Pipe and Tube Manufacturing from Purchased Steel","3","0","0","72",
"Puerto Rico","2005","3272  ","Glass and Glass Product Manufacturing","5","292","7732","72",
"Puerto Rico","2005","32721 ","Glass and Glass Product Manufacturing","5","292","7732","72",
"Puerto Rico","2005","327212","Other Pressed and Blown Glass and Glassware Manufacturing","1","0","0","72",
"Puerto Rico","2005","332212","Hand and Edge Tool Manufacturing","6","144","1122","72",
"Puerto Rico","2005","331210","Iron and Steel Pipe and Tube Manufacturing from Purchased Steel","3","0","0","72",
"Puerto Rico","2005","33122 ","Rolling and Drawing of Purchased Steel","4","0","0","72",
"Puerto Rico","2005","331221","Rolled Steel Shape Manufacturing","1","0","0","72",
"Puerto Rico","2005","33272 ","Turned Product and Screw, Nut, and Bolt Manufacturing","19","217","3876","72",
"Puerto Rico","2005","332213","Saw Blade and Handsaw Manufacturing","1","0","0","72",
"Puerto Rico","2005","3323  ","Architectural and Structural Metals Manufacturing","182","3829","71923","72",
"Puerto Rico","2005","33231 ","Plate Work and Fabricated Structural Product Manufacturing","25","718","15758","72",
"Puerto Rico","2005","3334  ","Ventilation, Heating, Air-Conditioning, and Commercial Refrigeration Equipment Manufacturing","16","283","6785","72",
"Puerto Rico","2005","332721","Precision Turned Product Manufacturing","13","183","3362","72",
"Puerto Rico","2005","332722","Bolt, Nut, Screw, Rivet, and Washer Manufacturing","6","34","514","72",
"Puerto Rico","2005","3328  ","Coating, Engraving, Heat Treating, and Allied Activities","13","170","3855","72",
"Puerto Rico","2005","3343  ","Audio and Video Equipment Manufacturing","2","0","0","72",
"Puerto Rico","2005","33341 ","Ventilation, Heating, Air-Conditioning, and Commercial Refrigeration Equipment Manufacturing","16","283","6785","72",
"Puerto Rico","2005","333411","Air Purification Equipment Manufacturing","1","0","0","72",
"Puerto Rico","2005","334220","Radio and Television Broadcasting and Wireless Communications Equipment Manufacturing","4","0","0","72",
"Puerto Rico","2005","33429 ","Other Communications Equipment Manufacturing","1","0","0","72",
"Puerto Rico","2005","334290","Other Communications Equipment Manufacturing","1","0","0","72",
"Puerto Rico","2005","335   ","Electrical Equipment, Appliance, and Component Manufacturing","44","6943","166944","72",
"Puerto Rico","2005","3351  ","Electric Lighting Equipment Manufacturing","8","783","19016","72",
"Puerto Rico","2005","33621 ","Motor Vehicle Body and Trailer Manufacturing","2","0","0","72",
"Puerto Rico","2005","33511 ","Electric Lamp Bulb and Part Manufacturing","2","0","0","72",
"Puerto Rico","2005","335110","Electric Lamp Bulb and Part Manufacturing","2","0","0","72",
"Puerto Rico","2005","33512 ","Lighting Fixture Manufacturing","6","0","0","72",
"Puerto Rico","2005","336214","Travel Trailer and Camper Manufacturing","2","0","0","72",
"Puerto Rico","2005","3369  ","Other Transportation Equipment Manufacturing","1","0","0","72",
"Puerto Rico","2005","3363  ","Motor Vehicle Parts Manufacturing","15","642","12264","72",
"Puerto Rico","2005","33631 ","Motor Vehicle Gasoline Engine and Engine Parts Manufacturing","4","0","0","72",
"Puerto Rico","2005","336612","Boat Building","3","0","0","72",
"Puerto Rico","2005","337920","Blind and Shade Manufacturing","6","30","277","72",
"Puerto Rico","2005","33699 ","Other Transportation Equipment Manufacturing","1","0","0","72",
"Puerto Rico","2005","336991","Motorcycle, Bicycle, and Parts Manufacturing","1","0","0","72",
"Puerto Rico","2005","33792 ","Blind and Shade Manufacturing","6","30","277","72",
"Puerto Rico","2005","339   ","Miscellaneous Manufacturing","134","11949","328991","72",
"Puerto Rico","2005","42    ","Wholesale Trade","2355","37315","1099652","72",
"Puerto Rico","2005","3391  ","Medical Equipment and Supplies Manufacturing","81","10801","305872","72",
"Puerto Rico","2005","33911 ","Medical Equipment and Supplies Manufacturing","81","10801","305872","72",
"Puerto Rico","2005","339999","All Other Miscellaneous Manufacturing","6","0","0","72",
"Puerto Rico","2005","4234  ","Professional and Commercial Equipment and Supplies Merchant Wholesalers","276","4784","159447","72",
"Puerto Rico","2005","423   ","Merchant Wholesalers, Durable Goods","1228","16574","463518","72",
"Puerto Rico","2005","4231  ","Motor Vehicle and Motor Vehicle Parts and Supplies Merchant Wholesalers","142","1915","49061","72",
"Puerto Rico","2005","423390","Other Construction Material Merchant Wholesalers","30","573","12920","72",
"Puerto Rico","2005","423620","Electrical and Electronic Appliance, Television, and Radio Set Merchant Wholesalers","24","611","20084","72",
"Puerto Rico","2005","42341 ","Photographic Equipment and Supplies Merchant Wholesalers","6","240","8039","72",
"Puerto Rico","2005","423410","Photographic Equipment and Supplies Merchant Wholesalers","6","240","8039","72",
"Puerto Rico","2005","42362 ","Electrical and Electronic Appliance, Television, and Radio Set Merchant Wholesalers","24","611","20084","72",
"Puerto Rico","2005","237   ","Heavy and Civil Engineering Construction","283","8026","129558","72",
"Puerto Rico","2005","42369 ","Other Electronic Parts and Equipment Merchant Wholesalers","53","419","15656","72",
"Puerto Rico","2005","423850","Service Establishment Equipment and Supplies Merchant Wholesalers","23","255","4582","72",
"Puerto Rico","2005","42386 ","Transportation Equipment and Supplies (except Motor Vehicle) Merchant Wholesalers","6","53","1098","72",
"Puerto Rico","2005","423860","Transportation Equipment and Supplies (except Motor Vehicle) Merchant Wholesalers","6","53","1098","72",
"Puerto Rico","2005","4239  ","Miscellaneous Durable Goods Merchant Wholesalers","143","1285","24669","72",
"Puerto Rico","2005","23622 ","Commercial and Institutional Building Construction","288","8115","135201","72",
"Puerto Rico","2005","236220","Commercial and Institutional Building Construction","288","8115","135201","72",
"Puerto Rico","2005","23814 ","Masonry Contractors","34","581","6700","72",
"Puerto Rico","2005","2371  ","Utility System Construction","56","1653","28935","72",
"Puerto Rico","2005","23813 ","Framing Contractors","11","0","0","72",
"Puerto Rico","2005","238130","Framing Contractors","11","0","0","72",
"Puerto Rico","2005","238140","Masonry Contractors","34","581","6700","72",
"Puerto Rico","2005","23815 ","Glass and Glazing Contractors","16","0","0","72",
"Puerto Rico","2005","238390","Other Building Finishing Contractors","9","54","854","72",
"Puerto Rico","2005","23835 ","Finish Carpentry Contractors","45","254","3157","72",
"Puerto Rico","2005","238350","Finish Carpentry Contractors","45","254","3157","72",
"Puerto Rico","2005","23839 ","Other Building Finishing Contractors","9","54","854","72",
"Puerto Rico","2005","2389  ","Other Specialty Trade Contractors","148","1461","25246","72",
"Puerto Rico","2005","3114  ","Fruit and Vegetable Preserving and Specialty Food Manufacturing","34","866","16441","72",
"Puerto Rico","2005","311330","Confectionery Manufacturing from Purchased Chocolate","5","0","0","72",
"Puerto Rico","2005","31134 ","Nonchocolate Confectionery Manufacturing","16","606","14789","72",
"Puerto Rico","2005","311340","Nonchocolate Confectionery Manufacturing","16","606","14789","72",
"Puerto Rico","2005","311830","Tortilla Manufacturing","3","8","97","72",
"Puerto Rico","2005","311821","Cookie and Cracker Manufacturing","9","381","6203","72",
"Puerto Rico","2005","311823","Dry Pasta Manufacturing","4","237","4813","72",
"Puerto Rico","2005","31183 ","Tortilla Manufacturing","3","8","97","72",
"Puerto Rico","2005","31222 ","Tobacco Product Manufacturing","4","0","0","72",
"Puerto Rico","2005","3119  ","Other Food Manufacturing","50","1874","45962","72",
"Puerto Rico","2005","312140","Distilleries","3","0","0","72",
"Puerto Rico","2005","3122  ","Tobacco Manufacturing","4","0","0","72",
"Puerto Rico","2005","312221","Cigarette Manufacturing","2","0","0","72",
"Puerto Rico","2005","312229","Other Tobacco Product Manufacturing","2","0","0","72",
"Puerto Rico","2005","314999","All Other Miscellaneous Textile Product Mills","22","1381","17701","72",
"Puerto Rico","2005","31491 ","Textile Bag and Canvas Mills","5","0","0","72",
"Puerto Rico","2005","314912","Canvas and Related Product Mills","5","0","0","72",
"Puerto Rico","2005","31499 ","All Other Textile Product Mills","22","1381","17701","72",
"Puerto Rico","2005","315292","Fur and Leather Apparel Manufacturing","2","0","0","72",
"Puerto Rico","2005","315   ","Apparel Manufacturing","101","7184","97772","72",
"Puerto Rico","2005","31529 ","Other Cut and Sew Apparel Manufacturing","16","506","7878","72",
"Puerto Rico","2005","315291","Infants' Cut and Sew Apparel Manufacturing","1","0","0","72",
"Puerto Rico","2005","315299","All Other Cut and Sew Apparel Manufacturing","13","359","5603","72",
"Puerto Rico","2005","3159  ","Apparel Accessories and Other Apparel Manufacturing","4","0","0","72",
"Puerto Rico","2005","321999","All Other Miscellaneous Wood Product Manufacturing","16","250","5063","72",
"Puerto Rico","2005","32199 ","All Other Wood Product Manufacturing","25","413","8389","72",
"Puerto Rico","2005","321991","Manufactured Home (Mobile Home) Manufacturing","2","0","0","72",
"Puerto Rico","2005","321992","Prefabricated Wood Building Manufacturing","7","0","0","72",
"Puerto Rico","2005","32312 ","Support Activities for Printing","13","109","2198","72",
"Puerto Rico","2005","323115","Digital Printing","7","14","354","72",
"Puerto Rico","2005","323117","Books Printing","1","0","0","72",
"Puerto Rico","2005","323119","Other Commercial Printing","5","107","2544","72",
"Puerto Rico","2005","323121","Tradebinding and Related Work","4","32","690","72",
"Puerto Rico","2005","32532 ","Pesticide and Other Agricultural Chemical Manufacturing","2","0","0","72",
"Puerto Rico","2005","32531 ","Fertilizer Manufacturing","4","0","0","72",
"Puerto Rico","2005","325311","Nitrogenous Fertilizer Manufacturing","1","0","0","72",
"Puerto Rico","2005","325314","Fertilizer (Mixing Only) Manufacturing","3","0","0","72",
"Puerto Rico","2005","327213","Glass Container Manufacturing","2","0","0","72",
