"Utah","2010","3336  ","Engine, turbine, and power transmission equipment manufacturing","6","0","0","49",
"Utah","2010","33361 ","Engine, turbine, and power transmission equipment manufacturing","6","0","0","49",
"Utah","2010","333611","Turbine and turbine generator set units manufacturing","2","0","0","49",
"Utah","2010","333612","Speed changer, industrial high-speed drive, and gear manufacturing","1","0","0","49",
"Utah","2010","333618","Other engine equipment manufacturing","3","0","0","49",
"Utah","2010","3339  ","Other general purpose machinery manufacturing","44","2074","134373","49",
"Utah","2010","33391 ","Pump and compressor manufacturing","6","182","17158","49",
"Utah","2010","333912","Air and gas compressor manufacturing","1","0","0","49",
"Utah","2010","3335  ","Metalworking machinery manufacturing","44","562","18391","49",
"Utah","2010","333911","Pump and pumping equipment manufacturing","5","0","0","49",
"Utah","2010","33392 ","Material handling equipment manufacturing","12","608","35802","49",
"Utah","2010","333921","Elevator and moving stairway manufacturing","2","0","0","49",
"Utah","2010","333922","Conveyor and conveying equipment manufacturing","6","144","8858","49",
"Utah","2010","333924","Industrial truck, tractor, trailer, and stacker machinery manufacturing","4","0","0","49",
"Utah","2010","33399 ","All other general purpose machinery manufacturing","26","1284","81413","49",
"Utah","2010","333991","Power-driven handtool manufacturing","1","0","0","49",
"Utah","2010","333992","Welding and soldering equipment manufacturing","5","0","254","49",
"Utah","2010","333993","Packaging machinery manufacturing","1","0","0","49",
"Utah","2010","333994","Industrial process furnace and oven manufacturing","2","0","0","49",
"Utah","2010","333995","Fluid power cylinder and actuator manufacturing","3","0","0","49",
"Utah","2010","333997","Scale and balance manufacturing","1","0","0","49",
"Utah","2010","333999","All other miscellaneous general purpose machinery manufacturing","13","186","6642","49",
"Utah","2010","334   ","Computer and electronic product manufacturing","159","15269","1000925","49",
"Utah","2010","3341  ","Computer and peripheral equipment manufacturing","19","458","26065","49",
"Utah","2010","33411 ","Computer and peripheral equipment manufacturing","19","458","26065","49",
"Utah","2010","334111","Electronic computer manufacturing","6","91","5403","49",
"Utah","2010","334112","Computer storage device manufacturing","2","0","0","49",
"Utah","2010","334113","Computer terminal manufacturing","1","0","0","49",
"Utah","2010","334119","Other computer peripheral equipment manufacturing","10","275","14110","49",
"Utah","2010","3342  ","Communications equipment manufacturing","22","755","57787","49",
"Utah","2010","33421 ","Telephone apparatus manufacturing","7","137","5867","49",
"Utah","2010","334210","Telephone apparatus manufacturing","7","137","5867","49",
"Utah","2010","33422 ","Radio and television broadcasting and wireless communications equipment manufacturing","15","618","51920","49",
"Utah","2010","334220","Broadcast and wireless communications equip.","15","618","51920","49",
"Utah","2010","3343  ","Audio and video equipment manufacturing","6","73","3978","49",
"Utah","2010","33431 ","Audio and video equipment manufacturing","6","73","3978","49",
"Utah","2010","334310","Audio and video equipment manufacturing","6","73","3978","49",
"Utah","2010","3344  ","Semiconductor and other electronic component manufacturing","42","3865","221711","49",
"Utah","2010","33441 ","Semiconductor and other electronic component manufacturing","42","3865","221711","49",
"Utah","2010","334412","Bare printed circuit board manufacturing","11","1112","37545","49",
"Utah","2010","334413","Semiconductor and related device manufacturing","6","0","0","49",
"Utah","2010","334415","Electronic resistor manufacturing","1","0","0","49",
"Utah","2010","334416","Electronic coil, transformer, and other inductor manufacturing","1","0","0","49",
"Utah","2010","334418","Printed circuit assembly (electronic assembly) manufacturing","10","0","12087","49",
"Utah","2010","334419","Other electronic component manufacturing","13","615","34334","49",
"Utah","2010","3345  ","Navigational, measuring, electromedical, and control instruments manufacturing","58","9852","667669","49",
"Utah","2010","33451 ","Electronic instrument manufacturing","58","9852","667669","49",
"Utah","2010","334510","Electromedical and electrotherapeutic apparatus manufacturing","15","2617","132682","49",
"Utah","2010","334511","Search, detection, navigation, guidance, aeronautical, and nautical system and instrument manufacturing","10","0","0","49",
"Utah","2010","334512","Automatic environmental control manufacturing for residential, commercial, and appliance use","3","0","0","49",
"Utah","2010","334513","Instruments and related products manufacturing for measuring, displaying, and controlling industrial process variables","4","0","0","49",
"Utah","2010","334514","Totalizing fluid meter and counting device manufacturing","1","0","0","49",
"Utah","2010","334515","Instrument manufacturing for measuring and testing electricity and electrical signals","5","77","4417","49",
"Utah","2010","334516","Analytical laboratory instrument manufacturing","8","490","31656","49",
"Utah","2010","334517","Irradiation apparatus manufacturing","6","1300","91263","49",
"Utah","2010","334518","Watch, clock, and part manufacturing","2","0","0","49",
"Utah","2010","334519","Other measuring and controlling device manufacturing","4","0","0","49",
"Utah","2010","33461 ","Manufacturing and reproducing magnetic and optical media","12","266","23715","49",
"Utah","2010","334611","Software reproducing","4","0","2500","49",
"Utah","2010","334612","Prerecorded compact disc (except software), tape, and record reproducing","6","192","7755","49",
"Utah","2010","334613","Magnetic and optical recording media manufacturing","2","0","0","49",
"Utah","2010","335   ","Electrical equipment, appliance, and component manufacturing","46","1418","68411","49",
"Utah","2010","3351  ","Electric lighting equipment manufacturing","11","95","3714","49",
"Utah","2010","33512 ","Lighting fixture manufacturing","11","95","3714","49",
"Utah","2010","335121","Residential electric lighting fixture manufacturing","2","0","0","49",
"Utah","2010","335122","Commercial, industrial, and institutional electric lighting fixture manufacturing","2","0","0","49",
"Utah","2010","335129","Other lighting equipment manufacturing","7","0","1190","49",
"Utah","2010","3352  ","Household appliance manufacturing","4","0","0","49",
"Utah","2010","33521 ","Small electrical appliance manufacturing","2","0","0","49",
"Utah","2010","335211","Electric housewares and household fan manufacturing","1","0","0","49",
"Utah","2010","335212","Household vacuum cleaner manufacturing","1","0","0","49",
"Utah","2010","33522 ","Major appliance manufacturing","2","0","0","49",
"Utah","2010","335221","Household cooking appliance manufacturing","2","0","0","49",
"Utah","2010","3353  ","Electrical equipment manufacturing","12","175","7537","49",
"Utah","2010","33531 ","Electrical equipment manufacturing","12","175","7537","49",
"Utah","2010","335311","Power, distribution, and specialty transformer manufacturing","2","0","0","49",
"Utah","2010","335312","Motor and generator manufacturing","2","0","0","49",
"Utah","2010","335313","Switchgear and switchboard apparatus manufacturing","4","71","3359","49",
"Utah","2010","335314","Relay and industrial control manufacturing","4","0","0","49",
"Utah","2010","3359  ","Other electrical equipment and component manufacturing","19","920","46939","49",
"Utah","2010","33591 ","Battery manufacturing","1","0","0","49",
"Utah","2010","335912","Primary battery manufacturing","1","0","0","49",
"Utah","2010","33592 ","Communication and energy wire and cable manufacturing","5","156","7661","49",
"Utah","2010","335929","Other communication and energy wire manufacturing","5","156","7661","49",
"Utah","2010","33593 ","Wiring device manufacturing","1","0","0","49",
"Utah","2010","335931","Current-carrying wiring device manufacturing","1","0","0","49",
"Utah","2010","33599 ","All other electrical equipment and component manufacturing","12","666","32679","49",
"Utah","2010","335991","Carbon and graphite product manufacturing","3","0","0","49",
"Utah","2010","335999","All other miscellaneous electrical equipment and component manufacturing","9","115","6535","49",
"Utah","2010","336   ","Transportation equipment manufacturing","96","0","0","49",
"Utah","2010","3362  ","Motor vehicle body and trailer manufacturing","16","1001","36856","49",
"Utah","2010","33621 ","Motor vehicle body and trailer manufacturing","16","1001","36856","49",
"Utah","2010","336211","Motor vehicle body manufacturing","4","0","0","49",
"Utah","2010","336212","Truck trailer manufacturing","3","0","0","49",
"Utah","2010","336213","Motor home manufacturing","1","0","0","49",
"Utah","2010","336214","Travel trailer and camper manufacturing","8","0","0","49",
"Utah","2010","3363  ","Motor vehicle parts manufacturing","40","2765","117570","49",
"Utah","2010","33631 ","Motor vehicle gasoline engine and engine parts manufacturing","5","21","493","49",
"Utah","2010","336312","Gasoline engine and engine parts manufacturing","5","21","493","49",
"Utah","2010","33632 ","Motor vehicle electrical and electronic equipment manufacturing","3","0","0","49",
"Utah","2010","336322","Other motor vehicle electrical and electronic equipment manufacturing","3","0","0","49",
"Utah","2010","33633 ","Motor vehicle steering and suspension components (except spring) manufacturing","2","0","0","49",
"Utah","2010","336330","Motor vehicle steering and suspension components (except spring) manufacturing","2","0","0","49",
"Utah","2010","33634 ","Motor vehicle brake system manufacturing","2","0","0","49",
"Utah","2010","336340","Motor vehicle brake system manufacturing","2","0","0","49",
"Utah","2010","33635 ","Motor vehicle transmission and power train parts manufacturing","4","0","0","49",
"Utah","2010","336350","Motor vehicle transmission and power train parts manufacturing","4","0","0","49",
"Utah","2010","33636 ","Motor vehicle seating and interior trim manufacturing","4","46","806","49",
"Utah","2010","336360","Motor vehicle seating and interior trim manufacturing","4","46","806","49",
"Utah","2010","33637 ","Motor vehicle metal stamping","2","0","0","49",
"Utah","2010","336370","Motor vehicle metal stamping","2","0","0","49",
"Utah","2010","33639 ","Other motor vehicle parts manufacturing","18","0","0","49",
"Utah","2010","336399","All other motor vehicle parts manufacturing","18","0","0","49",
"Utah","2010","3364  ","Aerospace product and parts manufacturing","21","0","0","49",
"Utah","2010","33641 ","Aerospace product and parts manufacturing","21","0","0","49",
"Utah","2010","336411","Aircraft manufacturing","2","0","0","49",
"Utah","2010","336412","Aircraft engine and engine parts manufacturing","3","0","0","49",
"Utah","2010","336413","Other aircraft parts and auxiliary equipment manufacturing","11","0","0","49",
"Utah","2010","3365  ","Railroad rolling stock manufacturing","2","0","0","49",
"Utah","2010","3346  ","Manufacturing and reproducing magnetic and optical media","12","266","23715","49",
"Utah","2010","336415","Guided missile and space vehicle propulsion unit and propulsion unit parts manufacturing","2","0","0","49",
"Utah","2010","336419","Other guided missile and space vehicle parts and auxiliary equipment manufacturing","3","0","0","49",
"Utah","2010","33651 ","Railroad rolling stock manufacturing","2","0","0","49",
"Utah","2010","336510","Railroad rolling stock manufacturing","2","0","0","49",
"Utah","2010","3366  ","Ship and boat building","3","0","0","49",
"Utah","2010","33661 ","Ship and boat building","3","0","0","49",
"Utah","2010","336611","Ship building and repairing","1","0","0","49",
"Utah","2010","336612","Boat building","2","0","0","49",
"Utah","2010","3369  ","Other transportation equipment manufacturing","14","0","0","49",
"Utah","2010","33699 ","Other transportation equipment manufacturing","14","0","0","49",
"Utah","2010","336991","Motorcycle, bicycle, and parts manufacturing","5","0","162","49",
"Utah","2010","336999","All other transportation equipment manufacturing","9","0","0","49",
"Utah","2010","337   ","Furniture and related product manufacturing","302","5130","174991","49",
"Utah","2010","3371  ","Household and institutional furniture and kitchen cabinet manufacturing","247","3440","111929","49",
"Utah","2010","33711 ","Wood kitchen cabinet and countertop manufacturing","171","1592","47607","49",
"Utah","2010","337110","Wood kitchen cabinet and countertop manufacturing","171","1592","47607","49",
"Utah","2010","33712 ","Household and institutional furniture manufacturing","76","1848","64322","49",
"Utah","2010","337121","Upholstered household furniture manufacturing","21","173","4262","49",
"Utah","2010","337122","Nonupholstered wood household furniture manufacturing","39","228","6016","49",
"Utah","2010","337124","Metal household furniture manufacturing","3","0","0","49",
"Utah","2010","337125","Household furniture (except wood and metal) manufacturing","4","0","108","49",
"Utah","2010","337127","Institutional furniture manufacturing","7","0","0","49",
"Utah","2010","337129","Wood television, radio, and sewing machine cabinet manufacturing","2","0","0","49",
"Utah","2010","3372  ","Office furniture (including fixtures) manufacturing","42","800","33980","49",
"Utah","2010","33721 ","Office furniture (including fixtures) manufacturing","42","800","33980","49",
"Utah","2010","337211","Wood office furniture manufacturing","4","0","434","49",
"Utah","2010","337212","Custom architectural woodwork and millwork manufacturing","22","460","22812","49",
"Utah","2010","337214","Office furniture (except wood) manufacturing","4","30","744","49",
"Utah","2010","337215","Showcase, partition, shelving, and locker manufacturing","12","283","9990","49",
"Utah","2010","3379  ","Other furniture related product manufacturing","13","890","29082","49",
"Utah","2010","33791 ","Mattress manufacturing","7","388","13769","49",
"Utah","2010","337910","Mattress manufacturing","7","388","13769","49",
"Utah","2010","33792 ","Blind and shade manufacturing","6","0","0","49",
"Utah","2010","337920","Blind and shade manufacturing","6","0","0","49",
"Utah","2010","339   ","Miscellaneous manufacturing","410","13182","584742","49",
"Utah","2010","3391  ","Medical equipment and supplies manufacturing","200","6500","334680","49",
"Utah","2010","33911 ","Medical equipment and supplies manufacturing","200","6500","334680","49",
"Utah","2010","339112","Surgical and medical instrument manufacturing","23","3728","212517","49",
"Utah","2010","339113","Surgical appliance and supplies manufacturing","20","585","29291","49",
"Utah","2010","339114","Dental equipment and supplies manufacturing","11","0","0","49",
"Utah","2010","339115","Ophthalmic goods manufacturing","8","204","7872","49",
"Utah","2010","339116","Dental laboratories","138","838","32815","49",
"Utah","2010","3399  ","Other miscellaneous manufacturing","210","6682","250062","49",
"Utah","2010","33991 ","Jewelry and silverware manufacturing","24","0","0","49",
"Utah","2010","339911","Jewelry (except costume) manufacturing","18","0","0","49",
"Utah","2010","339912","Silverware and hollowware manufacturing","2","0","0","49",
"Utah","2010","339913","Jewelers' material and lapidary work manufacturing","1","0","0","49",
"Utah","2010","339914","Costume jewelry and novelty manufacturing","3","0","88","49",
"Utah","2010","33992 ","Sporting and athletic goods manufacturing","40","3443","111985","49",
"Utah","2010","339920","Sporting and athletic goods manufacturing","40","3443","111985","49",
"Utah","2010","33993 ","Doll, toy, and game manufacturing","6","44","964","49",
"Utah","2010","339932","Game, toy, and children's vehicle manufacturing","6","44","964","49",
"Utah","2010","33994 ","Office supplies (except paper) manufacturing","11","156","5333","49",
"Utah","2010","339941","Pen and mechanical pencil manufacturing","1","0","0","49",
"Utah","2010","339942","Lead pencil and art good manufacturing","3","0","0","49",
"Utah","2010","339943","Marking device manufacturing","7","90","2756","49",
"Utah","2010","33995 ","Sign manufacturing","65","861","36750","49",
"Utah","2010","339950","Sign manufacturing","65","861","36750","49",
"Utah","2010","33999 ","All other miscellaneous manufacturing","64","1370","66418","49",
"Utah","2010","339991","Gasket, packing, and sealing device manufacturing","5","542","35895","49",
"Utah","2010","339992","Musical instrument manufacturing","7","0","410","49",
"Utah","2010","339995","Burial casket manufacturing","2","0","0","49",
"Utah","2010","339999","All other miscellaneous manufacturing","50","0","0","49",
"Utah","2010","42    ","Wholesale trade","3522","52770","2564186","49",
"Utah","2010","423   ","Merchant wholesalers, durable goods","2159","33499","1664443","49",
"Utah","2010","4231  ","Motor vehicle and motor vehicle parts and supplies merchant wholesalers","196","2960","116093","49",
"Utah","2010","42311 ","Automobile and other motor vehicle merchant wholesalers","50","917","45285","49",
"Utah","2010","423110","Automobile and other motor vehicle merchant wholesalers","50","917","45285","49",
"Utah","2010","42312 ","Motor vehicle supplies and new parts merchant wholesalers","116","1712","59860","49",
"Utah","2010","423120","Motor vehicle supplies and new parts merchant wholesalers","116","1712","59860","49",
"Utah","2010","42313 ","Tire and tube merchant wholesalers","14","153","5819","49",
"Utah","2010","423130","Tire and tube merchant wholesalers","14","153","5819","49",
"Utah","2010","42314 ","Motor vehicle parts (used) merchant wholesalers","16","178","5129","49",
"Utah","2010","423140","Motor vehicle parts (used) merchant wholesalers","16","178","5129","49",
"Utah","2010","4232  ","Furniture and home furnishing merchant wholesalers","101","1238","44905","49",
"Utah","2010","42321 ","Furniture merchant wholesalers","42","362","13867","49",
"Utah","2010","423210","Furniture merchant wholesalers","42","362","13867","49",
"Utah","2010","42322 ","Home furnishing merchant wholesalers","59","876","31038","49",
"Utah","2010","423220","Home furnishing merchant wholesalers","59","876","31038","49",
"Utah","2010","4233  ","Lumber and other construction materials merchant wholesalers","199","2646","117358","49",
"Utah","2010","42331 ","Lumber, plywood, millwork, and wood panel merchant wholesalers","81","993","46091","49",
"Utah","2010","423310","Lumber, plywood, millwork, and wood panel merchant wholesalers","81","993","46091","49",
"Utah","2010","42332 ","Brick, stone, and related construction material merchant wholesalers","46","1063","47271","49",
"Utah","2010","423320","Brick, stone, and related construction material merchant wholesalers","46","1063","47271","49",
"Utah","2010","42333 ","Roofing, siding, and insulation material merchant wholesalers","25","0","9527","49",
"Utah","2010","423330","Roofing, siding, and insulation material merchant wholesalers","25","0","9527","49",
"Utah","2010","42339 ","Other construction material merchant wholesalers","47","367","14469","49",
"Utah","2010","423390","Other construction material merchant wholesalers","47","367","14469","49",
"Utah","2010","4234  ","Professional and commercial equipment and supplies merchant wholesalers","336","4852","341059","49",
"Utah","2010","42341 ","Photographic equipment and supplies merchant wholesalers","6","0","3551","49",
"Utah","2010","423410","Photographic equipment and supplies merchant wholesalers","6","0","3551","49",
"Utah","2010","42342 ","Office equipment merchant wholesalers","54","883","46355","49",
"Utah","2010","423420","Office equipment merchant wholesalers","54","883","46355","49",
"Utah","2010","42343 ","Computer and computer peripheral equipment and software merchant wholesalers","97","1919","164939","49",
"Utah","2010","423430","Computer and computer peripheral equipment and software merchant wholesalers","97","1919","164939","49",
"Utah","2010","42344 ","Other commercial equipment merchant wholesalers","43","653","26636","49",
"Utah","2010","423440","Other commercial equipment merchant wholesalers","43","653","26636","49",
"Utah","2010","42345 ","Medical, dental, and hospital equipment and supplies merchant wholesalers","106","1111","85131","49",
"Utah","2010","423450","Medical, dental, and hospital equipment and supplies merchant wholesalers","106","1111","85131","49",
"Utah","2010","42346 ","Ophthalmic goods merchant wholesalers","11","0","0","49",
"Utah","2010","423460","Ophthalmic goods merchant wholesalers","11","0","0","49",
"Utah","2010","42349 ","Other professional equipment and supplies merchant wholesalers","19","0","10849","49",
"Utah","2010","423490","Other professional equipment and supplies merchant wholesalers","19","0","10849","49",
"Utah","2010","4235  ","Metal and mineral (except petroleum) merchant wholesalers","100","1304","64151","49",
"Utah","2010","42351 ","Metal service centers and other metal merchant wholesalers","95","1262","62224","49",
"Utah","2010","423510","Metal service centers and other metal merchant wholesalers","95","1262","62224","49",
"Utah","2010","42352 ","Coal and other mineral and ore merchant wholesalers","5","0","0","49",
"Utah","2010","423520","Coal and other mineral and ore merchant wholesalers","5","0","0","49",
"Utah","2010","4236  ","Electrical and electronic goods merchant wholesalers","249","7740","349218","49",
"Utah","2010","42361 ","Electrical apparatus and equipment, wiring supplies, and related equipment merchant wholesalers","127","1344","79838","49",
"Utah","2010","423610","Electrical apparatus and equipment, wiring supplies, and related equipment merchant wholesalers","127","1344","79838","49",
"Utah","2010","42362 ","Electrical and electronic appliance, television, and radio set merchant wholesalers","29","0","0","49",
"Utah","2010","423620","Electrical and electronic appliance, television, and radio set merchant wholesalers","29","0","0","49",
"Utah","2010","42369 ","Other electronic parts and equipment merchant wholesalers","93","0","0","49",
"Utah","2010","423690","Other electronic parts and equipment merchant wholesalers","93","0","0","49",
"Utah","2010","4237  ","Hardware, plumbing and heating equipment and supplies merchant wholesalers","177","1971","94346","49",
"Utah","2010","42371 ","Hardware merchant wholesalers","60","655","28086","49",
"Utah","2010","423710","Hardware merchant wholesalers","60","655","28086","49",
"Utah","2010","42372 ","Plumbing and heating equipment and supplies (hydronics) merchant wholesalers","64","699","30803","49",
"Utah","2010","423720","Plumbing and heating equipment and supplies (hydronics) merchant wholesalers","64","699","30803","49",
"Utah","2010","42373 ","Warm air heating and air-conditioning equipment and supplies merchant wholesalers","43","534","30537","49",
"Utah","2010","423730","Warm air heating and air-conditioning equipment and supplies merchant wholesalers","43","534","30537","49",
"Utah","2010","42374 ","Refrigeration equipment and supplies merchant wholesalers","10","83","4920","49",
"Utah","2010","423740","Refrigeration equipment and supplies merchant wholesalers","10","83","4920","49",
"Utah","2010","4238  ","Machinery, equipment, and supplies merchant wholesalers","502","6580","374638","49",
"Utah","2010","42381 ","Construction and mining (except oil well) machinery and equipment merchant wholesalers","82","1619","110781","49",
"Utah","2010","423810","Construction and mining (except oil well) machinery and equipment merchant wholesalers","82","1619","110781","49",
"Utah","2010","42382 ","Farm and garden machinery and equipment merchant wholesalers","57","881","35708","49",
"Utah","2010","423820","Farm and garden machinery and equipment merchant wholesalers","57","881","35708","49",
"Utah","2010","42383 ","Industrial machinery and equipment merchant wholesalers","241","2586","151251","49",
"Utah","2010","423830","Industrial machinery and equipment merchant wholesalers","241","2586","151251","49",
"Utah","2010","42384 ","Industrial supplies merchant wholesalers","61","538","31967","49",
"Utah","2010","423840","Industrial supplies merchant wholesalers","61","538","31967","49",
"Utah","2010","42385 ","Service establishment equipment and supplies merchant wholesalers","40","451","19923","49",
"Utah","2010","423850","Service establishment equipment and supplies merchant wholesalers","40","451","19923","49",
"Utah","2010","42386 ","Transportation equipment and supplies (except motor vehicle) merchant wholesalers","21","505","25008","49",
"Utah","2010","423860","Transportation equipment and supplies (except motor vehicle) merchant wholesalers","21","505","25008","49",
"Utah","2010","4239  ","Miscellaneous durable goods merchant wholesalers","299","4208","162675","49",
"Utah","2010","42391 ","Sporting and recreational goods and supplies merchant wholesalers","83","835","35417","49",
"Utah","2010","423910","Sporting and recreational goods and supplies merchant wholesalers","83","835","35417","49",
"Utah","2010","42392 ","Toy and hobby goods and supplies merchant wholesalers","24","0","0","49",
"Utah","2010","423920","Toy and hobby goods and supplies merchant wholesalers","24","0","0","49",
"Utah","2010","42393 ","Recyclable material merchant wholesalers","64","894","37850","49",
"Utah","2010","423930","Recyclable material merchant wholesalers","64","894","37850","49",
"Utah","2010","42394 ","Jewelry, watch, precious stone, and precious metal merchant wholesalers","24","794","27014","49",
"Utah","2010","423940","Jewelry, watch, precious stone, and precious metal merchant wholesalers","24","794","27014","49",
