"GEO_TTL","YEAR","NAICS2007","NAICS2007_TTL","ESTAB","EMP","PAYANN","state",
"Michigan","2009","00    ","Total for all sectors","221682","3383615","135807633","26",
"Michigan","2009","11    ","Agriculture, forestry, fishing and hunting","531","2993","99081","26",
"Michigan","2009","113   ","Forestry and logging","324","1568","48894","26",
"Michigan","2009","1131  ","Timber tract operations","4","0","0","26",
"Michigan","2009","11311 ","Timber tract operations","4","0","0","26",
"Michigan","2009","113110","Timber tract operations","4","0","0","26",
"Michigan","2009","11331 ","Logging","315","1488","45834","26",
"Michigan","2009","113310","Logging","315","1488","45834","26",
"Michigan","2009","114   ","Fishing, hunting and trapping","16","0","2903","26",
"Michigan","2009","1141  ","Fishing","8","0","1944","26",
"Michigan","2009","114210","Hunting and trapping","8","46","959","26",
"Michigan","2009","115   ","Support activities for agriculture and forestry","191","1355","47284","26",
"Michigan","2009","1151  ","Support activities for crop production","61","654","25446","26",
"Michigan","2009","115115","Farm labor contractors and crew leaders","4","0","0","26",
"Michigan","2009","115116","Farm management services","3","0","0","26",
"Michigan","2009","11521 ","Support activities for animal production","95","605","19053","26",
"Michigan","2009","115210","Support activities for animal production","95","605","19053","26",
"Michigan","2009","115310","Support activities for forestry","35","96","2785","26",
"Michigan","2009","2111  ","Oil and gas extraction","100","1081","91662","26",
"Michigan","2009","212   ","Mining (except oil and gas)","131","2396","127431","26",
"Michigan","2009","212234","Copper ore and nickel ore mining","1","0","0","26",
"Michigan","2009","1132  ","Forest nurseries and gathering of forest products","5","0","1053","26",
"Michigan","2009","11321 ","Forest nurseries and gathering of forest products","5","0","1053","26",
"Michigan","2009","113210","Forest nurseries and gathering of forest products","5","0","1053","26",
"Michigan","2009","1133  ","Logging","315","1488","45834","26",
"Michigan","2009","11411 ","Fishing","8","0","1944","26",
"Michigan","2009","114111","Finfish fishing","8","0","1944","26",
"Michigan","2009","1142  ","Hunting and trapping","8","46","959","26",
"Michigan","2009","11421 ","Hunting and trapping","8","46","959","26",
"Michigan","2009","11511 ","Support activities for crop production","61","654","25446","26",
"Michigan","2009","115112","Soil preparation, planting, and cultivating","30","88","3587","26",
"Michigan","2009","115113","Crop harvesting, primarily by machine","4","0","0","26",
"Michigan","2009","115114","Postharvest crop activities (except cotton ginning)","20","517","19244","26",
"Michigan","2009","1152  ","Support activities for animal production","95","605","19053","26",
"Michigan","2009","1153  ","Support activities for forestry","35","96","2785","26",
"Michigan","2009","11531 ","Support activities for forestry","35","96","2785","26",
"Michigan","2009","21    ","Mining, quarrying, and oil and gas extraction","379","5738","323729","26",
"Michigan","2009","211   ","Oil and gas extraction","100","1081","91662","26",
"Michigan","2009","21111 ","Oil and gas extraction","100","1081","91662","26",
"Michigan","2009","211111","Crude petroleum and natural gas extraction","92","1049","89395","26",
"Michigan","2009","211112","Natural gas liquid extraction","8","0","2267","26",
"Michigan","2009","2122  ","Metal ore mining","5","0","0","26",
"Michigan","2009","21221 ","Iron ore mining","3","0","0","26",
"Michigan","2009","212210","Iron ore mining","3","0","0","26",
"Michigan","2009","21223 ","Copper, nickel, lead, and zinc mining","2","0","0","26",
"Michigan","2009","212231","Lead ore and zinc ore mining","1","0","0","26",
"Michigan","2009","212312","Crushed and broken limestone mining and quarrying","17","0","20929","26",
"Michigan","2009","2123  ","Nonmetallic mineral mining and quarrying","126","1042","60803","26",
"Michigan","2009","21231 ","Stone mining and quarrying","22","0","22352","26",
"Michigan","2009","212311","Dimension stone mining and quarrying","2","0","0","26",
"Michigan","2009","212393","Other chemical and fertilizer mineral mining","1","0","0","26",
"Michigan","2009","212319","Other crushed and broken stone mining and quarrying","3","20","830","26",
"Michigan","2009","21232 ","Sand, gravel, clay, and ceramic and refractory minerals mining and quarrying","97","491","31932","26",
"Michigan","2009","212321","Construction sand and gravel mining","86","353","25249","26",
"Michigan","2009","212322","Industrial sand mining","11","0","0","26",
"Michigan","2009","21239 ","Other nonmetallic mineral mining and quarrying","7","0","0","26",
"Michigan","2009","21311 ","Support activities for mining","148","2261","104636","26",
"Michigan","2009","212399","All other nonmetallic mineral mining","6","0","0","26",
"Michigan","2009","213   ","Support activities for mining","148","2261","104636","26",
"Michigan","2009","2131  ","Support activities for mining","148","2261","104636","26",
"Michigan","2009","213111","Drilling oil and gas wells","35","611","19481","26",
"Michigan","2009","213112","Support activities for oil and gas operations","98","1567","80393","26",
"Michigan","2009","213113","Support activities for coal mining","5","12","589","26",
"Michigan","2009","221112","Fossil fuel electric power generation","24","0","112130","26",
"Michigan","2009","221113","Nuclear electric power generation","6","0","0","26",
"Michigan","2009","221119","Other electric power generation","16","0","0","26",
"Michigan","2009","22121 ","Natural gas distribution","65","2466","171885","26",
"Michigan","2009","221210","Natural gas distribution","65","2466","171885","26",
"Michigan","2009","2213  ","Water, sewage and other systems","73","472","26189","26",
"Michigan","2009","221310","Water supply and irrigation systems","50","0","14534","26",
"Michigan","2009","22132 ","Sewage treatment facilities","22","0","0","26",
"Michigan","2009","221330","Steam and air-conditioning supply","1","0","0","26",
"Michigan","2009","2361  ","Residential building construction","4639","13738","439113","26",
"Michigan","2009","2362  ","Nonresidential building construction","1114","12456","715441","26",
"Michigan","2009","213114","Support activities for metal mining","3","0","0","26",
"Michigan","2009","213115","Support activities for nonmetallic minerals (except fuels) mining","7","26","1790","26",
"Michigan","2009","22    ","Utilities","403","0","0","26",
"Michigan","2009","221   ","Utilities","403","0","0","26",
"Michigan","2009","2211  ","Electric power generation, transmission and distribution","265","0","0","26",
"Michigan","2009","22111 ","Electric power generation","59","0","255395","26",
"Michigan","2009","221111","Hydroelectric power generation","13","0","0","26",
"Michigan","2009","22112 ","Electric power transmission, control, and distribution","206","0","0","26",
"Michigan","2009","221121","Electric bulk power transmission and control","2","0","0","26",
"Michigan","2009","221122","Electric power distribution","204","0","0","26",
"Michigan","2009","2212  ","Natural gas distribution","65","2466","171885","26",
"Michigan","2009","22131 ","Water supply and irrigation systems","50","0","14534","26",
"Michigan","2009","221320","Sewage treatment facilities","22","0","0","26",
"Michigan","2009","22133 ","Steam and air-conditioning supply","1","0","0","26",
"Michigan","2009","23    ","Construction","19570","116417","5743366","26",
"Michigan","2009","236   ","Construction of buildings","5753","26194","1154554","26",
"Michigan","2009","23611 ","Residential building construction","4639","13738","439113","26",
"Michigan","2009","236115","New single-family housing construction (except operative builders)","1617","4789","152366","26",
"Michigan","2009","236116","New multifamily housing construction (except operative builders)","60","324","6589","26",
"Michigan","2009","236117","New housing operative builders","363","1294","46820","26",
"Michigan","2009","236118","Residential remodelers","2599","7331","233338","26",
"Michigan","2009","23621 ","Industrial building construction","110","2240","148378","26",
"Michigan","2009","236220","Commercial and institutional building construction","1004","10216","567063","26",
"Michigan","2009","237120","Oil and gas pipeline and related structures construction","21","601","38869","26",
"Michigan","2009","236210","Industrial building construction","110","2240","148378","26",
"Michigan","2009","23622 ","Commercial and institutional building construction","1004","10216","567063","26",
"Michigan","2009","237   ","Heavy and civil engineering construction","1227","12351","915797","26",
"Michigan","2009","2371  ","Utility system construction","604","7651","469567","26",
"Michigan","2009","23711 ","Water and sewer line and related structures construction","429","2609","161955","26",
"Michigan","2009","237110","Water and sewer line and related structures construction","429","2609","161955","26",
"Michigan","2009","23712 ","Oil and gas pipeline and related structures construction","21","601","38869","26",
"Michigan","2009","2373  ","Highway, street, and bridge construction","313","3088","348276","26",
"Michigan","2009","23713 ","Power and communication line and related structures construction","154","4441","268743","26",
"Michigan","2009","237130","Power and communication line and related structures construction","154","4441","268743","26",
"Michigan","2009","2372  ","Land subdivision","171","786","37648","26",
"Michigan","2009","23721 ","Land subdivision","171","786","37648","26",
"Michigan","2009","237210","Land subdivision","171","786","37648","26",
"Michigan","2009","23731 ","Highway, street, and bridge construction","313","3088","348276","26",
"Michigan","2009","2381  ","Foundation, structure, and building exterior contractors","2807","14881","660226","26",
"Michigan","2009","237310","Highway, street, and bridge construction","313","3088","348276","26",
"Michigan","2009","2379  ","Other heavy and civil engineering construction","139","826","60306","26",
"Michigan","2009","23799 ","Other heavy and civil engineering construction","139","826","60306","26",
"Michigan","2009","237990","Other heavy and civil engineering construction","139","826","60306","26",
"Michigan","2009","238   ","Specialty trade contractors","12590","77872","3673015","26",
"Michigan","2009","23811 ","Poured concrete foundation and structure contractors","768","3436","182486","26",
"Michigan","2009","238110","Poured concrete foundation and structure contractors","768","3436","182486","26",
"Michigan","2009","23812 ","Structural steel and precast concrete contractors","83","1248","54536","26",
"Michigan","2009","23814 ","Masonry contractors","631","3190","144349","26",
"Michigan","2009","238120","Structural steel and precast concrete contractors","83","1248","54536","26",
"Michigan","2009","23813 ","Framing contractors","365","1261","41563","26",
"Michigan","2009","238130","Framing contractors","365","1261","41563","26",
"Michigan","2009","238140","Masonry contractors","631","3190","144349","26",
"Michigan","2009","23815 ","Glass and glazing contractors","160","1208","58195","26",
"Michigan","2009","238150","Glass and glazing contractors","160","1208","58195","26",
"Michigan","2009","23819 ","Other foundation, structure, and building exterior contractors","82","489","16177","26",
"Michigan","2009","238190","Other foundation, structure, and building exterior contractors","82","489","16177","26",
"Michigan","2009","2382  ","Building equipment contractors","4910","40762","2077786","26",
"Michigan","2009","238210","Electrical contractors and other wiring installation contractors","2006","17245","883545","26",
"Michigan","2009","23822 ","Plumbing, heating, and air-conditioning contractors","2683","19888","985301","26",
"Michigan","2009","23829 ","Other building equipment contractors","221","3629","208940","26",
"Michigan","2009","23831 ","Drywall and insulation contractors","531","3433","133802","26",
"Michigan","2009","238340","Tile and terrazzo contractors","186","875","25153","26",
"Michigan","2009","23891 ","Site preparation contractors","1146","5514","280569","26",
"Michigan","2009","23816 ","Roofing contractors","442","3185","134788","26",
"Michigan","2009","238160","Roofing contractors","442","3185","134788","26",
"Michigan","2009","23817 ","Siding contractors","276","864","28132","26",
"Michigan","2009","238170","Siding contractors","276","864","28132","26",
"Michigan","2009","23821 ","Electrical contractors and other wiring installation contractors","2006","17245","883545","26",
"Michigan","2009","238220","Plumbing, heating, and air-conditioning contractors","2683","19888","985301","26",
"Michigan","2009","238290","Other building equipment contractors","221","3629","208940","26",
"Michigan","2009","2383  ","Building finishing contractors","2974","14033","491561","26",
"Michigan","2009","238310","Drywall and insulation contractors","531","3433","133802","26",
"Michigan","2009","23832 ","Painting and wall covering contractors","944","3733","135584","26",
"Michigan","2009","238320","Painting and wall covering contractors","944","3733","135584","26",
"Michigan","2009","23833 ","Flooring contractors","352","1532","53897","26",
"Michigan","2009","238330","Flooring contractors","352","1532","53897","26",
"Michigan","2009","23834 ","Tile and terrazzo contractors","186","875","25153","26",
"Michigan","2009","23835 ","Finish carpentry contractors","755","3247","105311","26",
"Michigan","2009","238350","Finish carpentry contractors","755","3247","105311","26",
"Michigan","2009","23839 ","Other building finishing contractors","206","1213","37814","26",
"Michigan","2009","238390","Other building finishing contractors","206","1213","37814","26",
"Michigan","2009","2389  ","Other specialty trade contractors","1899","8196","443442","26",
"Michigan","2009","238910","Site preparation contractors","1146","5514","280569","26",
"Michigan","2009","31111 ","Animal food manufacturing","28","292","12272","26",
"Michigan","2009","23899 ","All other specialty trade contractors","753","2682","162873","26",
"Michigan","2009","238990","All other specialty trade contractors","753","2682","162873","26",
"Michigan","2009","31-33 ","Manufacturing","12696","470900","22851092","26",
"Michigan","2009","311   ","Food manufacturing","719","27863","1150816","26",
"Michigan","2009","3111  ","Animal food manufacturing","28","292","12272","26",
"Michigan","2009","311111","Dog and cat food manufacturing","3","40","1139","26",
"Michigan","2009","311222","Soybean processing","2","0","0","26",
"Michigan","2009","311119","Other animal food manufacturing","25","252","11133","26",
"Michigan","2009","3112  ","Grain and oilseed milling","17","2116","152993","26",
"Michigan","2009","31121 ","Flour milling and malt manufacturing","9","494","27221","26",
"Michigan","2009","311211","Flour milling","9","494","27221","26",
"Michigan","2009","31122 ","Starch and vegetable fats and oils manufacturing","2","0","0","26",
"Michigan","2009","31123 ","Breakfast cereal manufacturing","6","1551","122633","26",
"Michigan","2009","311313","Beet sugar manufacturing","4","0","0","26",
"Michigan","2009","311230","Breakfast cereal manufacturing","6","1551","122633","26",
"Michigan","2009","3113  ","Sugar and confectionery product manufacturing","54","1693","60256","26",
"Michigan","2009","31131 ","Sugar manufacturing","6","0","0","26",
"Michigan","2009","311311","Sugarcane mills","1","0","0","26",
"Michigan","2009","311312","Cane sugar refining","1","0","0","26",
"Michigan","2009","31132 ","Chocolate and confectionery manufacturing from cacao beans","4","0","0","26",
"Michigan","2009","31134 ","Nonchocolate confectionery manufacturing","11","0","0","26",
"Michigan","2009","311340","Nonchocolate confectionery manufacturing","11","0","0","26",
"Michigan","2009","3114  ","Fruit and vegetable preserving and specialty food manufacturing","69","4434","188715","26",
"Michigan","2009","311421","Fruit and vegetable canning","33","1853","75445","26",
"Michigan","2009","311422","Specialty canning","3","0","0","26",
"Michigan","2009","311423","Dried and dehydrated food manufacturing","4","333","9315","26",
"Michigan","2009","31151 ","Dairy product (except frozen) manufacturing","39","4749","247624","26",
"Michigan","2009","311511","Fluid milk manufacturing","14","0","0","26",
"Michigan","2009","311513","Cheese manufacturing","11","0","0","26",
"Michigan","2009","311514","Dry, condensed, and evaporated dairy product manufacturing","11","2029","128839","26",
"Michigan","2009","3116  ","Animal slaughtering and processing","91","5021","179847","26",
"Michigan","2009","311612","Meat processed from carcasses","33","925","40528","26",
"Michigan","2009","3118  ","Bakeries and tortilla manufacturing","323","7055","197310","26",
"Michigan","2009","31183 ","Tortilla manufacturing","5","140","2822","26",
"Michigan","2009","311320","Chocolate and confectionery manufacturing from cacao beans","4","0","0","26",
"Michigan","2009","31133 ","Confectionery manufacturing from purchased chocolate","33","246","6128","26",
"Michigan","2009","311330","Confectionery manufacturing from purchased chocolate","33","246","6128","26",
"Michigan","2009","31141 ","Frozen food manufacturing","29","1533","66879","26",
"Michigan","2009","311411","Frozen fruit, juice, and vegetable manufacturing","16","707","32013","26",
"Michigan","2009","311412","Frozen specialty food manufacturing","13","826","34866","26",
"Michigan","2009","31142 ","Fruit and vegetable canning, pickling, and drying","40","2901","121836","26",
"Michigan","2009","3115  ","Dairy product manufacturing","47","4945","255103","26",
"Michigan","2009","311512","Creamery butter manufacturing","3","0","0","26",
"Michigan","2009","31152 ","Ice cream and frozen dessert manufacturing","8","0","0","26",
"Michigan","2009","311520","Ice cream and frozen dessert manufacturing","8","0","0","26",
"Michigan","2009","31161 ","Animal slaughtering and processing","91","5021","179847","26",
"Michigan","2009","311611","Animal (except poultry) slaughtering","45","0","0","26",
"Michigan","2009","311613","Rendering and meat byproduct processing","4","0","0","26",
"Michigan","2009","311615","Poultry processing","9","1955","64475","26",
"Michigan","2009","3117  ","Seafood product preparation and packaging","8","0","826","26",
"Michigan","2009","31171 ","Seafood product preparation and packaging","8","0","826","26",
"Michigan","2009","311711","Seafood canning","2","0","0","26",
"Michigan","2009","311712","Fresh and frozen seafood processing","6","4","541","26",
"Michigan","2009","31181 ","Bread and bakery product manufacturing","296","6517","178498","26",
"Michigan","2009","311811","Retail bakeries","215","1700","25674","26",
"Michigan","2009","311812","Commercial bakeries","76","4126","125737","26",
"Michigan","2009","311813","Frozen cakes, pies, and other pastries manufacturing","5","0","0","26",
"Michigan","2009","31182 ","Cookie, cracker, and pasta manufacturing","22","398","15990","26",
"Michigan","2009","311821","Cookie and cracker manufacturing","2","0","0","26",
"Michigan","2009","311822","Flour mixes and dough manufacturing from purchased flour","15","329","13815","26",
"Michigan","2009","311823","Dry pasta manufacturing","5","57","1946","26",
"Michigan","2009","311830","Tortilla manufacturing","5","140","2822","26",
"Michigan","2009","311920","Coffee and tea manufacturing","7","0","7766","26",
"Michigan","2009","3119  ","Other food manufacturing","82","2297","103494","26",
"Michigan","2009","31191 ","Snack food manufacturing","17","0","0","26",
"Michigan","2009","311911","Roasted nuts and peanut butter manufacturing","7","0","0","26",
"Michigan","2009","311919","Other snack food manufacturing","10","240","12494","26",
"Michigan","2009","31192 ","Coffee and tea manufacturing","7","0","7766","26",
"Michigan","2009","31193 ","Flavoring syrup and concentrate manufacturing","4","65","2644","26",
"Michigan","2009","311991","Perishable prepared food manufacturing","15","221","4393","26",
"Michigan","2009","311930","Flavoring syrup and concentrate manufacturing","4","65","2644","26",
"Michigan","2009","31194 ","Seasoning and dressing manufacturing","16","0","0","26",
"Michigan","2009","311941","Mayonnaise, dressing, and other prepared sauce manufacturing","11","0","0","26",
"Michigan","2009","311942","Spice and extract manufacturing","5","282","20169","26",
"Michigan","2009","31199 ","All other food manufacturing","38","858","31202","26",
"Michigan","2009","312111","Soft drink manufacturing","15","2715","125799","26",
"Michigan","2009","312112","Bottled water manufacturing","10","0","0","26",
"Michigan","2009","312113","Ice manufacturing","11","0","0","26",
"Michigan","2009","31212 ","Breweries","21","0","0","26",
"Michigan","2009","312120","Breweries","21","0","0","26",
"Michigan","2009","31213 ","Wineries","45","242","6559","26",
"Michigan","2009","312130","Wineries","45","242","6559","26",
"Michigan","2009","312140","Distilleries","2","0","0","26",
"Michigan","2009","3122  ","Tobacco manufacturing","1","0","0","26",
"Michigan","2009","31222 ","Tobacco product manufacturing","1","0","0","26",
"Michigan","2009","313   ","Textile mills","39","819","25498","26",
"Michigan","2009","3131  ","Fiber, yarn, and thread mills","2","0","0","26",
"Michigan","2009","313113","Thread mills","1","0","0","26",
"Michigan","2009","31322 ","Narrow fabric mills and schiffli machine embroidery","3","0","0","26",
"Michigan","2009","31323 ","Nonwoven fabric mills","3","0","0","26",
"Michigan","2009","3133  ","Textile and fabric finishing and fabric coating mills","23","217","8900","26",
"Michigan","2009","313312","Textile and fabric finishing (except broadwoven fabric) mills","11","51","1156","26",
"Michigan","2009","314110","Carpet and rug mills","10","0","0","26",
"Michigan","2009","311999","All other miscellaneous food manufacturing","23","637","26809","26",
"Michigan","2009","312   ","Beverage and tobacco product manufacturing","105","3940","172593","26",
"Michigan","2009","3121  ","Beverage manufacturing","104","3939","172570","26",
"Michigan","2009","31211 ","Soft drink and ice manufacturing","36","3279","154097","26",
"Michigan","2009","31214 ","Distilleries","2","0","0","26",
"Michigan","2009","312229","Other tobacco product manufacturing","1","0","0","26",
"Michigan","2009","31311 ","Fiber, yarn, and thread mills","2","0","0","26",
"Michigan","2009","313111","Yarn spinning mills","1","0","0","26",
"Michigan","2009","3132  ","Fabric mills","14","584","16182","26",
"Michigan","2009","31321 ","Broadwoven fabric mills","7","0","967","26",
"Michigan","2009","313210","Broadwoven fabric mills","7","0","967","26",
"Michigan","2009","313221","Narrow fabric mills","2","0","0","26",
"Michigan","2009","313222","Schiffli machine embroidery","1","0","0","26",
"Michigan","2009","313230","Nonwoven fabric mills","3","0","0","26",
"Michigan","2009","31324 ","Knit fabric mills","1","0","0","26",
"Michigan","2009","313249","Other knit fabric and lace mills","1","0","0","26",
"Michigan","2009","31331 ","Textile and fabric finishing mills","17","115","3011","26",
"Michigan","2009","313311","Broadwoven fabric finishing mills","6","64","1855","26",
"Michigan","2009","31332 ","Fabric coating mills","6","0","0","26",
"Michigan","2009","313320","Fabric coating mills","6","0","0","26",
"Michigan","2009","314   ","Textile product mills","179","2177","67712","26",
"Michigan","2009","3141  ","Textile furnishings mills","52","1243","39577","26",
"Michigan","2009","31411 ","Carpet and rug mills","10","0","0","26",
"Michigan","2009","31412 ","Curtain and linen mills","42","0","5055","26",
"Michigan","2009","314912","Canvas and related product mills","48","563","18233","26",
"Michigan","2009","314121","Curtain and drapery mills","28","83","1693","26",
"Michigan","2009","314129","Other household textile product mills","14","0","3362","26",
"Michigan","2009","3149  ","Other textile product mills","127","934","28135","26",
"Michigan","2009","31491 ","Textile bag and canvas mills","54","675","21230","26",
"Michigan","2009","314911","Textile bag mills","6","0","0","26",
"Michigan","2009","31499 ","All other textile product mills","73","0","6905","26",
"Michigan","2009","315111","Sheer hosiery mills","1","0","0","26",
"Michigan","2009","314991","Rope, cordage, and twine mills","3","0","0","26",
"Michigan","2009","314999","All other miscellaneous textile product mills","70","0","6053","26",
"Michigan","2009","315   ","Apparel manufacturing","79","355","6092","26",
"Michigan","2009","3151  ","Apparel knitting mills","5","22","447","26",
"Michigan","2009","31511 ","Hosiery and sock mills","2","0","0","26",
"Michigan","2009","315119","Other hosiery and sock mills","1","0","0","26",
"Michigan","2009","31519 ","Other apparel knitting mills","3","7","77","26",
"Michigan","2009","315191","Outerwear knitting mills","3","7","77","26",
"Michigan","2009","3152  ","Cut and sew apparel manufacturing","66","319","5454","26",
"Michigan","2009","31523 ","Women's and girls' cut and sew apparel manufacturing","7","50","1194","26",
"Michigan","2009","315231","Women's and girls' cut and sew lingerie, loungewear, and nightwear manufacturing","1","0","0","26",
"Michigan","2009","315233","Women's and girls' cut and sew dress manufacturing","4","0","403","26",
"Michigan","2009","315234","Women's and girls' cut and sew suit, coat, tailored jacket, and skirt manufacturing","1","0","0","26",
"Michigan","2009","315239","Women's and girls' cut and sew other outerwear manufacturing","1","0","0","26",
"Michigan","2009","31529 ","Other cut and sew apparel manufacturing","6","85","768","26",
"Michigan","2009","315299","All other cut and sew apparel manufacturing","6","85","768","26",
