"Puerto Rico","2005","32612 ","Plastics Pipe, Pipe Fitting, and Unlaminated Profile Shape Manufacturing","3","0","0","72",
"Puerto Rico","2005","326122","Plastics Pipe and Pipe Fitting Manufacturing","3","0","0","72",
"Puerto Rico","2005","32613 ","Laminated Plastics Plate, Sheet (except Packaging), and Shape Manufacturing","2","0","0","72",
"Puerto Rico","2005","327310","Cement Manufacturing","4","0","0","72",
"Puerto Rico","2005","327215","Glass Product Manufacturing Made of Purchased Glass","2","0","0","72",
"Puerto Rico","2005","3273  ","Cement and Concrete Product Manufacturing","136","3651","79039","72",
"Puerto Rico","2005","32731 ","Cement Manufacturing","4","0","0","72",
"Puerto Rico","2005","331222","Steel Wire Drawing","3","0","0","72",
"Puerto Rico","2005","331314","Secondary Smelting and Alloying of Aluminum","2","0","0","72",
"Puerto Rico","2005","3313  ","Alumina and Aluminum Production and Processing","6","0","0","72",
"Puerto Rico","2005","33131 ","Alumina and Aluminum Production and Processing","6","0","0","72",
"Puerto Rico","2005","331312","Primary Aluminum Production","1","0","0","72",
"Puerto Rico","2005","332311","Prefabricated Metal Building and Component Manufacturing","3","33","593","72",
"Puerto Rico","2005","33281 ","Coating, Engraving, Heat Treating, and Allied Activities","13","170","3855","72",
"Puerto Rico","2005","332312","Fabricated Structural Metal Manufacturing","19","648","14376","72",
"Puerto Rico","2005","332313","Plate Work Manufacturing","3","37","789","72",
"Puerto Rico","2005","33232 ","Ornamental and Architectural Metal Products Manufacturing","157","3111","56165","72",
"Puerto Rico","2005","333412","Industrial and Commercial Fan and Blower Manufacturing","2","0","0","72",
"Puerto Rico","2005","332812","Metal Coating, Engraving (except Jewelry and Silverware), and Allied Services to Manufacturers","6","54","1551","72",
"Puerto Rico","2005","332813","Electroplating, Plating, Polishing, Anodizing, and Coloring","7","116","2304","72",
"Puerto Rico","2005","3329  ","Other Fabricated Metal Product Manufacturing","29","686","15888","72",
"Puerto Rico","2005","3344  ","Semiconductor and Other Electronic Component Manufacturing","19","2753","79323","72",
"Puerto Rico","2005","333414","Heating Equipment (except Warm Air Furnaces) Manufacturing","4","0","0","72",
"Puerto Rico","2005","333415","Air-Conditioning and Warm Air Heating Equipment and Commercial and Industrial Refrigeration Equipment Manufacturing","9","199","5647","72",
"Puerto Rico","2005","3335  ","Metalworking Machinery Manufacturing","18","180","5483","72",
"Puerto Rico","2005","33431 ","Audio and Video Equipment Manufacturing","2","0","0","72",
"Puerto Rico","2005","334310","Audio and Video Equipment Manufacturing","2","0","0","72",
"Puerto Rico","2005","33441 ","Semiconductor and Other Electronic Component Manufacturing","19","2753","79323","72",
"Puerto Rico","2005","33521 ","Small Electrical Appliance Manufacturing","2","0","0","72",
"Puerto Rico","2005","335121","Residential Electric Lighting Fixture Manufacturing","4","0","0","72",
"Puerto Rico","2005","335122","Commercial, Industrial, and Institutional Electric Lighting Fixture Manufacturing","2","0","0","72",
"Puerto Rico","2005","3352  ","Household Appliance Manufacturing","2","0","0","72",
"Puerto Rico","2005","336312","Gasoline Engine and Engine Parts Manufacturing","4","0","0","72",
"Puerto Rico","2005","337   ","Furniture and Related Product Manufacturing","181","1751","26367","72",
"Puerto Rico","2005","33632 ","Motor Vehicle Electrical and Electronic Equipment Manufacturing","2","0","0","72",
"Puerto Rico","2005","336322","Other Motor Vehicle Electrical and Electronic Equipment Manufacturing","2","0","0","72",
"Puerto Rico","2005","33634 ","Motor Vehicle Brake System Manufacturing","2","0","0","72",
"Puerto Rico","2005","339111","Laboratory Apparatus and Furniture Manufacturing","3","0","0","72",
"Puerto Rico","2005","3371  ","Household and Institutional Furniture and Kitchen Cabinet Manufacturing","144","1292","16759","72",
"Puerto Rico","2005","33711 ","Wood Kitchen Cabinet and Countertop Manufacturing","67","483","5834","72",
"Puerto Rico","2005","337110","Wood Kitchen Cabinet and Countertop Manufacturing","67","483","5834","72",
"Puerto Rico","2005","42311 ","Automobile and Other Motor Vehicle Merchant Wholesalers","16","512","18467","72",
"Puerto Rico","2005","339112","Surgical and Medical Instrument Manufacturing","15","4555","146747","72",
"Puerto Rico","2005","339113","Surgical Appliance and Supplies Manufacturing","16","1997","50260","72",
"Puerto Rico","2005","339114","Dental Equipment and Supplies Manufacturing","3","0","0","72",
"Puerto Rico","2005","42342 ","Office Equipment Merchant Wholesalers","42","736","25870","72",
"Puerto Rico","2005","423110","Automobile and Other Motor Vehicle Merchant Wholesalers","16","512","18467","72",
"Puerto Rico","2005","42312 ","Motor Vehicle Supplies and New Parts Merchant Wholesalers","90","997","23178","72",
"Puerto Rico","2005","423120","Motor Vehicle Supplies and New Parts Merchant Wholesalers","90","997","23178","72",
"Puerto Rico","2005","423690","Other Electronic Parts and Equipment Merchant Wholesalers","53","419","15656","72",
"Puerto Rico","2005","423420","Office Equipment Merchant Wholesalers","42","736","25870","72",
"Puerto Rico","2005","42343 ","Computer and Computer Peripheral Equipment and Software Merchant Wholesalers","34","627","31318","72",
"Puerto Rico","2005","423430","Computer and Computer Peripheral Equipment and Software Merchant Wholesalers","34","627","31318","72",
"Puerto Rico","2005","42372 ","Plumbing and Heating Equipment and Supplies (Hydronics) Merchant Wholesalers","30","565","10564","72",
"Puerto Rico","2005","4237  ","Hardware, and Plumbing and Heating Equipment and Supplies Merchant Wholesalers","142","1969","46561","72",
"Puerto Rico","2005","42371 ","Hardware Merchant Wholesalers","75","1083","27331","72",
"Puerto Rico","2005","423710","Hardware Merchant Wholesalers","75","1083","27331","72",
"Puerto Rico","2005","42391 ","Sporting and Recreational Goods and Supplies Merchant Wholesalers","19","149","3243","72",
"Puerto Rico","2005","424210","Drugs and Druggists' Sundries Merchant Wholesalers","133","5390","242250","72",
"Puerto Rico","2005","423910","Sporting and Recreational Goods and Supplies Merchant Wholesalers","19","149","3243","72",
"Puerto Rico","2005","42392 ","Toy and Hobby Goods and Supplies Merchant Wholesalers","16","132","3110","72",
"Puerto Rico","2005","423920","Toy and Hobby Goods and Supplies Merchant Wholesalers","16","132","3110","72",
"Puerto Rico","2005","42446 ","Fish and Seafood Merchant Wholesalers","6","0","0","72",
"Puerto Rico","2005","4243  ","Apparel, Piece Goods, and Notions Merchant Wholesalers","121","1287","18642","72",
"Puerto Rico","2005","42431 ","Piece Goods, Notions, and Other Dry Goods Merchant Wholesalers","14","165","3696","72",
"Puerto Rico","2005","424310","Piece Goods, Notions, and Other Dry Goods Merchant Wholesalers","14","165","3696","72",
"Puerto Rico","2005","42448 ","Fresh Fruit and Vegetable Merchant Wholesalers","31","783","15055","72",
"Puerto Rico","2005","424460","Fish and Seafood Merchant Wholesalers","6","0","0","72",
"Puerto Rico","2005","42447 ","Meat and Meat Product Merchant Wholesalers","16","223","5105","72",
"Puerto Rico","2005","424470","Meat and Meat Product Merchant Wholesalers","16","223","5105","72",
"Puerto Rico","2005","42471 ","Petroleum Bulk Stations and Terminals","57","652","24176","72",
"Puerto Rico","2005","424710","Petroleum Bulk Stations and Terminals","57","652","24176","72",
"Puerto Rico","2005","42511 ","Business to Business Electronic Markets","2","0","0","72",
"Puerto Rico","2005","42472 ","Petroleum and Petroleum Products Merchant Wholesalers (except Bulk Stations and Terminals)","35","364","8105","72",
"Puerto Rico","2005","424720","Petroleum and Petroleum Products Merchant Wholesalers (except Bulk Stations and Terminals)","35","364","8105","72",
"Puerto Rico","2005","424990","Other Miscellaneous Nondurable Goods Merchant Wholesalers","51","600","9509","72",
"Puerto Rico","2005","425   ","Wholesale Electronic Markets and Agents and Brokers","54","280","6146","72",
"Puerto Rico","2005","4251  ","Wholesale Electronic Markets and Agents and Brokers","54","280","6146","72",
"Puerto Rico","2005","441310","Automotive Parts and Accessories Stores","809","7388","137544","72",
"Puerto Rico","2005","44132 ","Tire Dealers","142","428","6586","72",
"Puerto Rico","2005","44411 ","Home Centers","79","2599","40503","72",
"Puerto Rico","2005","441320","Tire Dealers","142","428","6586","72",
"Puerto Rico","2005","442   ","Furniture and Home Furnishings Stores","460","4226","66347","72",
"Puerto Rico","2005","4421  ","Furniture Stores","356","3383","53439","72",
"Puerto Rico","2005","444110","Home Centers","79","2599","40503","72",
"Puerto Rico","2005","445299","All Other Specialty Food Stores","79","639","4954","72",
"Puerto Rico","2005","44412 ","Paint and Wallpaper Stores","93","362","8212","72",
"Puerto Rico","2005","444120","Paint and Wallpaper Stores","93","362","8212","72",
"Puerto Rico","2005","44413 ","Hardware Stores","527","4013","53828","72",
"Puerto Rico","2005","31311 ","Fiber, Yarn, and Thread Mills","3","0","0","72",
"Puerto Rico","2005","4453  ","Beer, Wine, and Liquor Stores","77","738","21840","72",
"Puerto Rico","2005","44531 ","Beer, Wine, and Liquor Stores","77","738","21840","72",
"Puerto Rico","2005","445310","Beer, Wine, and Liquor Stores","77","738","21840","72",
"Puerto Rico","2005","313   ","Textile Mills","20","221","2508","72",
"Puerto Rico","2005","3131  ","Fiber, Yarn, and Thread Mills","3","0","0","72",
"Puerto Rico","2005","313113","Thread Mills","3","0","0","72",
"Puerto Rico","2005","315191","Outerwear Knitting Mills","3","0","0","72",
"Puerto Rico","2005","3132  ","Fabric Mills","11","199","2183","72",
"Puerto Rico","2005","3151  ","Apparel Knitting Mills","3","0","0","72",
"Puerto Rico","2005","31519 ","Other Apparel Knitting Mills","3","0","0","72",
"Puerto Rico","2005","3152  ","Cut and Sew Apparel Manufacturing","94","7086","94748","72",
"Puerto Rico","2005","3221  ","Pulp, Paper, and Paperboard Mills","4","68","1159","72",
"Puerto Rico","2005","31599 ","Apparel Accessories and Other Apparel Manufacturing","4","0","0","72",
"Puerto Rico","2005","315992","Glove and Mitten Manufacturing","1","0","0","72",
"Puerto Rico","2005","315999","Other Apparel Accessories and Other Apparel Manufacturing","3","0","0","72",
"Puerto Rico","2005","316   ","Leather and Allied Product Manufacturing","11","1873","24556","72",
"Puerto Rico","2005","322   ","Paper Manufacturing","36","1502","35587","72",
"Puerto Rico","2005","32211 ","Pulp Mills","1","0","0","72",
"Puerto Rico","2005","322110","Pulp Mills","1","0","0","72",
"Puerto Rico","2005","32212 ","Paper Mills","3","0","0","72",
"Puerto Rico","2005","32411 ","Petroleum Refineries","7","415","22028","72",
"Puerto Rico","2005","323122","Prepress Services","9","77","1508","72",
"Puerto Rico","2005","324   ","Petroleum and Coal Products Manufacturing","27","1059","39237","72",
"Puerto Rico","2005","3241  ","Petroleum and Coal Products Manufacturing","27","1059","39237","72",
"Puerto Rico","2005","32541 ","Pharmaceutical and Medicine Manufacturing","72","31677","1465558","72",
"Puerto Rico","2005","324110","Petroleum Refineries","7","415","22028","72",
"Puerto Rico","2005","325320","Pesticide and Other Agricultural Chemical Manufacturing","2","0","0","72",
"Puerto Rico","2005","3254  ","Pharmaceutical and Medicine Manufacturing","72","31677","1465558","72",
"Puerto Rico","2005","325411","Medicinal and Botanical Manufacturing","6","0","0","72",
"Puerto Rico","2005","32615 ","Urethane and Other Foam Product (except Polystyrene) Manufacturing","4","18","293","72",
"Puerto Rico","2005","326130","Laminated Plastics Plate, Sheet (except Packaging), and Shape Manufacturing","2","0","0","72",
"Puerto Rico","2005","32614 ","Polystyrene Foam Product Manufacturing","6","133","2398","72",
"Puerto Rico","2005","326140","Polystyrene Foam Product Manufacturing","6","133","2398","72",
"Puerto Rico","2005","32733 ","Concrete Pipe, Brick, and Block Manufacturing","26","0","0","72",
"Puerto Rico","2005","326150","Urethane and Other Foam Product (except Polystyrene) Manufacturing","4","18","293","72",
"Puerto Rico","2005","32732 ","Ready-Mix Concrete Manufacturing","77","1799","42998","72",
"Puerto Rico","2005","327320","Ready-Mix Concrete Manufacturing","77","1799","42998","72",
"Puerto Rico","2005","327331","Concrete Block and Brick Manufacturing","22","277","4062","72",
"Puerto Rico","2005","331319","Other Aluminum Rolling and Drawing","1","0","0","72",
"Puerto Rico","2005","327332","Concrete Pipe Manufacturing","4","0","0","72",
"Puerto Rico","2005","331315","Aluminum Sheet, Plate, and Foil Manufacturing","1","0","0","72",
"Puerto Rico","2005","331316","Aluminum Extruded Product Manufacturing","1","0","0","72",
"Puerto Rico","2005","3314  ","Nonferrous Metal (except Aluminum) Production and Processing","2","0","0","72",
"Puerto Rico","2005","3324  ","Boiler, Tank, and Shipping Container Manufacturing","16","418","12036","72",
"Puerto Rico","2005","332321","Metal Window and Door Manufacturing","54","1334","21840","72",
"Puerto Rico","2005","332322","Sheet Metal Work Manufacturing","53","603","9534","72",
"Puerto Rico","2005","332323","Ornamental and Architectural Metal Work Manufacturing","50","1174","24791","72",
"Puerto Rico","2005","33299 ","All Other Fabricated Metal Product Manufacturing","28","0","0","72",
"Puerto Rico","2005","33241 ","Power Boiler and Heat Exchanger Manufacturing","1","0","0","72",
"Puerto Rico","2005","33291 ","Metal Valve Manufacturing","1","0","0","72",
"Puerto Rico","2005","332919","Other Metal Valve and Pipe Fitting Manufacturing","1","0","0","72",
"Puerto Rico","2005","332992","Small Arms Ammunition Manufacturing","1","0","0","72",
"Puerto Rico","2005","333513","Machine Tool (Metal Forming Types) Manufacturing","1","0","0","72",
"Puerto Rico","2005","33351 ","Metalworking Machinery Manufacturing","18","180","5483","72",
"Puerto Rico","2005","333511","Industrial Mold Manufacturing","3","0","0","72",
"Puerto Rico","2005","333512","Machine Tool (Metal Cutting Types) Manufacturing","2","0","0","72",
"Puerto Rico","2005","334413","Semiconductor and Related Device Manufacturing","1","0","0","72",
"Puerto Rico","2005","333514","Special Die and Tool, Die Set, Jig, and Fixture Manufacturing","10","85","3137","72",
"Puerto Rico","2005","334411","Electron Tube Manufacturing","2","0","0","72",
"Puerto Rico","2005","334412","Bare Printed Circuit Board Manufacturing","2","0","0","72",
"Puerto Rico","2005","334414","Electronic Capacitor Manufacturing","1","0","0","72",
"Puerto Rico","2005","33531 ","Electrical Equipment Manufacturing","28","4718","120542","72",
"Puerto Rico","2005","335211","Electric Housewares and Household Fan Manufacturing","1","0","0","72",
"Puerto Rico","2005","335212","Household Vacuum Cleaner Manufacturing","1","0","0","72",
"Puerto Rico","2005","3353  ","Electrical Equipment Manufacturing","28","4718","120542","72",
"Puerto Rico","2005","33636 ","Motor Vehicle Seating and Interior Trim Manufacturing","2","0","0","72",
"Puerto Rico","2005","336340","Motor Vehicle Brake System Manufacturing","2","0","0","72",
"Puerto Rico","2005","33635 ","Motor Vehicle Transmission and Power Train Parts Manufacturing","3","56","587","72",
"Puerto Rico","2005","336350","Motor Vehicle Transmission and Power Train Parts Manufacturing","3","56","587","72",
"Puerto Rico","2005","337122","Nonupholstered Wood Household Furniture Manufacturing","52","603","8271","72",
"Puerto Rico","2005","336360","Motor Vehicle Seating and Interior Trim Manufacturing","2","0","0","72",
"Puerto Rico","2005","33712 ","Household and Institutional Furniture Manufacturing","77","809","10925","72",
"Puerto Rico","2005","337121","Upholstered Household Furniture Manufacturing","17","149","1804","72",
"Puerto Rico","2005","337124","Metal Household Furniture Manufacturing","4","23","276","72",
"Puerto Rico","2005","3399  ","Other Miscellaneous Manufacturing","53","1148","23119","72",
"Puerto Rico","2005","337125","Household Furniture (except Wood and Metal) Manufacturing","2","0","0","72",
"Puerto Rico","2005","339115","Ophthalmic Goods Manufacturing","4","2716","66152","72",
"Puerto Rico","2005","339116","Dental Laboratories","40","877","20119","72",
"Puerto Rico","2005","33991 ","Jewelry and Silverware Manufacturing","11","539","12369","72",
"Puerto Rico","2005","339911","Jewelry (except Costume) Manufacturing","5","0","0","72",
"Puerto Rico","2005","423140","Motor Vehicle Parts (Used) Merchant Wholesalers","13","66","961","72",
"Puerto Rico","2005","42313 ","Tire and Tube Merchant Wholesalers","23","340","6455","72",
"Puerto Rico","2005","423130","Tire and Tube Merchant Wholesalers","23","340","6455","72",
"Puerto Rico","2005","42314 ","Motor Vehicle Parts (Used) Merchant Wholesalers","13","66","961","72",
"Puerto Rico","2005","4232  ","Furniture and Home Furnishing Merchant Wholesalers","61","586","12548","72",
"Puerto Rico","2005","423450","Medical, Dental, and Hospital Equipment and Supplies Merchant Wholesalers","130","2369","73531","72",
"Puerto Rico","2005","42344 ","Other Commercial Equipment Merchant Wholesalers","37","338","7383","72",
"Puerto Rico","2005","423440","Other Commercial Equipment Merchant Wholesalers","37","338","7383","72",
"Puerto Rico","2005","42345 ","Medical, Dental, and Hospital Equipment and Supplies Merchant Wholesalers","130","2369","73531","72",
"Puerto Rico","2005","42394 ","Jewelry, Watch, Precious Stone, and Precious Metal Merchant Wholesalers","19","81","1623","72",
"Puerto Rico","2005","423720","Plumbing and Heating Equipment and Supplies (Hydronics) Merchant Wholesalers","30","565","10564","72",
"Puerto Rico","2005","42373 ","Warm Air Heating and Air-Conditioning Equipment and Supplies Merchant Wholesalers","23","242","7007","72",
"Puerto Rico","2005","423730","Warm Air Heating and Air-Conditioning Equipment and Supplies Merchant Wholesalers","23","242","7007","72",
"Puerto Rico","2005","42393 ","Recyclable Material Merchant Wholesalers","39","360","5309","72",
"Puerto Rico","2005","423930","Recyclable Material Merchant Wholesalers","39","360","5309","72",
"Puerto Rico","2005","423940","Jewelry, Watch, Precious Stone, and Precious Metal Merchant Wholesalers","19","81","1623","72",
"Puerto Rico","2005","424330","Women's, Children's, and Infants' Clothing and Accessories Merchant Wholesalers","61","342","6074","72",
"Puerto Rico","2005","42432 ","Men's and Boys' Clothing and Furnishings Merchant Wholesalers","21","82","2126","72",
"Puerto Rico","2005","424320","Men's and Boys' Clothing and Furnishings Merchant Wholesalers","21","82","2126","72",
"Puerto Rico","2005","42433 ","Women's, Children's, and Infants' Clothing and Accessories Merchant Wholesalers","61","342","6074","72",
"Puerto Rico","2005","4245  ","Farm Product Raw Material Merchant Wholesalers","11","96","1284","72",
"Puerto Rico","2005","424480","Fresh Fruit and Vegetable Merchant Wholesalers","31","783","15055","72",
"Puerto Rico","2005","42449 ","Other Grocery and Related Products Merchant Wholesalers","95","2590","73446","72",
"Puerto Rico","2005","424490","Other Grocery and Related Products Merchant Wholesalers","95","2590","73446","72",
"Puerto Rico","2005","42482 ","Wine and Distilled Alcoholic Beverage Merchant Wholesalers","23","0","0","72",
"Puerto Rico","2005","4248  ","Beer, Wine, and Distilled Alcoholic Beverage Merchant Wholesalers","31","1054","37557","72",
"Puerto Rico","2005","42481 ","Beer and Ale Merchant Wholesalers","8","0","0","72",
"Puerto Rico","2005","424810","Beer and Ale Merchant Wholesalers","8","0","0","72",
"Puerto Rico","2005","44-45 ","Retail Trade","11137","135203","1977541","72",
"Puerto Rico","2005","425110","Business to Business Electronic Markets","2","0","0","72",
"Puerto Rico","2005","42512 ","Wholesale Trade Agents and Brokers","52","0","0","72",
"Puerto Rico","2005","425120","Wholesale Trade Agents and Brokers","52","0","0","72",
"Puerto Rico","2005","441   ","Motor Vehicle and Parts Dealers","1400","14608","326741","72",
"Puerto Rico","2005","44211 ","Furniture Stores","356","3383","53439","72",
"Puerto Rico","2005","442210","Floor Covering Stores","15","101","2295","72",
"Puerto Rico","2005","442110","Furniture Stores","356","3383","53439","72",
"Puerto Rico","2005","4422  ","Home Furnishings Stores","104","843","12908","72",
"Puerto Rico","2005","44221 ","Floor Covering Stores","15","101","2295","72",
"Puerto Rico","2005","4442  ","Lawn and Garden Equipment and Supplies Stores","100","347","5911","72",
"Puerto Rico","2005","444130","Hardware Stores","527","4013","53828","72",
"Puerto Rico","2005","44419 ","Other Building Material Dealers","303","2747","50564","72",
"Puerto Rico","2005","444190","Other Building Material Dealers","303","2747","50564","72",
"Puerto Rico","2005","44421 ","Outdoor Power Equipment Stores","12","85","2498","72",
"Puerto Rico","2005","446   ","Health and Personal Care Stores","1359","14560","264006","72",
"Puerto Rico","2005","44612 ","Cosmetics, Beauty Supplies, and Perfume Stores","155","1234","17498","72",
"Puerto Rico","2005","4461  ","Health and Personal Care Stores","1359","14560","264006","72",
"Puerto Rico","2005","44611 ","Pharmacies and Drug Stores","783","11288","211519","72",
"Puerto Rico","2005","446110","Pharmacies and Drug Stores","783","11288","211519","72",
"Puerto Rico","2005","448130","Children's and Infants' Clothing Stores","79","765","7323","72",
"Puerto Rico","2005","448150","Clothing Accessories Stores","75","688","8328","72",
"Puerto Rico","2005","44814 ","Family Clothing Stores","327","4637","51023","72",
"Puerto Rico","2005","448140","Family Clothing Stores","327","4637","51023","72",
"Puerto Rico","2005","44815 ","Clothing Accessories Stores","75","688","8328","72",
"Puerto Rico","2005","45112 ","Hobby, Toy, and Game Stores","86","850","11444","72",
"Puerto Rico","2005","45114 ","Musical Instrument and Supplies Stores","22","128","2247","72",
"Puerto Rico","2005","451120","Hobby, Toy, and Game Stores","86","850","11444","72",
"Puerto Rico","2005","45113 ","Sewing, Needlework, and Piece Goods Stores","96","450","4707","72",
"Puerto Rico","2005","451130","Sewing, Needlework, and Piece Goods Stores","96","450","4707","72",
"Puerto Rico","2005","452910","Warehouse Clubs and Supercenters","19","0","0","72",
"Puerto Rico","2005","453920","Art Dealers","40","159","2319","72",
"Puerto Rico","2005","45299 ","All Other General Merchandise Stores","212","0","0","72",
"Puerto Rico","2005","452990","All Other General Merchandise Stores","212","0","0","72",
"Puerto Rico","2005","453   ","Miscellaneous Store Retailers","674","4272","53169","72",
"Puerto Rico","2005","454   ","Nonstore Retailers","214","1353","24683","72",
"Puerto Rico","2005","45399 ","All Other Miscellaneous Store Retailers","102","1053","9580","72",
"Puerto Rico","2005","453991","Tobacco Stores","13","56","696","72",
"Puerto Rico","2005","453998","All Other Miscellaneous Store Retailers (except Tobacco Stores)","89","997","8884","72",
"Puerto Rico","2005","481112","Scheduled Freight Air Transportation","13","132","4133","72",
"Puerto Rico","2005","484122","General Freight Trucking, Long-Distance, Less Than Truckload","3","8","368","72",
"Puerto Rico","2005","4812  ","Nonscheduled Air Transportation","11","57","972","72",
"Puerto Rico","2005","48121 ","Nonscheduled Air Transportation","11","57","972","72",
"Puerto Rico","2005","481211","Nonscheduled Chartered Passenger Air Transportation","8","0","0","72",
"Puerto Rico","2005","4842  ","Specialized Freight Trucking","124","825","14449","72",
"Puerto Rico","2005","48541 ","School and Employee Bus Transportation","113","640","5902","72",
"Puerto Rico","2005","48421 ","Used Household and Office Goods Moving","20","262","4798","72",
"Puerto Rico","2005","484210","Used Household and Office Goods Moving","20","262","4798","72",
"Puerto Rico","2005","48422 ","Specialized Freight (except Used Goods) Trucking, Local","92","541","9225","72",
"Puerto Rico","2005","485410","School and Employee Bus Transportation","113","640","5902","72",
"Puerto Rico","2005","541890","Other Services Related to Advertising","43","428","7933","72",
"Puerto Rico","2005","4855  ","Charter Bus Industry","1","0","0","72",
"Puerto Rico","2005","48551 ","Charter Bus Industry","1","0","0","72",
"Puerto Rico","2005","485510","Charter Bus Industry","1","0","0","72",
"Puerto Rico","2005","541860","Direct Mail Advertising","3","14","237","72",
"Puerto Rico","2005","54187 ","Advertising Material Distribution Services","9","42","657","72",
"Puerto Rico","2005","541870","Advertising Material Distribution Services","9","42","657","72",
"Puerto Rico","2005","54189 ","Other Services Related to Advertising","43","428","7933","72",
"Puerto Rico","2005","56172 ","Janitorial Services","170","7758","70179","72",
"Puerto Rico","2005","561720","Janitorial Services","170","7758","70179","72",
"Puerto Rico","2005","62111 ","Offices of Physicians","3192","10001","198638","72",
"Puerto Rico","2005","56173 ","Landscaping Services","125","2067","24598","72",
"Puerto Rico","2005","561730","Landscaping Services","125","2067","24598","72",
"Puerto Rico","2005","56174 ","Carpet and Upholstery Cleaning Services","14","1310","9181","72",
"Puerto Rico","2005","621111","Offices of Physicians (except Mental Health Specialists)","3056","9603","191916","72",
"Puerto Rico","2005","624120","Services for the Elderly and Persons with Disabilities","87","3590","24967","72",
"Puerto Rico","2005","621112","Offices of Physicians, Mental Health Specialists","136","398","6722","72",
"Puerto Rico","2005","6212  ","Offices of Dentists","989","3496","47328","72",
